"ID","Title","Link","Company","Location","Remote","Experience","EmploymentType","DatePosted","Section_0","Section_1","Section_10","Section_12","Section_13","Section_15","Section_16","Section_17","Section_19","Section_2","Section_20","Section_22","Section_23","Section_25","Section_26","Section_28","Section_30","Section_31","Section_33","Section_35","Section_36","Section_37","Section_39","Section_40","Section_42","Section_44","Section_5","Section_6","Section_7","Section_9","Section_11","Section_14","Section_18","Section_21","Section_24","Section_27","Section_29","Section_32","Section_34","Section_4","Section_41","Section_8","Section_38","Section_43","Section_45","Section_47","Section_46"
1870104,"Sr. Program Manager, Enterprise Programs","https://job-boards.greenhouse.io/pitchbookdata/jobs/4414953006","PitchBook","Seattle","No","7","Full time","2025-02-05T18:12:50.726672Z","At PitchBook, we are always looking forward. We continue to innovate, evolve, and invest in ourselves to bring out the best in everyone. Were deeply collaborative and thrive on the excitement, energy, and fun that reverberates throughout the company.","Our extensive learning programs and mentorship opportunities help us create a culture of curiosity that pushes us to always find new solutions and better ways of doing things. The combination of a rapidly evolving industry and our high ambitions means theres going to be some ambiguity along the way, but we excel when we challenge ourselves. Were willing to take risks, fail fast, and do it all over again in the pursuit of excellence.","Be the Program Manager of key initiatives in the PMOs portfolio, responsible for leading the discovery, planning, scoping, and implementation of these initiatives
Work closely with key stakeholders, program and project sponsors, and cross-functional teams to plan, scope, and identify deliverables and required resources and timing for new initiatives
Build a robust and achievable project plan drive forecastingestimation techniques to arrive at this plan hold the team accountable to meeting key committed deliverables
Define clear goals, prioritize the right work, and use data to drive crisp decisions in partnership with stakeholders
Ensure that requirements are established for the initiative
Proactively identify and resolve risks, issues, and conflicts affecting goal achievement, escalating when needed for resolution
Manage cross-team dependencies, align roadmaps, and unblock teams. Support planning activities that identify dependencies
Keep the team, sponsor, and relevant stakeholders informed on progress to goal
Provide accurate and timely reporting of program status throughout its life cycle using tools recommended by the PMO to organize, track, and manage programs
Implement structure, order, and clarity to ambiguous problems with little direction or oversight
Implement and adapt established program execution best practices recommended by the PMO
Support the vision and values of the company through role modeling and encouraging desired behaviors
Participate in various company initiatives and projects as requested","Skills and Qualifications","Bachelors degree
7 years of professional work experience with 3 years of project or program management
Experience program managing cross-functional programs for an organization with a strong understanding of program management fundamentals
Program management experience leading cross functional implementations related to financial products  revenue operations from start to finish
Operate with a strong sense of urgency and deliver results
Be data and metrics driven and use metrics and provide data for decision making
Able to effectively manage ambiguity and competing priorities and help teams prioritize and focus
Self-motivated and goal-oriented attitude and can work effectively as an individual or as part of a team
Exemplary verbal and written communication skills and comfortable to engage a diverse array of audiences
Able to work across multiple teams and stakeholders at all levels of seniority, build strong trusted relationships, and lead through influence
Able to problem solve and use judgment to make decisions within ambiguous situations
Hands on knowledge of a project management tool preferred
Able to effectively communicate with local and international teams in a multicultural setting both in-person, in writing, and via Zoom video calls","Benefits  Compensation at PitchBook","Physical Health","Comprehensive health benefits
Additional medical wellness incentives 
STD, LTD, ADD, and life insurance","Emotional Health","If you have a good attitude and are willing to roll up your sleeves to get things done, PitchBook is the place for you.","Paid sabbatical program after four years
Paid family and paternity leave 
Annual educational stipend
Ability to apply for tuition reimbursement
CFA exam stipend 
Robust training programs on industry and soft skills 
Employee assistance program
Generous allotment of vacation days, sick days, and volunteer days","Social Health","Matching gifts program
Employee resource groups
Subsidized emergency childcare  
Dependent Care FSA
Company-wide events
Employee referral bonus program  
Quarterly team building events","Financial Health","401k match
Shared ownership employee stock program 
Monthly transportation stipend","Please be aware the above PitchBook benefit and perk offerings are subject to corresponding plan and policy documents and may change during the course of your employment.","Compensation","Annual base salary 155,000-165,000
Target annual bonus percentage 10%","Starting pay will be based on several factors and commensurate with qualifications  experience. We also have a location-based compensation structure there may be different ranges for candidates by location.","Working Conditions","We believe our business and our culture are strongest when we work together in person. We also know that its helpful to have some flexibility to work remotely. Most roles work in the office 3 daysweek, and some are expected to work in the office 4-5 daysweek. The current expectation for this role is that you are working in the office 4 daysweek and that you are in the office full-time during the training period, for which the length varies by role. During an initial phone screen, the team will discuss expectations for this specific position.","The job conditions for this position are in a standard office setting. Employees in this position use PC and phone on an on-going basis throughout the day. Limited corporate travel may be required to remote offices or other business meetings and events.","Life At PB","We are consistently recognized as a Best Place to Work and our culture is at the heart of our success. Its our fundamental belief that people do and create great things and that people are the cornerstone of prosperity. We believe that proactively seeking out different points of view, listening to others, learning, and reflecting on what weve heard creates a sense of belonging within PitchBook and strengthens the PitchBook community.","We are excited to get to know you and your background. Concerned that you might not meet every requirement? We encourage you to still apply as you might be the right candidate for the role or other roles at PitchBook.","LI-EO1","About the Role","The Program Management Office (PMO) ensures the successful execution of key cross functional initiatives of the company through effective program management. PMO Program Managers drive cross functional initiatives that are top priority for PitchBook. The Program Management Office also helps scale execution at PitchBook by establishing guidelines and best practices for program management in the company through a Center of Excellence model establishing a program management community within PitchBook that allows program managers across the company to collaborate, learn, and share execution best practices providing visibility into overall performance of strategic initiatives and orchestrating strategic planning processes of the company.","PitchBooks Sr. Program Manager, Enterprise Programs drives strategic cross functional initiatives for the company. This role ensures that cross functional teams are driving towards defined program milestones and deliverables, removing bottlenecks, escalating risksissues as needed, providing visibility to progress and overall ensuring effective collaboration across teams. The PitchBook strategic planning process typically defines the various initiatives that this role will lead. In the near term, this role is likely to lead programs that involve working cross functionally within PitchBook and Morningstar to develop new capabilities as well as critical internal projects that support Sales, Customer Service, and Revenue Operations.","Primary Job Responsibilities",,,,,,,,,,,,,,,,,
2372474,"Account Development Manager","https://job-boards.greenhouse.io/pitchbookdata/jobs/4437854006","PitchBook","San Francisco","No","2","Full time","2025-02-05T18:12:50.726757Z","At PitchBook, we are always looking forward. We continue to innovate, evolve, and invest in ourselves to bring out the best in everyone. Were deeply collaborative and thrive on the excitement, energy, and fun that reverberates throughout the company.","Our extensive learning programs and mentorship opportunities help us create a culture of curiosity that pushes us to always find new solutions and better ways of doing things. The combination of a rapidly evolving industry and our high ambitions means theres going to be some ambiguity along the way, but we excel when we challenge ourselves. Were willing to take risks, fail fast, and do it all over again in the pursuit of excellence.",,"Bachelors degree
2 years of sales or account management experience
Proven ability to close complex deals with relevant stakeholders and oversee the end-to-end sales process
Prior experience with Catalyst, Salesforce, or similar CRM to forecast sales and maintain updated records of client interactions
Excellent verbal and written communication skills with a keen eye for detail
Exemplary presentation skills and comfortable engaging with a diverse array of clients
Interest in the private equity and venture capital marketplace preferred
Curious, able, and interested to learn about client needs
Organized with terrific prioritization skills
Self-motivated, persistent, and goal-oriented attitude and can work effectively as part of a team
Possess strong negotiation skills, persistence, and resiliency
Proficiency with the Microsoft Office suite including in-depth knowledge of Outlook, Word, and Excel with the ability to pick up new systems and software easily",,"Physical Health","Comprehensive health benefits
Additional medical wellness incentives 
STD, LTD, ADD, and life insurance",,"Paid sabbatical program after four years
Paid family and paternity leave 
Annual educational stipend
Ability to apply for tuition reimbursement
CFA exam stipend 
Robust training programs on industry and soft skills 
Employee assistance program
Generous allotment of vacation days, sick days, and volunteer days","If you have a good attitude and are willing to roll up your sleeves to get things done, PitchBook is the place for you.",,"Matching gifts program
Employee resource groups
Subsidized emergency childcare  
Dependent Care FSA
Company-wide events
Employee referral bonus program  
Quarterly team building events",,"401k match
Shared ownership employee stock program 
Monthly transportation stipend",,,"Annual base salary 95,000
Annual on target variable commission of fully ramped representative meeting expectations 72,000
PitchBook currently has no cap on commission and commission is determined by individual performance",,"We believe our business and our culture are strongest when we work together in person. We also know that its helpful to have some flexibility to work remotely. Most roles work in the office 3 daysweek, and some are expected to work in the office 4-5 daysweek. The current expectation for this role is that you are working in the office 3 daysweek and that you are in the office full-time during the training period, for which the length varies by role. During an initial phone screen, the team will discuss expectations for this specific position.",,"Life At PB","We are consistently recognized as a Best Place to Work and our culture is at the heart of our success. Its our fundamental belief that people do and create great things and that people are the cornerstone of prosperity. We believe that proactively seeking out different points of view, listening to others, learning, and reflecting on what weve heard creates a sense of belonging within PitchBook and strengthens the PitchBook community.","We are excited to get to know you and your background. Concerned that you might not meet every requirement? We encourage you to still apply as you might be the right candidate for the role or other roles at PitchBook.",,,,"As a member of our Account Management  Customer Success team, you will thrive on your ability to embrace and drive change and your commitment to ensuring you and PitchBook are always growing and improving. While continually learning and exploring new ideas and concepts, you will be inspired to ask questions and challenge the status quo while remaining focused on our customers success. We value teamwork and collaboration and encourage our people to build strong, trusting relationships with their teammates, customers, and partners. A contagious positivity, insatiable curiosity, and people-first attitude are the winning traits of our most successful Account Management  Customer Success team members. If this sounds like you, join us!","The Account Development Manager (ADM) plays a vital role in driving growth by deepening relationships with existing clients and re-engaging lapsed accounts. This individual will focus on identifying and managing a pipeline of opportunities within our current client base to expand our footprint within the organization. Additionally, they will develop targeted strategies to win back past clients, leveraging a consultative approach and industry expertise to build trust and loyalty.",,"Achieve sales goals measured quarterly while providing an excellent experience to your prospects
Act as the point of contact and business partner for a dedicated portfolio of PitchBooks clients and prospects via in-person meetings, phone, andor email
Identify growth opportunities to expand existing user base within portfolio of accounts to achieve and consistently exceed sales and retention goals
Develop and own the long-term strategy define growth goals and execution plans to increase engagement and footprint with clients over a multi-year time horizon
Conduct client demonstration sessions designed to highlight how the PitchBook platform addresses the needs of the account and individual end users with a consultative approach
Work collaboratively with designated Account Managers and Customer Success Associates to strategize on account growth opportunities
Efficiently and thoroughly manage your pipeline and oversee the end-to-end sales cycle
Use Catalyst and Salesforce to effectively manage client relationships through client interactions, account mapping, pipeline, and task management
Drive engagement with prospective clients through personally crafted sequences andor marketing provided materials via Highspot
Use Gong regularly to review client calls, provide product feedback, and self-evaluate
Effectively prospect new accounts as needed, creatively leveraging various channels including events, Salesforce, LinkedIn Navigator, and others
Adhere to Salesforce best practices and understands the importance of data hygiene and pipeline management
Support the vision and values of the company through role modeling and encouraging desired behaviors
Participate in various company initiatives and projects as requested","Skills and Qualifications","Benefits  Compensation at PitchBook","Emotional Health","Social Health","Financial Health","Please be aware the above PitchBook benefit and perk offerings are subject to corresponding plan and policy documents and may change during the course of your employment.","Compensation","Working Conditions","The job conditions for this position are in a standard office setting. Employees in this position use PC and phone on an on-going basis throughout the day. Limited corporate travel may be required to remote offices or other business meetings and events.","About the Role","LI-EO1","Primary Job Responsibilities",,,,,
