"ID","Title","Link","Company","Location","Remote","Experience","EmploymentType","DatePosted","Section_0","Section_1","Section_10","Section_12","Section_13","Section_15","Section_16","Section_17","Section_19","Section_2","Section_20","Section_22","Section_23","Section_25","Section_26","Section_28","Section_30","Section_31","Section_33","Section_35","Section_36","Section_37","Section_39","Section_40","Section_42","Section_44","Section_5","Section_6","Section_7","Section_9","Section_11","Section_14","Section_18","Section_21","Section_24","Section_27","Section_29","Section_32","Section_34","Section_4","Section_41","Section_8","Section_38","Section_43","Section_45","Section_47","Section_46"
2346874,"Sr. Reporter, Leveraged Loans","https://job-boards.greenhouse.io/pitchbookdata/jobs/4437270006","PitchBook","New York","No","4","Full time","2025-02-05T18:12:50.727034Z","At PitchBook, we are always looking forward. We continue to innovate, evolve, and invest in ourselves to bring out the best in everyone. Were deeply collaborative and thrive on the excitement, energy, and fun that reverberates throughout the company.","Our extensive learning programs and mentorship opportunities help us create a culture of curiosity that pushes us to always find new solutions and better ways of doing things. The combination of a rapidly evolving industry and our high ambitions means theres going to be some ambiguity along the way, but we excel when we challenge ourselves. Were willing to take risks, fail fast, and do it all over again in the pursuit of excellence.","Primary Job Responsibilities",,"Skills and Qualifications",,"Benefits  Compensation at PitchBook","Physical Health",,"If you have a good attitude and are willing to roll up your sleeves to get things done, PitchBook is the place for you.","Emotional Health",,"Social Health",,"Financial Health",,,"Compensation",,,"Working Conditions","We believe our business and our culture are strongest when we work together in person. We also know that its helpful to have some flexibility to work remotely. Most roles work in the office 3 daysweek, and some are expected to work in the office 4-5 daysweek. The current expectation for this role is that you are working in the office 3 daysweek and that you are in the office full-time during the training period, for which the length varies by role. During an initial phone screen, the team will discuss expectations for this specific position.",,"Life At PB",,,"As a member of the Editorial team, you will spend each day immersed in the private markets, aiming to help our customers be better investors, advisors, and market participants. The work you will do plays a direct role in the evolution of the industry!","Everyone on our team is supported by a flexible work environment and a culture that promotes curiosity, collaboration, and professional development. We prioritize recognition and respect across all roles and have a high level of camaraderie. The fast-growing nature of our organization provides ample opportunity to advance in your career and explore what interests you.","As we continue investing in the talent of our group, our coverage has evolved rapidly over multiple industries and geographies. Our insights are routinely cited by top-tier publications and sought after by prominent players in the financial markets. In addition to publishing timely market insights, we also partner closely with our Product, Engineering, and Data Operations teams to continually enhance our datasets and develop unique tools that have a material impact on our customers workflows. There is no better time to join us!",,"Report on and write real-time news stories detailing US leveraged loan issuance, including specific transaction terms
Develop and maintain contacts within the leveraged loan space, specifically loan investors, arranging banks, traders, portfolio managers, and others 
Follow trends, market moves, industry developments, and the personalities behind deal activity 
Working with Managing Editor and LCD Research, provide context around new-issue launches and produce in-depth analytical pieces detailing trends in the leveraged loan and leveraged finance marketplace, relying on sources and interviews and LCD research 
Work with Data Operations, Analysts, and Designers on creating and maintaining data or news-related initiatives
Support the vision and values of the company through role modeling and encouraging desired behaviors
Participate in various company initiatives and projects as requested","Bachelor's degree 
4-8 years of experience covering financial markets, ideally with a background in leveraged finance, debt, or structured finance 
Contacts within the US leveraged loan market andor ability to develop market contacts
Ability to work with data in Excel, PowerPoint, etc. 
Excellent writing, editing, and interpersonal skills 
Ability to work effectively under real-time deadlines 
Ability to work effectively as part of highly productive team","Comprehensive health benefits
Additional medical wellness incentives 
STD, LTD, ADD, and life insurance","Paid sabbatical program after four years
Paid family and paternity leave 
Annual educational stipend
Ability to apply for tuition reimbursement
CFA exam stipend 
Robust training programs on industry and soft skills 
Employee assistance program
Generous allotment of vacation days, sick days, and volunteer days","Matching gifts program
Employee resource groups
Subsidized emergency childcare  
Dependent Care FSA
Company-wide events
Employee referral bonus program  
Quarterly team building events","401k match
Shared ownership employee stock program 
Monthly transportation stipend","Please be aware the above PitchBook benefit and perk offerings are subject to corresponding plan and policy documents and may change during the course of your employment.","Annual base salary 112,000-130,000
Target annual bonus percentage 10%","Starting pay will be based on several factors and commensurate with qualifications  experience. We also have a location-based compensation structure there may be different ranges for candidates by location.","About the Role","We are consistently recognized as a Best Place to Work and our culture is at the heart of our success. Its our fundamental belief that people do and create great things and that people are the cornerstone of prosperity. We believe that proactively seeking out different points of view, listening to others, learning, and reflecting on what weve heard creates a sense of belonging within PitchBook and strengthens the PitchBook community.","The Sr. Reporter, Leveraged Loans for PitchBooks Leveraged Commentary  Data (LCD) unit will report on issuance in the US broadly syndicated loan market, relying on a deep roster of contacts across the asset class that the reporter has or will develop. The Sr. Reporters output will be published on PitchBook LCDs real-time platform, as well as in its daily, weekly, monthly, and quarterly publications.","The job conditions for this position are in a standard office setting. Employees in this position use PC and phone on an on-going basis throughout the day. Limited corporate travel may be required to remote offices or other business meetings and events.","We are excited to get to know you and your background. Concerned that you might not meet every requirement? We encourage you to still apply as you might be the right candidate for the role or other roles at PitchBook.","LI-BA1",,
2336555,"Customer Success Associate","https://job-boards.greenhouse.io/pitchbookdata/jobs/4438217006","PitchBook","New York","No","1","Full time","2025-02-05T18:12:50.727054Z","At PitchBook, we are always looking forward. We continue to innovate, evolve, and invest in ourselves to bring out the best in everyone. Were deeply collaborative and thrive on the excitement, energy, and fun that reverberates throughout the company.","Our extensive learning programs and mentorship opportunities help us create a culture of curiosity that pushes us to always find new solutions and better ways of doing things. The combination of a rapidly evolving industry and our high ambitions means theres going to be some ambiguity along the way, but we excel when we challenge ourselves. Were willing to take risks, fail fast, and do it all over again in the pursuit of excellence.",,"Bachelors degree preferred
1 years of sales or business development experience
Client first attitude and love to engage prospective new users for account expansion
Prior experience with Salesforce or similar CRM preferred
Excellent verbal and written communication skills with a keen eye for detail
Interested in financial markets or services, particularly private equity and venture capital
Ability to operate with a strong sense of urgency and deliver results
Terrific prioritization skills to manage your sales pipeline
Comfortable to engage with a diverse array of clients
Tenacious and goal-oriented and can work effectively as part of a group
Team player with the desire to try new ideas in order to achieve greater levels of success
Proficiency with the Microsoft Office suite including in-depth knowledge of Outlook, Word, and Excel with the ability to pick up new systems and software easily",,"Physical Health","Comprehensive health benefits
Additional medical wellness incentives 
STD, LTD, ADD, and life insurance",,"Paid sabbatical program after four years
Paid family and paternity leave 
Annual educational stipend
Ability to apply for tuition reimbursement
CFA exam stipend 
Robust training programs on industry and soft skills 
Employee assistance program
Generous allotment of vacation days, sick days, and volunteer days","If you have a good attitude and are willing to roll up your sleeves to get things done, PitchBook is the place for you.",,"Matching gifts program
Employee resource groups 
Subsidized emergency childcare  
Dependent Care FSA 
Company-wide events 
Employee referral bonus program   
Quarterly team building events",,"401k match
Shared ownership employee stock program 
Monthly transportation stipend",,,"Annual base salary 70,000
Annual on target variable commission of fully ramped representative meeting expectations 25,000
PitchBook currently has no cap on commission and commission is determined by individual performance",,"We believe our business and our culture are strongest when we work together in person. We also know that its helpful to have some flexibility to work remotely. Most roles work in the office 3 daysweek, and some are expected to work in the office 4-5 daysweek. The current expectation for this role is that you are working in the office 4 daysweek and that you are in the office full-time during the training period, for which the length varies by role. During an initial phone screen, the team will discuss expectations for this specific position.",,"Life at PB","We are consistently recognized as a Best Place to Work and our culture is at the heart of our success. Its our fundamental belief that people do and create great things and that people are the cornerstone of prosperity. We believe that proactively seeking out different points of view, listening to others, learning, and reflecting on what weve heard creates a sense of belonging within PitchBook and strengthens the PitchBook community.","We are excited to get to know you and your background. Concerned that you might not meet every requirement? We encourage you to still apply as you might be the right candidate for the role or other roles at PitchBook.",,,,"As a member of our Account Management  Customer Success team, you will thrive on your ability to embrace and drive change and your commitment to ensuring you and PitchBook are always growing and improving. While continually learning and exploring new ideas and concepts, you will be inspired to ask questions and challenge the status quo while remaining focused on our customers success. We value teamwork and collaboration and encourage our people to build strong, trusting relationships with their teammates, customers, and partners. A contagious positivity, insatiable curiosity, and people-first attitude are the winning traits of our most successful Account Management  Customer Success team members. If this sounds like you, join us!","Account Associates work on accounts that are of strategic importance to PitchBook and will work with a team to complete account expansion related activities. The Customer Success Associate will develop a deep knowledge of the accounts they support, their clients industrysector as well as their business needs, partnering with their Account Manager to grow these accounts over time.",,"Achieve demo volume goals measured at a monthly cadence while providing an excellent experience for target customers
Act as a consultant and display a positive and empathetic attitude - taking the time to understand your clients needs and business priorities in order to present relevant use cases
Work closely with Account Managers to build pipeline, routing qualified opportunities to the appropriate Account Manager for further development
Manage your inbound pipeline efficiently and work to recognize growth opportunities and enable new business within existing accounts
Work with a strong sense of urgency to meet and exceed daily and monthly KPIs, which translates into high daily activity
Work continuously to document the details of each potential client interaction in Salesforce in order to improve the customer experience and drive deal closure
Drive engagement with clients through personally crafted sequences andor marketing provided materials via Highspot
Effectively prospect new accounts as needed, creatively leveraging LinkedIn Sales Navigator
Research accounts to identify key decision makers and collaborate effectively with them
Connect with prospects through written and verbal communication in order to book demos, generate interest, and gain commitment
Utilize Outreach to assist in regular and timely communication
Use Gong regularly to review client interactions with Account Managers
Develop expertise about the PitchBook Platform, our clients, and their business needs
Support the vision and values of the company through role modeling and encouraging desired behaviors
Participate in various company initiatives and projects as requested","Skills and Qualifications","Benefits at PitchBook","Emotional Health","Social Health","Financial Health","Please be aware the above PitchBook benefit and perk offerings are subject to corresponding plan and policy documents and may change during the course of your employment.","Compensation","Working Conditions","The job conditions for this position are in a standard office setting. Employees in this position use PC and phone on an on-going basis throughout the day. Limited corporate travel may be required to remote offices or other business meetings and events.","About the Role","LI-VH1","Primary Job Responsibilities",,,,,
2336552,"Account Associate","https://job-boards.greenhouse.io/pitchbookdata/jobs/4439171006","PitchBook","New York","No","1","Full time","2025-02-05T18:12:50.729128Z","At PitchBook, we are always looking forward. We continue to innovate, evolve, and invest in ourselves to bring out the best in everyone. Were deeply collaborative and thrive on the excitement, energy, and fun that reverberates throughout the company.","Our extensive learning programs and mentorship opportunities help us create a culture of curiosity that pushes us to always find new solutions and better ways of doing things. The combination of a rapidly evolving industry and our high ambitions means theres going to be some ambiguity along the way, but we excel when we challenge ourselves. Were willing to take risks, fail fast, and do it all over again in the pursuit of excellence.",,"Bachelors degree preferred
1 years of sales or business development experience
Client first attitude and love to engage prospective new users for account expansion
Prior experience with Salesforce or similar CRM preferred
Excellent verbal and written communication skills with a keen eye for detail
Interested in financial markets or services, particularly private equity and venture capital
Ability to operate with a strong sense of urgency and deliver results
Terrific prioritization skills to manage your sales pipeline
Comfortable to engage with a diverse array of clients
Tenacious and goal-oriented and can work effectively as part of a group
Team player with the desire to try new ideas in order to achieve greater levels of success
Proficiency with the Microsoft Office suite including in-depth knowledge of Outlook, Word, and Excel with the ability to pick up new systems and software easily",,"Physical Health","Comprehensive health benefits
Additional medical wellness incentives 
STD, LTD, ADD, and life insurance",,"Paid sabbatical program after four years
Paid family and paternity leave 
Annual educational stipend
Ability to apply for tuition reimbursement
CFA exam stipend 
Robust training programs on industry and soft skills 
Employee assistance program
Generous allotment of vacation days, sick days, and volunteer days","If you have a good attitude and are willing to roll up your sleeves to get things done, PitchBook is the place for you.",,"Matching gifts program
Employee resource groups 
Subsidized emergency childcare  
Dependent Care FSA 
Company-wide events 
Employee referral bonus program   
Quarterly team building events",,"401k match
Shared ownership employee stock program 
Monthly transportation stipend",,,"Annual base salary 70,000
Annual on target variable commission of fully ramped representative meeting expectations 25,000
PitchBook currently has no cap on commission and commission is determined by individual performance",,"We believe our business and our culture are strongest when we work together in person. We also know that its helpful to have some flexibility to work remotely. Most roles work in the office 3 daysweek, and some are expected to work in the office 4-5 daysweek. The current expectation for this role is that you are working in the office 4 daysweek and that you are in the office full-time during the training period, for which the length varies by role. During an initial phone screen, the team will discuss expectations for this specific position.",,"Life at PB","We are consistently recognized as a Best Place to Work and our culture is at the heart of our success. Its our fundamental belief that people do and create great things and that people are the cornerstone of prosperity. We believe that proactively seeking out different points of view, listening to others, learning, and reflecting on what weve heard creates a sense of belonging within PitchBook and strengthens the PitchBook community.","We are excited to get to know you and your background. Concerned that you might not meet every requirement? We encourage you to still apply as you might be the right candidate for the role or other roles at PitchBook.",,,,"As a member of our Account Management  Customer Success team, you will thrive on your ability to embrace and drive change and your commitment to ensuring you and PitchBook are always growing and improving. While continually learning and exploring new ideas and concepts, you will be inspired to ask questions and challenge the status quo while remaining focused on our customers success. We value teamwork and collaboration and encourage our people to build strong, trusting relationships with their teammates, customers, and partners. A contagious positivity, insatiable curiosity, and people-first attitude are the winning traits of our most successful Account Management  Customer Success team members. If this sounds like you, join us!","Account Associates work on accounts that are of strategic importance to PitchBook and will work with a team to complete account expansion related activities. The Customer Success Associate will develop a deep knowledge of the accounts they support, their clients industrysector as well as their business needs, partnering with their Account Manager to grow these accounts over time.",,"Achieve demo volume goals measured at a monthly cadence while providing an excellent experience for target customers
Act as a consultant and display a positive and empathetic attitude - taking the time to understand your clients needs and business priorities in order to present relevant use cases
Work closely with Account Managers to build pipeline, routing qualified opportunities to the appropriate Account Manager for further development
Manage your inbound pipeline efficiently and work to recognize growth opportunities and enable new business within existing accounts
Work with a strong sense of urgency to meet and exceed daily and monthly KPIs, which translates into high daily activity
Work continuously to document the details of each potential client interaction in Salesforce in order to improve the customer experience and drive deal closure
Drive engagement with clients through personally crafted sequences andor marketing provided materials via Highspot
Effectively prospect new accounts as needed, creatively leveraging LinkedIn Sales Navigator
Research accounts to identify key decision makers and collaborate effectively with them
Connect with prospects through written and verbal communication in order to book demos, generate interest, and gain commitment
Utilize Outreach to assist in regular and timely communication
Use Gong regularly to review client interactions with Account Managers
Develop expertise about the PitchBook Platform, our clients, and their business needs
Support the vision and values of the company through role modeling and encouraging desired behaviors
Participate in various company initiatives and projects as requested","Skills and Qualifications","Benefits at PitchBook","Emotional Health","Social Health","Financial Health","Please be aware the above PitchBook benefit and perk offerings are subject to corresponding plan and policy documents and may change during the course of your employment.","Compensation","Working Conditions","The job conditions for this position are in a standard office setting. Employees in this position use PC and phone on an on-going basis throughout the day. Limited corporate travel may be required to remote offices or other business meetings and events.","About the Role","LI-VH1","Primary Job Responsibilities",,,,,
