"ID","Title","Link","Company","Location","Remote","Experience","EmploymentType","DatePosted","Section_0","Section_1","Section_10","Section_12","Section_13","Section_15","Section_16","Section_17","Section_19","Section_2","Section_20","Section_22","Section_23","Section_25","Section_26","Section_28","Section_30","Section_31","Section_33","Section_35","Section_36","Section_37","Section_39","Section_40","Section_42","Section_44","Section_5","Section_6","Section_7","Section_9","Section_11","Section_14","Section_18","Section_21","Section_24","Section_27","Section_29","Section_32","Section_34","Section_4","Section_41","Section_8","Section_38","Section_43","Section_45","Section_47","Section_46"
2299850,"Sr. Analyst, AI","https://job-boards.greenhouse.io/pitchbookdata/jobs/4425222006","PitchBook","San Francisco","No","Not specified","Full time","2025-02-05T18:12:50.729424Z","At PitchBook, we are always looking forward. We continue to innovate, evolve, and invest in ourselves to bring out the best in everyone. Were deeply collaborative and thrive on the excitement, energy, and fun that reverberates throughout the company.","Our extensive learning programs and mentorship opportunities help us create a culture of curiosity that pushes us to always find new solutions and better ways of doing things. The combination of a rapidly evolving industry and our high ambitions means theres going to be some ambiguity along the way, but we excel when we challenge ourselves. Were willing to take risks, fail fast, and do it all over again in the pursuit of excellence.",,"Analyze private market technology trends through the lens of venture capital deal-making, focusing on AI and Information Security ecosystems
Conduct in-depth market research, covering key trends, market sizes, growth drivers, risks, and disruption potential
Publish quarterly updates and research notes leveraging PitchBooks proprietary data on venture capital activity, valuations, and market trends
Build and maintain datasets of companies, investors, and funds, including taxonomy development to aid client tracking and analysis
Attend industry conferences and engage with professionals to deepen understanding of trends and expand your network
Engage with clients through meetings, webinars, and events to support sales, enhance client understanding, and drive strategic alignment
Streamline research processes to scale with growing client demand and improve efficiency across the team
Identify opportunities for new research and insights that utilize PitchBooks data to highlight trends in AI and Information Security
Develop innovative research offerings, including leveraging proprietary data and forming partnerships with other data vendors
Represent PitchBook Research externally (e.g., conferences, webinars) and internally (collaborating across teams like sales, marketing, and product development)
Align healthcare coverage with corporate objectives and organizational strategies to ensure relevance and value
Support the vision and values of the company through role modeling and encouraging desired behaviors 
Participate in various company initiatives and projects as requested",,"Bachelors degree in Finance, Economics, or Computer Science preferred
3 years of experience in equity research, investment banking, venture capital, or a related financial services role
Strong grasp of financial concepts, including valuation techniques (DCF, comparables, etc.), IRRs, asset allocation, fund benchmarks, and KPIs
Proven ability to contribute to the development of new products and services tailored to a growing customer base in an emerging industry
Comprehensive knowledge of the Artificial Intelligence and Information Security industries, including their ecosystems of service providers, technologies, and capital markets
Demonstrated expertise in writing investment research and engaging with clients on investment opportunities, preferably in the technolgoy sector
Passion for and deep understanding of venture capital, growth equity, and emerging technologies
Meticulous attention to detail with a strong analytical mindset
Excellent verbal and written communication and presentation skills
Advanced proficiency in Excel experience with the PitchBook Platform is a plus
Proficiency with the Microsoft Office suite including in-depth knowledge of Outlook, Word, and Excel with the ability to pick up new systems and software easily",,"Benefits  Compensation at PitchBook","Comprehensive health benefits
Additional medical wellness incentives 
STD, LTD, ADD, and life insurance","If you have a good attitude and are willing to roll up your sleeves to get things done, PitchBook is the place for you.",,"Paid sabbatical program after four years
Paid family and paternity leave 
Annual educational stipend
Ability to apply for tuition reimbursement
CFA exam stipend 
Robust training programs on industry and soft skills 
Employee assistance program
Generous allotment of vacation days, sick days, and volunteer days",,"Matching gifts program
Employee resource groups
Subsidized emergency childcare  
Dependent Care FSA
Company-wide events
Employee referral bonus program  
Quarterly team building events",,"401k match
Shared ownership employee stock program 
Monthly transportation stipend","Please be aware the above PitchBook benefit and perk offerings are subject to corresponding plan and policy documents and may change during the course of your employment.",,"Annual base salary 150,000-170,000
Target annual bonus percentage 10%","Starting pay will be based on several factors and commensurate with qualifications  experience. We also have a location-based compensation structure there may be different ranges for candidates by location.",,"Working Conditions","The job conditions for this position are in a standard office setting. Employees in this position use PC and phone on an on-going basis throughout the day. Limited corporate travel may be required to remote offices or other business meetings and events.",,"We are consistently recognized as a Best Place to Work and our culture is at the heart of our success. Its our fundamental belief that people do and create great things and that people are the cornerstone of prosperity. We believe that proactively seeking out different points of view, listening to others, learning, and reflecting on what weve heard creates a sense of belonging within PitchBook and strengthens the PitchBook community.","We are excited to get to know you and your background. Concerned that you might not meet every requirement? We encourage you to still apply as you might be the right candidate for the role or other roles at PitchBook.","About the Role","As a member of the Editorial team, you will spend each day immersed in the private markets, aiming to help our customers be better investors, advisors, and market participants. The work you will do plays a direct role in the evolution of the industry!","Everyone on our team is supported by a flexible work environment and a culture that promotes curiosity, collaboration, and professional development. We prioritize recognition and respect across all roles and have a high level of camaraderie. The fast-growing nature of our organization provides ample opportunity to advance in your career and explore what interests you.","Our Emerging Technology Research Group is looking for an experienced analyst to lead our coverage of Artificial Intelligence and Information Security. As a valued team member, youll hone your existing analytical skills, develop meaningful insights into a fascinating industry, and contribute to our best-in-class technology research. The research this team produces is utilized by many of the largest private capital investors, corporations investment banks, and service providers globally. Our team is creative, driven, and focused on providing the most insightful and actionable research to our readers and clients.","Primary Job Responsibilities","Skills and Qualifications","Physical Health","Emotional Health","Social Health","Financial Health",,"Compensation",,,"Life At PB","As we continue investing in the talent of our group, our coverage has evolved rapidly over multiple industries and geographies. Our insights are routinely cited by top-tier publications and sought after by prominent players in the financial markets. In addition to publishing timely market insights, we also partner closely with our Product, Engineering, and Data Operations teams to continually enhance our datasets and develop unique tools that have a material impact on our customers workflows. There is no better time to join us!","We believe our business and our culture are strongest when we work together in person. We also know that its helpful to have some flexibility to work remotely. Most roles work in the office 3 daysweek, and some are expected to work in the office 4-5 daysweek. The current expectation for this role is that you are working in the office 3 daysweek and that you are in the office full-time during the training period, for which the length varies by role. During an initial phone screen, the team will discuss expectations for this specific position.",,,,"LI-BA1"
2299848,"Sales Development Representative","https://job-boards.greenhouse.io/pitchbookdata/jobs/4434713006","PitchBook","London, England, United Kingdom","No","1","Internship","2025-02-05T18:12:50.729450Z","At PitchBook, we are always looking forward. We continue to innovate, evolve, and invest in ourselves to bring out the best in everyone. Were deeply collaborative and thrive on the excitement, energy, and fun that reverberates throughout the company.","Our extensive learning programs and mentorship opportunities help us create a culture of curiosity that pushes us to always find new solutions and better ways of doing things. The combination of a rapidly evolving industry and our high ambitions means theres going to be some ambiguity along the way, but we excel when we challenge ourselves. Were willing to take risks, fail fast, and do it all over again in the pursuit of excellence.","Achieve daily, weekly, and monthly outreach goals including demo and call volume while providing an excellent experience for prospective clients
Connect with your primary inbound prospect pipeline through written and verbal communication to book demos that show off the PitchBook product offering and drive deal closure
Prospect leads provided by Marketing and search for key points of contact by using the PitchBook Platform
Drive engagement with prospects through personally crafted sequences andor marketing provided materials via Highspot
Utilize Outreach to assist in regular and timely communication with potential clients
Document details of each prospective client interaction in Salesforce to improve the customer experience and drive deal closure
Act as a consultant to prospects by seeking to understand their needs and business priorities
Guide potential clients through needs analysis and discovery sessions to qualify the lead and drive new opportunities
Work closely with Outside Sales to learn about the need of our clients and the end-to-end sales cycle
Consistently follow-up on prospective client inquiries
Support the vision and values of the company through role modelling and encouraging desired behaviours
Participate in various company initiatives and projects as requested","Skills and Qualifications","Bachelors degree preferred
Prior internship experience or 1 year of work experience, ideally in finance or sales
Prior experience with Salesforce or similar CRM preferred
Love to prospect  you will act as the engine of our Sales team by warming up leads to be shared with Outside Sales
Ability to operate with a strong sense of urgency and deliver results
Demonstrate curiosity with a positive attitude
Demonstrate prioritisation skills to handle the large volume of leads efficiently
Excellent verbal and written communication skills
Possess strong negotiation skills and can effectively close leads
Team player with entrepreneurial spirit and the desire to try new ideas in order to achieve greater levels of success
Self-motivated, persistent and goal-oriented attitude and can work effectively as an individual or as part of a team
Interested in financial markets or services, particularly private equity and venture capital
Proficiency with the Microsoft Office suite including in-depth knowledge of Outlook, Word, and Excel with the ability to pick up new systems and software easily","Benefits at PitchBook","Physical Health           
Private medical insurance
Dental scheme
Additional medical wellness incentives 
Life cover
Emotional Health 
 

Paid sabbatical program after four years
Paid parental leave 
Education subsidies
Robust training programs on industry and soft skills 
Minimum 25 days annual leave and volunteer days",,"Social Health","If you have a good attitude and are willing to roll up your sleeves to get things done, PitchBook is the place for you.","Employee resource groups
Company-wide events
Employee referral bonus program  
Quarterly team building events","Financial Health","8% Pension contribution
Income protection
Shared ownership employee stock program 
Transportation stipend","Please be aware the above PitchBook benefit and perk offerings are subject to corresponding plan and policy documents and may change during the course of your employment.",,"We believe our business and our culture are strongest when we work together in person. We also know that its helpful to have some flexibility to work remotely. Most roles work in the office 3 daysweek, and some are expected to work in the office 4-5 daysweek. The current expectation for this role is that you are working in the office 5 daysweek and that you are in the office full-time during the training period, for which the length varies by role. During an initial phone screen, the team will discuss expectations for this specific position.",,"Life At PB",,,"LI-VH1",,,,,,"As a member of our Sales team, your commitment to excellence and passion for helping people succeed are the foundations for your career growth at PitchBook! With our customers success comes our success, and we are dedicated to providing them with the highest level of service and expertise.","At the core of our business is our commitment to understanding our clients' needs, challenges, and opportunities. As a member of our team, you'll be at the forefront of emerging trends and technologies by working closely with clients to position our products and services in a way that helps them achieve their goals. You will enjoy access to extensive training and development opportunities, including ongoing coaching and mentorship from experienced sales professionals. We are committed to helping you achieve your personal and professional goals, and we cant wait for you to join the team!","Sales Development Representatives (SDRs) work diligently to engage incoming leads and prospect potential new business. Sales Development Representatives contribute to the delivery of our overall sales goals by engaging warm leads through consistent call and email outreach to book product demos. They will also improve prospect information stored in PitchBooks CRM through consistent documentation of all prospect or client interactions.","Primary Job Responsibilities",,,,,,"Working Conditions","The job conditions for this position are in a standard office setting. Employees in this position use PC and phone on an on-going basis throughout the day. Limited corporate travel may be required to remote offices or other business meetings and events.","We are consistently recognized as a Best Place to Work and our culture is at the heart of our success. Its our fundamental belief that people do and create great things and that people are the cornerstone of prosperity. We believe that proactively seeking out different points of view, listening to others, learning, and reflecting on what weve heard creates a sense of belonging within PitchBook and strengthens the PitchBook community.","We are excited to get to know you and your background. Concerned that you might not meet every requirement? We encourage you to still apply as you might be the right candidate for the role or other roles at PitchBook.","About the Role",,,,,,,
2211061,"Customer Support Specialist","https://job-boards.greenhouse.io/pitchbookdata/jobs/4431683006","PitchBook","London, England, United Kingdom","No","1","Full time","2025-02-05T18:12:50.729469Z","At PitchBook, we are always looking forward. We continue to innovate, evolve, and invest in ourselves to bring out the best in everyone. Were deeply collaborative and thrive on the excitement, energy, and fun that reverberates throughout the company.","Our extensive learning programs and mentorship opportunities help us create a culture of curiosity that pushes us to always find new solutions and better ways of doing things. The combination of a rapidly evolving industry and our high ambitions means theres going to be some ambiguity along the way, but we excel when we challenge ourselves. Were willing to take risks, fail fast, and do it all over again in the pursuit of excellence.",,"Bachelors degree preferred
1 years of experience in a customer service role
A client first attitude and enjoy engaging with customers 
Ability to stay updated with changing industry and financial market trends while adapting to internal organizational updates and changes 
Prior experience with Salesforce or similar CRM preferred 
Excellent verbal and written communication skills with a keen eye for detail 
Interested in financial markets or services, particularly private equity and venture capital 
Ability to operate with a strong sense of urgency and deliver results 
Terrific prioritisation skills to handle high call volume in parallel with project work 
Ability to adapt to a corporate culture and seamlessly adopt guidelines and processes set forth by the organization 
Comfortable to engage with a diverse array of customers 
Team player with the desire to try new ideas in order to achieve greater levels of success 
Proficiency with the Microsoft Office suite including in-depth knowledge of Outlook, Word, and Excel with the ability to pick up new systems and software easily",,"Physical Health","Private medical insurance
Dental scheme
Additional medical wellness incentives 
Life cover",,"Paid sabbatical program after four years
Paid parental leave 
Education subsidies
Robust training programs on industry and soft skills 
Minimum 25 days annual leave and volunteer days","If you have a good attitude and are willing to roll up your sleeves to get things done, PitchBook is the place for you.",,"Employee resource groups
Company-wide events
Employee referral bonus program  
Quarterly team building events",,"8% Pension contribution
Income protection
Shared ownership employee stock program 
Transportation stipend",,,"We believe our business and our culture are strongest when we work together in person. We also know that its helpful to have some flexibility to work remotely. Most roles work in the office 3 daysweek, and some are expected to work in the office 4-5 daysweek. The current expectation for this role is that you are working in the office 3 daysweek and that you are in the office full-time during the training period, for which the length varies by role. During an initial phone screen, the team will discuss expectations for this specific position.","The job conditions for this position are in a standard office setting. Employees in this position use PC and phone on an on-going basis throughout the day. Limited corporate travel may be required to remote offices or other business meetings and events.","Life At PB",,"We are excited to get to know you and your background. Concerned that you might not meet every requirement? We encourage you to still apply as you might be the right candidate for the role or other roles at PitchBook.",,,,,,"As a member of our Account Management  Customer Success team, you will thrive on your ability to embrace and drive change and your commitment to ensuring you and PitchBook are always growing and improving. While continually learning and exploring new ideas and concepts, you will be inspired to ask questions and challenge the status quo while remaining focused on our customers success. We value teamwork and collaboration and encourage our people to build strong, trusting relationships with their teammates, customers, and partners. A contagious positivity, insatiable curiosity, and people-first attitude are the winning traits of our most successful Account Management  Customer Success team members. If this sounds like you, join us!","PitchBooks Customer Support Specialist Tier 1 provides direct customer support via phone, email, and chat to existing PitchBook clients. You will work with the support team to troubleshoot customer issues and ensure the best possible customer experience. You work at the front lines, providing real time assistance to clients in need. Customer experience pain points you identify will inform product improvements and allow PitchBook to optimize the platform for customers worldwide.",,"Respond to chat, phone, and email contacts from customers 
Achieve contact volume and quality goals measured quarterly  
Communicate effectively, both written and verbally, to ensure smooth resolution of customer issues 
Work collaboratively with other support specialists to resolve customer questions and issues 
Work continuously to document the details of each interaction in Salesforce to easily research customer issues and to inform product improvements 
Partner with global teams to ensure continuous support availability during required business hours 
Support the vision and values of the company through role modelling and encouraging desired behaviours 
Participate in various company initiatives and projects as requested","Skills and Qualifications","Benefits at PitchBook","Emotional Health","Social Health","Financial Health","Please be aware the above PitchBook benefit and perk offerings are subject to corresponding plan and policy documents and may change during the course of your employment.","Working Conditions",,"We are consistently recognized as a Best Place to Work and our culture is at the heart of our success. Its our fundamental belief that people do and create great things and that people are the cornerstone of prosperity. We believe that proactively seeking out different points of view, listening to others, learning, and reflecting on what weve heard creates a sense of belonging within PitchBook and strengthens the PitchBook community.","About the Role",,"Primary Job Responsibilities","LI-VH1",,,,
