"ID","Title","Link","Company","Location","Remote","Experience","EmploymentType","DatePosted","RoleDescription"
2477184,"Guest Care Specialist","https://jobs.smartrecruiters.com/MonroInc/744000043836404-guest-care-specialist","Monro","Louisville","No",1,"Full time","2025-02-21T22:26:17.111902Z","About The Role: The Guest Care Specialist role is full time or part-time and is an hourly position based upon needs of the business. The Guest Care Specialist is a key holder for the store and serves as the manager on duty (MOD) in the absence of the Store Manager, or when demand requires it. The Guest Care Specialist is expected to provide a superior Guest Care experience and assisting in driving sales of automotive repair services and tires. This position is expected to contribute the growth of the business through strong sales presentations to our guest and product and service knowledge. Guest Care Specialists must be comfortable answering the phone, inviting guest into our store, and making guests feel welcome during their visit.  Salary Range: $16.00 - $24.00 per hour - Based on experience. Responsibilities:  Successfully complete Monro's training program to enable Guest Care Specialist to execute the Monro selling process.   First point of contact for guests on the phone and in the store. Responsible for engaging guests, scheduling appointments, building trust, understanding needs, communicating processes and timelines, and presenting needed services following the Monro sellingprocess. Responsible for the organization and productivity of the service business through estimate and invoice transactions.   Under the direction of management, assists in various aspects of guest care, work order completion and register assistance, facility maintenance, and outside purchase ordering.  This position is a secondary key carrier responsible for basic and detailed opening and closing responsibilities.  Follow all policies and procedures related to cash, credit, check, refund and return policies. Works with the management team to react to guest service issues, guest complaints, and/or business opportunities.  Able to understand and effectively communicate all products and services Monro offers to guests.    Understand and adhere to company policies and procedures, Governmental standards including environmental codes and ANSI/OSHA standards. Consistent use of all required safety standards set forth in training and policies and procedures.   Partner with Management to produce a safe and health work environment that complies with all local, state, and federal laws, as well as with company policies and procedures.  Maintain an organized and neat guest waiting area.  Other duties as assigned.   Qualifications: High school diploma or equivalent required. Must possess a current valid drivers license and have a satisfactory Motor Vehicle Report (MVR)One (1) year of sales experience needed. Strong verbal communication skills, able to accurately write sales work orders and effectively explain services to guests. Strong problem-solving skills. Ability to work, Days, Evenings, Weekends, Holidays Profile Summary: Possess a strong focus on providing excellent guest service. Must be able to communicate clearly and professionally, both verbally and in writing. Must be able to develop a good understanding of the products or services being offered to guests. Possess basic sales skills. Must be able to think critically and find effective solutions to address guest concerns or resolve issues. Able to effectively manage time and can handle multiple priorities or various tasks at one time. Able to collaborate with others, work well with teammates, provide support when needed. Work Environment &amp; Physical Requirements: This job operates in an automotive shop environment.  The job will have exposure to a moderate noise level, adverse weather conditions, chemicals, odors, dirt, and dust. General Service Technicians must be able to complete the following but not limited to: Must be able to frequently lift, carry, and place merchandise and supplies up to 50 pounds without assistance. Frequent standing and walking for long periods of time. Frequent reaching overhead and below the knees, including squatting, bending, stooping, kneeling, twisting. Climb up and down ladders to retrieve and stock merchandise. Communicate effectively in person, by telephone, or by using telecommunications equipment. Enter and locate information on computer. Safely operates a motor vehicle. Benefits:  Paid vacation and holidays for Full Time teammates  401k eligibility immediately upon hireDirect DepositEmployee DiscountsHealthcare, Vision, and Dental for Full time teammates  Employee Access PerksCareer Advancement OpportunitiesThis summary is not an all-inclusive description of job duties. Other job duties and responsibilities may also be assigned by the incumbents supervisor at any time based upon the Companys needs.  Monro Inc. is proud to be an Equal Employment Opportunity / Affirmative Action employer. It is our policy to consider for employment all individuals regardless of age, color, national origin, citizenship status, physical or mental disability, race, religion, gender, sex, sexual orientation, gender identity and/or expression, genetic information, veteran status, or any other characteristic protected by federal, state, or local law.  Your next Destination!Growth Opportunity: At Monro were committed to helping our teammates grow their career through the combination of coursework, demonstrating leadership skills and open opportunities. Our teammates receive on-the-job training, company sponsored certifications, as well as course curriculum in Monro University that empowers them to advance to the next level of their careers.Monro, Inc. is an equal opportunity employer and affords equal opportunity to all applicants for all positions without regard to race, color, religion, sex, national origin, disability status, protected veteran status, or any other characteristic protected by law."
2477183,"Assistant Automotive  Store Manager","https://jobs.smartrecruiters.com/MonroInc/744000043844596-assistant-automotive-store-manager","Monro","Shelbyville","No",2,"Full time","2025-02-21T22:26:17.111998Z","The Assistant Manager role is a full-time position and is hourly based upon needs of the business. The Assistant Manager is a key holder for the store and serves as the manager on duty (MOD) in the absence of the Store Manager, or when demand requires it. The Assistant Manager is responsible for assisting in managing the operations of an automotive retail service and repair store to meet or exceed service standards and to achieve Monros performance and profitability goals.  This position is expected to ensure that all teammates deliver exceptional 5 Star service to our guests, through effective communication of vehicle issues and proposed solutions, as well as consistently meeting guest expectations for time commitments and quality.        Responsibilities:   Schedule guest appointments for the most effective optimization of technician abilities in the efficient and timely completion of vehicle services/repairs   Help achieve Monros sales goals by properly informing and recommending tire and service products and sales promotions.  Attend to all guest needs in areas of sales, service, complaints, and adjustments.  Build guest relationships to maximize customer satisfaction, loyalty, and retention.  Assist technicians in conveying repair and service needs to guests.  Ensure the store is in excellent condition and maintained to Monro standards for cleanliness and consistently in guest ready condition. Assist with inventory management to include the oversight of pulling of tires and parts, unloading and stocking inventory.  Provide direction and oversight to other technicians and assist where needed with services/repairs.  Assist in organizing the stores workflow to ensure that technician skill levels are utilized efficiently for completing vehicle services/repairs effectively and timely in accordance with Monro standards of operation.  Understand and adhere to company policies and procedures, Governmental standards including environmental codes and ANSI/OSHA standards. Consistent use of all required safety standards set forth in training and policies and procedures.   Perform Store Manager functions as business needs dictate.  Perform other duties as assigned and required by direct supervisor.
Pay is $15-$22 hourly, based on experience. Qualifications:   High School Diploma or equivalent   Minimum of two years retail experience, or the equivalent combination of education and experience.   Ability to work flexible hours, days, evenings, weekends, and holidays.  ASE certification and State Inspection License (where applicable) preferred.  Ability to influence and motivate a team to achieve set goals and objectives.    Ability to problem solve, manage inventory, merchandising, and customer service.    Communications skills to effectively communicate with teammates and guests.   Complete all Monro required training with the guidelines and timing provided.   Must possess a current valid drivers license and have a satisfactory Motor Vehicle Report (MVR) and have the ability to operate customers vehicles to conduct test drives.    Profile Summary:  Capable of performing basic automotive maintenance, repair, and tire services  Ability to identify problems by collecting data and establishing facts to produce practical decisions and solutions.  Ability to interpret and execute instructions furnished in written, oral, and diagram formats. Excellent customer service skills   Strong sales orientation and customer focus  Excellent verbal and written communication skills with the ability to convey technical issues and write routine reports.   Excellent organizational and time management skills with the ability to change focus quickly to meet business needs.    Work Environment &amp; Physical Requirements:   This job operates in an automotive shop environment.  The job will have exposure to a moderate noise level, adverse weather conditions, chemicals, odors, dirt, and dust. Assistant Managers must be able to complete the following but not limited to:  Must be able to see, hear, speak, lift, carry and stock merchandise and supplies up to 50 lbs. without assistance.  Frequent standing and walking for long periods of time.  Benefits Performance based incentives   Paid vacation and holidays for Full-Time Teammates Reimbursement for ASE Certifications   Reimbursement for State Inspection Licenses, where applicable   401k eligibility immediately upon hire Direct Deposit Employee Discounts Healthcare, Vision, and Dental for Full time teammates   Employee Access Perks Career Advancement Opportunities   Your next Destination!Growth Opportunity: At Monro were committed to helping our teammates grow their career through the combination of coursework, demonstrating leadership skills and open opportunities. Our teammates receive on-the-job training, company sponsored certifications, as well as course curriculum in Monro University that empowers them to advance to the next level of their careers.Monro, Inc. is an equal opportunity employer and affords equal opportunity to all applicants for all positions without regard to race, color, religion, sex, national origin, disability status, protected veteran status, or any other characteristic protected by law."
2477182,"General Service Technician","https://jobs.smartrecruiters.com/MonroInc/744000043851622-general-service-technician","Monro","Shelbyville","No","Not specified","Full time","2025-02-21T22:26:17.112036Z","Compensation: The hourly range for this role $13.00-$16.50 per hour. This role is eligible for additional compensation and incentives. Pay will be determined based on experience level.About The Role: The General Service Technician role is full time or part-time and is an hourly position based on needs of the business. The General Service Technician is responsible for performing basic routine vehicle repair and maintenance services in accordance with company standards and manufacturer specifications.  This position is expected to deliver exceptional 5 Star service to our guests, through effective communication of vehicle issues and proposed solutions while ensuring that guest expectations for time commitments and quality are consistently met.     Responsibilities:   Accurately perform basic vehicle services and repairs effectively and efficiently in accordance with Monro standards of operation.  Tire Services  perform wheel removal, balancing, patch/plug repairs, changing, mounting, installation and TPMS service and repair.  Vehicle Services  perform lubrications, oil changes, basic maintenance (e.g.: bulb, wiper blade and filter replacements, etc.), battery testing and installations.  Consistently complete Monros Courtesy Inspection process, on every guest vehicle, identifying, documenting, and communicating additional needed services and repairs.  Assist in inventory management to include pulling tires and parts, unloading and stocking inventory.  Assist with all general store duties, ensuring the store is in excellent condition and maintained to Monro standards for cleanliness and consistently in guest ready condition.  Consistently perform service(s) in accordance with Monros safety standards including but not limited to Monros Wheel Torque, Oil safety and compliance procedures.  Test drive vehicles in accordance with Monros Road Test policy, including consistently utilizing our dedicated test drive routes, while observing all local traffic and safety laws.  Understand and adhere to company policies and procedures, Governmental standards including environmental codes and ANSI/OSHA standards. Consistent use of all required safety standards set forth in training and policies and procedures.   Maintain technical knowledge and capabilities to ensure proficiency through the timely completion of all required Monro University training courses and modules.  Operate, utilize, and maintain all equipment in a safe manner in accordance with Monro and equipment manufacturer guidelines including but not limited to lifts, welders, brake lathes, etc.  Perform other duties as assigned and required. Qualifications:   High School Diploma or equivalent is preferred.  Automotive training including basic car maintenance and repair or the equivalent combination of education and experience.   Must possess a current valid drivers license and have a satisfactory Motor Vehicle Report (MVR) and have the ability to operate customers vehicles to conduct test drives. Required to own a basic set of tools or participate in Monros tool purchase program.  Profile Summary: Ability to take initiative in identifying problems, collecting data, and establishing facts to make practical decisions and recommend solutions.  Strong customer service skills  Strong verbal and written communication skills with the ability to convey technical issues and write routine reports.This summary is not an all-inclusive description of job duties. Other job duties and responsibilities may also be assigned by the incumbents supervisor at any time based upon the Companys needs.      Monro Inc. is proud to be an Equal Employment Opportunity / Affirmative Action employer. It is our policy to consider for employment all individuals regardless of age, color, national origin, citizenship status, physical or mental disability, race, religion, gender, sex, sexual orientation, gender identity and/or expression, genetic information, veteran status, or any other characteristic protected by federal, state, or local law.Benefits Health InsuranceDental Insurance401K Retirement Plan with Company MatchPaid vacationPaid HolidaysEmployee DiscountsCareer development Your next Destination!Growth Opportunity: At Monro were committed to helping our teammates grow their career through the combination of coursework, demonstrating leadership skills and open opportunities. Our teammates receive on-the-job training, company sponsored certifications, as well as course curriculum in Monro University that empowers them to advance to the next level of their careers.Monro, Inc. is an equal opportunity employer and affords equal opportunity to all applicants for all positions without regard to race, color, religion, sex, national origin, disability status, protected veteran status, or any other characteristic protected by law."
2474697,"General Service Technician","https://jobs.smartrecruiters.com/MonroInc/744000043760825-general-service-technician","Monro","Elizabeth","No","Not specified","Full time","2025-02-21T22:26:17.112085Z","Compensation: The hourly range for this role $14.00-$16.50 per hour. This role is eligible for additional compensation and incentives. Pay will be determined based on experience level.About The Role: The General Service Technician role is full time or part-time and is an hourly position based on needs of the business. The General Service Technician is responsible for performing basic routine vehicle repair and maintenance services in accordance with company standards and manufacturer specifications.  This position is expected to deliver exceptional 5 Star service to our guests, through effective communication of vehicle issues and proposed solutions while ensuring that guest expectations for time commitments and quality are consistently met.     Responsibilities:   Accurately perform basic vehicle services and repairs effectively and efficiently in accordance with Monro standards of operation.  Tire Services  perform wheel removal, balancing, patch/plug repairs, changing, mounting, installation and TPMS service and repair.  Vehicle Services  perform lubrications, oil changes, basic maintenance (e.g.: bulb, wiper blade and filter replacements, etc.), battery testing and installations.  Consistently complete Monros Courtesy Inspection process, on every guest vehicle, identifying, documenting, and communicating additional needed services and repairs.  Assist in inventory management to include pulling tires and parts, unloading and stocking inventory.  Assist with all general store duties, ensuring the store is in excellent condition and maintained to Monro standards for cleanliness and consistently in guest ready condition.  Consistently perform service(s) in accordance with Monros safety standards including but not limited to Monros Wheel Torque, Oil safety and compliance procedures.  Test drive vehicles in accordance with Monros Road Test policy, including consistently utilizing our dedicated test drive routes, while observing all local traffic and safety laws.  Understand and adhere to company policies and procedures, Governmental standards including environmental codes and ANSI/OSHA standards. Consistent use of all required safety standards set forth in training and policies and procedures.   Maintain technical knowledge and capabilities to ensure proficiency through the timely completion of all required Monro University training courses and modules.  Operate, utilize, and maintain all equipment in a safe manner in accordance with Monro and equipment manufacturer guidelines including but not limited to lifts, welders, brake lathes, etc.  Perform other duties as assigned and required. Qualifications:   High School Diploma or equivalent is preferred.  Automotive training including basic car maintenance and repair or the equivalent combination of education and experience.   Must possess a current valid drivers license and have a satisfactory Motor Vehicle Report (MVR) and have the ability to operate customers vehicles to conduct test drives. Required to own a basic set of tools or participate in Monros tool purchase program.  Profile Summary: Ability to take initiative in identifying problems, collecting data, and establishing facts to make practical decisions and recommend solutions.  Strong customer service skills  Strong verbal and written communication skills with the ability to convey technical issues and write routine reports.This summary is not an all-inclusive description of job duties. Other job duties and responsibilities may also be assigned by the incumbents supervisor at any time based upon the Companys needs.      Monro Inc. is proud to be an Equal Employment Opportunity / Affirmative Action employer. It is our policy to consider for employment all individuals regardless of age, color, national origin, citizenship status, physical or mental disability, race, religion, gender, sex, sexual orientation, gender identity and/or expression, genetic information, veteran status, or any other characteristic protected by federal, state, or local law.Benefits Health InsuranceDental Insurance401K Retirement Plan with Company MatchPaid vacationPaid HolidaysEmployee DiscountsCareer development Your next Destination!Growth Opportunity: At Monro were committed to helping our teammates grow their career through the combination of coursework, demonstrating leadership skills and open opportunities. Our teammates receive on-the-job training, company sponsored certifications, as well as course curriculum in Monro University that empowers them to advance to the next level of their careers.Monro, Inc. is an equal opportunity employer and affords equal opportunity to all applicants for all positions without regard to race, color, religion, sex, national origin, disability status, protected veteran status, or any other characteristic protected by law."
2474695,"Automotive General Service Technician","https://jobs.smartrecruiters.com/MonroInc/744000043763820-automotive-general-service-technician","Monro","Los Altos","No","Not specified","Full time","2025-02-21T22:26:17.112120Z","The Lube and Tire Technician at Monro or General Service Tech as we call it, is an entry level Automotive Technician position and a great way to start your career at Monro.  Starting day 1 you will begin a comprehensive mechanic training program, covering all aspects of your new role. As a General Service Technician, you will be an essential team member, performing maintenance services on Guest vehicles. More importantly, you will be part of a team working together to deliver 5 Star Guest experiences, while using your technician skills to take care of people, their cars and ensure our guests have safe, reliable transportation. Pay is based on experience plus, incentives (if applicable) Responsibilities Mechanic duties include changing, mounting, and installing tires Wheel removal, tire repair and balance, tire patch/plug repairs  Quick lube type duties such as lubrication and oil change Inspect and rotate tires   Basic automotive maintenance work such as battery installation  We will train you to do alignments, brake services, and scheduled maintenance services  Compensation: The hourly range for this role is $16.00 - $19.00. This role is eligible for additional compensation and incentives. Pay will be determined based on experience level.Minimum Qualifications   HS diploma or GED equivalent  Automotive experience  Own basic set of Mechanics tools or participate in tool purchase program  Valid Driver license Must be at least 18 years of agePositive attitude and a collaborative mindset  Ability to work with hands overhead, stand for long periods and lift 50 lbs  Preferred Qualifications  Automotive Technician or Lube and Tire experience  Benefits Health InsuranceDental Insurance401K Retirement Plan with Company MatchPaid vacationPaid HolidaysEmployee DiscountsCareer developmentYour next Destination!Growth Opportunity: At Monro were committed to helping our teammates grow their career through the combination of coursework, demonstrating leadership skills and open opportunities. Our teammates receive on-the-job training, company sponsored certifications, as well as course curriculum in Monro University that empowers them to advance to the next level of their careers.Monro, Inc. is an equal opportunity employer and affords equal opportunity to all applicants for all positions without regard to race, color, religion, sex, national origin, disability status, protected veteran status, or any other characteristic protected by law."
