"ID","Title","Link","Company","Location","Remote","Experience","EmploymentType","DatePosted","RoleDescription"
2451891,"Automotive General Service Technician","https://jobs.smartrecruiters.com/MonroInc/744000043143935-automotive-general-service-technician","Monro","Morehead City ","No","Not specified","Full time","2025-02-21T22:26:17.112992Z","The Lube and Tire Technician at Monro or General Service Tech as we call it, is an entry level Automotive Technician position and a great way to start your career at Monro.  Starting day 1 you will begin a comprehensive mechanic training program, covering all aspects of your new role. As a General Service Technician, you will be an essential team member, performing maintenance services on Guest vehicles. More importantly, you will be part of a team working together to deliver 5 Star Guest experiences, while using your technician skills to take care of people, their cars and ensure our guests have safe, reliable transportation. Pay is based on experience plus, incentives (if applicable) Responsibilities Mechanic duties include changing, mounting, and installing tires Wheel removal, tire repair and balance, tire patch/plug repairs  Quick lube type duties such as lubrication and oil change Inspect and rotate tires   Basic automotive maintenance work such as battery installation  We will train you to do alignments, brake services, and scheduled maintenance services Compensation: The hourly range for this role is $15 - $16 also there is a $2 flat rate commission. This role is eligible for additional compensation and incentives. Pay will be determined based on experience level.Minimum Qualifications   HS diploma or GED equivalent  Automotive experience  Own basic set of Mechanics tools or participate in tool purchase program  Valid Driver license Must be at least 18 years of agePositive attitude and a collaborative mindset  Ability to work with hands overhead, stand for long periods and lift 50 lbs  Preferred Qualifications  Automotive Technician or Lube and Tire experience  Benefits Health InsuranceDental Insurance401K Retirement Plan with Company MatchPaid vacationPaid HolidaysEmployee DiscountsCareer developmentYour next Destination!Growth Opportunity: At Monro were committed to helping our teammates grow their career through the combination of coursework, demonstrating leadership skills and open opportunities. Our teammates receive on-the-job training, company sponsored certifications, as well as course curriculum in Monro University that empowers them to advance to the next level of their careers.Monro, Inc. is an equal opportunity employer and affords equal opportunity to all applicants for all positions without regard to race, color, religion, sex, national origin, disability status, protected veteran status, or any other characteristic protected by law."
2449766,"Automotive Service Advisor","https://jobs.smartrecruiters.com/MonroInc/744000043060316-automotive-service-advisor","Monro","Ankeny","No","Not specified","Full time","2025-02-21T22:26:17.113018Z","As a Fast Tire Sales Specialist, you are responsible for providing a superior Guest Sales experience and assisting in driving sales of automotive repair services and tires. This position is expected to contribute the growth of the business through strong sales presentations to our guest and product and service knowledge. You must be comfortable answering the phone, inviting guest into our store, and making guests feel welcome during their visit.Responsibilities First point of contact for customers on the phone and in the store. Responsible for engaging customers, scheduling appointments, building trust, understanding needs, communicating processes and timelines, and presenting needed services following the Monro selling process. Responsible for the organization and productivity of the service business through estimate and invoice transactions. Under the direction of management, assists in various aspects of customer care, work order completion and register assistance, facility maintenance, and outside purchase ordering. This position is a secondary key carrier responsible for basic and detailed opening and closing responsibilities. Follow all policies and procedures related to cash, credit, check, refund and return policies. Works with the management team to react to customer service issues, customer complaints, and/or business opportunities. Able to understand and effectively communicate all products and services Monro offers to customers. Maintain an organized and neat customer waiting area. Other duties as assigned.Benefits  Health Insurance  Dental Insurance 401K Retirement Plan with Company Match Paid vacation Paid Holidays Career Development Your next Destination!Growth Opportunity: At Monro were committed to helping our teammates grow their career through the combination of coursework, demonstrating leadership skills and open opportunities. Our teammates receive on-the-job training, company sponsored certifications, as well as course curriculum in Monro University that empowers them to advance to the next level of their careers.Monro, Inc. is an equal opportunity employer and affords equal opportunity to all applicants for all positions without regard to race, color, religion, sex, national origin, disability status, protected veteran status, or any other characteristic protected by law."
2449765,"Automotive Assistant Manager","https://jobs.smartrecruiters.com/MonroInc/744000043062910-automotive-assistant-manager","Monro","Saranac Lake","No",1,"Full time","2025-02-21T22:26:17.113046Z","Position Summary:You are responsible for providing a superior Guest Care experience and assisting in driving sales of automotive repair services and tires. This position is expected to contribute the growth of the business through strong sales presentations to our guest and product and service knowledge.  You must be comfortable answering the phone, inviting guest into our store, and making guests feel welcome during their visit.Compensation:  The hourly guaranteed range for this role is from $16 - $19 per hour.  Pay will be based on experience level. Duties &amp; Responsibilities: Successfully complete Monro's training program to enable Guest Care Specialist to execute the Monro selling process.First point of contact for customers on the phone and in the store. Responsible for engaging customers, scheduling appointments, building trust, understanding needs, communicating processes and timelines, and presenting needed services following the Monro selling process. Responsible for the organization and productivity of the service business through estimate and invoice transactions.Under the direction of management, assists in various aspects of customer care, work order completion and register assistance, facility maintenance, and outside purchase ordering.This position is a secondary key carrier responsible for basic and detailed opening and closing responsibilities.Follow all policies and procedures related to cash, credit, check, refund and return policies. Works with the management team to react to customer service issues, customer complaints, and/or business opportunities.Able to understand and effectively communicate all products and services Monro offers to customers. Partner with Management to produce a safe and health work environment that complies with all local, state, and federal laws, as well as with company policies and procedures.Maintain an organized and neat customer waiting area.Other duties as assigned.Knowledge, Skills, and Abilities:High school diploma or equivalent required.Valid Driver's License.One (1) year of sales experience needed.Preferred One (1) year of related experience in the automotive service environment.Strong verbal communication skills, able to accurately write sales work orders and effectively explain services to customers.Strong problem-solving skills.Ability to work, Days, Evenings, Weekends, HolidaysPhysical Demands: Must be able to frequently lift, carry, and place merchandise and supplies up to 50 pounds without assistance.Frequent standing and walking for long periods of time.Frequent reaching overhead and below the knees, including squatting, bending, stooping, kneeling, twisting.Climb up and down ladders to retrieve and stock merchandise.Communicate effectively in person, by telephone, or by using telecommunications equipment.Enter and locate information on computer.Safely operates a motor vehicle.Benefits:  Paid vacation and holidays for Full Time teammates  401k eligibility immediately upon hireDirect DepositEmployee DiscountsHealthcare, Vision, and Dental for Full time teammates  Employee Access PerksCareer Advancement OpportunitiesThis summary is not an all-inclusive description of job duties. Other job duties and responsibilities may also be assigned by the incumbents supervisor at any time based upon the Companys needs.  Monro Inc. is proud to be an Equal Employment Opportunity / Affirmative Action employer. It is our policy to consider for employment all individuals regardless of age, color, national origin, citizenship status, physical or mental disability, race, religion, gender, sex, sexual orientation, gender identity and/or expression, genetic information, veteran status, or any other characteristic protected by federal, state, or local law.   Your next Destination!Growth Opportunity: At Monro were committed to helping our teammates grow their career through the combination of coursework, demonstrating leadership skills and open opportunities. Our teammates receive on-the-job training, company sponsored certifications, as well as course curriculum in Monro University that empowers them to advance to the next level of their careers.Monro, Inc. is an equal opportunity employer and affords equal opportunity to all applicants for all positions without regard to race, color, religion, sex, national origin, disability status, protected veteran status, or any other characteristic protected by law."
2449764,"Automotive Service Advisor","https://jobs.smartrecruiters.com/MonroInc/744000043062816-automotive-service-advisor","Monro","Johnston","No",1,"Full time","2025-02-21T22:26:17.113071Z","Responsibilities First point of contact for customers on the phone and in the store. Responsible for engaging customers, scheduling appointments, building trust, understanding needs, communicating processes and timelines, and presenting needed services following the Monro selling process. Responsible for the organization and productivity of the service business through estimate and invoice transactions. Under the direction of management, assists in various aspects of customer care, work order completion and register assistance, facility maintenance, and outside purchase ordering. This position is a secondary key carrier responsible for basic and detailed opening and closing responsibilities. Follow all policies and procedures related to cash, credit, check, refund and return policies. Works with the management team to react to customer service issues, customer complaints, and/or business opportunities. Able to understand and effectively communicate all products and services Monro offers to customers. Partner with Management to produce a safe and health work environment that complies with all local, state, and federal laws, as well as with company policies and procedures. Maintain an organized and neat customer waiting area. Other duties as assigned.Minimum Qualifications High school diploma or equivalent required. Valid Driver's License. One (1) year of sales experience needed. Preferred One (1) year of related experience in the automotive service environment. Strong verbal communication skills, able to accurately write sales work orders and effectively explain services to customers. Strong problem-solving skills. Ability to work, Days, Evenings, Weekends, Holidays Frequent standing and walking for long periods of time. Communicate effectively in person, by telephone, or by using telecommunications equipment.Benefits  Health Insurance  Dental Insurance 401K Retirement Plan with Company Match Paid vacation Paid Holidays Career Development Your next Destination!Growth Opportunity: At Monro were committed to helping our teammates grow their career through the combination of coursework, demonstrating leadership skills and open opportunities. Our teammates receive on-the-job training, company sponsored certifications, as well as course curriculum in Monro University that empowers them to advance to the next level of their careers.Monro, Inc. is an equal opportunity employer and affords equal opportunity to all applicants for all positions without regard to race, color, religion, sex, national origin, disability status, protected veteran status, or any other characteristic protected by law."
2449763,"Automotive Technician - Technician","https://jobs.smartrecruiters.com/MonroInc/744000043077595-automotive-technician-technician","Monro","Randallstown","No","Not specified","Full time","2025-02-21T22:26:17.113100Z","About the Role:The Technician role is full time or part-time and is an hourly position based on needs of the business. The Technician is primarily responsible for conducting basic vehicle diagnostics and performing routine vehicle repair and maintenance services in accordance with company standards and manufacturer specifications. This position is expected to deliver exceptional 5 Star service to our guests, through effective communication of vehicle issues and proposed solutions, as well as consistently meeting guest expectations for time commitments and quality.Salary Range: Hourly $15.00 - $18.00, with flat rate of $25 - $30 - Based on experience.This role is eligible for additional compensation and incentives. Responsibilities: Perform basic vehicle diagnostics to properly identify required repairs. Consistently complete Monros Courtesy Inspection process, on every guest vehicle, identifying, documenting, and communicating additional needed services and repairs; Audit courtesy inspections performed by the General Service Technicians Assist in inventory management to include pulling tires and parts, unloading and stocking inventory. Assist with all general store duties, ensuring the store is in excellent condition and maintained to Monro standards for cleanliness and consistently in guest ready condition. Consistently perform service(s) in accordance with Monros safety standards including but not limited to Monros Wheel Torque, Oil safety and compliance procedures Test drive vehicles in accordance with Monros Road Test policy, including consistently utilizing our dedicated test drive routes, while maintaining all local traffic and safety laws Understand and adhere to company policies and procedures, Governmental standards including environmental codes and ANSI/OSHA standards. Consistent use of all required safety standards set forth in training and policies and procedures. Maintain technical knowledge and capabilities to ensure proficiency through the timely completion of all required Monro University training courses and modules. Operate, utilize, and maintain all equipment in a safe manner in accordance with Monro and equipment manufacturer guidelines including but not limited to lifts, welders, brake lathes, etc. Perform other duties as assigned and required. Qualifications:High School Diploma or equivalent.   Automotive training including basic car maintenance and repair or the equivalent combination of education and experience.   ASE certification and State Inspection license (where applicable) preferred.  Must possess a current valid drivers license and have a satisfactory Motor Vehicle Report (MVR)  Required to own a basic set of tools or participate in Monros tool purchase program.Profile Summary: Capable of performing basic automotive maintenance, repair, and tire services Ability to diagnose problems identifying root cause and determine appropriate repair solution.  Ability to interpret and execute instructions furnished in written, oral, and diagram formats Strong customer service skills Strong verbal and written communication skills with the ability to convey technical issues and write routine reports.  Work Environment &amp; Physical Requirements:  This job operates in an automotive shop environment.  The job will have exposure to a moderate noise level, adverse weather conditions, chemicals, odors, dirt, and dust. Technicians must be able to complete the following but not limited to: Ability to work flexible hours, days, evenings, weekends, and holidays. Must be able to see, hear, lift, carry, and stock merchandise and supplies up to 50 lbs. without assistance. Frequent standing and walking for long periods of time. Frequent reaching overhead and below the knees, including squatting, bending, stooping, kneeling, and twisting.   Benefits:   Performance based incentives   Paid vacation and holidays for Full-Time Teammates Reimbursement for ASE Certifications   Reimbursement for State Inspection Licenses, where applicable   401k eligibility immediately upon hire Direct Deposit Employee Discounts Healthcare, Vision, and Dental for Full time teammates   Employee Access Perks Career Advancement Opportunities   This summary is not an all-inclusive description of job duties. Other job duties and responsibilities may also be assigned by the incumbents supervisor at any time based upon the Companys needs.      Monro Inc. is proud to be an Equal Employment Opportunity / Affirmative Action employer. It is our policy to consider for employment all individuals regardless of age, color, national origin, citizenship status, physical or mental disability, race, religion, gender, sex, sexual orientation, gender identity and/or expression, genetic information, veteran status, or any other characteristic protected by federal, state, or local law.   Your next Destination!Growth Opportunity: At Monro were committed to helping our teammates grow their career through the combination of coursework, demonstrating leadership skills and open opportunities. Our teammates receive on-the-job training, company sponsored certifications, as well as course curriculum in Monro University that empowers them to advance to the next level of their careers.Monro, Inc. is an equal opportunity employer and affords equal opportunity to all applicants for all positions without regard to race, color, religion, sex, national origin, disability status, protected veteran status, or any other characteristic protected by law."
2449762,"General Service Technician","https://jobs.smartrecruiters.com/MonroInc/744000043087841-general-service-technician","Monro","Waukee","No","Not specified","Full time","2025-02-21T22:26:17.113128Z","AUTOMOTIVE TECHNICIAN  LUBE &amp; TIREThe Lube and Tire Technician is an entry level Automotive Technician position and a great way to start your career at Monro. Starting day 1 you will begin a comprehensive mechanic training program, covering all aspects of your new role. As a General Service Technician, you will be an essential team member, performing maintenance services on Guest vehicles. This role is eligible for additional compensation and incentives.  Pay will be based on experience level.Responsibilities Changing, mounting, and installing tiresWheel removal, tire repair and balance, tire patch/plug repairsQuick lube type duties such as lubrication and oil changesVehicle Inspections and tire rotationsBasic automotive maintenance work such as battery installation and filtersWe will train you to do alignments, brake services, and scheduled maintenance servicesMinimum Qualifications  HS diploma or GED equivalentValid Driver licensePositive attitude and a collaborative mindsetAbility to work with hands overhead, stand for long periods and lift 50 lbs.Benefits  Health Insurance  Dental Insurance 401K Retirement Plan with Company Match Paid vacation Paid Holidays Career Development Your next Destination!Growth Opportunity: At Monro were committed to helping our teammates grow their career through the combination of coursework, demonstrating leadership skills and open opportunities. Our teammates receive on-the-job training, company sponsored certifications, as well as course curriculum in Monro University that empowers them to advance to the next level of their careers.Monro, Inc. is an equal opportunity employer and affords equal opportunity to all applicants for all positions without regard to race, color, religion, sex, national origin, disability status, protected veteran status, or any other characteristic protected by law."
