"ID","Title","Link","Company","Location","Remote","Experience","EmploymentType","DatePosted","RoleDescription"
2474685,"Automotive Technician - Technician","https://jobs.smartrecruiters.com/MonroInc/744000043809555-automotive-technician-technician","Monro","Cary","No","Not specified","Full time","2025-02-21T22:26:17.112333Z","About the Role:The Technician role is full time or part-time and is an hourly position based on needs of the business. The Technician is primarily responsible for conducting basic vehicle diagnostics and performing routine vehicle repair and maintenance services in accordance with company standards and manufacturer specifications. This position is expected to deliver exceptional 5 Star service to our guests, through effective communication of vehicle issues and proposed solutions, as well as consistently meeting guest expectations for time commitments and quality.Salary Range: $18.00 - $35.00 per hour - Based on experience.This role is eligible for additional compensation and incentives. Responsibilities: Perform basic vehicle diagnostics to properly identify required repairs. Consistently complete Monros Courtesy Inspection process, on every guest vehicle, identifying, documenting, and communicating additional needed services and repairs; Audit courtesy inspections performed by the General Service Technicians Assist in inventory management to include pulling tires and parts, unloading and stocking inventory. Assist with all general store duties, ensuring the store is in excellent condition and maintained to Monro standards for cleanliness and consistently in guest ready condition. Consistently perform service(s) in accordance with Monros safety standards including but not limited to Monros Wheel Torque, Oil safety and compliance procedures Test drive vehicles in accordance with Monros Road Test policy, including consistently utilizing our dedicated test drive routes, while maintaining all local traffic and safety laws Understand and adhere to company policies and procedures, Governmental standards including environmental codes and ANSI/OSHA standards. Consistent use of all required safety standards set forth in training and policies and procedures. Maintain technical knowledge and capabilities to ensure proficiency through the timely completion of all required Monro University training courses and modules. Operate, utilize, and maintain all equipment in a safe manner in accordance with Monro and equipment manufacturer guidelines including but not limited to lifts, welders, brake lathes, etc. Perform other duties as assigned and required. Qualifications:High School Diploma or equivalent.   Automotive training including basic car maintenance and repair or the equivalent combination of education and experience.   ASE certification and State Inspection license (where applicable) preferred.  Must possess a current valid drivers license and have a satisfactory Motor Vehicle Report (MVR)  Required to own a basic set of tools or participate in Monros tool purchase program.Profile Summary: Capable of performing basic automotive maintenance, repair, and tire services Ability to diagnose problems identifying root cause and determine appropriate repair solution.  Ability to interpret and execute instructions furnished in written, oral, and diagram formats Strong customer service skills Strong verbal and written communication skills with the ability to convey technical issues and write routine reports.  Work Environment &amp; Physical Requirements:  This job operates in an automotive shop environment.  The job will have exposure to a moderate noise level, adverse weather conditions, chemicals, odors, dirt, and dust. Technicians must be able to complete the following but not limited to: Ability to work flexible hours, days, evenings, weekends, and holidays. Must be able to see, hear, lift, carry, and stock merchandise and supplies up to 50 lbs. without assistance. Frequent standing and walking for long periods of time. Frequent reaching overhead and below the knees, including squatting, bending, stooping, kneeling, and twisting.   Benefits:   Performance based incentives   Paid vacation and holidays for Full-Time Teammates Reimbursement for ASE Certifications   Reimbursement for State Inspection Licenses, where applicable   401k eligibility immediately upon hire Direct Deposit Employee Discounts Healthcare, Vision, and Dental for Full time teammates   Employee Access Perks Career Advancement Opportunities   This summary is not an all-inclusive description of job duties. Other job duties and responsibilities may also be assigned by the incumbents supervisor at any time based upon the Companys needs.      Monro Inc. is proud to be an Equal Employment Opportunity / Affirmative Action employer. It is our policy to consider for employment all individuals regardless of age, color, national origin, citizenship status, physical or mental disability, race, religion, gender, sex, sexual orientation, gender identity and/or expression, genetic information, veteran status, or any other characteristic protected by federal, state, or local law.   Your next Destination!Growth Opportunity: At Monro were committed to helping our teammates grow their career through the combination of coursework, demonstrating leadership skills and open opportunities. Our teammates receive on-the-job training, company sponsored certifications, as well as course curriculum in Monro University that empowers them to advance to the next level of their careers.Monro, Inc. is an equal opportunity employer and affords equal opportunity to all applicants for all positions without regard to race, color, religion, sex, national origin, disability status, protected veteran status, or any other characteristic protected by law."
2474684,"Automotive Technician - Technician","https://jobs.smartrecruiters.com/MonroInc/744000043811407-automotive-technician-technician","Monro","Wilson","No","Not specified","Full time","2025-02-21T22:26:17.112370Z","About the Role:The Technician role is full time or part-time and is an hourly position based on needs of the business. The Technician is primarily responsible for conducting basic vehicle diagnostics and performing routine vehicle repair and maintenance services in accordance with company standards and manufacturer specifications. This position is expected to deliver exceptional 5 Star service to our guests, through effective communication of vehicle issues and proposed solutions, as well as consistently meeting guest expectations for time commitments and quality.Salary Range: $18.00 - $35.00 per hour - Based on experience.This role is eligible for additional compensation and incentives. Responsibilities: Perform basic vehicle diagnostics to properly identify required repairs. Consistently complete Monros Courtesy Inspection process, on every guest vehicle, identifying, documenting, and communicating additional needed services and repairs; Audit courtesy inspections performed by the General Service Technicians Assist in inventory management to include pulling tires and parts, unloading and stocking inventory. Assist with all general store duties, ensuring the store is in excellent condition and maintained to Monro standards for cleanliness and consistently in guest ready condition. Consistently perform service(s) in accordance with Monros safety standards including but not limited to Monros Wheel Torque, Oil safety and compliance procedures Test drive vehicles in accordance with Monros Road Test policy, including consistently utilizing our dedicated test drive routes, while maintaining all local traffic and safety laws Understand and adhere to company policies and procedures, Governmental standards including environmental codes and ANSI/OSHA standards. Consistent use of all required safety standards set forth in training and policies and procedures. Maintain technical knowledge and capabilities to ensure proficiency through the timely completion of all required Monro University training courses and modules. Operate, utilize, and maintain all equipment in a safe manner in accordance with Monro and equipment manufacturer guidelines including but not limited to lifts, welders, brake lathes, etc. Perform other duties as assigned and required. Qualifications:High School Diploma or equivalent.   Automotive training including basic car maintenance and repair or the equivalent combination of education and experience.   ASE certification and State Inspection license (where applicable) preferred.  Must possess a current valid drivers license and have a satisfactory Motor Vehicle Report (MVR)  Required to own a basic set of tools or participate in Monros tool purchase program.Profile Summary: Capable of performing basic automotive maintenance, repair, and tire services Ability to diagnose problems identifying root cause and determine appropriate repair solution.  Ability to interpret and execute instructions furnished in written, oral, and diagram formats Strong customer service skills Strong verbal and written communication skills with the ability to convey technical issues and write routine reports.  Work Environment &amp; Physical Requirements:  This job operates in an automotive shop environment.  The job will have exposure to a moderate noise level, adverse weather conditions, chemicals, odors, dirt, and dust. Technicians must be able to complete the following but not limited to: Ability to work flexible hours, days, evenings, weekends, and holidays. Must be able to see, hear, lift, carry, and stock merchandise and supplies up to 50 lbs. without assistance. Frequent standing and walking for long periods of time. Frequent reaching overhead and below the knees, including squatting, bending, stooping, kneeling, and twisting.   Benefits:   Performance based incentives   Paid vacation and holidays for Full-Time Teammates Reimbursement for ASE Certifications   Reimbursement for State Inspection Licenses, where applicable   401k eligibility immediately upon hire Direct Deposit Employee Discounts Healthcare, Vision, and Dental for Full time teammates   Employee Access Perks Career Advancement Opportunities   This summary is not an all-inclusive description of job duties. Other job duties and responsibilities may also be assigned by the incumbents supervisor at any time based upon the Companys needs.      Monro Inc. is proud to be an Equal Employment Opportunity / Affirmative Action employer. It is our policy to consider for employment all individuals regardless of age, color, national origin, citizenship status, physical or mental disability, race, religion, gender, sex, sexual orientation, gender identity and/or expression, genetic information, veteran status, or any other characteristic protected by federal, state, or local law.   Your next Destination!Growth Opportunity: At Monro were committed to helping our teammates grow their career through the combination of coursework, demonstrating leadership skills and open opportunities. Our teammates receive on-the-job training, company sponsored certifications, as well as course curriculum in Monro University that empowers them to advance to the next level of their careers.Monro, Inc. is an equal opportunity employer and affords equal opportunity to all applicants for all positions without regard to race, color, religion, sex, national origin, disability status, protected veteran status, or any other characteristic protected by law."
2474683,"General Service Technician","https://jobs.smartrecruiters.com/MonroInc/744000043811725-general-service-technician","Monro","Cary","No","Not specified","Full time","2025-02-21T22:26:17.112400Z","Compensation: The hourly range for this role $15.00-$17.00 per hour. This role is eligible for additional compensation and incentives. Pay will be determined based on experience level.About The Role: The General Service Technician role is full time or part-time and is an hourly position based on needs of the business. The General Service Technician is responsible for performing basic routine vehicle repair and maintenance services in accordance with company standards and manufacturer specifications.  This position is expected to deliver exceptional 5 Star service to our guests, through effective communication of vehicle issues and proposed solutions while ensuring that guest expectations for time commitments and quality are consistently met.     Responsibilities:   Accurately perform basic vehicle services and repairs effectively and efficiently in accordance with Monro standards of operation.  Tire Services  perform wheel removal, balancing, patch/plug repairs, changing, mounting, installation and TPMS service and repair.  Vehicle Services  perform lubrications, oil changes, basic maintenance (e.g.: bulb, wiper blade and filter replacements, etc.), battery testing and installations.  Consistently complete Monros Courtesy Inspection process, on every guest vehicle, identifying, documenting, and communicating additional needed services and repairs.  Assist in inventory management to include pulling tires and parts, unloading and stocking inventory.  Assist with all general store duties, ensuring the store is in excellent condition and maintained to Monro standards for cleanliness and consistently in guest ready condition.  Consistently perform service(s) in accordance with Monros safety standards including but not limited to Monros Wheel Torque, Oil safety and compliance procedures.  Test drive vehicles in accordance with Monros Road Test policy, including consistently utilizing our dedicated test drive routes, while observing all local traffic and safety laws.  Understand and adhere to company policies and procedures, Governmental standards including environmental codes and ANSI/OSHA standards. Consistent use of all required safety standards set forth in training and policies and procedures.   Maintain technical knowledge and capabilities to ensure proficiency through the timely completion of all required Monro University training courses and modules.  Operate, utilize, and maintain all equipment in a safe manner in accordance with Monro and equipment manufacturer guidelines including but not limited to lifts, welders, brake lathes, etc.  Perform other duties as assigned and required. Qualifications:   High School Diploma or equivalent is preferred.  Automotive training including basic car maintenance and repair or the equivalent combination of education and experience.   Must possess a current valid drivers license and have a satisfactory Motor Vehicle Report (MVR) and have the ability to operate customers vehicles to conduct test drives. Required to own a basic set of tools or participate in Monros tool purchase program.  Profile Summary: Ability to take initiative in identifying problems, collecting data, and establishing facts to make practical decisions and recommend solutions.  Strong customer service skills  Strong verbal and written communication skills with the ability to convey technical issues and write routine reports.This summary is not an all-inclusive description of job duties. Other job duties and responsibilities may also be assigned by the incumbents supervisor at any time based upon the Companys needs.      Monro Inc. is proud to be an Equal Employment Opportunity / Affirmative Action employer. It is our policy to consider for employment all individuals regardless of age, color, national origin, citizenship status, physical or mental disability, race, religion, gender, sex, sexual orientation, gender identity and/or expression, genetic information, veteran status, or any other characteristic protected by federal, state, or local law.Benefits Health InsuranceDental Insurance401K Retirement Plan with Company MatchPaid vacationPaid HolidaysEmployee DiscountsCareer development Your next Destination!Growth Opportunity: At Monro were committed to helping our teammates grow their career through the combination of coursework, demonstrating leadership skills and open opportunities. Our teammates receive on-the-job training, company sponsored certifications, as well as course curriculum in Monro University that empowers them to advance to the next level of their careers.Monro, Inc. is an equal opportunity employer and affords equal opportunity to all applicants for all positions without regard to race, color, religion, sex, national origin, disability status, protected veteran status, or any other characteristic protected by law."
2474682,"Automotive Technician - Technician","https://jobs.smartrecruiters.com/MonroInc/744000043812195-automotive-technician-technician","Monro","Wilson","No","Not specified","Full time","2025-02-21T22:26:17.112428Z","Your next Destination!Growth Opportunity: At Monro were committed to helping our teammates grow their career through the combination of coursework, demonstrating leadership skills and open opportunities. Our teammates receive on-the-job training, company sponsored certifications, as well as course curriculum in Monro University that empowers them to advance to the next level of their careers.Monro, Inc. is an equal opportunity employer and affords equal opportunity to all applicants for all positions without regard to race, color, religion, sex, national origin, disability status, protected veteran status, or any other characteristic protected by law."
2468166,"Automotive Store Manager","https://jobs.smartrecruiters.com/MonroInc/744000043579315-automotive-store-manager","Monro","Newark","No",4,"Full time","2025-02-21T22:26:17.112457Z","The Store Manager position is responsible for providing the day-to-day leadership to the store and teammates.  This position supports Monros vision in becoming a leader for automotive and tire centers, trusted by consumers as the best place for quality maintenance and repairs.   Compensation:  The range for this role is from $55,000 - $75,000 This role is eligible for additional compensation and incentives. Pay will be based on experience level.  Essential Functions:  Develop sales and technical teammates to produce a consistent 5-star Guest experience Ensure sales goals are achieved by assisting in the development and implementation of sales plans, thorough knowledge of services and products and the automotive industry  Introduce tire and service products to guests to maximize sales and guest satisfaction and loyalty   Support teammates in establishing and maintaining a productive sales environment by training and developing teammates on all shop operations and guest services  Ensure the store is effectively staffed by managing the recruiting, hiring, training, scheduling, evaluating, performance management, and development of teammates  Ensure expense control through the management of payroll, telephone usage, store maintenance and repairs, supplies, utilities, and other controllable expenses Perform other duties as assigned Management Responsibility: The Store Manager position provides daily leadership to all positions within the store to include General Service Technicians, Technicians, Technical Service Manager, Service Manager, and Assistant Store Manager. This position operates under the general direction of the District Manager.  High School Diploma or equivalent. 4-6 years of demonstrated leadership experience in a Automotive retail/sales environment. Proven ability to manage, drive and deliver financial results while controlling costs.  Ability to influence and motivate a team to achieve set goals and objectives.   Knowledge &amp; Skills:  Guest and team focused mindset with extensive experience in customer-facing, customer-centric environments Excellent verbal and written communication skills with the ability to convey technical issues and write routine reports  Business mentality with the drive to exceed established goals  Possess basic algebra skills to calculate figures and amounts such as discounts, interest, commissions proportions, and percentages Proactive with demonstrated proficiency in multi-tasking within a fast-paced environment Ability to take initiative in identifying problems, collecting data, and establishing facts in order to produce practical decisions and solutions Ability to effectively mentor, coach and develop teammates Work Environment &amp; Physical Requirements:  This job operates in an automotive shop environment.  The job will have exposure to a moderate noise level, adverse weather conditions, chemicals, odors, dirt and dust. Must possess a current valid drivers license and have a satisfactory Motor Vehicle Report (MVR) Ability to work flexible hours, days, evenings, weekends and holidays Must be able to lift, carry and stock merchandise and supplies up to 50 lbs. without assistance Frequent standing and walking for long periods of time Frequent reaching overhead and below the knees, including squatting, bending, stooping, kneeling, twisting  Benefits  Health Insurance  Dental Insurance 401K Retirement Plan with Company Match Paid vacation Paid Holidays Employee Discounts  Career Development  Your next Destination!Growth Opportunity: At Monro were committed to helping our teammates grow their career through the combination of coursework, demonstrating leadership skills and open opportunities. Our teammates receive on-the-job training, company sponsored certifications, as well as course curriculum in Monro University that empowers them to advance to the next level of their careers.Monro, Inc. is an equal opportunity employer and affords equal opportunity to all applicants for all positions without regard to race, color, religion, sex, national origin, disability status, protected veteran status, or any other characteristic protected by law."
