"ID","Title","Link","Company","Location","Remote","Experience","EmploymentType","DatePosted","RoleDescription"
2494554,"User Researcher","https://careers.roblox.com/jobs/6628405?gh_jid=6628405","Roblox","San Mateo","No",3,"Full time","2025-03-01T16:45:25.701253Z","Every day, tens of millions of people come to Roblox to explore, create, play, learn, and connect with friends in 3D immersive digital experiences all created by our global community of developers and creators.
At Roblox, were building the tools and platform that empower our community to bring any experience that they can imagine to life. Our vision is to reimagine the way people come together, from anywhere in the world, and on any device. Were on a mission to connect a billion people with optimism and civility, and looking for amazing talent to help us get there.
A career at Roblox means youll be working to shape the future of human interaction, solving unique technical challenges at scale, and helping to create safer, more civil shared experiences for everyone.You will focus on conducting generative and evaluative research centered on ensuring users and developers can play and create in a safe and civil environment. You will help answer questions to inform feature development from account creation to reporting abusive behavior. Youll also ensure we offer a seamless experience across user journeys and recommendations conform to Robloxs design system.
You will research how Roblox can retain and grow confidence in our platform as an industry leader in Trust &amp; Safety, informing product solutions to address the constantly evolving US and Global policy landscape.
You will:

Deeply understand the user experiences for a diverse global audience through seamless cross-product journeys, engaging learning experiences, and delightful interactions that align with our mission.
Manage end-to-end research projects with an ability to translate abstract ideas into viable product feature recommendations.
Conduct foundational research to understand and improve the safety and security of millions of players
Work with cross-functional (XFN) stakeholders in Design, Product, Policy, Legal, Engineering and Civility to facilitate research discussions, and give concise feedback to inform feature roadmaps and product vision
Work in close collaboration with the XFN to evolve research processes and foster a culture of inclusion, collaboration and innovation.
Have opportunities to present your work to Product Group leadership.
Report to the Director of UX Research.

You have:

3+ years of professional career experience as a UX or product researcher.
A Bachelor's, Master's or PhD in HCI, psychology, marketing research, sociology, anthropology, or other social science field with an emphasis on research, or equivalent work experience.
Knowledge about a variety of research methods. Is comfortable with both qualitative and quantitative methodology and can identify the correct methodology for the question at hand. Preferably has experience using software vendors like Qualtrics, database analysis with SQL and can conduct statistical analyses in SPSS, R or Python.
Engaged in collaboration and sharing work frequently, inviting feedback from peers and manager or supervisor
Solutions and a tuned thought process that ensure research will adequately answer questions and even challenge if the questions being asked are the right ones.
The ability to articulate and research findings clearly through verbal, written, and visual communication.
For roles that are based at our headquarters in San Mateo, CA: The starting base pay for this position is as shown below. The actual base pay is dependent upon a variety of job-related factors such as professional background, training, work experience, location, business needs and market demand. Therefore, in some circumstances, the actual salary could fall outside of this expected range. This pay range is subject to change and may be modified in the future. All full-time employees are also eligible for equity compensation and for benefits.Annual Salary Range$156,130$189,450 USDRoles that are based in our San Mateo, CA Headquarters are in-office Tuesday, Wednesday, and Thursday, with optional in-office on Monday and Friday (unless otherwise noted).
Youll Love:

Industry-leading compensation package
Excellent medical, dental, and vision coverage
A rewarding 401k program
Flexible vacation policy (varies by exemption status)
Roflex - Flexible and supportive work policy
Roblox Admin badge for your avatar
At Roblox HQ:

Free catered lunches five times a week and several fully stocked kitchens with unlimited snacks
Onsite fitness center and fitness program credit
Annual CalTrain Go Pass


Roblox provides equal employment opportunities to all employees and applicants for employment and prohibits discrimination and harassment of any type without regard to race, color, religion, age, sex, national origin, disability status, genetics, protected veteran status, sexual orientation, gender identity or expression, or any other characteristic protected by federal, state or local laws. Roblox also provides reasonable accommodations for all candidates during the interview process."
2494553,"Critical Harms Instructional Designer","https://careers.roblox.com/jobs/6658939?gh_jid=6658939","Roblox","San Mateo","No",5,"Full time","2025-03-01T16:45:25.701276Z","Every day, tens of millions of people come to Roblox to explore, create, play, learn, and connect with friends in 3D immersive digital experiences all created by our global community of developers and creators.
At Roblox, were building the tools and platform that empower our community to bring any experience that they can imagine to life. Our vision is to reimagine the way people come together, from anywhere in the world, and on any device. Were on a mission to connect a billion people with optimism and civility, and looking for amazing talent to help us get there.
A career at Roblox means youll be working to shape the future of human interaction, solving unique technical challenges at scale, and helping to create safer, more civil shared experiences for everyone.Reporting to the Manager - Moderator Performance, the Instructional Designers responsibilities include providing course design support to create engaging learning environments that are informed by desired learning outcomes. This includes liaising with subject experts, outlining objectives, and providing feasible timeframes.
To be successful as an Instructional Designer, you should understand how to use business partners to redesign courses, develop new courses or curricula, and create classroom and on-demand training materials. This role will focus on supporting our Critical Harms teams, who focus on the highest risk critical issues. You will implement learning interventions across broad geographies and multifaceted disciplines. Your learning interventions must produce real-world results for our Trust and Safety Operations team and support vendors. To be successful, you will have strong project management abilities and excellent technical writing and research skills.
Please Note: This role may review graphic, controversial, and sometimes offensive content in line with Robloxs content moderation practices.
You Will:

Take ownership of the full curriculum lifecycle, including development &amp; implementation, gathering feedback, monitoring/evaluating, measuring impact, and managing changes.
Consult with partners and subject matter experts to determine when a learning intervention is and IS NOT necessary.
Leverage and iterate shared frameworks to deliver ILT courses, facilitator guides, Train the Trainer guides, resource packs, supporting documentation, eLearns, and other scaled learning interventions.
Build new learning resources to maximize content retention and understanding.
Use the most up-to-date practices to measure training effectiveness, both for the learner and the business.

You Have:

5+ years of proven experience in Instructional Design.
5+ years of demonstrated experience building learning materials for a scaling, globally distributed, workforce - preference for experience with an operations team.
Experience in Trust &amp; Safety, Content Moderation, and/or Critical Harms topics (child endangerment, suicide and self harm, terrorism and violent extremism, etc.)
Experience with modern learning tools (Captivate, Articulate, LMS, Adobe Suite, etc.).
The ability to build learning interventions end-to-end (from needs analysis to measurement).
Familiarity with curriculum management best practices (measurement, audits, change management, etc.).
Degree or equivalent experience in Education or a related discipline.
For roles that are based at our headquarters in San Mateo, CA: The starting base pay for this position is as shown below. The actual base pay is dependent upon a variety of job-related factors such as professional background, training, work experience, location, business needs and market demand. Therefore, in some circumstances, the actual salary could fall outside of this expected range. This pay range is subject to change and may be modified in the future. All full-time employees are also eligible for equity compensation and for benefits.Annual Salary Range$158,820$201,920 USDRoles that are based in our San Mateo, CA Headquarters are in-office Tuesday, Wednesday, and Thursday, with optional in-office on Monday and Friday (unless otherwise noted).
Youll Love:

Industry-leading compensation package
Excellent medical, dental, and vision coverage
A rewarding 401k program
Flexible vacation policy (varies by exemption status)
Roflex - Flexible and supportive work policy
Roblox Admin badge for your avatar
At Roblox HQ:

Free catered lunches five times a week and several fully stocked kitchens with unlimited snacks
Onsite fitness center and fitness program credit
Annual CalTrain Go Pass


Roblox provides equal employment opportunities to all employees and applicants for employment and prohibits discrimination and harassment of any type without regard to race, color, religion, age, sex, national origin, disability status, genetics, protected veteran status, sexual orientation, gender identity or expression, or any other characteristic protected by federal, state or local laws. Roblox also provides reasonable accommodations for all candidates during the interview process."
2492908,"Sr. Program Manager, Support Operations","https://careers.roblox.com/jobs/6654874?gh_jid=6654874","Roblox","San Mateo","No",7,"Full time","2025-03-01T16:45:25.701303Z","Every day, tens of millions of people come to Roblox to explore, create, play, learn, and connect with friends in 3D immersive digital experiences all created by our global community of developers and creators.
At Roblox, were building the tools and platform that empower our community to bring any experience that they can imagine to life. Our vision is to reimagine the way people come together, from anywhere in the world, and on any device. Were on a mission to connect a billion people with optimism and civility, and looking for amazing talent to help us get there.
A career at Roblox means youll be working to shape the future of human interaction, solving unique technical challenges at scale, and helping to create safer, more civil shared experiences for everyone.We're building the future of entertainment, and our Support Operations team plays a crucial role in ensuring a positive experience for our growing community. We're looking for an experienced Program Manager to join our Support Operations team and drive new Support programs to transform the way we service all our users at Roblox. You will report to the Senior Director of Support Operations and work across teams at Roblox to make a step-change in the support experience for all users. This role is pivotal in scaling our support ecosystem to meet the needs of our fast expanding user base. The ideal candidate for this role is a self starter, creative, with the ability to lead multiple initiatives at once. We are looking for someone who is enthusiastic about what we are building at Roblox and who is excited to build world-class support programs.
You Will:

Help develop strategy, define program objectives, timelines, and success metrics. Develop detailed project plans and manage execution to achieve desired outcomes. Allocate resources effectively and track progress against goals.
Collaborate with Product, Engineering, Vendor Operations, Finance, Data Science, Developer Relations, and other teams to ensure alignment and seamless execution. Facilitate communication and drive consensus among stakeholders.
Identify and manage dependencies between projects to ensure smooth execution and avoid roadblocks.
Proactively identify, assess, and mitigate potential risks to program success. Develop contingency plans and escalate issues as needed.
Develop and implement change management plans to minimize disruption and ensure smooth transitions for users and internal teams.
Provide regular updates on program status, risks, and issues to stakeholders. Prepare reports and presentations to communicate progress and key learnings.

You Have:

7+ years of program management experience in a fast-paced technology environment.
Proven ability to lead and deliver complex, cross-functional programs at senior levels.
Strong understanding of support operations and customer experience.
Excellent communication, interpersonal, and stakeholder management skills.
Ability to thrive in a dynamic and fast-paced environment.
Experience with user segmentation and personalization support strategies.
Familiarity with help center technologies, chatbot, automation, and support tools.
Experience working with online communities.
For roles that are based at our headquarters in San Mateo, CA: The starting base pay for this position is as shown below. The actual base pay is dependent upon a variety of job-related factors such as professional background, training, work experience, location, business needs and market demand. Therefore, in some circumstances, the actual salary could fall outside of this expected range. This pay range is subject to change and may be modified in the future. All full-time employees are also eligible for equity compensation and for benefits.Annual Salary Range$170,685$203,407 USDRoles that are based in our San Mateo, CA Headquarters are in-office Tuesday, Wednesday, and Thursday, with optional in-office on Monday and Friday (unless otherwise noted).
Youll Love:

Industry-leading compensation package
Excellent medical, dental, and vision coverage
A rewarding 401k program
Flexible vacation policy (varies by exemption status)
Roflex - Flexible and supportive work policy
Roblox Admin badge for your avatar
At Roblox HQ:

Free catered lunches five times a week and several fully stocked kitchens with unlimited snacks
Onsite fitness center and fitness program credit
Annual CalTrain Go Pass


Roblox provides equal employment opportunities to all employees and applicants for employment and prohibits discrimination and harassment of any type without regard to race, color, religion, age, sex, national origin, disability status, genetics, protected veteran status, sexual orientation, gender identity or expression, or any other characteristic protected by federal, state or local laws. Roblox also provides reasonable accommodations for all candidates during the interview process."
1525734,"Principal Software Engineer - Input & Control","https://careers.roblox.com/jobs/6202182?gh_jid=6202182","Roblox","San Mateo","No",8,"Full time","2025-03-01T16:45:25.701336Z","Every day, tens of millions of people come to Roblox to explore, create, play, learn, and connect with friends in 3D immersive digital experiences all created by our global community of developers and creators.
At Roblox, were building the tools and platform that empower our community to bring any experience that they can imagine to life. Our vision is to reimagine the way people come together, from anywhere in the world, and on any device. Were on a mission to connect a billion people with optimism and civility, and looking for amazing talent to help us get there.
A career at Roblox means youll be working to shape the future of human interaction, solving unique technical challenges at scale, and helping to create safer, more civil shared experiences for everyone.We are seeking a highly skilled and experienced Principal Software Engineer to join our Input &amp; Controls team. In this role, you will be responsible for leading the development of innovative features, from inception through to final release. No matter the platform, be it mobile or desktop, VR or consoles, you will help enable our game developers to create engaging experiences with the Roblox community using cutting-edge technology. You will leverage your technical expertise to guide your team and collaborate with cross-functional groups to deliver next-level features to production.You Will: Report directly into the senior engineering manager Develop and maintain code that powers all gameplay systems on RobloxCreate visionary systems to simplify creation of gameplay systems, while simultaneously driving efforts to deepen the interactive experience on RobloxWork closely with our game developer community to help achieve their creative visionHave fun learning about what makes Roblox an amazing platform and place to work, while supplying to industry leading technologiesYou have:8+ years of professional development experienceFluent programming skills in C++ and Lua Worked extensively in areas like Gameplay Programming and Game Engines, Input and Player controls.Designs solutions that can be intuitively understood by developers of varying fields, such as engineers, game designers, and UI designersSystems level 3D math, pointers, templates, and raw blocks of memory are tools to write high-performance code, not your enemiesWorked on cross platform projects, including consoles or mobile devices.Detailed designs, rigorous in handling edge cases, and diligent in automated testingFor roles that are based at our headquarters in San Mateo, CA: The starting base pay for this position is as shown below. The actual base pay is dependent upon a variety of job-related factors such as professional background, training, work experience, location, business needs and market demand. Therefore, in some circumstances, the actual salary could fall outside of this expected range. This pay range is subject to change and may be modified in the future. All full-time employees are also eligible for equity compensation and for benefits.Annual Salary Range$315,850$383,910 USDRoles that are based in our San Mateo, CA Headquarters are in-office Tuesday, Wednesday, and Thursday, with optional in-office on Monday and Friday (unless otherwise noted).
Youll Love:

Industry-leading compensation package
Excellent medical, dental, and vision coverage
A rewarding 401k program
Flexible vacation policy (varies by exemption status)
Roflex - Flexible and supportive work policy
Roblox Admin badge for your avatar
At Roblox HQ:

Free catered lunches five times a week and several fully stocked kitchens with unlimited snacks
Onsite fitness center and fitness program credit
Annual CalTrain Go Pass


Roblox provides equal employment opportunities to all employees and applicants for employment and prohibits discrimination and harassment of any type without regard to race, color, religion, age, sex, national origin, disability status, genetics, protected veteran status, sexual orientation, gender identity or expression, or any other characteristic protected by federal, state or local laws. Roblox also provides reasonable accommodations for all candidates during the interview process."
2488257,"[Summer 2025] Developer Relations, Partnerships Intern","https://careers.roblox.com/jobs/6653914?gh_jid=6653914","Roblox","San Mateo","No","Not specified","Internship","2025-03-01T16:45:25.701364Z","Every day, tens of millions of people come to Roblox to explore, create, play, learn, and connect with friends in 3D immersive digital experiences all created by our global community of developers and creators.
At Roblox, were building the tools and platform that empower our community to bring any experience that they can imagine to life. Our vision is to reimagine the way people come together, from anywhere in the world, and on any device. Were on a mission to connect a billion people with optimism and civility, and looking for amazing talent to help us get there.
A career at Roblox means youll be working to shape the future of human interaction, solving unique technical challenges at scale, and helping to create safer, more civil shared experiences for everyone.The Developer Relations, Partnerships Intern position is a part of our Roblox 12-week summer internship program located in San Mateo, CA. As a Partnerships Intern, you will work alongside the Developer Relations and Top Accounts teams to build a thriving community on Roblox, fueling creator success by discovering emerging trends and pioneering new opportunities on the platform.
You Will:

Foster and manage relationships within the creator community.
Identify opportunities for developers to identify brand opportunities on the platform.
Cultivate and facilitate a network of developers interested in brand partnerships.
Collaborate cross-functionally with our Brand Partnerships team to facilitate brand integrations.
Gather relevant analytics and data, communicating results and project outcomes to internal stakeholders and leaders.

You Have:

Pursuing an undergraduate/graduate degree in Game Design, Game Development, or related focus.
Detail-oriented with strong organizational skills and strong verbal/written communication skills.
Knowledgeable around the developer ecosystem and how to effectively engage with creators.
Excited to build and foster relationships and networks.
Passionate about Roblox and our developer communities

Please note the Company may not be able to employ candidates for this role who have United States work authorization related to certain U.S. visa categories, or support future H-1B sponsorship at this time.For roles that are based at our headquarters in San Mateo, CA: The starting base pay for this position is as shown below. The actual base pay is dependent upon a variety of job-related factors such as professional background, training, work experience, location, business needs and market demand. Therefore, in some circumstances, the actual hourly rate could fall outside of this expected range. This pay range is subject to change and may be modified in the future. Please note that not all benefits shown below are applicable to internship opportunities.Hourly Pay Range$35$35 USDRoles that are based in our San Mateo, CA Headquarters are in-office Tuesday, Wednesday, and Thursday, with optional in-office on Monday and Friday (unless otherwise noted).
Youll Love:

Industry-leading compensation package
Excellent medical, dental, and vision coverage
A rewarding 401k program
Flexible vacation policy (varies by exemption status)
Roflex - Flexible and supportive work policy
Roblox Admin badge for your avatar
At Roblox HQ:

Free catered lunches five times a week and several fully stocked kitchens with unlimited snacks
Onsite fitness center and fitness program credit
Annual CalTrain Go Pass


Roblox provides equal employment opportunities to all employees and applicants for employment and prohibits discrimination and harassment of any type without regard to race, color, religion, age, sex, national origin, disability status, genetics, protected veteran status, sexual orientation, gender identity or expression, or any other characteristic protected by federal, state or local laws. Roblox also provides reasonable accommodations for all candidates during the interview process."
