"ID","Title","Link","Company","Location","Remote","Experience","EmploymentType","DatePosted","RoleDescription"
2518492,"Workplace Services Technician","https://careers.roblox.com/jobs/6669948?gh_jid=6669948","Roblox","San Mateo","No",8,"Full time","2025-03-01T16:45:25.700887Z","Every day, tens of millions of people come to Roblox to explore, create, play, learn, and connect with friends in 3D immersive digital experiences all created by our global community of developers and creators.
At Roblox, were building the tools and platform that empower our community to bring any experience that they can imagine to life. Our vision is to reimagine the way people come together, from anywhere in the world, and on any device. Were on a mission to connect a billion people with optimism and civility, and looking for amazing talent to help us get there.
A career at Roblox means youll be working to shape the future of human interaction, solving unique technical challenges at scale, and helping to create safer, more civil shared experiences for everyone.Reporting to the Director, Facilities, the Workplace Services Tech, will be primary in maintaining Roblox San Mateo offices. You will be a key piece in crafting an outstanding employee experience for all Robloxians by being customer oriented, proactive in maintenance and operational needs, and work successfully across multiple teams in-person and using communication tools such as email and slack.
Role is based in San Mateo, CA On-site/Monday - Friday (Nights and Weekends on a rotational basis): 7:30am - 4.30pm
You have:

8+ years experience in Facilities Operations
Must be productive and effective with minimal direction
Ability to prioritize responsibilities and multi-tasking in a fast-paced, constantly evolving, multifaceted environment
Deep experience working with customers and provide the personalized service
Working knowledge of hand tools with ability to use effectively
Aptitude to utilize computers, apps/software tools, or other relevant/required technology as needed to perform and communicate in the role
You are resourceful, exhibit patience under pressure, and know youre capable of finding solutions
You are a strong communicator and self-starter
Exceptional time management and organizational skills.
Familiarity working with Google Suite

You Will

Troubleshoot and/or repair common issues pertaining to cabinetry, millwork, laminates, plumbing fixtures, and interior building finishes (paint and patch)
Interact and communicate with property management and engineers
Assemble/install/repair furniture, fixtures and equipment
Move, arrange and transport furniture, equipment and materials
Supervise installer and move vendors
Respond to and address Site Services ticket requests
Conduct inspections of facilities to identify maintenance issues including, but not limited to safety hazard
Support vendor site visits
Processes maintenance related work orders and maintains a schedule of planned maintenance projects
Installs signs and whiteboards in select spaces as advised
Support setup/breakdown of onsite events, meetings, training, etc.
Setup of new employee workstations, including office relocations (moves adds changes)
Ensure appropriate inventory levels for maintenance/office supplies
Member of the Emergency Response Team (ERT) to assist with building emergencies
Keeps storage facilities and equipment in an orderly, working condition
Duties may require work during evenings and weekends.
Other duties as assigned
For roles that are based at our headquarters in San Mateo, CA: The starting base pay for this position is as shown below. The actual base pay is dependent upon a variety of job-related factors such as professional background, training, work experience, location, business needs and market demand. Therefore, in some circumstances, the actual salary could fall outside of this expected range. This pay range is subject to change and may be modified in the future. All full-time employees are also eligible for equity compensation and for benefits.Annual Salary Range$115,460$142,770 USDRoles that are based in our San Mateo, CA Headquarters are in-office Tuesday, Wednesday, and Thursday, with optional in-office on Monday and Friday (unless otherwise noted).
Youll Love:

Industry-leading compensation package
Excellent medical, dental, and vision coverage
A rewarding 401k program
Flexible vacation policy (varies by exemption status)
Roflex - Flexible and supportive work policy
Roblox Admin badge for your avatar
At Roblox HQ:

Free catered lunches five times a week and several fully stocked kitchens with unlimited snacks
Onsite fitness center and fitness program credit
Annual CalTrain Go Pass


Roblox provides equal employment opportunities to all employees and applicants for employment and prohibits discrimination and harassment of any type without regard to race, color, religion, age, sex, national origin, disability status, genetics, protected veteran status, sexual orientation, gender identity or expression, or any other characteristic protected by federal, state or local laws. Roblox also provides reasonable accommodations for all candidates during the interview process."
2518491,"Senior Product Designer, Social","https://careers.roblox.com/jobs/6652105?gh_jid=6652105","Roblox","San Mateo","No",5,"Full time","2025-03-01T16:45:25.701044Z","Every day, tens of millions of people come to Roblox to explore, create, play, learn, and connect with friends in 3D immersive digital experiences all created by our global community of developers and creators.
At Roblox, were building the tools and platform that empower our community to bring any experience that they can imagine to life. Our vision is to reimagine the way people come together, from anywhere in the world, and on any device. Were on a mission to connect a billion people with optimism and civility, and looking for amazing talent to help us get there.
A career at Roblox means youll be working to shape the future of human interaction, solving unique technical challenges at scale, and helping to create safer, more civil shared experiences for everyone.As a Product Designer on the Social Community Platform team, youll play a pivotal role in shaping how millions of users connect, collaborate, and build lasting relationships on Roblox. Youll design and develop end-to-end experiences for Roblox Forums, Groups, and Guilded, ensuring that our community tools empower players, creators, and brands to engage in meaningful ways.
Working closely with product, research, data science, and engineering teams, youll define community-first experiences across mobile, desktop, 10ft interfaces, VR wearables, and beyond. Youll drive UX strategy, influence the roadmap, and contribute to design patterns that make Roblox the best place for communities to thrive.
This is a high-visibility, high-impact role where your work will shape how players build friendships, form groups, and participate in discussions across the platform. Your designs will strengthen community bonds, foster deeper engagement, and enhance social discovery at a time of rapid growth for Roblox.
You Will:

Be the go-to designer for Robloxs Community Platform, defining UX strategy and collaborating on the roadmap for Forums, Groups, and Guilded.
Develop a deep understanding of community-building dynamics, including user needs, behaviors, and motivations.
Design end-to-end experiences that make it easy for users to form and manage groups, participate in discussions, and build vibrant online communities.
Optimize community engagement tools by enhancing social discovery, reputation systems, moderation features, and user-generated content interactions.
Deeply care about craft by creating visually compelling and intuitive user interfaces across devices and surfaces for a global audience.
Collaborate with the Foundation Design Systems team and co-develop new patterns and UI components to ensure consistency and scalability.
Understand the role of younger players, teen and adult players, brands, creators and studios to create a community strategy that serves all audiences.
Understand and communicate with your design work how to engage users and build deep online friendships and connections
Optimize user flows, connection opportunities and the social graph to enhance and deepen community on Roblox
Implement data-driven improvements by analyzing user feedback to discover struggles and challenges.
Provide mentorship and guidance to junior designers, fostering a collaborative and innovative design culture.
Collaborate effectively with cross-functional teams, influencing and aligning design decisions.
Partner with engineering by providing high-quality design specs and partner on implementation to deliver a high-quality, high-craft experience
Present design journeys and strategies at the team level

You Have:

Bachelor's degree or equivalent experience in Product Design, User Experience Design, Fine Arts, Graphic Design, or a related field.
Proven experience (5+ years) in UX/UI design, with a proven track record of delivery innovative consumer social community experiences
Strong portfolio showcasing exceptional visual design skills and user-centered design thinking.
Proficiency in design tools such as Figma, Adobe Creative Suite, Blender, Maya or similar software.
End to End systems thinking that supports complete and connected user experiences
Proficient in user-centered design principles and standard methodologies.
Expert knowledge of community and communication design patterns and familiarity with e-commerce, 3D Avatars and gaming experiences.
Proactive problem solving and project management skills, with the ability to lead and inspire a design team.
Investigative and inquisitive about product goals from both a company's and user's perspective, promoting a learning culture both within the Product Design team and the larger Roblox organization.
A persuasive storyteller with excellent communication and presentation skills, able to effectively communicate design concepts and reasoning to collaborators.
Collaborative approach with the ability to work cross-functionally and influence design decisions.
Deep understanding and passion for the gaming industry, especially user-generated content platforms like Roblox. Keen interest in user experience trends, industry advancements, and emerging technologies.
Ability to balance business objectives, user needs, and technical constraints in design solutions.
Motivated and always expanding your skills by looking for new tools and techniques.
For roles that are based at our headquarters in San Mateo, CA: The starting base pay for this position is as shown below. The actual base pay is dependent upon a variety of job-related factors such as professional background, training, work experience, location, business needs and market demand. Therefore, in some circumstances, the actual salary could fall outside of this expected range. This pay range is subject to change and may be modified in the future. All full-time employees are also eligible for equity compensation and for benefits.Annual Salary Range$250,710$298,590 USDRoles that are based in our San Mateo, CA Headquarters are in-office Tuesday, Wednesday, and Thursday, with optional in-office on Monday and Friday (unless otherwise noted).
Youll Love:

Industry-leading compensation package
Excellent medical, dental, and vision coverage
A rewarding 401k program
Flexible vacation policy (varies by exemption status)
Roflex - Flexible and supportive work policy
Roblox Admin badge for your avatar
At Roblox HQ:

Free catered lunches five times a week and several fully stocked kitchens with unlimited snacks
Onsite fitness center and fitness program credit
Annual CalTrain Go Pass


Roblox provides equal employment opportunities to all employees and applicants for employment and prohibits discrimination and harassment of any type without regard to race, color, religion, age, sex, national origin, disability status, genetics, protected veteran status, sexual orientation, gender identity or expression, or any other characteristic protected by federal, state or local laws. Roblox also provides reasonable accommodations for all candidates during the interview process."
2518490,"Senior Frontend Web Engineer, Marketing","https://careers.roblox.com/jobs/6658444?gh_jid=6658444","Roblox","San Mateo","No",5,"Full time","2025-03-01T16:45:25.701071Z","Every day, tens of millions of people come to Roblox to explore, create, play, learn, and connect with friends in 3D immersive digital experiences all created by our global community of developers and creators.
At Roblox, were building the tools and platform that empower our community to bring any experience that they can imagine to life. Our vision is to reimagine the way people come together, from anywhere in the world, and on any device. Were on a mission to connect a billion people with optimism and civility, and looking for amazing talent to help us get there.
A career at Roblox means youll be working to shape the future of human interaction, solving unique technical challenges at scale, and helping to create safer, more civil shared experiences for everyone.Roblox's web engineering team is at the heart of our Marketing, Brands, Education, and Safety initiatives. We're currently undertaking a major transformation of our website to rethink how we engage with our creators, approach prospective brands, and share our accomplishments. This involves an overhaul of both our web presence and marketing strategy.
We're a highly collaborative team of engineers, product managers, designers, and marketers seeking an experienced engineer to guide us on this journey.
As a Frontend Engineer, you will support:

corp.roblox.com
research.roblox.com
careers.roblox.com
brands.roblox.com
civility.roblox.com
education.roblox.com

You will:

Develop and Deploy Features: Define and deliver a cutting-edge web platform that empowers the creation of engaging, interactive, and impactful web pages.
Technical Strategy &amp; Execution: Lead the technical strategy for the web platform, focusing on performance, availability, reliability, accessibility, user experience, and development velocity. Actively contribute to implementing this strategy.
Cross-functional Collaboration: Work closely with Marketing, Design, and Product teams to define strategy, roadmap, and timelines.
Team Development: Onboard new team members and cultivate a culture of technical excellence.
Frontend Platform Advocacy: Represent the needs of the web team within broader frontend platform initiatives related to build, deploy, and monitoring processes.

You have:

Web Development Expertise: Deep understanding of both static and server-side website architectures and technologies.
CMS-driven Platform Development: Extensive experience leading the development of robust web platforms powered by Content Management Systems.
Modern UI Frameworks: Proficiency with at least one modern framework like Angular, React, or Vue.js.
Marketing Technology Stack: Experience working with tools like Google Analytics, Marketo, and Segment or other similar technologies.
Cloud Infrastructure: Proficient in cloud platforms like AWS or similar.
Technical SEO: Understanding of technical SEO principles and optimization techniques.
Proven Leadership &amp; Collaboration: Prior Tech Lead experience with a strong track record of collaboration with Engineering Managers, Product Managers, and other stakeholders.
Mentorship &amp; Coaching: Experience in coaching and mentoring mid-level and senior engineers.
For roles that are based at our headquarters in San Mateo, CA: The starting base pay for this position is as shown below. The actual base pay is dependent upon a variety of job-related factors such as professional background, training, work experience, location, business needs and market demand. Therefore, in some circumstances, the actual salary could fall outside of this expected range. This pay range is subject to change and may be modified in the future. All full-time employees are also eligible for equity compensation and for benefits.Annual Salary Range$207,450$271,910 USDRoles that are based in our San Mateo, CA Headquarters are in-office Tuesday, Wednesday, and Thursday, with optional in-office on Monday and Friday (unless otherwise noted).
Youll Love:

Industry-leading compensation package
Excellent medical, dental, and vision coverage
A rewarding 401k program
Flexible vacation policy (varies by exemption status)
Roflex - Flexible and supportive work policy
Roblox Admin badge for your avatar
At Roblox HQ:

Free catered lunches five times a week and several fully stocked kitchens with unlimited snacks
Onsite fitness center and fitness program credit
Annual CalTrain Go Pass


Roblox provides equal employment opportunities to all employees and applicants for employment and prohibits discrimination and harassment of any type without regard to race, color, religion, age, sex, national origin, disability status, genetics, protected veteran status, sexual orientation, gender identity or expression, or any other characteristic protected by federal, state or local laws. Roblox also provides reasonable accommodations for all candidates during the interview process."
2510134,"Senior Software Engineer - Matchmaking","https://careers.roblox.com/jobs/6667403?gh_jid=6667403","Roblox","San Mateo","No",4,"Full time","2025-03-01T16:45:25.701094Z","Every day, tens of millions of people come to Roblox to explore, create, play, learn, and connect with friends in 3D immersive digital experiences all created by our global community of developers and creators.
At Roblox, were building the tools and platform that empower our community to bring any experience that they can imagine to life. Our vision is to reimagine the way people come together, from anywhere in the world, and on any device. Were on a mission to connect a billion people with optimism and civility, and looking for amazing talent to help us get there.
A career at Roblox means youll be working to shape the future of human interaction, solving unique technical challenges at scale, and helping to create safer, more civil shared experiences for everyone.The Matchmaking team's mission is to:Provide the best player experience by choosing the best game possibleHandle game orchestration by ensuring performance across Roblox worldwide data centersAs a Senior Software Engineer with the Matchmaking team, you'll have the opportunity to build and own end-to-end mission-critical services within the Roblox ecosystem.Here are a few quick highlights of how we impact Roblox:Matchmaking Decisions - Selecting the best game server possible for every play request is a o(n2) problem. The system supports several millions of concurrent players.The game orchestration system handles games spread across data centers distributed all over the world, which are growing to support Roblox' terrific growth.You Will:Work on experimentation, data-driven projects and partner with data teammates to achieve the best player experience possible. You'll also work on the Matchmaking algorithm system to improve the quality of the matchmaking decision.Help create the next generation of the Matchmaking system, built to support up to 1B monthly active users.You Have:Experience architecting, designing, and developing a wide-array of software products.Experience building available distributed systems, and are familiar with NoSQL/NewSQL systems.Knowledge of REST, API design patterns, and scalable containerized systems and microservices.Knowledge of systems engineering is a plus.A Computer-Science graduate or MS graduate. 4+ years of experience.For roles that are based at our headquarters in San Mateo, CA: The starting base pay for this position is as shown below. The actual base pay is dependent upon a variety of job-related factors such as professional background, training, work experience, location, business needs and market demand. Therefore, in some circumstances, the actual salary could fall outside of this expected range. This pay range is subject to change and may be modified in the future. All full-time employees are also eligible for equity compensation and for benefits.Annual Salary Range$192,890$238,520 USDRoles that are based in our San Mateo, CA Headquarters are in-office Tuesday, Wednesday, and Thursday, with optional in-office on Monday and Friday (unless otherwise noted).
Youll Love:

Industry-leading compensation package
Excellent medical, dental, and vision coverage
A rewarding 401k program
Flexible vacation policy (varies by exemption status)
Roflex - Flexible and supportive work policy
Roblox Admin badge for your avatar
At Roblox HQ:

Free catered lunches five times a week and several fully stocked kitchens with unlimited snacks
Onsite fitness center and fitness program credit
Annual CalTrain Go Pass


Roblox provides equal employment opportunities to all employees and applicants for employment and prohibits discrimination and harassment of any type without regard to race, color, religion, age, sex, national origin, disability status, genetics, protected veteran status, sexual orientation, gender identity or expression, or any other characteristic protected by federal, state or local laws. Roblox also provides reasonable accommodations for all candidates during the interview process."
