"ID","Title","Link","Company","Location","Remote","Experience","EmploymentType","DatePosted","RoleDescription"
2471339,"Senior Product Manager, Roblox China","https://careers.roblox.com/jobs/6648551?gh_jid=6648551","Roblox","San Mateo","No",5,"Full time","2025-03-01T16:45:25.701653Z","Every day, tens of millions of people come to Roblox to explore, create, play, learn, and connect with friends in 3D immersive digital experiences all created by our global community of developers and creators.
At Roblox, were building the tools and platform that empower our community to bring any experience that they can imagine to life. Our vision is to reimagine the way people come together, from anywhere in the world, and on any device. Were on a mission to connect a billion people with optimism and civility, and looking for amazing talent to help us get there.
A career at Roblox means youll be working to shape the future of human interaction, solving unique technical challenges at scale, and helping to create safer, more civil shared experiences for everyone.Every day, tens of millions of people from around the world come to Roblox to play, learn, work, and socialize in immersive digital experiences created by the community.  In partnership with Tencent Holding Limited, Roblox is extending this experience to China, the biggest gaming market in the world.  This role will be instrumental in bringing about our success in the Chinese market, which is essential to Roblox achieving its goal of having 10% of the global video-game content revenue to flow through the platform.  We are a fast-paced, team with varied strengths with presence in Shenzhen (China) and San Mateo (US).
Our vision is to build a platform to connect billions of users with optimism and civility. This is whats known as the metaverse: a persistent space where anyone can do just about anything they can imagine, from anywhere in the world and on any device. The breadth of opportunities, and the evolving demands of this first-of-its-kind platform, ensure that your avenues for growth are always rapidly growing and flexible.
As a Senior Product Manager, youll be working with product teams across the company to land business and product objectives across the Roblox player and developer suite of products in China. You will serve as a strong customer advocate for this unique market, define and prioritize what is significant for our users, and influence &amp; orchestrate the creation of China-First platform capabilities. Come work with the most passionate, team-oriented, transformative, and crazy-smart people youll ever meet!This role is based in San Mateo, CA (no remote option) and reports to ""Head of International Product"".
You Will:

Focus on end-to-end critical user journeys and identify product gaps across groups and opportunities to build a better global product.
Distill customers and business requirements to formulate product opinions, and influence other product teams to incorporate them into roadmaps without direct authority.
Research and better understand local user pain points and help inform the rest of the company how to build a better global platform.
Work with a fast-paced multicultural team, across companies and time zones.
Have the opportunity to travel to the Roblox China office in Shenzhen.
Balance input from a wide variety of internal stakeholders and external partners with potentially competing priorities and timelines.
Work closely with product owners, engineers, designers and analysts to drive the planning and execution of complex product requirements.
Manage cross team dependencies, and coordinate cross-team initiatives and blocking issues.
Grow your career with an amazing company

You Are:

Fluent in technology, preferably consumer IT platforms, with a bachelors degree in Computer Science or equivalent experience.
A self-starter, with 5-7 years of experience in product management, in which you lead product development efforts that cut across multiple stakeholders and organizations. Experience building platforms and/or PMP or Six Sigma certified a plus.
Passionate about working across functional teams to land a strategy and influence others to work on a common goal.
Comfortable in navigating complexities and unknowns to help disambiguate and synthesize a holistic plan to drive execution.
An effective communicator with great language skills in English (listening, oral, and written) and Chinese Mandarin (listening, oral).
Open-minded and empathetic, with experience working across cross-geo and multicultural teams.
Dynamic and flexible, who creates opportunity out of uncertainty and ambiguity (e.g. changing requirements or incomplete data)
A problem solver, who approaches challenges with a logical and systematic framework
For roles that are based at our headquarters in San Mateo, CA: The starting base pay for this position is as shown below. The actual base pay is dependent upon a variety of job-related factors such as professional background, training, work experience, location, business needs and market demand. Therefore, in some circumstances, the actual salary could fall outside of this expected range. This pay range is subject to change and may be modified in the future. All full-time employees are also eligible for equity compensation and for benefits.Annual Salary Range$275,030$324,450 USDRoles that are based in our San Mateo, CA Headquarters are in-office Tuesday, Wednesday, and Thursday, with optional in-office on Monday and Friday (unless otherwise noted).
Youll Love:

Industry-leading compensation package
Excellent medical, dental, and vision coverage
A rewarding 401k program
Flexible vacation policy (varies by exemption status)
Roflex - Flexible and supportive work policy
Roblox Admin badge for your avatar
At Roblox HQ:

Free catered lunches five times a week and several fully stocked kitchens with unlimited snacks
Onsite fitness center and fitness program credit
Annual CalTrain Go Pass


Roblox provides equal employment opportunities to all employees and applicants for employment and prohibits discrimination and harassment of any type without regard to race, color, religion, age, sex, national origin, disability status, genetics, protected veteran status, sexual orientation, gender identity or expression, or any other characteristic protected by federal, state or local laws. Roblox also provides reasonable accommodations for all candidates during the interview process."
2315377,"Executive Assistant, Office of the CEO","https://careers.roblox.com/jobs/6567621?gh_jid=6567621","Roblox","San Mateo","No",5,"Full time","2025-03-01T16:45:25.701674Z","Every day, tens of millions of people come to Roblox to explore, create, play, learn, and connect with friends in 3D immersive digital experiences all created by our global community of developers and creators.
At Roblox, were building the tools and platform that empower our community to bring any experience that they can imagine to life. Our vision is to reimagine the way people come together, from anywhere in the world, and on any device. Were on a mission to connect a billion people with optimism and civility, and looking for amazing talent to help us get there.
A career at Roblox means youll be working to shape the future of human interaction, solving unique technical challenges at scale, and helping to create safer, more civil shared experiences for everyone.Do you thrive in a fast-paced environment where your contributions have a direct impact on a company's success? Are you a highly organized, proactive individual with an insatiable curiosity and a passion for supporting others? If so, this is an exciting opportunity to join the Office of the CEO team at Roblox! We're a team of collaborative, dynamic, and high-performing individuals who are passionate about our mission. This is a great opportunity to gain invaluable experience at the highest level, working alongside the Executive Business Partner to the CEO and Chief of Staff to make a real impact.You Will:Provide complex calendar assistance, demonstrating flexibility and proactive problem-solving to ensure seamless scheduling of meetings.Assist in coordination of domestic and international travel with meticulous attention to detail, including booking flights, accommodations, transportation, and itineraries.Assist in planning and execute a variety of internal and external events, offsites, and meetings, ensuring smooth logistics and a positive experience for attendees.Serve as a point of contact for corporate visits, welcoming external clients, partners, and candidates.Submit accurate and on time expense reports, purchase orders and invoices for payment.Provide support in creating, drafting and edits to presentations.Collaborate effectively with peers, colleagues, and cross-functional partners to support company-wide projects and goals.Maintain a high level of responsiveness in all communications, ensuring timely and accurate responses to inquiries. Assist with internal and external written communications, ensuring clarity and professionalism. Support project coordination and task management, including clear note taking.Proactively identify opportunities to improve efficiency within the Office of the CEO, conducting ongoing audits of the calendar and implementing solutions to optimize workflows.Maintain the highest level of confidentiality and discretion in handling sensitive information.Ensure continuity of support by providing coverage for the Executive Business Partner to the CEO during periods of absence.You Have:Minimum of 5 years of experience in an administrative or transferable role, demonstrating a proven track record of success in providing high-level support to executives.Exceptional organizational and time management skills, with the ability to prioritize tasks, manage multiple deadlines, and work independently.Excellent communication and interpersonal skills, both written and verbal, with the ability to build rapport with diverse individuals.Demonstrated ability to handle sensitive information with tact, professionalism, and the utmost discretion.Proactive problem-solving skills and the ability to anticipate needs and address challenges effectively.Adaptability and flexibility to thrive in a fast-paced environment with changing priorities.Proficiency in Google Suite and SlackFor roles that are based at our headquarters in San Mateo, CA: The starting base pay for this position is as shown below. The actual base pay is dependent upon a variety of job-related factors such as professional background, training, work experience, location, business needs and market demand. Therefore, in some circumstances, the actual salary could fall outside of this expected range. This pay range is subject to change and may be modified in the future. All full-time employees are also eligible for equity compensation and for benefits.Annual Salary Range$129,320$156,930 USDRoles that are based in our San Mateo, CA Headquarters are in-office Tuesday, Wednesday, and Thursday, with optional in-office on Monday and Friday (unless otherwise noted). Youll Love:

Industry-leading compensation package
Excellent medical, dental, and vision coverage
A rewarding 401k program
Flexible vacation policy (varies by exemption status)
Roflex - Flexible and supportive work policy
Roblox Admin badge for your avatar
At Roblox HQ:

Free catered lunches five times a week and several fully stocked kitchens with unlimited snacks
Onsite fitness center and fitness program credit
Annual CalTrain Go Pass


Roblox provides equal employment opportunities to all employees and applicants for employment and prohibits discrimination and harassment of any type without regard to race, color, religion, age, sex, national origin, disability status, genetics, protected veteran status, sexual orientation, gender identity or expression, or any other characteristic protected by federal, state or local laws. Roblox also provides reasonable accommodations for all candidates during the interview process."
2468221,"Principal Product Manager, Payments & Fraud","https://careers.roblox.com/jobs/6644894?gh_jid=6644894","Roblox","San Mateo","No",8,"Full time","2025-03-01T16:45:25.701696Z","Every day, tens of millions of people come to Roblox to explore, create, play, learn, and connect with friends in 3D immersive digital experiences all created by our global community of developers and creators.
At Roblox, were building the tools and platform that empower our community to bring any experience that they can imagine to life. Our vision is to reimagine the way people come together, from anywhere in the world, and on any device. Were on a mission to connect a billion people with optimism and civility, and looking for amazing talent to help us get there.
A career at Roblox means youll be working to shape the future of human interaction, solving unique technical challenges at scale, and helping to create safer, more civil shared experiences for everyone.As the Principal Product Manager for this group, you are the product leader owning payments, pricing and fraud systems supporting all of the revenue for the company.

You lead the long term strategy for payments, fraud prevention, and how users all over the world purchase on the platform. The scope of this role includes, but is not limited to, rapidly growing payments to new providers and platforms, international pricing and purchasing systems and optimization, and building extraordinary fraud and abuse defenses across the platform.
You are the lead for recurring revenue streams for Roblox which includes our Premium subscription offering and future such offerings.
You lead growth for gift cards business through innovative digital and physical offerings.
You drive innovation in ways in which creators can improve their earnings by making it easy and safe to transact on the platform. You lead the end to end experience of bringing Robux into the system and paying developers out.
You will handle payment and fraud operations leading a team of operators and analysts.

If you are an entrepreneurial product leader, who doesnt hesitate to propose ambitious ideas and put them into action, youll be a phenomenal fit. Roblox is an outstanding ecosystem. Fraud playbooks dont necessarily work here. The ideal candidate is hands-on, creative, data obsessed and has acute attention to detail.
This role is based in San Mateo, CA (no remote option) and reports to the Sr. Director Product, Monetization and Payments.
You Will:

Drive the product strategy and vision for an innovative Payments and Fraud platform on Roblox, leading the industry in defining ways in which users and developers can seamlessly transact on this platform.
Have full responsibility for developing features and capabilities to facilitate payments, and create a fabulous user experience for parents and users alike
Partner with other product, design, engineering and business partners at Roblox, and drive strategic alignment. Enroll other teams into your product vision and align roadmaps to ensure cohesive product functionality and value proposition.
Work closely with cross-functional partners to define scope, review technical capabilities, prioritize projects for release, and define new opportunities
Lead and facilitate brainstorming, then take these early ideas and iterate, experiment, and build
Balance and prioritize new features with existing backlog initiatives and align them with the product vision.
Represent payments and fraud team in executive reviews and company wide updates

You Have:

8-10 years of product management experience, with expertise in the payments, pricing and / or fraud space
A consistent track record of aligning teams and prioritizing features/resources to deliver an excellent product in monetization, payments, subscriptions or related fintech space
High-reaching drive: Worked in a fast paced environment, with ambitious priorities, through the product life cycle from planning, development, through to launch. Strong opinions and a willingness to make calls with limited information. A high degree of self-direction and a get stuff done demeanor.
Technical approach: delving into the product, platform and implementation details. Ability to engage with engineering to design scalable and extensible solutions.
Data-driven approach: Proficiency identifying, defining, tracking and acting upon metrics. Familiarity with experimentation and A/B testing methods. Experience identifying critical metrics and working with engineering and analytics on instrumentation and monitoring.
Strong written and verbal communication skills: Ability to convey strategies, priorities, and tradeoffs at the 30K foot level, as well as produce clear and detailed product and technical specification
For roles that are based at our headquarters in San Mateo, CA: The starting base pay for this position is as shown below. The actual base pay is dependent upon a variety of job-related factors such as professional background, training, work experience, location, business needs and market demand. Therefore, in some circumstances, the actual salary could fall outside of this expected range. This pay range is subject to change and may be modified in the future. All full-time employees are also eligible for equity compensation and for benefits.Annual Salary Range$324,450$375,590 USDRoles that are based in our San Mateo, CA Headquarters are in-office Tuesday, Wednesday, and Thursday, with optional in-office on Monday and Friday (unless otherwise noted).
Youll Love:

Industry-leading compensation package
Excellent medical, dental, and vision coverage
A rewarding 401k program
Flexible vacation policy (varies by exemption status)
Roflex - Flexible and supportive work policy
Roblox Admin badge for your avatar
At Roblox HQ:

Free catered lunches five times a week and several fully stocked kitchens with unlimited snacks
Onsite fitness center and fitness program credit
Annual CalTrain Go Pass


Roblox provides equal employment opportunities to all employees and applicants for employment and prohibits discrimination and harassment of any type without regard to race, color, religion, age, sex, national origin, disability status, genetics, protected veteran status, sexual orientation, gender identity or expression, or any other characteristic protected by federal, state or local laws. Roblox also provides reasonable accommodations for all candidates during the interview process."
2463223,"Senior Software Engineer - Content Understanding","https://careers.roblox.com/jobs/6647964?gh_jid=6647964","Roblox","San Mateo","No","Not specified","Full time","2025-03-01T16:45:25.701719Z","Every day, tens of millions of people come to Roblox to explore, create, play, learn, and connect with friends in 3D immersive digital experiences all created by our global community of developers and creators.
At Roblox, were building the tools and platform that empower our community to bring any experience that they can imagine to life. Our vision is to reimagine the way people come together, from anywhere in the world, and on any device. Were on a mission to connect a billion people with optimism and civility, and looking for amazing talent to help us get there.
A career at Roblox means youll be working to shape the future of human interaction, solving unique technical challenges at scale, and helping to create safer, more civil shared experiences for everyone.As a Senior Software Engineer within the Creator Organization, you will develop innovative full-stack solutions that define the future of Robloxs Content Understanding Platform. This platform processes billions of pieces of contentspanning 3D models, audio files, text, video, and entire experiencesextracting structured information about their meaning, context, and relationships. The Content Understanding Team develops cutting-edge AI models, advanced computer vision systems, and highly scalable backend platforms to power search, discovery, and moderation across Roblox. Your contributions will enable seamless asset discovery, automate moderation at scale, and drive transformative generative AI tools that reshape how millions of creators and users engage with Roblox.You Will:Solve full-stack challenges to improve how AI, creators, and users describe and get along with content, including images, 3D models, audio, text, and video.Craft and build scalable pipelines for training, evaluating, and deploying machine learning models to support content annotation and discovery.Develop robust backend systems to power real-time search, discovery, and powerful generative AI features.Blend innovation with practicality, applying the latest AI research to build impactful, production-ready solutions.Collaborate with engineers, product managers, and multi-functional teams to deliver bold technical projects.You Have:Strong programming skills in at least two languages (Python, C#, C++, Java) and a willingness to learn others as needed. Exposure to front end technologies and frameworks such as React or Angular.Practical experience crafting and scaling backend systems in cloud environments.Confirmed expertise across the stack, including backend development to deploying ML models in production environments.Familiarity with image or 3D object understanding, ideally within gaming or content creation industries.A get stuff done mentality with a readiness to solve challenges and take on tasks beyond your comfort zone to get results.A great foundation in computer vision, AI, or related fields.Bonus Points Experience with large-scale search systems, generative AI, or semantic content understanding.Experience with modern deep learning frameworks (e.g., PyTorch, TensorFlow) and end-to-end ML workflows.Knowledge of 3D geometry or asset workflows.Passion for empowering creators through innovative technology.For roles that are based at our headquarters in San Mateo, CA: The starting base pay for this position is as shown below. The actual base pay is dependent upon a variety of job-related factors such as professional background, training, work experience, location, business needs and market demand. Therefore, in some circumstances, the actual salary could fall outside of this expected range. This pay range is subject to change and may be modified in the future. All full-time employees are also eligible for equity compensation and for benefits.Annual Salary Range$192,890$238,520 USDFor roles that are based at our headquarters in San Mateo, CA: The starting base pay for this position is as shown below. The actual base pay is dependent upon a variety of job-related factors such as professional background, training, work experience, location, business needs and market demand. Therefore, in some circumstances, the actual hourly rate could fall outside of this expected range. This pay range is subject to change and may be modified in the future. Please note that not all benefits shown below are applicable to internship opportunities.Hourly Pay Range$1$1 USDRoles that are based in our San Mateo, CA Headquarters are in-office Tuesday, Wednesday, and Thursday, with optional in-office on Monday and Friday (unless otherwise noted). Youll Love:

Industry-leading compensation package
Excellent medical, dental, and vision coverage
A rewarding 401k program
Flexible vacation policy (varies by exemption status)
Roflex - Flexible and supportive work policy
Roblox Admin badge for your avatar
At Roblox HQ:

Free catered lunches five times a week and several fully stocked kitchens with unlimited snacks
Onsite fitness center and fitness program credit
Annual CalTrain Go Pass


Roblox provides equal employment opportunities to all employees and applicants for employment and prohibits discrimination and harassment of any type without regard to race, color, religion, age, sex, national origin, disability status, genetics, protected veteran status, sexual orientation, gender identity or expression, or any other characteristic protected by federal, state or local laws. Roblox also provides reasonable accommodations for all candidates during the interview process."
