"ID","Title","Link","Company","Location","Remote","Experience","EmploymentType","DatePosted","RoleDescription"
2992996,"Bauingenieur:in im Bereich Objekt- und Tragwerksplanung / Konstruktiver Ingenieurbau (Mensch*)","https://jobs.smartrecruiters.com/AFRY/744000060960653-bauingenieur-in-im-bereich-objekt-und-tragwerksplanung-konstruktiver-ingenieurbau-mensch-","Afry","Karlsruhe","No","Not specified","Full time","2025-05-23T02:01:35.534123Z","Du bist fr die Objekt- und/oder Tragwerksplanung im konstruktiven Ingenieurbau fr Anlagen der Verkehrsinfrastruktur in den Leistungsphasen 1-7 HOAI verantwortlichDie auftragskonforme, termingerechte, budget- und qualittsgerechte Durchfhrung von Planungsleistungen fr Baumanahmen des konstruktiven Ingenieurbaus gehrt ebenfalls zu Deinen AufgabenDu bist an der Koordination und Abstimmung mit internen und externen Projektbeteiligten beteiligtDie Qualittssicherung von Planungsleistungen des konstruktiven Ingenieurbaus runden Dein Profil abErfahrung:
Du besitzt ein erfolgreich abgeschlossenes Ingenieurstudium der Fachrichtung Bauingenieurwesen mit Vertiefung Konstruktiver Ingenieurbau. Du kannst erste Erfahrungen in der Objekt- und Tragwerksplanung von Verkehrsinfrastrukturprojekten nachweise.Fhigkeiten:
Idealerweise verfgst Du ber Kenntnisse in der 3D-Modellierung und BIM. Deutsch sprichst Du flieend, Englischkenntnisse liegen ebenfalls vor.Mindset:
Du bist Teamplayer und bringst ein hohes Ma an Engagement, Belastbarkeit und Flexibilitt mit.Du bist Teil spannender Projekte, die ihren Fokus auf Ressourcenschonung setzenDurch standortbergreifende Zusammenarbeit und vielfltige Netzwerkmglichkeiten, kannst Du Dein Wissen erweitern und von den Erfahrungen anderer profitierenBei uns kannst Du flexible Arbeitsbedingungen genieen, so sind Beruf und Privatleben optimal miteinander vereinbarWir bieten Dir eine individuelle Einarbeitung und ein angepasstes Buddy-Programm, damit Du Dich schnell in Deinem neuen Team zurechtfindestFr uns zhlt der Mensch als Ganzes. Deshalb bieten wir Dir ein umfassendes Gesundheitsprogramm an, welches Dich dabei untersttzt, fit und motiviert zu bleibenPasst nicht?
Die Stellenanzeige spricht Dich an, Du bist Dir allerdings nicht zu 100 % sicher, ob Dein Profil passt. Bewirb Dich trotzdem! Oder nutze die Chance zu einer Initiativbewerbung.So gehts weiter:Bewirb Dich direkt Online, indem Du auf den Apply now Button fr den fr Dich passenden Standort klickst. Hier gelangst Du in unser BewerberportalNutze fr weitere Fragen unsere direkten Ansprechpartner:innen aus unserem internen Recruiting-TeamNach Sichtung deiner Unterlagen und der Abstimmung mit dem zustndigen Fachbereich, melden wir uns schnellstmglich bei Dir zurckAnschlieend lernen wir uns per Microsoft-Teams oder direkt persnlich an einem unserer Standorte kennen und besprechen alle weiteren EinzelheitenDu mchtest Wechseln? Das bleibt unter uns!
Wir behandeln Deine Daten sowie Deine Bewerbung im gesamten Bewerbungsprozess streng vertraulich.Kontakt:
AFRY Deutschland GmbH
Frau Jennifer Morano
Senior Recruiterin | Human Resources
M: +49 172 981 1201Bei AFRY verwenden wir das geschftliche Du. Wir freuen uns daher auf Deine Ansprache in Du-Form.*Wir bei AFRY legen Wert auf Vielfalt - bei AFRY kannst Du Du sein. Fr uns spielt es keine Rolle, welches Geschlecht Du hast, wo Du herkommst, wie alt Du bist, ob Du eine Behinderung hast oder woran Du glaubst. Fr uns stehen gegenseitiger Respekt und Wertschtzung stets an oberster Stelle. Denn bei uns steht der Mensch im Mittelpunkt, um nachhaltige Lsungen fr die kommende Generation zu schaffen. Die Arbeit bei uns ist vielseitig und erfllend.MAKING FUTUREBei AFRY sorgen wir bei allem, was wir tun, fr Vernderungen. Denn Wandel entsteht nur, wenn mutige Ideen zusammenkommen. Wenn wir erfolgreich zusammenarbeiten, innovativ ttig sind und unterschiedliche Blickwinkel einnehmen. So gestalten wir die Zukunft. Wir sind aktiv auf der Suche nach qualifizierten Bewerberinnen und Bewerbern, die ein Teil unserer integrativen und vielfltigen Teams auf der ganzen Welt werden mchten. Schliee Dich uns an, um den bergang zu einer nachhaltigeren Zukunft zu beschleunigen."
2992995,"Bauingenieur:in im Bereich Objekt- und Tragwerksplanung / Konstruktiver Ingenieurbau (Mensch*)","https://jobs.smartrecruiters.com/AFRY/744000060963374-bauingenieur-in-im-bereich-objekt-und-tragwerksplanung-konstruktiver-ingenieurbau-mensch-","Afry","Cologne","No","Not specified","Full time","2025-05-23T02:01:35.534270Z","Du bist fr die Objekt- und/oder Tragwerksplanung im konstruktiven Ingenieurbau fr Anlagen der Verkehrsinfrastruktur in den Leistungsphasen 1-7 HOAI verantwortlichDie auftragskonforme, termingerechte, budget- und qualittsgerechte Durchfhrung von Planungsleistungen fr Baumanahmen des konstruktiven Ingenieurbaus gehrt ebenfalls zu Deinen AufgabenDu bist an der Koordination und Abstimmung mit internen und externen Projektbeteiligten beteiligtDie Qualittssicherung von Planungsleistungen des konstruktiven Ingenieurbaus runden Dein Profil abErfahrung:
Du besitzt ein erfolgreich abgeschlossenes Ingenieurstudium der Fachrichtung Bauingenieurwesen mit Vertiefung Konstruktiver Ingenieurbau. Du kannst erste Erfahrungen in der Objekt- und Tragwerksplanung von Verkehrsinfrastrukturprojekten nachweise.Fhigkeiten:
Idealerweise verfgst Du ber Kenntnisse in der 3D-Modellierung und BIM. Deutsch sprichst Du flieend, Englischkenntnisse liegen ebenfalls vor.Mindset:
Du bist Teamplayer und bringst ein hohes Ma an Engagement, Belastbarkeit und Flexibilitt mit.Du bist Teil spannender Projekte, die ihren Fokus auf Ressourcenschonung setzenDurch standortbergreifende Zusammenarbeit und vielfltige Netzwerkmglichkeiten, kannst Du Dein Wissen erweitern und von den Erfahrungen anderer profitierenBei uns kannst Du flexible Arbeitsbedingungen genieen, so sind Beruf und Privatleben optimal miteinander vereinbarWir bieten Dir eine individuelle Einarbeitung und ein angepasstes Buddy-Programm, damit Du Dich schnell in Deinem neuen Team zurechtfindestFr uns zhlt der Mensch als Ganzes. Deshalb bieten wir Dir ein umfassendes Gesundheitsprogramm an, welches Dich dabei untersttzt, fit und motiviert zu bleibenPasst nicht?
Die Stellenanzeige spricht Dich an, Du bist Dir allerdings nicht zu 100 % sicher, ob Dein Profil passt. Bewirb Dich trotzdem! Oder nutze die Chance zu einer Initiativbewerbung.So gehts weiter:Bewirb Dich direkt Online, indem Du auf den Apply now Button fr den fr Dich passenden Standort klickst. Hier gelangst Du in unser BewerberportalNutze fr weitere Fragen unsere direkten Ansprechpartner:innen aus unserem internen Recruiting-TeamNach Sichtung deiner Unterlagen und der Abstimmung mit dem zustndigen Fachbereich, melden wir uns schnellstmglich bei Dir zurckAnschlieend lernen wir uns per Microsoft-Teams oder direkt persnlich an einem unserer Standorte kennen und besprechen alle weiteren EinzelheitenDu mchtest Wechseln? Das bleibt unter uns!
Wir behandeln Deine Daten sowie Deine Bewerbung im gesamten Bewerbungsprozess streng vertraulich.Kontakt:
AFRY Deutschland GmbH
Frau Jennifer Morano
Senior Recruiterin | Human Resources
M: +49 172 981 1201Bei AFRY verwenden wir das geschftliche Du. Wir freuen uns daher auf Deine Ansprache in Du-Form.*Wir bei AFRY legen Wert auf Vielfalt - bei AFRY kannst Du Du sein. Fr uns spielt es keine Rolle, welches Geschlecht Du hast, wo Du herkommst, wie alt Du bist, ob Du eine Behinderung hast oder woran Du glaubst. Fr uns stehen gegenseitiger Respekt und Wertschtzung stets an oberster Stelle. Denn bei uns steht der Mensch im Mittelpunkt, um nachhaltige Lsungen fr die kommende Generation zu schaffen. Die Arbeit bei uns ist vielseitig und erfllend.MAKING FUTUREBei AFRY sorgen wir bei allem, was wir tun, fr Vernderungen. Denn Wandel entsteht nur, wenn mutige Ideen zusammenkommen. Wenn wir erfolgreich zusammenarbeiten, innovativ ttig sind und unterschiedliche Blickwinkel einnehmen. So gestalten wir die Zukunft. Wir sind aktiv auf der Suche nach qualifizierten Bewerberinnen und Bewerbern, die ein Teil unserer integrativen und vielfltigen Teams auf der ganzen Welt werden mchten. Schliee Dich uns an, um den bergang zu einer nachhaltigeren Zukunft zu beschleunigen."
2992994,"Energy Market – Analyst/Consultant - Renewables gases - Madrid","https://jobs.smartrecruiters.com/AFRY/744000060966306-energy-market-analyst-consultant-renewables-gases-madrid","Afry","Madrid","No",1,"Full time","2025-05-23T02:01:35.534292Z","We are looking for great people to join our team of energy consultants. We are currently recruiting for our Madrid team, but we have regular opportunities in our other offices Bogota, Bangkok, Beijing, Berlin, Dubai, Dusseldorf, Helsinki, London, Oxford, Milan, New York, Oslo, Paris, Stockholm, Vienna, and Zurich.
The challenges of decarbonisation, decentralisation and digitalisation require us to continually challenge our existing ideas to remain at the forefront of thinking on the future of the energy industry. Our vision is to be the most recommended advisor for the energy transition. If you are as interested as we are in this dynamic industry, we would love to hear from you.
You will have the opportunity to gain knowledge and experience to become an industry specialist within a stimulating and supportive environment. Our team specialises in all aspects of the energy transition. We offer strategic and commercial advice, develop policy and regulations, model systems and markets and support transactions. We pride ourselves on our in-depth analysis and strong client relationships.
Often the work is office based but there are many opportunities to travel for shorter trips for client meetings or for entire projects where work is on the client site. With more than 800 consultants across over 20 offices on 5 continents, and supported by 19,000 experts at AFRY in design, engineering and digitalisation, we are driven by the idea of helping our clients find solutions to business-critical questions. For individuals looking for international experience we can also offer secondments to other offices.
As a primary responsibility, you will support AFRY consulting activities for a wide range of clients  including major financial investors, the largest Iberian and international utilities, government, and regulatory bodies  through projects carried out mainly in Spain, Portugal and Latin AmericaIf you are as interested as we are in this dynamic industry, we would love to hear from you.Below we explain the main skills that we look for in our Analysts/Consultants:A Masters degree, or higher, in maths, engineering, economics or science related subjectWorking experience of 1-3 years specialized in renewables gases with previous experience in the industry.Advanced analytical and quantitative skills. We undertake a lot of complex analysis, a good proportion of which is numerical, so we are looking for people with an aptitude for complex quantitative and qualitative analysis, statistics, manipulation of large data and diverse mathematical models. This includes the ability to pay attention to detail and use MS Excel proficiently, understanding programming logic, and creative problem-solving skills.Excellent team working and leadership. All the work we do requires team working and you will be responsible for the delivery of the whole team. This involves planning the work, supporting the team, anticipating challenges, leading by example, and accountability towards the client (with more Senior support when required).Being fluent in Spanish and English. On the one hand our clients are located in Spanish and non-Spanish speaking countries, and on the other hand our work requires day-to-day collaboration  in English  with other AFRY offices.Writing and communication skills. Report-writing and presenting in public is a core part of our work, therefore we are also looking for the ability to explain complex information in a clear and logical way in English, both in writing and orally.Proactivity and responsibility. You will be working in a commercial environment against budgets and deadlines so you will need to be able to think for yourself, be proactive and have a business-oriented mindset.Passion for energy markets and policies. You have a holistic understanding of European electricity or gas market dynamics, sustainability challenges, and energy policies.Proven hands-on experience of indicatively 1 to 3 years in:any energy field (e.g. trading, renewable energies, retail markets, networks etc.)any business practice (e.g. transactions, management consulting, engineering etc.)Additionally, we highly value:computer programming (e.g. Matlab, Visual Basic, VBA etc.)database skills (e.g. MS Access or MS SQL Server)knowledge of Portuguese, French or another European languagecontacts in your industryWe value a healthy work life balance and diversity. We can consider a range of flexible working arrangements. Please include your preferences in your application.In AFRY Management Consulting we offer a competitive salary, a performance related bonus scheme and an excellent range of benefits.As part of your online application process, please provide a CV and covering letter stating why you want to work for AFRY and your salary expectations. We only accept online applications.If we think you could be a good fit for the organization you will be invited for a telephone interview following which, if we are both happy to continue the process, you will then be invited to a face-to-face interview. To allow us to assess your skills in practice this will be accompanied by Excel, Word and analytical reasoning exercises. In addition, you will have an informal chat with members of the team to find out more about what it is like to work at AFRY.You must have a right to live and work in Spain.At AFRY, we engineer change in everything we do. Change happens when brave ideas come together. When we collaborate, innovate technology, and embrace challenging points of view. Thats how we're making future. We are actively looking for qualified candidates to join our inclusive and diverse teams across the globe. Join us in accelerating the transition towards a sustainable future."
2992993,"Senior Projektingenieur:in Verkehrsinfrastruktur (Mensch*)","https://jobs.smartrecruiters.com/AFRY/744000060971346-senior-projektingenieur-in-verkehrsinfrastruktur-mensch-","Afry","Munich","No","Not specified","Full time","2025-05-23T02:01:35.534309Z","Du bist fr die Fach- und qualittsgerechte Bearbeitung von Verkehrsinfrastrukturprojekte, insbesondere fr Eisenbahnverkehrsanlagen in den Leistungsphasen 1-7 der HOAI, verantwortlich.Du arbeitest mit anderen Fachabteilungen bei schnittstellenbergreifenden Projekten, insbesondere bei BIM-Projekten, zusammenDu stimmst Dich mit Auftraggebern, Ingenieurbros, Sachverstndigen und Behrden ab.Erfahrung:
Du besitzt ein erfolgreich abgeschlossenes Studium der Fachrichtung Bauingenieurwesen, idealerweise mit Fachrichtung Verkehrsplanung oder einer vergleichbaren Fachrichtung. Du kannst mehrjhrige Berufserfahrung in der Objektplanung von Verkehrsinfrastrukturprojekten, insbesondere von Eisenbahnverkehrsanlagen nachweisen.Fhigkeiten:
Du verfgst ber ein ausgeprgtes, analytisches Denkvermgen und handelst unternehmerisch. Du bringst verhandlungssichere Deutschkenntnisse in Wort und Schrift mit.Tools:
Du hast idealerweise Erfahrung in der BIM-Planung oder Erfahrung im Umgang mit Trassierungsprogrammen (ProVi oder Civil 3D).Mindset:
Du bist ein Teamplayer und bringst Engagement sowie Flexibilitt mitDu bist Teil spannender Projekte, die ihren Fokus auf Ressourcenschonung setzenDurch standortbergreifende Zusammenarbeit und vielfltige Netzwerkmglichkeiten, kannst Du Dein Wissen erweitern und von den Erfahrungen anderer profitierenBei uns kannst Du flexible Arbeitsbedingungen genieen, so sind Beruf und Privatleben optimal miteinander vereinbarWir bieten Dir eine individuelle Einarbeitung und ein angepasstes Buddy-Programm, damit Du Dich schnell in Deinem neuen Team zurechtfindestFr uns zhlt der Mensch als Ganzes. Deshalb bieten wir Dir ein umfassendes Gesundheitsprogramm an, welches Dich dabei untersttzt, fit und motiviert zu bleiben
Passt nicht?
Die Stellenanzeige spricht Dich an, Du bist Dir allerdings nicht zu 100 % sicher, ob Dein Profil passt. Bewirb Dich trotzdem! Oder nutze die Chance zu einer Initiativbewerbung. So gehts weiter:Bewirb Dich direkt Online, indem Du auf den Apply now Button fr den fr Dich passenden Standort klickst. Hier gelangst Du in unser BewerberportalNutze fr weitere Fragen unsere direkten Ansprechpartner:innen aus unserem internen Recruiting-TeamNach Sichtung deiner Unterlagen und der Abstimmung mit dem zustndigen Fachbereich, melden wir uns schnellstmglich bei Dir zurckAnschlieend lernen wir uns per Microsoft-Teams oder direkt persnlich an einem unserer Standorte kennen und besprechen alle weiteren EinzelheitenDu mchtest Wechseln? Das bleibt unter uns!
Wir behandeln Deine Daten sowie Deine Bewerbung im gesamten Bewerbungsprozess streng vertraulich.Kontakt:
AFRY Deutschland GmbH
Frau Jennifer Morano
Senior Recruiterin | Human Resources
M: +49 172 981 1201Bei AFRY verwenden wir das geschftliche Du. Wir freuen uns daher auf Deine Ansprache in Du-Form.
 *Wir bei AFRY legen Wert auf Vielfalt - bei AFRY kannst Du Du sein. Fr uns spielt es keine Rolle, ob weiblich, mnnlich oder divers, wo Du herkommst, welche Hautfarbe Du hast oder woran Du glaubst. Fr uns stehen gegenseitiger Respekt und Wertschtzung stets an oberster Stelle. Denn bei uns steht der Mensch im Mittelpunkt, um nachhaltige Lsungen fr die kommende Generation zu schaffen. Die Arbeit bei uns ist vielseitig und erfllend.MAKING FUTUREBei AFRY sorgen wir bei allem, was wir tun, fr Vernderungen. Denn Wandel entsteht nur, wenn mutige Ideen zusammenkommen. Wenn wir erfolgreich zusammenarbeiten, innovativ ttig sind und unterschiedliche Blickwinkel einnehmen. So gestalten wir die Zukunft. Wir sind aktiv auf der Suche nach qualifizierten Bewerberinnen und Bewerbern, die ein Teil unserer integrativen und vielfltigen Teams auf der ganzen Welt werden mchten. Schliee Dich uns an, um den bergang zu einer nachhaltigeren Zukunft zu beschleunigen."
2992992,"Konstrukteur:in / Technische Zeichner:in Verkehrsanlagen (Mensch*)","https://jobs.smartrecruiters.com/AFRY/744000060970463-konstrukteur-in-technische-zeichner-in-verkehrsanlagen-mensch-","Afry","Berlin","No","Not specified","Full time","2025-05-23T02:01:35.534324Z","Du verantwortest den Entwurf, die Begleitung und Gestaltung von Planungsprozessen der VerkehrsanlagenDu bearbeitest selbststndig, qualifizierte Konstruktionen und prfst Eisenbahn-, Straen- und/oder InfrastrukturanlagenDu stimmst Dich selbststndig bei themenbergreifenden Teilplanungen abDu hast Interesse an der Bearbeitung von BIM-ProjektenDu untersttzt Dein Team in der Planungskoordination und dem PlanungsmanagementErfahrung:
Du kannst eine erfolgreich abgeschlossene Ausbildung zum Bautechniker / Bauzeichner nachweisen. Du bringst Erfahrung in der Konstruktion von Eisenbahn-, Straen- und/oder Infrastrukturanlagen mit.Fhigkeiten:
Ebenso besitzt Du fundierte Kenntnisse und Anwendung der gngigen Vorschriften.Tools:
Du hast gute bis sehr gute AutoCAD- oder AllPlan-Anwenderkenntnisse.Mindset:
Du denkst und handelst unternehmerisch. Du bist ein Teamplayer und bringst ein hohes Ma an Engagement, Belastbarkeit und Flexibilitt mit.Du bist Teil spannender Projekte, die ihren Fokus auf Ressourcenschonung setzenDurch standortbergreifende Zusammenarbeit und vielfltige Netzwerkmglichkeiten, kannst Du Dein Wissen erweitern und von den Erfahrungen anderer profitierenBei uns kannst Du flexible Arbeitsbedingungen genieen, so sind Beruf und Privatleben optimal miteinander vereinbarWir bieten Dir eine individuelle Einarbeitung und ein angepasstes Buddy-Programm, damit Du Dich schnell in Deinem neuen Team zurechtfindestFr uns zhlt der Mensch als Ganzes. Deshalb bieten wir Dir ein umfassendes Gesundheitsprogramm an, welches Dich dabei untersttzt, fit und motiviert zu bleibenPasst nicht?
Die Stellenanzeige spricht Dich an, Du bist Dir allerdings nicht zu 100 % sicher, ob Dein Profil passt. Bewirb Dich trotzdem! Oder nutze die Chance zu einer Initiativbewerbung. So gehts weiter:Bewirb Dich direkt Online, indem Du auf den Apply now Button fr den fr Dich passenden Standort klickst. Hier gelangst Du in unser BewerberportalNutze fr weitere Fragen unsere direkten Ansprechpartner:innen aus unserem internen Recruiting-TeamNach Sichtung deiner Unterlagen und der Abstimmung mit dem zustndigen Fachbereich, melden wir uns schnellstmglich bei Dir zurckAnschlieend lernen wir uns per Microsoft-Teams oder direkt persnlich an einem unserer Standorte kennen und besprechen alle weiteren EinzelheitenDu mchtest Wechseln? Das bleibt unter uns!
Wir behandeln Deine Daten sowie Deine Bewerbung im gesamten Bewerbungsprozess streng vertraulich.Kontakt:
AFRY Deutschland GmbH
Frau Jennifer Morano
Senior Recruiterin | Human Resources
M: +49 172 981 1201
 Bei AFRY verwenden wir das geschftliche Du. Wir freuen uns daher auf Deine Ansprache in Du-Form.

*Wir bei AFRY legen Wert auf Vielfalt - bei AFRY kannst Du Du sein. Fr uns spielt es keine Rolle, ob weiblich, mnnlich oder divers, wo Du herkommst, welche Hautfarbe Du hast oder woran Du glaubst. Fr uns stehen gegenseitiger Respekt und Wertschtzung stets an oberster Stelle. Denn bei uns steht der Mensch im Mittelpunkt, um nachhaltige Lsungen fr die kommende Generation zu schaffen. Die Arbeit bei uns ist vielseitig und erfllend.MAKING FUTUREBei AFRY sorgen wir bei allem, was wir tun, fr Vernderungen. Denn Wandel entsteht nur, wenn mutige Ideen zusammenkommen. Wenn wir erfolgreich zusammenarbeiten, innovativ ttig sind und unterschiedliche Blickwinkel einnehmen. So gestalten wir die Zukunft. Wir sind aktiv auf der Suche nach qualifizierten Bewerberinnen und Bewerbern, die ein Teil unserer integrativen und vielfltigen Teams auf der ganzen Welt werden mchten. Schliee Dich uns an, um den bergang zu einer nachhaltigeren Zukunft zu beschleunigen."
2992991,"Konfigurationsledare","https://jobs.smartrecruiters.com/AFRY/744000060981920-konfigurationsledare","Afry","Gothenburg","No","Not specified","Full time","2025-05-23T02:01:35.534340Z","Som konfigurationsledare kommer du att ing i ett kundprojekt inom fordonsutveckling och samarbeta nra med delprojektledaren fr att framtdriva projektet med hg kvalitet. Som konfigurationsledare kommer du ha du mjlighet att aktivt pverka och forma rollens funktion.Rollen innefattar att: Planera, implementera och driva konfigurationshanteringsarbete.Arbeta proaktivt med konfigurationsobjekten genom hela utvecklingslivscykeln.Driva beslutsfattande kring innehllet i konfigurationerna.Stdja organisationen i frgor relaterade till konfigurationshantering.Fungera som en aktiv ledare inom konfigurationshantering, dr du blir en viktig del av bde organisationen och projektet.Ditt grundlggande intresse fr fordonsutveckling och frmga att skapa ordning och reda r avgrande. Rollens framgng beror i hg grad p dina personliga egenskaper. I rollen r det av stor vikt att kunna kommunicera effektivt och ha en vilja att driva verksamheten framt. Du frvntas vara bde drivande och innovativ i ditt arbete.Vra kunder finns p flera stllen i Sverige, s resor i tjnsten kan frekomma.Krav fr tjnsten:Du har goda kunskaper i konfigurationsstyrning och kravhantering.Du har god kunskaper om fordonsutveckling, bde frn mjukvara och hrdvara Du har en civilingenjrsutbildning inom tex mekatronik, elektronik eller datateknik, eller har annan fr rollen relevant utbildningsbakgrundGoda kunskaper i svenska i bde tal och skrift.Vlkommen med din anskan!. Fr mer information r du varmt vlkommen att kontakta: Lena Henriksson - Section Manager
lena.henriksson@afry.comVi undanber oss direktkontakt med bemannings- och rekryteringsfretag samt sljare av ytterligare jobbannonser.Vlkommen med din anskan!  P AFRY driver vi frndring i allt vi gr. Vi anser att frndring sker nr modiga ider mts, nr vi samarbetar, skapar innovation och omfamnar kreativa lsningar, det r s vi skapar framtiden. Vi sker konstant kvalificerade kandidater som vill ansluta sig till vra inkluderande team runt om i vrlden. Bli en del av oss och pskynda den grna omstllningenP AFRY driver vi frndring i allt vi gr. Vi anser att frndring sker nr modiga ider mts, nr vi samarbetar, skapar innovation och omfamnar kreativa lsningar, det r s vi skapar framtiden. Vi sker konstant kvalificerade kandidater som vill ansluta sig till vra inkluderande  team runt om i vrlden. Bli en del av oss och pskynda den grna omstllningen"
