"ID","Title","Link","Company","Location","Remote","Experience","EmploymentType","DatePosted","RoleDescription"
2982257,"Rådgivende Ingeniør Elektro samferdsel","https://jobs.smartrecruiters.com/AFRY/744000060708475-radgivende-ingeni-r-elektro-samferdsel","Afry","Oslo","No","Not specified","Full time","2025-05-23T02:01:35.534813Z","Er du en erfaren elektroingenir med lidenskap for samferdselsprosjekter?
nsker du  jobbe i et sterkt fagmilj hvor du fr ansvar for prosjekteringen fra A til , og samarbeider tett med dyktige kollegaer innen ulike fagdisipliner?Hos AFRY fr du muligheten til  jobbe med spennende og komplekse prosjekter innen samferdsel, sammen med vre lysdesignere i Light Bureau, vre vegingenirer i AFRY Transportation, og resten av vrt tverrfaglige ingenirmilj.Vi ser etter deg som nsker  ta en aktiv rolle i utviklingen av fremtidens infrastruktur.Om rollen
Som elektroingenir hos oss vil du ha ansvar for  gjennomfre prosjekteringsoppdrag innen elkraft og/eller SRO i samferdselsprosjekter  fra tidligfase til ferdigstillelse. Du vil jobbe selvstendig og i tverrfaglige team, og ha kontakt med bde kunder, samarbeidspartnere og entreprenrer.HovedoppgaverDisiplinledelse, prosjektledelse eller fagansvar innen elektro i samferdselsprosjekterTeknisk prosjektering innen elektroteknikk (elkraft og/eller SRO)Koordinering med vrige rdgivere og samarbeidspartnereUtarbeidelse av reguleringsplaner, detaljplaner og byggeplanerOppflging i byggetid og kontakt med oppdragsgivereLitt om deg
Vi ser etter en strukturert og initiativrik kollega som tar eierskap til oppgaver og som ikke er redd for  g foran. Du er proaktiv og handlingsorientert, tar tak i utfordringer, og liker  holde fremdrift i prosjektene. Du evner  jobbe selvstendig, samtidig som du er en tydelig lagspiller som bidrar til et positivt og inkluderende arbeidsmilj.

Du kommuniserer godt p norsk, bde skriftlig og muntlig, og bygger lett gode relasjoner  bde internt i teamet og med kunder og samarbeidspartnere. Med en fleksibel innstilling og hy faglig integritet skaper du verdi og kvalitet i bde sm og store prosjekter.KvalifikasjonerUtdanning som ingenir bachelor eller master innen elektrofagMinimum 5 rs erfaring med prosjektering av elkraft/SRO i samferdselsprosjekterGod kjennskap til relevante verkty: Novapoint, AutoCAD, Civil 3D, Trimble, Quadri, Febdok og NetdokSolid forstelse for NEK 400, NEK 600, SSV-hndbker og andre relevante standarderErfaring med modellbasert gjennomfring av prosjekterDette kan vi tilbySpennende prosjekter og utfordringerDu fr vre med p noen av Norges mest komplekse og interessante infrastrukturprosjekter  som stbanehallen, Fyllingstunnelen, Tromstunnelene, Ring 1 og Kjos-krysset.Tverrfaglig samarbeid og faglig utfordringerHos oss fr du jobbe med kompetente kollegaer innen flere fagomrder, i et milj som verdsetter kompetansedeling, samarbeid og innovasjon. Vi gir deg muligheten til  pvirke egen utvikling gjennom kurs, sertifiseringer, prosjektansvar og deltakelse i fagnettverk.Sterkt sosialt miljVi har en aktiv personalklubb og et uformelt arbeidsmilj preget av godt humr, samarbeid og trivsel.Fleksibilitet og Konkurransedyktige betingelserVelg mellom kontorsteder i Lysaker, Lillestrm eller Sandefjord  eller annen lokasjon etter avtale. Vi tilbyr fleksibilitet i arbeidshverdagen og moderne lokaler med gode fasiliteter. Det er gode pensjons- og forsikringsordninger, inkludert helseforsikring. I tillegg til fri med lnn p de inneklemte dagene ifm jul og pske.
 Vi vurderer skere og gjennomfrer intervjuer fortlpende. nsker du en uformell prat om stillingen, ta gjerne kontakt med:Trond Kevin Stene, Seksjonsleder  tlf. +47 915 12 625Harald Lillevik, Avdelingsleder  tlf. +47 951 57 369
 Vi gleder oss til  hre fra deg!I AFRY er vi opptatt av  skape en forskjell i alt vi gjr, og vi tror p at endringer skjer nr vi tar modige valg sammen. Gjennom samarbeid, innovasjon og ulike perspektiver, er vi med p  skape lsninger for fremtiden. Vi er alltid p utkikk etter flere dyktige kollegaer som nsker  bli en del av vrt inkluderende og mangfoldige lag. Bli med oss og bidra til omstillingen mot et mer brekraftig samfunn."
2982256,"Prosjekteringsgruppeleder (PGL)","https://jobs.smartrecruiters.com/AFRY/744000060708700-prosjekteringsgruppeleder-pgl-","Afry","Oslo","No","Not specified","Full time","2025-05-23T02:01:35.534827Z","Vil du vre en nkkelperson i AFRYs spennende byggeprosjekter?

Prosjekteringsgruppeleder-seksjonen i AFRY leder selskapets strste tverrfaglige prosjekter og er en nkkelfaktor i vr strategi for  levere lnnsomme og brekraftige prosjekter. Seksjonen er i utvikling og har klare ml om  levere prosjektledelse av hy kvalitet og skape verdi i vre prosjekter.N skal vi ansette en ny kollega som evner  holde i komplekse prosjekter og samtidig bygge lag!

Om rollen
Som Prosjekteringsgruppeleder i AFRY fr du ansvar for tverrfaglige byggeprosjekter og vil vre selskapets ansikt utad. Vi jobber med prosjekter i ulike strrelser og sektorer, som skoler, sykehjem, industri, idrettshaller og boliger, og vi sttter kunden gjennom alle faser  fra mulighetsstudier til detaljprosjektering og oppflging i byggetiden.ArbeidsoppgaverLede og koordinere flerfaglige team av rdgivere/prosjekterende i forbindelse med store byggeprosjekter for industri, datasenter, offentlige bygg og boliger, primrt i prosjekter der AFRY leverer hele prosjekteringsgruppenDigital samhandling og prosesstyringKommunikasjon, bde internt og mot kunde
 Litt om deg
For  lykkes i denne rollen er det viktig med gode samarbeidsevner, tydelig kommunikasjon og evnen til  bygge sterke relasjoner. Du m ha en strukturert tilnrming til arbeidsdagen og kunne holde oversikt over komplekse prosesser. Det forventes ogs at du tar et tydelig eierskap til egne prosjekter og er en aktiv pdriver for fremdrift og kvalitet. Alle strre prosjekter gjennomfres sammen med en makker som fungerer som sparringspartner, og vi legger stor vekt p  sttte hverandre  srlig nr det virkelig gjelder.Hos AFRY har vi et sterkt fokus p fremtidsrettet teknologibruk, effektive arbeidsprosesser og tverrfaglig rdgivning. Vi samarbeider tett med BIM-avdelingen og er engasjerte i bruk av VDC og KI. Det er derfor en fordel om du har interesse for teknologi og nsker  vre med p vr digitale reise.nskede kvalifikasjoner:Utdannet Sivilingenir eller annen relevant MastergradMinst 5 rs relevant erfaring som Prosjekteringsleder og/eller ProsjektlederSterke kommunikasjonsevner p norsk og engelsk, bde skriftlig og muntligKjennskap til VDC er en fordel
 Dette kan vi tilbySpennende prosjekter Du fr vre med p noen av Norges mest komplekse og interessante Byggeprosjekter  som Nexans Halden, Alginor Haugesund, Kolbotn Omsorgsboliger, Thermo Fisher Lillestrm, Dronning Ingrids Hage, ombygging og nybygg av skoler i Oslo.Tverrfaglig samarbeid og faglig utfordringerHos oss fr du jobbe med kompetente kollegaer innen alle fagomrder, i et milj som verdsetter kompetansedeling, samarbeid og innovasjon. Vi gir deg muligheten til  pvirke egen utvikling gjennom kurs, sertifiseringer, prosjektansvar og deltakelse i fagnettverk.Et inkluderende og sosialt miljVi har en aktiv personalklubb og et uformelt arbeidsmilj preget av godt humr, samarbeid og trivsel. Vre ulikheter er en styrke og skaper engasjement og arbeidsglede. Vi mter hverandre med penhet og respekt og har det gy sammen! Vi verdsetter deg og din kompetanse - hos oss kan du vre deg selv.Fleksibilitet og konkurransedyktige betingelserVelg mellom kontorsteder p Lilleaker, Lillestrm eller Sandefjord  eller annen lokasjon etter avtale. Vi tilbyr fleksibilitet i arbeidshverdagen og moderne lokaler med gode fasiliteter. Det er gode pensjons- og forsikringsordninger, inkludert helseforsikring. I tillegg til fri med lnn p de inneklemte dagene ifm jul og pske.
 Vi vurderer skere og gjennomfrer intervjuer fortlpende. nsker du en uformell prat om stillingen, ta gjerne kontakt med:Sondre Nenseter, Avdelingsleder VVS, e-post: sondre.nenseter@afry.comBettina Srlie, Rekrutteringspartner, e-post: bettina.sorlie@afry.com
 Vi gleder oss til  hre fra deg!I AFRY er vi opptatt av  skape en forskjell i alt vi gjr, og vi tror p at endringer skjer nr vi tar modige valg sammen. Gjennom samarbeid, innovasjon og ulike perspektiver, er vi med p  skape lsninger for fremtiden. Vi er alltid p utkikk etter flere dyktige kollegaer som nsker  bli en del av vrt inkluderende og mangfoldige lag. Bli med oss og bidra til omstillingen mot et mer brekraftig samfunn."
2982255,"Rådgivende Ingeniør Elektro samferdsel","https://jobs.smartrecruiters.com/AFRY/744000060709315-radgivende-ingeni-r-elektro-samferdsel","Afry","Trondheim","No","Not specified","Full time","2025-05-23T02:01:35.534842Z","Er du en erfaren elektroingenir med lidenskap for samferdselsprosjekter?
nsker du  jobbe i et sterkt fagmilj hvor du fr ansvar for prosjekteringen fra A til , og samarbeider tett med dyktige kollegaer innen ulike fagdisipliner?Hos AFRY fr du muligheten til  jobbe med spennende og komplekse prosjekter innen samferdsel, sammen med vre lysdesignere i Light Bureau, vre vegingenirer i AFRY Transportation, og resten av vrt tverrfaglige ingenirmilj.Vi ser etter deg som nsker  ta en aktiv rolle i utviklingen av fremtidens infrastruktur.Om rollenSom elektroingenir hos oss vil du ha ansvar for  gjennomfre prosjekteringsoppdrag innen elkraft og/eller SRO i samferdselsprosjekter  fra tidligfase til ferdigstillelse. Du vil jobbe selvstendig og i tverrfaglige team, og ha kontakt med bde kunder, samarbeidspartnere og entreprenrer.HovedoppgaverDisiplinledelse, prosjektledelse eller fagansvar innen elektro i samferdselsprosjekterTeknisk prosjektering innen elektroteknikk (elkraft og/eller SRO)Koordinering med vrige rdgivere og samarbeidspartnereUtarbeidelse av reguleringsplaner, detaljplaner og byggeplanerOppflging i byggetid og kontakt med oppdragsgivere
 Litt om degVi ser etter en strukturert og initiativrik kollega som tar eierskap til oppgaver og som ikke er redd for  g foran. Du er proaktiv og handlingsorientert, tar tak i utfordringer, og liker  holde fremdrift i prosjektene. Du evner  jobbe selvstendig, samtidig som du er en tydelig lagspiller som bidrar til et positivt og inkluderende arbeidsmilj.

Du kommuniserer godt p norsk, bde skriftlig og muntlig, og bygger lett gode relasjoner  bde internt i teamet og med kunder og samarbeidspartnere. Med en fleksibel innstilling og hy faglig integritet skaper du verdi og kvalitet i bde sm og store prosjekter.KvalifikasjonerUtdanning som ingenir bachelor eller master innen elektrofagMinimum 5 rs erfaring med prosjektering av elkraft/SRO i samferdselsprosjekterGod kjennskap til relevante verkty: Novapoint, AutoCAD, Civil 3D, Trimble, Quadri, Febdok og NetdokSolid forstelse for NEK 400, NEK 600, SSV-hndbker og andre relevante standarderErfaring med modellbasert gjennomfring av prosjekterDette kan vi tilbySpennende prosjekter og utfordringerDu fr vre med p noen av Norges mest komplekse og interessante infrastrukturprosjekter  som stbanehallen, Fyllingstunnelen, Tromstunnelene, Ring 1 og Kjos-krysset.Tverrfaglig samarbeid og faglig utfordringerHos oss fr du jobbe med kompetente kollegaer innen flere fagomrder, i et milj som verdsetter kompetansedeling, samarbeid og innovasjon. Vi gir deg muligheten til  pvirke egen utvikling gjennom kurs, sertifiseringer, prosjektansvar og deltakelse i fagnettverk.Sterkt sosialt miljVi har en aktiv personalklubb og et uformelt arbeidsmilj preget av godt humr, samarbeid og trivsel.Fleksibilitet og Konkurransedyktige betingelserVelg mellom kontorsteder i Trondheim, Lysaker, Lillestrm eller Sandefjord  eller annen lokasjon etter avtale. Vi tilbyr fleksibilitet i arbeidshverdagen og moderne lokaler med gode fasiliteter. Det er gode pensjons- og forsikringsordninger, inkludert helseforsikring. I tillegg til fri med lnn p de inneklemte dagene ifm jul og pske.
 Vi vurderer skere og gjennomfrer intervjuer fortlpende. nsker du en uformell prat om stillingen, ta gjerne kontakt med:Trond Kevin Stene, Seksjonsleder  tlf. +47 915 12 625Harald Lillevik, Avdelingsleder  tlf. +47 951 57 369
 Vi gleder oss til  hre fra deg!I AFRY er vi opptatt av  skape en forskjell i alt vi gjr, og vi tror p at endringer skjer nr vi tar modige valg sammen. Gjennom samarbeid, innovasjon og ulike perspektiver, er vi med p  skape lsninger for fremtiden. Vi er alltid p utkikk etter flere dyktige kollegaer som nsker  bli en del av vrt inkluderende og mangfoldige lag. Bli med oss og bidra til omstillingen mot et mer brekraftig samfunn."
2982252,"Prosjektleder ytre miljø og myndighetskontakt","https://jobs.smartrecruiters.com/AFRY/744000060743183-prosjektleder-ytre-milj-og-myndighetskontakt","Afry","Oslo","No","Not specified","Full time","2025-05-23T02:01:35.534857Z","Vi trenger n  styrke laget vrt med en prosjektleder innen ytre milj og myndighetskontrakt. Vi har mange oppdrag, og trenger deg som srlig kan  bidra inn i vre prosjekt med  flge opp arbeid innenfor ytre milj og kontakt med forurensningsmyndighetene.I rollen skal du ha ansvar for:Arbeide som byggherrens ansvarlige for  lede arbeid med milj og brekraft i store og sm prosjekt.Oppflging av ytre milj og myndighetskontakt i Advansia sin rammeavtale med Statnett, Avinor og i andre strre infrastrukturprosjekt.Veilede byggherreorganisasjonen og ta ansvar for  implementere ambisjoner, krav fra lovverk og sertifiseringsordninger i alle faser av prosjektgjennomfringen.Ansvar for  flge opp prosjekteringsorganisasjon og entreprenrer p vegne av byggherre.Bist industrikunder med miljrisikovurderinger, utslippssknader og oppflging mot forurensningsmyndighetene.leveranser og oppflging av ytre milj i konseptvalgutredninger (KVU`er) og reguleringsplaner.gjennomfring av mindre oppdrag innenfor ytre milj (verdivurdering av tomter, tiltaksplaner, opprydding).Lede og bidra i utredninger innenfor relevante fagomrder.MSc i relevant fag som kjemi, miljgeologi, biologi og/eller naturmilj.Minimum fem rs relevant erfaring.Evne til  se helheten og prioritere.Evne til  lede andre og ta ansvar for fremdrift.Erfaring fra arbeid med oppflging av forurenset grunn, massehndtering, naturmangfold,Erfaring som rdgiver, entreprenr eller byggherre, bde med selvstendige oppdrag samt arbeid i tverrfaglige team.Kunnskap om forurensingsregelverket, og erfaring fra kontakt med forurensningsmyndighetene p bde lokalt og p nasjonalt niv.Erfaring med miljrisikovurdering og utslippssknader.God muntlig og skriftlig fremstillingsevne (norsk og engelsk).Gjerne et godt kontaktnett hos potensielle kunder og samarbeidspartnere. I vrt team vil du oppleve at det er god stemning, hy takhyde og en genuin spirit for  hjelpe hverandre. Vi er opptatt av kompetansedeling, er nytenkende, liker faglige diskusjoner og setter pris p teamarbeid og humor i hverdagen. Vi er stolte av jobben vi gjr og opptatt av  levere kvalitet i vre leveranser. Vi har et godt og inkluderende arbeidsmilj med faglig dyktige og engasjerte kolleger. Du fr en unik mulighet til  lre om vre kunder og deres virke, og du vil vre med p  jobbe frem smarte og fremtidsrettede lsninger.Vi tilbyr konkurransedyktige lnnsbetingelser med fleksitid, gode forsikrings- og pensjonsordninger, utviklingsmuligheter, et inkluderende arbeidsmilj, fleksibilitet til  kombinere jobb og privatliv, fem uker ferie samt fri med lnn i romjul og i pskeuken. Ta gjerne kontakt for en uformell prat. Vennligst benytt elektronisk sknad. Vi ser frem til  hre fra deg! Ved sprsml om stillingen, ta kontakt med: Anne Kristin Holen 
Gruppeleder Miljledelse
annekristin.holen@advansia.no Linda Sletteb 
Rekrutteringspartner
linda.slettebo@advansia.noHos oss fr du mulighet til  skape verdi og lykkes sammen med andre!"
2982251,"Inustrumentingenjör","https://jobs.smartrecruiters.com/AFRY/744000060744740-inustrumentingenjor","Afry","Stenungsund","No","Not specified","Full time","2025-05-23T02:01:35.534871Z","AFRY Process Industries vxer och fr allt fler stora projekt. Vi behver drfr utka vr verksamhet med flera erfarna resurser inom instrument.Som anstlld hos oss kommer du tillhra sektionen El, Instrument &amp; Automation p AFRY:s division Process Industries. Vi arbetar framfr allt inom processindustrin dr projekten och arbetet drivs antingen In-house frn vrt kontor i Stenungsund eller ute hos kund beroende p vad som r verenskommet.Vi har en vl inarbetad projektmodell som fljer vra tagande frn frstudier, Basic design, detaljkonstruktion vidare till implementationsfas och driftsttning. Vi arbetar med moderna verktyg/program fr multidisciplinra projekt fr bl.a kostnadsestimering, planering, konstruktion och dokumenthantering.AFRY som arbetsgivare erbjuder en trygg anstllning med kollektivavtal och attraktiva frmner. Flextid erbjuds fr att du ska f ihop en vardag att trivas i. Visste du att AFRY r rankat som en av Sveriges mest populra arbetsgivare bland ingenjrer? Vi vill grna visa dig varfr!Vi sker dig som vill ing i ett fantastiskt team dr vi arbetar ttt mellan ingenjrsdisciplinerna men ven i enskilda projekt och uppdrag.Vi ser grna att du har erfarenhet inom processindustrin, energi-, olja &amp; gas- och petrokemiindustri, samt att ha arbetat i projektform individuellt eller i strre och mindre grupper. Du har frmodligen en teknisk utbildning frn universitet, hgskola eller YH.Vi sker ven dig som har relevant arbetslivserfarenhet och vill prova p rollen som konsult eller konstruktr. Krkort r ett krav d det frekommer resor och kundbesk i tjnsten. Vi frutstter ocks att du behrskar bde det svenska och engelska sprket d det krvs i dialog med kunder.Framgngsfaktorn fr att lyckas hos oss r din egen drivkraft och motivation. I vra projektleveranser arbetar vi tillsammans i team men samtidigt tar du ansvar fr din del i vrt totala tagande till kunden. Du r systematisk, har ltt fr att snabbt anpassa dig till nya frutsttningar och, precis som vi, vill du ha kul p jobbet!Vlkommen med din anskan, sista anskningsdag r 2025-06-30

Kontaktperson fr frgor:
Johan Alexandersson, sektionschef
Johan.Alexandersson@afry.com

Vi undanber oss direktkontakt med bemannings- och rekryteringsfretag samt sljare av ytterligare jobbannonser.P AFRY driver vi frndring i allt vi gr. Vi anser att frndring sker nr modiga ider mts, nr vi samarbetar, skapar innovation och omfamnar kreativa lsningar, det r s vi skapar framtiden. Vi sker konstant kvalificerade kandidater som vill ansluta sig till vra inkluderande  team runt om i vrlden. Bli en del av oss och pskynda den grna omstllningen"
2982250,"Elkonstruktör","https://jobs.smartrecruiters.com/AFRY/744000060743796-elkonstruktor","Afry","Stenungsund","No","Not specified","Full time","2025-05-23T02:01:35.534887Z","AFRY Process Industries vxer och fr allt fler stora projekt. Vi sker drfr fler elkonstruktrer till Stenungsund!Som Elkonstruktr kommer du tillhra sektionen El, Instrument &amp; Automation i Stenungsund p AFRYs division Process Industries. Vi arbetar framfrallt inom processindustrin dr den gemensamma nmnaren fr oss p sektionen r el-, instrument och automationsdisciplinen. Projekten och arbetet drivs antingen In-house frn vrt kontor i Stenungsund eller ute hos kund beroende p vad som r verenskommet.Du kommer att arbeta med olika typer av projekt och uppdrag vilket kommer styras av din kompetens och erfarenhet, kundens behov samt din personliga ambition och utvecklingsplan. Du kommer bland annat arbete med:FrstudierKalkylberkningarFramtagning av teknisk beskrivningKonstruktion i industriella elanlggningarKabeldimensioneringFltinstallationerIdrifttagningProjekt/disciplinledning AFRY som arbetsgivare erbjuder en trygg anstllning med kollektivavtal och attraktiva frmner. Flextid erbjuds fr att du ska f ihop en vardag att trivas i. Visste du att AFRY r rankat som en av Sveriges mest populra arbetsgivare bland ingenjrer? Vi vill grna visa dig varfr!Vi sker dig som vill ing i ett fantastiskt team dr vi arbetar ttt mellan ingenjrsdisciplinerna men ven i enskilda projekt och uppdrag. Vi sker dig som har:Erfarenhet frn elkonstruktion inom processindustrin (process-, energi-, olja &amp; gas- och petrokemiindustri).Erfarenhet av att arbeta i projektform och grna en god frstelse fr de andra disciplinerna (instrument, automation, process med flera).En teknisk utbildning frn universitet, hgskola, YH eller arbetat dig till motsvarande kunskap.Krkort r ett krav d det frekommer resor och kundbesk i tjnsten. Vi frutstter ocks att du behrskar bde det svenska och engelska sprket d det krvs i dialog med kunder.Det som r framgngsfaktorn fr att lyckas hos oss r din egen drivkraft och motivation. I vra projektleveranser arbetar vi tillsammans i team men samtidigt tar du ansvar fr din del i vrt totala tagande till kunden. Du r systematisk, har ltt fr att snabbt anpassa dig till nya frutsttningar och, precis som vi, vill du ha kul p jobbet!Vlkommen med din anskan, sista anskningsdag r 2025-06-30

Kontaktperson fr frgor:
Johan Alexandersson, sektionschef
Johan.Alexandersson@afry.com

Vi undanber oss direktkontakt med bemannings- och rekryteringsfretag samt sljare av ytterligare jobbannonser.P AFRY driver vi frndring i allt vi gr. Vi anser att frndring sker nr modiga ider mts, nr vi samarbetar, skapar innovation och omfamnar kreativa lsningar, det r s vi skapar framtiden. Vi sker konstant kvalificerade kandidater som vill ansluta sig till vra inkluderande  team runt om i vrlden. Bli en del av oss och pskynda den grna omstllningen"
2978170,"Senior System Test Engineer","https://jobs.smartrecruiters.com/AFRY/744000060544255-senior-system-test-engineer","Afry","Gothenburg","No",5,"Full time","2025-05-23T02:01:35.534902Z","We are looking for a senior system test engineer within electromobility that wants to be part of our team, testing and developing solutions for vehicles, systems and functions together with our customers in Gothenburg and Trollhttan.In the role as system test engineer you will drive the development of testing for the next generations of mobility solutions. You are an important link between your team, suppliers and internal partners. Here you get the opportunity to work on exciting assignments for many different companies.With us, you become an important part of the AFRY family, with different skills. Together we create sustainable solutions for the challenges of the future. To us it is important that you have the opportunity to develop in the direction that you would like, and therefore that you have a manager that supports you in your ambition.We are looking for you with a bachelor or masters degree within computer science, automotive, physics or similar. You have at least five years experience within automotive R&amp;D within electromobility. A thorough understanding of product development processes are required, as well as experience with electrical architectures and safety concepts.Your main competence areas would beTesting of complex (HW/SW) automotive applications, both in simulated environments but also in vehicleDeveloping test cases from requirements with a system understandingImplementing test cases in simulated environments (HIL/SIL)Understanding of functional safety (ISO26262)Requirement developmentAgile development experienceWe also think you are comfortable with at least some of these tools/areasPython, Matlab/Simulink, C/C++Canalyzer, Canoe, INCA, ControldeskJenkins, GitIn addition you have experience from product development within high voltage systems (Charging, traction batteries, electric motors, inverters).As in all our recruitments large emphasis is put on personal qualities. As a person, you are positive and driven by constantly working to find new solutions to challenges you face together with your team. You are an effective and experienced communicator, and can express yourself well both orally and in writing. In addition, you are structured in your way of working and prefer order and order.We are looking for someone who wants to be part of AFRYs success story. Are you passionate about technology development? Do you like to work together to find the best solution? Then we can offer you career opportunities in a modern workplace with challenging assignments and exciting projects all over the world.

The AFRY Group is ranked as one of Swedens most popular employer among engineers. At AFRY you will be involved in developing innovative and sustainable solutions within infrastructure, energy and industry. We are always looking for the sharpest skills that can create a future society together with us. We hope you will learn as much from us as we will learn from you.At AFRY, we engineer change in everything we do. Change happens when brave ideas come together. When we collaborate, innovate technology, and embrace challenging points of view. Thats how we're making future. We are actively looking for qualified candidates to join our inclusive and diverse teams across the globe. Join us in accelerating the transition towards a sustainable future."
