"ID","Title","Link","Company","Location","Remote","Experience","EmploymentType","DatePosted","RoleDescription"
2987622,"Vi söker dig som vill jobba med QA/RA hos våra spännande kunder inom Life Science!","https://jobs.smartrecruiters.com/AFRY/744000060776185-vi-soker-dig-som-vill-jobba-med-qa-ra-hos-vara-spannande-kunder-inom-life-science-","Afry","Södertälje","No","Not specified","Full time","2025-05-23T02:01:35.534706Z","Vill du gra skillnad p riktigt, jobba inom Life Science och bidra till att skra kvalitet och kravefterlevnad fr produkter som pverkar mnniskors liv och hlsa? Vi sker nu en engagerad och driven konsult som vill arbeta med Quality Assurance och/eller Regulatory Affairs hos vra kunder inom framfr allt medicinteknik!Som konsult hos oss kommer du att arbeta i spnnande uppdrag antingen som QA, RA eller QA/RA hos ledande fretag inom Life Science. Du kommer att vara en viktig del i vra kunders kvalitetsarbete och arbeta tvrfunktionellt med andra avdelningar som produktion, utveckling och inkp.  Uppdragen varierar ver tid men kan inkludera:Skerstlla att produkter och processer uppfyller regulatoriska krav (t.ex. GMP, ISO 13485, MDR, FDA)Granskning och uppdatering av kvalitetsdokumentationDelta i eller leda interna och externa revisionerStdja produktregistreringar och regulatoriska anskningarVilka r vi? Vr sektion Compliance &amp; Quality Management (CQM) bestr av ca 30 medarbetare i Mlardalen, Malm och Gteborg. Sektionen drivs av Britta-Stina tillsammans med gruppchef Lars och vr teamleader Jacob. Bland vra medarbetare som r allt frn nyexaminerade till seniora, finns en bred kompetens inom kvalit, compliance och verksamhetsutveckling. Vi arbetar med produkter i hela dess livscykel eller processer i hela fretagets organisation i olika branscher och organisationer. Vi ser grna att du har:Akademisk examen inom naturvetenskap, teknik, farmaci eller motsvarandeTidigare erfarenhet av arbete inom QA eller RA, grna inom Life ScienceGod frstelse fr regulatoriska krav och kvalitetsstandarderFrmga att arbeta bde sjlvstndigt och i teamFlytande svenska och engelska i tal och skriftVi blir extra glada om du ven har:Kunskap inom MDR, IVDR, ISO 13485, ISO 14971 och/eller 21 CFR Part 820Erfarenhet av Premarket Notification, Premarket Approval eller LabelingVr konsultgrupp prglas av samarbete, ppenhet, professionalism och vi drivs av att skapa mervrde fr vra kunder. Vrt affrsomrde kan utver konsulttjnster ven erbjuda vra kunder paketerade lsningar och produkter.Vi erbjuder en arbetsplats med framtanda och trygghet i form av kollektivavtal och personalfrmner fr samtliga av vra medarbetare. Vr personalklubb arrangerar sociala aktiviteter p och utanfr kontoret. Allt frn skidresor, sjunga i kr till att spela brdspel  det finns ngot fr alla.Vi sker dig som vill vara en del av AFRYs framgngssaga. Brinner du fr teknisk utveckling? Gillar du att samarbeta fr att hitta den bsta lsningen? D kan vi erbjuda dig karrirmjligheter p en modern arbetsplats med utmanande arbetsuppgifter och spnnande projekt vrlden ver.Kontaktuppgifter fr frgorFr frgor gllande tjnsten, kontakta Segmentschef Britta-Stina Karlsson brittastina.karlsson@afry.comFr frgor gllande rekryteringsprocessen, kontakta Rekryteringspartner Fanny Sjdell, fanny.sjodell@afry.com   Ansk via anskningsknappen d vi inte kan ta emot anskningar via mejl.Vlkommen med din anskan senast 8/6!P AFRY driver vi frndring i allt vi gr. Vi anser att frndring sker nr modiga ider mts, nr vi samarbetar, skapar innovation och omfamnar kreativa lsningar, det r s vi skapar framtiden. Vi sker konstant kvalificerade kandidater som vill ansluta sig till vra inkluderande  team runt om i vrlden. Bli en del av oss och pskynda den grna omstllningen"
2987620,"Vi söker Supplier Quality Engineers med intresse för leverantörsutveckling i olika branscher! ","https://jobs.smartrecruiters.com/AFRY/744000060776414-vi-soker-supplier-quality-engineers-med-intresse-for-leverantorsutveckling-i-olika-branscher-","Afry","Södertälje","No","Not specified","Full time","2025-05-23T02:01:35.534722Z","r du en kvalitetsmedveten ingenjr med ett ga fr detaljer och ett stort intresse fr leverantrsutveckling? Vill du arbeta som konsult i teknikens framkant hos vra kunder inom olika branscher? D kan det hr vara nsta steg i din karrir!Som Supplier Quality Engineer kommer du att arbeta med att skerstlla och utveckla kvaliteten hos vra kunders leverantrer. Du kommer att vara en viktig lnk mellan vra kunders kvalitetsorganisation och deras leverantrsntverk. Du kommer att arbeta nra bde inkp, produktion och leverantrer fr att flja upp och utveckla kvalitetsprocesser.Uppdragen varierar ver tid men kan inkludera:Genomfrande av leverantrsrevisioner och uppfljningarKvalitetsuppfljning och avvikelsehanteringKravstllning och bedmning av nya och befintliga leverantrerStd vid NPI och frndringshanteringSamarbete med tvrfunktionella teamVilka r vi?Vr sektion Compliance &amp; Quality Management (CQM) bestr av ca 30 medarbetare i Mlardalen, Malm och Gteborg. Sektionen drivs av Britta-Stina tillsammans med gruppchef Lars och vr team-leader Jacob. Bland vra medarbetare som r allt frn nyexaminerade till seniora, finns en bred kompetens inom kvalit, compliance och verksamhetsutveckling. Vi arbetar med produkter i hela dess livscykel eller processer i hela fretagets organisation i olika branscher och organisationer. Vi ser grna att du har:Ngra rs erfarenhet av kvalitetsarbete, grna inom tillverkande industriErfarenhet av leverantrsbedmning och/eller revisionerFrstelse fr kvalitetsstandarder ssom ISO 9001, IATF 16949 eller liknandeGod kommunikationsfrmga och vana att arbeta i grnssnittet mellan teknik och affrFlytande svenska och engelska i tal och skriftVi blir extra glada om du ven har:Erfarenhet av APQP, PPAP, SQAP eller liknandeTidigare arbetat med kravstllning mot underleverantrerErfarenhet frn fordons-, verkstads- eller processindustrinFr att vara aktuell fr denna tjnst godknns enbart svenskt medborgarskap. Du kan behva genomg en skerhetsprvning, i enlighet med skerhetsskyddslagen.Vr konsultgrupp prglas av samarbete, ppenhet, professionalism och vi drivs av att skapa mervrde fr vra kunder. Vrt affrsomrde kan utver konsulttjnster ven erbjuda vra kunder paketerade lsningar och produkter.Vi erbjuder en arbetsplats med framtanda och trygghet i form av kollektivavtal och personalfrmner fr samtliga av vra medarbetare. Vr personalklubb arrangerar sociala aktiviteter p och utanfr kontoret. Allt frn skidresor, sjunga i kr till att spela brdspel  det finns ngot fr alla.Vi sker dig som vill vara en del av AFRYs framgngssaga. Brinner du fr teknisk utveckling? Gillar du att samarbeta fr att hitta den bsta lsningen? D kan vi erbjuda dig karrirmjligheter p en modern arbetsplats med utmanande arbetsuppgifter och spnnande projekt vrlden ver.Kontaktuppgifter fr frgorFr frgor gllande tjnsten, kontakta Segmentschef Britta-Stina Karlsson brittastina.karlsson@afry.comFr frgor gllande rekryteringsprocessen, kontakta Rekryteringspartner Fanny Sjdell, fanny.sjodell@afry.com   Ansk via anskningsknappen d vi inte kan ta emot anskningar via mejl.Vlkommen med din anskan senast 8/6!P AFRY driver vi frndring i allt vi gr. Vi anser att frndring sker nr modiga ider mts, nr vi samarbetar, skapar innovation och omfamnar kreativa lsningar, det r s vi skapar framtiden. Vi sker konstant kvalificerade kandidater som vill ansluta sig till vra inkluderande  team runt om i vrlden. Bli en del av oss och pskynda den grna omstllningen"
2982262,"Techniker Örtliche Bauaufsicht Infrastruktur (m/w/d)","https://jobs.smartrecruiters.com/AFRY/744000060690045-techniker-ortliche-bauaufsicht-infrastruktur-m-w-d-","Afry","Salzburg","No","Not specified","Full time","2025-05-23T02:01:35.534737Z","Wir bernehmen unter anderem die Verantwortung fr folgende Aufgabenbereiche:Koordination des BaugeschehensQualittsberwachungKostenverfolgungAbrechnungPlanmanagementBaudokumentationTerminverfolgungAusschreibungenMehrkostenforderungenVertragsmanagementDabei ist es unser Anspruch, ber das gewohnte Ma hinaus Teamwork und Kooperation zu frdern. Als rtliche Bauaufsicht verstehen wir uns als Vermittler zwischen allen Projektbeteiligten und sehen es als eine unserer Kernkompetenzen, gemeinsam mit unseren Projektpartnern eine erfolgreiche Abwicklung von Infrastrukturprojekten zu gewhrleisten.ber DichWir suchen laufend neue Kollegen, die unser Team verstrken und je nach Qualifikation und Erfahrung als BA-Techniker oder auch in leitender Funktion als BA-Leiter eigenstndig und engagiert zu einer erfolgreichen Projektabwicklung beitragen.Folgende Qualifikation erwarten wir von Dir:Abgeschlossene technische Ausbildung (HTL Hoch- und Tiefbau und/oder Studium im Bauingenieurwesen)Erfahrung in der Abwicklung von Infrastruktur-BauprojektenSehr gute technische wie auch bauwirtschaftliche und baurechtliche Kenntnisse (sterreichisches Baurecht)Sehr gute Deutschkenntnisse (mindestens C1)Auerdem verfgst Du ber folgende Kompetenzen:Ausgezeichnete Kommunikationsfhigkeiten und eine hohe SozialkompetenzGenaue und strukturierte ArbeitsweiseDu bist mutig und entschlossen, forderst Dich gerne selbst und tritts dafr ein, woran Du glaubst?Du bist ein Teamplayer, tauscht Dich mit deinen Kollegen und Projektpartnern aus, forderst und untersttzt Sie?Dann bist Du bei uns genau richtig!Unser Angebot Eine vielseitige und anspruchsvolle Ttigkeit in einem internationalen Unternehmen, welches Nachhaltigkeit und Umweltbewusstsein lebtAttraktive WeiterbildungsmglichkeitenOffenes Arbeitsklima, um Innovation und Weiterentwicklung zu frdernBetriebliche Gesundheitsfrderung Dein Dienstort ist Salzburg, von dort aus wirst Du zu abwechslungsreichen Bauprojekten in Salzburg sowie in Obersterreich, Niedersterreich, der Steiermark und Krnten entsendet. Neben den bereits genannten Benefits ist es uns wichtig, Dir ein faires und attraktives Vergtungspaket anzubieten. Fr diese Position bieten wir ein Mindestgrundgehalt ab  48.750,- brutto pro Jahr (auf der Basis von 39 Wochenstunden, kein All-In). Eine berzahlung ist je nach vorhandener Erfahrung und Qualifikation mglich. Besonders wichtig ist uns, dass Du Dich in unserem Team weiterentwickeln und wachsen kannst. Wir haben Programme entwickelt, wie zum Beispiel unsere eigene AFRY Austria Akademie oder unser Mentorenprogramm. Werde Teil von AFRY und bewirb Dich jetzt!Bei AFRY sorgen wir bei allem, was wir tun, fr Vernderungen. Denn Wandel entsteht nur, wenn mutige Ideen zusammenkommen. Wenn wir erfolgreich zusammenarbeiten, innovativ ttig sind und unterschiedliche Blickwinkel einnehmen. So gestalten wir die Zukunft. Wir sind aktiv auf der Suche nach qualifizierten Bewerberinnen und Bewerbern, die ein Teil unserer integrativen und vielfltigen Teams auf der ganzen Welt werden mchten. Schliee Dich uns an, um den bergang zu einer nachhaltigeren Zukunft zu beschleunigen."
2982261,"Techniker Örtliche Bauaufsicht für Stromleitungsbau (m/w/d)","https://jobs.smartrecruiters.com/AFRY/744000060690215-techniker-ortliche-bauaufsicht-fur-stromleitungsbau-m-w-d-","Afry","Salzburg","No","Not specified","Full time","2025-05-23T02:01:35.534752Z","Wir bernehmen die Verantwortung fr folgende Aufgabenbereiche:Koordination des BaugeschehensQualittsberwachungKostenverfolgungAbrechnungPlanmanagementBaudokumentationTerminverfolgungAusschreibungenMehrkostenforderungenVertragsmanagementDabei ist es unser Anspruch, ber das gewohnte Ma hinaus Teamwork und Kooperation zu frdern. Als rtliche Bauaufsicht verstehen wir uns als Vermittler zwischen allen Projektbeteiligten und sehen es als eine unserer Kernkompetenzen, gemeinsam mit unseren Projektpartnern eine erfolgreiche Abwicklung von Infrastrukturprojekten zu gewhrleisten.ber DichWir suchen laufend neue Kollegen, die unser Team verstrken und je nach Qualifikation und Erfahrung als BA-Techniker oder auch in leitender Funktion als BA-Leiter eigenstndig und engagiert zu einer erfolgreichen Projektabwicklung beitragen.Folgende Qualifikation erwarten wir von Dir:Abgeschlossene technische Ausbildung (HTL Hoch- und Tiefbau und/oder Studium im Bauingenieurwesen)Erfahrung in der Abwicklung von Infrastruktur-BauprojektenSehr gute technische wie auch bauwirtschaftliche und baurechtliche Kenntnisse (sterreichisches Baurecht)Sehr gute Deutschkenntnisse (mindestens C1) Auerdem verfgst Du ber folgende Kompetenzen:Ausgezeichnete Kommunikationsfhigkeiten und eine hohe SozialkompetenzGenaue und strukturierte ArbeitsweiseDu bist mutig und entschlossen, forderst Dich gerne selbst und tritts dafr ein, woran Du glaubst?Du bist ein Teamplayer, tauscht Dich mit deinen Kollegen und Projektpartnern aus, forderst und untersttzt Sie?Dann bist Du bei uns genau richtig!Unser Angebot Eine vielseitige und anspruchsvolle Ttigkeit in einem internationalen Unternehmen, welches Nachhaltigkeit und Umweltbewusstsein lebtAttraktive WeiterbildungsmglichkeitenOffenes Arbeitsklima, um Innovation und Weiterentwicklung zu frdernBetriebliche Gesundheitsfrderung, mit regelmigem Angebot Dein Dienstort ist Salzburg, von dort aus wirst Du zu abwechslungsreichen Bauprojekten in Salzburg sowie in Obersterreich, Niedersterreich, der Steiermark und Krnten entsendet. Neben den bereits genannten Benefits ist es uns wichtig, Dir ein faires und attraktives Vergtungspaket anzubieten. Fr diese Position bieten wir ein Mindestgrundgehalt ab  48.750,- brutto pro Jahr (auf der Basis von 39 Wochenstunden, kein All-In ). Eine berzahlung ergibt sich je nach vorhandener Erfahrung und Qualifikation. Besonders wichtig ist uns, dass du dich in unserem Team weiterentwickeln und wachsen kannst. Wir haben Programme entwickelt, wie zum Beispiel unsere eigene AFRY Austria Akademie oder unser Mentorenprogramm. Werde Teil von AFRY und bewirb dich jetzt! Bei AFRY sorgen wir bei allem, was wir tun, fr Vernderungen. Denn Wandel entsteht nur, wenn mutige Ideen zusammenkommen. Wenn wir erfolgreich zusammenarbeiten, innovativ ttig sind und unterschiedliche Blickwinkel einnehmen. So gestalten wir die Zukunft. Wir sind aktiv auf der Suche nach qualifizierten Bewerberinnen und Bewerbern, die ein Teil unserer integrativen und vielfltigen Teams auf der ganzen Welt werden mchten. Schliee Dich uns an, um den bergang zu einer nachhaltigeren Zukunft zu beschleunigen."
2982260,"Electrical Engineer","https://jobs.smartrecruiters.com/AFRY/744000060699965-electrical-engineer","Afry","Noida","No",5,"Full time","2025-05-23T02:01:35.534768Z","Your key responsibilitiesElectrical designer for MEP ServicesAutoCAD / Revit / MagiCAD) with output in dwgDrawing productionModel productionEducation: Bachelors or Masters degree in Electrical Engineering or equivalent from recognized universities in countries such as India, the Philippines, China, Pakistan, Indonesia, Vietnam, etc.Professional Experience: Minimum 5 years of experience in electrical design and planning for buildings  including offices, residential buildings, industrial facilities, or public environments.Software Skills:Proficiency in AutoCAD, Revit, Dialux/Relux, Solibri and documentation in Microsoft Office or similar environments.Regulations &amp; Standards:Basic understanding of international standards (e.g., IEC, NEC). Willingness and ability to quickly learn Swedish regulations (such as ELSK-FS, BBR, AMA EL).Language:English  good proficiency in both spoken and written form is required. Swedish is not mandatory at the time of employment, but willingness to learn technical terms in Swedish is highly desirable.Merits:Previous experience with international projects or working with Nordic companies.Certifications such as PMP, Certified Electrical Engineer, or experience in electrical inspections.Knowledge of Nordic standards or experience working in Nordic markets.Ability to adapt to new work cultures and technical practices.Experience working according to BIM standards and coordination in 3D models.Personal Qualities:Flexible and solution-oriented.Strong work ethic and ability to work independently.Excellent collaboration skills in a project environment.Eager to learn  especially Swedish regulations, language, and construction methods.Strong communication skills in English  both written and verbal.At AFRY, we engineer change in everything we do. Change happens when brave ideas come together. When we collaborate, innovate technology, and embrace challenging points of view. Thats how we're making future. We are actively looking for qualified candidates to join our inclusive and diverse teams across the globe. Join us in accelerating the transition towards a sustainable future."
2982259,"Projektleiter:in in der Objektplanung von Kläranlagen (Mensch*)","https://jobs.smartrecruiters.com/AFRY/744000060700475-projektleiter-in-in-der-objektplanung-von-klaranlagen-mensch-","Afry","Essen","No","Not specified","Full time","2025-05-23T02:01:35.534783Z","Du bist fr die Auslegung und Planung von kommunalen Klranlagen in allen Leistungsphasen der HOAI verantwortlichDu bist fr die Projektbearbeitung unter Einbeziehung und Fhrung der Fachplaner wie z.B. Verfahrens- und Maschinentechnik, Tragwerksplanung und Elektrotechnik zustndigDie technische und kaufmnnische Abwicklung von Projekten in der Planung, Ausfhrung und Bauberwachung gehrt ebenso zu Deinen AufgabenErfahrung:
Du kannst ein abgeschlossenes Studium im Bauingenieurwesen bzw. Verfahrens- oder Umwelttechnik nachweisen. Du kannst mind. fnf Jahre Berufserfahrung in der Planung von Klranlagen vorweisen.Fhigkeiten:
Du besitzt eine gute Kommunikationsfhigkeiten und die Fhigkeit zur Zusammenarbeit im Team. Ebenso hast du sehr gute Deutschkenntnisse in Wort und Schrift.Mindset:
Du verfgst ber eine schnelle Auffassungsgabe und ein hohes Ma an Engagement.Du bist Teil spannender Projekte, die ihren Fokus auf Ressourcenschonung setzenDurch standortbergreifende Zusammenarbeit und vielfltige Netzwerkmglichkeiten, kannst Du Dein Wissen erweitern und von den Erfahrungen anderer profitierenBei uns kannst Du flexible Arbeitsbedingungen genieen, so sind Beruf und Privatleben optimal miteinander vereinbarWir bieten Dir eine individuelle Einarbeitung und ein angepasstes Buddy-Programm, damit Du Dich schnell in Deinem neuen Team zurechtfindestFr uns zhlt der Mensch als Ganzes. Deshalb bieten wir Dir ein umfassendes Gesundheitsprogramm an, welches Dich dabei untersttzt, fit und motiviert zu bleibenDu mchtest Wechseln? Das bleibt unter uns!
Wir behandeln Deine Daten sowie Deine Bewerbung im gesamten Bewerbungsprozess streng vertraulich.Passt nicht?
Die Stellenanzeige spricht Dich an, Du bist Dir allerdings nicht zu 100 % sicher, ob Dein Profil passt. Bewirb Dich trotzdem! Oder nutze die Chance zu einer Initiativbewerbung. Klicke hier So gehts weiter:Bewirb Dich direkt Online, indem Du auf den Apply now Button fr den fr Dich passenden Standort klickst. Hier gelangst Du in unser BewerberportalNutze fr weitere Fragen unsere direkten Ansprechpartner:innen aus unserem internen Recruiting-TeamNach Sichtung deiner Unterlagen und der Abstimmung mit dem zustndigen Fachbereich, melden wir uns schnellstmglich bei Dir zurckAnschlieend lernen wir uns per Microsoft-Teams oder direkt persnlich an einem unserer Standorte kennen und besprechen alle weiteren EinzelheitenKontakt:
AFRY Deutschland GmbH
Jennifer Morano
Senior Recruiterin | Human Resources
M: +49 172 981 1201Bei AFRY verwenden wir das geschftliche Du. Wir freuen uns daher auf Deine Ansprache in Du-Form.*Wir bei AFRY legen Wert auf Vielfalt - bei AFRY kannst Du Du sein. Fr uns spielt es keine Rolle, ob weiblich, mnnlich oder divers, wo Du herkommst, welche Hautfarbe Du hast oder woran Du glaubst. Fr uns stehen gegenseitiger Respekt und Wertschtzung stets an oberster Stelle. Denn bei uns steht der Mensch im Mittelpunkt, um nachhaltige Lsungen fr die kommende Generation zu schaffen. Die Arbeit bei uns ist vielseitig und erfllend.MAKING FUTUREBei AFRY sorgen wir bei allem, was wir tun, fr Vernderungen. Denn Wandel entsteht nur, wenn mutige Ideen zusammenkommen. Wenn wir erfolgreich zusammenarbeiten, innovativ ttig sind und unterschiedliche Blickwinkel einnehmen. So gestalten wir die Zukunft. Wir sind aktiv auf der Suche nach qualifizierten Bewerberinnen und Bewerbern, die ein Teil unserer integrativen und vielfltigen Teams auf der ganzen Welt werden mchten. Schliee Dich uns an, um den bergang zu einer nachhaltigeren Zukunft zu beschleunigen."
2982258,"Senior Environmental Consultant, Renewable Energy And Thermal Power","https://jobs.smartrecruiters.com/AFRY/744000060700555-senior-environmental-consultant-renewable-energy-and-thermal-power","Afry","Manila","No",8,"Full time","2025-05-23T02:01:35.534798Z","Lead and support environmental and social (E&amp;S) feasibility studies for energy sector projects (natural gas, LNG to Power, biomass, Waste to Energy, wind, solar, hybrid, etc.) and potential other sectors e.g. infrastructure.Lead and support Environmental and Social Due Diligence (ESDD) studies for energy sector projects and potential other sectors.Lead and support as lenders environmental and social advisor during the construction and operation of energy sector projects and potential other sectors, including supporting consultations with Project Affected Persons and other stakeholders in the Philippines.Perform the role as Project Manager for Environmental and Social Impact Assessments (ESIAs) and the development E&amp;S Management Plans. Provide guidance on environmental matters, including regulatory E&amp;S requirements in the Philippines.Support Clients to develop and implement Environmental and Social Management Systems (ESMS).Contribute to business development by providing strategic advice on environmental and social issues to existing and potential clients, including the preparation of marketing material.Preparation of proposals (technical and financial) for environmental social services.Support other AFRY E&amp;S staff in the region and contribute to work outside of the region when opportunities arise.Enforce ethics and compliance in accordance with AFRY Code of Conduct.Higher professional degree in environmental science, engineering or related field (B.Sc., M.Sc. or Ph.D.).8+ years experience in environmental consulting / management.Experience in the preparation of ESIAs and E&amp;S Management Plans for renewable and thermal power projects.Experience in performing ESDD for renewable and thermal power projects.Track record of project managing environmental and social services for renewable and thermal power projects.Knowledge of potential social issues i.e. labor issues, resettlement and livelihood issues would be an advantage, including experience in undertaking stakeholder engagement activities.Knowledge of Philippines regulatory E&amp;S requirements and international E&amp;S standards and guidelines i.e. Equator Principles, IFC Performance Standards, WBG EHS Guidelines, ADB Safeguards etc.The willingness to travel to other countries inside and outside the region to support environmental and social services.Fluency in English.Excellent report writing, presentation and verbal communication skills.Ability to work well with people from a range of cultures.Ability to work independently.We offer the following to qualified candidates:Friendly international working environment with a wide variety of interesting and challenging tasksCompetitive salary packageCareer opportunity in one of the largest international consulting and engineering companiesPossibility to grow professionally and advance in careerPossibility to work in international renewable energy projectsAFRY is committed to creating an inclusive &amp; diverse environment and we are actively looking for qualified candidates irrespective of gender, gender identity, sexual orientation, ethnicity, religion, disability, or age. You will be part of a global and diverse company where our differences are our strengths. Join us to accelerate the transition towards a sustainable society.At AFRY, we engineer change in everything we do. Change happens when brave ideas come together. When we collaborate, innovate technology, and embrace challenging points of view. Thats how we're making future. We are actively looking for qualified candidates to join our inclusive and diverse teams across the globe. Join us in accelerating the transition towards a sustainable future."
