"ID","Title","Link","Company","Location","Remote","Experience","EmploymentType","DatePosted","RoleDescription"
2311942,"Vehicle Condition Associate ","https://www.carvana.com/careers/apply?gh_jid=6573988","carvana","Chesterfield, VA","No","Not specified","Full time","2025-05-07T02:00:14.059976Z","Vehicle Condition Associate I
Position Overview:
This entry level position is responsible for accurately assessing, documenting and maintaining the status and appearance of Carvanas wholesale inventory. This position is not eligible for visa sponsorship.
What youll be doing:

Ensure each vehicle is inspected for mechanical, drivability, and cosmetic concerns.
Operate state-of-the-art digital tools to accurately assess exterior and interior condition of Carvanas wholesale inventory.
Consistently use mobile tools to take multiple images of the assigned vehicles, including photos of any observed damage.
Ensure each vehicle is documented with the correct trim levels and other vehicle features/attributes.

 
What the Job Requires
To be able to do your job at Carvana, there are some basic requirements we want to share with you.

High School Diploma or equivalent is required.


At least 18  years of age.
Valid drivers license with a clean driving record (no DUIs and no more than two moving violations in the last 3 years).


Ability to use digital devices and mobile applications.
Ability to pay attention to detail. 
Ability to frequently stand, sit, walk, bend, stoop, squat, and lift up to 40 lbs.
Ability to drive frequently.
Ability to work outdoors continuously.
Ability and comfortability to be around fumes or odors that are from vehicles under maintenance.
Ability to work  in various weather conditions such as: rain, snow, heat, etc. 

 This job description is not designed to contain a comprehensive listing of activities, duties, or responsibilities that are required of the employee for this job. Duties, responsibilities, and activities may change at any time with or without notice."
2593873,"Entry-Level Auto Technician","https://www.carvana.com/careers/apply?gh_jid=6709505","carvana","Blue Mound, TX","No",5,"Full time","2025-05-07T02:00:14.060001Z","Were looking for Automotive Mechanics with a minimum of 6 months of professional automotive repair experience to join us at Carvana - the fastest-growing used automotive retailer in U.S. history and one of the four fastest companies to make the Fortune 500.As an Entry-Level Technician, youll be expected to perform light maintenance, fluid checks, and/or conduct the initial inspection on our vehicles to look for any imperfections or repairs that may be needed throughout the reconditioning process.At Carvana, youll receive a competitive wage and amazing perks  including a 401(k) with Carvana match and even a vehicle purchase discount  all while using state of the art tools in one of our high-tech Inspection Centers (click here to learn more). If youre joining us in an entry-level position, we offer training programs to make sure your skills and pay progress along with the company.
Other perks of the Job

100% company-paid healthcare premiums
Generous paid-time off and your birthday is a holiday!
ASE and tool reimbursement programs
Tuition reimbursement and student loan repayment

How To Get StartedJoin the Carvana team by applying on this page, or call one of our recruiters by phone at (888) 508-4749, Monday through Friday, between 6 AM and 4 PM MST.
Not a match for this role?We have a variety of Technician roles in our Inspection Centers, depending on your level of experience - take a look below to see what youll be doing to help us get our low-mileage, late-model cars ready for our customers:

Entry-Level Auto Technician (min 6 months professional experience): perform light maintenance, fluid checks, and/or conduct the initial inspection on our vehicles to look for any imperfections or repairs that may be needed throughout the reconditioning process.
Brake and Tire Technician (min 1 year professional experience): perform light maintenance or repairs, including changing brakes and tires
Mid-Level (Mechanical Repair / Build / General) Technician (min 3 years of professional experience): perform light to medium automotive repairs and minimal diagnostics on our vehicles
Experienced Technician (min 5 years of professional experience): perform extensive repairs and heavy engine work, as well as advanced vehicle diagnostics on all makes and models, including electric and hybrid vehicles

We also have a variety of other automotive roles available in one of our 18 locations across the country  take a look at our Careers site to apply for one of the following roles:

Auto Body roles: Paint, Prep/Body work, Wheel Repair, Airbrush, Interior Repair, Glass Repair, and PDR (Paintless Dent Repair) roles
Auto Technician/Mechanic roles: Lube and Oil, Inspection, Brake and Tire, Mechanical Repair / Build, and Master Technician roles
Entry-Level roles: Detailing, Inventory Associate (Car Porters), Photo, Parts Associate, Inspection, and Coordinator/Administrator roles

General qualifications and requirements

Ability to physically operate vehicle equipment and tools - must be able to lift up to 60 pounds independently
Must be at least 18 years of age and possess a valid drivers license. Some positions may be subject to an Motor Vehicle Records (MVR) check
An ability to work in a fast-paced, ever-changing production environment while sometimes being exposed to excessive weather conditions (heat/cold)
Use of safety equipment that may include but not limited to face shield or goggles, non-slip shoes, gloves, mask, and other protective garments and equipment

About CarvanaAt Carvana, we sell cars but we arent car salesmen. Our promise is simple: we wont sell a car to a customer that we wouldnt sell to our own Mom. Period.To make sure our cars are in first-rate condition, weve built multiple vehicle Reconditioning Centers around the country, where our cars are inspected, perfected, and photographed before reaching the Carvana website.Think youve got what it takes to join our team? Apply today!Carvana is an equal employment opportunity employer. All applicants receive consideration for employment without regard to race, color, religion, gender, sexual orientation, gender identity or expression, marital status, national origin, age, mental or physical disability, protected veteran status, or genetic information, or any other basis protected by applicable law. Carvana also prohibits harassment of applicants or employees based on any of these protected categories.Hiring is contingent on passing a complete background check. This role is not eligible for visa sponsorship. Must be at least 18 years of age and possess a valid drivers license. Must be able to read, write, speak and understand English."
2766951,"Customer Delivery Driver","https://www.carvana.com/careers/apply?gh_jid=6794336","carvana","Bentonville, AR","No",4,"Full time","2025-05-07T02:00:14.060027Z","We're looking for Customer Advocates with at least 2 years of customer-facing experience to build an exciting career at Carvana - the fastest-growing used automotive retailer in U.S. history and one of the four fastest companies to make the Fortune 500!
Whether it's delivering happiness to customers on the driveway or getting involved in the local community, our Customer Advocates are leading the charge in reintroducing happiness into the car-buying process. Ready to join the 'Hauler-Life'? Check out more below:

Shift Requirement: The hours for this position are from 11am - 9pm. We ask that team members be available to work 7 days a week. Days off will rotate between weekdays and weekend days.
Base compensation of $17/hour
Opportunity to increase hourly compensation by .50 cents every 3 months based on performance!
You'll get to represent our dynamic brand in dynamic ways! From delivering memorable customer experiences in the field to helping run one of our Vending Machines (in some locations), our Customer Advocates provide a one-of-a-kind and seamless car-delivery experience to each and every customer.
Competitive benefits that include medical, dental, vision, and matching 401k, along with other cool perks programs including student loan payments, discounts on vehicles, benefits for you pet(s), and much more!

We're looking for enthusiastic, energetic, and self-motivated team players with at least 2 years of customer-facing experience to:

Deliver vehicles straight to customers' doors with our custom car haulers (don't worry - a commercial license is not required to drive the hauler and you will receive ample training)
Frequently load/unload vehicles onto the hauler (this part does require getting physical!) and regularly inspect the car-hauler to make sure the vehicle maintains safe to drive
Complete customer paperwork and include thorough notes in our customer tracking system
Consistently drive safe and maintain a clean driving record in accordance with Carvana's CMV Driver Qualification policy.

* Candidates must have (or be able to obtain) a Notary in your local jurisdiction within the first 90 days of employment (process sponsored by Carvana). This process may involve satisfying state-specific requirements. For further details, candidates can review their local state notary requirements here: State Notary Requirements.
* Candidates must be able to satisfy state-specific requirements related to access DMV/title and registration systems.
* Illinois, Michigan, Louisiana, and Missouri employees must obtain a Chauffeur's license or any other state specialty license within the first two weeks of employment (process sponsored by Carvana).
* California employees must obtain a Vehicle Verifier license within the first 90 days of employment (Process sponsored by Carvana)
General qualifications and requirements

Ability to perform physically demanding tasks like detailing vehicles and loading/unloading vehicles onto our haulers in indoor and outdoor conditions with occasional exposure to inclement/extreme weather (some markets may require deliveries to be made in the snow, while other markets require deliveries to be made in the summer heat).
Ability to walk/stand and sustain physical activity for extended periods of time (8+ hours)
Must be able to read, write, speak and understand English
Requires high and low levels of movement with the ability to reach with arms, twist, kneel, crouch, climb, balance, and squat
Requires the grasping, carrying, lifting, pushing, and pulling of items of 50lbs.
Frequent driving requires excellent visual acuity and manual dexterity. Reasonable accommodations may be granted to enable individuals with disabilities to perform the essential functions

About Carvana
At Carvana, we sell cars but we aren't car salesmen. Our promise is simple: we won't sell a car to a customer that we wouldn't sell to our own Mom. Period. Being a brand ambassador at Carvana means having a passion for our vision and having a motor that never quits when it comes to representing our brand and values. Our Market Operations team members work as a team to deliver awesome customer experiences in their markets, while also remaining agile enough to keep up with the ever-changing beat and cadence of your daily activities. Think you've got what it takes to join our team? Apply today!
Carvana is an equal employment opportunity employer. All applicants receive consideration for employment without regard to race, color, religion, gender, sexual orientation, gender identity or expression, marital status, national origin, age, mental or physical disability, protected veteran status, or genetic information, or any other basis protected by applicable law. Carvana also prohibits harassment of applicants or employees based on any of these protected categories.
All applicants must pass a drug test and obtain a DOT Medical Card. Hiring is contingent on passing a complete background check. This roles is not eligible for visa sponsorship. Must be at least 21 years of age and possess a valid driver's license. Must be able to read, write, speak, and understand English."
2782229,"Automotive Detailer - ADESA","https://www.carvana.com/careers/apply?gh_jid=6805027","carvana","Lexington","No","Not specified","Full time","2025-05-07T02:00:14.060052Z","Pay: $16 hourly
Monday-Friday 8am-4:30pm schedule
Full Benefits Offered after 30 Days
Advancement Opportunities
 
ADESA is looking for great people to join our Vehicle Detail Team! Our detail centers are the last stop in the vehicle processing lifecycle and play a vital role in sale ready preparation. Whether youre entry level, intermediate, or consider yourself an expert, we want to talk with you if: youre motivated by staying busy, interested in an automotive career, enjoy working with friendly people, and want to contribute your way to upward mobility and growth.
Automotive Detailer Responsibilities and Duties:

Work in team units tasked with vehicle cleaning, detailing, and sale ready prep
Learn &amp; apply proper techniques for exterior and interior cleaning processes
Learn &amp; apply vehicle inspection techniques to maintain proper standards
Preparation for advanced techniques

See us in action: https://vimeo.com/652202630/3ae8c047b6
Qualifications:

Experience in automotive detailing preferred (not required). 
Must be at least eighteen (18) years of age.
Must be qualified to operate a motor vehicle and possess a valid drivers license.
Must have a demonstrated ability to read, write, and communicate effectively in English.
Must have the ability to physically operate vehicle equipment and tools.

PERKS &amp; BENEFITS:

Medical, Dental, and Vision benefits.
401K with company match.
Generous PTO (paid time off).
A multitude of perks including student loan payments, reimbursement programs, discounts on vehicles, benefits for your pets, and much more.
A great wellness program to keep you healthy and happy both physically and mentally.
Access to opportunities to expand your skillset and share your knowledge with others across the organization.

ABOUT US
ADESA currently operates 56 locations throughout the US. Our Vehicle Service &amp; Logistics Centers, some up to 200 acres, provide a wide array of vehicle services including repair &amp; reconditioning, auction remarketing, and many locations serve as market hub distribution sites. Our inventory comprises hundreds of thousands of vehicles across North America from retail to commercial, OEM &amp; more.
As an industry leader, ADESA is poised for a multi-year expansion including huge investments in facilities, massive sales growth, and an ever-increasing inventory of vehicles! We are looking for great people who want to take this journey with us!
Legal:
Hiring is contingent on passing a complete background check and motor vehicle record check. This role is not eligible for visa sponsorship.
ADESA is an equal employment opportunity employer. All applicants receive consideration for employment without regard to race, color, religion, gender, sexual orientation, gender identity or expression, marital status, national origin, age, mental or physical disability, protected veteran status, or genetic information, or any other basis protected by applicable law. ADESA also prohibits harassment of applicants or employees based on any of these protected categories.
Please note this job description is not designed to contain a comprehensive listing of activities, duties, or responsibilities that are required of the employee for this job. Duties, responsibilities, and activities may change at any time with or without notice."
2903930,"Wholesale Team Lead- Haines City","https://www.carvana.com/careers/apply?gh_jid=6864590","carvana","Haines City, Fl ","No",5,"Full time","2025-05-07T02:00:14.060078Z","Position Overview:
This supervisory position manages a team of Wholesale Advocates to ensure that the daily operating procedures run smoothly and efficiently while working closely with the Wholesale Operations Manager. This position is not eligible for visa sponsorship.
Salary: The Team Lead role starts at $45,000+ annually 
What youll be doing:

Oversee day-to-day activities of assigned team; identify teams strengths and weaknesses; determine areas of opportunity and the appropriate steps to improve.
Actively train, manage and develop the team by providing in the moment coaching, feedback and mentorship related to operations and customer experience; regularly communicating and coaching employees.
Lead Associate Director, Area Manager and Operations Manager site visits and keep leaders up to speed on any changes occurring at the site level.
Work with leadership to define team objectives.
Generate, monitor and understand reports to support business needs while presenting to upper management.
Provide vision and guidance for site specific Areas of Responsibility.
Recognize and reinforce individual and team accomplishments by using existing organizational tools and programs as well as by finding new, creative and effective methods of recognition.
Regularly participate in recruiting and communicating with external candidates.
Actively participate in the development and growth of the team.
Manage site operations, consumer outreach, employee development and a portfolio of non-retail vehicles. 
Identify and make important strategic decisions within the scope of the role.
Serve as a subject matter expert on vehicle trade intake operations and validation procedures.
Address and effectively manage complex and sensitive customer- facing issues. 
Monitor the transportation of all inbound and outbound wholesale inventory.  
Develop, coordinate, and enforce systems, policies, procedures, and productivity standards.
Manage daily workload and goals and create a strong and positive morale and spirit throughout the team. 
Maintain site integrity by accurately tracking vehicles and ensuring regular upkeep of facilities.

 
What the Job Requires:
To be able to do your job at Carvana, there are some basic requirements we want to share with you.

Bachelors Degree, or equivalent work experience, in  Supply Chain or similar field 
5+ years work experience in a customer facing team environment 
3+ years of leadership experience 
Proven history of developing and coaching employees
Prior experience with strategic planning, process improvement, and guiding teams to exceed goals
Valid drivers license with a clean driving record, compliant with Company guidelines.
Ability to operate a computer and/or tablet
Ability to effectively delegate tasks to team members
Ability to work as a team player and interact with customers, managers and coworkers in a positive, professional and courteous manner
Ability to multitask, problem solve, and prioritize effectively
Ability to frequently stand, sit, walk, bend, stoop, squat, and lift up to 40 lbs
Ability to frequently drive
Ability to push and pull in an environment that could be cold, hot, wet or noisy
Ability to be around fumes or odors that are from vehicles under maintenance
Ability to work in various weather conditions such as: rain, snow, heat, etc

This job description is not designed to contain a comprehensive listing of activities, duties, or responsibilities that are required of the employee for this job. Duties, responsibilities, and activities may change at any time with or without notice."
2903928,"Vehicle Check-In Coordinator - ADESA Auto Auction","https://www.carvana.com/careers/apply?gh_jid=6860629","carvana","New Stanton, PA","No","Not specified","Full time","2025-05-07T02:00:14.060104Z","Join Our Fast-Paced Team as a Vehicle Check-In Coordinator at ADESA!
Are you passionate about cars and thrive in a dynamic, high-energy environment? Do you have a keen eye for detail and love working in a team that keeps things moving? If so, we want YOU to be part of our auto auction team!
As a Vehicle Check-In Coordinator, youll be at the heart of the action, processing incoming vehicles, ensuring accurate documentation, and keeping our auction running smoothly. Every day brings something newdifferent cars, fast-paced challenges, and the thrill of the auction world!
If youre organized, detail-oriented, and ready to shift your career into high gear, apply today and join the excitement!
Location: 378 Hunker Waltz Mill Rd, New Stanton, PA 15672
Schedule: Mon-Fri 8am-5pm
Pay Range: $15-$16/hr
Responsibilities and Duties include but are not limited to the following
1. Provide excellent customer service:

Make sure customers receive a prompt, efficient and courteous attention on the lot.   
Maintain a professional appearance, orderly work environment.
Be familiar with procedures for handling all aspects of customers questions, complaints or disputes.  Advise the Operations Manager or designated manager of all serious complaints or incidences. 

2. Process Check-In of Vehicles:

Using handheld computer, input vehicle information including the VIN number, miles, dealer identification number, vehicle options, repair orders and any other pertinent information. 
Verify the VIN number being entered matches the VIN number on the shippers Bill of Lading.
Generate Stock-In sticker &amp; Auction Sale Sticker (Vehicle Run Number) and apply to window.
Write vehicle run number on the passenger front side window.
Issue new run sticks for vehicles not sold in prior weeks auction and input information into AuctionTrac. 

3. Safety:

Make sure the area conditions do not threaten employee or customer safety.  Respond to and follow proper procedures on employee and customer accidents, injuries and loss or damage to any property. 
Maintain and assure good operating condition of all equipment and facilities. Including handheld computer and printer.  Inform the manger or supervisor of all breakdowns and maintenance needs immediately. 

4. Other:

Practice and promote teamwork at all times.  Set a good personal example of attitude and performance.
Respond to and follow proper procedures on employee and customer accidents, injuries, and loss or damage to any property.  Report all incidents to the Manager.
Practice and promote company Core Values: Integrity, Customer Care, Innovation, Safety, Teamwork, Employee Welfare, Community Involvement and fun. 

Qualifications

Must be at least eighteen (18) years of age.
Must be qualified to operate a motor vehicle and possess a valid drivers license.
Must have a demonstrated ability to read, write, and communicate effectively in English.
Must have the ability to physically operate vehicle equipment and tools.

PERKS &amp; BENEFITS:

Medical, Dental, and Vision benefits.
401K with company match.
Generous PTO (paid time off).
A multitude of perks including student loan payments, reimbursement programs, discounts on vehicles, benefits for your pets, and much more.
A great wellness program to keep you healthy and happy both physically and mentally.
Access to opportunities to expand your skillset and share your knowledge with others across the organization.

ABOUT US
ADESA currently operates 56 locations throughout the US. Our Vehicle Service &amp; Logistics Centers, some up to 200 acres, provide a wide array of vehicle services including repair &amp; reconditioning, auction remarketing, and many locations serve as market hub distribution sites. Our inventory comprises hundreds of thousands of vehicles across North America from retail to commercial, OEM &amp; more.
As an industry leader, ADESA is poised for a multi-year expansion including huge investments in facilities, massive sales growth, and an ever-increasing inventory of vehicles! We are looking for great people who want to take this journey with us!
Legal:
Hiring is contingent on passing a complete background check and motor vehicle record check. This role is not eligible for visa sponsorship.
ADESA is an equal employment opportunity employer. All applicants receive consideration for employment without regard to race, color, religion, gender, sexual orientation, gender identity or expression, marital status, national origin, age, mental or physical disability, protected veteran status, or genetic information, or any other basis protected by applicable law. ADESA also prohibits harassment of applicants or employees based on any of these protected categories.
Please note this job description is not designed to contain a comprehensive listing of activities, duties, or responsibilities that are required of the employee for this job. Duties, responsibilities, and activities may change at any time with or without notice."
