"ID","Title","Link","Company","Location","Remote","Experience","EmploymentType","DatePosted","RoleDescription"
2950949,"Lead Transport Van Driver - ADESA Yaphank","https://www.carvana.com/careers/apply?gh_jid=6889048","carvana","Yaphank, NY","No","Not specified","Full time","2025-05-15T01:59:01.277299Z","Pay Range: $18-$19 hourly
About UsADESA, a Carvana owned company, currently operating over 50 locations throughout the US. Our Auto Auctions, some up to 200 acres, provide a wide array of vehicle services including repair &amp; reconditioning, auction remarketing, and many of our sites serve as market hub distribution centers. Our inventory comprises hundreds of thousands of vehicles across North America from retail to commercial, OEM &amp; more.We work in a service industry and embrace a we versus I culture  help others, and they will help you. Our industry is fun, fast-paced, and competitive  and filled with the best people who are passionate about what they do.Were excited about the future! As an industry leader, ADESA is poised for a multi-year expansion including huge investments in facilities, massive sales growth, and an ever-increasing inventory of vehicles! We are looking for great people who want to take this journey with us! Get a sneak peek into life at ADESA!
Role and Team

Reporting to the Transportation Manager, Lot Manager or designated manager, operate motor vehicles on and off auction premises in support of auction activities. Transports and directs Drivers to move, stage and park vehicles in the correct lot area. Perform all other duties assigned by designated manager. Must know, practice and ensure that company policies and procedures and state or federal laws are followed at all times.

Responsibilities

Transport Auction Drivers on and off auction premises for transport, pickup and delivery in support of auction activities.  
Assign Auction Drivers to a lot area on or off property to move, stage and park vehicles.  
Instruct Auction Drivers on positioning of vehicles as assigned by the designated manager.  

Qualifications

Must be at least eighteen (18) years of age.
Must be qualified to operate a motor vehicle and possess a valid drivers license.
Ability to work in all weather conditions is required.
Must have a demonstrated ability to read, write, and communicate effectively in English.
Must have the ability to physically operate vehicle equipment and tools.
Must be insured and/or insurable if required by the state.

ADESA Benefits and PerksCompetitive Pay | Quality Benefits | Holiday and Paid Time Off | Education and Equipment Reimbursement Programs | Matching 401(k) | Career Path Opportunities | And More!
 
Other RequirementsTo be able to do your job at ADESA, there are some basic requirements we want to share with you. Of course, well make any reasonable accommodations for those with disabilities to perform the essential functions of their jobs. 


Physical Requirements and Working Conditions: The physical requirements of the position are Heavy Physical Work.
Visual acuity requirements include color, depth perception and field of vision comparable to definitions for Mobile Equipment Operator Standard. Constant balancing, stooping, crouching, reaching, standing, walking, pushing, pulling, lifting, fingering, grasping, feeling, talking, hearing, repetitive motionOccasional standingPotential  climbing, crawling

Visual acuity requirements include color, depth perception and field of vision comparable to definitions for Clerical, Administrative, Machine Operators (including inspection) positions. 

Physical Working Conditions
This position is subject to both inside and outside environmental working conditions, including temperature changes, outside weather conditions, slightly elevated ambient noise levels, and minor atmospheric conditions affecting skin or respiratory systems, such as fumes, odors and dusts associated with internal and external service station/convenience food and petroleum dispensing operations.



Note:  Refer to the Handbook and Policy Manuals for important addendum requirements to all job descriptions.  This job description in no way states or implies that these are the only duties to be performed by the employee(s) incumbent in this position.  Employee(s) will be required to follow any other job-related instructions and to perform any other job-related duties requested by any person authorized to give instructions or assignments. The requirements listed in this document are the minimum levels of knowledge, skills, or abilities.



To be able to do your job at ADESA, you must be able to read, write, speak, and understand English. Of course, well make any reasonable accommodations for those with disabilities to perform the essential functions of their jobs.
 
Legal StuffHiring is contingent on passing a complete background check.  This role is not eligible for visa sponsorship.ADESA is an equal employment opportunity employer.  All applicants receive consideration for employment without regard to race, color, religion, gender, sexual orientation, gender identity or expression, marital status, national origin, age, mental or physical disability, protected veteran status, or genetic information, or any other basis protected by applicable law.  ADESA also prohibits harassment of applicants or employees based on any of these protected categories.Please note this job description is not designed to contain a comprehensive listing of activities, duties, or responsibilities that are required of the employee for this job. Duties, responsibilities, and activities may change at any time with or without notice."
2950948,"General Manager - ADESA Auto Auction","https://www.carvana.com/careers/apply?gh_jid=6888750","carvana","Little Rock","No",5,"Full time","2025-05-15T01:59:01.277314Z","About Us
ADESA, a Carvana owned company, currently operating over 50 locations throughout the US. Our auto auctions, some up to 200 acres, provide a wide array of vehicle services including repair &amp; reconditioning, auction remarketing, and many of our sites serve as market hub distribution centers. Our inventory comprises hundreds of thousands of vehicles across North America from retail to commercial, OEM &amp; more.
We work in a service industry and embrace a we versus I culture  help others, and they will help you. Our industry is fun, fast-paced, and competitive  and filled with the best people who are passionate about what they do.
Were excited about the future! As an industry leader, ADESA is poised for a multi-year expansion including huge investments in facilities, massive sales growth, and an ever-increasing inventory of vehicles! We are looking for great people who want to take this journey with us! 
 
Role and Team
Reporting to the Regional Vice President, the General Manager is responsible for driving the Auction to success through effective leadership.  This role is the primary leader for the site, setting the tone for customer and employee experience and executing strategies to support financial performance and company initiatives.   The General Manager is expected to embody the company values and influence and lead others as a people, customer, and business manager for their location.
 
Responsibilities

Identify opportunities for business growth.  Regularly meet with customers, attend sales visits with Sales staff and other customer engagement opportunities.  Make sure customers receive prompt, efficient and courteous attention for all contacts and transactions.
Act as change champion for the site.  Understand, navigate, communicate, and ensure successful adaptation of change initiatives.  Ensure proper follow-through on all directives, bulletins and schedules from the Corporate Office and Regional Vice President (RVP).  Maintain a good flow of communication with Corporate Office, RVP, key contacts within the company, and external contacts.
Attend a Profit and Loss Statement review each accounting period with the RVP.  Ensure accurate and timely reconciliation of accounting with weekly and monthly corporate reports.  Initiate and follow up on discrepancies.  Monitor accounts receivable and report variances to RVP, Controller and Central Office.  Control regular and overtime payroll and other business expenses to support business operations and financial objectives.
Monitor KPIs and expectations.  Leverage technology and tools available.  As appropriate, develop and implement action plans to support improvements, and celebrate successes.  
Be familiar with procedures for handling all aspects of customer disputes and resolve any customer complaints in a friendly, courteous manner.  Escalate issues to RVP as necessary.
Identify, hire, train, and mentor the management of today and the future for the auction.  Support recruiting, hiring and onboarding initiatives to meet business needs and corporate/legal requirements. Promote, develop and train all employees according to company guidelines.  
Maintain positive employee relations and morale.  Practice sound leadership and human relations principles to promote teamwork at all times.  Set a good personal example of attitude and performance.   Follow-through and communicate employee relations problems to the Regional Vice President and Human Resource team as appropriate.  Evaluate and take positive, consistent, disciplinary action on infractions of company policies and procedures as defined in the employee disciplinary policy.  Prepare and conduct performance appraisals for direct report employees and support the performance appraisal process for the team.
Conduct employee meetings at least once a month or as necessary to communicate Company and Department issues and build teamwork among the employees.  Maintain a good flow of communication with Regional Vice President,  and other pertinent personnel.
Account for and identify all auction inventory; monitor and report unusual activity and notify RVP and appropriate corporate teams as necessary.
Monitor and control all site related conditions, vehicles, property and equipment within corporate standards for cleanliness, proper maintenance and safety.  Advise Maintenance of all breakdowns and maintenance immediately.  Ensure good routine preventive maintenance. 
Make sure all Department area conditions do not threaten employee or customer safety.  Respond to and follow proper procedures on employee and customer accidents, injuries, and loss or damage to any property.  Report all incidents immediately.  Ensure functional specifications are sound, efficient and support ADESA goals.  Practice and instruct all employees in proper loss prevention and reaction procedures.  Account for and identify all keys, codes or other safety or security information.  Report all incidents properly and immediately. 
Direct proper record keeping and follow-through on all sales promotions, advertising and telemarketing.  Monitor and ensure compliance with sale plan layouts, corporate requirements with all contractual customers, contractors, and supplier agreements and other directives.  Advise and assist with corrective procedures, if needed.  Initiate and complete accurate vehicle transfers as instructed.  Ensure the use of marketing tools on selected customer accounts as instructed. 
Make sure company driving safety standards are met and substance abuse prevention and control procedures are followed for all activity. 
Must know, practice and ensure that company policies and procedures and state and federal laws are followed at all times. Ensure that no company or customer information is inappropriately divulged to unauthorized parties.

 
Skills and Attributes

Servant Leadership Philosophy
Sales and Marketing Skills
Change Management Skills
Human Relations and Leadership Skills
Communication Skills
Accounting and Financial Skills
Technical Skills

 
Qualifications

Bachelor's degree with auction and automotive experience or High School diploma/GED with at least 5 years auction experience with 5 years automotive of similar work experience required.
Minimum 5 years of leadership/supervisory experience
Excellent verbal and written communication skills
Proven ability to multitask while maintaining attention to detail
Confidentiality and integrity while handling sensitive information
Proven ability to manage deliverables and metrics against aggressive targets and timelines
Proficiency with computer systems and applications
Must be 18 years of age and have a valid drivers license that meets requirements

 
ADESA Benefits and Perks
Competitive Pay | Quality Benefits | Holiday and Paid Time Off | Education and Equipment Reimbursement Programs | Matching 401(k) | Career Path Opportunities | And More!
 
Other Requirements
To be able to do your job at ADESA, there are some basic requirements we want to share with you. Of course, well make any reasonable accommodations for those with disabilities to perform the essential functions of their jobs. 

You must be able to read, write, speak, and understand English.
The physical activity requirements of the position range from Light to Medium Physical Work. 

Frequent  standing, watching, touching, listening, walking, talking
Potential  running, jumping, yelling or other rapid or forceful movement in emergency situations

Visual acuity requirements include color, depth perception and field of vision comparable to definitions for Clerical, Administrative, Machine Operators (including inspection) positions. 

 
Physical Working Conditions:
This position is subject to both inside and outside environmental working conditions, including temperature changes, outside weather conditions, slightly elevated ambient noise levels, and minor atmospheric conditions affecting skin or respiratory systems, such as fumes, odors and dusts associated with internal and external service station/convenience food and petroleum dispensing operations.
Note:  Refer to the Handbook and Policy Manuals for important addendum requirements to all job descriptions.  This job description in no way states or implies that these are the only duties to be performed by the employee(s) incumbent in this position.  Employee(s) will be required to follow any other job-related instructions and to perform any other job-related duties requested by any person authorized to give instructions or assignments. The requirements listed in this document are the minimum levels of knowledge, skills, or abilities.
Legal Stuff
Hiring is contingent on passing a complete background check.  This role is not eligible for visa sponsorship.
ADESA is an equal employment opportunity employer.  All applicants receive consideration for employment without regard to race, color, religion, gender, sexual orientation, gender identity or expression, marital status, national origin, age, mental or physical disability, protected veteran status, or genetic information, or any other basis protected by applicable law.  ADESA also prohibits harassment of applicants or employees based on any of these protected categories.
Please note this job description is not designed to contain a comprehensive listing of activities, duties, or responsibilities that are required of the employee for this job. Duties, responsibilities, and activities may change at any time with or without notice."
2950947,"General Manager - ADESA Auto Auction","https://www.carvana.com/careers/apply?gh_jid=6888827","carvana","Shreveport","No",5,"Full time","2025-05-15T01:59:01.277329Z","About Us
ADESA, a Carvana owned company, currently operating over 50 locations throughout the US. Our auto auctions, some up to 200 acres, provide a wide array of vehicle services including repair &amp; reconditioning, auction remarketing, and many of our sites serve as market hub distribution centers. Our inventory comprises hundreds of thousands of vehicles across North America from retail to commercial, OEM &amp; more.
We work in a service industry and embrace a we versus I culture  help others, and they will help you. Our industry is fun, fast-paced, and competitive  and filled with the best people who are passionate about what they do.
Were excited about the future! As an industry leader, ADESA is poised for a multi-year expansion including huge investments in facilities, massive sales growth, and an ever-increasing inventory of vehicles! We are looking for great people who want to take this journey with us! 
 
Role and Team
Reporting to the Regional Vice President, the General Manager is responsible for driving the Auction to success through effective leadership.  This role is the primary leader for the site, setting the tone for customer and employee experience and executing strategies to support financial performance and company initiatives.   The General Manager is expected to embody the company values and influence and lead others as a people, customer, and business manager for their location.
 
Responsibilities

Identify opportunities for business growth.  Regularly meet with customers, attend sales visits with Sales staff and other customer engagement opportunities.  Make sure customers receive prompt, efficient and courteous attention for all contacts and transactions.
Act as change champion for the site.  Understand, navigate, communicate, and ensure successful adaptation of change initiatives.  Ensure proper follow-through on all directives, bulletins and schedules from the Corporate Office and Regional Vice President (RVP).  Maintain a good flow of communication with Corporate Office, RVP, key contacts within the company, and external contacts.
Attend a Profit and Loss Statement review each accounting period with the RVP.  Ensure accurate and timely reconciliation of accounting with weekly and monthly corporate reports.  Initiate and follow up on discrepancies.  Monitor accounts receivable and report variances to RVP, Controller and Central Office.  Control regular and overtime payroll and other business expenses to support business operations and financial objectives.
Monitor KPIs and expectations.  Leverage technology and tools available.  As appropriate, develop and implement action plans to support improvements, and celebrate successes.  
Be familiar with procedures for handling all aspects of customer disputes and resolve any customer complaints in a friendly, courteous manner.  Escalate issues to RVP as necessary.
Identify, hire, train, and mentor the management of today and the future for the auction.  Support recruiting, hiring and onboarding initiatives to meet business needs and corporate/legal requirements. Promote, develop and train all employees according to company guidelines.  
Maintain positive employee relations and morale.  Practice sound leadership and human relations principles to promote teamwork at all times.  Set a good personal example of attitude and performance.   Follow-through and communicate employee relations problems to the Regional Vice President and Human Resource team as appropriate.  Evaluate and take positive, consistent, disciplinary action on infractions of company policies and procedures as defined in the employee disciplinary policy.  Prepare and conduct performance appraisals for direct report employees and support the performance appraisal process for the team.
Conduct employee meetings at least once a month or as necessary to communicate Company and Department issues and build teamwork among the employees.  Maintain a good flow of communication with Regional Vice President,  and other pertinent personnel.
Account for and identify all auction inventory; monitor and report unusual activity and notify RVP and appropriate corporate teams as necessary.
Monitor and control all site related conditions, vehicles, property and equipment within corporate standards for cleanliness, proper maintenance and safety.  Advise Maintenance of all breakdowns and maintenance immediately.  Ensure good routine preventive maintenance. 
Make sure all Department area conditions do not threaten employee or customer safety.  Respond to and follow proper procedures on employee and customer accidents, injuries, and loss or damage to any property.  Report all incidents immediately.  Ensure functional specifications are sound, efficient and support ADESA goals.  Practice and instruct all employees in proper loss prevention and reaction procedures.  Account for and identify all keys, codes or other safety or security information.  Report all incidents properly and immediately. 
Direct proper record keeping and follow-through on all sales promotions, advertising and telemarketing.  Monitor and ensure compliance with sale plan layouts, corporate requirements with all contractual customers, contractors, and supplier agreements and other directives.  Advise and assist with corrective procedures, if needed.  Initiate and complete accurate vehicle transfers as instructed.  Ensure the use of marketing tools on selected customer accounts as instructed. 
Make sure company driving safety standards are met and substance abuse prevention and control procedures are followed for all activity. 
Must know, practice and ensure that company policies and procedures and state and federal laws are followed at all times. Ensure that no company or customer information is inappropriately divulged to unauthorized parties.

 
Skills and Attributes

Servant Leadership Philosophy
Sales and Marketing Skills
Change Management Skills
Human Relations and Leadership Skills
Communication Skills
Accounting and Financial Skills
Technical Skills

 
Qualifications

Bachelor's degree with auction and automotive experience or High School diploma/GED with at least 5 years auction experience with 5 years automotive of similar work experience required.
Minimum 5 years of leadership/supervisory experience
Excellent verbal and written communication skills
Proven ability to multitask while maintaining attention to detail
Confidentiality and integrity while handling sensitive information
Proven ability to manage deliverables and metrics against aggressive targets and timelines
Proficiency with computer systems and applications
Must be 18 years of age and have a valid drivers license that meets requirements

 
ADESA Benefits and Perks
Competitive Pay | Quality Benefits | Holiday and Paid Time Off | Education and Equipment Reimbursement Programs | Matching 401(k) | Career Path Opportunities | And More!
 
Other Requirements
To be able to do your job at ADESA, there are some basic requirements we want to share with you. Of course, well make any reasonable accommodations for those with disabilities to perform the essential functions of their jobs. 

You must be able to read, write, speak, and understand English.
The physical activity requirements of the position range from Light to Medium Physical Work. 

Frequent  standing, watching, touching, listening, walking, talking
Potential  running, jumping, yelling or other rapid or forceful movement in emergency situations

Visual acuity requirements include color, depth perception and field of vision comparable to definitions for Clerical, Administrative, Machine Operators (including inspection) positions. 

 
Physical Working Conditions:
This position is subject to both inside and outside environmental working conditions, including temperature changes, outside weather conditions, slightly elevated ambient noise levels, and minor atmospheric conditions affecting skin or respiratory systems, such as fumes, odors and dusts associated with internal and external service station/convenience food and petroleum dispensing operations.
Note:  Refer to the Handbook and Policy Manuals for important addendum requirements to all job descriptions.  This job description in no way states or implies that these are the only duties to be performed by the employee(s) incumbent in this position.  Employee(s) will be required to follow any other job-related instructions and to perform any other job-related duties requested by any person authorized to give instructions or assignments. The requirements listed in this document are the minimum levels of knowledge, skills, or abilities.
Legal Stuff
Hiring is contingent on passing a complete background check.  This role is not eligible for visa sponsorship.
ADESA is an equal employment opportunity employer.  All applicants receive consideration for employment without regard to race, color, religion, gender, sexual orientation, gender identity or expression, marital status, national origin, age, mental or physical disability, protected veteran status, or genetic information, or any other basis protected by applicable law.  ADESA also prohibits harassment of applicants or employees based on any of these protected categories.
Please note this job description is not designed to contain a comprehensive listing of activities, duties, or responsibilities that are required of the employee for this job. Duties, responsibilities, and activities may change at any time with or without notice."
