"ID","Title","Link","Company","Location","Remote","Experience","EmploymentType","DatePosted","RoleDescription"
2736945,"Mid-Level Auto Technician","https://www.carvana.com/careers/apply?gh_jid=6779426","carvana","Las Vegas","No",5,"Full time","2025-04-07T01:56:38.149087Z","Were looking for automotive mechanics with a minimum of 3 years of professional automotive repair experience to join us at Carvana - the fastest-growing used automotive retailer in U.S. history and one of the four fastest companies to make the Fortune 500.As a Mid-Level Auto Technician, youll be expected to perform light to medium automotive repairs and minimal diagnostics on our vehicles, including:

Performing general automotive repairs such as radiators, timing belts, alignments, and suspension systems
Completing repairs for wheel bearings and axles
Carrying out vehicle climate control repair and replacement for ACs and heater cores

At Carvana, youll receive a competitive wage and amazing perks  including a 401(k) with Carvana match and even a vehicle purchase discount  all while using state of the art tools in one of our high-tech Inspection Centers (click here to learn more). If youre joining us in an entry-level position, we offer training programs to make sure your skills and pay progress along with the company.
Other perks of the Job

100% company-paid healthcare premiums
Generous paid-time off and your birthday is a holiday!
ASE and tool reimbursement programs
Tuition reimbursement and student loan repayment

How To Get StartedJoin the Carvana team by applying on this page, or call one of our recruiters by phone at (888) 508-4749, Monday through Friday, between 6 AM and 4 PM MST.
Not a match for this role?We have a variety of Technician roles in our Inspection Centers, depending on your level of experience - take a look below to see what youll be doing to help us get our low-mileage, late-model cars ready for our customers:

Entry-Level Auto Technician (min 6 months professional experience): perform light maintenance, fluid checks, and/or conduct the initial inspection on our vehicles to look for any imperfections or repairs that may be needed throughout the reconditioning process.
Brake and Tire Technician (min 1 year professional experience): perform light maintenance or repairs, including changing brakes and tires
Mid-Level (Mechanical Repair / Build / General) Technician (min 3 years of professional experience): perform light to medium automotive repairs and minimal diagnostics on our vehicles
Experienced Technician (min 5 years of professional experience): perform extensive repairs and heavy engine work, as well as advanced vehicle diagnostics on all makes and models, including electric and hybrid vehicles

We also have a variety of other automotive roles available in one of our 18 locations across the country  take a look at our Careers site to apply for one of the following roles:

Auto Body roles: Paint, Prep/Body work, Wheel Repair, Airbrush, Interior Repair, Glass Repair, and PDR (Paintless Dent Repair) roles
Auto Technician/Mechanic roles: Lube and Oil, Inspection, Brake and Tire, Mechanical Repair / Build, and Master Technician roles
Entry-Level roles: Detailing, Inventory Associate (Car Porters), Photo, Parts Associate, Inspection, and Coordinator/Administrator roles

General qualifications and requirements

Ability to physically operate vehicle equipment and tools - must be able to lift up to 60 pounds independently
Must be at least 18 years of age and possess a valid drivers license. Some positions may be subject to an Motor Vehicle Records (MVR) check
An ability to work in a fast-paced, ever-changing production environment while sometimes being exposed to excessive weather conditions (heat/cold)
Use of safety equipment that may include but not limited to face shield or goggles, non-slip shoes, gloves, mask, and other protective garments and equipment

About CarvanaAt Carvana, we sell cars but we arent car salesmen. Our promise is simple: we wont sell a car to a customer that we wouldnt sell to our own Mom. Period.To make sure our cars are in first-rate condition, weve built multiple vehicle Reconditioning Centers around the country, where our cars are inspected, perfected, and photographed before reaching the Carvana website.Think youve got what it takes to join our team? Apply today!Carvana is an equal employment opportunity employer. All applicants receive consideration for employment without regard to race, color, religion, gender, sexual orientation, gender identity or expression, marital status, national origin, age, mental or physical disability, protected veteran status, or genetic information, or any other basis protected by applicable law. Carvana also prohibits harassment of applicants or employees based on any of these protected categories.Hiring is contingent on passing a complete background check. This role is not eligible for visa sponsorship. Must be at least 18 years of age and possess a valid drivers license. Must be able to read, write, speak and understand English."
2736944,"Mid-Level Automotive Parts Associate","https://www.carvana.com/careers/apply?gh_jid=6777608","carvana","Colorado Springs","No","Not specified","Full time","2025-04-07T01:56:38.149115Z","Were looking for Parts Associates with a minimum of 6 months of professional automotive parts experience to join us at Carvana - the fastest-growing used automotive retailer in U.S. history and one of the four fastest companies to make the Fortune 500.As a Mid-Level Parts Associate, youll be expected to help manage our inventory of parts by:

Sourcing and ordering complex automotive parts
Managing parts returns and general inventory
Communicating with dealers and suppliers
Managing reconciliation and recording of payment for parts 

At Carvana, youll receive a competitive wage and amazing perks  including a 401(k) with Carvana match and even a vehicle purchase discount  all while using state of the art tools in one of our high-tech Inspection Centers (click here to learn more). If youre joining us in an entry-level position, we offer training programs to make sure your skills and pay progress along with the company.
Other perks of the Job

100% company-paid healthcare premiums
Generous paid-time off and your birthday is a holiday!
ASE and tool reimbursement programs
Tuition reimbursement and student loan repayment

How To Get Started - Join the Carvana team by applying on this page! 
We also have a variety of other automotive roles available in one of our 18 locations across the country  take a look at our Careers site to apply for one of the following roles:

Auto Body roles: Paint, Prep/Body work, Wheel Repair, Airbrush, Interior Repair, Glass Repair, and PDR (Paintless Dent Repair) roles
Auto Technician/Mechanic roles: Lube and Oil, Inspection, Brake and Tire, Mechanical Repair / Build, and Master Technician roles
Entry-Level roles: Detailing, Inventory Associate (Car Porters), Photo, Parts Associate, Inspection, and Coordinator/Administrator roles

General qualifications and requirements

Ability to physically operate vehicle equipment and tools - must be able to lift up to 60 pounds independently
Must be at least 18 years of age and possess a valid drivers license. Some positions may be subject to an Motor Vehicle Records (MVR) check
An ability to work in a fast-paced, ever-changing production environment while sometimes being exposed to excessive weather conditions (heat/cold)
Use of safety equipment that may include but not limited to face shield or goggles, non-slip shoes, gloves, mask, and other protective garments and equipment

About CarvanaAt Carvana, we sell cars but we arent car salesmen. Our promise is simple: we wont sell a car to a customer that we wouldnt sell to our own Mom. Period.To make sure our cars are in first-rate condition, weve built multiple vehicle Reconditioning Centers around the country, where our cars are inspected, perfected, and photographed before reaching the Carvana website.Think youve got what it takes to join our team? Apply today!Carvana is an equal employment opportunity employer. All applicants receive consideration for employment without regard to race, color, religion, gender, sexual orientation, gender identity or expression, marital status, national origin, age, mental or physical disability, protected veteran status, or genetic information, or any other basis protected by applicable law. Carvana also prohibits harassment of applicants or employees based on any of these protected categories.Hiring is contingent on passing a complete background check. This role is not eligible for visa sponsorship. Must be at least 18 years of age and possess a valid drivers license. Must be able to read, write, speak and understand English."
2736943,"HIRING NOW Diesel Mechanic - Intermediate, Haines City","https://www.carvana.com/careers/apply?gh_jid=6778439","carvana","Haines City, Fl","No",8,"Full time","2025-04-07T01:56:38.149159Z","Were looking for intermediate Diesel Technicians with at least 1 year of experience in the Heavy Class 8 Mechanical Industry (or similar industry) to build an exciting career at Carvana - the fastest-growing used automotive retailer in U.S. history and one of the four fastest companies to make the Fortune 500! As a member of the Fleet Maintenance team, youll play a key role in helping deliver happiness to our customers by ensuring all preventative maintenance and general repairs are completed on our vehicle haulers and trailers in a timely manner and up to Carvana standards. Interested in joining the team? Check out more below: 

Accrue 104 hours of PTO in your first year!
Competitive benefits that include medical, dental, vision, and matching 401k, along with other cool perks programs including student loan payments, discounts on vehicles, benefits for your pets, and much more. 

Were looking for motivated team players with at least 1 year of experience working with heavy equipment to: 

Diagnose (using diagnostic equipment) and perform general, preventative maintenance, and DVIR for all heavy equipment.
Perform scheduled repairs and resolve issues uncovered during inspection including changing brakes, adjusting steering systems, replacing parts, fixing complex electrical issues, changing hydraulic components, and changing tires according to TIA guidelines. 
Use welders, torches, and plasma cutters to weld or fabricate broken parts.
Maintain accurate and proper records for all repairs performed on our fleet using our software (including parts records). 
Use diagnostic equipment to pull fault codes and follow OEM diagnose trees to accurately diagnose equipment.

General qualifications and requirements include:

1+ years experience in Heavy Class 8 Mechanical Industry or a similar industry. 
Valid Drivers License. 
Obtain at least two ASE Certification within the first 6 months of employment (process sponsored by Carvana). 
Must have your own tools to complete daily tasks, specialty tools will be provided by Carvana.
Requires standing for extended periods of time with frequent stretching, reaching, walking and stooping, pushing and/or pulling in an environment that may be cold, hot, noisy, and wet and may have fumes or odors due to vehicle maintenance.
Must be able to carry and transport up to 60 pounds up to 20 feet.
Ability to communicate and interact with others effectively in a professional, courteous manner. 
Ability to multitask and prioritize effectively.
Ability to communicate clearly and concisely, both written and oral.
This position may require travel for training purposes

This job description is not designed to contain a comprehensive listing of activities, duties, or responsibilities that are required of the employee for this job. Duties, responsibilities, and activities may change at any time with or without notice. 
Other perks of the job:

100% company-paid healthcare premiums
401(k) with Carvana Match 
Accrue 104 hours of PTO in your first year
Tool and boot allowance and discount on vehicle purchase
Generous paid-time off and your birthday is a holiday!
Tuition reimbursement and student loan repayment

About Carvana
At Carvana, we sell cars but we arent car salesmen. Our promise is simple: we wont sell a car to a customer that we wouldnt sell to our own Mom. Period. 
Being a team member on our Fleet Maintenance team means having a passion for our vision and using your technical expertise to help keep our fleet of heavy equipment in top condition so we can deliver positive and memorable experiences to our customers. Our Logistics team members help each other out and work as a team to ensure the job gets done while treating each other with trust and respect.
Think youve got what it takes to join our team? Apply today!
Carvana is an equal employment opportunity employer. All applicants receive consideration for employment without regard to race, color, religion, gender, sexual orientation, gender identity or expression, marital status, national origin, age, mental or physical disability, protected veteran status, or genetic information, or any other basis protected by applicable law. Carvana also prohibits harassment of applicants or employees based on any of these protected categories.
Hiring is contingent on passing a complete background check and drug test. This role is not eligible for visa sponsorship. Must be at least 18 years of age and possess a valid drivers license. Must be able to read, write, speak and understand English."
2736942," Functional Lead, Field Security - Colorado Springs, CO","https://www.carvana.com/careers/apply?gh_jid=6778671","carvana","Colorado Springs","No",5,"Full time","2025-04-07T01:56:38.149214Z","About Carvana
If you like disrupting the norm and are looking to join a company revolutionizing an industry then you will LOVE what Carvana has done for the car buying experience. Buying a car the old fashioned way sucks and we are working hard to make it NOT suck. I mean, have you seen our vending machine?!
We are looking for people who are excited to thrive in an environment of impactful change. Team spirit is evident at Carvana and everyday we let our passions and creativity foster innovation. We take big swings, set ambitious goals, and challenge each other to make data- and process-driven decisions in everything we do. Here are a few of our stories! Weve been changing the game since 2013, and were not taking our foot off the gas now. Want more of the story? Check out our background here. 
About the team and position
The Safe &amp; Secure Team helps to keep our 20,000+ associates, who work at our 200+ various locations, safe and secure every day. By collaborating with various Carvana teams and external partners the Safe &amp; Secure Team delivers strategic planning, operational risk program development, operational Safe &amp; Secure processes, data analytics, inventory reconciliation and control, learning and awareness program support, and project management. In partnership with the Field and Operations Team, the Safe &amp; Secure Support Team plays an integral function in delivering our mission to every associate at every site.
The Functional Lead, Safe &amp; Secure will be a part of the site Safe &amp; Secure Leadership Team providing support to 400+ associates who work within 4 business units that manage a site that sits on 120+ acres holding 9,000 vehicles. The Functional Lead, Field Safe &amp; Secure will work closely with the Manager, Field Safe &amp; Secure and Facility Leadership Team (Operations, Wholesale, Logistics, and People Operations) in supporting the safety of our associates and the protection of our assets in a dynamic working environment. The Functional Lead, Field Safe &amp; Secure will be directly responsible for the sites incident management program, DOT compliance, leadership of the Safety Action Team, process management of the Safe &amp; Secure technology at our sites, and support of efforts relating to operational risk optimization. This position will provide day to day leadership of the Safe &amp; Secure associates on second and third shifts.  The ideal candidate must possess leadership and people management skills, strong communication skills, quantitative rigor, and must be able to exercise independent judgment and work collaboratively with Carvanas varied operational functions. Most importantly, you will see your insights have an immediate, tangible impact every day in a disruptive and rapidly growing company. The position is field based and reports directly to the Manager, Field Safe &amp; Secure or Area Manager, Field Safe &amp; Secure depending on the size of the facility.
What youll be doing

Day to day leadership of direct reports of the second and third shift Safe &amp; Secure Associate Team at the assigned facility. Provide clear expectations, support through consistent coaching, and performance management.
Directly lead Safe &amp; Secure processes relating to our Incident Management Program and Over the Road Safety Program(DOT) at the site
Act as the captain of the Safety Action Team ensuring engagement of our teams at the site to provide a strong culture of safety behavior is evident in day to day operations.
Availability to work non-standard shifts, including evenings, overnights, weekends and holidays to meet business needs. Flexibility to respond to incidents at the site outside of standard business hours. 
Plan and Lead the Incident Management Program for the site, focusing on sustainable awareness and effective preparedness. Key supporter in an emergency situation for the site. 
Lead efforts relating to the identification and tracking of units that are being taken off lot to ensure effective inventory controls are in place. 
Directly lead the processes related to our Safe &amp; Secure Technology that supports the site. Ensure equipment is properly functioning, that issues are addressed, and that our processes relating to badge access, server room controls, monitoring alerts, and overall health of the program are running like a well oiled machine. 
Ensure all Aclaimant incidents are properly recorded and system information is accurate and actionable. Complete after action reviews to determine root causes of reported safety incidents and make improvement recommendations to the Manager of Safe &amp; Secure
Utilizes data to assess the Safe &amp; Secure business at the site reporting key wins and opportunities to the Safe &amp; Secure Manager. As directed, provides support to specific tasks that need to be completed to drive metric improvement. 
Foster open and productive working relationships with other applicable company departments.
Exercise prudent discretion regarding confidential and sensitive personnel information.
Perform other duties as assigned.
Domestic travel required - 10%.

Key Metrics

Safety Observations completed
Safety walk completion and reduction of open issues identified
EH&amp;S Training percentage completed
Critical Tracking of Off Lot Units - +90%.
Completion percentage of after incident Safety reviews and suggestions for improvement
Expired/Missing CDLs and Med Cards for Over the Road Safety (DOT)
JIRA ticket completion and customer ratings
Incident Management Training percentage completed

What you should know/have 

High School Diploma or equivalent is required.
At least 5 years of Safe and Secure  experience, preferably including distribution, warehousing, and fulfillment.
At least 1 year experience directly supervising and managing a team.
Excellent verbal and written communication skills.
Strong analytical and data-driven skill set.
Experience implementing Risk Mitigation programs to improve company profitability in collaboration with partners within a complex business environment.
Experience working closely and communicating effectively with a diverse set of stakeholders in an ever-changing, rapid growth environment with tight deadlines; Ability to take initiative in a constantly-changing work environment while maintaining flexibility and a collaborative attitude.
Experience investigating and resolving theft and fraud issues.
Able to help create, develop and implement process improvement(s).
Exceptional organizational skills with attention to detail and ability to prioritize multiple tasks.
Crisis Management/Incident Response experience.
Experience leading OSHA Program implementation within a distribution, warehousing, and fulfillment environment.
Must promote the company culture and mission to all employees, vendors, clients, and business partners.
Knowledge of how to utilize Google Microsoft systems.
Valid driver's license, and insurable DMV required. 
OSHA 10 Hour Training Certification preferred.

Wed love it if you also have

Bachelors degree from an accredited college or university preferred.
Experience implementing Risk Mitigation programs to improve company profitability in collaboration with partners within a complex business environment.
Crisis Management Leadership experience.
Experience leading OSHA Program implementation within a distribution, warehousing, and fulfillment environment.
OSHA 10 Hour Training Certification preferred.

What well offer in return

Full-Time Salary Position with a competitive salary.
Medical, Dental, and Vision benefits.
401K with company match.
A multitude of perks including student loan payments, discounts on vehicles, benefits for your pets, and much more..
A great wellness program to keep you healthy and happy both physically and mentally.
Access to opportunities to expand your skill set and share your knowledge with others across the organization.
A company culture of promotions from within, with a start-up atmosphere allowing for varied and rapid career development.
A seat in one of the fastest-growing companies in the country.

 
Other requirements
To be able to do your job at Carvana, there are some basic requirements we want to share with you.

Must be able to read, write, speak and understand English.

Of course, well make any reasonable accommodations for those with disabilities to perform the essential functions of their jobs. 
Legal stuff
Hiring is contingent on passing a complete background check.  This role is not eligible for visa sponsorship.
Carvana is an equal employment opportunity employer.  All applicants receive consideration for employment without regard to race, color, religion, gender, sexual orientation, gender identity or expression, marital status, national origin, age, mental or physical disability, protected veteran status, or genetic information, or any other basis protected by applicable law.  Carvana also prohibits harassment of applicants or employees based on any of these protected categories.
Please note this job description is not designed to contain a comprehensive listing of activities, duties, or responsibilities that are required of the employee for this job. Duties, responsibilities, and activities may change at any time with or without notice."
