"ID","Title","Link","Company","Location","Remote","Experience","EmploymentType","DatePosted","RoleDescription"
2736911,"Automotive Detailer - Eugene, OR","https://www.carvana.com/careers/apply?gh_jid=6779007","carvana","Eugene","No","Not specified","Full time","2025-04-07T01:56:38.150188Z","The Detailers role is to prepare vehicles for the auction by performing a variety of vehicle reconditioning tasks including interior detailing, upholstery cleaning, window cleaning, pre-wash, buffer, and quality control.
Hourly Rate: $16.50
Schedule: Monday through Thursday 8:00 AM - 5:00 PM, Friday 8:00 AM - 3:00 PM
**Clean Background &amp; Valid Drivers License w/ Clean Driving Record Required**
 
Detail Technician I (Entry level)

Work in team units tasked with vehicle cleaning, detailing, and sale ready prep
Learn &amp; apply proper techniques for exterior and interior cleaning processes
Learn &amp; apply vehicle inspection techniques to maintain proper standards
Preparation for advanced techniques

See us in action: Detailing and Reconditioning Work at ADESA
 
ADESA is looking for great people to join our Vehicle Detail Team! Our detail centers are the last stop in the vehicle processing lifecycle and play a vital role in sale ready preparation. Whether youre brand new to auto detailing, consider yourself an expert, or are somewhere in the middle, we'd love to talk with you.
It'd be a great fit if you're:

Motivated by staying busy
Interested in an automotive career
Enjoy working with friendly people
Wanting to contribute your way to upward mobility and growth.

PERKS &amp; BENEFITS:

Medical, Dental, and Vision benefits.
401K with company match.
Generous PTO (paid time off).
A multitude of perks including student loan payments, reimbursement programs, discounts on vehicles, benefits for your pets, and much more.
A great wellness program to keep you healthy and happy both physically and mentally.
Access to opportunities to expand your skillset and share your knowledge with others across the organization.

To be able to do your job at ADESA, there are some basic requirements we want to share with you. Of course, well make any reasonable accommodations for those with disabilities to perform the essential functions of their jobs. 

The physical activity requirements of the position range from Light to Medium Physical Work. 

Frequent  standing, watching, touching, listening, walking, talking
Potential  running, jumping, yelling or other rapid or forceful movement in emergency situations


Visual acuity requirements include color, depth perception and field of vision comparable to definitions for Clerical, Administrative, Machine Operators (including inspection) positions. 

 
This position is subject to both inside and outside environmental working conditions, including temperature changes, outside weather conditions, slightly elevated ambient noise levels, and minor atmospheric conditions affecting skin or respiratory systems, such as fumes, odors and dusts associated with internal and external service station/convenience food and petroleum dispensing operations.

Note:  Refer to the Handbook and Policy Manuals for important addendum requirements to all job descriptions.  This job description in no way states or implies that these are the only duties to be performed by the employee(s) incumbent in this position.  Employee(s) will be required to follow any other job-related instructions and to perform any other job-related duties requested by any person authorized to give instructions or assignments. The requirements listed in this document are the minimum levels of knowledge, skills, or abilities.

To be able to do your job at ADESA, you must be able to read, write, speak, and understand English. Of course, well make any reasonable accommodations for those with disabilities to perform the essential functions of their jobs.
ADESA, a Carvana owned company, currently operating over 50 locations throughout the US. Our Auto Auctions, some up to 200 acres, provide a wide array of vehicle services including repair &amp; reconditioning, auction remarketing, and many of our sites serve as market hub distribution centers. Our inventory comprises hundreds of thousands of vehicles across North America from retail to commercial, OEM &amp; more.
We work in a service industry and embrace a we versus I culture  help others, and they will help you. Our industry is fun, fast-paced, and competitive  and filled with the best people who are passionate about what they do.Were excited about the future! As an industry leader, ADESA is poised for a multi-year expansion including huge investments in facilities, massive sales growth, and an ever-increasing inventory of vehicles! We are looking for great people who want to take this journey with us! Get a sneak peek into life at ADESA!
Hiring is contingent on passing a complete background check.  This role is not eligible for visa sponsorship.
ADESA is an equal employment opportunity employer.  All applicants receive consideration for employment without regard to race, color, religion, gender, sexual orientation, gender identity or expression, marital status, national origin, age, mental or physical disability, protected veteran status, or genetic information, or any other basis protected by applicable law.  ADESA also prohibits harassment of applicants or employees based on any of these protected categories.
Please note this job description is not designed to contain a comprehensive listing of activities, duties, or responsibilities that are required of the employee for this job. Duties, responsibilities, and activities may change at any time with or without notice."
2736910,"Automotive Detailer - Austin","https://www.carvana.com/careers/apply?gh_jid=6777601","carvana","Austin","No","Not specified","Full time","2025-04-07T01:56:38.150216Z","The detailer's role is to prepare vehicles for the auction by performing a variety of vehicle reconditioning tasks including interior detailing, upholstery cleaning, window cleaning, pre-wash, buffer, and quality control.
Hourly Rate: $15.00
Schedule: Monday through Thursday 7:00 AM - 4:00 PM
**Clean Background &amp; Valid Drivers License w/ Clean Driving Record Required**
Detail Technician I (Entry level)

Work in team units tasked with vehicle cleaning, detailing, and sale ready prep
Learn &amp; apply proper techniques for exterior and interior cleaning processes
Learn &amp; apply vehicle inspection techniques to maintain proper standards
Preparation for advanced techniques

See us in action: Detailing and Reconditioning Work at ADESA
 
ADESA is looking for great people to join our Vehicle Detail Team! Our detail centers are the last stop in the vehicle processing lifecycle and play a vital role in sale ready preparation. Whether youre brand new to auto detailing, consider yourself an expert, or are somewhere in the middle, we'd love to talk with you.
It'd be a great fit if you're:

Motivated by staying busy
Interested in an automotive career
Enjoy working with friendly people
Wanting to contribute your way to upward mobility and growth.

PERKS &amp; BENEFITS:

Medical, Dental, and Vision benefits.
401K with company match.
Generous PTO (paid time off).
A multitude of perks including student loan payments, reimbursement programs, discounts on vehicles, benefits for your pets, and much more.
A great wellness program to keep you healthy and happy both physically and mentally.
Access to opportunities to expand your skillset and share your knowledge with others across the organization.

To be able to do your job at ADESA, there are some basic requirements we want to share with you. Of course, well make any reasonable accommodations for those with disabilities to perform the essential functions of their jobs. 

The physical activity requirements of the position range from Light to Medium Physical Work. 

Frequent  standing, watching, touching, listening, walking, talking
Potential  running, jumping, yelling or other rapid or forceful movement in emergency situations


Visual acuity requirements include color, depth perception and field of vision comparable to definitions for Clerical, Administrative, Machine Operators (including inspection) positions. 

 
This position is subject to both inside and outside environmental working conditions, including temperature changes, outside weather conditions, slightly elevated ambient noise levels, and minor atmospheric conditions affecting skin or respiratory systems, such as fumes, odors and dusts associated with internal and external service station/convenience food and petroleum dispensing operations.

Note:  Refer to the Handbook and Policy Manuals for important addendum requirements to all job descriptions.  This job description in no way states or implies that these are the only duties to be performed by the employee(s) incumbent in this position.  Employee(s) will be required to follow any other job-related instructions and to perform any other job-related duties requested by any person authorized to give instructions or assignments. The requirements listed in this document are the minimum levels of knowledge, skills, or abilities.

To be able to do your job at ADESA, you must be able to read, write, speak, and understand English. Of course, well make any reasonable accommodations for those with disabilities to perform the essential functions of their jobs.
ADESA, a Carvana owned company, currently operating over 50 locations throughout the US. Our Auto Auctions, some up to 200 acres, provide a wide array of vehicle services including repair &amp; reconditioning, auction remarketing, and many of our sites serve as market hub distribution centers. Our inventory comprises hundreds of thousands of vehicles across North America from retail to commercial, OEM &amp; more.
We work in a service industry and embrace a we versus I culture  help others, and they will help you. Our industry is fun, fast-paced, and competitive  and filled with the best people who are passionate about what they do.Were excited about the future! As an industry leader, ADESA is poised for a multi-year expansion including huge investments in facilities, massive sales growth, and an ever-increasing inventory of vehicles! We are looking for great people who want to take this journey with us! Get a sneak peek into life at ADESA!
Hiring is contingent on passing a complete background check.  This role is not eligible for visa sponsorship.
ADESA is an equal employment opportunity employer.  All applicants receive consideration for employment without regard to race, color, religion, gender, sexual orientation, gender identity or expression, marital status, national origin, age, mental or physical disability, protected veteran status, or genetic information, or any other basis protected by applicable law.  ADESA also prohibits harassment of applicants or employees based on any of these protected categories.
Please note this job description is not designed to contain a comprehensive listing of activities, duties, or responsibilities that are required of the employee for this job. Duties, responsibilities, and activities may change at any time with or without notice."
2731813,"Senior Specialist, Communications","https://www.carvana.com/careers/apply?gh_jid=6774638","carvana","Tempe","No",3,"Full time","2025-04-07T01:56:38.150261Z","SENIOR SPECIALIST, COMMUNICATIONS
About the Role
As a Senior Specialist in Communications at Carvana, you will be at the forefront of shaping and amplifying our narrative across a variety of media channels. This role is ideal for an enthusiastic storyteller who thrives on pitching compelling stories and forging strong relationships with media outlets. You will bring energy and expertise to crisis communications, adeptly crafting narratives that resonate with both internal and external audiences.
 
At Carvana, we are industry leaders who take big swings, set ambitious goals, and inspire each other to make values-based and data-driven decisions in everything we do. Our culture is special, camaraderie is strong, and every day, we let our passion and creativity foster innovation.
 
What youll be doing

Act as a relentless advocate for Carvanas story, pitching to media outlets and fostering strong relationships with journalists.
Become a subject matter expert on our industry, markets, and technology.
Respond to media inquiries, managing communications during crises with poise and precision.
Collaborate with cross-functional teams to create engaging content that showcases our brand identity and consumer-centric stories.
Monitor ongoing trends and seize opportunities to insert Carvana into relevant dialogues within the media landscape.
Maintain consistent, on-brand messaging across all communication channels.
Develop compelling communications assets such as press releases, media alerts, proactive media pitches, and media briefings.
Other duties as assigned.

 
What you should know/have

Bachelors degree in journalism, public relations, communications or related field required.
3+ years of experience in public relations and/or communications roles with a focus on media relations.
Proven track record of success in pitching stories and securing media coverage in national publications.
Strong crisis communication skills with the ability to manage sensitive situations effectively.
Comfort working in a high-visibility role where you will interact with senior leadership and need to perform well under pressure.
Exceptional writing skills, able to articulate stories that captivate and engage diverse audiences.
A proactive mindset, willing to explore unconventional angles to ensure Carvanas story is heard.
Experience with public company reporting communications, ensuring compliance and clarity in all disclosures.

 
What well offer in return

Full-Time Salary Position with a competitive salary.
Medical, Dental, and Vision benefits.
401K with company match.
A multitude of perks including student loan payments, discounts on vehicles, benefits for your pets, and much more.
A great wellness program to keep you healthy and happy both physically and mentally.
Access to opportunities to expand your skillset and share your knowledge with others across the organization.
A company culture of promotions from within, with a start-up atmosphere allowing for varied and rapid career development.

 
Legal stuff
Hiring is contingent on passing a complete background check. This role is not eligible for visa sponsorship.
 
Carvana is an Equal Opportunity Employer. All qualified applicants will receive consideration for employment without regard to race, color, religion, sex, sexual orientation, gender identity, national origin, age, protected veteran or disabled status, or genetic information.
 
Please note this job description is not designed to cover or contain a comprehensive listing of activities, duties, or responsibilities that are required of the employee for this job. Duties, responsibilities, and activities may change at any time with or without notice."
2335658,"Experienced Auto Painter","https://www.carvana.com/careers/apply?gh_jid=6583618","carvana","Plainfield, IN","No",5,"Full time","2025-04-07T01:56:38.150289Z","Were looking for Auto Painters with a minimum of 5 years of professional automotive painting experience to join us at Carvana - the fastest-growing used automotive retailer in U.S. history and one of the four fastest companies to make the Fortune 500.As an Experienced Painter, youll be expected to be highly skilled in painting (base coats, tri-coats, solid, metallic, and clear coats), blending adjacent panels, and paint correcting vehicles.At Carvana, youll receive a competitive wage and amazing perks  including a 401(k) with Carvana match and even a vehicle purchase discount  all while using state of the art tools in one of our high-tech Inspection Centers (click here to learn more). If youre joining us in an entry-level position, we offer training programs to make sure your skills and pay progress along with the company.
Other perks of the Job

100% company-paid healthcare premiums
Generous paid-time off and your birthday is a holiday!
ASE and tool reimbursement programs
Tuition reimbursement and student loan repayment

How To Get StartedJoin the Carvana team by applying on this page, or call one of our recruiters by phone at (888) 690-7853, Monday through Friday, between 6 AM and 4 PM PT (9AM to 7PM ET).
Not a match for this role?We have a variety of paint roles available, depending on your experience - look below to see other roles available to help us get our low-mileage, late-model cars ready for our customers:

Paint Prepper (min 6 months professional experience): prepare vehicles for cosmetic paintwork, including sanding, masking, taping, bagging, unbagging/tear down, and buffing
Entry-Level Painter (min 1 year professional experience): prime vehicles and perform final sanding before the vehicle is painted, along with buffing, touch-up, paint mixing, and airbrush.
Mid-Level Painter (min 3 years professional experience):  match/mix paint color and use water-based paint to paint the vehicle inside our paint booths
Experienced Painter (min 5 years professional experience): painting (base coats, tri-coats, solid, metallic, and clear coats), blending adjacent panels, and paint correcting vehicles.

We also have a variety of other automotive roles available in one of our 18 locations across the country  take a look at our Careers site to apply for one of the following roles:

Auto Body roles: Paint, Prep/Body work, Wheel Repair, Airbrush, Interior Repair, Glass Repair, and PDR (Paintless Dent Repair) roles
Auto Technician/Mechanic roles: Lube and Oil, Inspection, Brake and Tire, Mechanical Repair / Build, and Master Technician roles
Entry-Level roles: Detailing, Inventory Associate (Car Porters), Photo, Parts Associate, Inspection, and Coordinator/Administrator roles

General qualifications and requirements

Ability to physically operate vehicle equipment and tools - must be able to lift up to 60 pounds independently
Must be at least 18 years of age and possess a valid drivers license. Some positions may be subject to an Motor Vehicle Records (MVR) check
An ability to work in a fast-paced, ever-changing production environment while sometimes being exposed to excessive weather conditions (heat/cold)
Use of safety equipment that may include but not limited to face shield or goggles, non-slip shoes, gloves, mask, and other protective garments and equipment

About CarvanaAt Carvana, we sell cars but we arent car salesmen. Our promise is simple: we wont sell a car to a customer that we wouldnt sell to our own Mom. Period.To make sure our cars are in first-rate condition, weve built multiple vehicle Reconditioning Centers around the country, where our cars are inspected, perfected, and photographed before reaching the Carvana website.Think youve got what it takes to join our team? Apply today!Carvana is an equal employment opportunity employer. All applicants receive consideration for employment without regard to race, color, religion, gender, sexual orientation, gender identity or expression, marital status, national origin, age, mental or physical disability, protected veteran status, or genetic information, or any other basis protected by applicable law. Carvana also prohibits harassment of applicants or employees based on any of these protected categories.Hiring is contingent on passing a complete background check. This role is not eligible for visa sponsorship. Must be at least 18 years of age and possess a valid drivers license. Must be able to read, write, speak and understand English."
