"ID","Title","Link","Company","Location","Remote","Experience","EmploymentType","DatePosted","RoleDescription"
1963148,"Car Detailer","https://www.carvana.com/careers/apply?gh_jid=6444841","carvana","Nashville","No","Not specified","Full time","2025-05-15T01:59:01.276712Z","Were looking for entry-level Lot Attendants to build an exciting career at Carvana - the fastest-growing used automotive retailer in U.S. history and one of the four fastest companies to make the Fortune 500! As a Lot Attendant, you will be focused on maintaining the cleanliness and appearance of the vehicles at our Market Hubs. As part of this role, you will be expected to coordinate with fellow employees to ensure timely deliveries and the highest level of customer satisfaction. Interested in joining the team? Check out more below:

Base compensation of $15.00/hour 
This is a Part Time position
PTO and paid holidays + your birthday is a holiday
Location: Nashville, TN 37204

Were looking for enthusiastic, energetic, and self-motivated team players to:

Ensure each vehicle is inspected for mechanical, drivability or cosmetic concerns
Wash and vacuum all inventory on a regular basis
Complete multi-point inspection on arriving inventory to include fuel level, safety features, drivability test and proper display of all company and state disclosures
Maintain positive relationships with coworkers and external vendors
Interact and communicate with team members and management across all lines of the business.
Must adhere to regular and predictable attendance. 

General qualifications and requirements 

High School Diploma or equivalent is desirable
Must be 18 years of age and have a valid drivers license
Must have no more than 2 moving violations in the last 3 years or DUI
Must be able to lift up to 60 pounds independently; majority of lifting from knee to shoulder heights; other lifting required from various levels.
Must be able to carry and transport up to 60 pounds up to 20 feet.
Requires standing for an extended period of time with frequent stretching, reaching, walking and stooping, pushing and/or pulling in an environment that may be cold, hot, noisy, and wet and may have fumes or odors due to vehicle maintenance.
Requires working outdoors in all weather conditions.
Requires excellent visual acuity and manual dexterity.
Requires use of safety equipment that may include but not limited to face shield or goggles, non-slip shoes, gloves, mask, and other protective garments and equipment.
Requires frequent driving and some typing.
Must adhere to regular and predictable attendance.

About Carvana
At Carvana, we sell cars but we arent car salesmen. Our promise is simple: we wont sell a car to a customer that we wouldnt sell to our own Mom. Period. 
Being a brand ambassador of Carvana means having a passion for our vision and having a motor that never quits when it comes to representing our brand and values. Our Market Operations team members work as a team to deliver awesome customer experiences in their markets, while also remaining agile enough to keep up with the ever-changing beat and cadence of your daily activities.
Think youve got what it takes to join our team? Apply today!
Carvana is an equal employment opportunity employer. All applicants receive consideration for employment without regard to race, color, religion, gender, sexual orientation, gender identity or expression, marital status, national origin, age, mental or physical disability, protected veteran status, or genetic information, or any other basis protected by applicable law. Carvana also prohibits harassment of applicants or employees based on any of these protected categories.
Hiring is contingent on passing a complete background check. This role is not eligible for visa sponsorship. Must be at least 18 years of age and possess a valid drivers license. Must be able to read, write, speak and understand English."
2293064,"Car Detailer","https://www.carvana.com/careers/apply?gh_jid=6565620","carvana","Bessemer, AL","No","Not specified","Full time","2025-05-15T01:59:01.276783Z","Were looking for entry-level Lot Attendants to build an exciting career at Carvana - the fastest-growing used automotive retailer in U.S. history and one of the four fastest companies to make the Fortune 500! As a Lot Attendant, you will be focused on maintaining the cleanliness and appearance of the vehicles at our Market Hubs. As part of this role, you will be expected to coordinate with fellow employees to ensure timely deliveries and the highest level of customer satisfaction. Interested in joining the team? Check out more below:

Base compensation of $15/hour 
This is a part time] position
PTO and paid holidays + your birthday is a holiday
Location: 1951 Morgan Rd, Bessemer, Al 35022

Were looking for enthusiastic, energetic, and self-motivated team players to:

Ensure each vehicle is inspected for mechanical, drivability or cosmetic concerns
Wash and vacuum all inventory on a regular basis
Complete multi-point inspection on arriving inventory to include fuel level, safety features, drivability test and proper display of all company and state disclosures
Maintain positive relationships with coworkers and external vendors
Interact and communicate with team members and management across all lines of the business.
Must adhere to regular and predictable attendance. 

General qualifications and requirements 

High School Diploma or equivalent is desirable
Must be 18 years of age and have a valid drivers license
Must have no more than 2 moving violations in the last 3 years or DUI
Must be able to lift up to 60 pounds independently; majority of lifting from knee to shoulder heights; other lifting required from various levels.
Must be able to carry and transport up to 60 pounds up to 20 feet.
Requires standing for an extended period of time with frequent stretching, reaching, walking and stooping, pushing and/or pulling in an environment that may be cold, hot, noisy, and wet and may have fumes or odors due to vehicle maintenance.
Requires working outdoors in all weather conditions.
Requires excellent visual acuity and manual dexterity.
Requires use of safety equipment that may include but not limited to face shield or goggles, non-slip shoes, gloves, mask, and other protective garments and equipment.
Requires frequent driving and some typing.
Must adhere to regular and predictable attendance.

About Carvana
At Carvana, we sell cars but we arent car salesmen. Our promise is simple: we wont sell a car to a customer that we wouldnt sell to our own Mom. Period. 
Being a brand ambassador of Carvana means having a passion for our vision and having a motor that never quits when it comes to representing our brand and values. Our Market Operations team members work as a team to deliver awesome customer experiences in their markets, while also remaining agile enough to keep up with the ever-changing beat and cadence of your daily activities.
Think youve got what it takes to join our team? Apply today!
Carvana is an equal employment opportunity employer. All applicants receive consideration for employment without regard to race, color, religion, gender, sexual orientation, gender identity or expression, marital status, national origin, age, mental or physical disability, protected veteran status, or genetic information, or any other basis protected by applicable law. Carvana also prohibits harassment of applicants or employees based on any of these protected categories.
Hiring is contingent on passing a complete background check. This role is not eligible for visa sponsorship. Must be at least 18 years of age and possess a valid drivers license. Must be able to read, write, speak and understand English."
2766926,"Entry-Level Auto Technician","https://www.carvana.com/careers/apply?gh_jid=6214360","carvana","Concord","No",5,"Full time","2025-05-15T01:59:01.276804Z","Were looking for Automotive Mechanics with a minimum of 6 months of professional automotive repair experience to join us at Carvana - the fastest-growing used automotive retailer in U.S. history and one of the four fastest companies to make the Fortune 500.As an Entry-Level Technician, youll be expected to perform light maintenance, fluid checks, and/or conduct the initial inspection on our vehicles to look for any imperfections or repairs that may be needed throughout the reconditioning process.At Carvana, youll receive a competitive wage and amazing perks  including a 401(k) with Carvana match and even a vehicle purchase discount  all while using state of the art tools in one of our high-tech Inspection Centers (click here to learn more). If youre joining us in an entry-level position, we offer training programs to make sure your skills and pay progress along with the company.
Other perks of the Job

100% company-paid healthcare premiums
Generous paid-time off and your birthday is a holiday!
ASE and tool reimbursement programs
Tuition reimbursement and student loan repayment

How To Get StartedJoin the Carvana team by applying on this page, or call one of our recruiters by phone at (888) 508-4749, Monday through Friday, between 6 AM and 4 PM MST.
Not a match for this role?We have a variety of Technician roles in our Inspection Centers, depending on your level of experience - take a look below to see what youll be doing to help us get our low-mileage, late-model cars ready for our customers:

Entry-Level Auto Technician (min 6 months professional experience): perform light maintenance, fluid checks, and/or conduct the initial inspection on our vehicles to look for any imperfections or repairs that may be needed throughout the reconditioning process.
Brake and Tire Technician (min 1 year professional experience): perform light maintenance or repairs, including changing brakes and tires
Mid-Level (Mechanical Repair / Build / General) Technician (min 3 years of professional experience): perform light to medium automotive repairs and minimal diagnostics on our vehicles
Experienced Technician (min 5 years of professional experience): perform extensive repairs and heavy engine work, as well as advanced vehicle diagnostics on all makes and models, including electric and hybrid vehicles

We also have a variety of other automotive roles available in one of our 18 locations across the country  take a look at our Careers site to apply for one of the following roles:

Auto Body roles: Paint, Prep/Body work, Wheel Repair, Airbrush, Interior Repair, Glass Repair, and PDR (Paintless Dent Repair) roles
Auto Technician/Mechanic roles: Lube and Oil, Inspection, Brake and Tire, Mechanical Repair / Build, and Master Technician roles
Entry-Level roles: Detailing, Inventory Associate (Car Porters), Photo, Parts Associate, Inspection, and Coordinator/Administrator roles

General qualifications and requirements

Ability to physically operate vehicle equipment and tools - must be able to lift up to 60 pounds independently
Must be at least 18 years of age and possess a valid drivers license. Some positions may be subject to an Motor Vehicle Records (MVR) check
An ability to work in a fast-paced, ever-changing production environment while sometimes being exposed to excessive weather conditions (heat/cold)
Use of safety equipment that may include but not limited to face shield or goggles, non-slip shoes, gloves, mask, and other protective garments and equipment

About CarvanaAt Carvana, we sell cars but we arent car salesmen. Our promise is simple: we wont sell a car to a customer that we wouldnt sell to our own Mom. Period.To make sure our cars are in first-rate condition, weve built multiple vehicle Reconditioning Centers around the country, where our cars are inspected, perfected, and photographed before reaching the Carvana website.Think youve got what it takes to join our team? Apply today!Carvana is an equal employment opportunity employer. All applicants receive consideration for employment without regard to race, color, religion, gender, sexual orientation, gender identity or expression, marital status, national origin, age, mental or physical disability, protected veteran status, or genetic information, or any other basis protected by applicable law. Carvana also prohibits harassment of applicants or employees based on any of these protected categories.Hiring is contingent on passing a complete background check. This role is not eligible for visa sponsorship. Must be at least 18 years of age and possess a valid drivers license. Must be able to read, write, speak and understand English."
1878426,"Vehicle Inspector ","https://www.carvana.com/careers/apply?gh_jid=6299043","carvana","Chandler","No",1,"Full time","2025-05-15T01:59:01.276819Z","Pay range: $18-$20 hourly
About UsADESA, a Carvana owned company, currently operating over 50 locations throughout the US. Our Auto Auctions, some up to 200 acres, provide a wide array of vehicle services including repair &amp; reconditioning, auction remarketing, and many of our sites serve as market hub distribution centers. Our inventory comprises hundreds of thousands of vehicles across North America from retail to commercial, OEM &amp; more.We work in a service industry and embrace a we versus I culture  help others, and they will help you. Our industry is fun, fast-paced, and competitive  and filled with the best people who are passionate about what they do.Were excited about the future! As an industry leader, ADESA is poised for a multi-year expansion including huge investments in facilities, massive sales growth, and an ever-increasing inventory of vehicles! We are looking for great people who want to take this journey with us! Get a sneak peek into life at ADESA!
Role and Team
This role supports the ADESA businesses and customers by inspecting vehicles for condition, wear, tear, neglect, missing parts, mechanical issues, previous repairs, and damage/structural damage. Complete required vehicle inspection promptly and accurately including imaging and uploading results of the vehicle condition. Interact with dealers and consumers as needed professionally as the face of ADESA and its collective businesses.
Responsibilities

Communicate in a professional manner with customers (dealer or consumer)
Resolve any customer inquiries in a friendly, courteous, and professional manner; advise management of all complaints or incidents
Ensure internal and external customers receive prompt, efficient, and courteous attention
Inspect vehicles for signs of wear, tear, neglect, damage, previous repair, mechanical and structural damage.
Complete inspection of vehicles and ensure adherence to the defined program for the customer.
Capture data accurately on a mobile device, and work comfortably with software and technology.
Deliver results in a timely manner
Maintain productivity levels as set forth by management.
Deliver consistent, accurate inspections with a minimal rate of errors in accordance with reasonable expectations set forth by management.
Collaborate with management and sales team members on customer needs with insights to improve services provided
Maintain equipment and tools properly and advise the manager of any equipment maintenance or breakdown needed
Ensure vehicles are in clean condition with radios, seats, mirrors, and other convenience items in the same position as when the vehicle arrives
Submit completed condition reports using the appropriate technology made available to you to complete the vehicle inspection
Complete road test if required by contract or inspection type
Keep current on technology updates, new releases, and product development
Understand the functionality and ability to use tools such as paint meter, OBD scanner, etc.
Develop and maintain knowledge and expertise in areas of competitor products
Other duties as assigned.

Qualifications

Must be at least eighteen (18) years of age.
Must be qualified to operate a motor vehicle and possess a valid drivers license.
Must have a demonstrated ability to read, write, and communicate effectively in English.
Must have the ability to physically operate vehicle equipment and tools.
1 year Automotive experience: Auto Body, Auto Repair Shop
Mechanical Aptitude
Ability to enter data on a hand held device
Ability to identify previous structural/body damage
Ability to identify basic mechanical issues (sludge, suspension damage, radiator damage)

ADESA Benefits and PerksCompetitive Pay | Quality Benefits | Holiday and Paid Time Off | Education and Equipment Reimbursement Programs | Matching 401(k) | Career Path Opportunities | And More!
Other RequirementsTo be able to do your job at ADESA, there are some basic requirements we want to share with you. Of course, well make any reasonable accommodations for those with disabilities to perform the essential functions of their jobs. 

The physical activity requirements of the position range from Light to Medium Physical Work. 

Frequent  standing, watching, touching, listening, walking, talking
Potential  running, jumping, yelling or other rapid or forceful movement in emergency situations


Visual acuity requirements include color, depth perception and field of vision comparable to definitions for Clerical, Administrative, Machine Operators (including inspection) positions. 

Physical Working Conditions
This position is subject to both inside and outside environmental working conditions, including temperature changes, outside weather conditions, slightly elevated ambient noise levels, and minor atmospheric conditions affecting skin or respiratory systems, such as fumes, odors and dusts associated with internal and external service station/convenience food and petroleum dispensing operations.



Note:  Refer to the Handbook and Policy Manuals for important addendum requirements to all job descriptions.  This job description in no way states or implies that these are the only duties to be performed by the employee(s) incumbent in this position.  Employee(s) will be required to follow any other job-related instructions and to perform any other job-related duties requested by any person authorized to give instructions or assignments. The requirements listed in this document are the minimum levels of knowledge, skills, or abilities.



To be able to do your job at ADESA, you must be able to read, write, speak, and understand English. Of course, well make any reasonable accommodations for those with disabilities to perform the essential functions of their jobs.
Legal StuffHiring is contingent on passing a complete background check.  This role is not eligible for visa sponsorship.ADESA is an equal employment opportunity employer.  All applicants receive consideration for employment without regard to race, color, religion, gender, sexual orientation, gender identity or expression, marital status, national origin, age, mental or physical disability, protected veteran status, or genetic information, or any other basis protected by applicable law.  ADESA also prohibits harassment of applicants or employees based on any of these protected categories.Please note this job description is not designed to contain a comprehensive listing of activities, duties, or responsibilities that are required of the employee for this job. Duties, responsibilities, and activities may change at any time with or without notice."
2627549,"Car Detailer","https://www.carvana.com/careers/apply?gh_jid=6726356","carvana","Memphis","No","Not specified","Full time","2025-05-15T01:59:01.276834Z","Were looking for entry-level Lot Attendants to build an exciting career at Carvana - the fastest-growing used automotive retailer in U.S. history and one of the four fastest companies to make the Fortune 500! As a Lot Attendant, you will be focused on maintaining the cleanliness and appearance of the vehicles at our Market Hubs. As part of this role, you will be expected to coordinate with fellow employees to ensure timely deliveries and the highest level of customer satisfaction. Interested in joining the team? Check out more below:

Base compensation of $15/hour 
This is a part time position
PTO and paid holidays + your birthday is a holiday
Location: 5400 Getwell Rd. Memphis, TN 38118

Were looking for enthusiastic, energetic, and self-motivated team players to:

Ensure each vehicle is inspected for mechanical, drivability or cosmetic concerns
Wash and vacuum all inventory on a regular basis
Complete multi-point inspection on arriving inventory to include fuel level, safety features, drivability test and proper display of all company and state disclosures
Maintain positive relationships with coworkers and external vendors
Interact and communicate with team members and management across all lines of the business.
Must adhere to regular and predictable attendance. 

General qualifications and requirements 

High School Diploma or equivalent is desirable
Must be 18 years of age and have a valid drivers license
Must have no more than 2 moving violations in the last 3 years or DUI
Must be able to lift up to 60 pounds independently; majority of lifting from knee to shoulder heights; other lifting required from various levels.
Must be able to carry and transport up to 60 pounds up to 20 feet.
Requires standing for an extended period of time with frequent stretching, reaching, walking and stooping, pushing and/or pulling in an environment that may be cold, hot, noisy, and wet and may have fumes or odors due to vehicle maintenance.
Requires working outdoors in all weather conditions.
Requires excellent visual acuity and manual dexterity.
Requires use of safety equipment that may include but not limited to face shield or goggles, non-slip shoes, gloves, mask, and other protective garments and equipment.
Requires frequent driving and some typing.
Must adhere to regular and predictable attendance.

About Carvana
At Carvana, we sell cars but we arent car salesmen. Our promise is simple: we wont sell a car to a customer that we wouldnt sell to our own Mom. Period. 
Being a brand ambassador of Carvana means having a passion for our vision and having a motor that never quits when it comes to representing our brand and values. Our Market Operations team members work as a team to deliver awesome customer experiences in their markets, while also remaining agile enough to keep up with the ever-changing beat and cadence of your daily activities.
Think youve got what it takes to join our team? Apply today!
Carvana is an equal employment opportunity employer. All applicants receive consideration for employment without regard to race, color, religion, gender, sexual orientation, gender identity or expression, marital status, national origin, age, mental or physical disability, protected veteran status, or genetic information, or any other basis protected by applicable law. Carvana also prohibits harassment of applicants or employees based on any of these protected categories.
Hiring is contingent on passing a complete background check. This role is not eligible for visa sponsorship. Must be at least 18 years of age and possess a valid drivers license. Must be able to read, write, speak and understand English."
2225607,"Logistics Network Operations Specialist ","https://www.carvana.com/careers/apply?gh_jid=6544140","carvana","Tempe, Az","No",2,"Full time","2025-05-15T01:59:01.276848Z","Position Overview: 
This intermediate level position provides network operations support including on road escalation incidents for Carvana-employed auto haulers delivering cars to customers nationwide. This position is not eligible for visa sponsorship.
What youll be doing:
 Assist in resolving real-time on road incidents moving across the Logistics Network by providing real-time incident management and support to all drivers.  Serve as the first point of contact for Carvana-employed Vehicle Transporters and Advocates.  Provide real-time support to Logistics field teams while maintaining route integrity and service levels.  Minimize postponed deliveries through root cause analysis and continuous monitoring of exceptions.  Use multiple internal systems to gather data and troubleshoot issues that may arise during transit.  Locate and select vendors to drive excellent service while mitigating risks and downtime.  Maximize outbound capacity to increase on-time delivery and reduce transit times.  Collaborate with Vehicle Transporters, Logistics Field Leadership, Fleet Maintenance, Market Operations, and Network Planning to minimize network disruptions.  Leverage strong analytical and Google Sheet skills to help organize data.  Perform administrative duties including accurately documenting real-time incidents while effectively communicating incident status and resolution plan to Logistics Field Leadership.
What the job requires:
To be able to do your job at Carvana, there are some basic requirements we want to share with you.  High School Diploma or GED, or equivalent experience.  2+ years experience in a Customer Service role.  2+ years of practical experience in Maintenance or Logistics.  Experience in Logistics Operations with knowledge of DOT regulations and compliance, FMCSA, and HOS  Ability to work as a team player and interact with customers, managers, and coworkers in a professional and courteous manner.  Ability to multitask and prioritize effectively.  Ability to maintain professionalism in a fast-paced environment.  Ability to work variable schedule(s) as necessary.  Ability to commute and work out of the Tempe headquarters.  Ability to work in an office environment, with extensive use of computers.  Ability to sit for up to eight hours per day.  Ability to communicate clearly and concisely, both written and oral.
This job description is not designed to contain a comprehensive listing of activities, duties, or responsibilities that are required of the employee for this job. Duties, responsibilities, and activities may change at any time with or without notice."
