"ID","Title","Link","Company","Location","Remote","Experience","EmploymentType","DatePosted","RoleDescription"
2766914,"Customer Service Delivery Advocate","https://www.carvana.com/careers/apply?gh_jid=6794327","carvana","Bentonville, AR","No",4,"Full time","2025-05-07T02:00:14.059592Z","We're looking for Customer Advocates with at least 2 years of customer-facing experience to build an exciting career at Carvana - the fastest-growing used automotive retailer in U.S. history and one of the four fastest companies to make the Fortune 500!
Whether it's delivering happiness to customers on the driveway or getting involved in the local community, our Customer Advocates are leading the charge in reintroducing happiness into the car-buying process. Ready to join the 'Hauler-Life'? Check out more below:

Shift Requirement: The hours for this position are from 11am - 9pm. We ask that team members be available to work 7 days a week. Days off will rotate between weekdays and weekend days.
Base compensation of $17/hour
Opportunity to increase hourly compensation by .50 cents every 3 months based on performance!
You'll get to represent our dynamic brand in dynamic ways! From delivering memorable customer experiences in the field to helping run one of our Vending Machines (in some locations), our Customer Advocates provide a one-of-a-kind and seamless car-delivery experience to each and every customer.
Competitive benefits that include medical, dental, vision, and matching 401k, along with other cool perks programs including student loan payments, discounts on vehicles, benefits for you pet(s), and much more!

We're looking for enthusiastic, energetic, and self-motivated team players with at least 2 years of customer-facing experience to:

Deliver vehicles straight to customers' doors with our custom car haulers (don't worry - a commercial license is not required to drive the hauler and you will receive ample training)
Frequently load/unload vehicles onto the hauler (this part does require getting physical!) and regularly inspect the car-hauler to make sure the vehicle maintains safe to drive
Complete customer paperwork and include thorough notes in our customer tracking system
Consistently drive safe and maintain a clean driving record in accordance with Carvana's CMV Driver Qualification policy.

* Candidates must have (or be able to obtain) a Notary in your local jurisdiction within the first 90 days of employment (process sponsored by Carvana). This process may involve satisfying state-specific requirements. For further details, candidates can review their local state notary requirements here: State Notary Requirements.
* Candidates must be able to satisfy state-specific requirements related to access DMV/title and registration systems.
* Illinois, Michigan, Louisiana, and Missouri employees must obtain a Chauffeur's license or any other state specialty license within the first two weeks of employment (process sponsored by Carvana).
* California employees must obtain a Vehicle Verifier license within the first 90 days of employment (Process sponsored by Carvana)
General qualifications and requirements

Ability to perform physically demanding tasks like detailing vehicles and loading/unloading vehicles onto our haulers in indoor and outdoor conditions with occasional exposure to inclement/extreme weather (some markets may require deliveries to be made in the snow, while other markets require deliveries to be made in the summer heat).
Ability to walk/stand and sustain physical activity for extended periods of time (8+ hours)
Must be able to read, write, speak and understand English
Requires high and low levels of movement with the ability to reach with arms, twist, kneel, crouch, climb, balance, and squat
Requires the grasping, carrying, lifting, pushing, and pulling of items of 50lbs.
Frequent driving requires excellent visual acuity and manual dexterity. Reasonable accommodations may be granted to enable individuals with disabilities to perform the essential functions

About Carvana
At Carvana, we sell cars but we aren't car salesmen. Our promise is simple: we won't sell a car to a customer that we wouldn't sell to our own Mom. Period. Being a brand ambassador at Carvana means having a passion for our vision and having a motor that never quits when it comes to representing our brand and values. Our Market Operations team members work as a team to deliver awesome customer experiences in their markets, while also remaining agile enough to keep up with the ever-changing beat and cadence of your daily activities. Think you've got what it takes to join our team? Apply today!
Carvana is an equal employment opportunity employer. All applicants receive consideration for employment without regard to race, color, religion, gender, sexual orientation, gender identity or expression, marital status, national origin, age, mental or physical disability, protected veteran status, or genetic information, or any other basis protected by applicable law. Carvana also prohibits harassment of applicants or employees based on any of these protected categories.
All applicants must pass a drug test and obtain a DOT Medical Card. Hiring is contingent on passing a complete background check. This roles is not eligible for visa sponsorship. Must be at least 21 years of age and possess a valid driver's license. Must be able to read, write, speak, and understand English."
1857329,"Mid-Level Automotive Parts Associate","https://www.carvana.com/careers/apply?gh_jid=6287139","carvana","Framingham, MA","No","Not specified","Full time","2025-05-07T02:00:14.059690Z","Were looking for Parts Associates with a minimum of 6 months of professional automotive parts experience to join us at Carvana - the fastest-growing used automotive retailer in U.S. history and one of the four fastest companies to make the Fortune 500.As a Mid-Level Parts Associate, youll be expected to help manage our inventory of parts by:

Sourcing and ordering complex automotive parts
Managing parts returns and general inventory
Communicating with dealers and suppliers
Managing reconciliation and recording of payment for parts 

At Carvana, youll receive a competitive wage and amazing perks  including a 401(k) with Carvana match and even a vehicle purchase discount  all while using state of the art tools in one of our high-tech Inspection Centers (click here to learn more). If youre joining us in an entry-level position, we offer training programs to make sure your skills and pay progress along with the company.
Other perks of the Job

100% company-paid healthcare premiums
Generous paid-time off and your birthday is a holiday!
ASE and tool reimbursement programs
Tuition reimbursement and student loan repayment

How To Get Started - Join the Carvana team by applying on this page! 
We also have a variety of other automotive roles available in one of our 18 locations across the country  take a look at our Careers site to apply for one of the following roles:

Auto Body roles: Paint, Prep/Body work, Wheel Repair, Airbrush, Interior Repair, Glass Repair, and PDR (Paintless Dent Repair) roles
Auto Technician/Mechanic roles: Lube and Oil, Inspection, Brake and Tire, Mechanical Repair / Build, and Master Technician roles
Entry-Level roles: Detailing, Inventory Associate (Car Porters), Photo, Parts Associate, Inspection, and Coordinator/Administrator roles

General qualifications and requirements

Ability to physically operate vehicle equipment and tools - must be able to lift up to 60 pounds independently
Must be at least 18 years of age and possess a valid drivers license. Some positions may be subject to an Motor Vehicle Records (MVR) check
An ability to work in a fast-paced, ever-changing production environment while sometimes being exposed to excessive weather conditions (heat/cold)
Use of safety equipment that may include but not limited to face shield or goggles, non-slip shoes, gloves, mask, and other protective garments and equipment

About CarvanaAt Carvana, we sell cars but we arent car salesmen. Our promise is simple: we wont sell a car to a customer that we wouldnt sell to our own Mom. Period.To make sure our cars are in first-rate condition, weve built multiple vehicle Reconditioning Centers around the country, where our cars are inspected, perfected, and photographed before reaching the Carvana website.Think youve got what it takes to join our team? Apply today!Carvana is an equal employment opportunity employer. All applicants receive consideration for employment without regard to race, color, religion, gender, sexual orientation, gender identity or expression, marital status, national origin, age, mental or physical disability, protected veteran status, or genetic information, or any other basis protected by applicable law. Carvana also prohibits harassment of applicants or employees based on any of these protected categories.Hiring is contingent on passing a complete background check. This role is not eligible for visa sponsorship. Must be at least 18 years of age and possess a valid drivers license. Must be able to read, write, speak and understand English."
1857347,"Mid-Level Auto Technician","https://www.carvana.com/careers/apply?gh_jid=6104351","carvana","Kansas City","No",5,"Full time","2025-05-07T02:00:14.059720Z","Were looking for automotive mechanics with a minimum of 3 years of professional automotive repair experience to join us at Carvana - the fastest-growing used automotive retailer in U.S. history and one of the four fastest companies to make the Fortune 500.As a Mid-Level Auto Technician, youll be expected to perform light to medium automotive repairs and minimal diagnostics on our vehicles, including:

Performing general automotive repairs such as radiators, timing belts, alignments, and suspension systems
Completing repairs for wheel bearings and axles
Carrying out vehicle climate control repair and replacement for ACs and heater cores

At Carvana, youll receive a competitive wage and amazing perks  including a 401(k) with Carvana match and even a vehicle purchase discount  all while using state of the art tools in one of our high-tech Inspection Centers (click here to learn more). If youre joining us in an entry-level position, we offer training programs to make sure your skills and pay progress along with the company.
Other perks of the Job

100% company-paid healthcare premiums
Generous paid-time off and your birthday is a holiday!
ASE and tool reimbursement programs
Tuition reimbursement and student loan repayment

How To Get StartedJoin the Carvana team by applying on this page, or call one of our recruiters by phone at (888) 508-4749, Monday through Friday, between 6 AM and 4 PM MST.
Not a match for this role?We have a variety of Technician roles in our Inspection Centers, depending on your level of experience - take a look below to see what youll be doing to help us get our low-mileage, late-model cars ready for our customers:

Entry-Level Auto Technician (min 6 months professional experience): perform light maintenance, fluid checks, and/or conduct the initial inspection on our vehicles to look for any imperfections or repairs that may be needed throughout the reconditioning process.
Brake and Tire Technician (min 1 year professional experience): perform light maintenance or repairs, including changing brakes and tires
Mid-Level (Mechanical Repair / Build / General) Technician (min 3 years of professional experience): perform light to medium automotive repairs and minimal diagnostics on our vehicles
Experienced Technician (min 5 years of professional experience): perform extensive repairs and heavy engine work, as well as advanced vehicle diagnostics on all makes and models, including electric and hybrid vehicles

We also have a variety of other automotive roles available in one of our 18 locations across the country  take a look at our Careers site to apply for one of the following roles:

Auto Body roles: Paint, Prep/Body work, Wheel Repair, Airbrush, Interior Repair, Glass Repair, and PDR (Paintless Dent Repair) roles
Auto Technician/Mechanic roles: Lube and Oil, Inspection, Brake and Tire, Mechanical Repair / Build, and Master Technician roles
Entry-Level roles: Detailing, Inventory Associate (Car Porters), Photo, Parts Associate, Inspection, and Coordinator/Administrator roles

General qualifications and requirements

Ability to physically operate vehicle equipment and tools - must be able to lift up to 60 pounds independently
Must be at least 18 years of age and possess a valid drivers license. Some positions may be subject to an Motor Vehicle Records (MVR) check
An ability to work in a fast-paced, ever-changing production environment while sometimes being exposed to excessive weather conditions (heat/cold)
Use of safety equipment that may include but not limited to face shield or goggles, non-slip shoes, gloves, mask, and other protective garments and equipment

About CarvanaAt Carvana, we sell cars but we arent car salesmen. Our promise is simple: we wont sell a car to a customer that we wouldnt sell to our own Mom. Period.To make sure our cars are in first-rate condition, weve built multiple vehicle Reconditioning Centers around the country, where our cars are inspected, perfected, and photographed before reaching the Carvana website.Think youve got what it takes to join our team? Apply today!Carvana is an equal employment opportunity employer. All applicants receive consideration for employment without regard to race, color, religion, gender, sexual orientation, gender identity or expression, marital status, national origin, age, mental or physical disability, protected veteran status, or genetic information, or any other basis protected by applicable law. Carvana also prohibits harassment of applicants or employees based on any of these protected categories.Hiring is contingent on passing a complete background check. This role is not eligible for visa sponsorship. Must be at least 18 years of age and possess a valid drivers license. Must be able to read, write, speak and understand English."
2593898,"Vehicle Condition Associate","https://www.carvana.com/careers/apply?gh_jid=6708784","carvana","Rocklin, CA","No","Not specified","Full time","2025-05-07T02:00:14.059790Z","Pay range: $20-$21 hourly
Vehicle Condition Associate I
Position Overview:
This entry level position is responsible for accurately assessing, documenting and maintaining the status and appearance of Carvanas wholesale inventory. This position is not eligible for visa sponsorship.
What youll be doing:

Ensure each vehicle is inspected for mechanical, drivability, and cosmetic concerns.
Operate state-of-the-art digital tools to accurately assess exterior and interior condition of Carvanas wholesale inventory.
Consistently use mobile tools to take multiple images of the assigned vehicles, including photos of any observed damage.
Ensure each vehicle is documented with the correct trim levels and other vehicle features/attributes.

 
What the Job Requires
To be able to do your job at Carvana, there are some basic requirements we want to share with you.

High School Diploma or equivalent is required.


At least 18  years of age.
Valid drivers license with a clean driving record (no DUIs and no more than two moving violations in the last 3 years).


Ability to use digital devices and mobile applications.
Ability to pay attention to detail. 
Ability to frequently stand, sit, walk, bend, stoop, squat, and lift up to 40 lbs.
Ability to drive frequently.
Ability to work outdoors continuously.
Ability and comfortability to be around fumes or odors that are from vehicles under maintenance.
Ability to work  in various weather conditions such as: rain, snow, heat, etc. 

 This job description is not designed to contain a comprehensive listing of activities, duties, or responsibilities that are required of the employee for this job. Duties, responsibilities, and activities may change at any time with or without notice."
2795698,"Post Production Manager","https://www.carvana.com/careers/apply?gh_jid=6813474","carvana","Auburn","No",3,"Full time","2025-05-07T02:00:14.059819Z","About Carvana
At Carvana, we sell cars but we arent car salesmen.  Our promise is simple: we wont sell a car to a customer that we wouldnt sell to our own Mom. Period. To make sure our cars are in first-rate condition,  weve built multiple vehicle Reconditioning Centers around the country, where our cars are inspected, perfected, and photographed before reaching the Carvana website. Using our Carvana Certified 150-point inspection process, were able to verify that every vehicle meets our rigorous mechanical and cosmetic standards. 
We strive to provide only the highest quality vehicles to our customers in our mission to deliver a no-hassle, better car buying experience. We are actively looking for passionate and talented individuals who can help us deliver on that promise. 
Think youve got what it takes to join our team? Keep reading below to see what were looking for!
 
About the team and position
The Post Production Manager plans, coordinates, and manages all post production activities including but not limited to: quality checks, inventory refresh, returns, and repairs of ready line inventory.  This role directs up to 30 associates that work across multiple shifts, six days a week, in a fast paced production environment. 
This is a 1st shift position with a schedule of Monday thru Friday 6am-3pm at our Belton MO inspection Center.
 
What youll be doing

Leadership 20%

Provide vision and guidance to the post production team in meeting performance metrics  
Positively reinforce and engage the team in ensuring the Carvana quality standard is maintained   
Maintain a highly engaged team while meeting performance requirements ensuring all vehicles are up to standard and ready to ship    
Live the Carvana values



Standard Operating Procedures 40%

Ensure operating standards such as standardized work, operating rules, 5S, and visual management tools are in place and consistently executed
Oversee that associates are working productively both through direct observation and reporting.  
Ensure that the Carvana vehicle standards are consistently executed
Available by phone to provide timely updates to the advocate and logistics teams on push vehicles  
Identify problems either through reporting or direct observation and take action to solve the problem at the root cause.  Communicate results with IC leadership and create action plans to ensure problems are corrected.
Ensure compliance with all health and safety and loss prevention guidelines



People Management 30%

Participate in the selection and hiring process
Ensure staffing levels are maintained and that there is adequate backup for each position
Promote teamwork through all levels of associates
Train and mentor leads
Provide competency based feedback to leads and associates
Provide appropriate performance management feedback to associates



Continuous Improvement 10%

Identify opportunities to improve efficiency, quality, and cost.
Lead problem solving for the group  
Train and mentor associates on problem solving

Other duties as assigned

What you should have

Minimum of 3 years of leadership  experience either in automotive or a lean manufacturing environment
Proven track record of leading and developing associates  
Proven ability to obtain project deliverables and company metrics


Excellent communications skills, oral and written
Ability to work with and through teams to achieve results
An ability to work in a fast-paced, ever changing production environment while sometimes being exposed to excessive weather conditions (heat/cold)
Strong analysis and decision making ability
Proficient computer skills

What well offer in return

Full-Time Position with a competitive salary
Medical, Dental, and Vision benefits
401K with company match
A multitude of perks including student loan payments, discounts on vehicles, benefits for your pets, and much more
A great wellness program to keep you healthy and happy, both physically and mentally
Access to opportunities to expand your skillset and share your knowledge with others across the organization
A company culture of promotions from within, with a start-up atmosphere allowing for varied and rapid career development
A seat in one of the fastest-growing companies in the country

Other requirements
To be able to do your job at Carvana, there are some basic requirements we want to share with you.

Must be able to read, write, speak and understand English
Must be at least 18 years of age
A valid driver's license
A clean driving record with no more than two moving violations or DUIs in the last three years


This job position is designated as a safety-sensitive position
Must be able to lift up to 60 pounds independently; majority of lifting from knee to shoulder heights; other lifting required from various levels
Must be able to carry and transport up to 60 pounds up to 20 feet
Requires standing for extended periods of time with frequent stretching, reaching, walking, stooping, pushing, and/or pulling in an environment that may be cold, hot, noisy, and wet and may have fumes or odors due to vehicle maintenance
Requires excellent visual acuity and manual dexterity
Requires use of safety equipment that may include but not limited to face shield or goggles, non-slip shoes, gloves, mask, and other protective garments and equipment
Requires frequent driving and computer data entry 
Must adhere to regular and predictable attendance

Of course, well make any reasonable accommodations for those with disabilities to perform the essential functions of their jobs. 
 
Legal stuff
Hiring is contingent on passing a complete background check.  This role is not eligible for visa sponsorship.
Carvana is an equal employment opportunity employer.  All applicants receive consideration for employment without regard to race, color, religion, gender, sexual orientation, gender identity or expression, marital status, national origin, age, mental or physical disability, protected veteran status, or genetic information, or any other basis protected by applicable law.  Carvana also prohibits harassment of applicants or employees based on any of these protected categories."
