"ID","Title","Link","Company","Location","Remote","Experience","EmploymentType","DatePosted","RoleDescription"
2738831," Field Specialist, Environmental Health and Safety - Blue Mound, TX","https://www.carvana.com/careers/apply?gh_jid=6780068","carvana","Blue Mound, TX","No",3,"Full time","2025-04-07T01:56:38.148580Z","LOCATION: 1123 Cantrell sansom, Rd, Blue Mound, TX 76131
About Carvana
If you like disrupting the norm and are looking to join a company revolutionizing an industry then you will LOVE what Carvana has done for the car buying experience. Buying a car the old fashioned way sucks and we are working hard to make it NOT suck. I mean, have you seen our vending machine?!
We are looking for people who are excited to thrive in an environment of impactful change. Team spirit is evident at Carvana and everyday we let our passions and creativity foster innovation. We take big swings, set ambitious goals, and challenge each other to make data- and process-driven decisions in everything we do. Here are a few of our stories! Weve been changing the game since 2013, and were not taking our foot off the gas now. Want more of the story? Check out our background here. 
 
About the team and position
Were looking for an experienced Environmental Health and Safety professional to join our EHS team and support our mission to build strong health and safety programs as well as environmental compliance initiatives.  The EHS Specialist will help manage compliance programs, guide corrective actions, and support ongoing environmental and health and safety needs across the organization.  This individual will play an integral role in the collection, review, and reporting of information to regulatory agencies in addition to optimizing the EHS programs. Experience and demonstrated problem solving skills and collaboration skills will be critical to the EHS Specialists success.  This position will  be assigned to a single Reconditioning Center or a cluster of sites based on the needs of the business.  
 
What youll be doing

Assist in the development and management of information systems related to recordkeeping for EHS management and compliance programs.
Support the ongoing compliance with multimedia environmental permits and regulatory requirements across a regional operating area or specific site.
Collaborate with outside consultants as needed.
Monitor programs and performance to track compliance and effectiveness of all EHS initiatives.
Participate with Safety Action Teams (SATs) across operating locations in the assigned region or site.
Review management tools and measurement systems to facilitate compliance and the ability to satisfy regulatory scrutiny.
Directly interface with OSHA and Environmental regulators on the companys behalf.
Collaborate with properties regarding corrective actions and/or alleged violations.
Provide ongoing support for regulatory questions across numerous jurisdictions.
Review development plans for compliance and permitting concerns.
Lead environmental due diligence efforts as needed.
Other tasks related to environmental affairs and health and safety as assigned by team leadership.
Driving may be required for select locations. 

What you should know/have

Bachelors degree from an accredited college or university in a relevant field. 
3+ years of relevant experience (including graduate work) within the Environmental Health and Safety (EHS) field. 
Valid driver's license with no restrictions and a clean driving record for select sites/locations. 
Exceptionally strong computer skills are a must.
Demonstrated technical skills with indoor air quality, asbestos (NIOSH 582), and other industrial hygiene topics.
Strong written and verbal communication skills.
Customer service mentality is critical.
Outstanding character and integrity.

Wed love it if you also have

Occupational Safety and Health Administration (OSHA) Hazardous Waste and Emergency Response (HAZWOPER) certification. 
Familiarity with federal environmental, health, and safety regulations and permitting programs.
A background in engineering and/or consulting. 

 
What well offer in return

Full-Time Salary Position with a competitive salary.
Medical, Dental, and Vision benefits.
401K with company match.
A multitude of perks including student loan payments, discounts on vehicles, benefits for your pets, and much more..
A great wellness program to keep you healthy and happy both physically and mentally.
Access to opportunities to expand your skill set and share your knowledge with others across the organization.
A company culture of promotions from within, with a start-up atmosphere allowing for varied and rapid career development.
A seat in one of the fastest-growing companies in the country.

 
Other requirements
To be able to do your job at Carvana, there are some basic requirements we want to share with you.

Must be able to read, write, speak and understand English.

Of course, well make any reasonable accommodations for those with disabilities to perform the essential functions of their jobs. 
 
Legal stuff
Hiring is contingent on passing a complete background check.  This role is not eligible for visa sponsorship.
 
Carvana is an equal employment opportunity employer.  All applicants receive consideration for employment without regard to race, color, religion, gender, sexual orientation, gender identity or expression, marital status, national origin, age, mental or physical disability, protected veteran status, or genetic information, or any other basis protected by applicable law.  Carvana also prohibits harassment of applicants or employees based on any of these protected categories.
 
Please note this job description is not designed to contain a comprehensive listing of activities, duties, or responsibilities that are required of the employee for this job. Duties, responsibilities, and activities may change at any time with or without notice."
1878398,"Automotive Quality Associate","https://www.carvana.com/careers/apply?gh_jid=6385089","carvana","Haines City, FL","No","Not specified","Full time","2025-04-07T01:56:38.148773Z","About Carvana 
At Carvana, we sell cars but we arent car salesmen. Our promise is simple: we wont sell a car to a 
customer that we wouldnt sell to our own Mom. Period. To make sure our cars are in first-rate 
condition, weve built multiple vehicle Reconditioning Centers around the country, where our cars are 
inspected, perfected, and photographed before reaching the Carvana website. Using our Carvana 
Certified 150-point inspection process, were able to verify that every vehicle meets our rigorous 
mechanical and cosmetic standards. 
We strive to provide only the highest quality vehicles to our customers in our mission to deliver a 
no-hassle, better car buying experience. We are actively looking for passionate and talented individuals who can help us deliver on that promise. Think youve got what it takes to join our team? Keep reading below to see what were looking for! 
About the team and position 
An Inventory Associate in IQR is an individual contributor role that has the opportunity to work in the quality and post production work zones. Qualifying candidates must love helping people, enjoy being part of a team, and possess the drive to help achieve superior customer satisfaction by upholding the quality standards Carvana sets for its customers. They must be goal-oriented, enthusiastic, energetic, self-motivated, with the ability to interact and communicate with all levels of the organization at the Inspection Center. This position is not eligible for visa sponsorship. 
What youll be doing: 

Perform multi-point quality inspections on the interior &amp; exterior of vehicles. 
Operating company-owned vehicles on company property, but not on public roads, to position vehicle to the appropriate workstations
Develop an expert-level knowledge on vehicle quality standards while executing quality checks at a high level. 
Use Carvana tools and applications to enter data and track vehicles
Make autonomous decisions on which vehicles will pass the quality check. 
Apply Carvana lean manufacturing principles and follow standardized work by adhering to the 5S model.
Other duties as assigned.

 
What the job requires: 
To be able to do your job at Carvana, there are some basic requirements we want to share with you. 

Ability to read, write, speak and understand English. 
Must be at least 18 years of age. 
Valid drivers license with a clean driving record (no DUIs and no more than two moving violations in the last 3 years). 
This job position is designated as a safety-sensitive position. 
Must be able to lift up to 60 pounds independently; majority of lifting from knee to shoulder heights; other lifting required from various levels. 
Requires standing for extended periods of time with frequent stretching, reaching, walking, stooping, pushing, and/or pulling in an environment that may be cold, hot, noisy, and wet and may have fumes or odors due to vehicle maintenance. 
Requires use of safety equipment that may include but not limited to face shield or goggles, non-slip shoes, gloves, mask, and other protective garments and equipment. 
Ability to maintain high volume and high-quality content in a fast-paced environment.  Ability to pay attention to detail. 
Ability to communicate and interact with others effectively in a professional, courteous manner.  Ability to move in and out of vehicles regularly. 
Ability to multitask and prioritize effectively. 
Ability to work overtime and on weekends. 

It would be great if you also had 

Experience working in the Automotive Industry or in a Lean Manufacturing environment 
Experience detailing or washing vehicles 
Experience working for a fast-paced hyper-growth company 

What well offer in return 

Competitive hourly wages (NO FLAT RATE) 
On the job training 
100% company-paid healthcare premiums for employees 
Excellent schedules that allow for work/life balance 
100% employee paid Healthcare Premiums 
401k with company match 
Tuition Reimbursement and Student Loan Repayment 
Vehicle Discount 
A company culture of growth, with a start-up atmosphere, allowing for varied and rapid career development 
A leadership team that listens and is geared toward teammate engagement 

This job description is not designed to contain a comprehensive listing of activities, duties, or responsibilities that are required of the employee for this job. Duties, responsibilities, and activities may change at any time with or without notice."
2011864,"Mid-Level Automotive Parts Associate - 2nd shift","https://www.carvana.com/careers/apply?gh_jid=6469573","carvana","Tolleson, AZ","No","Not specified","Full time","2025-04-07T01:56:38.148814Z","Were looking for Parts Associates with a minimum of 6 months of professional automotive parts experience to join us at Carvana - the fastest-growing used automotive retailer in U.S. history and one of the four fastest companies to make the Fortune 500.As a Mid-Level Parts Associate, youll be expected to help manage our inventory of parts by:

Sourcing and ordering complex automotive parts
Managing parts returns and general inventory
Communicating with dealers and suppliers
Managing reconciliation and recording of payment for parts 

At Carvana, youll receive a competitive wage and amazing perks  including a 401(k) with Carvana match and even a vehicle purchase discount  all while using state of the art tools in one of our high-tech Inspection Centers (click here to learn more). If youre joining us in an entry-level position, we offer training programs to make sure your skills and pay progress along with the company.
Other perks of the Job

100% company-paid healthcare premiums
Generous paid-time off and your birthday is a holiday!
ASE and tool reimbursement programs
Tuition reimbursement and student loan repayment

How To Get Started - Join the Carvana team by applying on this page! 
We also have a variety of other automotive roles available in one of our 18 locations across the country  take a look at our Careers site to apply for one of the following roles:

Auto Body roles: Paint, Prep/Body work, Wheel Repair, Airbrush, Interior Repair, Glass Repair, and PDR (Paintless Dent Repair) roles
Auto Technician/Mechanic roles: Lube and Oil, Inspection, Brake and Tire, Mechanical Repair / Build, and Master Technician roles
Entry-Level roles: Detailing, Inventory Associate (Car Porters), Photo, Parts Associate, Inspection, and Coordinator/Administrator roles

General qualifications and requirements

Ability to physically operate vehicle equipment and tools - must be able to lift up to 60 pounds independently
Must be at least 18 years of age and possess a valid drivers license. Some positions may be subject to an Motor Vehicle Records (MVR) check
An ability to work in a fast-paced, ever-changing production environment while sometimes being exposed to excessive weather conditions (heat/cold)
Use of safety equipment that may include but not limited to face shield or goggles, non-slip shoes, gloves, mask, and other protective garments and equipment

About CarvanaAt Carvana, we sell cars but we arent car salesmen. Our promise is simple: we wont sell a car to a customer that we wouldnt sell to our own Mom. Period.To make sure our cars are in first-rate condition, weve built multiple vehicle Reconditioning Centers around the country, where our cars are inspected, perfected, and photographed before reaching the Carvana website.Think youve got what it takes to join our team? Apply today!Carvana is an equal employment opportunity employer. All applicants receive consideration for employment without regard to race, color, religion, gender, sexual orientation, gender identity or expression, marital status, national origin, age, mental or physical disability, protected veteran status, or genetic information, or any other basis protected by applicable law. Carvana also prohibits harassment of applicants or employees based on any of these protected categories.Hiring is contingent on passing a complete background check. This role is not eligible for visa sponsorship. Must be at least 18 years of age and possess a valid drivers license. Must be able to read, write, speak and understand English."
2616473,"Brake and Tire Auto Technician","https://www.carvana.com/careers/apply?gh_jid=6721588","carvana","Nashville","No",5,"Full time","2025-04-07T01:56:38.148864Z","Were looking for Automotive Mechanics with a minimum of 1 year of professional automotive repair experience to join us at Carvana - the fastest-growing used automotive retailer in U.S. history and one of the four fastest companies to make the Fortune 500.As a Brake &amp; Tire Technician, youll be expected to perform light maintenance or repairs, including changing brakes and tires and performing:

Technician services, such as routine inspections/maintenance
Basic mechanical repair for brake pads/calipers/rotors, tire installations, and wheel alignments

At Carvana, youll receive a competitive wage and amazing perks  including a 401(k) with Carvana match and even a vehicle purchase discount  all while using state of the art tools in one of our high-tech Inspection Centers (click here to learn more). If youre joining us in an entry-level position, we offer training programs to make sure your skills and pay progress along with the company.
Other perks of the Job

100% company-paid healthcare premiums
Generous paid-time off and your birthday is a holiday!
ASE and tool reimbursement programs
Tuition reimbursement and student loan repayment

How To Get StartedJoin the Carvana team by applying on this page, or call one of our recruiters by phone at (888) 508-4749, Monday through Friday, between 6 AM and 4 PM MST.
Not a match for this role?We have a variety of Technician roles in our Inspection Centers, depending on your level of experience - take a look below to see what youll be doing to help us get our low-mileage, late-model cars ready for our customers:

Entry-Level Auto Technician (min 6 months professional experience): perform light maintenance, fluid checks, and/or conduct the initial inspection on our vehicles to look for any imperfections or repairs that may be needed throughout the reconditioning process.
Brake and Tire Technician (min 1 year professional experience): perform light maintenance or repairs, including changing brakes and tires
Mid-Level (Mechanical Repair / Build / General) Technician (min 3 years of professional experience): perform light to medium automotive repairs and minimal diagnostics on our vehicles
Experienced Technician (min 5 years of professional experience): perform extensive repairs and heavy engine work, as well as advanced vehicle diagnostics on all makes and models, including electric and hybrid vehicles

We also have a variety of other automotive roles available in one of our 18 locations across the country  take a look at our Careers site to apply for one of the following roles:

Auto Body roles: Paint, Prep/Body work, Wheel Repair, Airbrush, Interior Repair, Glass Repair, and PDR (Paintless Dent Repair) roles
Auto Technician/Mechanic roles: Lube and Oil, Inspection, Brake and Tire, Mechanical Repair / Build, and Master Technician roles
Entry-Level roles: Detailing, Inventory Associate (Car Porters), Photo, Parts Associate, Inspection, and Coordinator/Administrator roles

General qualifications and requirements

Ability to physically operate vehicle equipment and tools - must be able to lift up to 60 pounds independently
Must be at least 18 years of age and possess a valid drivers license. Some positions may be subject to an Motor Vehicle Records (MVR) check
An ability to work in a fast-paced, ever-changing production environment while sometimes being exposed to excessive weather conditions (heat/cold)
Use of safety equipment that may include but not limited to face shield or goggles, non-slip shoes, gloves, mask, and other protective garments and equipment

About CarvanaAt Carvana, we sell cars but we arent car salesmen. Our promise is simple: we wont sell a car to a customer that we wouldnt sell to our own Mom. Period.To make sure our cars are in first-rate condition, weve built multiple vehicle Reconditioning Centers around the country, where our cars are inspected, perfected, and photographed before reaching the Carvana website.Think youve got what it takes to join our team? Apply today!Carvana is an equal employment opportunity employer. All applicants receive consideration for employment without regard to race, color, religion, gender, sexual orientation, gender identity or expression, marital status, national origin, age, mental or physical disability, protected veteran status, or genetic information, or any other basis protected by applicable law. Carvana also prohibits harassment of applicants or employees based on any of these protected categories.Hiring is contingent on passing a complete background check. This role is not eligible for visa sponsorship. Must be at least 18 years of age and possess a valid drivers license. Must be able to read, write, speak and understand English."
2293064,"Car Detailer","https://www.carvana.com/careers/apply?gh_jid=6565620","carvana","Bessemer, AL","No","Not specified","Full time","2025-04-07T01:56:38.148892Z","Were looking for entry-level Lot Attendants to build an exciting career at Carvana - the fastest-growing used automotive retailer in U.S. history and one of the four fastest companies to make the Fortune 500! As a Lot Attendant, you will be focused on maintaining the cleanliness and appearance of the vehicles at our Market Hubs. As part of this role, you will be expected to coordinate with fellow employees to ensure timely deliveries and the highest level of customer satisfaction. Interested in joining the team? Check out more below:

Base compensation of $15/hour 
This is a part time] position
PTO and paid holidays + your birthday is a holiday
Location: 1951 Morgan Rd, Bessemer, Al 35022

Were looking for enthusiastic, energetic, and self-motivated team players to:

Ensure each vehicle is inspected for mechanical, drivability or cosmetic concerns
Wash and vacuum all inventory on a regular basis
Complete multi-point inspection on arriving inventory to include fuel level, safety features, drivability test and proper display of all company and state disclosures
Maintain positive relationships with coworkers and external vendors
Interact and communicate with team members and management across all lines of the business.
Must adhere to regular and predictable attendance. 

General qualifications and requirements 

High School Diploma or equivalent is desirable
Must be 18 years of age and have a valid drivers license
Must have no more than 2 moving violations in the last 3 years or DUI
Must be able to lift up to 60 pounds independently; majority of lifting from knee to shoulder heights; other lifting required from various levels.
Must be able to carry and transport up to 60 pounds up to 20 feet.
Requires standing for an extended period of time with frequent stretching, reaching, walking and stooping, pushing and/or pulling in an environment that may be cold, hot, noisy, and wet and may have fumes or odors due to vehicle maintenance.
Requires working outdoors in all weather conditions.
Requires excellent visual acuity and manual dexterity.
Requires use of safety equipment that may include but not limited to face shield or goggles, non-slip shoes, gloves, mask, and other protective garments and equipment.
Requires frequent driving and some typing.
Must adhere to regular and predictable attendance.

About Carvana
At Carvana, we sell cars but we arent car salesmen. Our promise is simple: we wont sell a car to a customer that we wouldnt sell to our own Mom. Period. 
Being a brand ambassador of Carvana means having a passion for our vision and having a motor that never quits when it comes to representing our brand and values. Our Market Operations team members work as a team to deliver awesome customer experiences in their markets, while also remaining agile enough to keep up with the ever-changing beat and cadence of your daily activities.
Think youve got what it takes to join our team? Apply today!
Carvana is an equal employment opportunity employer. All applicants receive consideration for employment without regard to race, color, religion, gender, sexual orientation, gender identity or expression, marital status, national origin, age, mental or physical disability, protected veteran status, or genetic information, or any other basis protected by applicable law. Carvana also prohibits harassment of applicants or employees based on any of these protected categories.
Hiring is contingent on passing a complete background check. This role is not eligible for visa sponsorship. Must be at least 18 years of age and possess a valid drivers license. Must be able to read, write, speak and understand English."
