"ID","Title","Link","Company","Location","Remote","Experience","EmploymentType","DatePosted","RoleDescription"
2950958,"Team Lead, Market Operations ","https://www.carvana.com/careers/apply?gh_jid=6888769","carvana","York","No",5,"Full time","2025-05-15T01:59:01.277168Z","About Carvana 
At Carvana, we sell cars, but we are not salespeople. We have made it our mission to create a hassle-free way for people to buy and sell cars. We saw a huge problem with how much of a headache it is to buy a car the traditional way, so we committed ourselves to put customer satisfaction at the core of our business, we have built a no-pressure, no-haggle online car buying experience that saves our customers time and money. Customers can search through thousands of vehicles online, see full 360-degree views of both the interior and exterior of the vehicles before deciding to go through the purchasing process. Our Customer Advocates will then either deliver the purchased vehicle to our customers driveway using one of our kick-ass one car haulers, or they will meet our customers at one of our amazing coin-operated Vending Machines. 
For more information on Carvana and our mission, sneak a peek at our company introduction video. 
About the team and position 
Carvanas Market Operation department is known for its team-oriented, fast-paced environment. We hire bright people who are willing to roll up their sleeves, step in wherever needed, mentor and develop team members, and assume additional responsibilities as needed while juggling multiple projects. Dont forget to bring your personality! We thrive from each unique perspective. Our strength is in our diversity of opinions. 
Job Description 
The Team Lead, in our Market Operations group, is responsible for running the local Carvana hub and everything that comes with it, including (but not limited to); market launch, operations, logistics, consumer branding, team engagement and effectiveness and, of course, the markets ongoing success. We are looking for someone who is a big picture thinker with the ability to manage the employee and customer experience. A Team Lead not only crushes daily operations, but they have the savvy to assess business trends and proactively create solutions to potential roadblocks. We need a strong people leader, as a Team Lead works closely with a team of extremely talented Customer Advocates and is responsible for providing vision and development opportunities. 
What youll be Doing 

Be a continuous positive force within the market and create strong morale and spirit throughout the team. 


Help interview, select, onboard and train a team of Customer Advocates and provide the tools, resources and guidance they need to be successful. Employee development is an essential part of this role. 


Actively develop a team of Customer Advocates by providing feedback, conducting performance check-ins, and setting goals to improve performance and skill set. 


Recognize and reinforce individual and team accomplishments by using existing organizational tools and programs as well as by finding new, creative and effective methods of recognition.


Generate and monitor regular reports like a boss and presenting to upper management... also like a boss. 


Be the go to expert for your team. Youre always ready to jump in alongside an Advocate to wash cars or jump into our kick-ass single-car hauler and deliver cars to our customers while providing a stellar customer experience. 


Drive production in a fast-paced customer service environment and keep every detail of your market operating like a well oiled machine 


Actively look for ways to improve the overall customer and Advocate team experience. 
Address and effectively manage complex and sensitive customer-facing issues. 

What you should have 

5+ years work experience in a customer facing team environment 
3+ years of management experience 
Proven history of developing and coaching employees
Prior experience with strategic planning, process improvement, and guiding teams to exceed goals 
Excellent interpersonal and leadership skills 
Ability to diagnose and solve problems with varying complexity while maintaining focus on the customer experience 
Willingness to work on weekends 
Enthusiasm and energy to contribute to and thrive in a rapidly growing start-up atmosphere where roles continually adapt as the company evolves 

It would be great if you also had 

Bachelors Degree
Experience with Salesforce or Tableau
An analytical mind
Experience handling logistics

What well offer in return 

Full-Time Salary Position 
Medical, Dental, and Vision benefits 
401K with company match 
A multitude of perks including student loan payments, discounts on vehicles, benefits for your pets, and much more 


A great wellness program to keep you healthy and happy both physically and mentally 
Access to opportunities to expand your skillset and share your knowledge with others across the organization 


A company culture of promotions from within, with a start-up atmosphere allowing for varied and rapid career development 


A seat in one of the fastest-growing companies in the country

Other requirements 
To be able to do your job at Carvana, there are some basic requirements we want to share with you. 

Must be able to read, write, speak, and understand English. 
The ability to walk/stand and sustain physical activity for extended periods of time (8+ hours).
Requires high and low levels of movement with the ability to reach with arms, twist, kneel, crouch, climb, balance, and squat. 


Requires the grasping, carrying, lifting, pushing, and pulling of items up to 50lbs.
Frequent driving requires excellent visual activity and manual dexterity.
Requires to work in outdoor weather conditions.
Must be able to stay in stationary potions for extended periods of time (when driving) up to 3 hours at a time. 


Frequently communicates with customers and must be able to exchange accurate information. 

Of course, well make any reasonable accommodations for those with disabilities to perform the essential functions of their jobs. 
Legal stuff 
Hiring is contingent on passing a complete background check. This role is not eligible for visa sponsorship. 
Carvana is an equal employment opportunity employer. All applicants receive consideration for employment without regard to race, color, religion, gender, sexual orientation, gender identity or expression, marital status, national origin, age, mental or physical disability, protected veteran status, or genetic information, or any other basis protected by applicable law. Carvana also prohibits harassment of applicants or employees based on any of these protected categories. 
Please note this job description is not designed to contain a comprehensive listing of activities, duties, or responsibilities that are required of the employee for this job. Duties, responsibilities, and activities may change at any time with or without notice."
2950957,"Team Lead, Market Operations ","https://www.carvana.com/careers/apply?gh_jid=6888710","carvana","Manville, NJ","No",5,"Full time","2025-05-15T01:59:01.277184Z","About Carvana 
At Carvana, we sell cars, but we are not salespeople. We have made it our mission to create a hassle-free way for people to buy and sell cars. We saw a huge problem with how much of a headache it is to buy a car the traditional way, so we committed ourselves to put customer satisfaction at the core of our business, we have built a no-pressure, no-haggle online car buying experience that saves our customers time and money. Customers can search through thousands of vehicles online, see full 360-degree views of both the interior and exterior of the vehicles before deciding to go through the purchasing process. Our Customer Advocates will then either deliver the purchased vehicle to our customers driveway using one of our kick-ass one car haulers, or they will meet our customers at one of our amazing coin-operated Vending Machines. 
For more information on Carvana and our mission, sneak a peek at our company introduction video. 
About the team and position 
Carvanas Market Operation department is known for its team-oriented, fast-paced environment. We hire bright people who are willing to roll up their sleeves, step in wherever needed, mentor and develop team members, and assume additional responsibilities as needed while juggling multiple projects. Dont forget to bring your personality! We thrive from each unique perspective. Our strength is in our diversity of opinions. 
Job Description 
The Team Lead, in our Market Operations group, is responsible for running the local Carvana hub and everything that comes with it, including (but not limited to); market launch, operations, logistics, consumer branding, team engagement and effectiveness and, of course, the markets ongoing success. We are looking for someone who is a big picture thinker with the ability to manage the employee and customer experience. A Team Lead not only crushes daily operations, but they have the savvy to assess business trends and proactively create solutions to potential roadblocks. We need a strong people leader, as a Team Lead works closely with a team of extremely talented Customer Advocates and is responsible for providing vision and development opportunities. 
What youll be Doing 

Be a continuous positive force within the market and create strong morale and spirit throughout the team. 


Help interview, select, onboard and train a team of Customer Advocates and provide the tools, resources and guidance they need to be successful. Employee development is an essential part of this role. 


Actively develop a team of Customer Advocates by providing feedback, conducting performance check-ins, and setting goals to improve performance and skill set. 


Recognize and reinforce individual and team accomplishments by using existing organizational tools and programs as well as by finding new, creative and effective methods of recognition.


Generate and monitor regular reports like a boss and presenting to upper management... also like a boss. 


Be the go to expert for your team. Youre always ready to jump in alongside an Advocate to wash cars or jump into our kick-ass single-car hauler and deliver cars to our customers while providing a stellar customer experience. 


Drive production in a fast-paced customer service environment and keep every detail of your market operating like a well oiled machine 


Actively look for ways to improve the overall customer and Advocate team experience. 
Address and effectively manage complex and sensitive customer-facing issues. 

What you should have 

5+ years work experience in a customer facing team environment 
3+ years of management experience 
Proven history of developing and coaching employees
Prior experience with strategic planning, process improvement, and guiding teams to exceed goals 
Excellent interpersonal and leadership skills 
Ability to diagnose and solve problems with varying complexity while maintaining focus on the customer experience 
Willingness to work on weekends 
Enthusiasm and energy to contribute to and thrive in a rapidly growing start-up atmosphere where roles continually adapt as the company evolves 

It would be great if you also had 

Bachelors Degree
Experience with Salesforce or Tableau
An analytical mind
Experience handling logistics

What well offer in return 

Full-Time Salary Position 
Medical, Dental, and Vision benefits 
401K with company match 
A multitude of perks including student loan payments, discounts on vehicles, benefits for your pets, and much more 


A great wellness program to keep you healthy and happy both physically and mentally 
Access to opportunities to expand your skillset and share your knowledge with others across the organization 


A company culture of promotions from within, with a start-up atmosphere allowing for varied and rapid career development 


A seat in one of the fastest-growing companies in the country

Other requirements 
To be able to do your job at Carvana, there are some basic requirements we want to share with you. 

Must be able to read, write, speak, and understand English. 
The ability to walk/stand and sustain physical activity for extended periods of time (8+ hours).
Requires high and low levels of movement with the ability to reach with arms, twist, kneel, crouch, climb, balance, and squat. 


Requires the grasping, carrying, lifting, pushing, and pulling of items up to 50lbs.
Frequent driving requires excellent visual activity and manual dexterity.
Requires to work in outdoor weather conditions.
Must be able to stay in stationary potions for extended periods of time (when driving) up to 3 hours at a time. 


Frequently communicates with customers and must be able to exchange accurate information. 

Of course, well make any reasonable accommodations for those with disabilities to perform the essential functions of their jobs. 
Legal stuff 
Hiring is contingent on passing a complete background check. This role is not eligible for visa sponsorship. 
Carvana is an equal employment opportunity employer. All applicants receive consideration for employment without regard to race, color, religion, gender, sexual orientation, gender identity or expression, marital status, national origin, age, mental or physical disability, protected veteran status, or genetic information, or any other basis protected by applicable law. Carvana also prohibits harassment of applicants or employees based on any of these protected categories. 
Please note this job description is not designed to contain a comprehensive listing of activities, duties, or responsibilities that are required of the employee for this job. Duties, responsibilities, and activities may change at any time with or without notice."
2950956,"Senior Post-Production Auto Technician - $6,000 Sign-On Bonus","https://www.carvana.com/careers/apply?gh_jid=6888028","carvana","Concord","No",5,"Full time","2025-05-15T01:59:01.277198Z","Were looking for Automotive Mechanics with a minimum of 6 months of professional automotive repair experience to join us at Carvana - the fastest-growing used automotive retailer in U.S. history and one of the four fastest companies to make the Fortune 500.As an Entry-Level Post-Production Auto Technician, youll be expected to perform light maintenance, fluid checks, and/or conduct quality inspections on our vehicles to look for any imperfections or repairs that may be needed throughout the post production process.At Carvana, youll receive a competitive wage and amazing perks  including a 401(k) with Carvana match and even a vehicle purchase discount  all while using state of the art tools in one of our high-tech Inspection Centers (click here to learn more). If youre joining us in an entry-level position, we offer training programs to make sure your skills and pay progress along with the company.
Other perks of the Job

100% company-paid healthcare premiums
Generous paid-time off and your birthday is a holiday!
ASE and tool reimbursement programs
Tuition reimbursement and student loan repayment

How To Get StartedJoin the Carvana team by applying on this page, or call one of our recruiters by phone at (888) 508-4749, Monday through Friday, between 6 AM and 4 PM MST.
Not a match for this role?We have a variety of Technician roles in our Inspection Centers, depending on your level of experience - take a look below to see what youll be doing to help us get our low-mileage, late-model cars ready for our customers:

Entry-Level Auto Technician (min 6 months professional experience): perform light maintenance, fluid checks, and/or conduct the initial inspection on our vehicles to look for any imperfections or repairs that may be needed throughout the reconditioning process.
Brake and Tire Technician (min 1 year professional experience): perform light maintenance or repairs, including changing brakes and tires
Mid-Level (Mechanical Repair / Build / General) Technician (min 3 years of professional experience): perform light to medium automotive repairs and minimal diagnostics on our vehicles
Experienced Technician (min 5 years of professional experience): perform extensive repairs and heavy engine work, as well as advanced vehicle diagnostics on all makes and models, including electric and hybrid vehicles

We also have a variety of other automotive roles available in one of our 17 locations across the country  take a look at our Careers site to apply for one of the following roles:

Auto Body roles: Paint, Prep/Body work, Wheel Repair, Airbrush, Interior Repair, Glass Repair, and PDR (Paintless Dent Repair) roles
Auto Technician/Mechanic roles: LOF (Lube, Oil, and Filter), Inspection, Brake and Tire, Mechanical Repair / Build, and Master Technician roles
Entry-Level roles: Detailing, Inventory Associate (Lot Attendant), Photobooth, Parts Associate, Inspection, and Coordinator/Administrator roles

General qualifications and requirements

Ability to physically operate vehicle equipment and tools - must be able to lift up to 60 pounds independently
Must be at least 18 years of age and possess a valid drivers license. Some positions may be subject to an Motor Vehicle Records (MVR) check
An ability to work in a fast-paced, ever-changing production environment while sometimes being exposed to excessive weather conditions (heat/cold)
Use of safety equipment that may include but not limited to face shield or goggles, non-slip shoes, gloves, mask, and other protective garments and equipment

About CarvanaAt Carvana, we sell cars but we arent car salesmen. Our promise is simple: we wont sell a car to a customer that we wouldnt sell to our own Mom. Period.To make sure our cars are in first-rate condition, weve built multiple vehicle Reconditioning Centers around the country, where our cars are inspected, perfected, and photographed before reaching the Carvana website.Think youve got what it takes to join our team? Apply today!Carvana is an equal employment opportunity employer. All applicants receive consideration for employment without regard to race, color, religion, gender, sexual orientation, gender identity or expression, marital status, national origin, age, mental or physical disability, protected veteran status, or genetic information, or any other basis protected by applicable law. Carvana also prohibits harassment of applicants or employees based on any of these protected categories.Hiring is contingent on passing a complete background check. This role is not eligible for visa sponsorship. Must be at least 18 years of age and possess a valid drivers license. Must be able to read, write, speak and understand English."
2950955,"Security Guard (PT) - ADESA Tampa","https://www.carvana.com/careers/apply?gh_jid=6889092","carvana","Tampa","No",1,"Full time","2025-05-15T01:59:01.277212Z","This is a PART TIME Security position
Days Worked: Monday, Friday, Saturday
About UsADESA, a Carvana owned company, currently operating over 50 locations throughout the US. Our Auto Auctions, some up to 200 acres, provide a wide array of vehicle services including repair &amp; reconditioning, auction remarketing, and many of our sites serve as market hub distribution centers. Our inventory comprises hundreds of thousands of vehicles across North America from retail to commercial, OEM &amp; more.We work in a service industry and embrace a we versus I culture  help others, and they will help you. Our industry is fun, fast-paced, and competitive  and filled with the best people who are passionate about what they do.Were excited about the future! As an industry leader, ADESA is poised for a multi-year expansion including huge investments in facilities, massive sales growth, and an ever-increasing inventory of vehicles! We are looking for great people who want to take this journey with us! Get a sneak peek into life at ADESA!
Role and Team

As a Security Guard, you will be an integral part of the Security Team executing processes at our facility to ensure our associates, customers, and assets are protected.   At our gates, you will be the face of ADESA to our customers, vendors and associates.  You will play an active role in ensuring our Inventory Control procedures are followed.  You will be adept at utilizing ADESA technology.  You will support vehicle location research when necessary.  This position is hourly and reports to the Operations or designated manager. This position may work various shifts and weekends.

Responsibilities

Secure all gates and buildings and patrol the premises. Sound alarms and notify authorities in case of emergency. 
Verify only authorized individuals enter the property.  Provide facility directions to customers, vendors and transporters. 
Check gate passes to ensure vehicles are authorized to exit property.
Check departing vehicles to guard against theft of company property.
Greet customers at the gate and provide prompt and courteous service. Resolve customer complaints in a friendly manner.
When difficult situations arise, de-escalate situations to ensure we win with partners and collaborate on the forefront.
Using a handheld device, input vehicle information including the VIN number, miles, owner identification, vehicle options, repair orders and any other pertinent information.
Verify the VIN number being entered matches the VIN number on the shippers Bill of Lading.
Watch and report irregularities such as fire hazards, leaking water pipes and doors left unsecured.
Account for and identify all keys, codes or other safety and security information
Maintain a current list of emergency and management telephone numbers
Maintain good operating condition of all equipment and facilities, including handheld devices and printers.  Notify management of all breakdowns and maintenance needs.
Maintain a professional appearance and orderly work environment
Practice and promote teamwork continuously.  Set a good personal example of attitude and performance
Maintain a good flow of communication with all auction team members and leaders

Skills and Attributes

1 - 2 years of experience within a customer service environment
Strong attention to detail and communication skills
Ability to relate well with others and establish strong working relationships
Ability to handle conflict situations in a positive way
Ability to accurately enter data on a handheld device or computer
Strong customer service skills
Ability to organize, plan, and execute multiple tasks in a fast-paced work environment

Qualifications

High School diploma or GED preferred
Ability to work in all weather conditions
Requires computer data entry skills
Must adhere to regular and predictable attendance
Must be 18 years of age and have a valid drivers license that meets the requirements
Able to safely drive a variety of make/model/sizes of vehicles
Requires standing for extended periods

ADESA Benefits and PerksCompetitive Pay | Quality Benefits | Holiday and Paid Time Off | Education and Equipment Reimbursement Programs | Matching 401(k) | Career Path Opportunities | And More!
 
Other RequirementsTo be able to do your job at ADESA, there are some basic requirements we want to share with you. Of course, well make any reasonable accommodations for those with disabilities to perform the essential functions of their jobs. 

The physical activity requirements of the position range from Light to Medium Physical Work. 

Frequent  standing, watching, touching, listening, walking, talking
Potential  running, jumping, yelling or other rapid or forceful movement in emergency situations


Visual acuity requirements include color, depth perception and field of vision comparable to definitions for Clerical, Administrative, Machine Operators (including inspection) positions. 

Physical Working Conditions
This position is subject to both inside and outside environmental working conditions, including temperature changes, outside weather conditions, slightly elevated ambient noise levels, and minor atmospheric conditions affecting skin or respiratory systems, such as fumes, odors and dusts associated with internal and external service station/convenience food and petroleum dispensing operations.



Note:  Refer to the Handbook and Policy Manuals for important addendum requirements to all job descriptions.  This job description in no way states or implies that these are the only duties to be performed by the employee(s) incumbent in this position.  Employee(s) will be required to follow any other job-related instructions and to perform any other job-related duties requested by any person authorized to give instructions or assignments. The requirements listed in this document are the minimum levels of knowledge, skills, or abilities.



To be able to do your job at ADESA, you must be able to read, write, speak, and understand English. Of course, well make any reasonable accommodations for those with disabilities to perform the essential functions of their jobs.
 
Legal StuffHiring is contingent on passing a complete background check.  This role is not eligible for visa sponsorship.ADESA is an equal employment opportunity employer.  All applicants receive consideration for employment without regard to race, color, religion, gender, sexual orientation, gender identity or expression, marital status, national origin, age, mental or physical disability, protected veteran status, or genetic information, or any other basis protected by applicable law.  ADESA also prohibits harassment of applicants or employees based on any of these protected categories.Please note this job description is not designed to contain a comprehensive listing of activities, duties, or responsibilities that are required of the employee for this job. Duties, responsibilities, and activities may change at any time with or without notice."
