"ID","Title","Link","Company","Location","Remote","Experience","EmploymentType","DatePosted","RoleDescription"
1870919,"Claims Manager im tiermedizinischen Bereich (m/w/d)","https://apply.workable.com/j/D0B187942C","Dentolo","Berlin","No","Not specified","Full time","2025-06-29T02:23:20.381407Z","Um den digitalen Gesundheitsschutz weiter voranzutreiben und noch mehr Menschen den Zugang zu sinnvoller Vorsorge zu ermglichen, bauen wir unser Claims-Team fr unser Produkt petolo (Marke fr Tierversicherungstarife) weiter aus. Daher suchen wir ab sofort einen Claims Manager (m/w/d) im tiermedizinischen Bereich mit einer wchentlichen Arbeitszeit (Montag bis Freitag) von 40 Stunden. Dein Wohnort sollte idealerweise im Raum Berlin/Brandenburg sein - ist dies nicht der Fall, kannst du dich trotzdem bewerben.Deine Rolle in unserem Team Du bearbeitest eigenstndig eingehende Leistungsflle in Form von Kostenvoranschlgen und Rechnungen.  Du berechnest mithilfe unseres Algorithmus-basierten Systems Erstattungen fr unsere Kund:innen. Du stehst unseren Kolleg:innen aus der Kundenbetreuung bei allen Fragen rund um unsere Leistungsflle untersttzend zur Seite und steuerst somit einen groen Beitrag zu unserer Kundenzufriedenheit bei.  Du untersttzt bei der Optimierung und Automatisierung unserer Prozesse im Leistungsfall-Management und trgst zur Verbesserung unseres Kundenerlebnisses bei.  Als Team erreichen wir gemeinsam unsere festgelegten Tages- und Monatsziele. Dein Profil Du konntest bereits erste Erfahrungen im Bereich der Sach- bzw. Leistungsfallbearbeitung oder Abrechnung sammeln.  Eine Ausbildung im tiermedizinischen Bereich ist ein Plus, aber kein Muss. Du berzeugst durch ein selbstsicheres Auftreten und kommunizierst freundlich und offen.  Du bist ein Organisationstalent mit gutem Zeitmanagement und berzeugst durch deine unabhngige und strukturierte Arbeitsweise.  Du besitzt idealerweise Kenntnisse im Umgang mit den gngigen MS Office-Anwendungen. Du beherrschst Deutsch in Wort und Schrift auf mindestens C1-Niveau. Warum getolo?	Gehalt &amp; Urlaub Attraktives Fixgehalt Gestaffelte Urlaubstage, beginnend bei 28 Tagen (+ frei am 24. und 31.12)  	Mobilitt &amp; Flexibilitt Whle  zwischen einem Swapfiets-Fahrrad oder einem bezuschussten BVG Umwelt- oder Deutschlandticket Arbeite hybrid - aus deinem Home Office oder in unserem Bro in Berlin-Mitte Arbeite bis zu 60 Tage im EU-Ausland  	Gesundheit Nutzung von kostenlosen Coaching-Sitzungen mit nilo.health, unserem Tool fr mentale Gesundheit Teste unsere Produkte selbst! Whle zwischen dentolo, petolo oder vitolo    	Weiterentwicklung Weiterbildungsbudget ab 750  jhrlich Regelmiges (360 Grad) Feedback  	Und vieles mehr... Legendre Sommer- und Winterpartys  Regelmige Teamevents Mitarbeitervergnstigungen ber Corporate Benefits Zwei Ehrenamtstage pro Kalenderjahr Haustierfreundliches Bro Klingt nach einer perfekten Stelle fr dich?Wir freuen uns auf deine Bewerbung und darauf, dich kennenzulernen!ber getoloDie 2015 gegrndete getolo GmbH ist ein innovatives und mehrfach ausgezeichnetes InsurTech, das ganzheitliche Zusatztarife in den Bereichen Zahnzusatz, Tierkranken und -haftpflicht sowie Krankenzusatztarife anbietet. Unter den Marken dentolo, petolo und vitolo betreuen wir ber 200.000 Kund:innen in Deutschland und bieten einen digitalen und unkomplizierten Schutz an, der sich nahtlos in den Alltag unserer Kund:innen integriert.Wir glauben: Vorsorge ist immer besser als Nachsorge und deshalb stellen wir Prvention, kundenzentrierten Service und finanzielle Sicherheit in den Mittelpunkt, um Kund:innen und ihre Liebsten vor unerwarteten Kosten zu schtzen. Dank der engen Zusammenarbeit unseres Teams aus Marktspezialist:innen und Versicherungsexpert:innen behalten wir aktuelle Entwicklungen stets im Blick, um praktikable Lsungen fr aktuelle Probleme anzubieten.Die getolo Unternehmenskultur basiert auf Zusammenarbeit, Innovationsgeist und Schnelligkeit  immer mit dem klaren Fokus auf die Bedrfnisse unserer Kund:innen. Mit einem Team von rund 200 Mitarbeitenden wird getolo von Daniel Gadea (CEO) und Laura Wulff (CGO) geleitet. getolo ist Partner von DA Direkt und Teil der Zurich Gruppe Deutschland. getolo ist ein Arbeitgeber, der Chancengleichheit und Vielfalt frdert. Wir bemhen uns, ein freundliches, sicheres und einladendes Umfeld fr alle getolis zu schaffen, unabhngig von ethnischer Herkunft, Geschlecht, Geschlechtsidentitt und -ausdruck, sexueller Orientierung, Einschrnkungen und Begabungen jeglicher Art, krperlicher Erscheinung, sozialem Hintergrund, Familienstand, Alter oder Religion (oder deren Fehlen).Bei deiner Bewerbung konzentrieren wir uns ausschlielich auf deine Erfahrung und Motivation. Du entscheidest selbst, welche zustzlichen Informationen du preisgeben mchtest (Foto, Familienstand, Religion, Geschlecht, Nationalitt usw.). Wir schtzen und behandeln alle Bewerbungen gleich.Kontakt:getolo Recruiting Teamjobs@getolo.com"
1870920,"Customer Service Agent (m/w/d)","https://apply.workable.com/j/D711F51880","Dentolo","Berlin","No","Not specified","Full time","2025-06-29T02:23:20.381508Z","Um den digitalen Gesundheitsschutz weiter voranzutreiben und noch mehr Menschen den Zugang zu sinnvoller Vorsorge zu ermglichen, bauen wir unsere Kundenservice-Teams jeweils fr unsere Produkte petolo (Marke fr Tierversicherungstarife) und dentolo (Marke fr Zahnzusatztarife) weiter aus. Daher suchen wir ab sofort zwei neue empathische Customer Service Agents (m/w/d) mit einer wchentlichen Arbeitszeit (Montag bis Freitag) von 40 Stunden. Dein Wohnort sollte idealerweise im Raum Berlin/Brandenburg sein - ist dies nicht der Fall, kannst du dich trotzdem bewerben.Deine Rolle in unserem Team Kundenkommunikation: Bearbeitung von Anfragen ber Inbound- und Outbound-Telefonie, E-Mail sowie Chat. Kundenbetreuung: Als Erstkontakt stehst du unseren Kund:innen bei Fragen zur Seite. Mit deiner Produktexpertise hilfst du Bestandskund:innen ihre Bedrfnisse und Anfragen zu ihrer Zahnzusatz- oder Tierkrankentarife zu beantworten. Wissensmanagement: Du untersttzt beim Aufbau und der Weiterentwicklung unserer digitalen Wissensdatenbank. Prozessoptimierung und Automatisierung: Du leistest einen wichtigen Beitrag zur Verbesserung und Optimierung unserer Prozesse und der Customer Journey im Bereich Customer Success. Dein Profil  Erfahrung im Kundensupport: Du hast bereits Erfahrungen im Kundenservice oder hnlichen Bereichen mit Kundenkontakt gesammelt.  Organisationstalent und Teamwork: Du verfgst ber organisatorische und kommunikative Fhigkeiten. Dein Teamgeist, gepaart mit deiner Flexibilitt, machen dich zu einer wertvollen Bereicherung. Du bringst nicht nur Aufgeschlossenheit und Motivation mit, sondern zeigst den Willen, aktiv an der Gestaltung eines dynamischen Unternehmens mitzuwirken.  Zahnmedizinische Vorkenntnisse sind von Vorteil.  Interesse an Versicherungsthemen: Du bringst eine Neugier fr den Versicherungsbereich mit oder hast die Bereitschaft, dich in diesem Feld einzuarbeiten.  Kenntnisse in MS Office: Idealerweise besitzt du das Know-how fr die MS Office-Anwendungen.  Sprachkompetenz im Arbeitsumfeld: Du verfgst ber ausgezeichnete Deutschkenntnisse (mindestens C1) in Wort und Schrift. Zustzlich besitzt du flieende Englischkenntnisse. Warum getolo?	Gehalt &amp; Urlaub Attraktives Fixgehalt Gestaffelte Urlaubstage, beginnend bei 28 Tagen (max. 30 Tage). Frei am 24. und 31.12 	Mobilitt &amp; Flexibilitt Du hast die Wahl zwischen einem kostenlosen Swapfiets-Fahrrad oder einem von uns bezuschussten BVG Umwelt- oder Deutschlandticket Arbeite hybrid - aus deinem Home Office oder in unserem Bro in Berlin-Mitte Arbeite bis zu 60 Tage im EU-Ausland 	Gesundheit Nutzung von kostenlosen Coaching-Sitzungen mit nilo.health, unserem Tool fr mentale Gesundheit Teste unsere Produkte selbst! Whle zwischen dentolo, petolo oder vitolo  	Weiterentwicklung Weiterbildungsbudget ab 750  jhrlich Regelmiges (360 Grad) Feedback 	Teamgeist Legendre Sommer- und Winterpartys Regelmige Teamevents Mitarbeitervergnstigungen ber Corporate Benefits Zwei Ehrenamtstage pro Kalenderjahr Haustierfreundliches Bro Klingt nach einer perfekten Stelle fr dich?Wir freuen uns auf deine Bewerbung und darauf, dich kennenzulernen! ber getoloDie 2015 gegrndete getolo GmbH ist ein innovatives und mehrfach ausgezeichnetes InsurTech, das ganzheitliche Zusatztarife in den Bereichen Zahnzusatz, Tierkranken und -haftpflicht sowie Krankenzusatztarife anbietet. Unter den Marken dentolo, petolo und vitolo betreuen wir ber 200.000 Kund:innen in Deutschland und bieten einen digitalen und unkomplizierten Schutz an, der sich nahtlos in den Alltag unserer Kund:innen integriert.Wir glauben: Vorsorge ist immer besser als Nachsorge und deshalb stellen wir Prvention, kundenzentrierten Service und finanzielle Sicherheit in den Mittelpunkt, um Kund:innen und ihre Liebsten vor unerwarteten Kosten zu schtzen. Dank der engen Zusammenarbeit unseres Teams aus Marktspezialist:innen und Versicherungsexpert:innen behalten wir aktuelle Entwicklungen stets im Blick, um praktikable Lsungen fr aktuelle Probleme anzubieten.Die getolo Unternehmenskultur basiert auf Zusammenarbeit, Innovationsgeist und Schnelligkeit  immer mit dem klaren Fokus auf die Bedrfnisse unserer Kund:innen. Mit einem Team von rund 200 Mitarbeitenden wird getolo von Daniel Gadea (CEO) und Laura Wulff (CGO) geleitet. getolo ist Partner von DA Direkt und Teil der Zurich Gruppe Deutschland. getolo ist ein Arbeitgeber, der Chancengleichheit und Vielfalt frdert. Wir bemhen uns, ein freundliches, sicheres und einladendes Umfeld fr alle getolis zu schaffen, unabhngig von ethnischer Herkunft, Geschlecht, Geschlechtsidentitt und -ausdruck, sexueller Orientierung, Einschrnkungen und Begabungen jeglicher Art, krperlicher Erscheinung, sozialem Hintergrund, Familienstand, Alter oder Religion (oder deren Fehlen).Bei deiner Bewerbung konzentrieren wir uns ausschlielich auf deine Erfahrung und Motivation. Du entscheidest selbst, welche zustzlichen Informationen du preisgeben mchtest (Foto, Familienstand, Religion, Geschlecht, Nationalitt usw.). Wir schtzen und behandeln alle Bewerbungen gleich.Kontakt:getolo Recruiting Teamjobs@getolo.com"
2774015,"Strategy & Business Development Manager (m/f/d)","https://apply.workable.com/j/70B64C993C","Dentolo","Berlin","No",3,"Full time","2025-06-29T02:23:20.381557Z","About getolo:Founded in 2015, getolo GmbH is an innovative and award-winning InsurTech company that offers comprehensive supplementary insurance plans in the areas of dental, pet health and liability, as well as health add-on coverage. Under the brands dentolo, petolo, and vitolo, we serve over 200,000 customers in Germany and France, providing digital and hassle-free protection that seamlessly integrates into their daily lives.We believe that prevention is always better than curewhich is why we focus on preventive care, customer-centric service, and financial security to protect our customers and their loved ones from unexpected costs. Thanks to the close collaboration of our team of market specialists and insurance experts, we continuously monitor industry developments to offer practical solutions for current challenges.getolo's company culture is built on collaboration, innovation, and agilityalways with a strong focus on the needs of our customers. With a team of around 200 employees, getolo is led by Daniel Gadea (CEO) and Laura Wulff (CGO). getolo is a partner of DA Direkt and part of the Zurich Group Germany.We are seeking a strategic and results-driven Strategy &amp; Business Development Manager (m/f/d) to lead high-impact initiatives across European markets. Are you ready for a new challenge in a rapidly developing insurtech? Look no furtherYour role in a team:Drive European expansion: Lead cross-functional teams in executing market entry strategies and launch high-impact activities for our insurance verticals across Europe. Strategic project management: Take full ownership of high-priority initiatives, effectively managing timelines, milestones, and deliverables while driving alignment and accountability across departments. Revenue growth strategy development: Monitor, analyze and explore growth potentials and create actionable strategies and initiatives to drive revenue growth in close collaboration with the strategic research team. C-Level engagement: Work directly with senior executives, providing insights, updates, and strategic recommendations to influence key business decisions. Project management excellence: Act as a facilitator for building and scaling best-practice project management capabilities across the organization, fostering a culture of accountability, transparency and continuous improvement. Stakeholder management: Build and maintain strong relationships with key stakeholders including external partners to ensure alignment, effective communication and successful collaboration on strategic initiatives.What you need to be successful: 3+ years of work experience in Strategy &amp; Business Development Experience in fast paced environments (e.g. startup, scale-up, consulting) and project management (e.g. consulting, inhouse strategy department) Substantial insurance industry expertise in previous position  Strong track record in managing multi-stakeholder projects settings including external stakeholders  Structured mindset with high team and communication skills Independent way of working and entrepreneurial thinking Native or C2 German, fluent English Spanish or Italian would be a big plus Berlin-based Why getolo? Salary &amp; Vacation Attractive fixed salary Start with 28 vacation days, with an increase every two years (capped at 30 days). Holidays on December 24th and 31st.  Mobility &amp; Flexibility Choose between a free Swapfiets bike, a BVG ticket (Umweltticket) or a Deutschlandticket subsidized by us Work hybrid - from your home office or in our office in Berlin-Mitte Work abroad in the EU for up to 60 days  Health Benefit from free coaching sessions with nilo.health, our mental health tool Test our products yourself! Choose between dentolo, petolo or vitolo  Development Training budget starting from 750  per year Regular (360 degree) feedback  And much more... Legendary summer and winter parties  Regular team events Many discounts on the corporate Benefits Platform Pet friendly office Sounds like the perfect job for you? We look forward to receiving your application and getting to know you! getolo is an equal opportunity and diversity employer. We strive to create a friendly, safe, and welcoming environment for all our team members, regardless of ethnicity, gender, gender identity and expression, sexual orientation, limitations and talents of any kind, physical appearance, social background, marital status, age, or religion (or lack thereof).When you apply, we focus solely on your experience and motivation. You decide what additional information you want to disclose (photo, marital status, religion, gender, nationality, etc.). We value and treat all applications equally. Contact:Katia MinukhinaTalent Acquisition Managerjobs@getolo.com030398200588"
1865386,"Claims Manager im zahnmedizinischen Bereich (m/w/d)","https://apply.workable.com/j/1EDC97170B","Dentolo","Berlin","No","Not specified","Full time","2025-06-29T02:23:20.381606Z","Um den digitalen Gesundheitsschutz weiter voranzutreiben und noch mehr Menschen den Zugang zu sinnvoller Vorsorge zu ermglichen, bauen wir unser Claims-Team fr unser Produkt dentolo (Marke fr Zahnzusatztarife) weiter aus. Daher suchen wir ab sofort einen Claims Manager (m/w/d) im zahnmedizinischen Bereich mit einer wchentlichen Arbeitszeit (Montag bis Freitag) von 40 Stunden. Dein Wohnort sollte idealerweise im Raum Berlin/Brandenburg sein - ist dies nicht der Fall, kannst du dich trotzdem bewerben.Deine Rolle in unserem Team Du bearbeitest eigenstndig eingehende Leistungsflle in Form von Kostenvoranschlgen und Rechnungen.  Du berechnest mithilfe unseres Algorithmus-basierten Systems Erstattungen fr unsere Kund:innen. Du stehst unseren Kolleg:innen aus der Kundenbetreuung bei allen Fragen rund um unsere Leistungsflle untersttzend zur Seite und steuerst somit einen groen Beitrag zu unserer Kundenzufriedenheit bei.  Du untersttzt bei der Optimierung und Automatisierung unserer Prozesse im Leistungsfall-Management und trgst zur Verbesserung unseres Kundenerlebnisses bei.  Neben der im Vordergrund stehenden Schadensachbearbeitung bist du bereit, auch crossfunktionale Aufgaben wie die Telefonie mit Kund:innen zu bernehmen. Als Team erreichen wir gemeinsam unsere festgelegten Tages- und Monatsziele. Dein Profil Du konntest bereits erste Erfahrungen im Bereich der Sach- bzw. Leistungsfallbearbeitung oder Abrechnung sammeln.  Eine Ausbildung im zahnmedizinischen Bereich ist ein Plus, aber kein Muss. Du berzeugst durch ein selbstsicheres Auftreten und kommunizierst freundlich und offen.  Du bist ein Organisationstalent mit gutem Zeitmanagement und berzeugst durch deine unabhngige und strukturierte Arbeitsweise.  Du besitzt idealerweise Kenntnisse im Umgang mit den gngigen MS Office-Anwendungen. Du beherrschst Deutsch in Wort und Schrift auf mindestens C1-Niveau. Warum getolo?	Gehalt &amp; Urlaub Attraktives Fixgehalt Gestaffelte Urlaubstage, beginnend bei 28 Tagen (max. 30 Tage). Frei am 24. und 31.12. 	Mobilitt &amp; Flexibilitt Whle zwischen einem Swapfiets-Fahrrad oder einem bezuschussten BVG Umwelt- oder Deutschlandticket Arbeite hybrid - aus deinem Home Office oder in unserem Bro in Berlin-Mitte Arbeite bis zu 60 Tage im EU-Ausland  	Gesundheit Nutzung von kostenlosen Coaching-Sitzungen mit nilo.health, unserem Tool fr mentale Gesundheit Teste unsere Produkte selbst! Whle zwischen dentolo, petolo oder vitolo    	Weiterentwicklung Weiterbildungsbudget ab 750  jhrlich Regelmiges (360 Grad) Feedback  	Und vieles mehr... Legendre Sommer- und Winterpartys  Regelmige Teamevents Mitarbeitervergnstigungen ber Corporate Benefits Zwei Ehrenamtstage pro Kalenderjahr Haustierfreundliches Bro Klingt nach einer perfekten Stelle fr dich?Wir freuen uns auf deine Bewerbung und darauf, dich kennenzulernen! ber getoloDie 2015 gegrndete getolo GmbH ist ein innovatives und mehrfach ausgezeichnetes InsurTech, das ganzheitliche Zusatztarife in den Bereichen Zahnzusatz, Tierkranken und -haftpflicht sowie Krankenzusatztarife anbietet. Unter den Marken dentolo, petolo und vitolo betreuen wir ber 200.000 Kund:innen in Deutschland und bieten einen digitalen und unkomplizierten Schutz an, der sich nahtlos in den Alltag unserer Kund:innen integriert.Wir glauben: Vorsorge ist immer besser als Nachsorge und deshalb stellen wir Prvention, kundenzentrierten Service und finanzielle Sicherheit in den Mittelpunkt, um Kund:innen und ihre Liebsten vor unerwarteten Kosten zu schtzen. Dank der engen Zusammenarbeit unseres Teams aus Marktspezialist:innen und Versicherungsexpert:innen behalten wir aktuelle Entwicklungen stets im Blick, um praktikable Lsungen fr aktuelle Probleme anzubieten.Die getolo Unternehmenskultur basiert auf Zusammenarbeit, Innovationsgeist und Schnelligkeit  immer mit dem klaren Fokus auf die Bedrfnisse unserer Kund:innen. Mit einem Team von rund 200 Mitarbeitenden wird getolo von Daniel Gadea (CEO) und Laura Wulff (CGO) geleitet. getolo ist Partner von DA Direkt und Teil der Zurich Gruppe Deutschland. getolo ist ein Arbeitgeber, der Chancengleichheit und Vielfalt frdert. Wir bemhen uns, ein freundliches, sicheres und einladendes Umfeld fr alle getolis zu schaffen, unabhngig von ethnischer Herkunft, Geschlecht, Geschlechtsidentitt und -ausdruck, sexueller Orientierung, Einschrnkungen und Begabungen jeglicher Art, krperlicher Erscheinung, sozialem Hintergrund, Familienstand, Alter oder Religion (oder deren Fehlen).Bei deiner Bewerbung konzentrieren wir uns ausschlielich auf deine Erfahrung und Motivation. Du entscheidest selbst, welche zustzlichen Informationen du preisgeben mchtest (Foto, Familienstand, Religion, Geschlecht, Nationalitt usw.). Wir schtzen und behandeln alle Bewerbungen gleich.Kontakt:getolo Recruiting Teamjobs@getolo.com"
2681376,"Senior Performance Marketing Manager - Google Ads (m/w/d)","https://apply.workable.com/j/0934495841","Dentolo","Berlin","No",4,"Full time","2025-06-29T02:23:20.381643Z","About getolo:Founded in 2015, getolo GmbH is an innovative and award-winning InsurTech company that offers comprehensive supplementary insurance plans in the areas of dental, pet health and liability, as well as health add-on coverage. Under the brands dentolo, petolo, and vitolo, we serve over 200,000 customers in Germany, providing digital and hassle-free protection that seamlessly integrates into their daily lives.We believe that prevention is always better than curewhich is why we focus on preventive care, customer-centric service, and financial security to protect our customers and their loved ones from unexpected costs. Thanks to the close collaboration of our team of market specialists and insurance experts, we continuously monitor industry developments to offer practical solutions for current challenges.getolo's company culture is built on collaboration, innovation, and agilityalways with a strong focus on the needs of our customers. With a team of around 200 employees, getolo is led by Daniel Gadea (CEO) and Laura Wulff (CGO). getolo is a partner of DA Direkt and part of the Zurich Group Germany.We are now looking for a Performance Marketing Manager to join our Marketing Department. As a key member of our team, you will play a pivotal role in crafting compelling and innovative digital experiences. You will work closely with various departments, fostering collaboration to drive the success of our projects. Your role in a team: Set up and optimise Google Ads campaigns, driving results through strategic thinking and based on data-driven insights. Conduct keyword research and build keyword strategies Co-own the advertising and testing strategy for Google Ads. Plan, execute, and optimise conversion rates across platforms and products, to achieve goals and KPIs, ensuring efficient budget allocation and continuous improvement. Monitor and analyse campaign data, providing regular reports to stakeholders. Implement A/B testing methodologies to refine and improve campaign performance. Stay up-to-date with the latest trends, features, and best practices in Google Ads and digital marketing. What you need to be successful:  Experience: At least 4 years of in-depth knowledge of Google ads.  Familiarity with Google Analytics, conversion tracking, and other related tools Strong analytical skills, attention to detail and experience in using structured approaches to problem solving.  Proficiency in data driven performance analysis, customer journey optimization and A/B testing as well as deep understanding of tracking and analytics.  Language Skills: Fluent in English, written and spoken.  Comfortable working in a fast-paced environment. Excellent communication skills and the ability to work collaboratively in a team. Self-motivated, organised, and capable of meeting project deadlines. Located in Germany  Why getolo? Salary &amp; Vacation Attractive fixed salary Start with 28 vacation days, with an increase every two years (capped at 30 days). Holidays on December 24th and 31st.  Mobility &amp; Flexibility Choose between a free Swapfiets bike, a BVG ticket (Umweltticket) or a Deutschlandticket subsidized by us Work hybrid - from your home office or in our office in Berlin-Mitte Work abroad in the EU for up to 60 days  Health Benefit from free coaching sessions with nilo.health, our mental health tool Test our products yourself! Choose between dentolo, petolo or vitolo  Development Training budget starting from 750  per year Regular (360 degree) feedback  And much more... Legendary summer and winter parties  Regular team events Many discounts on the corporate Benefits Platform Pet friendly office Sounds like the perfect job for you? We look forward to receiving your application and getting to know you! getolo is an equal opportunity and diversity employer. We strive to create a friendly, safe, and welcoming environment for all our team members, regardless of ethnicity, gender, gender identity and expression, sexual orientation, limitations and talents of any kind, physical appearance, social background, marital status, age, or religion (or lack thereof).When you apply, we focus solely on your experience and motivation. You decide what additional information you want to disclose (photo, marital status, religion, gender, nationality, etc.). We value and treat all applications equally. Contact:Katia MinukhinaTalent Acquisition Manager kminukhina@getolo.com030398200588"
