"ID","Title","Link","Company","Location","Remote","Experience","EmploymentType","DatePosted","RoleDescription"
3527473,"Marketing Lead - Ebury Institutional","https://job-boards.eu.greenhouse.io/ebury/jobs/4665462101","Ebury","London","No",3,"Full time","2025-09-03T01:49:12.320620Z","Ebury is a global fintech firm dedicated to empowering businesses to expand internationally through tailored and forward-thinking financial solutions. Since our founding in 2009, weve grown to a diverse team of over 1,700 professionals across 40+ offices and 29+ markets worldwide. Joining Ebury means becoming part of a collaborative and innovative environment where your contributions are valued. Youll play a key role in shaping the future of cross-border finance, while advancing your own career in a dynamic, high-growth industry.
Marketing Lead, Ebury Institutional
Ebury London Victoria Office - Hybrid: 4 days in the office, 1 day working from home per week
Our private markets team are experiencing significant growth and Ebury is uniquely positioned to support Institutionals active in private markets.
We are looking for a high-performing, commercially minded Marketing professional to lead and execute Eburys Institutional marketing. This is a cross-functional role where you'll take ownership of campaigns from end to end-crafting compelling content, identifying key audiences, launching initiatives across multiple channels, and measuring their impact. You'll work closely with product, sales, and global marketing colleagues to elevate Eburys presence in Private Markets.
The Opportunity:
We are seeking a talented and experienced Marketing Lead to join our dynamic marketing team. This is a mid-level role for a commercially-minded marketer with a proven track record in B2B financial services.
You will play a pivotal role in driving awareness, engagement, and lead generation for our Institutional offerings, leveraging your expertise to execute comprehensive marketing strategies. A key aspect of this role will be to maximise the impact of Ebury's existing and future marketing assets, ensuring they are effectively utilised across all marketing channels.
Key Responsibilities:
Content &amp; Communications:

Deliver a content calendar, including the generation of editorial ideas, and content creation as well as continual improvement across marketing and sales collaterals, social media and website
Manage the creation and distribution of high-quality, engaging content tailored for private markets 
Support distribution team with bespoke content and pitch materials

Social Media:

 Manage and optimise social marketing channels, including LinkedIn showcase page, to drive traffic and conversions.
Analyse campaign performance for organic and paid initiatives, identify trends, and implement data-driven reportings.

Activation &amp; Events:

Identify PR opportunities and work with the PR team to secure media coverage.
Drive the set up of Ebury events marketing for key events

Skills &amp; Experience:

3-5 years of B2B marketing experience in asset management, private markets, fintech, or financial services
Proven track record of developing and executing successful marketing campaigns that drive measurable results.
Strong understanding of digital marketing channels and best practices (SEO, SEM, social media, email marketing).
Excellent written and verbal communication skills, with the ability to create compelling and engaging content.
Analytical mindset with the ability to interpret data and make data-driven decisions.
Highly organized, detail-oriented, and able to manage multiple projects simultaneously.
Self-starter with a proactive attitude and the ability to work independently and as part of a team.
Proficiency in marketing automation platforms (e.g., HubSpot, Salesforce Marketing Cloud) and CRM systems is a plus.

Why Ebury?

Competitive Starting Salary with an annual discretionary bonus that truly rewards your performance from day one.
Dedicated Mentorship: Learn directly from experienced managers who are invested in your success.
Cutting-Edge Technology: Leverage state-of-the-art, tailor-made tools and systems that enable you to perform at your best.
Clear, Accelerated Career Progression: Defined pathways to leadership and specialist roles within Ebury.
Dynamic &amp; Supportive Culture: Work in a collaborative environment where teamwork and personal growth are prioritised.
Generous Benefits Package: Access competitive benefits tailored to your location, which typically include health care and social benefits.
Central London Office: A fantastic location with excellent transport links.

Ready to launch your career with a global FinTech? Click the Apply Today and discover your potential at Ebury!About Us
Ebury is a FinTech success story, positioned among the fastest-growing international companies in its sector.Founded in 2009, we are headquartered in London and have more than 1700 staff with a presence in more than 29 markets worldwide. Cultural diversity is part of what makes Ebury a special place to be. From Sao Paulo to Dubai, Vancouver to Auckland, we enjoy sharing team experiences and celebrating success across the Ebury family.Hard work pays off: in 2019, Ebury received a 350 million investment from Banco Santander and has won internationally recognised awards including Financial Times: 1000 Europe's Fastest-Growing Companies.None of this would have been possible without our proudest achievement: our great people. Enthusiastic, innovative and collaborative teams, always ready to disrupt and revolutionise the fast-paced FinTech sector. At Ebury, were committed to building a workplace where everyone feels valued, supported, and empowered to thrive. Were proud to have active employee networks and ESG initiatives that reflect our inclusive culture, including our Womens Network, LGBTQIA+ Network, and Veterans Network. These communities provide spaces for connection, mentorship, advocacy, and collaboration across our global teams.
We believe in inclusion. We stand against discrimination in all forms and have no tolerance for the intolerance of differences that makes us a modern and successful organisation. At Ebury, you can be whoever you want to be and still feel a sense of belonging no matter your story because we want you and your uniqueness to help write our future.
Please submit your application on the careers website directly, uploading your CV / resume in English."
3525653,"Technical Account Manager","https://job-boards.eu.greenhouse.io/ebury/jobs/4662270101","Ebury","São Paulo","No",2,"Full time","2025-09-03T01:49:12.320724Z","Ebury is a global fintech firm dedicated to empowering businesses to expand internationally through tailored and forward-thinking financial solutions. Since our founding in 2009, weve grown to a diverse team of over 1,700 professionals across 40+ offices and 29+ markets worldwide. Joining Ebury means becoming part of a collaborative and innovative environment where your contributions are valued. Youll play a key role in shaping the future of cross-border finance, while advancing your own career in a dynamic, high-growth industry.
Technical Account Manager
Operations
Ebury Bank So Paulo Office - Hybrid: 4 days in the office, 1 day working from home per week
The Implementation Services Team is responsible for managing the technical relationships with API and complex Clients. This includes Clients using the Ebury API, those using open-banking (PSD2) and local and international standards (such as EBICS, SFTP or EDITRAN), those on custom implementations, and those using a mix of all of these. The team sits with Technology and interfaces with most other Ebury departments and teams, as well as directly with Clients. Reporting to the Implementation Services Manager, this role will take on a number of responsibilities within the team. 
What youll do


Ensure that API and complex implementations are running smoothly and Clients get an optimal onboarding and integration process;
The role would suit individuals with Technical Backgrounds such as QAs, Automation Engineers or any other hands-on role who want to move into a more customer-facing role;
Support the Sales Team and the Client in pre and post sales;
Manage the Clients implementation throughout the lifecycle;
Work with Operations and Security to ensure highest standards are met;
Gather Requirements for enhancements and ensure Clients are using the latest and most appropriate functionality;
Document requirements, analyse development or operational changes and present potential solutions to colleagues in Technology and Product; 
Execute the plans, monitor progress and adjust timelines or scope accordingly;
Report progress and communicate updates to third parties and internally;
Record videos, take part in webinars, and promote Ebury functionality in the community.


 
What youll need

Minimum of two years previous experience in a technical role;
Working with requirements documents, test cases, use cases, reporting;
Experience of working on projects, problem solving &amp; time management;
Experience with APIs: SOAP XML / JSON, Postman, Jira;
Host to host protocols like, SFTP;
Ability to debug or review logs;
Advanced English;
Excellent communicator with highly developed written and interpersonal skills;
Enjoys working in a multi-cultural and international environment with some Client visits;
Self-starter able to work effectively in a dynamic and rapidly changing environment;
Desirable: SWIFT MTXXX messaging, SEPA CAMT messaging; Payments industry experience; Open Banking AISP/PISP; Customer facing experience; Google Data Studio, Looker, SQL; Advanced Spanish.

Why Ebury?

Competitive Starting Salary with an annual discretionary bonus that truly rewards your performance from day one.
Dedicated Mentorship: Learn directly from experienced managers who are invested in your success.
Cutting-Edge Technology: Leverage state-of-the-art tailor made tools and systems that enable you to perform at your best.
Clear, Accelerated Career Progression: Defined pathways to leadership and specialist roles within Ebury.
Dynamic &amp; Supportive Culture: Work in a collaborative environment where teamwork and personal growth are prioritized.
Generous Benefits Package: Access competitive benefits tailored to your location, which typically include health care and social benefits.
So Paulo Office: A fantastic location with excellent transport links.

Ready to launch your career with a global FinTech? Click the Apply Today and discover your potential at Ebury!
You can also connect with me on LinkedIn - Rafaela Procpio
 
At Ebury Bank we value diversity in all its forms and are committed to creating an inclusive environment. All of our vacancies are open and eligible for people with disabilities.
 
#LI-ONSITE 
#LI- RP1About Us
Ebury is a FinTech success story, positioned among the fastest-growing international companies in its sector.Founded in 2009, we are headquartered in London and have more than 1700 staff with a presence in more than 29 markets worldwide. Cultural diversity is part of what makes Ebury a special place to be. From Sao Paulo to Dubai, Vancouver to Auckland, we enjoy sharing team experiences and celebrating success across the Ebury family.Hard work pays off: in 2019, Ebury received a 350 million investment from Banco Santander and has won internationally recognised awards including Financial Times: 1000 Europe's Fastest-Growing Companies.None of this would have been possible without our proudest achievement: our great people. Enthusiastic, innovative and collaborative teams, always ready to disrupt and revolutionise the fast-paced FinTech sector. At Ebury, were committed to building a workplace where everyone feels valued, supported, and empowered to thrive. Were proud to have active employee networks and ESG initiatives that reflect our inclusive culture, including our Womens Network, LGBTQIA+ Network, and Veterans Network. These communities provide spaces for connection, mentorship, advocacy, and collaboration across our global teams.
We believe in inclusion. We stand against discrimination in all forms and have no tolerance for the intolerance of differences that makes us a modern and successful organisation. At Ebury, you can be whoever you want to be and still feel a sense of belonging no matter your story because we want you and your uniqueness to help write our future.
Please submit your application on the careers website directly, uploading your CV / resume in English."
3525652,"Screening & Transaction Monitoring Analyst","https://job-boards.eu.greenhouse.io/ebury/jobs/4656543101","Ebury","León","No","Not specified","Full time","2025-09-03T01:49:12.320760Z","Ebury is a global fintech firm dedicated to empowering businesses to expand internationally through tailored and forward-thinking financial solutions. Since our founding in 2009, weve grown to a diverse team of over 1,700 professionals across 40+ offices and 29+ markets worldwide. Joining Ebury means becoming part of a collaborative and innovative environment where your contributions are valued. Youll play a key role in shaping the future of cross-border finance, while advancing your own career in a dynamic, high-growth industry.
Screening &amp; Transaction Monitoring Analyst - Ebury Mass Payments
Ebury Leon Office - Hybrid: 4 days in the office, 1 day working from home per week
 
Ebury Mass Payments (EMP) is the premier non-bank provider of high volume currency and payment solutions. The division operates in 5 of the 24 Ebury offices and has made a recent acquisition which will dramatically accelerate growth.
We are looking for a Screening &amp; Transaction Monitoring Analyst to join our EMP Operations team in our Leon office. We are looking for candidates who are ambitious, bright and enthusiastic to develop their professional career in Finance. This is an excellent opportunity to join a rapidly growing, international company in a role which offers professional growth and career progression.
 
What youll do

Safeguarding Ebury and our existing Clients from financial crime risk - including money laundering, terrorist financing, bribery and corruption, fraud, sanctions risk, tax evasion and reputational risk.
Reviewing and/or investigating matches against sanctions, PEPs, adverse media and internal lists in a timely fashion and processing in compliance with relevant legislative, regulatory and internal requirements
Conducting real-time and retrospective rules-based monitoring on client transactions and processing alerts in compliance with Eburys processes and procedures and making risk-based decisions when assessing the risk of the transactions performed by clients
Identification of red flags and exposure to financial crime risk, including escalation to Compliance where required
Responding to Requests For Information on transactions from banking partners
Responding to queries from other internal departmentsComplete and manage all allocated tasks with focus, and in a timely manner
Proactive follow-up of requests for information to ensure timely completion of customer due diligence
Communicate the status of tasks to colleagues, supervisors and managers, and escalate issues swiftly, where required.
Adhere to all internal policies, processes and procedures
Ensure prompt resolution of customers related issues (transactions, payments, RFIs and any other relevant issues as required).
Support ad-hoc projects within the department and wider business as required

 
What youll need

Entry level role preferably with experience in Transaction Monitoring/Screening or equivalent.
Knowledge of red flags and financial crime typologies relevant to the FX and payment space is preferential
Diligent, with good attention to detail and analytic mind
Proactive, with the ability to work within strict time-frames and under pressure
Working successfully in a target driven operational environment
Good communication skills, both written and verbal
Effective research and critical thinking skills with an ability to find solutions independently
Highly organised, with the ability to work to deadlines, multi-task, and prioritise and re-prioritise workload as neededCo-operative, and comfortable working in a team environment
Adaptable, with the ability to cope with changing products, processes and procedures
Curious and eager to learn, and actively asks questions to confirm understanding of processes and procedures
Fluency in English, any other language is considered highly desirable

 
Why Ebury?

Competitive Starting Salary with an annual discretionary bonus that truly rewards your performance from day one.
Dedicated Mentorship: Learn directly from experienced managers who are invested in your success.
Cutting-Edge Technology: Leverage state-of-the-art tailor made tools and systems that enable you to perform at your best.
Clear, Accelerated Career Progression: Defined pathways to leadership and specialist roles within Ebury.
Dynamic &amp; Supportive Culture: Work in a collaborative environment where teamwork and personal growth are prioritized.
Generous Benefits Package: Access competitive benefits tailored to your location, which typically include health care and social benefits.
Central Leon Office: A fantastic location with excellent transport links.

Ready to launch your career with a global FinTech? Click the Apply Today and discover your potential at Ebury!
 
#LI-JG1About Us
Ebury is a FinTech success story, positioned among the fastest-growing international companies in its sector.Founded in 2009, we are headquartered in London and have more than 1700 staff with a presence in more than 29 markets worldwide. Cultural diversity is part of what makes Ebury a special place to be. From Sao Paulo to Dubai, Vancouver to Auckland, we enjoy sharing team experiences and celebrating success across the Ebury family.Hard work pays off: in 2019, Ebury received a 350 million investment from Banco Santander and has won internationally recognised awards including Financial Times: 1000 Europe's Fastest-Growing Companies.None of this would have been possible without our proudest achievement: our great people. Enthusiastic, innovative and collaborative teams, always ready to disrupt and revolutionise the fast-paced FinTech sector. At Ebury, were committed to building a workplace where everyone feels valued, supported, and empowered to thrive. Were proud to have active employee networks and ESG initiatives that reflect our inclusive culture, including our Womens Network, LGBTQIA+ Network, and Veterans Network. These communities provide spaces for connection, mentorship, advocacy, and collaboration across our global teams.
We believe in inclusion. We stand against discrimination in all forms and have no tolerance for the intolerance of differences that makes us a modern and successful organisation. At Ebury, you can be whoever you want to be and still feel a sense of belonging no matter your story because we want you and your uniqueness to help write our future.
Please submit your application on the careers website directly, uploading your CV / resume in English."
3523868,"Engineering Manager","https://job-boards.eu.greenhouse.io/ebury/jobs/4664405101","Ebury","London","No","Not specified","Full time","2025-09-03T01:49:12.320791Z","Ebury is a global fintech firm dedicated to empowering businesses to expand internationally through tailored and forward-thinking financial solutions. Since our founding in 2009, weve grown to a diverse team of over 1,700 professionals across 40+ offices and 29+ markets worldwide. Joining Ebury means becoming part of a collaborative and innovative environment where your contributions are valued. Youll play a key role in shaping the future of cross-border finance, while advancing your own career in a dynamic, high-growth industry.
Engineering Manager
London Victoria Office - Hybrid: 4 days in the office, 1 day working from home
About the Role
We are seeking a highly motivated and experienced Engineering Manager to lead a team of talented engineers in the development and maintenance of our cutting-edge financial technology platform. As an Engineering Manager, you will play a critical role in shaping the technical direction of your domain, ensuring the delivery of high-quality solutions that meet the needs of our customers. You will be responsible for fostering a culture of collaboration, innovation, and excellence within your team while driving continuous improvement and growth.
Key Responsibilities

Technical Leadership:

Own a domain/subdomain and set the 0-6 month technical roadmap.
Work with senior engineers to ensure architectural consistency.
Be accountable for the reliability, availability, and security of your systems.
Ensure all systems have appropriate support, SLAs, on-call rotas, and documentation.




Delivery Management:

Be responsible for your team's delivery, including planning sprints and overseeing project health.
Assess the criticality of unplanned work, minimizing context-switching and unnecessary pressure.
Balance team capacity with roadmap demands.
Instill a sense of urgency to find the right balance between velocity and quality.
Ensure all incidents are owned.




Cross-Functional Collaboration:

Act as the primary liaison between engineering and product, partnering with your product counterpart to ensure full alignment.
Communicate progress and escalate issues effectively.




People Management:

Lead and manage a team of engineers at varying levels, creating a stable environment for the group.
Be responsible for managing the team's performance and well-being, initiating corrective actions when needed.
Provide coaching, performance reviews, and career pathing.
Create a culture of ownership and feedback.
Demonstrate the ability to hire, grow, and retain high-performing engineers.




Process and Performance:

Ensure that company processes are effectively and timely executed.
The primary measurement of success is at the team level.
Be accountable for team KPIs (velocity, quality, on-time delivery, morale, staffing).
You may manage a limited budget for tools or specific project costs.



Qualifications

Proven experience as an Engineering Manager or in a similar leadership role leading and supporting engineers.
Deep understanding of software development methodologies and best practices.
Experience with agile development processes.
Excellent communication, interpersonal, and leadership skills.
Strong problem-solving and decision-making abilities.
Passion for technology and innovation.

Benefits:

Competitive salary and benefits package.
Opportunity to work on challenging and rewarding projects.
Collaborative and supportive work environment.
Be part of a dynamic and growing company.
About Us
Ebury is a FinTech success story, positioned among the fastest-growing international companies in its sector.Founded in 2009, we are headquartered in London and have more than 1700 staff with a presence in more than 29 markets worldwide. Cultural diversity is part of what makes Ebury a special place to be. From Sao Paulo to Dubai, Vancouver to Auckland, we enjoy sharing team experiences and celebrating success across the Ebury family.Hard work pays off: in 2019, Ebury received a 350 million investment from Banco Santander and has won internationally recognised awards including Financial Times: 1000 Europe's Fastest-Growing Companies.None of this would have been possible without our proudest achievement: our great people. Enthusiastic, innovative and collaborative teams, always ready to disrupt and revolutionise the fast-paced FinTech sector. At Ebury, were committed to building a workplace where everyone feels valued, supported, and empowered to thrive. Were proud to have active employee networks and ESG initiatives that reflect our inclusive culture, including our Womens Network, LGBTQIA+ Network, and Veterans Network. These communities provide spaces for connection, mentorship, advocacy, and collaboration across our global teams.
We believe in inclusion. We stand against discrimination in all forms and have no tolerance for the intolerance of differences that makes us a modern and successful organisation. At Ebury, you can be whoever you want to be and still feel a sense of belonging no matter your story because we want you and your uniqueness to help write our future.
Please submit your application on the careers website directly, uploading your CV / resume in English."
