"ID","Title","Link","Company","Location","Remote","Experience","EmploymentType","DatePosted","RoleDescription"
3514273,"Head of Marketplace (e-commerce)","https://jobs.smartrecruiters.com/DeliveryHero/744000078948191-head-of-marketplace-e-commerce-","Hero","Stockholm","No","Not specified","Full time","2025-09-01T02:11:20.622512Z","Are you ready to lead our retail revolution?Do you have sharp business acumen in retail and want to help change how people shop? Do you want to develop a portfolio that not only adds value to customers but also strengthens partnerships and company growth? If you are also an analytical leader who can inspire and engage your team, this might be the opportunity for you! We are now looking for our Head of Retail, who will drive and further develop foodora Swedens E-Commerce strategy to new heights.The position belongs to our Quick Commerce department, which is responsible for expanding and developing foodoras retail business beyond the restaurant sector. Quick Commerce is an innovative division offering customers everything from groceries to pharmacy items and electronics delivered in minutes. As Head of Retail, you will lead a big team and be responsible for developing and managing our retail partners, including both large chains and smaller stores.What you will do:Oversee both our commercial and operational oversight of our marketplace vendorsLead and motivate the local retail team.Develop a profitable retail portfolio and strategy to ensure growth. Enhance the operational efficiency across marketplace vendorsNegotiate and secure long-term agreements with large retail chains and smaller stores.Assess market potential and identify new partnership opportunities.Ensure that foodora becomes the preferred partner in the retail sector.Track key KPIs related to growth, profitability, and team well-being.Collaborate closely with other departments such as operations, finance, and our general manager.To succeed as Head of Retail, we envision that you:Have higher education in business, marketing, economics, strategy, or management (relevant experience can compensate).
 Have leadership experience with personnel responsibility, and experience in account management and portfolio management.
 Can demonstrate strong results from negotiations and securing major contracts.
 Have a solid business understanding and analytical skills to develop business cases and manage budget and P&amp;L responsibilities.
 Are technically competent, with good experience in Office or G-Suite.Are fluent in both written and spoken Swedish and English....and as a person, you are:Structured and able to manage multiple tasks in a dynamic environment.
 Goal-oriented, focused on meeting high standards and objectives.
 Proactive and solution-oriented, thriving in collaboration with different stakeholders.
 Sales-oriented, with experience in account management and negotiation.
 Innovative, with a knack for thinking outside the box to find new solutions.Wellness allowance topped with the opportunity to participate in many work/life balance initiatives at foodora.Employee discount at foodora (woho!) and awesome friday breakfasts!Occupational pension, incl. premium exemption insurance, accident insurance and life insurance.foodora Learning - Monthly learning sessions about different topics, such as the Q-commerce industry, negotiation techniques and project management combined with a structured onboarding and insipring courses within Sana Labs.Great deals at Benify (for e.g. gym membership, e-bikes hotels, audiobooks, streaming services, clothes, kitchen supplies... and so much more!Awesome AWs and (pink) parties!"
3514272,"Picker (efood market) -  Περιστέρι","https://jobs.smartrecruiters.com/DeliveryHero/744000078946310-picker-efood-market-","Hero","Athens","No","Not specified","Full time","2025-09-01T02:11:20.622527Z","                   ,    ...      !  efood market    Pickers (    )  o   .       ,         online .                ,      efood market     . Picker :       (Picking - Packing)                         /             /        /logistics      :   ,              Life @efood:At efood, no day is the same as the one before! efooders know that working and having a good time aren't the opposite and thats why every day at efood is a new adventure! We always aim higher and we thrive in finding solutions to push our limits further!We care about our customers, our employees, our society.We seize every opportunity to celebrate achievements and milestones, but we also celebrate small things (like Fridays!)Every efooder is part of a fast-growing multinational company, with endless opportunities for professional growth and acquisition of new skills!We have an established, yet super creative and fun working environment, with talented and ambitious people whose ultimate goal is to maintain efood as the ideal workplace!  Hungry enough to join us?efood collects and processes personal data in accordance with applicable data protection laws. If you are a European Job Applicant see the privacy notice for further details."
3514271,"Data Analyst","https://jobs.smartrecruiters.com/DeliveryHero/744000078954615-data-analyst","Hero","Xinyi District","No",2,"Full time","2025-09-01T02:11:20.622542Z","We are seeking a dynamic Data Analyst to be part of our mission to drive impactful decisions across our 17 markets. Working within our Analytics team, you'll support the team by providing high-quality insights, maintaining data consistency, and collaborating with internal teams to assist in decision-making. This is a foundational role offering the opportunity to grow technical skills, gain exposure to high-impact projects, and learn from experienced data professionals.Data Preparation &amp; Analysis: Supporting data collection, cleansing, and preparation to ensure quality, reliability, and consistency. Conducting basic analyses using SQL and Excel, and assisting senior analysts with larger datasets.Dashboard Development: Creating and maintaining dashboards (e.g., in Looker or Tableau) for internal reporting needs. Ensuring they are user-friendly and meeting the requirements of key stakeholders.Reporting &amp; Ad Hoc Analysis: Assisting in generating recurring reports and fulfilling ad-hoc analysis requests from internal stakeholders to support strategic decisions.Data Quality &amp; Tracking: Monitoring data quality and participating in QA processes to ensure consistency across all reporting metrics.Collaboration: Working closely with senior analysts and team leads, learning from their approach to data modeling, visualization, and storytelling.Stakeholder Management: Partnering with business stakeholders across the organization to understand their analytical needs, proposing data solutions, and communicating insights in an actionable manner.
 Find out more about our Data Analytics folks here: Turn insights into impact!Looking for a career in data analytics? This could be the opportunity for you!Bachelors degree in Statistics, Mathematics, Economics, Computer Science, or a related field.Overall 2-5 years of experience in data analytics, ideally in a business or product analytics role.Familiarity with Commercial, Marketing or Logistics datasets and an understanding of the business processes driving these functions would be an added advantage. Proficiency in SQL and experience with at least one data visualization tool (e.g., Looker, Tableau).Familiarity with customer behavior tracking tools (e.g., Google Analytics) is a plus.Strong communication skills, with an ability to present findings in a clear and concise way.A team-oriented mindset with a willingness to learn and take on new challenges.
To help us review applications consistently, please attach a copy of your resume in English. We appreciate your effort and look forward to learning more about you!What we offer:A dynamic and challenging work environment.A company committed to developing you personally and professionally.A great working atmosphere with regular company and team events.A vibrant and international team committed to diversity and inclusion.Responsibility from day one in a fast growing and global company.foodpanda is operated by Delivery Hero Group (DH Group) - the worlds leading local delivery platform, operating in 70+ markets across Asia, Europe, Latin America, the Middle East, and Africa. Delivery Hero started as a food delivery service in 2011 and now employs 40,000+ people globally. Additionally, Delivery Hero is pioneering quick commerce, the next generation of e-commerce, aiming to bring groceries and household goods to customers in under one hour and often in 20 to 30 minutes. Headquartered in Berlin, Germany, Delivery Hero has been listed on the Frankfurt Stock Exchange since 2017.In July 2024, Delivery Hero SE merged three of its market-leading food delivery businesses, foodora and Yemeksepeti in Europe, and foodpanda in Asia. All three businesses now make up the second-largest organization within the Delivery Hero Group, and leading food and QCommerce delivery in 17 markets in both regions."
3514270,"Assistant Manager, Account Management","https://jobs.smartrecruiters.com/DeliveryHero/744000078964784-assistant-manager-account-management","Hero","Karachi","No",2,"Full time","2025-09-01T02:11:20.622557Z","Function as the main contact person for accounts in Karachi.Development and maintenance of strong and trustworthy relationships with all assigned accounts.Analysis and identification of upcoming needs and opportunities.Negotiate contracts and close agreements to maximize profits.Responsible for MoM Growth of all assigned accounts.Clearly communicate the progress of weekly/monthly/quarterly initiatives to internal and external stakeholders.Prepare reports on Commercial Metrics, Operational Metrics &amp; Product MixSupport cross functional teams in delivering the strategy by facilitating communication of lessons learned, resolving urgent issues, lining up appropriate group level support and deploying processes &amp; tools.Additional tasks/projects as they arise.Bachelor's Degree in Business Administration or relevant.At least 2+ years of work experience in a similar role.Experience with Microsoft Office, especially Excel, or Google equivalents.A little About Us:We are fast, like mind boggling fast! So if youre someone who loves ever changing goals and loves optimization, youre the right fit for us!We love people who can develop things from scratch, own them and then work on improving them.We love what we do, and we dont rest until weve achieved our targets. So if youre also someone who is driven until the dream is achieved, come join us!"
3514269,"Key Account Manager (Quick Commerce)","https://jobs.smartrecruiters.com/DeliveryHero/744000078971155-key-account-manager-quick-commerce-","Hero","Athens","No","Not specified","Full time","2025-09-01T02:11:20.622576Z","Do you excel at building strong, trust-based relationships with key clients and turning their needs into strategic solutions?Are you skilled at balancing client satisfaction with business goals through effective communication, negotiation, and problem-solving?This job ad is for you! We are looking for a passionate and results-driven Key Account Manager to join our team! In this role, you will act as the primary link between our most important partners and our internal teams, ensuring seamless collaboration and mutual growth. From understanding client needs and crafting tailored solutions to monitoring commercial and operational KPIs, you'll be at the heart of our client success strategy.If you're excited about making an impact, driving results through data, and building meaningful client relationships, wed love to meet you! What youll do:Develop and maintain solid relationships with efoods key clientsDevelop a thorough understanding of key clients' needs and requirements and prepare customized solutions to meet their objectivesAct as the main point of contact between key clients and internal teamsCommunicate and collaborate with marketing, sales, product, and operations departments to ensure that both company's &amp; key clients needs are metCompile and monitor reports on account progress, goals, and forecasts for account teams and stakeholders.Negotiate with key clients and sell services for the fulfillment of each client's long-term goalsMonitor commercial KPIs of the key partners aiming for their continual growthTrack operational KPIs of the key partners &amp; take actions in alignment with the Ops dpt to keep them healthy Life @efood At efood, we constantly have chances to raise the bar improving, innovating, and challenging ourselves to grow! 
We take ownership of what we do, embracing challenges, and making things happen! 
We move with pace to deliver value fast, which keeps us ahead, always balancing speed with quality! 
We stay humble   as we grow and dive deep   in situations, asking questions &amp; exploring beyond the surface to get the best solutions!
We bring good vibes by lifting each other up, focusing on whats possible, and being the kind of teammate everyone wants on their side! 
Were a fast-growing, dynamic team where every efooder has the opportunity to shine, grow, and be part of something exciting.

Hungry enough to join us? Proven experience in Sales &amp; Key Account ManagementCustomer-centric approachProficient in all Microsoft Office applications as well as CRM softwareStrong negotiation and leadership skillsExceptional customer service skillsExcellent communication skillsProblem-solving attitude Ability to work independently without supervisionWe recognize qualitative work and we want our people to feel appreciated! Thats why we offer an attractive remuneration package for what you bring in!We share a passion for food, so you will certainly appreciate the ticket restaurant card  to spend in restaurants and/or food supplies. We are efooders after all!We take care of you with Private Medical &amp; Life Insurance from day #1 to keep you healthy and safe!We want you to grow with us  ! And to help you keep improving, we provide you access to our online training platform where you can study  topics for your personal and professional growth!Are you a cappuccino lover ? Do you desperately want a cookie? Our inhouse cafeteria got you covered!If you want to stay in shape  , our in-house gym awaits you fully equipped!Pension Plan  to help you plan for the future.efood collects and processes personal data in accordance with applicable data protection laws. If you are a European Job Applicant see the privacy notice for further details."
3514268,"Sr. Director Media Solutions","https://jobs.smartrecruiters.com/DeliveryHero/744000078975916-sr-director-media-solutions","Hero","Dubai","No",10,"Full time","2025-09-01T02:11:20.622600Z","We are looking for a Senior Director Media Solutions to lead our retail media business and drive growth across our Grocery &amp; Retail vertical. This is a high-impact, end-to-end leadership role where you will be responsible for defining and executing our monetization strategy, and leading a diverse organization of core functions across Partnerships, Operations, and Campaigns.In this role, you will be instrumental in scaling our retail media business, with a primary focus on fast-moving consumer goods (FMCG) and future expansion into categories like health and beauty, electronics, and other brand advertising.  WHATS ON YOUR PLATE?&gt; Define and Execute Strategy: Architect the overarching product and go-to-market strategy for our retail media business. You will own the full end-to-end roadmap, from product prioritization and market entry to platform adoption. Your decisions will directly contribute to achieving country teams' P&amp;L objectives by providing strategic guidance and supporting direct investments. You will have full ownership of the entire retail media ecosystem, including onsite, offsite, and data monetization. &gt; Team Leadership &amp; Development: Lead, mentor, and scale our high-performing retail media organization. You will be responsible for overseeing the distinct functions within your team, ensuring they work together seamlessly to achieve our business objectives. This includes providing guidance to the Partnerships team on advertiser relationships, directing the Ad Operations &amp; Performance team on tool management and KPI tracking, and guiding the Campaigns team on cross-functional orchestration with marketing and product. &gt; Drive Cross-Functional Alignment: Serve as the primary driver of the retail media business across the organization. You will be the central point of contact, ensuring alignment with commercial teams on sales targets, with product and engineering on feature roadmaps, and with marketing on go-to-market initiatives. &gt; Ensure Operational Excellence: Implement and refine the operational framework for the entire retail media function. This includes optimizing organizational design, standardizing role leveling, and establishing best practices for execution and performance measurement to ensure we operate efficiently and effectively at scale.WHAT DID WE ORDER?Experience:10+ years of progressive experience in e-commerce, digital marketing, or retail media, with a proven track record of building and scaling media propositions within a marketplace, publisher, or retailer environment.Proven experience in a senior leadership role, with the ability to manage and develop multi-disciplinary teams and drive a culture of high performance.Deep expertise in retail media advertising, including sponsored ads, programmatic advertising, and data monetization strategies.Experience working across multi-market or global accounts, with an understanding of regional dynamics, particularly within the Middle East and North Africa (MENA) region.Working at an e-commerce operation is a must, where you have experience with commercial functions like category management, supply chain, and operations, even if they were outside the direct scope of your role.Skills:Strategic Acumen: Ability to translate complex business challenges into a clear, actionable strategy and long-term vision.Data-Driven Mindset: Strong analytical skills with the ability to leverage data to inform decisions, optimize investments, and tell a compelling story.Leadership &amp; Influence: Exceptional communication and interpersonal skills, with a track record of building trust and influencing stakeholders at all levels, both internally and externally.Commercial Orientation: A strong understanding of business drivers and the ability to identify new commercial opportunities to grow revenue.Agility: Proven ability to thrive in a fast-paced, dynamic, and ever-evolving e-commerce environment."
3514267,"Assistant, Accounts Payable","https://jobs.smartrecruiters.com/DeliveryHero/744000078979043-assistant-accounts-payable","Hero","Lahore","No",2,"Contract","2025-09-01T02:11:20.622624Z","Perform 3-way match in the Internal System for all incoming invoices for the different warehouses across Pakistan.Recording of invoice in the Accounting system.Ensure accuracy of invoices and outgoing payments.Keep track of all expenditures and outgoing payments.Support in monthly closing activities, for example booking of accruals for invoices that have yet to be received.Continuous improvement of the end-to-end Accounts payable process.Ad-hoc finance or administrative support to the finance team.Minimum 2 years experience or post qualification experience in an audit firm.Bachelors degree required in Accounting, Finance or another relevant field.Proficient in Excel (e.g. Pivot Tables, VLOOKUPs etc.)Excellent written and verbal communication skills, strong analytical abilities.Ability to work well under pressure, detail-oriented and employs a proactive approach to problem-solving.Team player with an ability to function effectively in a dynamic, fast-paced environment.What we offerA dynamic and challenging work environment.A company committed to developing you personally and professionally.A great working atmosphere with regular company and team events.A vibrant and international team committed to diversity and inclusion.Responsibility from day one in a fast growing and global company.Other benefits include free food, health and dental insurance, and learning and development opportunities!Our parent company, Delivery Hero, is a global leader in the food delivery industry processing over 3 million orders every day and operating in 40+ markets in the world, with 18,000 employees and approximately 500,000+ restaurant partners."
3514266,"Category Manager - MENA - Pricing & Promotion","https://jobs.smartrecruiters.com/DeliveryHero/744000078981245-category-manager-mena-pricing-promotion","Hero","Dubai","No",4,"Full time","2025-09-01T02:11:20.622647Z","Were looking for a Category Manager (Pricing &amp; Promotions) to join the team and focus on growing our own Grocery Store tMart, which is the regions first cloud store concept offering 30- minute delivery of groceries at hypermarket prices. The service has expanded rapidly across Kuwait, UAE, Qatar, Jordan, Bahrain, Egypt, Oman and Iraq!
Whats On Your Plate?Lead with countries on developing a pricing strategy that meets our objectives by country Lead with countries on identifying our target competitors, collecting retail audits, Setting the pricing matrix, and support on testing and analyzing results Do regular maintenance for the pricing strategies of the countries and resolve items with margin erosion, and items that jeopardize our price perception Lead discussions with price scrapping providers (Data Science internally or external vendors) to enhance results and data accuracy Evaluate compliance with the pricing strategy by country based on pricing tools and guidelines Lead with country teams on implementing the promo strategy and measuring promo effectiveness.Lead with country teams on assessing the performance &amp; ROI of each campaign and support them on taking proper decisions Do reporting of pricing and promotion KPIs and deep dive on monthly basis for visibility of local commercial teamWhat Did We Order? You have at least 4+ years of experience in progressive development and management of multiple product categories, matured by working for large retailers (FMCG), in an international setting. You are very detail-oriented, structured and know how to prioritize -- you consider yourself as someone who delivers solutions and not bottlenecks to be solved. You are willing to do anything necessary for the project to succeed, including working on the warehouse floor when you are short staffed to making a customer delivery, or to take customer calls. No job is too insignificant, no detail is too small for you. You are able to interact with senior-level executives and can manage the expectations of multiple stakeholders. You are someone energized by the unknown and look forward to learning each day on the job. You have excellent analytical and communication skills, and always like to be hands-on with several tools. You have excellent analytical skills, and always like to be hands-on with several tools. Knowing SQL would be highly advantageous  Additionally, you have robust interpersonal and intercultural skills. You can inspire several teams and stakeholders to rally behind a mission. Language skills: Fluent English and Arabic would be highly advantageous."
