"ID","Title","Link","Company","Location","Remote","Experience","EmploymentType","DatePosted","RoleDescription"
3522350,"Sales Executive - Local Shops","https://jobs.smartrecruiters.com/DeliveryHero/744000079174305-sales-executive-local-shops","Hero","Sulaymaniyah","No","Not specified","Full time","2025-09-01T02:11:20.622137Z","Role SummaryResponsible for developing the business in the designated region through vendor acquisition.What's On Your Plate?Submit the Sales plan as per the set objectives. Maintain accurate records of all sales and prospecting activities to analyze the sales prospects.  Receive the leads from the lead generation team, communicate with them and convert the leads to sales.  Interact with the customer for product offering, brand awareness on time to time basis by meetings and calls.  Identify the clients who show inclination towards the product but didnt purchase it and follow up for these kinds of customers for special deals and offering.  Create and conduct effective proposal presentations, negotiate and send Request of Proposal (RFP) quoting the rates and terms of conditions to sign the contract and bring clients onboard with Talabat.com.  Encourage clients/ local shops to upload menu pictures on Talabat site.  Maintain the record and inform the Management for contact and not contacted leads and ensure that the records are entered into personal and automated follow-up processes. Attain accurate and original logo and SKU items picture from vendors.  Attain the information of delivery charge methodology. Implement promotions, coupons and vouchers to boost and generate sales growth.  Encourage vendors to subscribe for the online payment gateway. Maintain accurate records of all sales and prospecting activities including:Sales calls Closed salesFollow-up activities Sales expense reportPresentations Sales meeting report (new shops) Daily signed contract report Interpersonal SkillsCommunication SkillsCustomer Service SkillsNegotiation SkillsProblem Solving SkillsMarket Research SkillsPlanning and Organizing SkillsFluent in English, Arabic, and Kurdish"
3522115,"Sr. Data Scientist - Algorithms (Based in Dubai)","https://jobs.smartrecruiters.com/DeliveryHero/744000079170435-sr-data-scientist-algorithms-based-in-dubai-","Hero","London","No",3,"Full time","2025-09-01T02:11:20.622237Z","Role SummaryAs the leading delivery company in the region, we have a great responsibility and opportunity to impact the lives of millions of customers, restaurant partners, and riders. To realize our potential, we need to advance our platform to become much more intelligent in how it understands and serves our users.As a senior data scientist on the algorithms track, your mission will be to improve the quality of the decisions made across product and business via relevant, reliable, and actionable data. You will own a particular domain across product and business and will work closely with the corresponding product and business managers and are part of a talented team of data scientists and data engineers. You will own the entire data value chain including logging, data modeling, building machine learning and/or advanced analytics solutions, analysis, reporting, and experimentation.You will be part of a specialized team that keeps a pulse on the evolving industry landscape, helping us anticipate trends through strategic insights, and maintain our leadership in the MENA region in the food delivery space.  
 What's On Your Plate?Leveraging ambiguous business problems as opportunities to drive objective criteria using data.Solving complex business problems using the simplest most appropriate Algorithms to deliver business value.Designing and implementing effective and impactful machine learning systems in production.Developing a deep understanding of the product experiences and business processes that make up your area of focus.Developing a deep familiarity with the source data and its generating systems through documentation, interacting with the engineering teams, and systematic data profiling.Contributing heavily to the design and maintenance of the data models that allow us to measure performance and comprehend performance drivers for your area of focus.Working closely with product and business teams to identify important questions that can be answered effectively with data.Delivering well-formed, relevant, reliable, and actionable insights and recommendations to support data-driven decision-making through deep analysis and automated reports.Designing, planning, and analyzing experiments (A/B and multivariate tests) occasionally.Supporting product and business managers with KPI design and goal setting.Mentoring other data scientists in their growth journeys.Contributing to improving our ways of work, our tooling, and our internal training programs.What Did We Order?Technical ExperienceExperience in machine learning, deep learning, recommendation systems, pattern recognition, data mining and artificial intelligence.Deep knowledge and experience in ML algorithms and frameworks (e.g. Scikit-learn, XGBoost, LightGBM, CatBoost, SVMs, Keras, TensorFlow, PyTorch ...).Excellent SQL.Competence with reproducible data analysis using Python or R.Familiarity with data modeling and dimensional design. (Experience with DBT is a plus)Strong command over the entire data lifecycle including; problem formulation, data auditing, rigorous analysis, interpretation, recommendations, and presentation.Familiarity with different types of analysis including; descriptive, exploratory, inferential, causal, and predictive analysis.Deep understanding of the various experiment design and analysis workflows and the corresponding statistical techniques.Familiarity with product data (impressions, events, ..) and product health measurement (conversion, engagement, retention, ..).Familiarity with BigQuery and the Google Cloud Platform is a plus.Data engineering and data pipeline development experience (e.g. via Airflow) is a plus.QualificationsBachelor's degree in engineering, computer science, technology, or similar fields. A postgraduate degree is a plus but not required.3+ years of overall experience working in data science or machine learning.Experience doing data science in an online consumer product setting is a plus.A good problem solver with a figure it out growth mindset.An excellent collaborator.An excellent communicator.A strong sense of ownership and accountability.A keep it simple approach to #makeithappen."
3522114,"Admin tMart","https://jobs.smartrecruiters.com/DeliveryHero/744000079174115-admin-tmart","Hero","Maadi","No",1,"Contract","2025-09-01T02:11:20.622261Z","Raising Purchase Orders (Regulars &amp; Promotion) in the system and sending it to suppliersUpdate Internal database with order details (dates, vendors, quantity) and the suppliers details. Track Orders and ensure timely delivery.Communicates with the supplier and with the operations team in regards with the LPO/DeliveryGenerating and Sending Admin reports (Active Items, Customer Orders, Weekly Cost Update, Pepsi Data Sharing, QFA sales report, Purchase Order MTD)Sending Monthly Data Sharing to suppliersChecking the images in Talabat App weekly and uploading the ones that are missingChanging the barcodes, cost price and description as per operations requestUpdates the google sheet for all the changes in barcodes, price and description.Maintains the countrys Assortment/Google FilePrinting and stamping of documentsAd hoc related tasks as per managers request You have at least 1+ years of experience within data recording and the administrative field You are very detail-oriented, structured and know how to prioritize -- you consider yourself as someone who delivers solutions and not bottlenecks to be solved.You are able to interact with senior-level executives and can manage the expectations of multiple stakeholders.You are someone energized by the unknown and look forward to learning each day on the job.You have excellent analytical and communication skills, and always like to be hands-on with several tools."
3517410,"Specialist, Product Operations - (Logistics, Service)","https://jobs.smartrecruiters.com/DeliveryHero/744000079005747-specialist-product-operations-logistics-service-","Hero","Berlin","No",2,"Full time","2025-09-01T02:11:20.622289Z","We are on the lookout for a Specialist, Product Operations - (Logistics, Service) to join the Service product line on our journey to always deliver amazing experiences.  In our Logistics Team, youll tackle high-impact challenges that make last-mile delivery efficient, affordable, and sustainable. Your work will directly improve experiences for riders, end customers, and merchants across the globe. Each enhancement you contribute will help Delivery Hero optimize delivery operations, supporting expansion into new areas like grocery and retail. Our Service Product line is responsible for all customer, vendor and rider support-related products, including our in-house agent-facing tools for customer issue resolution. Within the Product line, you will be responsible for the performance of our products and work very closely with our product, analytics and data science teams and different entities across the globe to optimize them in order to maximize the value (both cost and top-line) to the business.
 In our team, youll tackle high-impact challenges that make last-mile delivery efficient, affordable, and sustainable. Your work will directly improve experiences for riders, end customers, and merchants across the globe. Each enhancement you contribute will help Delivery Hero optimize operations.You monitor, analyze, and optimize key performance indicators (e.g., AHT, SOP adherence, resolution rate, tool adoption) across regions to ensure agent-facing tools are driving efficiency, productivity, and quality at scale.You drive end-to-end performance improvement initiatives by identifying usage gaps, conducting root cause analyses, and implementing targeted actions that boost agent productivity and tool ROI.You enable data-driven decision making through structured reporting, executive-ready insights, and dashboards that track progress toward business goals and highlight improvement areas.You act as the operational owner of Agent CRM and GenAI tools, ensuring optimal utilization by setting best practices, leading initiatives, and ensuring alignment across all markets and teams.You serve as the central point of contact and subject matter expert for operational teams leveraging Agent CRM and GenAI, proactively addressing blockers, consolidating feedback, and enabling global alignment.You collaborate closely with cross-functional teamsProduct, Operations, Training, Quality, and Data Analyticsto shape tool evolution based on front-line feedback and business priorities.You continuously assess and enhance SOPs, training material, and workflows to ensure scalable, consistent, and impactful tool usage across markets.You challenge the status quo by bringing innovative, data-backed proposals for improving both tooling and process, and ensure fast, coordinated execution and follow-through.You measure impact and effectiveness of tool and process improvements through pre/post analysis and continuous feedback loops.You have 2-4 years of relevant experience (not counting internships) in a consulting or tech company, working in functions like product operations, contact center operations, or operations excellenceYou have at least a Bachelors degree in a quantitative subject - e.g. mathematics, engineering, business administrationYou have very strong analytical and problem-solving skills, with the ability to draw insights from complex data setsYou are self-driven and communicative, independent and pragmatic in handling business challengesYou are proactive, intellectually curious, and motivated by shaping product and business strategy in a high-stakes environmentYou have strong analytical skills; proficiency in Excel, Google Sheets, and/or data visualization tools (e.g., Looker, Tableau, Power BI)You have excellent English communication skills, both written and spokenEnsuring you and all our Heroes are looked after, happy, and healthy is always on the menu. Because if youre in good shape, then were in good shape.Make the most of our hybrid working model and join the team for face-to-face connection and collaboration in our beautiful Berlin campus 2 days a weekWe offer 27 days holiday with an extra day on 2nd and 3rd year of serviceWe will support you in developing yourself and your career growth opportunities: 1.000  Educational Budget, Language Courses, Parental Support and access to the Udemy Business platform to explore a variety of online courses.Get moving and release those wonderful, mind-boosting endorphins: Health Checkups, Meditation, Gym &amp; Bicycle SubsidyCash. Dough. Cheddar. Whatever you call it, well help you with it: Employee Share Purchase Plan, Sabbatical Bank,  Public Transportation Ticket Discount, Life &amp; Accident Insurance, Corporate Pension PlanThe power of getting together over some food is unrivaled. Here are a few ways to help you do that. All the yum: Digital Meal Vouchers, Food Vouchers, Corporate Discounts. Courses. Ready to join our team? If youre excited to grow, collaborate and be part of the worlds leading delivery platform, wed love to hear from you. Apply today!We believe diversity and inclusion are key to creating not only an exciting product, but also an amazing customer and employee experience. Fostering this starts with hiring - therefore we do not discriminate on the basis of racial identities, religious beliefs, color, national origin, gender identities or expressions, sexual orientations, age, marital or disability statuses, or any other aspect that makes you, you. We encourage you to let us know if you need any accommodations or specific accessibility support to ensure a smooth interview experiencejust include it in your application. You're welcome to share your pronouns (he/she/they) right from the start so we can address you respectfully from our first contact."
3517409,"Sr. Specialist Demand Planning","https://jobs.smartrecruiters.com/DeliveryHero/744000079006076-sr-specialist-demand-planning","Hero","Dubai","No",5,"Full time","2025-09-01T02:11:20.622315Z","Were looking for a Sr Specialist Demand Planning to join the team and focus on growing our own Grocery Store tMart, which is the regions first cloud store concept offering 30-minute delivery of groceries at hypermarket prices. The service has expanded rapidly across Kuwait, UAE, Qatar, Jordan, Bahrain, Egypt, Oman and Iraq! Whats On Your Plate?Demand Forecasting and Planning : Ability to use past sales data, market trends, promotions and category insights to develop a highly accurate forecast for the Import Shipments portfolioImports Shipments Planning: Ability to plan forecasts/stocks/inbound containers for a 3/6 month forward pipeline to maintain constant availability with adequate Stock Cover, utilizing all available data sources and alignment processes with cross functional teams.Import Shipment Clearance Process: Act as subject matter expert and drive process governance and adherence for imports shipment clearing process with external/internal stakeholders.Work closely with Finance/Commercial/Operations teams to ensure zero demurrages, minimized claims and expedited/time bound clearing process is in place. Ability to monitor and drive continuous process improvement to reduce costs. Ensure new product sourcing follows internal guidelines/lead times and are planned accordingly.Work with respective Country Supply chain teams on projects and initiatives to drive process improvements.Work closely with commercial/operations teams on key projects and initiatives.Reporting and Communication: Prepare and present demand planning reports and dashboards. Use BI analytics to automate reporting processes.Implement standardized supply chain metrics and processes for all MENA countries.Inventory Management: Ability to plan and drive DOH policy for all MENA countries with end to end mapping of supply chain processes.Work with respective country team to improve Forecasting accuracy and availability of SKUs in storeMonitoring inventory processes to ensure Shrinkage is minimized while optimizing on DOH.Promotions Planning: Work closely with the commercial team to define metrics and processes for promotions planning in the supply chain.DC Management: Monitor daily and weekly DC KPIs and share with Local country head and drive the improvement in operations.Establish and ensure compliance about processes and Operations in WarehouseSupplier Management: Able to hold discussions with external stakeholders on availability and fill rate and drive improvements.Project Management: Ability to work on various projects with a wide variety of stakeholders, managing project timelines and team expectations effectively.What Did We Order?You have at least 5+ years hands-on experience in Supply Chain Planning, Forecasting, Import Shipments, DC Planning, Inventory Management &amp; System implementationsYou come with an experience in retail groceries, ideally with focus on Ultra Fresh Analytical skills, big data manipulation + advanced ease with excelYou have experience in forecasting models and suppliers schedulingYou have experience in Imports Shipments, Incoterms.You are very detail-oriented, structured and know how to prioritize -- you consider yourself as someone who delivers solutions and not bottlenecks to be solved.You have good stakeholder management skills and are a self starter with an entrepreneurial mindset.You are someone energized by the unknown and look forward to learning each day on the jobYou have excellent analytical and communication skills, and always like to be hands-on with several tools"
3517408,"Account Executive Senior","https://jobs.smartrecruiters.com/DeliveryHero/744000079024206-account-executive-senior","Hero","Lima","No","Not specified","Full time","2025-09-01T02:11:20.622340Z","En PedidosYa, buscamos Account Executive Senior para potenciar y fidelizar las marcas aliadas a travs de la administracin y venta de funcionalidades en la App.Cules sern tus desafos?Entender el comportamiento de nuestros partners para brindarles apoyo y ayudarles a desarrollarse en la categora.Realizar seguimiento y anlisis de resultados de los locales para identificar oportunidades de mejora comercial.Gestionar y actualizar catlogos, ofertas, horarios y perfiles, brindando asesoramiento comercial.Fidelizar y optimizar la relacin comercial con nuestros partners, rentabilizando la categora.Capacitar a los partners en el uso de las herramientas de la App y otros portales.Experiencia en generacin y gestin de carteras de clientes y cuentas comerciales.Mnimo 2 aos de experiencia comercial, preferentemente en el rubro E-commerce.Conocimientos slidos de Marketing Digital (KPIs como CPO, CPA, CPC, Ratios de Conversin).Dominio avanzado de Excel.Gran capacidad de comunicacin, organizacin, autonoma, habilidades de negociacin y orientacin a resultados. Crear valor para un gran ecosistema de negocios, con foco en la persona usuaria, porque somos user centric.Jugar en equipo siempre.Moverte a la velocidad de tus ideas.Aprender, desarrollarte y reinventarte.Generar impacto positivo en las personas y el planeta.Trabajar en #ModoPeYa: nuestra manera de trabajar focalizada en la flexibilidad y orientada a lograr un buen balance dentro y fuera de la oficina.La diversidad de talento potencia nuestra Cooltura y nuestra organizacin. Jugamos en equipo en todo lo que hacemos, y lo que ms nos gusta de eso es que promovemos la creacin de equipos diversos e inclusivos que puedan aportar diferentes perspectivas a PedidosYa. Nuestras oportunidades laborales estn abiertas a todas las personas, independientemente de su identidad de gnero, orientacin sexual, origen tnico, religin, edad, discapacidad y/o otras caractersticas individuales.

En caso de necesitar algn ajuste razonable o accesibilidad particular para tener la entrevista, por favor no dejes de aclararlo en tu postulacin. Adems, sintete libre de indicarnos tus pronombres (l/ella/elle) desde el primer contacto. 

#CoolturaPeYa #LaDiversidadNosPotencia"
3517407,"Performance & Special Projects Executive","https://jobs.smartrecruiters.com/DeliveryHero/744000079031738-performance-special-projects-executive","Hero","İstanbul","No",3,"Full time","2025-09-01T02:11:20.622366Z","Define and execute the business strategy for Dmarts and Shops in TR, with a focus on driving revenue growth, improving profitability, and enhancing customer experienceAccountable for annual budgeting and working with country teams in meeting profitability/ financial targets across portfolio marketsDrive cross-functional collaboration with other teams within Yemeksepeti and DH to ensure alignment and maximize synergies across the organizationIncubate &amp; Lead special projects across the Dmart and Shops businesses, which may include new market launches, process improvements, and technology implementationsBuild and lead a high-performing team of performance managers, BI Analysts and project managersProvide regular updates to TR leadership on the performance of the business, key initiatives, and progress towards strategic goals.Bachelor's or Master's degree in Business Administration, Engineering, or related field.At least 3-5 years of experience in a performance management or operations role within the e-commerce or technology industries, with a proven track record of driving resultsStrong analytical skills &amp; Excellent project management skills, with the ability to lead and execute complex projects across multiple stakeholders.Strong leadership skills with experience in managing and developing high-performing teams.Excellent communication and interpersonal skills in English, with the ability to effectively communicate with stakeholders at all levels of the organization.Ability to work in a fast-paced and dynamic environment, with a strong sense of urgency and attention to detail.A chance to crown your career at Yemeksepeti, Turkey's largest online quick delivery platform, that has been raising future managers and industry leaders for 20 years!A working environment where employee happiness is prioritized, with a strong corporate culture, passionate colleagues working together towards the same goal, and a transparent management approach!Project opportunities that you can run together with the employees of Delivery Hero companies in 43 countries of the world and great teachings about global industry leadership!Flexible work hours so that you can plan your business and social life as you wish! (Start working at any time between 08:00 and 10:00!)A birthday leave waiting for you the next day so you can have fun and party as much as you want on your birthday!Online trainings shaped by your choices, where the opportunities you can learn and improve yourself are unlimited!A comprehensive private health insurance that will never let you down when you need it!The Yemeksepeti family! Always smiling and high communication skills!A pre-planned orientation program so that you can capture the spirit of Yemeksepeti in the best way, get to know the brand from the inside, and always feel at home. And of course, a Buddy who will always support you in your first weeks!Your rights arising from the processing of your personal data, within the scope of the Law on the Protection of personal data. You can find detailed information on the page of our Clarification Text at https://www.yemeksepeti.com/contents/kvkk-aday-aydinlatma-metni"
