"ID","Title","Link","Company","Location","Remote","Experience","EmploymentType","DatePosted","RoleDescription"
3510009,"Engineer II - Data Platform","https://jobs.smartrecruiters.com/DeliveryHero/744000078732515-engineer-ii-data-platform","Hero","Barcelona","No",3,"Full time","2025-09-01T02:11:20.622770Z","Were hiring an Engineer II to join the Data Platform team, powering Delivery Hero - based in Glovo, Barcelona.YOUR MISSIONYou will work in one of the core data teams within Glovo, responsible for developing new capabilities of the Global Data Platform that empowers the full Delivery Hero group of users to create a variety of data products and data assets. You will work mostly with cloud solutions, making sure that our data platform is highly scalable, available, secure and optimized to cope with the increase in demand.THE JOURNEYWork on challenging problems regarding large amounts of data processing.Develop software using modern engineering approaches and agile principles.Make our technology and our team scale as the business grows.End-to-end ownership of team goals.Deliver high-quality solutions.Drive and Participate in the team technical decisions.WHAT YOU WILL BRING TO THE RIDEExperience diagnosing and resolving performance issues in complex software systems3+ years of relevant full-time experienceProficient in Python, kotlin, or other high-level programming languagesSkilled in scripting languages (e.g., Bash, Python, etc.)Extensive knowledge of object-oriented programming, design patterns, and software architectureStrong understanding of data modeling and database designCommitted to best practices in object-oriented development and writing clean, well-structured codePassionate about writing automated tests and ensuring code reliabilityProficient in containerizing applications using Docker for consistent development, testing, and production environments; experienced with Dockerfiles, Docker images, and Docker ComposeKnowledgeable in relational databases and alternative data management approachesFamiliar with concurrency and event-driven developmentExcellent analytical and problem-solving skillsDemonstrated interest in areas beyond coding such as architecture, algorithms, optimization, automation, or scalabilityStrong written and verbal communication skills in EnglishNice to have:Experience in managing distributed services/microservices platforms.Experience with Amazon web services or Google cloud services  (GCP)Experience with SparkExperience with Data Mesh/ Datalake Catalogs. Experience with Bigquery and/or NotebooksExperience with Kubernetes. Experience with Kafka, Kinesis, Flink event streamingIndividuals representing diverse profiles, and abilities, encompassing various genders, ethnicities, and backgrounds, are less likely to apply for this role if they do not possess solid experience in 100% of these areas. Even if it seems you don't meet our musts don't let it stop you, we are all about finding the best talent out there! Skills can be learned, and embracing diversity is invaluable.We believe driven talent deserves: Monthly Glovo credits to satisfy your cravings! Discounted gym memberships to keep you energized. Extra time off, the freedom to work from home two days a week, and the opportunity to work from anywhere for up to three weeks a year! Enhanced parental leave, and office-based nursery. Online therapy and wellbeing benefits to ensure your mental well-being.Here at Glovo, we thrive on diversity, we believe it enhances our teams, products, and culture. We know that the best ideas come from a mashup of brilliant diverse minds. This is why we are committed to providing equal opportunities to talent from all backgrounds - all genders, racial/diverse backgrounds, abilities, ages, sexual orientations and all other unique characteristics that make you YOU. We will encourage you to bring your authentic self to work, fostering an inclusive environment where everyone feels heard. Feel free to note your pronouns in your application (e.g., she/her/hers, he/him/his, they/them/theirs, etc).So, ready to take the wheel and make this the ride of your life? Delve into our culture by taking a peek at our Instagram and check out our Linkedin and website!We believe diversity and inclusion are key to creating not only an exciting product, but also an amazing customer and employee experience. Fostering this starts with hiring - therefore we do not discriminate on the basis of racial identities, religious beliefs, color, national origin, gender identities or expressions, sexual orientations, age, marital or disability statuses, or any other aspect that makes you, you. We encourage you to let us know if you need any accommodations or specific accessibility support to ensure a smooth interview experiencejust include it in your application. You're welcome to share your pronouns (he/she/they) right from the start so we can address you respectfully from our first contact."
3510008,"Senior Engineer, Golang, - (Global Experimentation - Tech Foundations)","https://jobs.smartrecruiters.com/DeliveryHero/744000078735451-senior-engineer-golang-global-experimentation-tech-foundations-","Hero","Barcelona","No",5,"Full time","2025-09-01T02:11:20.622786Z","We are on the lookout for a Senior Engineer, Golang, - (Tech Foundations) to join the Global Experimentation on our journey to always deliver amazing experiences. As a member of the Tech Foundation Team, youll support Delivery Heros rapid innovation and growth. Youll work on foundational systems that enable faster feature development, security, and reliability across our global engineering community. Every enhancement you make will contribute to our teams' ability to build, scale, and deliver quality featuresultimately impacting millions of users worldwide.In this role you will Design, develop, and implement high-quality, high-performance backend services primarily using Go (Golang) and JVM-based technologies.Collaborate with cross-functional teams to define the best architecture and integration strategy for new services and functionalities.Ensure the scalability, reliability, and efficiency of our systems, optimizing the use of AWS Cloud Services (EC2, S3, RDS, Lambda, SQS, SNS, DynamoDB, etc.).Implement and maintain observability tools (monitoring, logging, tracing) using platforms like Grafana, Prometheus, ELK Stack, etc., to ensure system visibility and rapid problem resolution.Actively participate in code reviews, system design, and architectural discussions, contributing your expertise and best practices.Identify and address performance bottlenecks, security vulnerabilities, and reliability issues in the backend infrastructure.Design and implement multi-region and multi-tenant architectures to ensure high availability and low latency globally.Work in a collaborative environment, communicating effectively with engineering, product, and operations teams.5+ years of professional backend software development experience working on modern backend programming languages, such as Go (Golang), Java, Python, or Kotlin. Experience building production services with Go is a significant plus.Demonstrated experience in designing, implementing, and operating scalable and highly available systems on AWS Cloud Services.Hands-on experience with observability tools like Grafana, Prometheus, Datadog, or Kibana for monitoring, alerting, and log analysis.Deep understanding of relational databases (e.g., PostgreSQL, MySQL) and NoSQL (e.g., DynamoDB, MongoDB, Redis).Experience with microservices architectures and RESTful/gRPC APIs.Intermediate to advanced English proficiency is required for effective communication.Nice to have:Knowledge and hands-on experience with Feature Flagging and/or A/B Testing systems.Experience or adaptability to work with multiple programming languages.Familiarity with Docker and Kubernetes.Experience working in a fast-paced, agile environment.A passion for delivering high-quality, maintainable, and scalable code.Individuals representing diverse profiles, and abilities, encompassing various genders, ethnicities, and backgrounds, are less likely to apply for this role if they do not possess solid experience in 100% of these areas. Even if it seems you dont meet our musts dont let it stop you, we are all about finding the best talent out there! Skills can be learned, and embracing diversity is invaluable.We believe driven talent deserves: An enticing equity plan *if applicable Top-notch private health insurance to keep you at your peak. Monthly Glovo credits so you can test new features in our beta app (and to satisfy your cravings!) Discounts on transportation, food, and even kindergarten expenses or office-based nursery. Discounted gym memberships to keep you energized. The freedom to work from home two days a week, and the opportunity to work from anywhere for up to three weeks a year. . Enhanced parental leave (*if applicable) Online therapy and wellbeing benefitsWell deliver a non-vanilla culture built on talent, where we work to amplify the impact on millions of people, paving the way forward together.At Glovo, we truly value diversity for the positive impact it brings to our teams, products, and culture. Were dedicated to providing equal opportunities for talent from all backgrounds. Feel free to note your pronouns in your application (e.g., she/her/hers, he/him/his, they/them/theirs, etc).Delve into our culture by taking a peek at our Instagram and check out our Linkedin and website!"
3510007,"Specialist, Product Support - (Logistics, Rider)","https://jobs.smartrecruiters.com/DeliveryHero/744000078742237-specialist-product-support-logistics-rider-","Hero","Berlin","No","Not specified","Full time","2025-09-01T02:11:20.622801Z","We are on the lookout for a Specialist, Product Support (Logistics, Rider) to join the Global Logistics Team on our journey to always deliver amazing experiences. 

In our Logistics Team, youll tackle high-impact challenges that make last-mile delivery efficient, affordable, and sustainable. Your work will directly improve experiences for riders, end customers, and merchants across the globe. Each enhancement you contribute will help Delivery Hero optimize delivery operations, supporting expansion into new areas like grocery and retail.Triage and investigate bug reports, complying with existing SLAsWork cross-functionally with Engineers and Product Managers, to advocate key areas for improvements for high-impact issues.Inform and deliver new strategies and tactics to improve users' experience with Product Support.Influence innovation across Product Support and Product Operations to identify opportunities for simplicity and scalability.Help shape internal processes for the team through observation, suggestion and implementation.Contribute to the team's documentation library by writing and maintaining how-to troubleshooting guides, internal processes, and knowledge bites for stakeholders. Serve as a point of contact for regional stakeholders and Product squads for Feature RolloutsIdentify trends, exceptions, and connections between reported issues.Build strong relationships with local and regional stakeholders, acting as their primary point of contact for product knowledge, issue tracking and change management.Proactively communicate with relevant stakeholders, providing updates and seeking support from management when blocked to ensure timely execution.Understand all KPIs related to their area and suggest prioritization for new tasks that align with team goals.Familiar with agile software development and related tools; and ideally previous education in software engineering.Strong team player, with an ability to connect people and teams to our company vision.Hands-on attitude, capable of dealing with constant change and being able to get things done in a timely and effective manner A proactive mentality, a curious mindset and a desire to make an impact.Ability to think like a Product user and be invested in our users' needs.Excellent English skills, in both written and verbal communication. Nice to have:  Bachelor's degree or background in QA, development, product support or product managementPrevious education in software engineering Ability to work with databases to create meaningful insightsEnsuring you and all our Heroes are looked after, happy, and healthy is always on the menu. Because if youre in good shape, then were in good shape.Make the most of our hybrid working model and join the team for face-to-face connection and collaboration in our beautiful Berlin campus 2 days a weekWe offer 27 days holiday with an extra day on 2nd and 3rd year of serviceWe will support you in developing yourself and your career growth opportunities: 1.000  Educational Budget, Language Courses, Parental Support and access to the Udemy Business platform to explore a variety of online courses.Get moving and release those wonderful, mind-boosting endorphins: Health Checkups, Meditation, Gym &amp; Bicycle SubsidyCash. Dough. Cheddar. Whatever you call it, well help you with it: Employee Share Purchase Plan, Sabbatical Bank,  Public Transportation Ticket Discount, Life &amp; Accident Insurance, Corporate Pension PlanThe power of getting together over some food is unrivaled. Here are a few ways to help you do that. All the yum: Digital Meal Vouchers, Food Vouchers, Corporate Discounts. Courses. Ready to join our team? If youre excited to grow, collaborate and be part of the worlds leading delivery platform, wed love to hear from you. Apply today!We believe diversity and inclusion are key to creating not only an exciting product, but also an amazing customer and employee experience. Fostering this starts with hiring - therefore we do not discriminate on the basis of racial identities, religious beliefs, color, national origin, gender identities or expressions, sexual orientations, age, marital or disability statuses, or any other aspect that makes you, you. We encourage you to let us know if you need any accommodations or specific accessibility support to ensure a smooth interview experiencejust include it in your application. You're welcome to share your pronouns (he/she/they) right from the start so we can address you respectfully from our first contact."
3510006,"Staff Product Designer, Mid-size Partner’s segment - (Quick Commerce)","https://jobs.smartrecruiters.com/DeliveryHero/744000078761906-staff-product-designer-mid-size-partner-s-segment-quick-commerce-","Hero","Barcelona","No",7,"Full time","2025-09-01T02:11:20.622816Z","We're hiring a Staff Product Designer to join the Quick Commerce Global Services team, powering Delivery Hero - based in Glovo, Barcelona.YOUR MISSIONIn this role, youll be part of a central team within Delivery Heros Global Services unit, shaping solutions that serve our entire global ecosystem, and your work will drive impact across Delivery Heros regional brands worldwide. Youll be working with cross-functional teams to build scalable solutions that enhance customer experiences and operational excellence on a global scale. Its a unique opportunity to combine Glovos vibrant, fast-paced culture with the reach and complexity of one of the worlds largest local delivery platforms.Our Mid-size Partners segment vision is to empower our Quick Commerce partners with the best mobile solutions. By creating a seamless user experience, we help them effortlessly operate, fulfill orders, and scale their businesses across any of our brands.You will be involved in the full product development cycle, from brainstorming product innovations to conducting research and running usability testing sessions, to propose simple design solutions used by our Partners Worldwide.THE JOURNEYLead the design strategy to be in sync with the product strategy and vision by collaborating with cross-functional partners and senior stakeholders.Translate complex user and business needs into clear, user-centric design solutions that drive meaningful business outcomes.Drive the end-to-end product design process, from discovery and research to high-fidelity designs and implementation support.Deliver production-ready, high-quality Android mobile user experiences using Figma as your primary tool.Become the voice of the user, bringing their narrative to the forefront of any product discussions.Be responsible for promoting design solutions and best practices within your team and across the organization, inspiring creativity, and challenging established thinking.WHAT YOU WILL BRING TO THE RIDEYou have extensive experience as a Product Designer, with a strong portfolio showcasing a user-centric approach and a deep understanding of problem-solving. You bring a minimum of 7 years of professional experience, specifically in B2C products and Android mobile design, and are proficient with Figma's distributed version control tools.You demonstrate the ability to manage multiple workstreams and initiatives in a fast-paced environment, using operational expertise in prioritization and time management to navigate a complex segment.You have vast experience leading research initiatives and design discussions, and are comfortable advocating for your design proposals through clear narratives and data-driven insights.You possess excellent written and verbal communication skills in English. Spanish speaking is a huge plus.You have demonstrable experience collaborating effectively with peers, product managers, developers, and senior stakeholders to align on goals and deliver high-quality outcomes.You have experience in a role that requires leadership and mentorship, which is highly valued.Individuals representing diverse profiles, and abilities, encompassing various genders, ethnicities, and backgrounds, are less likely to apply for this role if they do not possess solid experience in 100% of these areas. Even if it seems you don't meet our musts don't let it stop you, we are all about finding the best talent out there! Skills can be learned, and embracing diversity is invaluable.We believe driven talent deserves: Monthly Glovo credits to satisfy your cravings! Discounted gym memberships to keep you energized. Extra time off, the freedom to work from home two days a week, and the opportunity to work from anywhere for up to three weeks a year! Enhanced parental leave, and office-based nursery. Online therapy and wellbeing benefits to ensure your mental well-being.Here at Glovo, we thrive on diversity, we believe it enhances our teams, products, and culture. We know that the best ideas come from a mashup of brilliant diverse minds. This is why we are committed to providing equal opportunities to talent from all backgrounds - all genders, racial/diverse backgrounds, abilities, ages, sexual orientations and all other unique characteristics that make you YOU. We will encourage you to bring your authentic self to work, fostering an inclusive environment where everyone feels heard. Feel free to note your pronouns in your application (e.g., she/her/hers, he/him/his, they/them/theirs, etc).So, ready to take the wheel and make this the ride of your life? Delve into our culture by taking a peek at our Instagram and check out our Linkedin and website!"
3510004,"Staff Product Designer, Mid-size Partner’s segment - (Quick Commerce)","https://jobs.smartrecruiters.com/DeliveryHero/744000078762565-staff-product-designer-mid-size-partner-s-segment-quick-commerce-","Hero","Barcelona","No",7,"Full time","2025-09-01T02:11:20.622831Z","We're hiring a Staff Product Designer to join the Quick Commerce Global Services team, powering Delivery Hero - based in Glovo, Barcelona.YOUR MISSIONIn this role, youll be part of a central team within Delivery Heros Global Services unit, shaping solutions that serve our entire global ecosystem, and your work will drive impact across Delivery Heros regional brands worldwide. Youll be working with cross-functional teams to build scalable solutions that enhance customer experiences and operational excellence on a global scale. Its a unique opportunity to combine Glovos vibrant, fast-paced culture with the reach and complexity of one of the worlds largest local delivery platforms.Our Mid-size Partners segment vision is to empower our Quick Commerce partners with the best mobile solutions. By creating a seamless user experience, we help them effortlessly operate, fulfill orders, and scale their businesses across any of our brands.You will be involved in the full product development cycle, from brainstorming product innovations to conducting research and running usability testing sessions, to propose simple design solutions used by our Partners Worldwide.THE JOURNEYLead the design strategy to be in sync with the product strategy and vision by collaborating with cross-functional partners and senior stakeholders.Translate complex user and business needs into clear, user-centric design solutions that drive meaningful business outcomes.Drive the end-to-end product design process, from discovery and research to high-fidelity designs and implementation support.Deliver production-ready, high-quality Android mobile user experiences using Figma as your primary tool.Become the voice of the user, bringing their narrative to the forefront of any product discussions.Be responsible for promoting design solutions and best practices within your team and across the organization, inspiring creativity, and challenging established thinking.WHAT YOU WILL BRING TO THE RIDEYou have extensive experience as a Product Designer, with a strong portfolio showcasing a user-centric approach and a deep understanding of problem-solving. You bring a minimum of 7 years of professional experience, specifically in B2C products and Android mobile design, and are proficient with Figma's distributed version control tools.You demonstrate the ability to manage multiple workstreams and initiatives in a fast-paced environment, using operational expertise in prioritization and time management to navigate a complex segment.You have vast experience leading research initiatives and design discussions, and are comfortable advocating for your design proposals through clear narratives and data-driven insights.You possess excellent written and verbal communication skills in English. Spanish speaking is a huge plus.You have demonstrable experience collaborating effectively with peers, product managers, developers, and senior stakeholders to align on goals and deliver high-quality outcomes.You have experience in a role that requires leadership and mentorship, which is highly valued.Individuals representing diverse profiles, and abilities, encompassing various genders, ethnicities, and backgrounds, are less likely to apply for this role if they do not possess solid experience in 100% of these areas. Even if it seems you don't meet our musts don't let it stop you, we are all about finding the best talent out there! Skills can be learned, and embracing diversity is invaluable.We believe driven talent deserves: Monthly Glovo credits to satisfy your cravings! Discounted gym memberships to keep you energized. Extra time off, the freedom to work from home two days a week, and the opportunity to work from anywhere for up to three weeks a year! Enhanced parental leave, and office-based nursery. Online therapy and wellbeing benefits to ensure your mental well-being.Here at Glovo, we thrive on diversity, we believe it enhances our teams, products, and culture. We know that the best ideas come from a mashup of brilliant diverse minds. This is why we are committed to providing equal opportunities to talent from all backgrounds - all genders, racial/diverse backgrounds, abilities, ages, sexual orientations and all other unique characteristics that make you YOU. We will encourage you to bring your authentic self to work, fostering an inclusive environment where everyone feels heard. Feel free to note your pronouns in your application (e.g., she/her/hers, he/him/his, they/them/theirs, etc).So, ready to take the wheel and make this the ride of your life? Delve into our culture by taking a peek at our Instagram and check out our Linkedin and website!We believe diversity and inclusion are key to creating not only an exciting product, but also an amazing customer and employee experience. Fostering this starts with hiring - therefore we do not discriminate on the basis of racial identities, religious beliefs, color, national origin, gender identities or expressions, sexual orientations, age, marital or disability statuses, or any other aspect that makes you, you. We encourage you to let us know if you need any accommodations or specific accessibility support to ensure a smooth interview experiencejust include it in your application. You're welcome to share your pronouns (he/she/they) right from the start so we can address you respectfully from our first contact."
