"ID","Title","Link","Company","Location","Remote","Experience","EmploymentType","DatePosted","RoleDescription"
3510002,"Account Executive","https://jobs.smartrecruiters.com/DeliveryHero/744000078774135-account-executive","Hero","Managua","No","Not specified","Full time","2025-09-01T02:11:20.622845Z","Tenemos una oportunidad para ti, estamos buscando Account Executive para sumarse al equipo en Nicaragua!

Como Account Executive desarrollars tu labor en nuestro equipo comercial de post venta con el objetivo principal de gestionar el mantenimiento de cuentas, potenciar, fidelizar, facturar y administrar las relaciones estratgicas y comerciales:Venta consultiva y administracin de promociones pagas por nuestros partners.Coordinacin de promociones y publicidad en la App con los Partners buscando su inversin en las diferentes verticales de PedidosYa.Verificar el correcto funcionamiento de la operativa de nuestros partners en el App.Mejorar la experiencia del usuario a travs del correcto entrenamiento de las herramientas disponibles en la App para nuestros comercios afiliados.Desarrollar y acordar condiciones comerciales y de facturacin.Analizar la inversin ptima para cada cliente en pos de maximizar el retorno de la misma.Anlisis de la performance de los partners para generar nuevos prospectos para negociaciones, logrando nuevos acuerdos comerciales.Experiencia comercial generando y gestionando carteras de clientes y cuentas.Perfil data driven. Experiencia o conocimientos de KPI s.Deseable conocimientos en Marketing y de manejo de indicadores de Marketing Digital (CPO, CPA, CPC, Ratios de Conversin).Dominio de Excel.Excelentes habilidades interpersonales, de comunicacin y trabajo en equipo.Capacidad de planificacin, organizacin y autonoma.Automvil propio para trabajar.Crear valor para un gran ecosistema de negocios, con foco en la persona usuaria, porque somos user centric.Jugar en equipo siempre.Moverte a la velocidad de tus ideas.Aprender, desarrollarte y reinventarte.Generar impacto positivo en las personas y el planeta.Trabajar en #ModoPeYa: nuestra manera de trabajar focalizada en la flexibilidad y orientada a lograr un buen balance dentro y fuera de la oficina.La diversidad de talento potencia nuestra Cooltura y nuestra organizacin. Jugamos en equipo en todo lo que hacemos, y lo que ms nos gusta de eso es que promovemos la creacin de equipos diversos e inclusivos que puedan aportar diferentes perspectivas a PedidosYa. Nuestras oportunidades laborales estn abiertas a todas las personas, independientemente de su identidad de gnero, orientacin sexual, origen tnico, religin, edad, discapacidad y/o otras caractersticas individuales.

En caso de necesitar algn ajuste razonable o accesibilidad particular para tener la entrevista, por favor no dejes de aclararlo en tu postulacin. Adems, sintete libre de indicarnos tus pronombres (l/ella/elle) desde el primer contacto. 

#CoolturaPeYa #LaDiversidadNosPotencia"
3510001,"People Operations Analyst","https://jobs.smartrecruiters.com/DeliveryHero/744000078809669-people-operations-analyst","Hero","Buenos Aires","No","Not specified","Full time","2025-09-01T02:11:20.622861Z","La misin del rol de People Ops es apoyar la optimizacin y simplificacin de los procesos operativos del rea de People mediante la estandarizacin, documentacin y mejora continua. El objetivo principal es minimizar la sobrecarga operativa, fomentando la centralizacin de procesos, la identificacin de dolores en comn y el desarrollo de soluciones que impulsen la eficiencia. De esta manera, se busca garantizar una mejor calidad de la informacin y experiencias nicas para los colaboradores, asegurando que los sistemas y herramientas implementados sean funcionales y faciliten el trabajo diario.Gestionar los procesos operativos que el equipo asuma con foco en el detalle, en el usuario y de punta a puntaCrear y mantener documentacin clara y actualizada para los procesos operativos del rea de People.Apoyar en la consolidacin de procesos comunes para reducir duplicidades y mejorar la eficiencia.Detectar puntos de dolor recurrentes en las operaciones y acompaar en la resolucin.Brindar soporte en el uso de sistemas, garantizando que se adapten a las necesidades diarias del negocio.Realizar auditorias recurrentes con el objetivo de asegurarse la Data Quality de PeYa.Estudiantes avanzados de Recursos Humanos, Ingeniera o Licenciatura en Sistemas, o carreras a fines.Slidos conocimientos del idioma inglsSer un plus contar con: experiencia gestionando sistemas de HRCrear valor para un gran ecosistema de negocio.Jugar en equipo, siempre: Pensar soluciones y construir colaborativamente, con buena energa.Moverte a la velocidad de tus ideas y emprender.Aprender, desarrollarte y reinventarte: Permitirte equivocarte, aprender haciendo, iterar y adaptarte a los cambios.Generar impacto positivo en las personas y el planeta.Trabajar de otra manera, en #ModoPeYa: no importa el tiempo ni el lugar desde donde trabajas, lo que importa es la agilidad con la que tomas decisiones, la flexibilidad para adaptarte y los resultados que alcanzas en equipo.La diversidad de talento potencia nuestra Cooltura y nuestra organizacin. Jugamos en equipo en todo lo que hacemos, y lo que ms nos gusta de eso es que promovemos la creacin de equipos diversos e inclusivos que puedan aportar diferentes perspectivas a PedidosYa. Nuestras oportunidades laborales estn abiertas a todas las personas, independientemente de su identidad de gnero, orientacin sexual, origen tnico, religin, edad, discapacidad y/o otras caractersticas individuales.

En caso de necesitar algn ajuste razonable o accesibilidad particular para tener la entrevista, por favor no dejes de aclararlo en tu postulacin. Adems, sintete libre de indicarnos tus pronombres (l/ella/elle) desde el primer contacto. 

#CoolturaPeYa #LaDiversidadNosPotencia"
3506090,"Data Engineer","https://jobs.smartrecruiters.com/DeliveryHero/744000078695234-data-engineer","Hero","Athens","Yes",4,"Full time","2025-09-01T02:11:20.622877Z","Are you passionate about leveraging data to drive informed decision-making and fuel business growth?  Do you have a knack for designing robust data infrastructure and optimizing data pipelines?  Lets talk! At efood we believe in the power of data as it is at the heart of everything we do in order to further expand and shape the online delivery landscape. Our Data team is working closely with our Product and Engineering teams, and they ensure the seamless flow of information that empowers our teams to make strategic decisions.  We are currently in search of a Data Engineer who will be responsible for designing, building and maintaining our data architecture and flows, and optimizing data warehouse and pipeline. In this role, you will be working with agile methodologies and your contributions will have immediate impact on the scalability, efficiency, and reliability of our data infrastructure, influencing day-to-day decisions at efood.  What youll do: Design, deploy and manage infrastructure components and systems of the data platformDesign and maintain data warehouse (data preparation, data warehousing, reporting, analytics &amp; data exploration and information delivery)Support and maintain the data foundation that the reporting layer and dashboards rely onBuild, maintain, and deploy data products for analytics and data science teams on cloud platformsPrepare high-level ETL mapping specificationsDevelop complex code data scripts (usually in Python or  SQL) to extract and manipulate data from multiple sources.Act across all development levels - from data acquisition and manipulations to the solution deployment and ongoing supportEnsure data accuracy, integrity, privacy, security and complianceResolve end user reporting problems through collaboration with stakeholdersTroubleshoot technical issues and provide administrative support for the Business Intelligence toolbox
Life @efood: At efood, no day is the same as the day before!efooders know that working and having a good time aren't the opposite and thats why every day at efood is a new adventure!We always aim higher and we thrive in finding solutions to push our limits further! We care about our customers, our employees, and our society.We seize every opportunity to celebrate achievements and milestones, but we also celebrate small things (like Fridays!)Every efooder is part of a fast-growing multinational company, with endless opportunities for professional growth and acquisition of new skills! We have an established, yet super creative and fun working environment, with talented and ambitious people whose ultimate goal is to maintain efood as the ideal workplace!University/Bachelors Degree in Computer ScienceAt least 4 years experience in a relevant positionUnderstanding and implementation experience with both relational and data warehousing modelsStrong knowledge of data analysis, data transformation, conceptual data modeling, meta-data management, data mart schemas for optimal performance of business intelligence solutionsStrong programming experience with Python Advanced SQL skillsExperience with at least one cloud provider (Google Cloud, AWS, Azure)Experience with docker and container orchestration technologies (Kubernetes)Experience with workflow scheduling tools (e.g. Apache Airflow, Argo workflows, Dagster, Luigi)Analytical acumen with a strong sense of urgency and ownership in your workExcellent communication and collaboration skills Proven ability to work independently and as part of multidisciplinary teamProficiency in Greek and English (verbal and written)
 Nice to have:Experience with Columnar Databases (e.g. BigQuery, Redshift)Experience with Infrastructure as Code tooling (e.g. Terraform)Experience with Git and implementation of CI/CD pipelinesFamiliarity in working with REST APIsBasic knowledge of analytics conceptsIf you are happy, we are happy! Thats why we offer an attractive remuneration package for what you bring in!We share a passion for food, so you will certainly appreciate the ticket restaurant card  to spend in restaurants and/or food supplies. We are efooders after all!We take care of you with Private Medical &amp; Life Insurance from day #1 to keep you healthy and happy!We prioritize your mental health  and offer round-the-clock access to an online mental health platform. You can schedule unlimited therapy sessions with certified psychologists and coaching sessions with experienced coaches.We want you to grow with us! And to help you keep improving, we provide you access to our online training platform where you can study  topics for your personal and professional growth!Are you a cappuccino lover ? Do you desperately want a cookie? Our cafeteria got you covered!If you want to stay in shape , our in-house gym awaits you fully equipped!We are passionate about exploring, growing &amp; learning and our Global Mobility plan is created to help our people find their purpose  around the world !Saving for the future? Weve got your back! Our Pension Plan helps you invest in tomorrow while you enjoy today!efood collects and processes personal data in accordance with applicable data protection laws. If you are a European Job Applicant see the privacy notice for further details."
3506089,"Corporate Account Manager","https://jobs.smartrecruiters.com/DeliveryHero/744000078526430-corporate-account-manager","Hero","Taguig","No",2,"Full time","2025-09-01T02:11:20.622902Z","Develop strategic business partnerships with existing customers to be in line with department's direction and customer strategy to deliver business objectivesCultivate relationships and manage new and recurring clients - youll do what it takes to keep them happy and upsell their business either by adding more users or activating existing user baseProactively coordinate with cross functions on customer projects: i.e. marketing &amp; retention campaign development, etc. Develop the overall strategy for revenue growth through cross-functional collaboration; e.g. top line growth through increasing the Gross Merchandise Value output from Key Corporate CustomersEnsure effectiveness of monthly campaign and ROI for every promotions/ activities implemented in responsible account(s) and timely customer payment  Regular business review and analysis internally and externally to identify gaps and opportunitiesImplementing new business strategies to expand existing customer base and to secure targets by searching and screening for new customers such as corporate projects etc.Provide quality follow up with customer inquiries, pre-sales to post-sales service and technical support to customers to maintain relationships with all potential and existing clients.Generate new ideas and implement right tactics for Account GrowthAchieve the set target by focusing on the development of Active Users and Active Corporates Bachelor degree or higher in any relating field
 2-3 years experience within a client/account management role preferable -
B2B account management experience would be an advantage
 Direct knowledge of key account management or sales skills is advantageous
 Excellent analytical and presentational skills
 Experience managing large account portfolios
 Strong analytical skills, makes well-judged decisions, good numeracy, pays
strong attention to detail, is a strong problem solver, demonstrates good
commercial awareness and thinks outside the box to generate new ideas
 Good command of English
 Having a good negotiation skills and budget management experience"
3506088,"Specialist, Strategic Account Management","https://jobs.smartrecruiters.com/DeliveryHero/744000078635583-specialist-strategic-account-management","Hero","Dhaka","No",3,"Full time","2025-09-01T02:11:20.622926Z","Responsibilities:Operating as the lead point of contact for any and all matters specific to VendorsBuilding and maintaining strong, long-lasting relationship with vendors, acting as the primary point of contact for all business metrics.Develop and implement strategies for vendors growth and retention.Overseeing customer account management, including negotiating contracts and identify opportunities to maximize revenue.Tracking key performance indicators (KPIs) and analyzing data to assess account performance, identifying areas for improvement, and implementing strategies to drive revenue growth and operational efficiency.Expand the relationships with existing customers by continuously proposing solutions that meet their objectives. Experience of 3 to 4 year(s) in relevant fieldThe applicants should have experience in the following area(s):Key Account, Relationship Management, Corporate Sales,Marketing, TelemarketingCreative problem-solving, effective communication and strong interpersonal skillsEnjoy working in a vibrant and fast-paced environmentAble to commence work immediately or within short noticeAbility to communicate and manage at all level.An extra steep learning curve.A dynamic and challenging work environment.A company committed to developing you personally and professionally.A vibrant and international team committed to diversity and inclusion.Regular company and team events.Responsibility from day one in a fast-growing and global company.Other benefits include health insurance and learning and development opportunities!"
3506087,"Specialist, Strategic Account Management","https://jobs.smartrecruiters.com/DeliveryHero/744000078638692-specialist-strategic-account-management","Hero","Dhaka","No",3,"Full time","2025-09-01T02:11:20.622950Z","Operating as the lead point of contact for any and all matters specific to VendorsBuilding and maintaining strong, long-lasting relationship with vendors, acting as the primary point of contact for all business metrics.Develop and implement strategies for vendors growth and retention.Overseeing customer account management, including negotiating contracts and identify opportunities to maximize revenue.Tracking key performance indicators (KPIs) and analyzing data to assess account performance, identifying areas for improvement, and implementing strategies to drive revenue growth and operational efficiency.Expand the relationships with existing customers by continuously proposing solutions that meet their objectives.
 Experience of 3 to 4 year(s) in relevant fieldThe applicants should have experience in the following area(s):Key Account, Relationship Management, Corporate Sales, Marketing, TelemarketingCreative problem-solving, effective communication and strong interpersonal skillsEnjoy working in a vibrant and fast-paced environmentAbility to communicate and manage effectively at all levels."
3506086,"Specialist Kitchens Growth","https://jobs.smartrecruiters.com/DeliveryHero/744000078651142-specialist-kitchens-growth","Hero","Dubai","No",2,"Full time","2025-09-01T02:11:20.622976Z","As a Growth Specialist, you will support the commercial success of partner brands across our kitchen network. Your role will focus on analyzing performance, identifying growth opportunities, and executing initiatives that drive sales, order frequency, and customer retention. Youll collaborate closely with internal teams and external partners to deliver measurable business impact.Account Support: Manage a portfolio of partner accounts, acting as a key point of contact to support their growth.Performance Monitoring: Track and analyze partner performance data to uncover trends, opportunities, and risks.Growth Initiatives: Assist in planning and executing initiatives such as menu optimization, promotions, upselling strategies, and operational improvements.Cross-Functional Collaboration: Work closely with marketing, operations, and product teams to ensure smooth rollout and impact of growth plans.Insights &amp; Reporting: Prepare regular reports and share actionable insights with both internal stakeholders and partners.Partner Communication: Maintain strong, professional relationships with partners by providing proactive support and recommendations.Bachelors degree in Business, Marketing, Economics, or a related field.At least 2 years of experience in account management, growth, consulting, or similar performance-driven roles, and experienced handling a large volume of accounts (over 90+).Previous experience within industries such as F&amp;B, food tech, e-commerce platforms, or marketing agencies is highly desirable.Strong communications skills in Arabic (mandatory).Strong analytical and problem-solving skills; proficiency in Excel and data visualization tools.Ability to manage multiple projects with strong attention to detail."
3506085,"Praktikant (w/m/d) Content Operations – Retail Onboarding (ab 25-38,5 Wochenstunden)","https://jobs.smartrecruiters.com/DeliveryHero/744000078654257-praktikant-w-m-d-content-operations-retail-onboarding-ab-25-38-5-wochenstunden-","Hero","Vienna","No","Not specified","Internship","2025-09-01T02:11:20.622999Z","Die Foodora Austria GmbH ist Teil des Delivery Hero Netzwerkes, einer der grten globalen Essensbestellplattformen. Unser international agierendes Team ist bereits in mehr als 50 Lndern ttig. Foodora bietet seinen mehr als 150 Mitarbeiter*innen die Dynamik und das Entwicklungspotenzial eines Startups, gleichzeitig wird Rckhalt und Frderung durch die Unternehmensgruppe und das lokale Management gesichert.Unser Team ist aufrichtig und ehrgeizig - gleichzeitig ist Spa ein wichtiger Aspekt unseres Arbeitsalltags. Wir suchen motivierte und enthusiastische Teammitglieder, die uns auf unserer Mission begleiten. Auf die ideale Person, die vor allem durch eine innovative Denkweise und eine stark ausgeprgte Hands-on-Mentalitt berzeugt, wartet ein aufregendes Praktikum in Wien.Wir suchen dich alsPraktikant (w/m/d) Content Operations  Retail Onboarding (ab 25-38,5 Wochenstunden)Das erwartet dich:Du untersttzt unser Team aktiv dabei, den Onboarding-Prozess fr unsere Retail-Partner erfolgreich abzuschlieen.Dabei hilfst du bei der Erstellung der Online-Shops und der Listung der Sortimente. Zudem nimmst du Kontakt zu Partnern per Telefon oder E-Mail auf, um fehlende Informationen anzufordern und sicherzustellen, dass alle Unterlagen vollstndig vorliegen.Whrend deines Praktikums erhltst du wertvolle Einblicke in unsere Arbeitsprozesse und sammelst praktische Erfahrungen in einem dynamischen Umfeld. Das bieten wir dir:Ein Praktikum (ca. 2-3 Monate, ab 25 Wochenstunden) in einem erfolgreichen, schnell wachsenden internationalen Unternehmen  mit der Mglichkeit, wertvolle Einblicke zu gewinnen.Gelebte Kollegialitt sowie ein motiviertes Team, von dem du lernen und dich inspirieren lassen kannst.Ein groes Paket an Benefits, darunter u.a. regelmige Teamevents, foodora meal allowance, flexible Arbeitszeiten und vieles mehr.Auf Basis einer Vollzeitbeschftigung (38,5 Wochenstunden) bieten wir ein monatliches Bruttogehalt ab EUR 2.000,- in Abhngigkeit von deiner Erfahrung.Schnelle Auffassungsgabe und gutes Zeitmanagement.Eigenstndige Arbeitsweise sowie Teamfhigkeit.Sorgfltige und detailorientierte Arbeitsweise.Lsungsorientiertes Denken und technisches VerstndnisGute Deutschkenntnisse sowie Englischkenntnisse.Kenntnisse in Office AnwendungenWir bei Delivery Hero glauben daran, dass Vielfalt der Schlssel ist, nicht nur ein aufregendes Produkt, sondern auch eine berragende Kunden- und Mitarbeiter*innenerfahrung zu schaffen. Dies zu frdern beginnt mit der Einstellung - deshalb diskriminieren wir nicht aufgrund von Religion, Hautfarbe, Herkunft, Geschlecht, sexueller Orientierung, Alter, Familienstand oder anderen Aspekten, die dich zu dem machen, was du bist. Studien haben gezeigt, dass insbesondere Frauen und andere Randgruppen sich seltener auf Stellen bewerben, wenn sie nicht alle Qualifikationen erfllen. Bist du an dieser Stelle interessiert und bringst bereits einen Groteil der von uns gesuchten Qualifikationen mit? Dann zgere nicht, dich trotzdem zu bewerben!Wir haben dein Interesse geweckt?Dann bewirb dich jetzt mit deinen Unterlagen unter Angabe deiner Gehaltsvorstellungen und deines mglichen Starttermins."
3506084,"Account Manager","https://jobs.smartrecruiters.com/DeliveryHero/744000078658281-account-manager","Hero","Maadi","No",3,"Contract","2025-09-01T02:11:20.623015Z","About the roleAt Talabat, the role of the Account Manager will play a key role in managing and nurturing successful relationships with our partner restaurants. You will be responsible for ensuring the success and satisfaction of our partner restaurants through driving growth, operations, and content for your assigned portfolio.Key ResponsibilitiesBuild and maintain strong relationships with restaurant partners, understanding their needs and ensuring their expectations are met.Ensure menu quality index, price parity, vendor funded deals, and drive affordabilityBuilding new commercial relationships by renewing the existing contacts through offerrenegotiating, preferred partnerships, and upselling to new profitability leversOwn full performance of your portfolio, from sales performance, to in-store operations, tomarketing and growth strategies, and providing every-day supportMaintain a regular cadence of in-person meetings with all your partners in your assigned portfolio. Provide excellent and proactive reporting to partners on performance. Negotiate and acquire restaurants on different ads products to help boost their growth. Ensure daily, weekly, and month targets are on track and with your team lead to ensure constant portfolio growth.Maintain granular reporting on your portfolios performance. Upselling new services to our existing restaurants such as logistics as a service, tPro, and various loyalty programsAutomate and digitalize vendor experience by pushing for vendor portal adoption, self service and self booking through talabat vendor dashboard What did we order? Have a passion for sales 3-4  years of experience, ideally in sales, account management, or related experience. You excel in a transactional deal cycleHigh level of ownership and dedication. You show creative sales tactics to engage with the prospect"
