"ID","Title","Link","Company","Location","Remote","Experience","EmploymentType","DatePosted","RoleDescription"
3128767,"Automotive General Service Technician","https://jobs.smartrecruiters.com/MonroInc/744000065613667-automotive-general-service-technician","monro","Louisville","No","Not specified","Full time","2025-06-19T02:05:18.371325Z","The Lube and Tire Technician at Monro or General Service Tech as we call it, is an entry level Automotive Technician position and a great way to start your career at Monro.  Starting day 1 you will begin a comprehensive mechanic training program, covering all aspects of your new role. As a General Service Technician, you will be an essential team member, performing maintenance services on Guest vehicles. More importantly, you will be part of a team working together to deliver 5 Star Guest experiences, while using your technician skills to take care of people, their cars and ensure our guests have safe, reliable transportation. Pay is based on experience plus, incentives (if applicable) Responsibilities Mechanic duties include changing, mounting, and installing tires Wheel removal, tire repair and balance, tire patch/plug repairs  Quick lube type duties such as lubrication and oil change Inspect and rotate tires   Basic automotive maintenance work such as battery installation  We will train you to do alignments, brake services, and scheduled maintenance services  Compensation: The hourly range for this role is $15.00 - $19.00. This role is eligible for additional compensation and incentives. Pay will be determined based on experience level.Minimum Qualifications   HS diploma or GED equivalent  Automotive experience  Own basic set of Mechanics tools or participate in tool purchase program  Valid Driver license Must be at least 18 years of agePositive attitude and a collaborative mindset  Ability to work with hands overhead, stand for long periods and lift 50 lbs  Preferred Qualifications  Automotive Technician or Lube and Tire experience  Benefits Health InsuranceDental Insurance401K Retirement Plan with Company MatchPaid vacationPaid HolidaysEmployee DiscountsCareer developmentYour next Destination!Growth Opportunity: At Monro were committed to helping our teammates grow their career through the combination of coursework, demonstrating leadership skills and open opportunities. Our teammates receive on-the-job training, company sponsored certifications, as well as course curriculum in Monro University that empowers them to advance to the next level of their careers.Monro, Inc. is an equal opportunity employer and affords equal opportunity to all applicants for all positions without regard to race, color, religion, sex, national origin, disability status, protected veteran status, or any other characteristic protected by law."
3128766,"Automotive General Service Technician","https://jobs.smartrecruiters.com/MonroInc/744000065621975-automotive-general-service-technician","monro","Elizabeth","No","Not specified","Full time","2025-06-19T02:05:18.371442Z","The Lube and Tire Technician at Monro or General Service Tech as we call it, is an entry level Automotive Technician position and a great way to start your career at Monro.  Starting day 1 you will begin a comprehensive mechanic training program, covering all aspects of your new role. As a General Service Technician, you will be an essential team member, performing maintenance services on Guest vehicles. More importantly, you will be part of a team working together to deliver 5 Star Guest experiences, while using your technician skills to take care of people, their cars and ensure our guests have safe, reliable transportation. Pay is based on experience plus, incentives (if applicable) Responsibilities Mechanic duties include changing, mounting, and installing tires Wheel removal, tire repair and balance, tire patch/plug repairs  Quick lube type duties such as lubrication and oil change Inspect and rotate tires   Basic automotive maintenance work such as battery installation  We will train you to do alignments, brake services, and scheduled maintenance services  Compensation: The hourly range for this role is $15.50 - $18.00 This role is eligible for additional compensation and incentives. Pay will be determined based on experience level.Minimum Qualifications   HS diploma or GED equivalent  Automotive experience  Own basic set of Mechanics tools or participate in tool purchase program  Valid Driver license Must be at least 18 years of agePositive attitude and a collaborative mindset  Ability to work with hands overhead, stand for long periods and lift 50 lbs  Preferred Qualifications  Automotive Technician or Lube and Tire experience  Benefits Health InsuranceDental Insurance401K Retirement Plan with Company MatchPaid vacationPaid HolidaysEmployee DiscountsCareer developmentYour next Destination!Growth Opportunity: At Monro were committed to helping our teammates grow their career through the combination of coursework, demonstrating leadership skills and open opportunities. Our teammates receive on-the-job training, company sponsored certifications, as well as course curriculum in Monro University that empowers them to advance to the next level of their careers.Monro, Inc. is an equal opportunity employer and affords equal opportunity to all applicants for all positions without regard to race, color, religion, sex, national origin, disability status, protected veteran status, or any other characteristic protected by law."
3128765,"Automotive Technician","https://jobs.smartrecruiters.com/MonroInc/744000065622265-automotive-technician","monro","Shepherdsville","No","Not specified","Full time","2025-06-19T02:05:18.371475Z","About the Role:   The Technician role is full time or part-time and is an hourly position based on needs of the business. The Technician is primarily responsible for conducting basic vehicle diagnostics and performing routine vehicle repair and maintenance services in accordance with company standards and manufacturer specifications.  This position is expected to deliver exceptional 5 Star service to our guests, through effective communication of vehicle issues and proposed solutions, as well as consistently meeting guest expectations for time commitments and quality.     Responsibilities:   Perform basic vehicle diagnostics to properly identify required repairs.  Consistently complete Monros Courtesy Inspection process, on every guest vehicle, identifying, documenting, and communicating additional needed services and repairs; Audit courtesy inspections performed by the General Service Technicians   Assist in inventory management to include pulling tires and parts, unloading and stocking inventory. Assist with all general store duties, ensuring the store is in excellent condition and maintained to Monro standards for cleanliness and consistently in guest ready condition.  Consistently perform service(s) in accordance with Monros safety standards including but not limited to Monros Wheel Torque, Oil safety and compliance procedures  Test drive vehicles in accordance with Monros Road Test policy, including consistently utilizing our dedicated test drive routes, while maintaining all local traffic and safety laws  Understand and adhere to company policies and procedures, Governmental standards including environmental codes and ANSI/OSHA standards. Consistent use of all required safety standards set forth in training and policies and procedures.   Maintain technical knowledge and capabilities to ensure proficiency through the timely completion of all required Monro University training courses and modules.  Operate, utilize, and maintain all equipment in a safe manner in accordance with Monro and equipment manufacturer guidelines including but not limited to lifts, welders, brake lathes, etc.  Perform other duties as assigned and required.    Profile Summary:  Capable of performing basic automotive maintenance, repair, and tire services  Ability to diagnose problems identifying root cause and determine appropriate repair solution.   Ability to interpret and execute instructions furnished in written, oral, and diagram formats  Strong customer service skills  Strong verbal and written communication skills with the ability to convey technical issues and write routine reports.       Work Environment &amp; Physical Requirements:   This job operates in an automotive shop environment.  The job will have exposure to a moderate noise level, adverse weather conditions, chemicals, odors, dirt, and dust. Technicians must be able to complete the following but not limited to:  Ability to work flexible hours, days, evenings, weekends, and holidays.  Must be able to see, hear, lift, carry and stock merchandise and supplies up to 75 lbs. without assistance.  Frequent standing and walking for long periods of time.  Frequent reaching overhead and below the knees, including squatting, bending, stooping, kneeling, twisting.    This summary is not an all-inclusive description of job duties. Other job duties and responsibilities may also be assigned by the incumbents supervisor at any time based upon the Companys needs.      Compensation for this position is $20.00 per hour/$35.00 per hour flat rate based on experience.Qualifications:   High School Diploma or equivalent.   Automotive training including basic car maintenance and repair or the equivalent combination of education and experience.   ASE certification and State Inspection license (where applicable) preferred.  Must possess a current valid drivers license and have a satisfactory Motor Vehicle Report (MVR)  Required to own a basic set of tools or participate in Monros tool purchase program.  Benefits:   Performance based incentives   Paid vacation and holidays for Full-Time Teammates Reimbursement for ASE Certifications   Reimbursement for State Inspection Licenses, where applicable   401k eligibility immediately upon hire Direct Deposit Employee Discounts Healthcare, Vision, and Dental for Full time teammates   Employee Access Perks Career Advancement Opportunities  Your next Destination!Growth Opportunity: At Monro were committed to helping our teammates grow their career through the combination of coursework, demonstrating leadership skills and open opportunities. Our teammates receive on-the-job training, company sponsored certifications, as well as course curriculum in Monro University that empowers them to advance to the next level of their careers.Monro, Inc. is an equal opportunity employer and affords equal opportunity to all applicants for all positions without regard to race, color, religion, sex, national origin, disability status, protected veteran status, or any other characteristic protected by law."
3128764,"Assistant Automotive Store Manager","https://jobs.smartrecruiters.com/MonroInc/744000065621147-assistant-automotive-store-manager","monro","Louisville","No",2,"Full time","2025-06-19T02:05:18.371519Z","ASSISTANT AUTOMOTIVE STORE MANAGERThe Assistant Manager role is a full-time position and is hourly based upon needs of the business. The Assistant Manager is a key holder for the store and serves as the manager on duty (MOD) in the absence of the Store Manager, or when demand requires it. The Assistant Manager is responsible for assisting in managing the operations of an automotive retail service and repair store to meet or exceed service standards and to achieve Monros performance and profitability goals.  This position is expected to ensure that all teammates deliver exceptional 5 Star service to our guests, through effective communication of vehicle issues and proposed solutions, as well as consistently meeting guest expectations for time commitments and quality.        Responsibilities:   Schedule guest appointments for the most effective optimization of technician abilities in the efficient and timely completion of vehicle services/repairs   Help achieve Monros sales goals by properly informing and recommending tire and service products and sales promotions.  Attend to all guest needs in areas of sales, service, complaints, and adjustments.  Build guest relationships to maximize customer satisfaction, loyalty, and retention.  Assist technicians in conveying repair and service needs to guests.  Ensure the store is in excellent condition and maintained to Monro standards for cleanliness and consistently in guest ready condition. Assist with inventory management to include the oversight of pulling of tires and parts, unloading and stocking inventory.  Provide direction and oversight to other technicians and assist where needed with services/repairs.  Assist in organizing the stores workflow to ensure that technician skill levels are utilized efficiently for completing vehicle services/repairs effectively and timely in accordance with Monro standards of operation.  Understand and adhere to company policies and procedures, Governmental standards including environmental codes and ANSI/OSHA standards. Consistent use of all required safety standards set forth in training and policies and procedures.   Perform Store Manager functions as business needs dictate.  Perform other duties as assigned and required by direct supervisor.Pay range $17- $21 Based on Experience Minimum Qualifications High school or GED equivalent.2+ years of automotive and sales experienceValid Driver LicenseAbility to work with hands overhead, stand for long periods and lift 50 lbs.Excellent communication skills and basic algebra to calculate figures and amounts such as discounts, interest, commissions proportions, and percentages.Guest and team focused mindsetMonro conducts criminal background checks for those positions with security and/or financial responsibilities.  All background checks are conducted in accordance with applicable federal, state and local law, including but not limited to the Fair Credit Reporting Act.  No applicant will be automatically disqualified because of a criminal record.  Rather, the Company will consider the nature of the crime(s), when it occurred, the applicants explanation, and the relationship to the position sought in making its determination.  Preferred Qualifications ASE Automotive CertificationsProven Automotive or Automotive Quick Lube sales experienceLeadership experienceBenefits:   Performance based incentives   Paid vacation and holidays for Full-Time Teammates Reimbursement for ASE Certifications   Reimbursement for State Inspection Licenses, where applicable   401k eligibility immediately upon hire Direct Deposit Employee Discounts Healthcare, Vision, and Dental for Full time teammates   Employee Access Perks Career Advancement Opportunities    Your next Destination!Growth Opportunity: At Monro were committed to helping our teammates grow their career through the combination of coursework, demonstrating leadership skills and open opportunities. Our teammates receive on-the-job training, company sponsored certifications, as well as course curriculum in Monro University that empowers them to advance to the next level of their careers.Monro, Inc. is an equal opportunity employer and affords equal opportunity to all applicants for all positions without regard to race, color, religion, sex, national origin, disability status, protected veteran status, or any other characteristic protected by law."
3128759,"Automotive Technician","https://jobs.smartrecruiters.com/MonroInc/744000065617182-automotive-technician","monro","Louisville","No",3,"Full time","2025-06-19T02:05:18.371546Z","Responsible for the efficient, diagnosis, repair and maintenance of Guests vehicles, the Automotive Technician position is a great way to start your career at Monro.  Starting day 1 you will begin a comprehensive Technician training program, covering all aspects of your new role, while preparing you for the next. As an Automotive Technician for Monro, you will be an essential team member, performing repair services on Guest vehicles. More importantly, you will be part of a team working together to deliver 5 Star Guest experiences, while using your Technician skills to take care of people, their cars and ensure our guests have safe, reliable transportation. Compensation:  The hourly guaranteed range for this role is from $16 - $20 per hour. This role is eligible for additional compensation and incentives.  Flat Rate range $20 - $40 hour flagged, Pay will be based on experience level.  Responsibilities  Perform brakes, suspension, tire installation, scheduled maintenance, and all manner of automotive repairs and maintenance, that you are qualified to perform Secure our guests approval to perform the work as a result of the diagnosis; and always maintain a clean, neat work area Complete thorough automotive vehicle inspections on every vehicle you service and perform any repairs and maintenance  Test drive guest vehicles and use our shop truck in a safe manner to pick up inventory as needed Collaborate with teammates and provide leadership to General Service Technicians   Minimum Qualifications  High school or GED equivalent. 3+ years of automotive technician experience Valid Driver License Own a basic set of automotive tools or participate in tool purchase program. Ability to work with hands overhead, stand for long periods and lift 50 lbs.  Guest and team focused mindset  Have and maintain an Automotive Technician State Inspectors license, where applicable. Preferred Qualifications  ASE automotive certification in at least one of A1-A8  Automotive Technician State Inspector License Automotive technical school certificate/degree Benefits Health InsuranceDental Insurance401K Retirement Plan with Company MatchPaid vacationPaid HolidaysEmployee DiscountsCareer developmentYour next Destination!Growth Opportunity: At Monro were committed to helping our teammates grow their career through the combination of coursework, demonstrating leadership skills and open opportunities. Our teammates receive on-the-job training, company sponsored certifications, as well as course curriculum in Monro University that empowers them to advance to the next level of their careers.Monro, Inc. is an equal opportunity employer and affords equal opportunity to all applicants for all positions without regard to race, color, religion, sex, national origin, disability status, protected veteran status, or any other characteristic protected by law."
3128757,"Automotive Technician","https://jobs.smartrecruiters.com/MonroInc/744000065621050-automotive-technician","monro","Louisville","No",3,"Full time","2025-06-19T02:05:18.371579Z","Responsible for the efficient, diagnosis, repair and maintenance of Guests vehicles, the Automotive Technician position is a great way to start your career at Monro.  Starting day 1 you will begin a comprehensive Technician training program, covering all aspects of your new role, while preparing you for the next. As an Automotive Technician for Monro, you will be an essential team member, performing repair services on Guest vehicles. More importantly, you will be part of a team working together to deliver 5 Star Guest experiences, while using your Technician skills to take care of people, their cars and ensure our guests have safe, reliable transportation. Compensation:  The hourly guaranteed range for this role is from $12 - $20  per hour. This role is eligible for additional compensation and incentives.  Flat Rate range $20 - $40 hour flagged, Pay will be based on experience level.  Responsibilities  Perform brakes, suspension, tire installation, scheduled maintenance, and all manner of automotive repairs and maintenance, that you are qualified to perform Secure our guests approval to perform the work as a result of the diagnosis; and always maintain a clean, neat work area Complete thorough automotive vehicle inspections on every vehicle you service and perform any repairs and maintenance  Test drive guest vehicles and use our shop truck in a safe manner to pick up inventory as needed Collaborate with teammates and provide leadership to General Service Technicians   Minimum Qualifications  High school or GED equivalent. 3+ years of automotive technician experience Valid Driver License Own a basic set of automotive tools or participate in tool purchase program. Ability to work with hands overhead, stand for long periods and lift 50 lbs.  Guest and team focused mindset  Have and maintain an Automotive Technician State Inspectors license, where applicable. Preferred Qualifications  ASE automotive certification in at least one of A1-A8  Automotive Technician State Inspector License Automotive technical school certificate/degree Benefits Health InsuranceDental Insurance401K Retirement Plan with Company MatchPaid vacationPaid HolidaysEmployee DiscountsCareer developmentYour next Destination!Growth Opportunity: At Monro were committed to helping our teammates grow their career through the combination of coursework, demonstrating leadership skills and open opportunities. Our teammates receive on-the-job training, company sponsored certifications, as well as course curriculum in Monro University that empowers them to advance to the next level of their careers.Monro, Inc. is an equal opportunity employer and affords equal opportunity to all applicants for all positions without regard to race, color, religion, sex, national origin, disability status, protected veteran status, or any other characteristic protected by law."
3128752,"Automotive Mechanic/Technician","https://jobs.smartrecruiters.com/MonroInc/744000065719275-automotive-mechanic-technician","monro","Lewes","No",2,"Full time","2025-06-19T02:05:18.371613Z","Automotive Mechanic/TechnicianPay: $16-$18 hourly, with flat rate of $25 - $33 per hour. Pay is based on experience and certifications.  Responsible for the efficient, diagnosis, repair and maintenance of Guests vehicles, the Automotive Technician position is a great way to start your career at Monro.  Starting day 1 you will begin a comprehensive Technician training program, covering all aspects of your new role, while preparing you for the next. As an Automotive Technician for Monro, you will be an essential team member, performing repair services on Guest vehicles. More importantly, you will be part of a team working together to deliver 5 Star Guest experiences, while using your skills to take care of people, their cars and ensure our guests have safe, reliable transportation.Responsibilities Perform brakes, suspension, tire installation, scheduled maintenance, diagnostics, and all manner of automotive repairs and maintenance, that you are qualified to performSecure our guests approval to perform the work as a result of the diagnosis; and always maintain a clean, neat work areaComplete thorough automotive vehicle inspections on every vehicle you service and perform any repairs and maintenanceTest drive guest vehicles and use our shop truck in a safe manner to pick up inventory as neededCollaborate with teammates and provide leadership to General Service Technicians  Minimum Qualifications 2+ years of automotive technician experienceValid Driver LicenseOwn a basic set of automotive tools or participate in tool purchase program.Ability to work with hands overhead, stand for long periods and lift 50 lbs.Guest and team focused mindsetHave and maintain an Automotive Technician State Inspectors license, where applicable.Preferred Qualifications ASE automotive certification in at least one of A1-A8 Automotive Technician State Inspector LicenseAutomotive technical school certificate/degreeBenefits Performance based incentives   Paid vacation and holidays for Full-Time Teammates Reimbursement for ASE Certifications   Reimbursement for State Inspection Licenses, where applicable   401k eligibility immediately upon hire Direct Deposit Employee Discounts Healthcare, Vision, and Dental for Full time teammates   Employee Access Perks Career Advancement Opportunities  INDR6Your next Destination!Growth Opportunity: At Monro were committed to helping our teammates grow their career through the combination of coursework, demonstrating leadership skills and open opportunities. Our teammates receive on-the-job training, company sponsored certifications, as well as course curriculum in Monro University that empowers them to advance to the next level of their careers.Monro, Inc. is an equal opportunity employer and affords equal opportunity to all applicants for all positions without regard to race, color, religion, sex, national origin, disability status, protected veteran status, or any other characteristic protected by law."
