"ID","Title","Link","Company","Location","Remote","Experience","EmploymentType","DatePosted","RoleDescription"
2904634,"PA STATE AND EMISSIONS INSPECTOR - AUTOMOTIVE TECHNICIAN","https://jobs.smartrecruiters.com/MonroInc/744000057880356-pa-state-and-emissions-inspector-automotive-technician","monro","Robinson Township","No",2,"Full time","2025-05-09T02:00:01.418042Z","We offer HOURLY positions, ranging from $15 - $20 per hour based on experience and abilities.   More Experienced, Licensed and Certified Technicians can earn from $20+ - $35+ per hour on our Flat Rate plan based on experience, abilities and production.    Our Technician's are responsible for High Quality and Efficient diagnosis, repair and maintenance of our Guests vehicles.  The Automotive Technician position is a great way to start your career at Monro.  Starting day 1 you will begin a comprehensive Technician training program, covering all aspects of your new role, while preparing you for the next. As an Automotive Technician for Monro, you will be an essential team member, performing repair services on Guest vehicles. More importantly, you will be part of a team working together to deliver 5 Star Guest experiences, while using your Automotive Technician skills to take care of our guests, their vehicle's and ensure our guests have safe, reliable transportation.  This role is eligible for additional compensation and incentives.  Pay will be based on experience level. Responsibilities Perform brakes, suspension, tire installation, scheduled maintenance, and all manner of automotive repairs and maintenance, that you are qualified to performSecure our guests approval to perform the work as a result of the diagnosis; and always maintain a clean, neat work areaComplete thorough automotive vehicle inspections on every vehicle you service and perform any repairs and maintenanceTest drive guest vehicles and use our shop truck in a safe manner to pick up inventory as neededCollaborate with teammates and provide leadership to General Service Technicians  Minimum Qualifications Have and maintain an Automotive Technician State Inspectors license, where applicable.High school or GED equivalent.2+ years of automotive technician experienceValid Driver LicenseOwn a basic set of automotive tools or participate in tool purchase program.Ability to work with hands overhead, stand for long periods and lift 50 lbs.Guest and team focused mindsetPreferred Qualifications Current State Inspection/Emissions Licenses (In PA and NY)ASE automotive certification in at least one of A1-A8Automotive technical school certificate/degreeBenefitsPerformance based incentives   Paid vacation and holidays for Full-Time Teammates Reimbursement for ASE Certifications   Reimbursement for State Inspection / Emissions Licenses (where applicable by state)   401k eligibility immediately upon hire Direct Deposit Employee Discounts Healthcare, Vision, and Dental for Full time teammates   Employee Access Perks Career Advancement Opportunities    Your next Destination!Growth Opportunity: At Monro were committed to helping our teammates grow their career through the combination of coursework, demonstrating leadership skills and open opportunities. Our teammates receive on-the-job training, company sponsored certifications, as well as course curriculum in Monro University that empowers them to advance to the next level of their careers.Monro, Inc. is an equal opportunity employer and affords equal opportunity to all applicants for all positions without regard to race, color, religion, sex, national origin, disability status, protected veteran status, or any other characteristic protected by law."
2904633,"District Manager - Automotive Retail","https://jobs.smartrecruiters.com/MonroInc/744000057896990-district-manager-automotive-retail","monro","Richmond","No",3,"Full time","2025-05-09T02:00:01.418069Z","About the Role:  Reporting to the Regional Vice President, the District Manager is responsible for multiple locations. The primary expectation of the District Manager is to ensure the safety of our teammates and guests while achieving sales and profit budgets for each location they supervise. Other responsibilities include SOX Compliance, labor management, hiring, training, counseling, developing store managers, and retention.  Compensation: The pay range for this position is $90,000-120,000/year based upon experience. This role is eligible for additional incentives based upon performance. Responsibilities:  Lead assigned area in overall operations to drive sales and maximize profit via the store managers and teammates. Support company initiatives to achieve vision, mission, and values to be Americas leading automotive tire-service centers, trusted by our guests as the best place in their neighborhoods for quality automotive service and tires.  Assess skills of store managers, monitor performance, and set performance goals to deliver on company initiatives. Manage budget and capital expenses to maximize profit potential and drive P&amp;L health within assigned area.  Ensure assigned locations are appropriately staffed with the necessary skills in accordance with company labor management standards and demand to drive sales and profitability.Engage, train, develop and lead Store Managers through coaching on store operations, phone call execution, sales, product knowledge, and service processes during regular touchpoints with stores. Conduct and document regularly scheduled store visits which includes tracking action items, maintenance of equipment, appearance standards, labor management and communicating follow-up expectations to the Store Manager and plans for improvement.  Conduct quarterly cycle counts in stores in additional to annual inventories of stores in assigned area.Ensure all locations are adhering to company policies, including safety, security, and compliance standards throughout assigned area to provide a safe working environment. Communicate effectively and professionally with Store Support Center teammates, business partners and attend regional and company led meetings as required.Closely monitor customer satisfaction and resolve customer service concerns as they arise.  Drive strategic partnerships with third parties within the assigned area and train Store Managers on strategic partnership related duties. Develop others including yourself and improve teammate retention.Conduct regularly scheduled store meetings with direct reports to recognize accomplishments and communicate company directives.Maintain knowledge of local market competitors, automotive industry, and new developments.  Complete all Monro required training with the guidelines and timing provided. Perform other duties as assigned. Qualifications: High school or equivalent is required. Bachelors degree in business or related field is preferred. Minimum of 3-5 years of a single unit, multi-unit and/or area to include P&amp;L management. Minimum of 3-5 years as a hiring manager to include recruiting, hiring, and promoting people.  Must have a valid drivers license and have a satisfactory Motor Vehicle Report (MVR). Profile Summary:  Ability to develop rapport and trust with direct reports, peers, and leadership.  Ability to embrace, lead and champion organizational change. Oversees the performance of multiple Store Managers in up to twenty retail locations.Supports initiatives to achieve companys vision, mission, and values to be Americas leading auto service and tire center.Pro-active, process driven, with a strong focus on safety, sales, performance goals, phone call conversions, and guest count.Ability to plan, visit each store regularly, and facilitate regularly scheduled meetings with direct reports. Possesses strong people skills to effectively communicate with a wide variety of people assertively and confidently. Properly recognizes teammates for their achievements and identifies training and developmental opportunities.Ability to interpret and apply company policies and procedures. Excellent verbal and written communication skills. Able to be flexible and adapt to different work groups, work styles, and work environments. Partners with peers, Store Support Center teammates, and business partners to lead and manage the needs of the assigned area (Human Resources, Marketing, Loss Prevention, Finance, etc.) Ability to manage P&amp;L and to quantify the impact to metrics and financials. Ability to develop creative solutions to problem-solving. Ability to stay organized and multi-task in a professional and efficient manner. Focuses on details and follows instructions. Establishes goals and implements plans to achieve. Delivers on commitments. Drives strategic partnerships with third party businesses within the area. Possesses skills in the use of Microsoft suites of office products. Experience of recruiting, hiring, and promoting teammates as a hiring manager. Travel: Daily, mostly local travel. Applicant should live within or within reasonable distance of the assigned area. Occasional overnight stays. Work Environment &amp; Physical Requirements: This job operates in an automotive shop environment.  The job will have exposure to a moderate noise level, adverse weather conditions, chemicals, odors, dirt, and dust. District Managers must be able to complete the following but not limited to:Frequent standing and walking for long periods of time.Occasionally climbing up and down ladders to perform cycle counts of parts and tires.Occasionally able to lift, carry and stock merchandise and supplies up to 50 lbs. without assistance.Occasionally reaching overhead and below the knees, including squatting, bending, stooping, kneeling, twisting.Benefits: Four-week onboarding and training program Performance based incentives Paid vacation and holidays 401k eligibility immediately upon hireDirect DepositEmployee DiscountsHealthcare, Vision, and Dental for Full time teammates Employee Access PerksCompany provided vehicle Cell phone stipend Career Advancement Opportunities   This summary is not an all-inclusive description of job duties. Other job duties and responsibilities may also be assigned by the incumbents supervisor at any time based upon the Companys needs.  Monro conducts criminal background checks for those positions with security and/or financial responsibilities.  All background checks are conducted in accordance with applicable federal, state and local law, including but not limited to the Fair Credit Reporting Act.  No applicant will be automatically disqualified because of a criminal record.  Rather, the Company will consider the nature of the crime(s), when it occurred, the applicants explanation, and the relationship to the position sought in making its determination.   Monro Inc. is proud to be an Equal Employment Opportunity / Affirmative Action employer. It is our policy to consider for employment all individuals regardless of age, color, national origin, citizenship status, physical or mental disability, race, religion, gender, sex, sexual orientation, gender identity and/or expression, genetic information, veteran status, or any other characteristic protected by federal, state or local law.    Your next Destination!Growth Opportunity: At Monro were committed to helping our teammates grow their career through the combination of coursework, demonstrating leadership skills and open opportunities. Our teammates receive on-the-job training, company sponsored certifications, as well as course curriculum in Monro University that empowers them to advance to the next level of their careers.Monro, Inc. is an equal opportunity employer and affords equal opportunity to all applicants for all positions without regard to race, color, religion, sex, national origin, disability status, protected veteran status, or any other characteristic protected by law."
2904632,"Automotive Mechanic/Technician","https://jobs.smartrecruiters.com/MonroInc/744000057904026-automotive-mechanic-technician","monro","Cherry Hill Township","No",2,"Full time","2025-05-09T02:00:01.418096Z","Automotive Mechanic/TechnicianThe pay range for this position is between $25 to $40 flat rate with a guarantee rate of $17.00Responsible for the efficient, diagnosis, repair and maintenance of Guests vehicles, the Automotive Technician position is a great way to start your career at Monro.  Starting day 1 you will begin a comprehensive Technician training program, covering all aspects of your new role, while preparing you for the next. As an Automotive Technician for Monro, you will be an essential team member, performing repair services on Guest vehicles. More importantly, you will be part of a team working together to deliver 5 Star Guest experiences, while using your Technician skills to take care of people, their cars and ensure our guests have safe, reliable transportation.Responsibilities Perform brakes, suspension, tire installation, scheduled maintenance, and all manner of automotive repairs and maintenance, that you are qualified to performSecure our guests approval to perform the work as a result of the diagnosis; and always maintain a clean, neat work areaComplete thorough automotive vehicle inspections on every vehicle you service and perform any repairs and maintenanceTest drive guest vehicles and use our shop truck in a safe manner to pick up inventory as neededCollaborate with teammates and provide leadership to General Service Technicians  Minimum Qualifications 2+ years of automotive technician experienceValid Driver LicenseOwn a basic set of automotive tools or participate in tool purchase program.Ability to work with hands overhead, stand for long periods and lift 50 lbs.Guest and team focused mindsetHave and maintain an Automotive Technician State Inspectors license, where applicable.Preferred Qualifications ASE automotive certification in at least one of A1-A8 Automotive Technician State Inspector LicenseAutomotive technical school certificate/degreeBenefits Performance based incentives   Paid vacation and holidays for Full-Time Teammates 401k eligibility immediately upon hire Direct Deposit Employee Discounts Healthcare, Vision, and Dental for Full time teammates   Employee Access Perks Career Advancement Opportunities   Your next Destination!Growth Opportunity: At Monro were committed to helping our teammates grow their career through the combination of coursework, demonstrating leadership skills and open opportunities. Our teammates receive on-the-job training, company sponsored certifications, as well as course curriculum in Monro University that empowers them to advance to the next level of their careers.Monro, Inc. is an equal opportunity employer and affords equal opportunity to all applicants for all positions without regard to race, color, religion, sex, national origin, disability status, protected veteran status, or any other characteristic protected by law."
2904631,"Automotive General Service Technician","https://jobs.smartrecruiters.com/MonroInc/744000057914465-automotive-general-service-technician","monro","Largo","No","Not specified","Full time","2025-05-09T02:00:01.418121Z","At Monro the General Service Tech as we call it, is an entry level Automotive Technician position and a great way to start your career at Monro. The General Service Technician is also responsible for helping out at the counter, answering phones, checking in guests and covering the days off for the store manager. Starting day 1 you will begin a comprehensive mechanic training program, covering all aspects of your new role. As a General Service Technician, you will be an essential team member, performing maintenance services on Guest vehicles. More importantly, you will be part of a team working together to deliver 5 Star Guest experiences, while using your technician skills to take care of people, their cars and ensure our guests have safe, reliable transportation. Pay is based on experience plus, incentives (if applicable) Responsibilities Mechanic duties include changing, mounting, and installing tires Wheel removal, tire repair and balance, tire patch/plug repairs  Quick lube type duties such as lubrication and oil change Inspect and rotate tires   Basic automotive maintenance work such as battery installation  We will train you to do alignments, brake services, and scheduled maintenance services You will be trained on the phones system to help answer the phones and set up guest appointmentsYou will be trained on the computer system to help write up and check out guestsyou will be trained on how to order parts and write estimatesCompensation: The hourly range for this role is $16 - $18.00. This role is eligible for additional compensation and incentives. Pay will be determined based on experience level.Minimum Qualifications   HS diploma or GED equivalent  Automotive experience  Own basic set of Mechanics tools or participate in tool purchase program  Valid Driver license Must be at least 18 years of agePositive attitude and a collaborative mindset  Ability to work with hands overhead, stand for long periods and lift 50 lbs  Preferred Qualifications  Automotive Technician or Lube and Tire experience  Benefits  Performance based incentives   Paid vacation and holidays   Reimbursement for ASE Certifications   Reimbursement for State Inspection Licenses, where applicable   401k eligibility immediately upon hire Direct Deposit Employee Discounts Healthcare, Vision, and Dental  Employee Access Perks Career Advancement Opportunities   Your next Destination!Growth Opportunity: At Monro were committed to helping our teammates grow their career through the combination of coursework, demonstrating leadership skills and open opportunities. Our teammates receive on-the-job training, company sponsored certifications, as well as course curriculum in Monro University that empowers them to advance to the next level of their careers.Monro, Inc. is an equal opportunity employer and affords equal opportunity to all applicants for all positions without regard to race, color, religion, sex, national origin, disability status, protected veteran status, or any other characteristic protected by law."
2904629,"Automotive Technician - Technician","https://jobs.smartrecruiters.com/MonroInc/744000057918456-automotive-technician-technician","monro","Huntingdon","No","Not specified","Full time","2025-05-09T02:00:01.418152Z","About the Role:  *** Seeking an Inspection License Automotive Technician ****The Technician role is full time or part-time and is an hourly position based on needs of the business. The Technician is primarily responsible for conducting basic vehicle diagnostics and performing routine vehicle repair and maintenance services in accordance with company standards and manufacturer specifications. This position is expected to deliver exceptional 5 Star service to our guests, through effective communication of vehicle issues and proposed solutions, as well as consistently meeting guest expectations for time commitments and quality.Salary Range: $17.00 - $19.00 per hour guarantee, with flat rate of $25 - $38.00 per hour - Based on experience.This role is eligible for additional compensation and incentives. Responsibilities: Perform basic vehicle diagnostics to properly identify required repairs. Consistently complete Monros Courtesy Inspection process, on every guest vehicle, identifying, documenting, and communicating additional needed services and repairs; Audit courtesy inspections performed by the General Service Technicians Assist in inventory management to include pulling tires and parts, unloading and stocking inventory. Assist with all general store duties, ensuring the store is in excellent condition and maintained to Monro standards for cleanliness and consistently in guest ready condition. Consistently perform service(s) in accordance with Monros safety standards including but not limited to Monros Wheel Torque, Oil safety and compliance procedures Test drive vehicles in accordance with Monros Road Test policy, including consistently utilizing our dedicated test drive routes, while maintaining all local traffic and safety laws Understand and adhere to company policies and procedures, Governmental standards including environmental codes and ANSI/OSHA standards. Consistent use of all required safety standards set forth in training and policies and procedures. Maintain technical knowledge and capabilities to ensure proficiency through the timely completion of all required Monro University training courses and modules. Operate, utilize, and maintain all equipment in a safe manner in accordance with Monro and equipment manufacturer guidelines including but not limited to lifts, welders, brake lathes, etc. Perform other duties as assigned and required. Qualifications:High School Diploma or equivalent.   Automotive training including basic car maintenance and repair or the equivalent combination of education and experience.   ASE certification and State Inspection license (where applicable) preferred.  Must possess a current valid drivers license and have a satisfactory Motor Vehicle Report (MVR)  Required to own a basic set of tools or participate in Monros tool purchase program.Profile Summary: Capable of performing basic automotive maintenance, repair, and tire services Ability to diagnose problems identifying root cause and determine appropriate repair solution.  Ability to interpret and execute instructions furnished in written, oral, and diagram formats Strong customer service skills Strong verbal and written communication skills with the ability to convey technical issues and write routine reports.  Work Environment &amp; Physical Requirements:  This job operates in an automotive shop environment.  The job will have exposure to a moderate noise level, adverse weather conditions, chemicals, odors, dirt, and dust. Technicians must be able to complete the following but not limited to: Ability to work flexible hours, days, evenings, weekends, and holidays. Must be able to see, hear, lift, carry, and stock merchandise and supplies up to 50 lbs. without assistance. Frequent standing and walking for long periods of time. Frequent reaching overhead and below the knees, including squatting, bending, stooping, kneeling, and twisting.   Benefits:   Performance based incentives   Paid vacation and holidays for Full-Time Teammates Reimbursement for ASE Certifications   Reimbursement for State Inspection Licenses, where applicable   401k eligibility immediately upon hire Direct Deposit Employee Discounts Healthcare, Vision, and Dental for Full time teammates   Employee Access Perks Career Advancement Opportunities   This summary is not an all-inclusive description of job duties. Other job duties and responsibilities may also be assigned by the incumbents supervisor at any time based upon the Companys needs.      Monro Inc. is proud to be an Equal Employment Opportunity / Affirmative Action employer. It is our policy to consider for employment all individuals regardless of age, color, national origin, citizenship status, physical or mental disability, race, religion, gender, sex, sexual orientation, gender identity and/or expression, genetic information, veteran status, or any other characteristic protected by federal, state, or local law.   Your next Destination!Growth Opportunity: At Monro were committed to helping our teammates grow their career through the combination of coursework, demonstrating leadership skills and open opportunities. Our teammates receive on-the-job training, company sponsored certifications, as well as course curriculum in Monro University that empowers them to advance to the next level of their careers.Monro, Inc. is an equal opportunity employer and affords equal opportunity to all applicants for all positions without regard to race, color, religion, sex, national origin, disability status, protected veteran status, or any other characteristic protected by law."
