"ID","Title","Link","Company","Location","Remote","Experience","EmploymentType","DatePosted","RoleDescription"
2892010,"Automotive Technician","https://jobs.smartrecruiters.com/MonroInc/744000057596168-automotive-technician","monro","Greece","No","Not specified","Full time","2025-05-09T02:00:01.418563Z","About the Role:  The Technician role is full time or part-time and is an hourly position based on needs of the business. The Technician is primarily responsible for conducting basic vehicle diagnostics and performing routine vehicle repair and maintenance services in accordance with company standards and manufacturer specifications.  This position is expected to deliver exceptional 5 Star service to our guests, through effective communication of vehicle issues and proposed solutions, as well as consistently meeting guest expectations for time commitments and quality.   Salary Range: $23.00 - $35.00 per hour - Based on experience.This role is eligible for additional compensation and incentives. Responsibilities:  Perform basic vehicle diagnostics to properly identify required repairs. Consistently complete Monros Courtesy Inspection process, on every guest vehicle, identifying, documenting, and communicating additional needed services and repairs; Audit courtesy inspections performed by the General Service Technicians  Assist in inventory management to include pulling tires and parts, unloading and stocking inventory.Assist with all general store duties, ensuring the store is in excellent condition and maintained to Monro standards for cleanliness and consistently in guest ready condition. Consistently perform service(s) in accordance with Monros safety standards including but not limited to Monros Wheel Torque, Oil safety and compliance procedures Test drive vehicles in accordance with Monros Road Test policy, including consistently utilizing our dedicated test drive routes, while maintaining all local traffic and safety laws Understand and adhere to company policies and procedures, Governmental standards including environmental codes and ANSI/OSHA standards. Consistent use of all required safety standards set forth in training and policies and procedures.  Maintain technical knowledge and capabilities to ensure proficiency through the timely completion of all required Monro University training courses and modules. Operate, utilize, and maintain all equipment in a safe manner in accordance with Monro and equipment manufacturer guidelines including but not limited to lifts, welders, brake lathes, etc. Perform other duties as assigned and required. Qualifications:  High School Diploma or equivalent.  Automotive training including basic car maintenance and repair or the equivalent combination of education and experience.  ASE certification and State Inspection license (where applicable) preferred. Must possess a current valid drivers license and have a satisfactory Motor Vehicle Report (MVR) and have the ability to operate customers vehicles to conduct test drives.Required to own a basic set of tools or participate in Monros tool purchase program.  Profile Summary: Capable of performing basic automotive maintenance, repair, and tire services Ability to diagnose problems identifying root cause and determine appropriate repair solution.  Ability to interpret and execute instructions furnished in written, oral, and diagram formats Strong customer service skills Strong verbal and written communication skills with the ability to convey technical issues and write routine reports.   Work Environment &amp; Physical Requirements:  This job operates in an automotive shop environment.  The job will have exposure to a moderate noise level, adverse weather conditions, chemicals, odors, dirt, and dust. Technicians must be able to complete the following but not limited to: Ability to work flexible hours, days, evenings, weekends, and holidays. Must be able to see, hear, lift, carry and stock merchandise and supplies up to 50 lbs. without assistance. Frequent standing and walking for long periods of time. Frequent reaching overhead and below the knees, including squatting, bending, stooping, kneeling, twisting.  Ability to diagnose problems identifying root cause and determine appropriate repair solution.  Ability to interpret and execute instructions furnished in written, oral, and diagram formats Strong customer service skills Strong verbal and written communication skills with the ability to convey technical issues and write routine reports.  Benefits:  Performance based incentives  Paid vacation and holidays for Full-Time TeammatesReimbursement for ASE CertificationsReimbursement for State Inspection Licenses, where applicable401k eligibility immediately upon hireDirect DepositEmployee DiscountsHealthcare, Vision, and Dental for Full time TeammatesEmployee Access PerksCareer Advancement Opportunities   This summary is not an all-inclusive description of job duties. Other job duties and responsibilities may also be assigned by the incumbents supervisor at any time based upon the Companys needs.    Monro Inc. is proud to be an Equal Employment Opportunity / Affirmative Action employer. It is our policy to consider for employment all individuals regardless of age, color, national origin, citizenship status, physical or mental disability, race, religion, gender, sex, sexual orientation, gender identity and/or expression, genetic information, veteran status, or any other characteristic protected by federal, state, or local law.  Your next Destination!Growth Opportunity: At Monro were committed to helping our teammates grow their career through the combination of coursework, demonstrating leadership skills and open opportunities. Our teammates receive on-the-job training, company sponsored certifications, as well as course curriculum in Monro University that empowers them to advance to the next level of their careers.Monro, Inc. is an equal opportunity employer and affords equal opportunity to all applicants for all positions without regard to race, color, religion, sex, national origin, disability status, protected veteran status, or any other characteristic protected by law."
2892009,"Assistant Manager","https://jobs.smartrecruiters.com/MonroInc/744000057595581-assistant-manager","monro","Aberdeen","No",2,"Full time","2025-05-09T02:00:01.418610Z","About The Role: The Assistant Manager role is a full-time position and is hourly based upon needs of the business. The Assistant Manager is a key holder for the store and serves as the manager on duty (MOD) in the absence of the Store Manager, or when demand requires it. The Assistant Manager is responsible for assisting in managing the operations of an automotive retail service and repair store to meet or exceed service standards and to achieve Monros performance and profitability goals.  This position is expected to ensure that all teammates deliver exceptional 5 Star service to our guests, through effective communication of vehicle issues and proposed solutions, as well as consistently meeting guest expectations for time commitments and quality.  Responsibilities:  Schedule guest appointments for the most effective optimization of technician abilities in the efficient and timely completion of vehicle services/repairs  Help achieve Monros sales goals by properly informing and recommending tire and service products and sales promotions. Attend to all guest needs in areas of sales, service, complaints, and adjustments. Build guest relationships to maximize customer satisfaction, loyalty, and retention. Assist technicians in conveying repair and service needs to guests. Ensure the store is in excellent condition and maintained to Monro standards for cleanliness and consistently in guest ready condition.Assist with inventory management to include the oversight of pulling of tires and parts, unloading and stocking inventory. Provide direction and oversight to other technicians and assist where needed with services/repairs. Assist in organizing the stores workflow to ensure that technician skill levels are utilized efficiently for completing vehicle services/repairs effectively and timely in accordance with Monro standards of operation. Understand and adhere to company policies and procedures, Governmental standards including environmental codes and ANSI/OSHA standards. Consistent use of all required safety standards set forth in training and policies and procedures.  Perform Store Manager functions as business needs dictate. Perform other duties as assigned and required by direct supervisor.  Compensation:  $17-24 hour based on experience.  This role also has other incentives and bonuses available.Qualifications:  High School Diploma or equivalent  Minimum of two years retail experience, or the equivalent combination of education and experience.  Ability to work flexible hours, days, evenings, weekends, and holidays. ASE certification and State Inspection License (where applicable) preferred. Ability to influence and motivate a team to achieve set goals and objectives.   Ability to problem solve, manage inventory, merchandising, and customer service.   Communications skills to effectively communicate with teammates and guests.  Complete all Monro required training with the guidelines and timing provided.  Must possess a current valid drivers license and have a satisfactory Motor Vehicle Report (MVR) and have the ability to operate customers vehicles to conduct test drives.Profile Summary: Capable of performing basic automotive maintenance, repair, and tire services Ability to identify problems by collecting data and establishing facts to produce practical decisions and solutions. Ability to interpret and execute instructions furnished in written, oral, and diagram formats.Excellent customer service skills  Strong sales orientation and customer focus Excellent verbal and written communication skills with the ability to convey technical issues and write routine reports.  Excellent organizational and time management skills with the ability to change focus quickly to meet business needs. Work Environment &amp; Physical Requirements:  This job operates in an automotive shop environment.  The job will have exposure to a moderate noise level, adverse weather conditions, chemicals, odors, dirt, and dust. Assistant Managers must be able to complete the following but not limited to: Must be able to see, hear, speak, lift, carry and stock merchandise and supplies up to 50 lbs. without assistance. Frequent standing and walking for long periods of time. Frequent reaching overhead and below the knees, including squatting, bending, stooping, kneeling, twisting. All your information will be kept confidential according to EEO guidelines.Benefits:  Performance based incentives  Paid vacation and holidays  Reimbursement for ASE Certifications  Reimbursement for State Inspection Licenses, where applicable  401k eligibility immediately upon hireDirect DepositEmployee DiscountsHealthcare, Vision, and DentalEmployee Access PerksCareer Advancement Opportunities This summary is not an all-inclusive description of job duties. Other job duties and responsibilities may also be assigned by the incumbents supervisor at any time based upon the Companys needs.   Monro Inc. is proud to be an Equal Employment Opportunity / Affirmative Action employer. It is our policy to consider for employment all individuals regardless of age, color, national origin, citizenship status, physical or mental disability, race, religion, gender, sex, sexual orientation, gender identity and/or expression, genetic information, veteran status, or any other characteristic protected by federal, state, or local law.   Your next Destination!Growth Opportunity: At Monro were committed to helping our teammates grow their career through the combination of coursework, demonstrating leadership skills and open opportunities. Our teammates receive on-the-job training, company sponsored certifications, as well as course curriculum in Monro University that empowers them to advance to the next level of their careers.Monro, Inc. is an equal opportunity employer and affords equal opportunity to all applicants for all positions without regard to race, color, religion, sex, national origin, disability status, protected veteran status, or any other characteristic protected by law."
2892008,"Automotive Technician - Technician","https://jobs.smartrecruiters.com/MonroInc/744000057599455-automotive-technician-technician","monro","Statesville","No","Not specified","Full time","2025-05-09T02:00:01.418638Z","About the Role:The Technician role is full time or part-time and is an hourly position based on needs of the business. The Technician is primarily responsible for conducting basic vehicle diagnostics and performing routine vehicle repair and maintenance services in accordance with company standards and manufacturer specifications. This position is expected to deliver exceptional 5 Star service to our guests, through effective communication of vehicle issues and proposed solutions, as well as consistently meeting guest expectations for time commitments and quality.Salary Range: $17.00 - $19.00 per hour guarantee, with flat rate of $25 - $35.00 per hour - Based on experience.This role is eligible for additional compensation and incentives. Responsibilities: Perform basic vehicle diagnostics to properly identify required repairs. Consistently complete Monros Courtesy Inspection process, on every guest vehicle, identifying, documenting, and communicating additional needed services and repairs; Audit courtesy inspections performed by the General Service Technicians Assist in inventory management to include pulling tires and parts, unloading and stocking inventory. Assist with all general store duties, ensuring the store is in excellent condition and maintained to Monro standards for cleanliness and consistently in guest ready condition. Consistently perform service(s) in accordance with Monros safety standards including but not limited to Monros Wheel Torque, Oil safety and compliance procedures Test drive vehicles in accordance with Monros Road Test policy, including consistently utilizing our dedicated test drive routes, while maintaining all local traffic and safety laws Understand and adhere to company policies and procedures, Governmental standards including environmental codes and ANSI/OSHA standards. Consistent use of all required safety standards set forth in training and policies and procedures. Maintain technical knowledge and capabilities to ensure proficiency through the timely completion of all required Monro University training courses and modules. Operate, utilize, and maintain all equipment in a safe manner in accordance with Monro and equipment manufacturer guidelines including but not limited to lifts, welders, brake lathes, etc. Perform other duties as assigned and required. Qualifications:High School Diploma or equivalent.   Automotive training including basic car maintenance and repair or the equivalent combination of education and experience.   ASE certification and State Inspection license (where applicable) preferred.  Must possess a current valid drivers license and have a satisfactory Motor Vehicle Report (MVR)  Required to own a basic set of tools or participate in Monros tool purchase program.Profile Summary: Capable of performing basic automotive maintenance, repair, and tire services Ability to diagnose problems identifying root cause and determine appropriate repair solution.  Ability to interpret and execute instructions furnished in written, oral, and diagram formats Strong customer service skills Strong verbal and written communication skills with the ability to convey technical issues and write routine reports.  Work Environment &amp; Physical Requirements:  This job operates in an automotive shop environment.  The job will have exposure to a moderate noise level, adverse weather conditions, chemicals, odors, dirt, and dust. Technicians must be able to complete the following but not limited to: Ability to work flexible hours, days, evenings, weekends, and holidays. Must be able to see, hear, lift, carry, and stock merchandise and supplies up to 50 lbs. without assistance. Frequent standing and walking for long periods of time. Frequent reaching overhead and below the knees, including squatting, bending, stooping, kneeling, and twisting.   Benefits:   Performance based incentives   Paid vacation and holidays for Full-Time Teammates Reimbursement for ASE Certifications   Reimbursement for State Inspection Licenses, where applicable   401k eligibility immediately upon hire Direct Deposit Employee Discounts Healthcare, Vision, and Dental for Full time teammates   Employee Access Perks Career Advancement Opportunities   This summary is not an all-inclusive description of job duties. Other job duties and responsibilities may also be assigned by the incumbents supervisor at any time based upon the Companys needs.      Monro Inc. is proud to be an Equal Employment Opportunity / Affirmative Action employer. It is our policy to consider for employment all individuals regardless of age, color, national origin, citizenship status, physical or mental disability, race, religion, gender, sex, sexual orientation, gender identity and/or expression, genetic information, veteran status, or any other characteristic protected by federal, state, or local law.   Your next Destination!Growth Opportunity: At Monro were committed to helping our teammates grow their career through the combination of coursework, demonstrating leadership skills and open opportunities. Our teammates receive on-the-job training, company sponsored certifications, as well as course curriculum in Monro University that empowers them to advance to the next level of their careers.Monro, Inc. is an equal opportunity employer and affords equal opportunity to all applicants for all positions without regard to race, color, religion, sex, national origin, disability status, protected veteran status, or any other characteristic protected by law."
2892007,"State Certified Automotive / Technician-Mechanic  ( Flint Michigan)","https://jobs.smartrecruiters.com/MonroInc/744000057600391-state-certified-automotive-technician-mechanic-flint-michigan-","monro","Flint","No",2,"Full time","2025-05-09T02:00:01.418664Z","Automotive Mechanic/TechnicianThe pay range for this position is between $18.00 and $28.00 per hour guaranteed based on experience, and number of state certification and or Master tech status. Flat rate between $25 and $43Responsible for the efficient, diagnosis, repair and maintenance of Guests vehicles, the Automotive Technician position is a great way to start your career at Monro.  Starting day 1 you will begin a comprehensive Technician training program, covering all aspects of your new role, while preparing you for the next. As an Automotive Technician for Monro, you will be an essential team member, performing repair services on Guest vehicles. More importantly, you will be part of a team working together to deliver 5 Star Guest experiences, while using your Technician skills to take care of people, their cars and ensure our guests have safe, reliable transportation.Responsibilities Perform brakes, suspension, tire installation, scheduled maintenance, and all manner of automotive repairs and maintenance, that you are qualified to performSecure our guests approval to perform the work as a result of the diagnosis; and always maintain a clean, neat work areaComplete thorough automotive vehicle inspections on every vehicle you service and perform any repairs and maintenanceTest drive guest vehicles and use our shop truck in a safe manner to pick up inventory as neededCollaborate with teammates and provide leadership to General Service Technicians  Minimum Qualifications 2+ years of automotive technician experienceValid Driver LicenseOwn a basic set of automotive tools or participate in tool purchase program.Ability to work with hands overhead, stand for long periods and lift 50 lbs.Guest and team focused mindsetHave and maintain an Automotive Technician State Inspectors license, where applicable.Preferred Qualifications ASE automotive certification in at least one of A1-AAutomotive technical school certificate/degreeState Automotive CertificationBenefits Performance based incentives   Paid vacation and holidays for Full-Time Teammates Reimbursement for ASE Certifications   Reimbursement for State Inspection Licenses, where applicable   401k eligibility immediately upon hire Direct Deposit Employee Discounts Healthcare, Vision, and Dental for Full time teammates   Employee Access Perks Career Advancement Opportunities   Your next Destination!Growth Opportunity: At Monro were committed to helping our teammates grow their career through the combination of coursework, demonstrating leadership skills and open opportunities. Our teammates receive on-the-job training, company sponsored certifications, as well as course curriculum in Monro University that empowers them to advance to the next level of their careers.Monro, Inc. is an equal opportunity employer and affords equal opportunity to all applicants for all positions without regard to race, color, religion, sex, national origin, disability status, protected veteran status, or any other characteristic protected by law."
