"ID","Title","Link","Company","Location","Remote","Experience","EmploymentType","DatePosted","RoleDescription"
2962352,"Healthcare Industry Architect","https://jobs.smartrecruiters.com/PaloAltoNetworks2/744000060033798-healthcare-industry-architect","Palo_Alto_Networks","Santa Clara","No",15,"Full time","2025-05-19T02:06:55.148107Z","Your CareerThe Healthcare Industry Architect, will expect to be knowledgeable of the top healthcare industry use cases and cybersecurity trends in todays market and   correlate how top use cases impact Palo Alto Healthcare Architecture Offerings in the areas of next generation security, cloud, and sec ops transformation. The healthcare architect should be very knowledgeable of the key industry use cases, and also the full palo alto networks suite of offerings. The healthcare architect will be responsible for being a strategic and technology advisor to drive adoption and sales for Palo Altos most strategic healthcare provider clients. The healthcare advisor should be very comfortable in creating content, collateral, and architectural diagrams tying the most important use cases to the Palo Alto Set of Platforms and solutions. The healthcare architect should be very comfortable to present, evangelize,, and drive a partnership with both a C-level audience and practitioners. The healthcare architect should also be  comfortable in enabling sellers, partners, and account teams on the healthcare message and palo alto network technology solution areas. Your ImpactDrive and Create a Healthcare Industry Point of View and Architecture based on Palo Alto Networks Solution and Platform AreasDrive a 'solution sales' mindset translating healthcare use cases to Palo Alto Network Solutions and OfferingsCollaborate closely with sales leadership to drive a consultative sales culture working with the biggest healthcare providers in North AmericaAccountability with sales leaders to drive key performance metrics of bookings and pipeline to help grow the healthcare business in North AmericaDevelop and contribute to a healthcare industry point of view tied to palo alto offerings for both current and future healthcare industry use casesCoach and enable healthcare team to utilizing standard methodologies, playbooks for the healthcare vertical Help Present, Speak, and Drive Thought Leadership at Industry Events and Consortia(i.e HIMMS, Healthcare ISAC, Council Meetings, etc..)Your Experience 15+ years in healthcare sales and/or cybersecurity sales.Deep understanding of the healthcare provider market and industry trends.Proven ability to communicate complex cybersecurity solutions to C-level audiences.Strong knowledge of Palo Alto Networks' products and architectural solutions.Bachelor's degree (MBA preferred).The TeamThe Worldwide Shared Services team is dedicated to empowering Palo Alto Networks go-to-market teams through innovative solutions and strategic guidance to drive superior outcomes. We strive to equip our teams with the expertise and resources needed to make a meaningful and lasting impact with the customers we serve while achieving sales excellence. We are committed to fostering an environment where our team members can thrive, creating a culture of collaboration and knowledge sharing to drive collective growth and success.The Industry Solutions teams enable sales success in industry verticals.Who we Are: Industry-specific advisors and architects across Palo Alto Networks top 4 verticals: Financial Services, Healthcare, Manufacturing &amp; RetailWhat we Do: We help account teams understand the business of Financial Services, Healthcare, Manufacturing and Retail. We translate industry business problems into opportunities and connect customer business outcomes to the capabilities Palo Alto Networks can enable. 

Why it Matters to You: We help build trust with clients, improve customer business outcomes and increase wins in top growth accounts.Compensation DisclosureThe compensation offered for this position will depend on qualifications, experience, and work location. For candidates who receive an offer at the posted level, the starting base salary (for non-sales roles) or base salary + commission target (for sales/commissioned roles) is expected to be between $186,000 - $278,000/YR. The offered compensation may also include restricted stock units and a bonus. A description of our employee benefits may be found here.Our Commitment

Were problem solvers that take risks and challenge cybersecuritys status quo. Its simple: we cant accomplish our mission without diverse teams innovating, together.We are committed to providing reasonable accommodations for all qualified individuals with a disability. If you require assistance or accommodation due to a disability or special need, please contact us at  accommodations@paloaltonetworks.com.Palo Alto Networks is an equal opportunity employer. We celebrate diversity in our workplace, and all qualified applicants will receive consideration for employment without regard to age, ancestry, color, family or medical care leave, gender identity or expression, genetic information, marital status, medical condition, national origin, physical or mental disability, political affiliation, protected veteran status, race, religion, sex (including pregnancy), sexual orientation, or other legally protected characteristics.All your information will be kept confidential according to EEO guidelines.
Is role eligible for Immigration Sponsorship? No. Please note that we will not sponsor applicants for work visas for this position."
2962351,"Legal Operations Manager, Outside Counsel and Spend Management","https://jobs.smartrecruiters.com/PaloAltoNetworks2/744000060037412-legal-operations-manager-outside-counsel-and-spend-management","Palo_Alto_Networks","Dallas","Yes",7,"Full time","2025-05-19T02:06:55.148126Z","Your CareerThis role will support Palo Alto Networks legal department by optimizing outside counsel management and spend. This individual will manage outside counsel engagements, including selection, onboarding, performance evaluation, and billing review. They will also maintain legal technologies and processes for e-billing, matter management, and spend analytics. This role will report into the Director, Head of Legal Operations and collaborate with internal legal teams, finance, and outside counsel. Your ImpactOversee quarterly and annual budget planning with Finance across legal practice areas.Collaborate with stakeholders to forecast and budget legal spend.Develop and implement strategies to reduce outside counsel spend while maintaining quality.Implement a top-tier law firm panel program (preferred vendor panel) and a spend optimization strategy with outside counsel.Manage onboarding for new firms, selection, and performance evaluation of outside counsel.Negotiate and manage outside counsel billing rates and alternative fee arrangements.Oversee e-billing, ensuring accuracy and compliance, including invoice review and processing.Develop and maintain legal spend analytics and reporting to identify trends, cost drivers, and savings opportunities.Implement and manage legal technology solutions for outside counsel management, e-billing, and spend analytics, including systems implementations, training, and user support.Stay current on industry best practices for outside counsel management and legal spend optimization.Train internal legal teams and outside counsel on billing guidelines, e-billing processes, and relevant topics.Drive continuous improvement in legal operations processes and systems.Develop strong, collaborative relationships with cross-functional partners.Your Experience A self-starter with enthusiasm, who can work independently with minimal oversight on certain projects but who is also a team player and can support projects when needed. Must have a passion for operations, willing to take on diverse projects.Excellent analytical, negotiation, and communication skills.Ability to manage multiple projects and prioritize effectively.Impeccable attention to detail and exceptional professional judgment. Excellent organization and communication skills with the ability to develop, implement, and enhance processes.Ability to execute under pressure and within tight timelines while juggling multiple projects.7+ years of experience in legal operations, focused on outside counsel management and understanding of legal billing practices/e-billing systems.Experience with legal technology solutions, including matter management, e-billing, and spend analytics platforms.The TeamWe are a Legal Team who is unrelenting in our pursuit of achievement, we are constantly seeking improvements and can take on every challenge. We value a positive attitude and high empathy. We adjust according to the situation, learn new things, innovate, and try new methods. We value collaboration, function as a team and know that our colleagues experience and knowledge are valuable. We demonstrate the highest level of adherence to not only what is legal but also what is right. We apply our legal knowledge to real-world scenarios, have a desire to explore the unknown and question the status quo in pursuit of better, more effective solutions.Compensation DisclosureThe compensation offered for this position will depend on qualifications, experience, and work location. For candidates who receive an offer at the posted level, the starting base salary (for non-sales roles) or base salary + commission target (for sales/commissioned roles) is expected to be between $142,000 - $178,000/YR. The offered compensation may also include restricted stock units and a bonus. A description of our employee benefits may be found here.Our Commitment

Were problem solvers that take risks and challenge cybersecuritys status quo. Its simple: we cant accomplish our mission without diverse teams innovating, together.We are committed to providing reasonable accommodations for all qualified individuals with a disability. If you require assistance or accommodation due to a disability or special need, please contact us at  accommodations@paloaltonetworks.com.Palo Alto Networks is an equal opportunity employer. We celebrate diversity in our workplace, and all qualified applicants will receive consideration for employment without regard to age, ancestry, color, family or medical care leave, gender identity or expression, genetic information, marital status, medical condition, national origin, physical or mental disability, political affiliation, protected veteran status, race, religion, sex (including pregnancy), sexual orientation, or other legally protected characteristics.All your information will be kept confidential according to EEO guidelines."
2962350,"Legal Operations Manager, Outside Counsel and Spend Management","https://jobs.smartrecruiters.com/PaloAltoNetworks2/744000060040254-legal-operations-manager-outside-counsel-and-spend-management","Palo_Alto_Networks","Seattle","Yes",7,"Full time","2025-05-19T02:06:55.148146Z","Your CareerThis role will support Palo Alto Networks legal department by optimizing outside counsel management and spend. This individual will manage outside counsel engagements, including selection, onboarding, performance evaluation, and billing review. They will also maintain legal technologies and processes for e-billing, matter management, and spend analytics. This role will report into the Director, Head of Legal Operations and collaborate with internal legal teams, finance, and outside counsel. Your ImpactOversee quarterly and annual budget planning with Finance across legal practice areas.Collaborate with stakeholders to forecast and budget legal spend.Develop and implement strategies to reduce outside counsel spend while maintaining quality.Implement a top-tier law firm panel program (preferred vendor panel) and a spend optimization strategy with outside counsel.Manage onboarding for new firms, selection, and performance evaluation of outside counsel.Negotiate and manage outside counsel billing rates and alternative fee arrangements.Oversee e-billing, ensuring accuracy and compliance, including invoice review and processing.Develop and maintain legal spend analytics and reporting to identify trends, cost drivers, and savings opportunities.Implement and manage legal technology solutions for outside counsel management, e-billing, and spend analytics, including systems implementations, training, and user support.Stay current on industry best practices for outside counsel management and legal spend optimization.Train internal legal teams and outside counsel on billing guidelines, e-billing processes, and relevant topics.Drive continuous improvement in legal operations processes and systems.Develop strong, collaborative relationships with cross-functional partners.Your Experience A self-starter with enthusiasm, who can work independently with minimal oversight on certain projects but who is also a team player and can support projects when needed. Must have a passion for operations, willing to take on diverse projects.Excellent analytical, negotiation, and communication skills.Ability to manage multiple projects and prioritize effectively.Impeccable attention to detail and exceptional professional judgment. Excellent organization and communication skills with the ability to develop, implement, and enhance processes.Ability to execute under pressure and within tight timelines while juggling multiple projects.7+ years of experience in legal operations, focused on outside counsel management and understanding of legal billing practices/e-billing systems.Experience with legal technology solutions, including matter management, e-billing, and spend analytics platforms.The TeamWe are a Legal Team who is unrelenting in our pursuit of achievement, we are constantly seeking improvements and can take on every challenge. We value a positive attitude and high empathy. We adjust according to the situation, learn new things, innovate, and try new methods. We value collaboration, function as a team and know that our colleagues experience and knowledge are valuable. We demonstrate the highest level of adherence to not only what is legal but also what is right. We apply our legal knowledge to real-world scenarios, have a desire to explore the unknown and question the status quo in pursuit of better, more effective solutions.Compensation DisclosureThe compensation offered for this position will depend on qualifications, experience, and work location. For candidates who receive an offer at the posted level, the starting base salary (for non-sales roles) or base salary + commission target (for sales/commissioned roles) is expected to be between $142,000 - $178,000/YR. The offered compensation may also include restricted stock units and a bonus. A description of our employee benefits may be found here.Our Commitment

Were problem solvers that take risks and challenge cybersecuritys status quo. Its simple: we cant accomplish our mission without diverse teams innovating, together.We are committed to providing reasonable accommodations for all qualified individuals with a disability. If you require assistance or accommodation due to a disability or special need, please contact us at  accommodations@paloaltonetworks.com.Palo Alto Networks is an equal opportunity employer. We celebrate diversity in our workplace, and all qualified applicants will receive consideration for employment without regard to age, ancestry, color, family or medical care leave, gender identity or expression, genetic information, marital status, medical condition, national origin, physical or mental disability, political affiliation, protected veteran status, race, religion, sex (including pregnancy), sexual orientation, or other legally protected characteristics.All your information will be kept confidential according to EEO guidelines."
2962349,"Legal Operations Manager, Outside Counsel and Spend Management","https://jobs.smartrecruiters.com/PaloAltoNetworks2/744000060040227-legal-operations-manager-outside-counsel-and-spend-management","Palo_Alto_Networks","Atlanta","Yes",7,"Full time","2025-05-19T02:06:55.148164Z","Your CareerThis role will support Palo Alto Networks legal department by optimizing outside counsel management and spend. This individual will manage outside counsel engagements, including selection, onboarding, performance evaluation, and billing review. They will also maintain legal technologies and processes for e-billing, matter management, and spend analytics. This role will report into the Director, Head of Legal Operations and collaborate with internal legal teams, finance, and outside counsel. Your ImpactOversee quarterly and annual budget planning with Finance across legal practice areas.Collaborate with stakeholders to forecast and budget legal spend.Develop and implement strategies to reduce outside counsel spend while maintaining quality.Implement a top-tier law firm panel program (preferred vendor panel) and a spend optimization strategy with outside counsel.Manage onboarding for new firms, selection, and performance evaluation of outside counsel.Negotiate and manage outside counsel billing rates and alternative fee arrangements.Oversee e-billing, ensuring accuracy and compliance, including invoice review and processing.Develop and maintain legal spend analytics and reporting to identify trends, cost drivers, and savings opportunities.Implement and manage legal technology solutions for outside counsel management, e-billing, and spend analytics, including systems implementations, training, and user support.Stay current on industry best practices for outside counsel management and legal spend optimization.Train internal legal teams and outside counsel on billing guidelines, e-billing processes, and relevant topics.Drive continuous improvement in legal operations processes and systems.Develop strong, collaborative relationships with cross-functional partners.Your Experience A self-starter with enthusiasm, who can work independently with minimal oversight on certain projects but who is also a team player and can support projects when needed. Must have a passion for operations, willing to take on diverse projects.Excellent analytical, negotiation, and communication skills.Ability to manage multiple projects and prioritize effectively.Impeccable attention to detail and exceptional professional judgment. Excellent organization and communication skills with the ability to develop, implement, and enhance processes.Ability to execute under pressure and within tight timelines while juggling multiple projects.7+ years of experience in legal operations, focused on outside counsel management and understanding of legal billing practices/e-billing systems.Experience with legal technology solutions, including matter management, e-billing, and spend analytics platforms.The TeamWe are a Legal Team who is unrelenting in our pursuit of achievement, we are constantly seeking improvements and can take on every challenge. We value a positive attitude and high empathy. We adjust according to the situation, learn new things, innovate, and try new methods. We value collaboration, function as a team and know that our colleagues experience and knowledge are valuable. We demonstrate the highest level of adherence to not only what is legal but also what is right. We apply our legal knowledge to real-world scenarios, have a desire to explore the unknown and question the status quo in pursuit of better, more effective solutions.Compensation DisclosureThe compensation offered for this position will depend on qualifications, experience, and work location. For candidates who receive an offer at the posted level, the starting base salary (for non-sales roles) or base salary + commission target (for sales/commissioned roles) is expected to be between $142,000 - $178,000/YR. The offered compensation may also include restricted stock units and a bonus. A description of our employee benefits may be found here.Our Commitment

Were problem solvers that take risks and challenge cybersecuritys status quo. Its simple: we cant accomplish our mission without diverse teams innovating, together.We are committed to providing reasonable accommodations for all qualified individuals with a disability. If you require assistance or accommodation due to a disability or special need, please contact us at  accommodations@paloaltonetworks.com.Palo Alto Networks is an equal opportunity employer. We celebrate diversity in our workplace, and all qualified applicants will receive consideration for employment without regard to age, ancestry, color, family or medical care leave, gender identity or expression, genetic information, marital status, medical condition, national origin, physical or mental disability, political affiliation, protected veteran status, race, religion, sex (including pregnancy), sexual orientation, or other legally protected characteristics.All your information will be kept confidential according to EEO guidelines."
2962348,"Solutions Consultant (Systems Engineer), Czechia","https://jobs.smartrecruiters.com/PaloAltoNetworks2/744000060038006-solutions-consultant-systems-engineer-czechia","Palo_Alto_Networks","Prague","Yes",3,"Full time","2025-05-19T02:06:55.148183Z","As a Solutions Consultant, you will provide technical expertise and guidance in customers' network security and zero trust journey.  You will be key in defining technical solutions that secure a customers key business imperatives.  You evangelize our industry leadership in on-prem, cloud, and security services that establish Palo Alto Networks as a customers cybersecurity partner.Your ImpactCollaborate with sales teams to recommend and develop customer solutions within your assigned specializationPresent to customers as our expert at all levels in the customer hierarchy, from practitioner to senior leadershipLead and support customer demonstrations that showcase our unique value propositionResponsible for prospective customers and partners' Technical Validation projects based on best practices to ensure technical win in assigned opportunitiesArchitect solutions that will help our customers strengthen and simplify their security postureDocument high-level design and key use cases to ensure proper implementation and value realization of Palo Alto Networks solutionsLead conversations about industry trends and emerging changes to the security landscape.Responsible for discussing and highlighting product alignment with customer requirements and differentiationAs the main technical point of contact for network security, you will assist and collaborate to respond effectively to RFIs/RFPsPosition Palo Alto Networks or partner delivered services as appropriate to ensure proper implementation and value realization of Palo Alto Networks solutionsDiscuss, with credibility, competitive offers in the marketplace and position ours as the best alternativeYour Experience3+ years experience in pre-sales/sales engineering within Zero Trust, Networking, Network Security, SaaS Security or SSE/SASE Outstanding customer communication and problem-solving skillsExperience in working with customers, demonstrating problem-solving skills and a can-do attitudeSolid understanding of NGFW, Network Security, SASE, SD-WAN, CASB, Proxy, DLP and BYOD SolutionsFinancial services sector experience is preferredAdvanced knowledge of On-Premise and Cloud-Delivered Network Security TechnologiesFluent Czech &amp; proficient English language skillsThe TeamOur Domain Consultant team members work hand-in-hand with organizations around the world to keep their digital environments protected. We educate, inspire,and empower our potential clients in their journey to security. You are empowered with unmatched systems and tools and a team built on joint success. You wont find someone at Palo Alto Networks that isnt committed to your success  with everyone pitching in to assist when it comes to solutions selling, learning, and development. Our Solutions Consulting community is driven by the mission to be our customers cybersecurity partner of choice, protecting their digital way of life.Our Commitment

Were problem solvers that take risks and challenge cybersecuritys status quo. Its simple: we cant accomplish our mission without diverse teams innovating, together.We are committed to providing reasonable accommodations for all qualified individuals with a disability. If you require assistance or accommodation due to a disability or special need, please contact us at  accommodations@paloaltonetworks.com.Palo Alto Networks is an equal opportunity employer. We celebrate diversity in our workplace, and all qualified applicants will receive consideration for employment without regard to age, ancestry, color, family or medical care leave, gender identity or expression, genetic information, marital status, medical condition, national origin, physical or mental disability, political affiliation, protected veteran status, race, religion, sex (including pregnancy), sexual orientation, or other legally protected characteristics.All your information will be kept confidential according to EEO guidelines."
