"ID","Title","Link","Company","Location","Remote","Experience","EmploymentType","DatePosted","RoleDescription"
3034324,"Principal Product Manager (AI Security)","https://jobs.smartrecruiters.com/PaloAltoNetworks2/744000062293576-principal-product-manager-ai-security-","Palo_Alto_Networks","Santa Clara","No","Not specified","Full time","2025-06-03T02:04:31.306408Z","Your CareerPalo Alto Networks is building a world-class product management organization and continues to look for top-notch product management talent to expand the team. As the Director of Product Management for AI Runtime Security, you will be responsible for building and scaling our AI Runtime product offering. Our platforms represent the foundation of our network security, cloud, and AI security offerings,  providing you an opportunity to define the future of the AI security industry by solving key problems for our customers and reestablishing whats possible in this emerging space.To be successful in this position you must possess a combination of strong technical skills, analytical skills, as well as a passion for driving enterprise AI Security while bridging customer business requirements with key market trends. You must be comfortable with frequent interaction with customers, prospects, and industry analysts presenting and explaining our security solution while understanding and articulating their requirements. You have a track record of success in leading focused, tightly-knit product teams, have delivered on product commitments in working closely with engineering leadership, and have successfully developed and articulated your vision, product strategy, and product plans to the companys leadership.Your ImpactCloud Networking and Security Domain Expertise - Deeply understands cloud application architectures, network and AI threat landscape and is seen as a strategic advisor for cross functional teams.  Ability to correlate technical design patterns and bring unique and deep customer insights to eng teams to build highly differentiated products.
 Execution - Achieve desired outcomes in fast paced environments within stipulated timelines.  Resilience when faced with challenges and a high bias for action to ensure the team stays on track for set goals.
 Data-Driven Decision Making - Utilize data analytics to monitor and analyze operational metrics, identifying trends, anomalies, and areas for improvements that will influence the software firewall / AI Runtime security Product Roadmap
Go-to Market Expertise - Engage with the product marketing team and help them develop compelling messaging. Proactively drives holistic product positioning and product launch plans that includes contributing to high quality customer pitch decks, whitepapers, demos, sales enablement material etcYour Experience Experience - Proven experience in product management, preferably within the cloud network and AI/ML driven products.Analytical Skills - Strong analytical and problem-solving skills, with a track record of using data to drive decisionsTechnical Acumen - Experience with cloud and networking enterprise products/platforms is required.  Experience with network security and AI/ML powered solutions for an enterprise platform is a big plus.Communication - Excellent communication and interpersonal skills, with the ability to effectively collaborate with technical and business stakeholdersLeadership - Demonstrated ability to lead cross-functional teams and drive initiatives in a dynamic, fast-paced environmentEducation - Bachelor's degree in Engineering - advanced degree or relevant certifications are a plus or equivalent military experienceTo stay ahead of the curve, its critical to know where the curve is, and how to anticipate the changes were facing. For the fastest-growing cybersecurity company, the curve is the evolution of cyberattacks and the products and services that proactively address them. Our Product Management Team helps us do just that. Our organization and employees are committed to changing as rapidly as our industrys threats do, and to do that, we need creative product teams to address emerging cyber threats. They provide behind-the-scenes support for our products by being a source of information on our products for our systems engineers, staying on top of the environment we sell in, and helping to implement product-wide technical solutions based on our clients feedback and needs. As threats and technology evolve, we stay ahead to accomplish our mission.Compensation Disclosure The compensation offered for this position will depend on qualifications, experience, and work location. For candidates who receive an offer at the posted level, the starting base salary (for non-sales roles) or base salary + commission target (for sales/commissioned roles) is expected to be between $231000 - $317000/YR. The offered compensation may also include restricted stock units and a bonus. A description of our employee benefits may be found here.Our Commitment

Were problem solvers that take risks and challenge cybersecuritys status quo. Its simple: we cant accomplish our mission without diverse teams innovating, together.We are committed to providing reasonable accommodations for all qualified individuals with a disability. If you require assistance or accommodation due to a disability or special need, please contact us at  accommodations@paloaltonetworks.com.Palo Alto Networks is an equal opportunity employer. We celebrate diversity in our workplace, and all qualified applicants will receive consideration for employment without regard to age, ancestry, color, family or medical care leave, gender identity or expression, genetic information, marital status, medical condition, national origin, physical or mental disability, political affiliation, protected veteran status, race, religion, sex (including pregnancy), sexual orientation, or other legally protected characteristics.Our Commitment

Were problem solvers that take risks and challenge cybersecuritys status quo. Its simple: we cant accomplish our mission without diverse teams innovating, together.We are committed to providing reasonable accommodations for all qualified individuals with a disability. If you require assistance or accommodation due to a disability or special need, please contact us at  accommodations@paloaltonetworks.com.Palo Alto Networks is an equal opportunity employer. We celebrate diversity in our workplace, and all qualified applicants will receive consideration for employment without regard to age, ancestry, color, family or medical care leave, gender identity or expression, genetic information, marital status, medical condition, national origin, physical or mental disability, political affiliation, protected veteran status, race, religion, sex (including pregnancy), sexual orientation, or other legally protected characteristics.All your information will be kept confidential according to EEO guidelines.
Is role eligible for Immigration Sponsorship?: Yes"
3034323,"Major Account Manager - Healthcare","https://jobs.smartrecruiters.com/PaloAltoNetworks2/744000062359675-major-account-manager-healthcare","Palo_Alto_Networks","Wellington","No","Not specified","Full time","2025-06-03T02:04:31.306424Z","Your CareerThe Major Account Manager partners with our Healthcare customers in New Zealand to secure their entire digital experience. Youre motivated by the desire to solve critical challenges facing our customers secure environment, so youre prepared to connect them with a solution for every stage of threat prevention.  This role is a significant driver of company revenue and growth. As an experienced and dynamic sales professional, youre responsible for leading and driving sales engagements. We know the SASE opportunity is massive. Our solutions are best-in-breed and customers need a trusted cybersecurity partner who can create a truly zero trust based security architecture. Our customers are looking to us to create critical transformations and our portfolio of solutions will help us do that.Your ImpactAs a Major Account Manager,  you will drive and orchestrate large complex sales cycles and work with our internal partners and teams to best serve the customerYour consultative selling experience will identify business challenges and create solutions for prospects and our customersUnderstand the competitive landscape and customer needs so you can effectively position the portfolio of Palo Alto Networks solutionsCreate clear goals and complete accurate forecasting through developing a detailed territory planLeverage prospect stories to create a compelling value proposition with insights into value for that specific accountStay updated on industry news and trends, and how they affect Palo Alto Networks products and servicesTravel as necessary within your territory, and to company-wide meetingsYour Experience Experience and networks in the Healthcare industry in New Zealand is highly desirableExperience and knowledge of SaaS-based architectures, ideally in a networking and/or security industry - SASE technology is preferredDemonstrated experience selling complex solutions, value selling, and/or consultative sales techniquesTechnical aptitude for understanding how technology products and solutions solve business problemsIdentifies problems, reviews data, determines the root causes, and provides scalable solutionsCultivate relationships with our channel partners to bring channel-centric go-to-market approach for our customersDemonstrates in depth knowledge of the full sales cycle and the ability to follow a structured sales processAbility to take a holistic approach to problem solving by understanding the bigger picture, and considering complex interrelationships and outcomesExcellent time management skills, and work with high levels of autonomy and self-directionThe TeamOur sales team members work hand-in-hand with large organizations around the world to keep their digital environments protected. We educate, inspire, and empower our potential clients in their journey to security.As part of our sales team, you are empowered with unmatched systems and tools, constantly updated research and sales libraries, and a team built on joint success. You wont find someone at Palo Alto Networks that isnt committed to your success  with everyone pitching in to assist when it comes to solutions selling, learning, and development. As a member of our sales team, you are motivated by a solutions-focused sales environment and find fulfillment in working with clients to resolve incredibly complex cyberthreats.Our Commitment

Were problem solvers that take risks and challenge cybersecuritys status quo. Its simple: we cant accomplish our mission without diverse teams innovating, together.We are committed to providing reasonable accommodations for all qualified individuals with a disability. If you require assistance or accommodation due to a disability or special need, please contact us at  accommodations@paloaltonetworks.com.Palo Alto Networks is an equal opportunity employer. We celebrate diversity in our workplace, and all qualified applicants will receive consideration for employment without regard to age, ancestry, color, family or medical care leave, gender identity or expression, genetic information, marital status, medical condition, national origin, physical or mental disability, political affiliation, protected veteran status, race, religion, sex (including pregnancy), sexual orientation, or other legally protected characteristics.All your information will be kept confidential according to EEO guidelines."
3034322,"MDR Analyst","https://jobs.smartrecruiters.com/PaloAltoNetworks2/744000062363055-mdr-analyst","Palo_Alto_Networks","Bangalore","No",3,"Full time","2025-06-03T02:04:31.306439Z","Your CareerWe are seeking a driven problem solver to join our Unit 42 MDR team. Our team is responsible for customers internal security monitoring, threat hunting and incident response. As a MDR Analyst, we will rely on you to detect and respond to cyber incidents facing customers internal business. The ideal candidate is a quick learner and good communicator who will be able to follow established processes for analyzing threat alerts that fire from our Cortex XDR. The candidate should be a creative thinker who takes pride in solving tough problems.Your ImpactJoin a new emerging team who is going to be part of Palo Altos Unit 42, Working closely with global customers providing the best security in the market Own an incident lifecycle from outbreak to full remediation Provide critical feedback to the different product, research and engineering and threat hunting teams to help improve the products for the entire Palo Alto Networks customer baseWork closely with Security Research, Threat Intelligence and Threat Hunting teams to remediate and detect new emerging threatsThis position is a rotational Shift includes night Shifts as-well (Sunday - Friday Evening &amp; Saturday Evening)Your Experience 3+ years of experience in a multi tiered SOC/IR is a must Experienced with Technologies such as EDR, SIEM, SOAR, FW A well established familiarity with attack trends and vectors Excellent written and oral communication skills in English Some degree of Malware Analysis or equivalent military experience - An advantage CEH / CompTIA CYSA+ certifications - An advantage Hands-on experience with Cortex XSOAR or Cortex XDR - An advantageThe TeamThe team youll lead helps protect customers by identifying the most sophisticated &amp; stealthy attacks in their environment. The team does so by leveraging the Cortex product suite as well as unique tools, methodologies and techniques. Cortex provides enterprise-scale detection and response that runs on integrated endpoint, network and cloud data  reduce the noise and focus on real threats. This team works closely with the different product teams and helps improve each and every product by providing first-hand insights into how the product is used and how it can perform even better. Our Commitment

Were problem solvers that take risks and challenge cybersecuritys status quo. Its simple: we cant accomplish our mission without diverse teams innovating, together.We are committed to providing reasonable accommodations for all qualified individuals with a disability. If you require assistance or accommodation due to a disability or special need, please contact us at  accommodations@paloaltonetworks.com.Palo Alto Networks is an equal opportunity employer. We celebrate diversity in our workplace, and all qualified applicants will receive consideration for employment without regard to age, ancestry, color, family or medical care leave, gender identity or expression, genetic information, marital status, medical condition, national origin, physical or mental disability, political affiliation, protected veteran status, race, religion, sex (including pregnancy), sexual orientation, or other legally protected characteristics.All your information will be kept confidential according to EEO guidelines.
Is role eligible for Immigration Sponsorship? No. Please note that we will not sponsor applicants for work visas for this position."
3034321,"Business Systems Analyst, Planning","https://jobs.smartrecruiters.com/PaloAltoNetworks2/744000062373415-business-systems-analyst-planning","Palo_Alto_Networks","Remote","Yes",2,"Full time","2025-06-03T02:04:31.306454Z","Your CareerThis position will be responsible for building, managing, and maintaining new and existing model infrastructures in the Sales Planning tool, for example Anaplan, Pigment, or equivalent. This position will report directly to our Manager of Business Systems for Sales Planning, and the broader business community, to modify models and dashboards within the system.  The primary focus will be to work on developing requirements for any proposed changes to the system or any other technical properties. As a Model Builder, you will partner with key stakeholders in various teams, including our Global Planning Organization, Theatre Sales Operations Teams, and Strategic Analytics Team to drive project execution from discovery through closure. The ideal candidate should be comfortable working in a team and a matrix environment. This position works across department and functional lines on a variety of programs that range in scope, risk and complexity with an eye toward continuous improvement.Your ImpactWork with other team members to translate existing solutions, complex spreadsheets and business problems into elegant, intuitive multi-dimensional modelsModify existing models as part of a connected solution, optimization, or to incorporate new functionalityProvide candid, meaningful feedback and progress updates in a timely manner to the Business Partner and teamDevelop model documentationParticipate in data integration and migration solutionsLead UAT testing and deploymentMaintain Opportunity Model infrastructure for developed models and make changes based on line of business feedbackBuild and maintain new models for future phases of the system implementationLead data stewardship efforts across source systems and PigmentLiaison with multiple teams that include Sales Operations, IT teams and Finance and Operations usersConduct administrative tasks as needed associated with the Pigment platformResearch data questions that arise from regular usage of the platformUser support on calculations/logic to address any questions that ariseIdentify business requirements and build user stories to support enhancements for the platformTraining new users on the Pigment platformYour Experience A bachelor's degree in Finance, Accounting, MIS or related field or equivalent military experience requiredMinimum 2 years experience in Model building / Development for Pigment or AnaplanLevel 2 , Level 3 Certification in Anaplan or Pigment Certification (preferred) Excellent Communication and Prioritization skillsAdvanced proficiency in Microsoft Excel and experience in efficiently designing and maintaining complex modelsFamiliarity with basic data integration scripting concepts and ETL technologies preferredDemonstrated knowledge of a formal system implementation methodology  requirements gathering, design, build/test and deploy (Agile methodology preferable)Experience building models in a Sales environment strongly preferred Strong understanding of data integration (inbound and outbound)Experience with Salesforce or other sales systems and tools is a plusPassion for business analytics, modeling and planningExcellent problem solving, analytical, and communication skillsDesire to work with a truly dynamic and exciting team, with a roll-up your sleeves approachOur Commitment

Were problem solvers that take risks and challenge cybersecuritys status quo. Its simple: we cant accomplish our mission without diverse teams innovating, together.We are committed to providing reasonable accommodations for all qualified individuals with a disability. If you require assistance or accommodation due to a disability or special need, please contact us at  accommodations@paloaltonetworks.com.Palo Alto Networks is an equal opportunity employer. We celebrate diversity in our workplace, and all qualified applicants will receive consideration for employment without regard to age, ancestry, color, family or medical care leave, gender identity or expression, genetic information, marital status, medical condition, national origin, physical or mental disability, political affiliation, protected veteran status, race, religion, sex (including pregnancy), sexual orientation, or other legally protected characteristics.All your information will be kept confidential according to EEO guidelines."
3029239,"Sr Network Engineer","https://jobs.smartrecruiters.com/PaloAltoNetworks2/744000062099085-sr-network-engineer","Palo_Alto_Networks","Tel Aviv-Yafo","No",5,"Full time","2025-06-03T02:04:31.306471Z","Your CareerAs an IT Network Engineer at Palo Alto Networks, you will be part of a team supporting our corporate network, data centers, engineering labs and cloud services network infrastructure. You will be a key contributor in the daily network operations and will be an escalation point for our Service Desk, Operations, DevOps and engineering.Your ImpactDeploy and manage LAN, WAN, and WLAN networks to meet business objectivesMaintain detailed documentation of network configurations, topologies, and processesIdentify, diagnose, and resolve network issues efficientlyCollaborate with global IT and security team to mitigate network vulnerabilitiesParticipate in incident response to resolve escalated via on-call dutiesProactively monitoring, troubleshooting, and improving network infrastructureAct as an escalation point and mentor for our Tier 1 team membersLead local and global projects from the initiation to implementation in alignment with global IT policiesYour Experience 5+ years of experience as a network engineer in large enterprises supporting LAN, WLAN and WANIn depth understanding of TCP/IP and Layer2 switching protocolsComprehensive understanding of all routing protocols, e.g. BGP and OSPFHands on experience in deploying, maintaining and troubleshooting firewalls (preferably Palo Alto Networks)Experience using debugging tools (e.g. Wireshark) and monitor tools (e.g. Datagod)Being familiar with Cloud base environments, GCP, AWS and AzureAnalytical problem solving and troubleshooting ability - exceptionally organized, self-motivated individual that can juggle across multiple prioritiesSuperb communication skills, including the ability to write network and security documentation, policies, and guidelinesAbility to work nights and weekends as part of 24/7 on-call supportPreferred certifications CCIE, CCSP, CCDP, CCNPThe TeamWorking at a high-tech cybersecurity company within Information Technology is a once-in-a-lifetime opportunity. Youll join the brightest minds in technology, creating, building, and supporting tools and enabling our global teams on the front line of defense against cyberattacks. Were connected by one mission but driven by the impact of that mission and what it means to protect our way of life in the digital age. Join a dynamic and fast-paced team of people who feel excited by the prospect of a challenge and feel a thrill at resolving technical gaps that inhibit productivity.Our Commitment

Were problem solvers that take risks and challenge cybersecuritys status quo. Its simple: we cant accomplish our mission without diverse teams innovating, together.We are committed to providing reasonable accommodations for all qualified individuals with a disability. If you require assistance or accommodation due to a disability or special need, please contact us at  accommodations@paloaltonetworks.com.Palo Alto Networks is an equal opportunity employer. We celebrate diversity in our workplace, and all qualified applicants will receive consideration for employment without regard to age, ancestry, color, family or medical care leave, gender identity or expression, genetic information, marital status, medical condition, national origin, physical or mental disability, political affiliation, protected veteran status, race, religion, sex (including pregnancy), sexual orientation, or other legally protected characteristics.All your information will be kept confidential according to EEO guidelines."
