"ID","Title","Link","Company","Location","Remote","Experience","EmploymentType","DatePosted","RoleDescription"
3522018,"Solution Consultant BFSI","https://jobs.smartrecruiters.com/PaloAltoNetworks2/744000079139055-solution-consultant-bfsi","Palo_Alto_Networks","New Delhi","No",10,"Full time","2025-08-31T02:00:55.429344Z","Your CareerThe Solutions Consultant is the evolution of the traditional Sales Engineering role, aligning how we best serve our customers in understanding their environment, providing solution guidance and ensuring value realization in their investment with Palo Alto Networks. As a Solutions Consultant you provide technical leadership and expertise and guidance in your customers security transformation journey. You will play a key role in defining technical solutions that secure a customers key business imperatives and ensuring value realization of their investment with Palo Alto Networks. You evangelize our industry leadership in on-prem, cloud, and security operations services that establish PANW as your customers cybersecurity partner of choice. You will play an important role in understanding BFSI vertical, technology landscape, business challenges etc &amp; then mapping it with Palo Alto Networks solutions. Your ImpactBecome a Domain Expert: Develop a deep understanding of the BFSI vertical's operational nuances, including its core products, processes, and regulatory landscape.Stay Ahead of the Curve: Continuously track and understand emerging trends, technological shifts, and security threats within the BFSI industry.Translate Challenges into Solutions: Partner with customers to understand their unique business challenges and security imperatives. Then, strategically align Palo Alto Networks' solutions to deliver tangible business value, helping them achieve their security transformation goals.Serve as a Trusted Advisor: Act as the primary technical point of contact, providing expert guidance and technical leadership throughout the customer's journey. You'll ensure they fully realize the value of their investment with Palo Alto Networks.Curiosity is core to the Solutions Consultant role, and you see complex problems as opportunities to learn and deliver innovative solutions! You define your impact by:Meeting and exceeding sales quotas by building and implementing strategic, technical account plans that target cross-platform solutions.Your ability to position, demonstrate and create high level designs across the entire PANW portfolio based on customer business needsConducting discovery to understand and articulate the key technical, operational, and commercial imperatives of your prospects and customersWorking closely with Professional Services, Customer Success and Specialist teams to ensure overall customer implementation and adoption of solutions.Demonstrating strong communication skills and the ability to influence through effective presentations and customer-specific demos, technical engagements, and workshopsLeading successful technical validation efforts based on best practices to ensure technical win in assigned opportunities.Orchestrating supporting resources (Specialists, Channel Resources, Customer Support) to ensure a one-team approach that demonstrates a cohesive strategyPromoting end-to-end solutions that include PANW and/or partner professional services to ensure customers realize business value soonerUnderstanding the competitive landscape and effectively differentiating our leadershipContinuously investing in yourself to develop technical and professional skills that drive your ever-increasing contributions to success of our customers while actively participating within the Solutions Consultant community and at industry events(OT) - Identifying technical stakeholders and cultivating relationships with key personas to build and drive a security architecture transformation roadmap
 
 Your ExperienceUnderstanding of Network Security, SecOps (SIEM, SOAR, XDR etc), Public Cloud Infrastructure, Private Cloud Infrastructure, Data Centers, Application Modernization, SASE &amp; Cyber Security related technologies.10+ years experience doing presales role and solid exposure to key large BFSI accounts in the West. Delivering cybersecurity solutions that solve technical challenges and influence new business initiativesInfluencing and gaining buy-in from key stakeholders, either in a customer-facing or internal role; prior experience in a pre-sales role is idealCreating and delivering technical presentations, workshops, or technical validation engagementsContinuous Collaboration across multiple functions internally &amp; externally to achieve the sales objectivesExperience in selling, designing, competing, implementing, or managing one or more of the following solutions: Network Security, SASE, SaaS, CNAPP and/or SOC Transformation TechnologiesPartnering with system integrators &amp; professional services functions to ensure successful implementation and adoption of sold solutionsPartnering with Customer success function to ensure continuous consumption &amp;  improved adoption for the contract period.Complex sales involving long sales processes with multiple buying centers and multi-product solutions are preferredGlobal &amp; Independent Cybersecurity CertificationsProficient in EnglishThe TeamOur Solutions Consultant team members work hand-in-hand with large organizations around the world to keep their digital environments protected. We educate, inspire,and empower our potential clients in their journey to transform their security architectures. You are empowered with unmatched systems and tools and a team built on joint success. You wont find someone at Palo Alto Networks that isnt committed to your success  with everyone pitching in to assist when it comes to solutions selling, learning, and development. Our Solutions Consulting community is driven by the mission to be our customers cybersecurity partner of choice, protecting their digital way of life.Our CommitmentWere trailblazers that dream big, take risks, and challenge cybersecuritys status quo. Its simple: we cant accomplish our mission without diverse teams innovating, together.We are committed to providing reasonable accommodations for all qualified individuals with a disability. If you require assistance or accommodation due to a disability or special need, please contact us at accommodations@paloaltonetworks.com.Palo Alto Networks is an equal opportunity employer. We celebrate diversity in our workplace, and all qualified applicants will receive consideration for employment without regard to age, ancestry, color, family or medical care leave, gender identity or expression, genetic information, marital status, medical condition, national origin, physical or mental disability, political affiliation, protected veteran status, race, religion, sex (including pregnancy), sexual orientation, or other legally protected characteristics.   Our Commitment

Were problem solvers that take risks and challenge cybersecuritys status quo. Its simple: we cant accomplish our mission without diverse teams innovating, together.We are committed to providing reasonable accommodations for all qualified individuals with a disability. If you require assistance or accommodation due to a disability or special need, please contact us at  accommodations@paloaltonetworks.com.Palo Alto Networks is an equal opportunity employer. We celebrate diversity in our workplace, and all qualified applicants will receive consideration for employment without regard to age, ancestry, color, family or medical care leave, gender identity or expression, genetic information, marital status, medical condition, national origin, physical or mental disability, political affiliation, protected veteran status, race, religion, sex (including pregnancy), sexual orientation, or other legally protected characteristics.All your information will be kept confidential according to EEO guidelines."
3519568,"Senior Renewal Sales Rep","https://jobs.smartrecruiters.com/PaloAltoNetworks2/744000078999035-senior-renewal-sales-rep","Palo_Alto_Networks","Singapore","No",3,"Full time","2025-08-31T02:00:55.429424Z","Your CareerAs a Strategic Relationship Representative, you will partner closely with internal and external partners to accomplish your sales objectives. Your partnership, expertise, and understanding of the evolution of cybersecurity sets you apart, and you chase value driven impact for our clients. The prospect of solving complex cyber challenges excites you, and building recommendations for those challenges for unique sets of customers brings you fulfillment. Your ImpactManage all maintenance and subscription renewals in your territoryQuote generation, including creation of coterminous quotesUpsell to multiyear renewals by positioning value to customerDiligent follow up with Regional Sales Managers,, channel partners and end users to bring in renewals before expirationSubmit accurate and timely forecast through ClariWork within existing renewals database and collaborate with Sales Operations and IT to drive process and systems improvements and best practicesYour Experience 3+ Years experience in IT Sales to enterprise customersKnowledge in working with Channel PartnersTrack record of achieving sales goals and objectivesExperience using Salesforce.com and ClariEnthusiastic, driven and confident: ability to clearly and persuasively articulate the companys mission, product and business opportunityPrevious experience, and ability to learn new technology quickly, adapt to changing needs and possess strong analytical skillsAbility to quickly build productive relationships in a fast-paced, performance-driven environmentThe TeamPalo Alto Networks has brought technology to market that is reshaping the cybersecurity threat and protection landscape. Our ability to protect digital transactions is limited only by our ability to establish relationships with our potential customers and help them understand how our products can protect their environments. This is where our sales teams come in. Our sales team members work together with large organizations to keep their digital information safe. Our passionate sales teams educate, inspire, and empower our potential clients.As part of our sales team, you are empowered with unmatched systems and tools, constantly updated research and sales libraries, and a team built on joint success. You wont find someone at Palo Alto Networks that isnt committed to your success  with everyone pitching in to assist when it comes to solutions selling, learning, and development. As a member of our sales team, you are motivated by a solutions-focused sales environment and find fulfillment in working with clients to resolve incredibly complex cyberthreats. Youre an amazing sales person  youre just looking for something more substantial and challenging as your next step.Our Commitment

Were problem solvers that take risks and challenge cybersecuritys status quo. Its simple: we cant accomplish our mission without diverse teams innovating, together.We are committed to providing reasonable accommodations for all qualified individuals with a disability. If you require assistance or accommodation due to a disability or special need, please contact us at  accommodations@paloaltonetworks.com.Palo Alto Networks is an equal opportunity employer. We celebrate diversity in our workplace, and all qualified applicants will receive consideration for employment without regard to age, ancestry, color, family or medical care leave, gender identity or expression, genetic information, marital status, medical condition, national origin, physical or mental disability, political affiliation, protected veteran status, race, religion, sex (including pregnancy), sexual orientation, or other legally protected characteristics.All your information will be kept confidential according to EEO guidelines."
3519567,"Technical Transformation Specialist (Unit 42)","https://jobs.smartrecruiters.com/PaloAltoNetworks2/744000079001895-technical-transformation-specialist-unit-42-","Palo_Alto_Networks","Remote","Yes","Not specified","Full time","2025-08-31T02:00:55.429444Z","Your CareerOur leading consultancy seeks an experienced and innovative Technical Transformation Specialist (Technical Director), to identify, craft and oversee high-impact transformation programmes across our most important EMEA clients.This role requires a trusted technical advisor who can bridge the gap between strategic vision and technical execution  collaborating with vCISOs, Unit 42 engagement leads, and client stakeholders to design and deliver transformation blueprints, platform adoption strategies, and pragmatic implementation roadmaps.Youll work at multiple levels: partnering with Unit 42 peers and client senior decision makers to influence transformation direction, embedding into delivery teams to guide execution, and engaging in activities to elevate Unit 42s voice in the market.You bring a deep understanding of Palo Alto Networks technologies, especially Cortex and Prisma, and experience in applying them within large-scale transformation programmes. This role blends delivery, technical advisory, thought leadership, and enablement  ensuring our clients achieve measurable security outcomes while unlocking the benefits of a platform adoption strategy.Your ImpactClient Engagement and Programme Delivery:Embed into key Unit 42 client engagements to design and deliver security transformation roadmapsPartner with vCISOs and engagement leads to translate high-level strategy into actionable, technical programmesContribute to blueprint generation, architecture reviews, and post-incident transformation designIdentify opportunities for platform adoption, particularly across Cortex, Prisma, and NGFW portfoliosCollaborate across presales, professional services, and product teams to ensure a unified client experienceThought Leadership &amp; Industry Collaboration:Represent Unit 42 and Palo Alto Networks in technical workshops, industry roundtables, or conferencesMaintain expertise in AI, cloud security, Zero Trust, SOC transformation, and platformization strategiesCo-author technical thought leadership content, micro-briefs, and transformation guides for clients.Serve as an internal technical SME, supporting GTM campaigns and enablement initiatives across EMEATechnical Excellence &amp; Enablement:Ensure transformation recommendations are pragmatic, achievable, and aligned to client operating realitiesMaintain awareness of industry best practices, emerging technologies, and regulatory shifts impacting transformationProvide technical mentoring and knowledge sharing across Unit 42 teams to strengthen delivery capabilityYour Experience Proven experience delivering large-scale security transformation programmes in enterprise environmentsHands-on expertise with Palo Alto Networks technologies, particularly Cortex and Prisma; NGFW experience highly valuedBackground in architecture, presales, professional services, or platform strategyStrong understanding of cloud-native security, AI applications, Zero Trust, and SOC modernisationSkilled communicator  able to engage confidently with both technical teams and senior executivesExperience in the EMEA market, with understanding of local delivery and sales ecosystemsFluent in English, with German, Spanish, or Italian as strong differentiatorsHighly DesiredRecognised expertise in a specialist technical topic and the ability to present it at industry events.Professional certifications (e.g., CISSP, CISM, CCSK, PCNSE).Experience working within multi-provider, multi-year transformation engagements.The TeamUnit 42 brings together our world-renowned threat researchers with an elite team of security consultants to create an intelligence-driven, response ready organization. The Unit 42 Threat Intelligence team provides threat research that enables security teams to understand adversary intent and attribution, while enhancing protections offered by our products and services to stop advanced attacks. As threats escalate, Unit 42 is available to advise customers on the latest risks, assess their readiness, and help them recover when the worst occurs.Our Commitment

Were problem solvers that take risks and challenge cybersecuritys status quo. Its simple: we cant accomplish our mission without diverse teams innovating, together.We are committed to providing reasonable accommodations for all qualified individuals with a disability. If you require assistance or accommodation due to a disability or special need, please contact us at  accommodations@paloaltonetworks.com.Palo Alto Networks is an equal opportunity employer. We celebrate diversity in our workplace, and all qualified applicants will receive consideration for employment without regard to age, ancestry, color, family or medical care leave, gender identity or expression, genetic information, marital status, medical condition, national origin, physical or mental disability, political affiliation, protected veteran status, race, religion, sex (including pregnancy), sexual orientation, or other legally protected characteristics.All your information will be kept confidential according to EEO guidelines."
3519566,"Senior Software Infrastructure Engineer (Cortex Cloud)","https://jobs.smartrecruiters.com/PaloAltoNetworks2/744000079017716-senior-software-infrastructure-engineer-cortex-cloud-","Palo_Alto_Networks","Tel Aviv-Yafo","No",7,"Full time","2025-08-31T02:00:55.429479Z","Your CareerWe are looking for a highly technical individual to join our Cortex XDR Agent core team as a Principal Automation Engineer. The team builds the foundation of the Cortex XDR endpoint agent, from security modules to server communication and task management.
We believe automation tests are a critical part of the product release cycle. As an Principal Automation Engineer, you will be responsible to design and maintain the automation infrastructure. You will be involved in feature and test designs, and work closely with developers, product management and other QA members. Your ImpactBe a part of highly motivated and skilled engineering teamDevelop on all the leading platforms both on End points  Windows, Mac, Linux And Cloud  AWS (Amazon web services), GCP (Google cloud platform), Microsoft Azure and K8sLead technical decisions within the group, be part of automation architectural designs, maintain and develop automation knowledge base.Collaborate closely with QA and Dev teams, DevOps, and product managers.Your Experience 7+ years of experience in automation infrastructure development in PythonDeep Knowledge of object oriented programming design conceptsSkilled in diagnosing and solving complex problems while providing detailed technical analysisFamiliarity with cloud environments (GCP...) and containerization (Docker, Kubernetes)Knowledge of continuous integration, automated tools, and best practices in automationSecurity background in general and security programs knowledge in particular - an advantageExcellent communication and interpersonal skills in both Hebrew and EnglishSelf-motivated learner with a strong ability to adapt to new technologies and methodologies quickly.Attention to details and high behavioral standardsThe TeamOur engineering team is at the core of our products and connected directly to the mission of preventing cyberattacks. We are constantly innovating-challenging the way we, and the industry, think about cybersecurity. Our engineers don't shy away from building products to solve problems no one has pursued before.
We define the industry instead of waiting for directions. We need individuals who feel comfortable in ambiguity, excited by the prospect of a challenge, and empowered by the unknown risks facing our everyday lives that are only enabled by a secure digital environment. Our Commitment

Were problem solvers that take risks and challenge cybersecuritys status quo. Its simple: we cant accomplish our mission without diverse teams innovating, together.We are committed to providing reasonable accommodations for all qualified individuals with a disability. If you require assistance or accommodation due to a disability or special need, please contact us at  accommodations@paloaltonetworks.com.Palo Alto Networks is an equal opportunity employer. We celebrate diversity in our workplace, and all qualified applicants will receive consideration for employment without regard to age, ancestry, color, family or medical care leave, gender identity or expression, genetic information, marital status, medical condition, national origin, physical or mental disability, political affiliation, protected veteran status, race, religion, sex (including pregnancy), sexual orientation, or other legally protected characteristics.Our Commitment

Were problem solvers that take risks and challenge cybersecuritys status quo. Its simple: we cant accomplish our mission without diverse teams innovating, together.We are committed to providing reasonable accommodations for all qualified individuals with a disability. If you require assistance or accommodation due to a disability or special need, please contact us at  accommodations@paloaltonetworks.com.Palo Alto Networks is an equal opportunity employer. We celebrate diversity in our workplace, and all qualified applicants will receive consideration for employment without regard to age, ancestry, color, family or medical care leave, gender identity or expression, genetic information, marital status, medical condition, national origin, physical or mental disability, political affiliation, protected veteran status, race, religion, sex (including pregnancy), sexual orientation, or other legally protected characteristics.All your information will be kept confidential according to EEO guidelines."
