"ID","Title","Link","Company","Location","Remote","Experience","EmploymentType","DatePosted","RoleDescription"
3040885,"Domain Consultant - Network Security","https://jobs.smartrecruiters.com/PaloAltoNetworks2/744000062681015-domain-consultant-network-security","Palo_Alto_Networks","Monterrey","Yes",6,"Full time","2025-06-03T02:04:31.305798Z","Your Career

As a domain consultant for network security transformation, you provide technical expertise and guidance in customers' network security and zero trust journey.  You will be key in defining technical solutions that secure a customers key business imperatives.  You evangelize our industry leadership in on-prem, cloud, and security services that establish Palo Alto Networks as a customers cybersecurity partner.

Your ImpactCollaborate with sales teams to recommend and develop customer solutions within your assigned specialization.Present to customers as our expert at all levels in the customer hierarchy, from practitioner to senior leadership.Lead and support customer demonstrations that showcase our unique value proposition.Responsible for prospective customers and partners' Technical Validation projects based on best practices to ensure technical win in assigned opportunities.Architect solutions that will help our customers strengthen and simplify their security postureDocument high-level design and key use cases to ensure proper implementation and value realization of Palo Alto Networks solutionsLead conversations about industry trends and emerging changes to the security landscape.Responsible for discussing and highlighting product alignment with customer requirements and differentiationAs the main technical point of contact for Network Security, you will assist and collaborate to respond effectively to RFIs/RFPs.Position Palo Alto Networks or Partner delivered services as appropriate to ensure proper implementation and value realization of Palo Alto Networks solutionsDiscuss, with credibility, competitive offers in the marketplace and position ours as the best alternativeDistinguished by additional specialized knowledge in breadth and/or depth. Your Experience6+ years experience in pre-sales/sales engineering within Zero Trust, Networking, Network Security, SaaS Security or SSE/SASE Experience with L2-L4 Networking (L2 Switching architectures including Spanning Tree, VLANs/trunking, IP routing including static routes, OSPF and BGP, route re-distribution, L4 Load-balancing)Outstanding customer communication and problem-solving skillsExperience in working with customers, demonstrating problem-solving skills and a can-do attitudeSolid understanding of NGFW, Network Security, SASE, SD-WAN, CASB, Proxy, DLP and BYOD SolutionsAdvanced knowledge of On-Premise and Cloud-Delivered Network Security Technologies This is a field sales position where travel requirements may be required to support in person customer meetings, please discuss with the recruiter on the specifics for this position.Proficient in EnglishThe TeamOur Domain Consultant team members work hand-in-hand with organizations around the world to keep their digital environments protected. We educate, inspire, and empower our potential clients in their journey to security. You are empowered with unmatched systems and tools and a team built on joint success. You wont find someone at Palo Alto Networks that isnt committed to your success  with everyone pitching in to assist when it comes to solutions selling, learning, and development. Our Solutions Consulting community is driven by the mission to be our customers cybersecurity partner of choice, protecting their digital way of life.Our Commitment

Were problem solvers that take risks and challenge cybersecuritys status quo. Its simple: we cant accomplish our mission without diverse teams innovating, together.We are committed to providing reasonable accommodations for all qualified individuals with a disability. If you require assistance or accommodation due to a disability or special need, please contact us at  accommodations@paloaltonetworks.com.Palo Alto Networks is an equal opportunity employer. We celebrate diversity in our workplace, and all qualified applicants will receive consideration for employment without regard to age, ancestry, color, family or medical care leave, gender identity or expression, genetic information, marital status, medical condition, national origin, physical or mental disability, political affiliation, protected veteran status, race, religion, sex (including pregnancy), sexual orientation, or other legally protected characteristics.All your information will be kept confidential according to EEO guidelines.Our Commitment

Were problem solvers that take risks and challenge cybersecuritys status quo. Its simple: we cant accomplish our mission without diverse teams innovating, together.We are committed to providing reasonable accommodations for all qualified individuals with a disability. If you require assistance or accommodation due to a disability or special need, please contact us at  accommodations@paloaltonetworks.com.Palo Alto Networks is an equal opportunity employer. We celebrate diversity in our workplace, and all qualified applicants will receive consideration for employment without regard to age, ancestry, color, family or medical care leave, gender identity or expression, genetic information, marital status, medical condition, national origin, physical or mental disability, political affiliation, protected veteran status, race, religion, sex (including pregnancy), sexual orientation, or other legally protected characteristics.All your information will be kept confidential according to EEO guidelines."
3040435,"Cortex Cloud Sales Specialist (Middle East and Turkey)","https://jobs.smartrecruiters.com/PaloAltoNetworks2/744000062611845-cortex-cloud-sales-specialist-middle-east-and-turkey-","Palo_Alto_Networks","Ankara","Yes",5,"Full time","2025-06-03T02:04:31.305866Z","We are seeking a dynamic and experienced Sales Specialist to drive the growth of our Cortex and Cloud business across the region. The ideal candidate will operate in a high-growth environment at scale, thrive in driving innovation, have a solid background in cybersecurity sales, and a deep understanding of security solutions. They will have a proven track record of developing strong customer relationships and executing strategies that support rapid expansion and success. This role requires a strategic thinker who excels in collaboration with internal teams, engages effectively with customers, and drives revenue growth through the sale of complex solutions.Your Impact:Join the fastest growing team where experience meets cutting-edge solutionsBuild and cultivate strong customer relationships, driving business growth within the region.Partner with the core sales team to align customer strategies and engagements with Cortex and Cloud business objectives.Take full ownership of leading strategic sales campaigns, sales forecasting, utilizing in-depth knowledge of sales cycles from initial contact through procurement.Engage in deep technical discussions beyond standard sales presentations and pitches; while translating complex technical cybersecurity solutions into clear business value propositions for customers.Collaborate closely with cross-functional teams, including sales engineers, to provide tailored customer-centric solutions.Partner with Alliances to develop joint strategies, enhance customer engagement and deliver innovative solutions for existing and prospective clients.Travel domestically as needed to meet with customers and attend key business events.Your Experience 5+ years of field sales experience focusing on key customer accounts and delivering value to Enterprise or Major-level accounts.Extensive platform selling experience in complex sales with multiple buying centers.Experience selling Cybersecurity,  SIEM, EDR or CNAPP (DevSecOps, CloudOps) solutions is highly preferred.Established trusted relationships with CIOs and CISOs with the ability to influence and drive strategic conversationsExpertise in applying complex solution sales methodologies to drive results.Experience working with channel partners and a deep understanding of a channel-centric go-to-market strategy.Demonstrated ability to thrive in a fast-paced, high-growth startup environment while collaborating effectively with sales engineers and cross-functional teams.Experience operating in a continuous adoption, expansion, and upsell sales motion within a matrixed sales organization is preferredWillingness to travel domestically as necessary to meet business needs.The TeamPalo Alto Networks has brought technology to market that is reshaping the cybersecurity threat and protection landscape. Our ability to protect digital transactions is limited only by our ability to establish relationships with our potential customers and help them understand how our products can protect their environments. This is where our sales teams come in. Our sales team members work together with large organizations to keep their digital information safe. Our passionate sales teams educate, inspire, and empower our potential clients.As part of our sales team, you are empowered with unmatched systems and tools, constantly updated research and sales libraries, and a team built on joint success. You wont find someone at Palo Alto Networks that isnt committed to your success  with everyone pitching in to assist when it comes to solutions selling, learning, and development. As a member of our sales team, you are motivated by a solutions-focused sales environment and find fulfillment in working with clients to resolve incredibly complex cyberthreats. Youre an amazing sales person  youre just looking for something more substantial and challenging as your next step.Our Commitment

Were problem solvers that take risks and challenge cybersecuritys status quo. Its simple: we cant accomplish our mission without diverse teams innovating, together.We are committed to providing reasonable accommodations for all qualified individuals with a disability. If you require assistance or accommodation due to a disability or special need, please contact us at  accommodations@paloaltonetworks.com.Palo Alto Networks is an equal opportunity employer. We celebrate diversity in our workplace, and all qualified applicants will receive consideration for employment without regard to age, ancestry, color, family or medical care leave, gender identity or expression, genetic information, marital status, medical condition, national origin, physical or mental disability, political affiliation, protected veteran status, race, religion, sex (including pregnancy), sexual orientation, or other legally protected characteristics.All your information will be kept confidential according to EEO guidelines."
3040434,"Senior Staff Software Engineer QA Engineer (Strata Logging Service)","https://jobs.smartrecruiters.com/PaloAltoNetworks2/744000062614590-senior-staff-software-engineer-qa-engineer-strata-logging-service-","Palo_Alto_Networks","Santa Clara","No",8,"Full time","2025-06-03T02:04:31.305887Z","Your CareerAs a Software Developer in Test, you will design, develop and deliver next generation technologies. You will build, automate, and run performance testing scenarios for our products in virtualized elements.You will participate in design discussions and help make a difference in developing the future direction of our AI/ML software. You will drive the efficiency and reliability of our products by testing them thoroughly to understand potential risks, bugs, or issues, providing an exemplary product experience for our end users. You strive for the best in everything you domeaning you wont rest until the products you work on are at the highest quality. You love hunting for problems within code, seeking issues to correct, and enjoy the challenge of a code-based scavenger hunt that includes testing, providing feedback, and identifying alternative suggestions for our products environment.We are looking for highly technical individuals driven in their desire to get hands-on experience with a wide variety of networking technologies. You'll work closely with our development and product management teams, testing and presenting the results to identify new approaches. 
Your ImpactDesign, develop and execute test automation to test software features on our next-generation security platform as part of our Strata Logging ServiceDevelop and maintain test automation and framework.Develop tools and infrastructure that enable engineers to build, test and release features confidently and continuously.Understand customer configurations. debug, reproduce, verify fixes and add new test cases for issues uncovered in customer deployments.Verify endurance and scale testing to validate robust feature functionality under stress.Work closely with the Software Engineering, Product Management teams during product development from design to release.File bugs and work with development to fix issues seenMix in your creative skills with a focused testing approach to produce the best quality products in cybersecurity  Be involved in a rigorous approach to testing for specifications, assist the team with testing methods or tools for new testingYou will also have the chance to work on different public cloud platforms (AWS, GCP, Azure) to automate cloud orchestration, visualization and alerting mechanismsConfigure, build and expand both Functional and System Testbeds Excellent troubleshooting abilities. Debug issues found during testing and verify bug fixes once they are resolved.Your ExperienceBS or MS in computer science or related technical field.8+ years of related experience as a Systems Test Engineer in networking/cloud technologies4 years of proven experience in leading test strategy Cloud products such as AWS, Google Cloud Platform (GCP), and AzureGood understanding of networking concepts, L2-L7 protocolsBasic understanding of SQL queriesExperience with API and UI automation/testing.Experience with VMWare vsphere Scripting and/or programming with experience in Infrastructure and Tools development in Python.Experience with Unix/Linux OSComfortable with Agile methodologies and working in small and large teamsTesting network security products, preferably with firewalls and intrusion prevention is a plus.Experience in testing container technologies (Docker, Kubernetes) is a plusExperience driving performance test efforts for complex, asynchronous microservice-based systemsA self-starter who is confident and effective when working across distributed teamsExcellent communication and collaborative skillsThe Team Our engineering team is at the core of our products  connected directly to the mission of preventing cyberattacks. We are constantly innovating  challenging the way we, and the industry, think about cybersecurity. Our engineers dont shy away from building products to solve problems no one has pursued before. We define the industry, instead of waiting for directions. We need individuals who feel comfortable in ambiguity, excited by the prospect of a challenge, and empowered by the unknown risks facing our everyday lives that are only enabled by a secure digital environment. Compensation DisclosureThe compensation offered for this position will depend on qualifications, experience, and work location. For candidates who receive an offer at the posted level, the starting base salary (for non-sales roles) or base salary + commission target (for sales/commissioned roles) is expected to be between $176000 - $194,500/YR. The offered compensation may also include restricted stock units and a bonus. A description of our employee benefits may be found hereOur Commitment

Were problem solvers that take risks and challenge cybersecuritys status quo. Its simple: we cant accomplish our mission without diverse teams innovating, together.We are committed to providing reasonable accommodations for all qualified individuals with a disability. If you require assistance or accommodation due to a disability or special need, please contact us at  accommodations@paloaltonetworks.com.Palo Alto Networks is an equal opportunity employer. We celebrate diversity in our workplace, and all qualified applicants will receive consideration for employment without regard to age, ancestry, color, family or medical care leave, gender identity or expression, genetic information, marital status, medical condition, national origin, physical or mental disability, political affiliation, protected veteran status, race, religion, sex (including pregnancy), sexual orientation, or other legally protected characteristics.All your information will be kept confidential according to EEO guidelines.
Is role eligible for Immigration Sponsorship?: Yes"
3039839,"Senior Staff Engineer - MacOS - C/C++ (Global Protect)","https://jobs.smartrecruiters.com/PaloAltoNetworks2/744000062537848-senior-staff-engineer-macos-c-c-global-protect-","Palo_Alto_Networks","Santa Clara","Yes",5,"Full time","2025-06-03T02:04:31.305905Z","Your CareerPrisma AccessTM combines the Internet connectivity/security you need - and delivers it everywhere you need it. Using cutting-edge public and private cloud technologies, it extends the next-generation security protection to all cloud services and to its customers regardless of whether they are on-premise, on remote networks or mobile users. One part of Prisma AccessTM is our GlobalProtect team, which is responsible for securing the network traffic from Customer devices to Prisma AccessTM Cloud. We are seeking an experienced Software Engineer to design, develop and deliver next-generation technologies within our GlobalProtect team. We want passionate engineers who love to code and build great products and who bring new ideas in all facets of software development. We are looking for leaders who take ownership of their areas of focus and who are driven to solve problems at every level. Collaboration and teamwork are at the foundation of our culture and we need engineers who can communicate at a high level and work well with others towards achieving a common goal.Your Experience5+ years of experience in software development with a focus on macOS.2+ years of hands-on experience in macOS systems programming, with a deep understanding of macOS kernel internals, device drivers and system-level programProficiency in C/C++ programming languages, with a strong emphasis on macOS development.Familiarity with Swift or Objective-C is a plus.Knowledge of networking protocols and troubleshooting tools specifically on macOS platforms.Familiarity with macOS frameworks such as System Extensions, Network Extensions, and Endpoint Security Framework is a strong plus.Experience with Win32 SDK for Windows development is a significant advantage.A team player with a can-do attitude, ready to tackle complex problems and eager to learn and grow.Skilled at collaboration and effective communication across multiple teams.M.S./B.S. degree in Computer Science, Electrical Engineering, or equivalent military experience.Preferred QualitiesA fast learner who adapts quickly to new tools and technologies.Enjoys solving challenging problems and working across cross-functional teams.Knowledge of the cybersecurity field.Proven ability to guide and inspire others, fostering a culture of shared ownership and technical excellence.Ability to articulate vision clearly and convincingly, collaborating effectively with diverse teams across functions.We encourage applications from candidates outside of the Santa Clara, California area and offer relocation assistance to help facilitate a smooth transition for the right talent.The TeamOur engineering team is at the core of our products  connected directly to the mission of preventing cyberattacks. We are constantly innovating  challenging the way we, and the industry, think about cybersecurity. Our engineers dont shy away from building products to solve problems no one has pursued before.We define the industry, instead of waiting for directions. We need individuals who feel comfortable in ambiguity, excited by the prospect of a challenge, and empowered by the unknown risks facing our everyday lives that are only enabled by a secure digital environment. Compensation DisclosureThe compensation offered for this position will depend on qualifications, experience, and work location. For candidates who receive an offer at the posted level, the starting base salary (for non-sales roles) or base salary + commission target (for sales/commissioned roles) is expected to be between $164000 - $195000YR The offered compensation may also include restricted stock units and a bonus. A description of our employee benefits may be found here.  Our Commitment

Were problem solvers that take risks and challenge cybersecuritys status quo. Its simple: we cant accomplish our mission without diverse teams innovating, together.We are committed to providing reasonable accommodations for all qualified individuals with a disability. If you require assistance or accommodation due to a disability or special need, please contact us at  accommodations@paloaltonetworks.com.Palo Alto Networks is an equal opportunity employer. We celebrate diversity in our workplace, and all qualified applicants will receive consideration for employment without regard to age, ancestry, color, family or medical care leave, gender identity or expression, genetic information, marital status, medical condition, national origin, physical or mental disability, political affiliation, protected veteran status, race, religion, sex (including pregnancy), sexual orientation, or other legally protected characteristics.All your information will be kept confidential according to EEO guidelines."
