"ID","Title","Link","Company","Location","Remote","Experience","EmploymentType","DatePosted","RoleDescription"
3515256,"Senior Project Manager","https://jobs.smartrecruiters.com/PaloAltoNetworks2/744000078924850-senior-project-manager","Palo_Alto_Networks","Singapore","No",5,"Full time","2025-08-31T02:00:55.429782Z","Your ImpactProject Manage complex delivery engagements across our product portfolio. The role will be part of the Technical Services (TS) organisation within PANW. Daily project management throughout the program life cycle for some of our largest customers.Defining and implementing project and operational governance controls Building and maintaining effective project plans and documentation to maximise delivery efficiency and efficacy. Managing risks and issues from identification through to taking appropriate corrective action in conjunction with the customer and Palo Alto Networks stakeholders.Act as a customers single interface into Palo Alto Networks for Sales, Product Management, Customer Success, Professional Services and Focused Services throughout deployment.Effectively manage and utilise resources across projects in conjunction with Palo Alto Networks Professional and Focused Services.Proactively distribute stakeholder communications internal to Palo Alto Networks and the CustomerSupport Revenue recognition activities through effective forecasting of project milestones, deliverables and planning. Your ExperienceThe Senior project manager must have strong practical experience in project management, which was gained through managing large and complex projects. He or she must have the following:Excellent business communication skills, dealing with senior management of internal and external stakeholdersGood knowledge and handling of project and program management methodology and techniquesGood understanding of the wider objectives of the programAbility to work positively with the wide range of individuals involved in the programStrong leadership and management skillsThe ability to find innovative ways to resolve problemsBSc in Computer Science, MSc, Business, or equivalent education/training/experience or equivalent military experience required5+ years of related work experience or leading complex projects desiredAnalyze project profitability, revenue, margins, bill rates, and utilizationStrong proficiency with project management software, such as Microsoft Project, Clarizen, SmartsheetsGood presentation skills including written, oral, presentationStrong interpersonal skills including appreciation and the ability to elicit collaboration from a wide variety of sources, including upper management, clients, and other departmentsFlexible to shifting priorities, demands, and timelines - able to promptly and expertly react to project adjustments and alterationsProject Management Institute PMP(r) certification or equivalent a plusExperience with Googles G Suite (Drive, Docs, Sheets, and Slides) is a plusThe TeamOur technical services team is critical to our success and mission. As part of this team, you enable customer success by providing support to clients post-sale. Our dedication to our customers doesn't stop once they sign - it evolves. As threats and technology evolve, we stay in step to accomplish our mission. You'll be involved in implementing new products, transitioning from old products to new, and will fix integrations and critical issues as they are raised. But you won't wait for them to be raised, you'll seek them out, too. We fix and identify technical problems, with a pointed focus of providing the best customer support in the industry.Our Commitment

Were problem solvers that take risks and challenge cybersecuritys status quo. Its simple: we cant accomplish our mission without diverse teams innovating, together.We are committed to providing reasonable accommodations for all qualified individuals with a disability. If you require assistance or accommodation due to a disability or special need, please contact us at  accommodations@paloaltonetworks.com.Palo Alto Networks is an equal opportunity employer. We celebrate diversity in our workplace, and all qualified applicants will receive consideration for employment without regard to age, ancestry, color, family or medical care leave, gender identity or expression, genetic information, marital status, medical condition, national origin, physical or mental disability, political affiliation, protected veteran status, race, religion, sex (including pregnancy), sexual orientation, or other legally protected characteristics.All your information will be kept confidential according to EEO guidelines."
3515255,"Solution Consultant (PRESALES)","https://jobs.smartrecruiters.com/PaloAltoNetworks2/744000078932338-solution-consultant-presales-","Palo_Alto_Networks","Manila","No",6,"Full time","2025-08-31T02:00:55.429797Z","Your CareerThe Solutions Consultant is the evolution of the traditional Sales Engineering role, aligning how we best serve our customers in understanding their environment, providing solution guidance and ensuring value realization in their investment with Palo Alto Networks.  As a Solutions Consultant you provide technical leadership and expertise and guidance in your customers security transformation journey.  You will play a key role in defining technical solutions that secure a customers key business imperatives and ensuring value realization of their investment with Palo Alto Networks.  You evangelize our industry leadership in on-prem, cloud, and security operations services that establish PANW as your customers cybersecurity partner of choice.Your ImpactCuriosity is core to the Solutions Consultant role, and you see complex problems as opportunities to learn and deliver innovative solutions! You define your impact by:Meeting and exceeding sales quotas by building and implementing strategic, technical account plans that target cross-platform solutionsUnderstands Key customer business requirements and has the ability to position, demonstrate and create high level designs across the entire PANW portfolio solutions creating business value for customersAbility to drive customer adoption of Palo Alto Networks Platform. Building customer relationships by helping customers achieve increased productivity, operational efficiency, security efficacy, and greater flexibility to innovateConducting discovery to understand and articulate the key technical, operational, and commercial imperatives of your prospects and customersWorking closely with Professional Services, Customer Success and Specialist teams to ensure overall customer implementation and adoption of solutions.Demonstrating strong communication skills, influencing through effective presentations and customer-specific demos, and conducts technical engagements and workshops that are clear and impactful, simplifying complex ideas for various audiencesLeading successful technical validation efforts based on best practices to ensure technical win in assigned opportunitiesDemonstrates Cross functional leadership driving collaboration and orchestrating supporting resources (Specialists, Channel Resources, Customer Support) to ensure a one-team approach that demonstrates a cohesive strategyPromoting end-to-end solutions that include PANW and/or partner professional services to ensure customers realize business value soonerUnderstanding the competitive landscape and effectively differentiating PANW's leadership in the cybersecurity space  Continuously investing in yourself to develop technical and professional skills that drive your ever-increasing contributions to success of our customers while actively participating within the Solutions Consultant community and at industry eventsIdentifying technical stakeholders and cultivating relationships with key personas to build and drive a security architecture transformation roadmapYour Experience 6+ years experience in pre-sales/sales engineeringSkilled in at least one of the following Networking, Network Security, Cybersecurity, Private/Public Cloud Security, SOC/Endpoint or SASE.Experience in delivering cybersecurity solutions that solve technical challenges and influence new business initiatives is preferredInfluencing and gaining buy-in from key stakeholders, either in a customer-facing or internal role; prior experience in a pre-sales role is idealCreating and delivering technical presentations, workshops, or technical validation engagements Experience in selling, designing, implementing, or managing one or more of the following solutions: Network Security, SASE, SaaS, CNAPP and/or SOC Transformation TechnologiesPartnering with Customer Support functions to ensure successful implementation and adoption of sold solutionsExperience in complex sales involving long sales processes with multiple buying centers and multi-product solutions are preferredThis is a field sales position where travel requirements may be required to support in person customer meetings, please discuss with the recruiter on the specifics for this position.Proficient in EnglishThe TeamOur Solutions Consultant team members work hand-in-hand with large organizations around the world to keep their digital environments protected. We educate, inspire,and empower our potential clients in their journey to transform their security architectures. You are empowered with unmatched systems and tools and a team built on joint success. You wont find someone at Palo Alto Networks that isnt committed to your success  with everyone pitching in to assist when it comes to solutions selling, learning, and development. Our Solutions Consulting community is driven by the mission to be our customers cybersecurity partner of choice, protecting their digital way of life.  Our Commitment

Were problem solvers that take risks and challenge cybersecuritys status quo. Its simple: we cant accomplish our mission without diverse teams innovating, together.We are committed to providing reasonable accommodations for all qualified individuals with a disability. If you require assistance or accommodation due to a disability or special need, please contact us at  accommodations@paloaltonetworks.com.Palo Alto Networks is an equal opportunity employer. We celebrate diversity in our workplace, and all qualified applicants will receive consideration for employment without regard to age, ancestry, color, family or medical care leave, gender identity or expression, genetic information, marital status, medical condition, national origin, physical or mental disability, political affiliation, protected veteran status, race, religion, sex (including pregnancy), sexual orientation, or other legally protected characteristics.All your information will be kept confidential according to EEO guidelines."
3515254,"Senior Technical Support Engineer-Prisma Access Browser","https://jobs.smartrecruiters.com/PaloAltoNetworks2/744000078935835-senior-technical-support-engineer-prisma-access-browser","Palo_Alto_Networks","Bangalore","No","Not specified","Full time","2025-08-31T02:00:55.429827Z","Your CareerYou will work firsthand with our valued customers to address their complex post-sales concerns, where analysis of situations or data requires an in-depth evaluation of many factors. Youre a critical thinker in understanding the methods, techniques, and evaluation criteria for obtaining results. Youll enjoy networking with key contacts outside your own area of expertise, with a strong capability of detailing difficult technical issues to both non-technical and technical professionals.You will regularly participate in technical discussions with multi-functional teams, creating an environment of transparency that ultimately leads to better products, better working environments, and better cybersecurity. Your quick thinking and support to our clients provides the fast assistance they need to keep their environments secure  which means youll need to move quickly, thoughtfully, and provide technical assistance as needed (often, in high pressure situations)Your ImpactProvide Technical Support to customers and partnersProvide configurations, troubleshooting, and best practices to customersManage support cases to ensure issues are recorded, tracked, resolved, and follow-ups are completed in a timely mannerProvide fault isolation and root cause analysis for technical issuesPublish Technical Support Bulletins and other technical documentation in the Knowledge BaseReview of technical documentation for training materials, technical marketing collateral, manuals, troubleshooting guides, etc.Travel to customer sites in the event of a critical situation to expedite resolution as requiredProvide on-call support 24x7 on an as-needed basisYour Experience Communication: Excellent written and verbal communication skills.Technical Support: Previous experience in a technical support environment is advantageous, along with strong exposure to support roles and working with large global customers, partners, and internal teams (such as DevOps, Engineering, QA, and Product managers). Scheduling: Willing to work flexible and varying shift times, including weekends and evenings.Technical Skills:Networking IPSEC, TCP/IP, PKI, SSL/ TLS, HTTP/HTTPSRouting knowledge (BGP is a must)Experience working with Firewall Central Management SystemsWorking knowledge of Security services (IDS/IPS, Firewalls, etc.)Operating Systems: Expertise in OS systems and troubleshooting, including Windows, MAC, Linux, and IOS (debugging, editing registries, using OS built-in tools such as Event Viewer to aid in troubleshooting, file changes on Linux, etc.)Tools &amp; Security: Comfortable using tools such as Chrome Developer Tools to isolate issues, capture HAR file, and perform HAR file analysis Authentication: Good understanding of authentication protocols (e.g., SAML, LDAP, RADIUS). Experience working with a multi-factor authentication security system (tokens, certificates, CAC cards, and similar) Proficiency in Prisma Access and GlobalProtect is a plus.The TeamOur technical support team is critical to our success and mission. As part of this team, you enable customer success by providing support to clients after they have purchased our products. Our dedication to our customers doesnt stop once they sign  it evolves. As threats and technology change, we stay in step to accomplish our mission.Youll be involved in implementing new products, transitioning from old products to new, and will fix integrations and critical issues as they are raised  in fact, youll seek them out to ensure our clients are safely supported. We fix and identify technical problems, with a pointed focus of providing the best customer support in the industry.Our Commitment

Were problem solvers that take risks and challenge cybersecuritys status quo. Its simple: we cant accomplish our mission without diverse teams innovating, together.We are committed to providing reasonable accommodations for all qualified individuals with a disability. If you require assistance or accommodation due to a disability or special need, please contact us at  accommodations@paloaltonetworks.com.Palo Alto Networks is an equal opportunity employer. We celebrate diversity in our workplace, and all qualified applicants will receive consideration for employment without regard to age, ancestry, color, family or medical care leave, gender identity or expression, genetic information, marital status, medical condition, national origin, physical or mental disability, political affiliation, protected veteran status, race, religion, sex (including pregnancy), sexual orientation, or other legally protected characteristics.All your information will be kept confidential according to EEO guidelines."
3515253,"Principal Escalation Engineer","https://jobs.smartrecruiters.com/PaloAltoNetworks2/744000078937910-principal-escalation-engineer","Palo_Alto_Networks","San Francisco","No","Not specified","Full time","2025-08-31T02:00:55.429844Z","Your CareerThis is a highly visible, senior level position on a small but growing team that will benefit from out of box thinking and technical insight. The ideal Principal Engineering Escalation Engineer will bring a mix of customer management and broad/deep technical skills related to telecommunication equipment and Internet traffic.  A background in troubleshooting or designing modern networks, a good understanding of the behaviors of Internet applications and protocols and strong command of English are the starting points for success in this role.Your ImpactThis Engineering Escalation role is positioned to intercept and assist or drive technical escalations that come to the executive level in engineeringEscalations of this type are extremely critical and are driven by the account teams in the fieldYou will speak with executive levels at customers, delivering among other things, discussions about the situation, explaining the root cause or progress toward it, providing status internally, and addressing technical questions during customer interactionsYour Experience BE /B.tech or equivalent technical graduation is mandatory or equivalent military experience requiredCareer level experience in support service, technical support or similar troubleshooting related roleTechnical lead in area of expertise related to cyberspace equipment vendor or network security organizationAble to explain complex technical issues to non-technical peopleAble to have open discussions on network design, network security and related technical topics  Required Technical Skills Configuring and troubleshooting dynamic routing protocols (BGP and OSPF primarily)L1-L3 (ISO model) troubleshootingBroad understanding of and ability to analyze and troubleshoot Internet applications and protocolsTroubleshooting VPNs (IPSec and SSL tunnels)Pcap analysis (via Wireshark and other tools)Hardware troubleshooting for telecommunications equipmentC, C++ and python programming languages(Good to have)   Helpful Certifications -Advanced certification for network equipment vendors (e.g. JNCIE, JNCP, CCIE, CCNA, CCNP, CCA etc)Cloud deployment for AWS, GCP, Azure or KVM based solutions)The TeamOur engineering team is at the core of our products  connected directly to the mission of preventing cyberattacks. We are constantly innovating  challenging the way we, and the industry, think about cybersecurity. Our engineers dont shy away from building products to solve problems no one has pursued before.We define the industry, instead of waiting for directions. We need individuals who feel comfortable in ambiguity, excited by the prospect of a challenge, and empowered by the unknown risks facing our everyday lives that are only enabled by a secure digital environment.Compensation DisclosureThe compensation offered for this position will depend on qualifications, experience, and work location. For candidates who receive an offer at the posted level, the starting base salary (for non-sales roles) or base salary + commission target (for sales/commissioned roles) is expected to be between $147000/YR - $237500/YR. The offered compensation may also include restricted stock units and a bonus. A description of our employee benefits may be found here.Our Commitment

Were problem solvers that take risks and challenge cybersecuritys status quo. Its simple: we cant accomplish our mission without diverse teams innovating, together.We are committed to providing reasonable accommodations for all qualified individuals with a disability. If you require assistance or accommodation due to a disability or special need, please contact us at  accommodations@paloaltonetworks.com.Palo Alto Networks is an equal opportunity employer. We celebrate diversity in our workplace, and all qualified applicants will receive consideration for employment without regard to age, ancestry, color, family or medical care leave, gender identity or expression, genetic information, marital status, medical condition, national origin, physical or mental disability, political affiliation, protected veteran status, race, religion, sex (including pregnancy), sexual orientation, or other legally protected characteristics.All your information will be kept confidential according to EEO guidelines."
3515252,"Principal Escalation Engineer","https://jobs.smartrecruiters.com/PaloAltoNetworks2/744000078938555-principal-escalation-engineer","Palo_Alto_Networks","Charlotte","No","Not specified","Full time","2025-08-31T02:00:55.429862Z","Your CareerThis is a highly visible, senior level position on a small but growing team that will benefit from out of box thinking and technical insight. The ideal Principal Engineering Escalation Engineer will bring a mix of customer management and broad/deep technical skills related to telecommunication equipment and Internet traffic.  A background in troubleshooting or designing modern networks, a good understanding of the behaviors of Internet applications and protocols and strong command of English are the starting points for success in this role.Your ImpactThis Engineering Escalation role is positioned to intercept and assist or drive technical escalations that come to the executive level in engineeringEscalations of this type are extremely critical and are driven by the account teams in the fieldYou will speak with executive levels at customers, delivering among other things, discussions about the situation, explaining the root cause or progress toward it, providing status internally, and addressing technical questions during customer interactionsYour Experience BE /B.tech or equivalent technical graduation is mandatory or equivalent military experience requiredCareer level experience in support service, technical support or similar troubleshooting related roleTechnical lead in area of expertise related to cyberspace equipment vendor or network security organizationAble to explain complex technical issues to non-technical peopleAble to have open discussions on network design, network security and related technical topics  Required Technical Skills Configuring and troubleshooting dynamic routing protocols (BGP and OSPF primarily)L1-L3 (ISO model) troubleshootingBroad understanding of and ability to analyze and troubleshoot Internet applications and protocolsTroubleshooting VPNs (IPSec and SSL tunnels)Pcap analysis (via Wireshark and other tools)Hardware troubleshooting for telecommunications equipmentC, C++ and python programming languages(Good to have)   Helpful Certifications -Advanced certification for network equipment vendors (e.g. JNCIE, JNCP, CCIE, CCNA, CCNP, CCA etc)Cloud deployment for AWS, GCP, Azure or KVM based solutions)The TeamOur engineering team is at the core of our products  connected directly to the mission of preventing cyberattacks. We are constantly innovating  challenging the way we, and the industry, think about cybersecurity. Our engineers dont shy away from building products to solve problems no one has pursued before.We define the industry, instead of waiting for directions. We need individuals who feel comfortable in ambiguity, excited by the prospect of a challenge, and empowered by the unknown risks facing our everyday lives that are only enabled by a secure digital environment.Compensation DisclosureThe compensation offered for this position will depend on qualifications, experience, and work location. For candidates who receive an offer at the posted level, the starting base salary (for non-sales roles) or base salary + commission target (for sales/commissioned roles) is expected to be between $147000/YR - $237500/YR The offered compensation may also include restricted stock units and a bonus. A description of our employee benefits may be found here.Our Commitment

Were problem solvers that take risks and challenge cybersecuritys status quo. Its simple: we cant accomplish our mission without diverse teams innovating, together.We are committed to providing reasonable accommodations for all qualified individuals with a disability. If you require assistance or accommodation due to a disability or special need, please contact us at  accommodations@paloaltonetworks.com.Palo Alto Networks is an equal opportunity employer. We celebrate diversity in our workplace, and all qualified applicants will receive consideration for employment without regard to age, ancestry, color, family or medical care leave, gender identity or expression, genetic information, marital status, medical condition, national origin, physical or mental disability, political affiliation, protected veteran status, race, religion, sex (including pregnancy), sexual orientation, or other legally protected characteristics.All your information will be kept confidential according to EEO guidelines."
