"ID","Title","Link","Company","Location","Remote","Experience","EmploymentType","DatePosted","RoleDescription"
2962331,"Technical Account Manager  Unit 42 MDR","https://jobs.smartrecruiters.com/PaloAltoNetworks2/744000060090138-technical-account-manager-unit-42-mdr","Palo_Alto_Networks","Santa Clara","Yes",4,"Full time","2025-05-19T02:06:55.148734Z","Your CareerThe Technical Account Manager will act as a trusted advisor to our customers to help ensure efficient Palo Alto Networks Unit 42 Managed Services adoption. In this role, you will work closely with CISOs, Security Architects, Security Engineers, and Operations teams within mid-to-large enterprises to implement best-in-breed Managed Detection and Response &amp; Managed Threat Hunting services. The end result is increased customer satisfaction, value, retention, and expansion of the Unit 42s security footprint.Your ImpactAct as the main technical point of contact for Managed Services customers, owning the relationship end-to-endDevelop a trusted advisor relationship with customer stakeholders, executive sponsors and partners to drive the managed services adoption to ensure they are leveraging the solution to achieve full business valueLeverage deep knowledge of MSSP/MDR operations, XDR, SOAR, and incident response to guide customersBe the first line of defense in solving customer technical  questions/clarifications, and coordinating and prioritizing timely resolutions with engineering teams and become a Subject Matter expert over timeDrive onboarding, service adoption, and ongoing alignment.Manage escalations, service reviews, and response coordination with internal teamsOwn and lead projects in a fast-moving, high-pressure environmentAdapt quickly, build workflows, and help define scalable processes to improve service deliveryCommunicate clearly with both technical and executive stakeholders.Your Experience 4+ years in cybersecurity, including 3+ years in a customer-facing technical role (TAM, Security Consultant, Solutions Engineer, etc.)Solid understanding of security operations, threat detection, and incident response workflowsExperience working with MDR, EDR, XDR, or SIEM platformsStrong executive presence and ability to communicate complex security topics to technical and non-technical stakeholdersA customer-first mindset with proven ability to build trust and long-term relationshipsExcellent problem-solving skills and a proactive, ownership-driven approachAbility to manage multiple accounts and priorities in a fast-paced, dynamic environmentProven track record of managing customer escalations, balancing customer expectations, and negotiating successful resolutionsHighly data-driven with a commitment to following processTeam player with the highest level of integrity, who will innovate to continue improving the way we serve our customersPrevious experience with a Cybersecurity/SaaS solutions company and/or an enterprise software company highly desiredThe TeamUnit 42 is the global threat intelligence team at Palo Alto Networks. We believe threat intelligence should be shared and available to all within the industry. We deliver high-quality, in-depth research on adversaries, malware families, and attack campaigns. Our analysts uncover and document adversary behaviors and then share playbooks that give insight into the various tools, techniques, and procedures threat actors execute to compromise organizations.If youre looking for a career with access to the brightest minds in cybersecurity, youve found it. We have a hunger for researching, hunting out the worlds newest threats and sharing them with our industry to make the digital world a safer place.You will be part of a growing, passionate, and dynamic team with an opportunity to work on challenging and exciting projects  centered on what we believe is one of the most significant mission statements in the world. We also strive to be the most people-centric company ever! That means were constantly working to make your experience amazing, and you are part of the team breaking boundaries of what the workplace can be!Compensation DisclosureThe compensation offered for this position will depend on qualifications, experience, and work location. For candidates who receive an offer at the posted level, the starting base salary (for non-sales roles) or base salary + commission target (for sales/commissioned roles) is expected to be between $128,000 - $209,000/YR. The offered compensation may also include restricted stock units and a bonus. A description of our employee benefits may be found here.Our Commitment

Were problem solvers that take risks and challenge cybersecuritys status quo. Its simple: we cant accomplish our mission without diverse teams innovating, together.We are committed to providing reasonable accommodations for all qualified individuals with a disability. If you require assistance or accommodation due to a disability or special need, please contact us at  accommodations@paloaltonetworks.com.Palo Alto Networks is an equal opportunity employer. We celebrate diversity in our workplace, and all qualified applicants will receive consideration for employment without regard to age, ancestry, color, family or medical care leave, gender identity or expression, genetic information, marital status, medical condition, national origin, physical or mental disability, political affiliation, protected veteran status, race, religion, sex (including pregnancy), sexual orientation, or other legally protected characteristics.All your information will be kept confidential according to EEO guidelines."
2962330,"Principal Engineer Software - (L7- Network Security)","https://jobs.smartrecruiters.com/PaloAltoNetworks2/744000060090595-principal-engineer-software-l7-network-security-","Palo_Alto_Networks","Santa Clara","No",7,"Full time","2025-05-19T02:06:55.148760Z","Your CareerWe're seeking innovators - engineers who seek to design new products, designing state-of-the-art products that do not exist today. These engineers love to code with a drive to build global products and bring new ideas to develop security disciplines to solve real-world problems. We are looking for leaders who take ownership of their areas of focus and who are driven to pursue problems at every level. Collaboration is at the heart of our culture and we need engineers who can communicate at a high level and work well with multi-functional teams towards achieving a common goal.
As a member of Layer-7 Application Security group, you will be responsible for designing and developing security features on the next-generation firewall platform integrating with our security services cloud. You will work with product management on user requirements, apply your knowledge to functional design, utilize your programming skills for efficient and robust implementation, and interact with quality assurance and field support teams throughout the entire software development cycle.Your ImpactYou will be expected to participate in all phases of the product development cycle, from definition, design, through implementation and testDevelop functional specifications, assess task requirements and scheduling, and participate in development, debug and support Candidate should also have hands-on experience with networking or network security technologies and C language development in a Unix/Linux environment Suggest and implement improvements to the development process Be able to clearly communicate goals and desired outcomes to internal project teams Interview, mentor and coach new team membersYour Experience Proficient in C and familiar with Unix/Linux development environmentWorking knowledge of TCP/IP internals and L7 protocolsWorking knowledge of common data structures and algorithmsVerbal and written communication skills to work with cross-functional groupsTeam player with a can-do attitude in a dynamic working environmentPreferred QualificationsAdvance level of software development experienceGraduate degree (MS or PhD) in Computer Science or similar technical disciplineKnowledge of multi-core / multi-process / multi-threaded programmingExperience with network packet processing software development, 7 - 10 yearsExperience with application layer protocols such as HTTP, SIP, H.323, DNS, etc.Experience with and interest to learn other programming languagesExperience with large-scale and/or high-performance software design and developmentExperience with deep packet inspection engineExperience with GoLangThe TeamAs a member of the Layer-7 Application Security group, you will be responsible for designing and developing security features on the next-generation firewall platform integrating with our security services cloud.Compensation DisclosureThe compensation offered for this position will depend on qualifications, experience, and work location. For candidates who receive an offer at the posted level, the starting base salary (for non-sales roles) or base salary + commission target (for sales/commissioned roles) is expected to be between:: $185K - $215K/YR. The offered compensation may also include restricted stock units and a bonus. A description of our employee benefits may be found here.Our Commitment

Were problem solvers that take risks and challenge cybersecuritys status quo. Its simple: we cant accomplish our mission without diverse teams innovating, together.We are committed to providing reasonable accommodations for all qualified individuals with a disability. If you require assistance or accommodation due to a disability or special need, please contact us at  accommodations@paloaltonetworks.com.Palo Alto Networks is an equal opportunity employer. We celebrate diversity in our workplace, and all qualified applicants will receive consideration for employment without regard to age, ancestry, color, family or medical care leave, gender identity or expression, genetic information, marital status, medical condition, national origin, physical or mental disability, political affiliation, protected veteran status, race, religion, sex (including pregnancy), sexual orientation, or other legally protected characteristics.All your information will be kept confidential according to EEO guidelines."
2962329,"Principal Software Test Engineer  (Cloud Identity Engine)","https://jobs.smartrecruiters.com/PaloAltoNetworks2/744000060090957-principal-software-test-engineer-cloud-identity-engine-","Palo_Alto_Networks","Santa Clara","No",10,"Full time","2025-05-19T02:06:55.148779Z","Your CareerThe Cloud Management Platform is a public cloud delivered management platform to manage all Palo Alto Networks Next generation network security solutions. Its an easy-to-use, scalable and secure platform to operationalize complex deployments using the Palo Alto Networks network security portfolio.You will work in a team of highly motivated engineers building a highly scalable and secure multi-tenant public cloud solution to manage devices in physical, virtual or container form factors. We are looking for passionate engineers that can code and build great products as well as leaders that can own and deliver. Collaboration and teamwork are at the foundation of our culture and we need engineers who can communicate at a high level and work well with others towards achieving a common goal. Responsibilities:As a Principal Software Development Engineer in Test (SDET), you will play a key role in ensuring the quality and reliability of our software products. Your responsibilities will include:Test Planning and Execution:Create detailed, comprehensive, and well-structured test plans that cover all possible test cases to verify feature functionality for customer use cases.Design and execute automation scripts for all test cases.Automation Framework Development:Develop and maintain robust test automation frameworks.Develop tools and infrastructure to enhance the quality and efficiency of testing.Contribute to improving existing test automation frameworks to support new software features.Defect Management:Utilize excellent troubleshooting abilities to isolate issues found during testing.Verify bug fixes once they are resolved and efficiently reproduce and debug issues found during and after software release.Project Management:Estimate, prioritize, plan, and coordinate testing activities to ensure that feature deliverables meet release deadlines.Collaboration:Collaborate with cross-functional product management, development, and SDET teams in a fast-paced environment.Participate in a high-paced work environment with short release cycles and take ownership of tasks.Experience:Test Planning and Methodologies:Proven experience in writing test plans and test cases with a strong understanding of SDET methodologies, tools, and procedures.Networking and Cloud Security:Experience with TCP/IP Networking and Network/Cloud Security required.Knowledge of Active Directories, Cloud Directories and Identity Providers like those offered by Azure, Google, Okta etc is desirable.Test Automation &amp; Frameworks:Strong knowledge of test automation methodologies, tools, and frameworksExperience developing test automation for REST APIs using Python/PytestUI automation/testing experience using Selenium/JavaScript/Playwright.Proficiency in at least one programming language (e.g., Python, Java, JavaScript) Cloud and CI/CD:Experience testing Cloud Management platforms is highly desirable.Experience in building and maintaining GitLab CI/CD pipelines.Experience with Cloud technologies such as AWS, Azure, or GCP.Knowledge of Active Directories, Cloud Directories and Identity Providers like those offered by Azure, Google, Okta etc is desirable.Soft Skills:Demonstrated ability to learn quickly and work in fast-paced, innovative environments.Excellent communication and collaborative skills.Educational Qualifications:BS or MS in Computer Engineering or a related technical field.Minimum of 10+ years' experience as a Software Developer/SDET/Software Test Engineer. The TeamOur engineering team is at the core of our products  connected directly to the mission of preventing cyberattacks. We are constantly innovating  challenging the way we, and the industry, think about cybersecurity. Our engineers dont shy away from building products to solve problems no one has pursued before.We define the industry, instead of waiting for directions. We need individuals who feel comfortable in ambiguity, excited by the prospect of a challenge, and empowered by the unknown risks facing our everyday lives that are only enabled by a secure digital environment. Compensation DisclosureThe compensation offered for this position will depend on qualifications, experience, and work location. For candidates who receive an offer at the posted level, the starting base salary (for non-sales roles) or base salary + commission target (for sales/commissioned roles) is expected to be between $147000 - $225500/YR. The offered compensation may also include restricted stock units and a bonus. A description of our employee benefits may be found here.  Our Commitment

Were problem solvers that take risks and challenge cybersecuritys status quo. Its simple: we cant accomplish our mission without diverse teams innovating, together.We are committed to providing reasonable accommodations for all qualified individuals with a disability. If you require assistance or accommodation due to a disability or special need, please contact us at  accommodations@paloaltonetworks.com.Palo Alto Networks is an equal opportunity employer. We celebrate diversity in our workplace, and all qualified applicants will receive consideration for employment without regard to age, ancestry, color, family or medical care leave, gender identity or expression, genetic information, marital status, medical condition, national origin, physical or mental disability, political affiliation, protected veteran status, race, religion, sex (including pregnancy), sexual orientation, or other legally protected characteristics.All your information will be kept confidential according to EEO guidelines.
Is role eligible for Immigration Sponsorship?: Yes"
2962328,"Sr Principal Product Security Researcher (Vulnerability Research)","https://jobs.smartrecruiters.com/PaloAltoNetworks2/744000060094086-sr-principal-product-security-researcher-vulnerability-research-","Palo_Alto_Networks","Santa Clara","No","Not specified","Full time","2025-05-19T02:06:55.148797Z","Your CareerThese days, the threat landscape is fluid and always changing. Cyber bad-actors are constantly finding new and diabolically creative ways to get to your data and theres just no telling what door theyll knock on next. As a Principal Product Security Researcher, you will be helping Palo Alto Networks in a high visibility and impactful role to stay ahead of the curve in addressing the latest security threats.Your ImpactDiscover and create proof of concepts for new security vulnerabilities in Palo Alto Networks products and cloud offeringsAdvance the state of the art in security research and bug hunting by developing novel methods for vulnerability discoveryEvaluate the security of Palo Alto Networks products code and architecture. Propose changes to improve their security posturePerform root-cause analysis of vulnerabilities and work closely with product teams to develop and review secure solutionsServe as a product security subject-matter expert when collaborating with Palo Alto Networks leadership and industry partnersYour Experience Proven track record of discovering and exploiting impactful vulnerabilities in software (e.g. CVEs, bug bounties, talks)Expert in secure programming, penetration testing, and security architecture in cloud native environments (e.g. GCP, AWS)Strong familiarity with cloud security, Linux, low level operating system concepts, and networkingStrong analytical and problem-solving skills, the ability to work both independently and collaboratively with diverse stakeholdersExcellent written and verbal communication skills preferably demonstrated through technical blogs, write-ups, and talksExperience writing SAST rules and fuzzing/instrumenting complex applications to discover vulnerabilities is a plusParticipation in Capture the Flag (CTF) events, a local OWASP chapter, or similar security-focused communities is a plusBS or MS Degree in Engineering or Computer Science, related to computer security, application security, information security, network security, or cryptography or equivalent military experience is preferredThe TeamWe are on a mission to build the industry's best Security large language model.Our engineering team is at the core of our products  connected directly to the mission of preventing cyberattacks. We are constantly innovating  challenging the way we, and the industry, think about cybersecurity. Our engineers dont shy away from building products to solve problems no one has pursued before.We define the industry, instead of waiting for directions. We need individuals who feel comfortable in ambiguity, excited by the prospect of a challenge, and empowered by the unknown risks facing our everyday lives that are only enabled by a secure digital environment.Compensation DisclosureThe compensation offered for this position will depend on qualifications, experience, and work location. For candidates who receive an offer at the posted level, the starting base salary (for non-sales roles) or base salary + commission target (for sales/commissioned roles) is expected to be between $157000 - $255000/YR. The offered compensation may also include restricted stock units and a bonus. A description of our employee benefits may be found here.Our Commitment

Were problem solvers that take risks and challenge cybersecuritys status quo. Its simple: we cant accomplish our mission without diverse teams innovating, together.We are committed to providing reasonable accommodations for all qualified individuals with a disability. If you require assistance or accommodation due to a disability or special need, please contact us at  accommodations@paloaltonetworks.com.Palo Alto Networks is an equal opportunity employer. We celebrate diversity in our workplace, and all qualified applicants will receive consideration for employment without regard to age, ancestry, color, family or medical care leave, gender identity or expression, genetic information, marital status, medical condition, national origin, physical or mental disability, political affiliation, protected veteran status, race, religion, sex (including pregnancy), sexual orientation, or other legally protected characteristics.All your information will be kept confidential according to EEO guidelines.
Is role eligible for Immigration Sponsorship?: Yes"
