"ID","Title","Link","Company","Location","Remote","Experience","EmploymentType","DatePosted","RoleDescription"
2967461,"Senior Angular Frontend Engineer (Cortex - Application Security)","https://jobs.smartrecruiters.com/PaloAltoNetworks2/744000060181645-senior-angular-frontend-engineer-cortex-application-security-","Palo_Alto_Networks","Tel Aviv-Yafo","No",4,"Full time","2025-05-19T02:06:55.147791Z","Your CareerWe are a strong team, developing new solutions for one of the most focused products in the company, moving quickly and using cutting edge technologies. We are seeking an exceptional front-end developer with at least 3 years of experience in the latest Javascript technologies (React, Angular, Vue) working on client-side applications on large scales.We are looking for a highly technical individual, who believes that a great frontend is a key to a product's success. Our team's main focus is building a great frontend infrastructure with outstanding UX and taking forward the visibility of our cyber security products.Your ImpactDesign and develop next generation frontend applicationTake responsibility and lead the development of multiple components of the system in a dynamic environmentWork closely with our UI/UX experts, designers and product managers to create visionary cyber security productsResearch, design and develop complex data visualization solutions Your Experience 4+ years of hands-on experience in frontend development  MustPractical knowledge of Angular v14+, ideally including newer features in v16/v17 (e.g., Signals, new control flow syntax, Standalone APIs)Strong proficiency in TypeScript and modern JavaScriptSolid command of RxJS for reactive programmingDeep understanding of HTML5, SASS, Tailwind CSS, and web animations/transitionsProven ability to work independently, learn quickly, and collaborate effectively in a teamExperience with interactive charting frameworks and canvas-based graph libraries  AdvantageThe TeamJoin our Application Security Frontend Engineering team - where innovation meets impact. Our engineering team is at the core of our products and directly aligned with our mission: preventing cyberattacks. Were constantly pushing boundaries and challenging conventional thinking in cybersecurity. If you're passionate about building secure, user-focused applications and want to work on problems no one has tackled beforethis is your place.#LI-SS2Our Commitment

Were problem solvers that take risks and challenge cybersecuritys status quo. Its simple: we cant accomplish our mission without diverse teams innovating, together.We are committed to providing reasonable accommodations for all qualified individuals with a disability. If you require assistance or accommodation due to a disability or special need, please contact us at  accommodations@paloaltonetworks.com.Palo Alto Networks is an equal opportunity employer. We celebrate diversity in our workplace, and all qualified applicants will receive consideration for employment without regard to age, ancestry, color, family or medical care leave, gender identity or expression, genetic information, marital status, medical condition, national origin, physical or mental disability, political affiliation, protected veteran status, race, religion, sex (including pregnancy), sexual orientation, or other legally protected characteristics.All your information will be kept confidential according to EEO guidelines."
2967460,"Sr Principal Engineer Software (Cortex Backend Engineering)","https://jobs.smartrecruiters.com/PaloAltoNetworks2/744000060186655-sr-principal-engineer-software-cortex-backend-engineering-","Palo_Alto_Networks","Santa Clara","No",14,"Full time","2025-05-19T02:06:55.147864Z","Your CareerWe are looking for a Senior Principal Backend Engineer to join our Cortex backend engineering group.
The group develops and maintains the backend of Cortex products - Cortex XSOAR, Cortex XDR, and Cortex XSIAM. The great majority of the Cortex engineering group is located in the Santa Clara and Tel Aviv offices.
You will join a team focused on developing, innovating, and scaling the Cortex Platform, along with contributing to shared Cortex infrastructures and components. We are looking for candidates with a can-do attitude, who are passionate about complex problems and thrive on bringing value to thousands of customers.Your ImpactAs a Senior Principal Engineer on the team, you will:Work regularly across teams as an acknowledged technical leader in the organizationDrive projects from requirements to complete design and implementation as project lead or mentor thereofLead efforts to align planned work across the product in collaboration with product management, UX design, and fellow engineering stakeholdersUtilize your big-picture perspective to spot existing and impending problems, then work with senior engineers and leadership across the department to analyze and solve themProactively spot, articulate, and mitigate risks in ongoing and planned projects to ensure smooth execution and high output  this may include providing ad hoc mentorship, communicating with project stakeholders, or rolling up your sleeves and stepping in to help move things alongMentor engineers across the departmentRegularly provide cross-team technical collaboration and consultationDesign, build, and optimize data models and queries for speed and scale, using data storage technologies like MySQL and BigQueryDesign and build business logic and API endpoints using Python and FlaskDesign and build backend services using GoYour Experience 14+ years of experience in software engineering, with a focus on cloud-native application development, at large organizations or innovative startupsStrong programming skills in one of Python, Go, or Java, with experience in building distributed systems8+ years of experience in cloud technologies like ElasticSearch, Pubsub, etc.Excellent troubleshooting abilities. Isolate issues found during testing and verify bug fixes once they are resolvedExperience with cloud development (REST APIs, Databases, Serverless computing) of distributed cloud applicationsExperience with building and delivering services and workflows at scale, leveraging microservices architecturesGood understanding of public cloud design considerations and limitations in areas of microservice architectures, security, global network infrastructure, distributed systems, and load balancingExperience with the agile process and working with software development teams involved with building out full stack products, deployed on the cloud at scaleExperience as a hands-on tech lead / architectCan-do attitude and ability to make trade-off judgements with data driven decision makingHigh energy and the ability to work in a fast-paced environmentEnjoys working with many different teams with strong collaboration and communications skillsBS/MS in Computer Science or Computer Engineering or related technical degreeNice to HaveStrong understanding and applied knowledge of Kubernetes architecture deployments (such as Ansible, Kubespray, Helm, CDK8s, k8s managed and unmanaged) and a variety of Kubernetes distributions such as Rancher Kubernetes Engine (RKE2)Experience with cloud-native storage solutions (e.g. Ceph, Rook) with a proven ability to develop and manage custom Kubernetes controllers or operatorsStrong understanding of principles of DevSecOps, DevOps, and Continuous Delivery Compensation DisclosureThe compensation offered for this position will depend on qualifications, experience, and work location. For candidates who receive an offer at the posted level, the starting base salary (for non-sales roles) or base salary + commission target (for sales/commissioned roles) is expected to be between $170000 - $277000/YR. The offered compensation may also include restricted stock units and a bonus. A description of our employee benefits may be found here.Our Commitment

Were problem solvers that take risks and challenge cybersecuritys status quo. Its simple: we cant accomplish our mission without diverse teams innovating, together.We are committed to providing reasonable accommodations for all qualified individuals with a disability. If you require assistance or accommodation due to a disability or special need, please contact us at  accommodations@paloaltonetworks.com.Palo Alto Networks is an equal opportunity employer. We celebrate diversity in our workplace, and all qualified applicants will receive consideration for employment without regard to age, ancestry, color, family or medical care leave, gender identity or expression, genetic information, marital status, medical condition, national origin, physical or mental disability, political affiliation, protected veteran status, race, religion, sex (including pregnancy), sexual orientation, or other legally protected characteristics.All your information will be kept confidential according to EEO guidelines.
Is role eligible for Immigration Sponsorship?: Yes"
2967459,"Principal Engineer Software (SASE) - NetSec","https://jobs.smartrecruiters.com/PaloAltoNetworks2/744000060188105-principal-engineer-software-sase-netsec","Palo_Alto_Networks","Pune","No",12,"Full time","2025-05-19T02:06:55.147890Z","Your CareerPrisma AccessTM combines the Internet connectivity/security you need - and delivers it everywhere you need it. Using cutting-edge public and private cloud technologies, it extends the next-generation security protection to all cloud services and to its customers regardless of whether they are on-premise, on remote networks or mobile users. We are seeking an experienced Software Engineer to design, develop and deliver next-generation technologies within our Prisma Access team. We want passionate engineers who love to code and build great products. Engineers who bring new ideas in all facets of software development. We are looking for leaders who take ownership of their areas of focus and who are driven to solve problems at every level. Collaboration and teamwork are at the foundation of our culture and we need engineers who can communicate at a high level and work well with others towards achieving a common goal.Your ImpactDesign and implement new features and integrations for virtualization features across diverse cloud environments and deployments.Engage in all phases of the product development cycle from concept definition, design, through implementation, and testing.Develop comprehensive functional specifications, evaluate task requirements and timelines, and contribute to design, development, debugging, and support processes.Hands-on experience with virtualization technologies, various hypervisors, system software, and networking.Customer First Mindset is required and a very good team player. Be a cultural champion and role model for others  showcasing the org valuesWork with different development and quality assurance groups to achieve the best qualityWork with DevOps and technical support teams to troubleshoot and fix customer reported issuesYour ExperienceBachelors/Masters in Computer Science or a related field required12+ years of experience in Software Development.Proficiency in one or more programming languages including Go, C, C++, Python.A strong grasp of various Layer 7 protocols including TCP/IP stack and SSL/TLS.Knowledge of protocols like OAuth, SAML, and basic authentication methods.A good  understanding of the Geneve encapsulation protocol (RFC 8926), its header format, and its purpose in network virtualization.Familiarity with concepts like overlay networks, virtual extensible LANs (VXLAN), Network Virtualization using Generic Routing Encapsulation (NVGRE) is a plus.Understanding how encapsulation and tunneling work in general.Skill in diagnosing application-level network issues using tools like tcpdump, Wireshark, and application-specific debugging tools is a plus.Awareness of application-layer vulnerabilities (e.g., OWASP Top 10) and best practices for secure development.Strong knowledge in network security fields like stateful firewall, packet processing, and network ACL.Solid understanding of operating system networking concepts (e.g., network interfaces, routing tables).Experience with socket programming and network libraries.Experience with virtualization platforms (e.g., VMware, OpenStack, Kubernetes) is a plus.Experience with deployment on cloud environments (OCI/AWS/GCP)Familiarity with cloud service architectures, including compute and networking.Experiencing building highly available, scalable, and performant systemsStrong grasp on microservices and designing complex products via distributed systemsExperience in mentoring and guiding junior team members in high performing teams.Prior experience in the Cyber Security domain is preferred.The Team

As part of the browser technologies team, you will be responsible for building products that protect data, workloads, and infrastructure for some of the largest enterprise customers in the world. We help the customers in their transitional journey to the cloud by ensuring they have the best in class protection. The cloud market has been growing at a rapid rate for the last few years. As more and more enterprises use the public cloud, there is an insatiable demand for securing workloads in the public cloud.Our Commitment

Were problem solvers that take risks and challenge cybersecuritys status quo. Its simple: we cant accomplish our mission without diverse teams innovating, together.We are committed to providing reasonable accommodations for all qualified individuals with a disability. If you require assistance or accommodation due to a disability or special need, please contact us at  accommodations@paloaltonetworks.com.Palo Alto Networks is an equal opportunity employer. We celebrate diversity in our workplace, and all qualified applicants will receive consideration for employment without regard to age, ancestry, color, family or medical care leave, gender identity or expression, genetic information, marital status, medical condition, national origin, physical or mental disability, political affiliation, protected veteran status, race, religion, sex (including pregnancy), sexual orientation, or other legally protected characteristics.All your information will be kept confidential according to EEO guidelines.
Is role eligible for Immigration Sponsorship? No. Please note that we will not sponsor applicants for work visas for this position.
Covid-19 Vaccination Information for Palo Alto Networks JobsVaccine requirements and disclosure obligations vary by country.Unless applicable law requires otherwise, you must be vaccinated for COVID or qualify for a reasonable accommodation if:The job requires accessing a company worksiteThe job requires in-person customer contact and the customer has implemented such requirementsYou choose to access a Palo Alto Networks worksiteIf you have questions about the vaccine requirements of this particular position based on your location or job requirements, please inquire with the recruiter."
2967458,"Principal Consultant - Proactive Services (Unit 42)","https://jobs.smartrecruiters.com/PaloAltoNetworks2/744000060193056-principal-consultant-proactive-services-unit-42-","Palo_Alto_Networks","Remote","No",6,"Full time","2025-05-19T02:06:55.147913Z","Your CareerAs a Principal Consultant in Unit 42 you will have the opportunity to work across a number of proactive cyber security domains including Cloud Security, Security Operations, Cyber Risk Management and Artificial Intelligence in cyber security.We are seeking an individual who is passionate about cyber security, curious with a demonstrated track record of continuous learning, and has the technical acumen to embrace data, technological and innovative approaches to deliver the best consulting outcomes for clients, as they work to address the challenges associated with todays cyber threat landscape. Your ImpactPrincipal SOC Advisory6+ years of consulting experience in SOC, security engineering, SIEM administration, and incident management and demonstrated success with serving large, multinational organisations in designing and implementing an organisations security operations program, organisational structures, and capabilitiesPossess a deep technical knowledge in Security Incident and Event Management (SIEM) platforms, Security Orchestration and Response (SOAR) technologies, Endpoint Protection and Response/Next Gen Protection and Response (EDR/XDR) tools, Next GenFirewalls, Threat Intelligence and Hunting platformsDefensive Security Skills (desired)Experience in security operations design, engineering and/or analysis and investigations, ideally in complex environments, with security event correlations across a variety of sources i.e. cloud, network, endpoint, logsAbility to perform detailed assessments, identify areas for improvement and make recommendations to transform an organisation's cyber security operations and capabilities to better protect, detect and rapidly respond to modern threats. Demonstrated experience in improving an organisations security operations capabilities such as improvements in asset visibility, threat detection capabilities, automation techniques, case management, enablement of compliance and regulatory requirementsExperience in conducting threat hunting and/or compromise assessments to identify active or dormant indicators of compromise (IoCs) or evidence of unknown threats within an organisations digital environmentRelevant industry certifications including GIAC Defensible Security Architect (GDSA), GIAC Intrusion Analyst (GCIA), GIAC Continuous Monitoring (GMON), CISSPUnderstanding of cyber risk frameworks or industry standards such as 800-53, ISO 27001/2, PCI, CIS 18, CMMCPrincipal Cloud Security6+ years of experience performing cloud security advisement and risk assessments based upon industry-accepted standardsHands-on experience with a cloud hosting provider (AWS, Azure, GCP, etc)Experience with a Cloud Application Security Broker - MCAS, NetskopePossess a deep technical knowledge in CASBs, Cloud Platforms and the dependencies around such an environment (WAF, SSO, Cloud Threats, API Security, Cloud Security Posture Management)Former experience with cloud migrations (cloud to cloud, or on-prem to cloud)Knowledge of command-line interfaces or scripting tools in cloud environments is a plusCloud Security skills (desired)Secure software development practices, including SecDevOpsSound knowledge of applicable frameworks &amp; standards, including OWASP, MITRE ATT@CK &amp; D3FEND, CIS, NIST CSF, CSA CCM &amp; ISO 27107Relevant industry certifications including CSCPUnderstanding of cyber risk frameworks or industry standards such as 800-53, ISO 27001/2, PCI, CIS 18, CMMCPrincipal Cyber Risk ManagementExperience in performing cyber security threat &amp; risk assessments to support the development of cyber security strategies and roadmapsTechnical proficiency in a wide range of cyber risk management services, including cyber threat, risk and control assessments, secure software development practices, penetration testing, vulnerability assessments, among othersSound knowledge of applicable laws, compliance regulations, and industry standards as it relates to privacy, security, and complianceSound knowledge of applicable frameworks, including MITRE ATT@CK &amp; D3FEND, CIS, NIST CSF, CSA CCMStrong communication and presentation skillsCyber Risk Management skills (desired)Experience in threat modelling &amp; application security risk assessments, secure software development practices, including SecDevOpsFAIR Open certified &amp; experience in applying FAIR for cyber risk quantification Relevant industry certifications including CISSP, CISM, CISAUnderstanding of cyber risk frameworks or industry standards such as 800-53, ISO 27001/2, PCI, CIS 18, CMMCYour Experience 6+ years of experience performing cyber security consulting in at least two of the three domains above, with SME experience in one of the domainsExperience managing a team of consultantsDemonstrates a track record in strengthening existing and developing new client relationshipsAbility to strive in a startup environmentAbility to perform travel requirements as needed to meet business demands Identified ability to grow into a valuable contributor to the practice and, specifically -have an external presence via public speaking, conferences, and/or publicationshave credibility, executive presence, and gravitasbe able to have a meaningful and rapid delivery contributionhave the potential and capacity to understand all aspects of the business and an excellent understanding of PANW productsbe collaborative and able to build relationships internally, externally, and across all PANW functions, including the sales teamBachelors Degree in Information Security, Computer Science, Digital Forensics, Cyber Security OR equivalent years of professional experience or equivalent military experience to meet job requirements and expectationsThe TeamUnit 42 Consulting is Palo Alto Network's security advisory team.  Our vision is to create a more secure digital world by providing the highest quality incident response, cyber risk management, and digital forensic services to clients of all sizes. Our team is composed of recognized experts and incident responders with deep technical expertise and experience in investigations, data breach response, digital forensics, and information security. With a highly successful track record of delivering mission-critical cybersecurity solutions, we are experienced in working quickly to provide an effective incident response, attack readiness, and remediation plans with a focus on providing long-term support to improve our clients security posture. Our Commitment

Were problem solvers that take risks and challenge cybersecuritys status quo. Its simple: we cant accomplish our mission without diverse teams innovating, together.We are committed to providing reasonable accommodations for all qualified individuals with a disability. If you require assistance or accommodation due to a disability or special need, please contact us at  accommodations@paloaltonetworks.com.Palo Alto Networks is an equal opportunity employer. We celebrate diversity in our workplace, and all qualified applicants will receive consideration for employment without regard to age, ancestry, color, family or medical care leave, gender identity or expression, genetic information, marital status, medical condition, national origin, physical or mental disability, political affiliation, protected veteran status, race, religion, sex (including pregnancy), sexual orientation, or other legally protected characteristics.All your information will be kept confidential according to EEO guidelines.
Covid-19 Vaccination Information for Palo Alto Networks JobsVaccine requirements and disclosure obligations vary by country.Unless applicable law requires otherwise, you must be vaccinated for COVID or qualify for a reasonable accommodation if:The job requires accessing a company worksiteThe job requires in-person customer contact and the customer has implemented such requirementsYou choose to access a Palo Alto Networks worksiteIf you have questions about the vaccine requirements of this particular position based on your location or job requirements, please inquire with the recruiter."
