"ID","Title","Link","Company","Location","Remote","Experience","EmploymentType","DatePosted","RoleDescription"
2987460,"Sr. Software Engineer, E-Commerce","https://careers.onepeloton.com/en/all-jobs/?gh_jid=6905465","Peloton","New York","No",5,"Full time","2025-06-19T02:05:19.649273Z","ABOUT THE ROLE
Peloton is looking for a Software Engineer on our E-Commerce team to help scale Peloton's $1+ billion e-commerce channel. This Senior Software Engineer will be responsible for growing and executing the technical roadmap of innovative features by partnering with your peers in product management, design, marketing, member support, international teams, etc. You should have a passion for the technical and operational excellence, and relentlessly championing best practices in a continuously evolving and dynamic environment.
YOUR DAILY IMPACT AT PELOTON

Help to evolve our platform to best in class by providing guidance to the teams in terms of technical strategy and excellency.
 API development experience with a variety of languages.
Develop on modern front-end web technologies, architectures, and building high performant user-friendly experiences on the web.
Write understandable, testable code with an eye towards maintainability, scalability and performance.
Drive cross-team dependencies and design docs to help promote a culture of learning and constant improvement. 
Partner with stakeholders to identify technical trade-offs and to make informed technical and product decisions.
Collaborate with other software engineers by taking part in pair programming and leading white boarding solutions, team discussions, and task breakdown etc.

YOU BRING TO PELOTON

 5+ years of software development experience.
Strong product and technical mindset.
Proven experience with Sprint Boot (or Spring), Java, Postgres, AWS, GraphQL, Docker, Kubernetes.
Have experience with Next, React and Typescript.
Ability to contribute consistently and positively in a high-paced, fast-changed environment.
Passionate about technology, new ideas, and always willing to learn new things.
Analytical and creative problem solver, with the flexibility to accommodate evolving business needs.
Expert understanding of object-oriented and/or functional programming design principles.
Good understanding of Agile, Lean, DevOps, and SRE principles.
Acute attention to detail and dedication to quality.

BONUS POINTS IF YOU

Have experience working within e-commerce. 3+ years of experience contributing to the architecture and design (architecture, design patterns, reliability and scaling) of new and current systems.
Have experience integrating and deploying to managed cloud infrastructure (AWS or GCP).
Have experience with microservices architecture and the backend-for-frontend pattern.
Are able to take a project from scoping requirements through actual execution and delivery.
Attend meetups, conferences, and participate in the software engineering community.
Contribute to open-source projects.
Have experience migrating a monolithic system to an ecosystem of microservices.
Have experience with or knowledge of TDD, DDD, CQRS and Event Sourcing.
Worked on a system that had to deal with internationalization and localization.

#LI-Hybrid
#LI-JS2
The base salary range represents the low and high end of the anticipated salary range for this position to be performed remotely from any Peloton office or facility, in any U.S. State and any location therein. The actual base salary offered for this position will depend on numerous factors including, without limitation, experience and business objectives. Our base salary is just one component of Pelotons competitive total rewards strategy that also includes annual equity awards and an Employee Stock Purchase Plan as well as other region-specific health and welfare benefits.
As an organization, one of our top priorities is to maintain the health and wellbeing for our employees and their family. To achieve this goal, we offer robust and comprehensive benefits including:

Medical, dental and vision insurance 
Generous paid time off policy
Short-term and long-term disability
Access to mental health services
401k, tuition reimbursement and student loan paydown plans
Employee Stock Purchase Plan
Fertility and adoption support and up to 18 weeks of paid parental leave 
Child care and family care discounts
Free access to Peloton Digital App and apparel and product discounts
Commuter benefits and Citi Bike Discount
Pet insurance and so much more!

Base Salary Range$138,800$194,400 USD 
ABOUT PELOTON:
Peloton (NASDAQ: PTON) provides Members with expert instruction, and world class content to create impactful and entertaining workout experiences for anyone, anywhere and at any stage in their fitness journey. At home, outdoors, traveling, or at the gym, Peloton brings together innovative hardware, distinctive software, and exclusive content. Founded in 2012 and headquartered in New York City, Peloton has millions of Members across the US, UK, Canada, Germany, Australia, and Austria. For more information, visit www.onepeloton.com.
Peloton is an equal opportunity employer and complies with all applicable federal, state, and local fair employment practices laws. Equal employment opportunity has been, and will continue to be, a fundamental principle at Peloton, where all team members, applicants, and other covered persons are considered on the basis of their personal capabilities and qualifications without discrimination because of race, color, religion, sex, age, national origin, disability, pregnancy, genetic information, military or veteran status, sexual orientation, gender identity or expression, marital and civil partnership/union status, alienage or citizenship status, creed, genetic predisposition or carrier status, unemployment status, familial status, domestic violence, sexual violence or stalking victim status, caregiver status, or any other protected characteristic as established by applicable law. This policy of equal employment opportunity applies to all practices and procedures relating to recruitment and hiring, compensation, benefits, termination, and all other terms and conditions of employment.  If you would like to request any accommodations from application through to interview, please email: applicantaccommodations@onepeloton.com.At Peloton, we embrace technology, including AI, to enhance productivity and accelerate innovation in the work we do for our members, However, in our hiring process, our priority remains in getting to know you and your unique qualifications. To ensure a fair and equitable process, we do not permit the use of AI tools during any stage of the application and interview process. In considering you as an applicant, we want to understand your skills, experiences, and motivations without mediation through an AI system. We also want to directly assess your communication skills without the use of an AI tool. Qualified applicants with arrest or conviction records will be considered for employment in accordance with the Los Angeles County Fair Chance Ordinance for Employers and the California Fair Chance Act, the City of Los Angeles Fair Chance Initiative for Hiring Ordinance and the San Francisco Fair Chance Ordinance, as applicable to applicants applying for positions in these jurisdictions.
Please be aware that fictitious job openings, consulting engagements, solicitations, or employment offers may be circulated on the Internet in an attempt to obtain privileged information, or to induce you to pay a fee for services related to recruitment or training. Peloton does NOT charge any application, processing, or training fee at any stage of the recruitment or hiring process. All genuine job openings will be posted here on our careers page and all communications from the Peloton recruiting team and/or hiring managers will be from an @onepeloton.com email address. 
If you have any doubts about the authenticity of an email, letter or telephone communication purportedly from, for, or on behalf of Peloton, please email applicantaccommodations@onepeloton.com before taking any further action in relation to the correspondence.
Peloton does not accept unsolicited agency resumes. Agencies should not forward resumes to our jobs alias, Peloton employees or any other organization location. Peloton is not responsible for any agency fees related to unsolicited resumes."
3106346,"Peloton Expert","https://careers.onepeloton.com/en/all-jobs/?gh_jid=6790065","Peloton","New York","No","Not specified","Full time","2025-06-19T02:05:19.649375Z","ABOUT THE ROLE
Upbeat, hardworking, and results-driven, our Peloton Experts are the front-line business drivers in Peloton's retail showrooms. They exhibit a keen knowledge of our product, services, and company. Above all, our Peloton Experts are strong communicators who are able to understand the needs of their clients, build long-lasting relationships with these clients and build a solid network for sales.
 
YOUR DAILY IMPACT AT PELOTON


Focus on achieving and exceeding individual sales goals


Maximize sales through excellent customer service, product knowledge, and merchandise presentation


Proactively utilize Salesforce to record and maintain client information and preferences to drive your business


Develop a deep knowledge and understanding of Peloton's products and brand image


Phone and email outreach to both established and developing clients to communicate updates, events, and follow-up


Provide outstanding customer service at all times


Work professionally with fellow sales specialists in a team environment


Help to maintain visual/physical standards of store


 
YOU BRING TO PELOTON


Prior sales experience - preferably in a customer-focused environment


Entrepreneurial spirit with a desire to exceed sales goals


Enthusiastic, energetic, and personable professional demeanor


Excellent written and verbal communication skills


Ambitious, hardworking and team-oriented


An appreciation of fitness and a balanced lifestyle


High school graduate or equivalent


Must be able to work nights, weekends, and holidays


Proficiency with MS applications (Word, Excel, etc), Apple Products, and Salesforce a plus


#LI-LB1
The actual base salary offered for this position will depend on numerous factors including, without limitation, experience and business objectives, and if the location for the job changes.
As an organization, one of our top priorities is to maintain the health and wellbeing for our employees and their family. To achieve this goal, we offer robust and comprehensive benefits including:

Medical, dental and vision insurance 
Generous paid time off policy
Short-term and long-term disability
Access to mental health services
401k, tuition reimbursement and student loan paydown plans
Employee Stock Purchase Plan
Fertility and adoption support and up to 18 weeks of paid parental leave 
Child care and family care discounts
Free access to Peloton Digital App and apparel and product discounts
Commuter benefits and Citi Bike Discount
Pet insurance and so much more!

Hourly Pay Rate$23$23 USD 
ABOUT PELOTON:
Peloton (NASDAQ: PTON) provides Members with expert instruction, and world class content to create impactful and entertaining workout experiences for anyone, anywhere and at any stage in their fitness journey. At home, outdoors, traveling, or at the gym, Peloton brings together innovative hardware, distinctive software, and exclusive content. Founded in 2012 and headquartered in New York City, Peloton has millions of Members across the US, UK, Canada, Germany, Australia, and Austria. For more information, visit www.onepeloton.com.
Peloton is an equal opportunity employer and complies with all applicable federal, state, and local fair employment practices laws. Equal employment opportunity has been, and will continue to be, a fundamental principle at Peloton, where all team members, applicants, and other covered persons are considered on the basis of their personal capabilities and qualifications without discrimination because of race, color, religion, sex, age, national origin, disability, pregnancy, genetic information, military or veteran status, sexual orientation, gender identity or expression, marital and civil partnership/union status, alienage or citizenship status, creed, genetic predisposition or carrier status, unemployment status, familial status, domestic violence, sexual violence or stalking victim status, caregiver status, or any other protected characteristic as established by applicable law. This policy of equal employment opportunity applies to all practices and procedures relating to recruitment and hiring, compensation, benefits, termination, and all other terms and conditions of employment.  If you would like to request any accommodations from application through to interview, please email: applicantaccommodations@onepeloton.com.At Peloton, we embrace technology, including AI, to enhance productivity and accelerate innovation in the work we do for our members, However, in our hiring process, our priority remains in getting to know you and your unique qualifications. To ensure a fair and equitable process, we do not permit the use of AI tools during any stage of the application and interview process. In considering you as an applicant, we want to understand your skills, experiences, and motivations without mediation through an AI system. We also want to directly assess your communication skills without the use of an AI tool. Qualified applicants with arrest or conviction records will be considered for employment in accordance with the Los Angeles County Fair Chance Ordinance for Employers and the California Fair Chance Act, the City of Los Angeles Fair Chance Initiative for Hiring Ordinance and the San Francisco Fair Chance Ordinance, as applicable to applicants applying for positions in these jurisdictions.
Please be aware that fictitious job openings, consulting engagements, solicitations, or employment offers may be circulated on the Internet in an attempt to obtain privileged information, or to induce you to pay a fee for services related to recruitment or training. Peloton does NOT charge any application, processing, or training fee at any stage of the recruitment or hiring process. All genuine job openings will be posted here on our careers page and all communications from the Peloton recruiting team and/or hiring managers will be from an @onepeloton.com email address. 
If you have any doubts about the authenticity of an email, letter or telephone communication purportedly from, for, or on behalf of Peloton, please email applicantaccommodations@onepeloton.com before taking any further action in relation to the correspondence.
Peloton does not accept unsolicited agency resumes. Agencies should not forward resumes to our jobs alias, Peloton employees or any other organization location. Peloton is not responsible for any agency fees related to unsolicited resumes."
2172437,"Software Engineer II, SwiftUI","https://careers.onepeloton.com/en/all-jobs/?gh_jid=6495827","Peloton","New York","No",2,"Full time","2025-06-19T02:05:19.649431Z","ABOUT THE ROLE
Peloton's Music team builds products and features for anything and everything related to music. We build tools for instructors, studios, and production teams to handle, select, play music, and construct workouts across all fields globally. We also provide internal music services globally.
YOUR DAILY IMPACT AT PELOTON

Collaborate with the team that builds features for the Music Platform for both iOS and MacOS
Work with our product, design, and backend teams to identify and advise the platform elements required to support client-side features
Write code that is readable, maintainable, detailed, and thoroughly tested
Evaluate and communicate engineering solutions and trade-offs to teammates and other, potentially non-technical teams

YOU BRING TO PELOTON

2+ years of experience
Familiarity with SwiftUI and UIKit (AppKit and Combine, are a plus)
Understanding of the concurrency APIs available on Apples platforms
Experience developing integrations with RESTful APIs
Experience building component based UIs
Experience writing appropriate test coverage with XCTest
Understanding of modern architecture patterns like Model-View-View Model (MVVM)
Experience with Git
Experience shipping iOS applications
Knowledgeable around performance tuning, memory optimization, monitoring, and crash analysis
Experience with crash analysis and debugging tools
Familiarity with continuous build systems
Experience with music or audio application development
Have previous exposure to a Test-First Development environment
Have experience working in an Agile environment
Have OSS Project(s) or give to OSS communities

#LI-Hybrid
#LI-TP1
 
The base salary range represents the low and high end of the anticipated salary range for this position to be performed remotely from any Peloton office or facility, in any U.S. State and any location therein. The actual base salary offered for this position will depend on numerous factors including, without limitation, experience and business objectives. Our base salary is just one component of Pelotons competitive total rewards strategy that also includes annual equity awards and an Employee Stock Purchase Plan as well as other region-specific health and welfare benefits.
As an organization, one of our top priorities is to maintain the health and wellbeing for our employees and their family. To achieve this goal, we offer robust and comprehensive benefits including:

Medical, dental and vision insurance 
Generous paid time off policy
Short-term and long-term disability
Access to mental health services
401k, tuition reimbursement and student loan paydown plans
Employee Stock Purchase Plan
Fertility and adoption support and up to 18 weeks of paid parental leave 
Child care and family care discounts
Free access to Peloton Digital App and apparel and product discounts
Commuter benefits and Citi Bike Discount
Pet insurance and so much more!

Base Salary Range$92,600$124,900 USD 
ABOUT PELOTON:
Peloton (NASDAQ: PTON) provides Members with expert instruction, and world class content to create impactful and entertaining workout experiences for anyone, anywhere and at any stage in their fitness journey. At home, outdoors, traveling, or at the gym, Peloton brings together innovative hardware, distinctive software, and exclusive content. Founded in 2012 and headquartered in New York City, Peloton has millions of Members across the US, UK, Canada, Germany, Australia, and Austria. For more information, visit www.onepeloton.com.
Peloton is an equal opportunity employer and complies with all applicable federal, state, and local fair employment practices laws. Equal employment opportunity has been, and will continue to be, a fundamental principle at Peloton, where all team members, applicants, and other covered persons are considered on the basis of their personal capabilities and qualifications without discrimination because of race, color, religion, sex, age, national origin, disability, pregnancy, genetic information, military or veteran status, sexual orientation, gender identity or expression, marital and civil partnership/union status, alienage or citizenship status, creed, genetic predisposition or carrier status, unemployment status, familial status, domestic violence, sexual violence or stalking victim status, caregiver status, or any other protected characteristic as established by applicable law. This policy of equal employment opportunity applies to all practices and procedures relating to recruitment and hiring, compensation, benefits, termination, and all other terms and conditions of employment.  If you would like to request any accommodations from application through to interview, please email: applicantaccommodations@onepeloton.com.At Peloton, we embrace technology, including AI, to enhance productivity and accelerate innovation in the work we do for our members, However, in our hiring process, our priority remains in getting to know you and your unique qualifications. To ensure a fair and equitable process, we do not permit the use of AI tools during any stage of the application and interview process. In considering you as an applicant, we want to understand your skills, experiences, and motivations without mediation through an AI system. We also want to directly assess your communication skills without the use of an AI tool. Qualified applicants with arrest or conviction records will be considered for employment in accordance with the Los Angeles County Fair Chance Ordinance for Employers and the California Fair Chance Act, the City of Los Angeles Fair Chance Initiative for Hiring Ordinance and the San Francisco Fair Chance Ordinance, as applicable to applicants applying for positions in these jurisdictions.
Please be aware that fictitious job openings, consulting engagements, solicitations, or employment offers may be circulated on the Internet in an attempt to obtain privileged information, or to induce you to pay a fee for services related to recruitment or training. Peloton does NOT charge any application, processing, or training fee at any stage of the recruitment or hiring process. All genuine job openings will be posted here on our careers page and all communications from the Peloton recruiting team and/or hiring managers will be from an @onepeloton.com email address. 
If you have any doubts about the authenticity of an email, letter or telephone communication purportedly from, for, or on behalf of Peloton, please email applicantaccommodations@onepeloton.com before taking any further action in relation to the correspondence.
Peloton does not accept unsolicited agency resumes. Agencies should not forward resumes to our jobs alias, Peloton employees or any other organization location. Peloton is not responsible for any agency fees related to unsolicited resumes."
