"ID","Title","Link","Company","Location","Remote","Experience","EmploymentType","DatePosted","RoleDescription"
2764883,"iOS Software Engineer III","https://careers.onepeloton.com/en/all-jobs/?gh_jid=6791361","Peloton","New York","No",3,"Full time","2025-06-19T02:05:19.650716Z","ABOUT THE ROLE
Our team owns the apps that bring Pelotons workout experience to iOS, tvOS, and watchOS.We build native Swift applications that engage our members who own Peloton hardware as wellas those members whose only touchpoint with the brand is via their mobile device or TV.Pelotons mobile apps are an important and growing focus for the company, as they provide aneasy way for new users to engage with Pelotons high-quality content at a greater range of pricepoints. In this role, you will work with the team that builds features for the Peloton iOS, tvOS, andwatchOS applications. You will also work with our Product, Design, and backend teams toidentify and inform the platform elements required to support client-side features.
YOUR DAILY IMPACT AT PELOTON Work with frameworks and technologies like SwiftUI, RxSwift, CoreBluetooth, HealthKit,CoreLocation, CoreMotion, AVFoundation, and more Participate in the development of features Be part of an exceptionally encouraging team that values feedback, both positive and forcareer growth Work with our cross-functional partners, including Product, Design, API, and QA teams Participate in Architecture meetings to help ensure our apps meet the highest qualitystandards Develop features across iOS, iPadOS, tvOS and watchOS apps as needed Ownershipbe part of a small team that ships an application to a large user base
YOU BRING TO PELOTON 3+ years of experience developing iOS applications, or equivalent education. Ability to write code that is readable, maintainable, documented, and thoroughly tested. Familiarity with UIKit (SwiftUI and Combine are a plus) and Auto Layout. Experience developing integrations with RESTful APIs. An understanding of modern architecture patterns like Model-View-View Model (MVVM). Experience with Git. Ability to effectively translate Product, UX, and UI requirements into codeimplementation. Ability to evaluate and communicate engineering solutions and trade-offs to teammatesand other, potentially non-technical teams.
#LI-JS2
#LI-Hybrid
The base salary range represents the low and high end of the anticipated salary range for this position based at our New York City headquarters. The actual base salary offered for this position will depend on numerous factors including, without limitation, experience and business objectives and if the location for the job changes. Our base salary is just one component of Pelotons competitive total rewards strategy that also includes annual equity awards and an Employee Stock Purchase Plan as well as other region-specific health and welfare benefits.
As an organization, one of our top priorities is to maintain the health and wellbeing for our employees and their family. To achieve this goal, we offer robust and comprehensive benefits including:

Medical, dental and vision insurance 
Generous paid time off policy
Short-term and long-term disability
Access to mental health services
401k, tuition reimbursement and student loan paydown plans
Employee Stock Purchase Plan
Fertility and adoption support and up to 18 weeks of paid parental leave 
Child care and family care discounts
Free access to Peloton Digital App and apparel and product discounts
Commuter benefits and Citi Bike Discount
Pet insurance and so much more!

Base Salary Range$140,400$166,100 USD 
ABOUT PELOTON:
Peloton (NASDAQ: PTON) provides Members with expert instruction, and world class content to create impactful and entertaining workout experiences for anyone, anywhere and at any stage in their fitness journey. At home, outdoors, traveling, or at the gym, Peloton brings together innovative hardware, distinctive software, and exclusive content. Founded in 2012 and headquartered in New York City, Peloton has millions of Members across the US, UK, Canada, Germany, Australia, and Austria. For more information, visit www.onepeloton.com.
Peloton is an equal opportunity employer and complies with all applicable federal, state, and local fair employment practices laws. Equal employment opportunity has been, and will continue to be, a fundamental principle at Peloton, where all team members, applicants, and other covered persons are considered on the basis of their personal capabilities and qualifications without discrimination because of race, color, religion, sex, age, national origin, disability, pregnancy, genetic information, military or veteran status, sexual orientation, gender identity or expression, marital and civil partnership/union status, alienage or citizenship status, creed, genetic predisposition or carrier status, unemployment status, familial status, domestic violence, sexual violence or stalking victim status, caregiver status, or any other protected characteristic as established by applicable law. This policy of equal employment opportunity applies to all practices and procedures relating to recruitment and hiring, compensation, benefits, termination, and all other terms and conditions of employment.  If you would like to request any accommodations from application through to interview, please email: applicantaccommodations@onepeloton.com.At Peloton, we embrace technology, including AI, to enhance productivity and accelerate innovation in the work we do for our members, However, in our hiring process, our priority remains in getting to know you and your unique qualifications. To ensure a fair and equitable process, we do not permit the use of AI tools during any stage of the application and interview process. In considering you as an applicant, we want to understand your skills, experiences, and motivations without mediation through an AI system. We also want to directly assess your communication skills without the use of an AI tool. Qualified applicants with arrest or conviction records will be considered for employment in accordance with the Los Angeles County Fair Chance Ordinance for Employers and the California Fair Chance Act, the City of Los Angeles Fair Chance Initiative for Hiring Ordinance and the San Francisco Fair Chance Ordinance, as applicable to applicants applying for positions in these jurisdictions.
Please be aware that fictitious job openings, consulting engagements, solicitations, or employment offers may be circulated on the Internet in an attempt to obtain privileged information, or to induce you to pay a fee for services related to recruitment or training. Peloton does NOT charge any application, processing, or training fee at any stage of the recruitment or hiring process. All genuine job openings will be posted here on our careers page and all communications from the Peloton recruiting team and/or hiring managers will be from an @onepeloton.com email address. 
If you have any doubts about the authenticity of an email, letter or telephone communication purportedly from, for, or on behalf of Peloton, please email applicantaccommodations@onepeloton.com before taking any further action in relation to the correspondence.
Peloton does not accept unsolicited agency resumes. Agencies should not forward resumes to our jobs alias, Peloton employees or any other organization location. Peloton is not responsible for any agency fees related to unsolicited resumes."
2727148,"Treasury Associate","https://careers.onepeloton.com/en/all-jobs/?gh_jid=6759774","Peloton","New York","No",2,"Full time","2025-06-19T02:05:19.650756Z","ABOUT THE ROLE
The Peloton Treasury Team is looking for a talented treasury professional to join our team! The ideal candidate is a self-starter, analytical, attentive to detail, and highly organized. Moreover, the candidate is someone who consistently exceeds expectations and excels in quantitative and qualitative analytics. Having a solid foundation in Treasury and an interest in capital markets and macroeconomic trends is a plus. The Associate will support Pelotons banking activities, liquidity management and analytics, capital market reporting, maintenance of procedures, and support ad-hoc Treasury projects. The Associate will have the opportunity to regularly collaborate cross-functionally and quickly gain exposure to many areas of Treasury.
YOUR DAILY IMPACT AT PELOTON:

Collaborate internally and externally to ensure timely and accurate processing of Treasury payments, including wires and ACH, FX, and credit card activity.
Maintain global cash positions and short-term cash forecasts to ensure sufficient liquidity to cover payment activities.
Develop clear understanding of and interconnectivity between payment-related systems to resolve payment and reconciliation issues.
Track financial covenant compliance for Pelotons credit facilities.
Monitor market conditions, interest rates, and economic indicators that impact Treasury, capital market, and reporting workflows.
Prepare analyses supporting investments, payment execution, capital markets and broader Treasury initiatives.
Support ad-hoc projects and reporting for insurance, T&amp;E, and consumer finance workstreams.

YOU BRING TO PELOTON:

Bachelors Degree in Finance, Economics, Accounting, or related field.
2-3 years relevant Treasury or finance experience.
Understanding of cash management, payment processes, and Treasury systems.
Experience with Excel (vlookups, pivot tables, conditional formatting).
Excellent analytical skills and ability to identify areas to improve processes.
Strong problem solving and decision-making skills with an analytical mindset.
Experience with FX and investment management concepts.
Familiarity with treasury management systems and ERP experience (Kyriba, Netsuite, etc.)
Familiarity with and interest in capital markets and macroeconomic analysis.
Demonstrated ability to successfully manage multiple workstreams simultaneously.

#LI-EV1
#LI-HYBRID
The base salary range represents the low and high end of the anticipated salary range for this position based at our New York City headquarters. The actual base salary offered for this position will depend on numerous factors including, without limitation, experience and business objectives and if the location for the job changes. Our base salary is just one component of Pelotons competitive total rewards strategy that also includes annual equity awards and an Employee Stock Purchase Plan as well as other region-specific health and welfare benefits.
As an organization, one of our top priorities is to maintain the health and wellbeing for our employees and their family. To achieve this goal, we offer robust and comprehensive benefits including:

Medical, dental and vision insurance 
Generous paid time off policy
Short-term and long-term disability
Access to mental health services
401k, tuition reimbursement and student loan paydown plans
Employee Stock Purchase Plan
Fertility and adoption support and up to 18 weeks of paid parental leave 
Child care and family care discounts
Free access to Peloton Digital App and apparel and product discounts
Commuter benefits and Citi Bike Discount
Pet insurance and so much more!

Base Salary Range$84,250$99,650 USD 
ABOUT PELOTON:
Peloton (NASDAQ: PTON) provides Members with expert instruction, and world class content to create impactful and entertaining workout experiences for anyone, anywhere and at any stage in their fitness journey. At home, outdoors, traveling, or at the gym, Peloton brings together innovative hardware, distinctive software, and exclusive content. Founded in 2012 and headquartered in New York City, Peloton has millions of Members across the US, UK, Canada, Germany, Australia, and Austria. For more information, visit www.onepeloton.com.
Peloton is an equal opportunity employer and complies with all applicable federal, state, and local fair employment practices laws. Equal employment opportunity has been, and will continue to be, a fundamental principle at Peloton, where all team members, applicants, and other covered persons are considered on the basis of their personal capabilities and qualifications without discrimination because of race, color, religion, sex, age, national origin, disability, pregnancy, genetic information, military or veteran status, sexual orientation, gender identity or expression, marital and civil partnership/union status, alienage or citizenship status, creed, genetic predisposition or carrier status, unemployment status, familial status, domestic violence, sexual violence or stalking victim status, caregiver status, or any other protected characteristic as established by applicable law. This policy of equal employment opportunity applies to all practices and procedures relating to recruitment and hiring, compensation, benefits, termination, and all other terms and conditions of employment.  If you would like to request any accommodations from application through to interview, please email: applicantaccommodations@onepeloton.com.At Peloton, we embrace technology, including AI, to enhance productivity and accelerate innovation in the work we do for our members, However, in our hiring process, our priority remains in getting to know you and your unique qualifications. To ensure a fair and equitable process, we do not permit the use of AI tools during any stage of the application and interview process. In considering you as an applicant, we want to understand your skills, experiences, and motivations without mediation through an AI system. We also want to directly assess your communication skills without the use of an AI tool. Qualified applicants with arrest or conviction records will be considered for employment in accordance with the Los Angeles County Fair Chance Ordinance for Employers and the California Fair Chance Act, the City of Los Angeles Fair Chance Initiative for Hiring Ordinance and the San Francisco Fair Chance Ordinance, as applicable to applicants applying for positions in these jurisdictions.
Please be aware that fictitious job openings, consulting engagements, solicitations, or employment offers may be circulated on the Internet in an attempt to obtain privileged information, or to induce you to pay a fee for services related to recruitment or training. Peloton does NOT charge any application, processing, or training fee at any stage of the recruitment or hiring process. All genuine job openings will be posted here on our careers page and all communications from the Peloton recruiting team and/or hiring managers will be from an @onepeloton.com email address. 
If you have any doubts about the authenticity of an email, letter or telephone communication purportedly from, for, or on behalf of Peloton, please email applicantaccommodations@onepeloton.com before taking any further action in relation to the correspondence.
Peloton does not accept unsolicited agency resumes. Agencies should not forward resumes to our jobs alias, Peloton employees or any other organization location. Peloton is not responsible for any agency fees related to unsolicited resumes."
2655986,"Sr. Industrial Designer","https://careers.onepeloton.com/en/all-jobs/?gh_jid=6711231","Peloton","Taipei","No",10,"Full time","2025-06-19T02:05:19.650789Z","ABOUT THE ROLEThis is an opportunity to join the Industrial Design team for an industry-leading family of fitness products and accessories. You will lead our consumer electronics hardware's functional, aesthetic, and user experience aspects. In this role, you will work closely with our passionate team of designers, product managers, engineers, marketers, outside vendors, and key business partners to develop new products and features.As a Color, Material, and Finish (CMF) Design Lead - at Peloton, you will be responsible for leading CMF strategies and projects for all hard products in our core line. You will work hand in hand with the ID team in collaboration with Engineering and Sourcing to develop a CMF strategy for our long-term road map. Your ability to speak to upper management and cross-functional departments will be an asset to promoting design insights and direction to the entire organization.YOUR DAILY IMPACT AT PELOTON

Support across all categories the respective ID teams on live programs with CMF direction by designing concepts, and providing needed color palettes and material specifications.
Creating CMF-relevant deliverables for program achievements leading towards production.
Create and maintain an internal library system for organizing color, material, and texture
Develop a master sample chip library that is unique to Peloton
Analyze and approve colors, materials, and finishes at different stages of the development process.
Partner with Peloton's internal sourcing team and external vendors to develop standards for production.
Drive critical initiatives to enhance the role of CMF on product development and in the wider development process.
Develop a relationship with internal and external trend forecasting resources to create seasonal trend presentations for the design team, product, and creative teams to keep the teams informed of up and coming market trends
Understand material trends and forecast innovative materials used in various Hard and Soft Goods applications across multiple industries including fitness, cycling, and consumer electronics.
Become a leader with a vision for all things CMF and help to sharpen and expand the awareness and importance of CMF.

YOU BRING TO PELOTON

Must have a Bachelor's Degree in Industrial Design, Textile Design, or a related field.
10+ years working in a relevant field of design
Exceptional visual, communication, and presentation skills.
Proficient in Photoshop, Illustrator, InDesign Key, and word processing (Basic Solidworks, CAD, KeyShot are a plus).
You can manage your workload and operate individually.
Able to travel to shows and suppliers both domestically and internationally.
Previous experience growing a team and managing junior designers
 
ABOUT PELOTON:
Peloton (NASDAQ: PTON) provides Members with expert instruction, and world class content to create impactful and entertaining workout experiences for anyone, anywhere and at any stage in their fitness journey. At home, outdoors, traveling, or at the gym, Peloton brings together innovative hardware, distinctive software, and exclusive content. Founded in 2012 and headquartered in New York City, Peloton has millions of Members across the US, UK, Canada, Germany, Australia, and Austria. For more information, visit www.onepeloton.com.
Peloton is an equal opportunity employer and complies with all applicable federal, state, and local fair employment practices laws. Equal employment opportunity has been, and will continue to be, a fundamental principle at Peloton, where all team members, applicants, and other covered persons are considered on the basis of their personal capabilities and qualifications without discrimination because of race, color, religion, sex, age, national origin, disability, pregnancy, genetic information, military or veteran status, sexual orientation, gender identity or expression, marital and civil partnership/union status, alienage or citizenship status, creed, genetic predisposition or carrier status, unemployment status, familial status, domestic violence, sexual violence or stalking victim status, caregiver status, or any other protected characteristic as established by applicable law. This policy of equal employment opportunity applies to all practices and procedures relating to recruitment and hiring, compensation, benefits, termination, and all other terms and conditions of employment.  If you would like to request any accommodations from application through to interview, please email: applicantaccommodations@onepeloton.com.At Peloton, we embrace technology, including AI, to enhance productivity and accelerate innovation in the work we do for our members, However, in our hiring process, our priority remains in getting to know you and your unique qualifications. To ensure a fair and equitable process, we do not permit the use of AI tools during any stage of the application and interview process. In considering you as an applicant, we want to understand your skills, experiences, and motivations without mediation through an AI system. We also want to directly assess your communication skills without the use of an AI tool. Qualified applicants with arrest or conviction records will be considered for employment in accordance with the Los Angeles County Fair Chance Ordinance for Employers and the California Fair Chance Act, the City of Los Angeles Fair Chance Initiative for Hiring Ordinance and the San Francisco Fair Chance Ordinance, as applicable to applicants applying for positions in these jurisdictions.
Please be aware that fictitious job openings, consulting engagements, solicitations, or employment offers may be circulated on the Internet in an attempt to obtain privileged information, or to induce you to pay a fee for services related to recruitment or training. Peloton does NOT charge any application, processing, or training fee at any stage of the recruitment or hiring process. All genuine job openings will be posted here on our careers page and all communications from the Peloton recruiting team and/or hiring managers will be from an @onepeloton.com email address. 
If you have any doubts about the authenticity of an email, letter or telephone communication purportedly from, for, or on behalf of Peloton, please email applicantaccommodations@onepeloton.com before taking any further action in relation to the correspondence.
Peloton does not accept unsolicited agency resumes. Agencies should not forward resumes to our jobs alias, Peloton employees or any other organization location. Peloton is not responsible for any agency fees related to unsolicited resumes."
