"ID","Title","Link","Company","Location","Remote","Experience","EmploymentType","DatePosted","RoleDescription"
2932880,"Financial Analyst, Financial Planning and Analysis (FTC)","https://careers.onepeloton.com/en/all-jobs/?gh_jid=6866389","Peloton","London, England","No","Not specified","Full time","2025-06-19T02:05:19.650177Z","ABOUT THE ROLE
Peloton is looking for a hard-working, motivated Financial Analyst who will play a critical role in supporting demand planning, financial forecasting and management reporting for the International business; providing financial planning analysis and data-driven insights and assisting with business performance updates to support decision-making across multiple departments within Peloton. The ideal candidate has prior experience with demand forecasting with a history of using traffic and conversion metrics to deliver these forecasts. This person is also adept at communicating their results clearly and concisely, is confident presenting in front of senior stakeholders, possesses strong prioritsation skills, and demonstrates a desire to continually raise the bar of their work.This person will work closely with cross-functional teams and corporate leaders to provide forecasting, reporting, and strategic support.
12-month fixed-term contract
YOUR DAILY IMPACT AT PELOTON

Demand Forecasting: Develop and maintain demand forecasts for Peloton products across international markets, incorporating historical data, market trends, seasonality, and other relevant factors. You will communicate any impactful insights to the wider organisation, enabling them to have a better understanding of International demand and the factors that influence it. Prior experience using traffic and conversion to forecast demand is strongly desired.
Demand Analysis: Analyse demand patterns, including SKU-level demand, pricing variations, promotions and geographical variations, to provide actionable insights for decision-making.
Financial Forecasting: Assist in the preparation and maintenance of monthly, quarterly and annual financial forecasts. Co-ordinating inputs from multiple stakeholders and software to create a financial plan for the business with a focus on sales and revenue, assisting with other areas as needed
Management Reporting: Support the monthly close process through partnership with Accounting as well as the Global FP&amp;A team based in New York City. Assist in monthly and quarterly internal reporting, including driving insightful analyses to explain trends and any variance to plans
Cross-Functional Communication: Work closely with the cross functional teams to update business analyses and financial models required for budgeting, forecasting and long-range planning. Assist in the creation of ad-hoc analyses for cross-functional leaders and help to identify key trends and potential risks and opportunities across the business

YOU BRING TO PELOTON

Experience in forecasting, financial planning or a related role, preferably in a consumer goods or direct-to-consumer environment
Advanced Excel / PowerPoint / Financial Modeling skills (and G-Suite equivalent)
Hands-on experience with reporting and data visualization tools such as Looker, Tableau, etc.; Looker preferred
Hands-on experience with financial reporting software such as NetSuite
Experience with international consolidation and reporting a plus
Strong analytical and quantitative skills, with the ability to work with large datasets and interpret complex data.
Excellent communication skills with the ability to present complex data-driven insights to non-technical stakeholders.
An organised and diligent approach to solving open-ended problems.
Strong attention to detail and problem-solving abilities.
Ability to work in a fast-paced, collaborative environment and adapt to changing priorities.

#LI-Hybrid  #LI-MS2 
ABOUT PELOTON:
Peloton (NASDAQ: PTON) provides Members with expert instruction, and world class content to create impactful and entertaining workout experiences for anyone, anywhere and at any stage in their fitness journey. At home, outdoors, traveling, or at the gym, Peloton brings together innovative hardware, distinctive software, and exclusive content. Founded in 2012 and headquartered in New York City, Peloton has millions of Members across the US, UK, Canada, Germany, Australia, and Austria. For more information, visit www.onepeloton.com.
Peloton is an equal opportunity employer and complies with all applicable federal, state, and local fair employment practices laws. Equal employment opportunity has been, and will continue to be, a fundamental principle at Peloton, where all team members, applicants, and other covered persons are considered on the basis of their personal capabilities and qualifications without discrimination because of race, color, religion, sex, age, national origin, disability, pregnancy, genetic information, military or veteran status, sexual orientation, gender identity or expression, marital and civil partnership/union status, alienage or citizenship status, creed, genetic predisposition or carrier status, unemployment status, familial status, domestic violence, sexual violence or stalking victim status, caregiver status, or any other protected characteristic as established by applicable law. This policy of equal employment opportunity applies to all practices and procedures relating to recruitment and hiring, compensation, benefits, termination, and all other terms and conditions of employment.  If you would like to request any accommodations from application through to interview, please email: applicantaccommodations@onepeloton.com.At Peloton, we embrace technology, including AI, to enhance productivity and accelerate innovation in the work we do for our members, However, in our hiring process, our priority remains in getting to know you and your unique qualifications. To ensure a fair and equitable process, we do not permit the use of AI tools during any stage of the application and interview process. In considering you as an applicant, we want to understand your skills, experiences, and motivations without mediation through an AI system. We also want to directly assess your communication skills without the use of an AI tool. Qualified applicants with arrest or conviction records will be considered for employment in accordance with the Los Angeles County Fair Chance Ordinance for Employers and the California Fair Chance Act, the City of Los Angeles Fair Chance Initiative for Hiring Ordinance and the San Francisco Fair Chance Ordinance, as applicable to applicants applying for positions in these jurisdictions.
Please be aware that fictitious job openings, consulting engagements, solicitations, or employment offers may be circulated on the Internet in an attempt to obtain privileged information, or to induce you to pay a fee for services related to recruitment or training. Peloton does NOT charge any application, processing, or training fee at any stage of the recruitment or hiring process. All genuine job openings will be posted here on our careers page and all communications from the Peloton recruiting team and/or hiring managers will be from an @onepeloton.com email address. 
If you have any doubts about the authenticity of an email, letter or telephone communication purportedly from, for, or on behalf of Peloton, please email applicantaccommodations@onepeloton.com before taking any further action in relation to the correspondence.
Peloton does not accept unsolicited agency resumes. Agencies should not forward resumes to our jobs alias, Peloton employees or any other organization location. Peloton is not responsible for any agency fees related to unsolicited resumes."
2926806,"Staff Software Engineer, Context Experience","https://careers.onepeloton.com/en/all-jobs/?gh_jid=6866388","Peloton","New York","No",8,"Full time","2025-06-19T02:05:19.650206Z","ABOUT THE ROLE
The Content Experiences team is responsible for the core content browsing experience at Peloton, including supporting the homescreen, class library, scheduling features, and tooling for internal production stakeholders. We are looking for a passionate Staff Software Engineer/Tech Lead. This person will provide technical leadership as the team designs, builds, and deploys innovative products and services while scaling our architecture to support many more millions of members. We are looking for proven experience in areas including API and data modeling, system design, and service migration and development. At Peloton, intelligent and motivated engineers can have a tremendous impact on what we create and how we create it. Help us build the future of fitness!
YOUR DAILY IMPACT AT PELOTON


Enhance and operate business-critical APIs and services with a focus on high availability, low latency, security and scalability


Propose, experiment, and implement solutions to scale services while meeting business and product requirements


Leverage production monitoring/profiling/tracing and load testing tools to discover bottlenecks and using techniques such as data modeling, query optimization, and caching to address the bottlenecks


Be a technical leader within the team you work with and cross functionally within Peloton


Be able to identify common patterns as well as develop and foster development of reusable components and standards across teams


Coordinate technical projects across teams within Peloton


Be a valued member of an autonomous, multi-functional agile team


Use industry-standard, cloud-native tech, which means easily transferable skills


Bring in best practices of software development in your team and evangelize across teams


YOU BRING TO PELOTON


8+ years of experience developing high-performance, highly scalable backend cloud application systems


A valued team player in a dynamic, autonomous, cross-functional agile team that inspires others


Hands-on experience building, testing, deploying, and monitoring services


Expertise in Kotlin, Python, or similar languages


Hands-on experience decomposing monoliths into microservices


Hands-on experience implementing event-driven architectures


Experience interfacing with members of other teams to gain clarity, triage issues, and drive cross-functional initiatives


Experience with both relational (e.g. PostgreSQL, MySQL) and NoSQL (e.g. DynamoDB, Cassandra, Mongo) databases


Experience with caching technologies such as Memache, Redis


Experience with request processing such as REST or gRPC


Familiar with deployment toolings/environments such as Kubernetes, Terraform, GitHub Actions, Jenkins etc


The base salary range represents the low and high end of the anticipated salary range for this position based at our New York City headquarters. The actual base salary offered for this position will depend on numerous factors including, without limitation, experience and business objectives and if the location for the job changes. Our base salary is just one component of Pelotons competitive total rewards strategy that also includes annual equity awards and an Employee Stock Purchase Plan as well as other region-specific health and welfare benefits.
As an organization, one of our top priorities is to maintain the health and wellbeing for our employees and their family. To achieve this goal, we offer robust and comprehensive benefits including:

Medical, dental and vision insurance 
Generous paid time off policy
Short-term and long-term disability
Access to mental health services
401k, tuition reimbursement and student loan paydown plans
Employee Stock Purchase Plan
Fertility and adoption support and up to 18 weeks of paid parental leave 
Child care and family care discounts
Free access to Peloton Digital App and apparel and product discounts
Commuter benefits and Citi Bike Discount
Pet insurance and so much more!

Base Salary Range$201,000$246,950 USD 
ABOUT PELOTON:
Peloton (NASDAQ: PTON) provides Members with expert instruction, and world class content to create impactful and entertaining workout experiences for anyone, anywhere and at any stage in their fitness journey. At home, outdoors, traveling, or at the gym, Peloton brings together innovative hardware, distinctive software, and exclusive content. Founded in 2012 and headquartered in New York City, Peloton has millions of Members across the US, UK, Canada, Germany, Australia, and Austria. For more information, visit www.onepeloton.com.
Peloton is an equal opportunity employer and complies with all applicable federal, state, and local fair employment practices laws. Equal employment opportunity has been, and will continue to be, a fundamental principle at Peloton, where all team members, applicants, and other covered persons are considered on the basis of their personal capabilities and qualifications without discrimination because of race, color, religion, sex, age, national origin, disability, pregnancy, genetic information, military or veteran status, sexual orientation, gender identity or expression, marital and civil partnership/union status, alienage or citizenship status, creed, genetic predisposition or carrier status, unemployment status, familial status, domestic violence, sexual violence or stalking victim status, caregiver status, or any other protected characteristic as established by applicable law. This policy of equal employment opportunity applies to all practices and procedures relating to recruitment and hiring, compensation, benefits, termination, and all other terms and conditions of employment.  If you would like to request any accommodations from application through to interview, please email: applicantaccommodations@onepeloton.com.At Peloton, we embrace technology, including AI, to enhance productivity and accelerate innovation in the work we do for our members, However, in our hiring process, our priority remains in getting to know you and your unique qualifications. To ensure a fair and equitable process, we do not permit the use of AI tools during any stage of the application and interview process. In considering you as an applicant, we want to understand your skills, experiences, and motivations without mediation through an AI system. We also want to directly assess your communication skills without the use of an AI tool. Qualified applicants with arrest or conviction records will be considered for employment in accordance with the Los Angeles County Fair Chance Ordinance for Employers and the California Fair Chance Act, the City of Los Angeles Fair Chance Initiative for Hiring Ordinance and the San Francisco Fair Chance Ordinance, as applicable to applicants applying for positions in these jurisdictions.
Please be aware that fictitious job openings, consulting engagements, solicitations, or employment offers may be circulated on the Internet in an attempt to obtain privileged information, or to induce you to pay a fee for services related to recruitment or training. Peloton does NOT charge any application, processing, or training fee at any stage of the recruitment or hiring process. All genuine job openings will be posted here on our careers page and all communications from the Peloton recruiting team and/or hiring managers will be from an @onepeloton.com email address. 
If you have any doubts about the authenticity of an email, letter or telephone communication purportedly from, for, or on behalf of Peloton, please email applicantaccommodations@onepeloton.com before taking any further action in relation to the correspondence.
Peloton does not accept unsolicited agency resumes. Agencies should not forward resumes to our jobs alias, Peloton employees or any other organization location. Peloton is not responsible for any agency fees related to unsolicited resumes."
2926805,"Manager, Member Lifecycle Marketing","https://careers.onepeloton.com/en/all-jobs/?gh_jid=6842681","Peloton","New York","No",5,"Full time","2025-06-19T02:05:19.650243Z","ABOUT THE ROLE 
Peloton is seeking a highly motivated, data-driven Manager, Membership Retention, to join our Membership Strategy &amp; Engagement team. This role is essential in driving churn prevention and member reactivation strategies through personalized, data-informed communications and lifecycle touchpoints.
Were looking for a strategic thinker with a passion for lifecycle marketing, proven retention expertise, and a deep understanding of the customer journey. This role is ideal for someone who thrives in a fast-paced environment, is comfortable with cross-functional collaboration, and wants to make a tangible impact on member satisfaction and business growth.
YOUR DAILY IMPACT AT PELOTON

Develop and execute targeted strategies to prevent churn and extend member lifetime value across key lifecycle stages.
Partner with Product Analytics and Data Science to leverage predictive churn models and risk scoring to activate timely, personalized retention strategies.
Build and test re-engagement journeys for inactive members, using behavioral segmentation and performance insights.
Own and optimize reactivation campaigns for recently cancelled members, including win-back offers and personalized messaging.
Continuously improve the cancellation funnel to reduce completions, increase save rates, and collect actionable feedback.
Launch and manage automated reactivation flows for paused and cancelled members, leveraging key lifecycle triggers.
Design and deploy soft churn mitigation campaigns, such as payment recovery and usage-based nudges.
Develop pause lifecycle strategies that drive timely reactivation and maintain member value during downtime.
Collaborate cross-functionally to ensure churn initiatives align with broader business goals, product updates, and member insights.

YOU BRING TO PELOTON

5+ years in lifecycle, CRM, or retention marketing roles, with 4+ years of hands-on experience managing multi-channel programs (email, SMS, push, in-app).
Experience in a subscription-based or DTC business is strongly preferred.
Technical Skills: Proficient in marketing automation tools (esp. Braze), with working knowledge of HTML and email design best practices. Bonus if experienced in building app banners or hardware-related messaging.
Analytical Ability: Skilled at analyzing complex datasets to extract insights and inform strategy. Familiarity with tools like Looker, Google Analytics, and Excel is a plus.
Project &amp; Stakeholder Management: Proven success leading cross-functional initiatives and managing multiple workstreams simultaneously. Comfortable working autonomously and collaboratively.
Creative &amp; Strategic Thinking: A blend of creative and analytical thinking with a strong understanding of member behavior and lifecycle drivers. Experience in designing compelling user journeys and retention touchpoints.
Communication: Excellent written and verbal communication skills, with experience creating clear and effective presentations for internal stakeholders and leadership teams.
Team-Oriented: A collaborative, team-first mindset with the ability to influence without authority and build strong partnerships across departments.

#LI-EV1
#HYBRID
The base salary range represents the low and high end of the anticipated salary range for this position based at our New York City headquarters. The actual base salary offered for this position will depend on numerous factors including, without limitation, experience and business objectives and if the location for the job changes. Our base salary is just one component of Pelotons competitive total rewards strategy that also includes annual equity awards and an Employee Stock Purchase Plan as well as other region-specific health and welfare benefits.
As an organization, one of our top priorities is to maintain the health and wellbeing for our employees and their family. To achieve this goal, we offer robust and comprehensive benefits including:

Medical, dental and vision insurance 
Generous paid time off policy
Short-term and long-term disability
Access to mental health services
401k, tuition reimbursement and student loan paydown plans
Employee Stock Purchase Plan
Fertility and adoption support and up to 18 weeks of paid parental leave 
Child care and family care discounts
Free access to Peloton Digital App and apparel and product discounts
Commuter benefits and Citi Bike Discount
Pet insurance and so much more!

Base Salary Range$139,900$171,850 USD 
ABOUT PELOTON:
Peloton (NASDAQ: PTON) provides Members with expert instruction, and world class content to create impactful and entertaining workout experiences for anyone, anywhere and at any stage in their fitness journey. At home, outdoors, traveling, or at the gym, Peloton brings together innovative hardware, distinctive software, and exclusive content. Founded in 2012 and headquartered in New York City, Peloton has millions of Members across the US, UK, Canada, Germany, Australia, and Austria. For more information, visit www.onepeloton.com.
Peloton is an equal opportunity employer and complies with all applicable federal, state, and local fair employment practices laws. Equal employment opportunity has been, and will continue to be, a fundamental principle at Peloton, where all team members, applicants, and other covered persons are considered on the basis of their personal capabilities and qualifications without discrimination because of race, color, religion, sex, age, national origin, disability, pregnancy, genetic information, military or veteran status, sexual orientation, gender identity or expression, marital and civil partnership/union status, alienage or citizenship status, creed, genetic predisposition or carrier status, unemployment status, familial status, domestic violence, sexual violence or stalking victim status, caregiver status, or any other protected characteristic as established by applicable law. This policy of equal employment opportunity applies to all practices and procedures relating to recruitment and hiring, compensation, benefits, termination, and all other terms and conditions of employment.  If you would like to request any accommodations from application through to interview, please email: applicantaccommodations@onepeloton.com.At Peloton, we embrace technology, including AI, to enhance productivity and accelerate innovation in the work we do for our members, However, in our hiring process, our priority remains in getting to know you and your unique qualifications. To ensure a fair and equitable process, we do not permit the use of AI tools during any stage of the application and interview process. In considering you as an applicant, we want to understand your skills, experiences, and motivations without mediation through an AI system. We also want to directly assess your communication skills without the use of an AI tool. Qualified applicants with arrest or conviction records will be considered for employment in accordance with the Los Angeles County Fair Chance Ordinance for Employers and the California Fair Chance Act, the City of Los Angeles Fair Chance Initiative for Hiring Ordinance and the San Francisco Fair Chance Ordinance, as applicable to applicants applying for positions in these jurisdictions.
Please be aware that fictitious job openings, consulting engagements, solicitations, or employment offers may be circulated on the Internet in an attempt to obtain privileged information, or to induce you to pay a fee for services related to recruitment or training. Peloton does NOT charge any application, processing, or training fee at any stage of the recruitment or hiring process. All genuine job openings will be posted here on our careers page and all communications from the Peloton recruiting team and/or hiring managers will be from an @onepeloton.com email address. 
If you have any doubts about the authenticity of an email, letter or telephone communication purportedly from, for, or on behalf of Peloton, please email applicantaccommodations@onepeloton.com before taking any further action in relation to the correspondence.
Peloton does not accept unsolicited agency resumes. Agencies should not forward resumes to our jobs alias, Peloton employees or any other organization location. Peloton is not responsible for any agency fees related to unsolicited resumes."
