"ID","Title","Link","Company","Location","Remote","Experience","EmploymentType","DatePosted","RoleDescription"
3051184,"Growth Builder (Contract) - DACH","https://job-boards.greenhouse.io/reddit/jobs/6945122","Reddit","Remote","Yes","Not specified","Contract","2025-06-19T02:05:20.291165Z","Reddit is a community of communities. Its built on shared interests, passion, and trust and is home to the most open and authentic conversations on the internet. Every day, Reddit users submit, vote, and comment on the topics they care most about. With 100,000+ active communities and approximately 101M+ daily active unique visitors, Reddit is one of the internets largest sources of information. For more information, visit redditinc.com.




The Reddit Growth Builder plays a key role in developing and expanding a vibrant ecosystem of communities on Reddit. As a Growth Builder in Germany, Austria, and Switzerland, you will be responsible for supporting Reddits goal of growing multiple communities by surfacing and promoting content that resonates most with the local user base. You will work closely with internal teams and external partners, playing a key role in amplifying content and engagement across German-speaking communities.Location: Open to remote candidates in Austria, Germany, the Netherlands, or Switzerland
Primary Responsibilities:

Support the setup of new subreddits, including styling, graphics, and community rules.
Identify, surface, and share content that is most engaging for local audiences.
Develop a deep understanding of the culture and needs of focus communities to tailor content and engagement strategies.
Collaborate with cross-functional teams to align on growth strategies.
Provide feedback on product features (e.g., user onboarding experiences, new feature launches) to ensure they align with the needs of the local market.
Conduct data analysis and research to help guide community growth initiatives and optimize content strategy.

Requirements:

Fluent in Swiss German, with a deep understanding of the countrys culture and language.
Bonus: Fluent in either French or Italian.
Experience working with external partners and pitching initiatives.
Strong familiarity with Reddit, its ecosystem, and user expectations.
Ability to quickly understand and adapt to the nuances of various topics and content verticals.
Ability to dedicate 20-40 hours per week on Reddit growth initiatives.
Open to internships and working students.
Reddit is proud to be an equal opportunity employer, and is committed to building a workforce representative of the diverse communities we serve.  Reddit is committed to providing reasonable accommodations for qualified individuals with disabilities and disabled veterans in our job application procedures. If, due to a disability, you need an accommodation during the interview process, please let your recruiter know."
3038079,"Senior Client Partner, Mid-Market (Goods)","https://job-boards.greenhouse.io/reddit/jobs/6937239","Reddit","Toronto","No",8,"Full time","2025-06-19T02:05:20.291191Z","Reddit is a community of communities. Its built on shared interests, passion, and trust and is home to the most open and authentic conversations on the internet. Every day, Reddit users submit, vote, and comment on the topics they care most about. With 100,000+ active communities and approximately 101M+ daily active unique visitors, Reddit is one of the internets largest sources of information. For more information, visit redditinc.com.




We're looking for a sharp, positive, and motivated self-starter to join our Mid-Market team in Toronto! In addition to laying the foundation of the team, the Client Partner will be responsible for forming relationships with key brands and ensuring they meet their business objectives using Reddit's advertising suite.
Please note that this role is required to be based in-person in Toronto.
Core Responsibilities:

Collaborate with existing clients to deliver Reddit solutions that help achieve those customers marketing and business goals
Identify areas of additional opportunity within existing client relationships, including new lines of business, and move them through to close
Collaborate with Account Managers to create long-term, mutually beneficial partnerships between your customer base and Reddit
Act as the CEO of your book of business, and take full ownership of strategic bets, revenue forecasting, and ensuring operational rigor
Communicate feedback on our sales processes, narratives, and products to advocate for customers and improve the team's effectiveness and efficiency
Proactively manage and deepen relationships with existing advertising partners, both with agencies and directly with clients to drive year-over-year revenue growth
Proactively construct upfront and joint business plans with top clients
Establish mutually beneficial relationships with new clients, educating them on Reddit and the Reddit ads platform
Leverage agency and client direct relationships to identify new buyers of Reddit advertising products
Leverage data from internal and external sources to inform client strategies and pitch proposals
Consistently meet deadlines for all projects, ensuring that clients receive the highest level of customer service
Act as an internal lead by actively volunteering in team meetings and Reddit special projects
Own client meetings from agenda to final presentation, instilling confidence and setting all interactions up for success by appropriately setting client expectations, identifying outcomes, and communicating clear next steps
Act as the primary point of contact for clients to communicate major platform updates, releases, changes, and/or opportunities that will deepen or expand the relationship
Provide strategic, proactive, and consultative advice to clients in order to uplevel and grow the relationship
Persistently explore and uncover the needs of your clients, leveraging deep product knowledge to align their goals with new and unique opportunities on the platform
Shape Reddits ads product roadmap by aggregating and sharing client feedback and campaign metrics with cross-functional stakeholders
Provide thought leadership and act as a Reddit evangelist with partners and at industry events
Share your industry, client, and product expertise by mentoring and training other team members
Collaborate closely with other Client Partners and Account Managers to craft a cohesive strategy across shared accounts
Build and leverage deep internal relationships, both within your direct team and cross-functionally, working together to deliver on client and business goals

Qualifications: 

8-12 years of experience in digital media with at least 4-7 years of experience in sales
Proven experience managing relationships up through C-level executives
Deep industry expertise in specific verticals, product types, and/or measurement solutions
Deep existing relationships within the agency and client direct space
Subject matter expertise in the social media landscape and native advertising
Experience building and executing long-term account growth strategies
Demonstrated top-performer achievement against sales targets
Ability to lead special projects
Ability to manage and scale a book of business greater than 20 accounts
Positive outlook, team player
Demonstrated high achievement against sales targets
Motivated self-starter who thrives in unstructured environments
BA / BS degree or equivalent work experience

Benefits:

Comprehensive Health Benefits
Retirement Savings plan with matching contributions
Workspace benefits for your home office
Personal &amp; Professional development funds
Family Planning Support
Flexible Vacation &amp; Reddit Global Days Off

#LI-ES1 #LI-onsiteReddit is proud to be an equal opportunity employer, and is committed to building a workforce representative of the diverse communities we serve.  Reddit is committed to providing reasonable accommodations for qualified individuals with disabilities and disabled veterans in our job application procedures. If, due to a disability, you need an accommodation during the interview process, please let your recruiter know."
3038078,"Client Account Executive, Mid-Market (Services)","https://job-boards.greenhouse.io/reddit/jobs/6892704","Reddit","Los Angeles","No",5,"Full time","2025-06-19T02:05:20.291218Z","Reddit is a community of communities. Its built on shared interests, passion, and trust and is home to the most open and authentic conversations on the internet. Every day, Reddit users submit, vote, and comment on the topics they care most about. With 100,000+ active communities and approximately 101M+ daily active unique visitors, Reddit is one of the internets largest sources of information. For more information, visit redditinc.com.




Were building Reddits Mid-Market team in North America to support a rapidly expanding book of advertisers who are looking to grow their businesses through Reddits unique, intent-rich communities. This is an opportunity to join a high-impact team that is reshaping how advertisers think about discovery, performance, and brand-building at scale.
As a Client Account Executive, you will have end-to-end ownership to, grow and retain your book of business across the Services segment. You will drive strategic conversations, guide campaign execution, and partner cross-functionally to help advertisers succeed on Reddit. You'll work closely with a team of Account Strategists to scale your impact across a dedicated book of business. The ideal candidate thrives in a fast-paced, consultative environment and enjoys taking ownership, building deep client relationships, and turning insights into action.
Please note that this role is required to work in person from our Los Angeles office 12 days per week.
Core Responsibilities

Own and grow a book of mid-market advertisers, acting as the main point of contact for both clients and agencies.
Drive advertiser activation, retention, and revenue growth through thoughtful client consultation, performance analysis, and solution-oriented storytelling.
Initiate and lead strategic sales conversations using market trends, performance data, and industry context to advise clients on how to scale on Reddit.
Work with Account Strategists to implement and optimize campaigns to achieve your clients advertising objectives across performance and brand campaigns.
Monitor and report on key campaign metrics, providing actionable recommendations for continuous improvement.
Identify and communicate product feedback and market insights to cross-functional teams to influence Reddits go-to-market strategy.
Develop and execute sales strategies to hit and exceed quarterly revenue targets.Cultivate strong client relationships with a customer-first mindset, balancing client priorities with Reddit best practices and long-term success planning.
Serve as a foundational hire shaping scaled sales methodologies and best practices for the Client Account Executive role.

Qualifications

5+ years of experience in digital media sales, account management, or paid social strategy.
Proven track record of meeting or exceeding revenue targets.
Strong understanding of the customer marketing funnel, auction dynamics, and digital advertising landscape.
Excellent communication skills - written, verbal, and visual - with a strong ability to craft and present narratives that drive action.
Highly analytical; comfortable translating data into client-facing insights.
Motivated self-starter who thrives in ambiguity and fast-paced environments.
Proficiency in Excel/Google Sheets and strong understanding of performance measurement and attribution.

Benefits:

Comprehensive Healthcare Benefits and Income Replacement Programs
401k Match
Family Planning Support
Gender-Affirming Care
Mental Health &amp; Coaching Benefits
Flexible Vacation &amp; Reddit Global Days off
Generous paid Parental Leave  
Paid Volunteer time off
Pay Transparency:
This job posting may span more than one career level.
In addition to base salary, this job is eligible to receive equity in the form of restricted stock units, and will also be eligible to receive a commission. Additionally, Reddit offers a wide range of benefits to U.S.-based employees, including medical, dental, and vision insurance, 401(k) program with employer match, generous time off for vacation, and parental leave. To learn more, please visit https://www.redditinc.com/careers/.
To provide greater transparency to candidates, we share base pay ranges for all US-based job postings regardless of state. We set standard base pay ranges for all roles based on function, level, and country location, benchmarked against similar stage growth companies. Final offer amounts are determined by multiple factors including, skills, depth of work experience and relevant licenses/credentials, and may vary from the amounts listed below.The base pay range for this position is:$114,660$160,510 USDReddit is proud to be an equal opportunity employer, and is committed to building a workforce representative of the diverse communities we serve.  Reddit is committed to providing reasonable accommodations for qualified individuals with disabilities and disabled veterans in our job application procedures. If, due to a disability, you need an accommodation during the interview process, please let your recruiter know."
3026840,"Senior Software Engineer, AI Enablement","https://job-boards.greenhouse.io/reddit/jobs/6932236","Reddit","Remote","Yes",4,"Full time","2025-06-19T02:05:20.291250Z","Reddit is a community of communities. Its built on shared interests, passion, and trust and is home to the most open and authentic conversations on the internet. Every day, Reddit users submit, vote, and comment on the topics they care most about. With 100,000+ active communities and approximately 101M+ daily active unique visitors, Reddit is one of the internets largest sources of information. For more information, visit redditinc.com.




Reddits Developer Platform is on a mission to become the creativity launchpad for the internet. 
Were building a home for games and interactive experiences on Reddit. We give creators a cross platform SDK, a compute environment, and all of their AI friendly tooling to build quickly.
This is a cutting-edge space, and we want someone that can help Reddit lead in AI tooling.
What Youll Do:

Spearhead the integration of cutting-edge AI capabilities into our Developer Platform.
Build and maintain integrations leading AI IDE tools, including Cursor, Bolt.new, and Firebase Studio.
Work with leading foundation models like OpenAI &amp; Gemini.
Fine-tune and adapt AI models, integrating them with Reddit systems to solve unique problems for our creators.
Develop our toolchain for agentic development, leveraging protocols like MCP to enable AI agents to interact with Reddit tools and services.
Engage directly with the community of developers and creators leveraging AI for rapid prototyping and development ('vibe-coding') to gather feedback and drive adoption.

Who You Might Be:

4+ years of experience in the Javascript &amp; web toolchain.
Experience using novel AI IDEs and associated toolchains.
Experience working with and deploying OpenAI, Gemini or similar model providers. 
Interest in game development and creative spaces.

This role is 100% remote friendly. Qualified candidates must be located in Canada or the US. Optional office space is available in NYC, SF, LA, Chicago and Toronto.
Benefits:


Comprehensive Health benefits


Registered Retirement Savings plan with matching contributions


Income Replacement Programs


Family Planning Support


Gender-Affirming Care


Mental Health &amp; Coaching Benefits


Flexible Vacation &amp; Reddit Global Days Off

Reddit is proud to be an equal opportunity employer, and is committed to building a workforce representative of the diverse communities we serve.  Reddit is committed to providing reasonable accommodations for qualified individuals with disabilities and disabled veterans in our job application procedures. If, due to a disability, you need an accommodation during the interview process, please let your recruiter know."
3026839,"Senior Software Engineer, AI Enablement","https://job-boards.greenhouse.io/reddit/jobs/6932306","Reddit","Toronto","Yes",4,"Full time","2025-06-19T02:05:20.291282Z","Reddit is a community of communities. Its built on shared interests, passion, and trust and is home to the most open and authentic conversations on the internet. Every day, Reddit users submit, vote, and comment on the topics they care most about. With 100,000+ active communities and approximately 101M+ daily active unique visitors, Reddit is one of the internets largest sources of information. For more information, visit redditinc.com.




Reddits Developer Platform is on a mission to become the creativity launchpad for the internet. 
Were building a home for games and interactive experiences on Reddit. We give creators a cross platform SDK, a compute environment, and all of their AI friendly tooling to build quickly.
This is a cutting-edge space, and we want someone that can help Reddit lead in AI tooling.
What Youll Do:

Spearhead the integration of cutting-edge AI capabilities into our Developer Platform.
Build and maintain integrations leading AI IDE tools, including Cursor, Bolt.new, and Firebase Studio.
Work with leading foundation models like OpenAI &amp; Gemini.
Fine-tune and adapt AI models, integrating them with Reddit systems to solve unique problems for our creators.
Develop our toolchain for agentic development, leveraging protocols like MCP to enable AI agents to interact with Reddit tools and services.
Engage directly with the community of developers and creators leveraging AI for rapid prototyping and development ('vibe-coding') to gather feedback and drive adoption.

Who You Might Be:

4+ years of experience in the Javascript &amp; web toolchain.
Experience using novel AI IDEs and associated toolchains.
Experience working with and deploying OpenAI, Gemini or similar model providers. 
Interest in game development and creative spaces.

This role is 100% remote friendly. Qualified candidates must be located in Canada or the US. Optional office space is available in NYC, SF, LA, Chicago and Toronto.
Benefits:


Comprehensive Health benefits


Registered Retirement Savings plan with matching contributions


Income Replacement Programs


Family Planning Support


Gender-Affirming Care


Mental Health &amp; Coaching Benefits


Flexible Vacation &amp; Reddit Global Days Off

Reddit is proud to be an equal opportunity employer, and is committed to building a workforce representative of the diverse communities we serve.  Reddit is committed to providing reasonable accommodations for qualified individuals with disabilities and disabled veterans in our job application procedures. If, due to a disability, you need an accommodation during the interview process, please let your recruiter know."
3026838,"Senior Software Engineer, AI Enablement","https://job-boards.greenhouse.io/reddit/jobs/6932297","Reddit","Remote","Yes",4,"Full time","2025-06-19T02:05:20.291316Z","Reddit is a community of communities. Its built on shared interests, passion, and trust and is home to the most open and authentic conversations on the internet. Every day, Reddit users submit, vote, and comment on the topics they care most about. With 100,000+ active communities and approximately 101M+ daily active unique visitors, Reddit is one of the internets largest sources of information. For more information, visit redditinc.com.




Reddits Developer Platform is on a mission to become the creativity launchpad for the internet. 
Were building a home for games and interactive experiences on Reddit. We give creators a cross platform SDK, a compute environment, and all of their AI friendly tooling to build quickly.
This is a cutting-edge space, and we want someone that can help Reddit lead in AI tooling.
What Youll Do:

Spearhead the integration of cutting-edge AI capabilities into our Developer Platform.
Build and maintain integrations leading AI IDE tools, including Cursor, Bolt.new, and Firebase Studio.
Work with leading foundation models like OpenAI &amp; Gemini.
Fine-tune and adapt AI models, integrating them with Reddit systems to solve unique problems for our creators.
Develop our toolchain for agentic development, leveraging protocols like MCP to enable AI agents to interact with Reddit tools and services.
Engage directly with the community of developers and creators leveraging AI for rapid prototyping and development ('vibe-coding') to gather feedback and drive adoption.

Who You Might Be:

4+ years of experience in the Javascript &amp; web toolchain.
Experience using novel AI IDEs and associated toolchains.
Experience working with and deploying OpenAI, Gemini or similar model providers. 
Interest in game development and creative spaces.

This role is 100% remote friendly. Qualified candidates must be located in Canada or the US. Optional office space is available in NYC, SF, LA, Chicago and Toronto.
Benefits:


Comprehensive Health benefits


Registered Retirement Savings plan with matching contributions


Income Replacement Programs


Family Planning Support


Gender-Affirming Care


Mental Health &amp; Coaching Benefits


Flexible Vacation &amp; Reddit Global Days Off

Reddit is proud to be an equal opportunity employer, and is committed to building a workforce representative of the diverse communities we serve.  Reddit is committed to providing reasonable accommodations for qualified individuals with disabilities and disabled veterans in our job application procedures. If, due to a disability, you need an accommodation during the interview process, please let your recruiter know."
