"ID","Title","Link","Company","Location","Remote","Experience","EmploymentType","DatePosted","RoleDescription"
3098198,"Community Operations - Customer support role","https://job-boards.greenhouse.io/reddit/jobs/6973243","Reddit","Remote","Yes","Not specified","Full time","2025-06-19T02:05:20.290741Z","Reddit is a community of communities. Its built on shared interests, passion, and trust and is home to the most open and authentic conversations on the internet. Every day, Reddit users submit, vote, and comment on the topics they care most about. With 100,000+ active communities and approximately 101M+ daily active unique visitors, Reddit is one of the internets largest sources of information. For more information, visit redditinc.com.




We are seeking a Community Support Specialist to join our Community Support Team. This role will primarily focus on managing ticketed support requests from our community of moderators. You will be responsible for efficiently resolving a variety of issues, escalating complex problems when necessary, and working collaboratively with cross-functional teams to enhance the moderator support experience. Additionally, you will provide ticketed support to Reddit users and moderators.
Key Responsibilities

Handle and resolve ticketed support requests from moderators promptly and effectively.
Provide first-line support for non-technical issues raised by Reddit users.
Escalate complex issues to appropriate teams and follow up to ensure resolution.
Collaborate with cross-functional teams to identify and implement improvements in moderator support processes.
Maintain comprehensive documentation of support interactions and resolutions.
Stay updated on platform changes and community guidelines to provide accurate support.

Qualifications

Previous experience as a moderator on Reddit is required.
Familiarity with Zendesk or similar ticketing systems.
Proven experience in providing first-line support in a customer service environment.
Excellent verbal and written communication skills.
Strong analytical skills with the ability to troubleshoot issues effectively.
Experience working in a team-oriented environment and collaborating with cross-functional teams.

Preferred Qualifications

Knowledge of Reddit's platform and community dynamics.
Fluency in English and at least one additional European language (French, Italian, Spanish, or German).
Previous experience in customer support or community management roles.
Reddit is proud to be an equal opportunity employer, and is committed to building a workforce representative of the diverse communities we serve.  Reddit is committed to providing reasonable accommodations for qualified individuals with disabilities and disabled veterans in our job application procedures. If, due to a disability, you need an accommodation during the interview process, please let your recruiter know."
2762830,"Staff Software Engineer - Web Test Engineering ","https://job-boards.greenhouse.io/reddit/jobs/6791824","Reddit","Remote","Yes",8,"Full time","2025-06-19T02:05:20.290767Z","Reddit is a community of communities. Its built on shared interests, passion, and trust and is home to the most open and authentic conversations on the internet. Every day, Reddit users submit, vote, and comment on the topics they care most about. With 100,000+ active communities and approximately 101M+ daily active unique visitors, Reddit is one of the internets largest sources of information. For more information, visit redditinc.com.




The Test Engineering team within the Quality Engineering (QE) org is looking for a Staff Software Engineer who can work in a highly collaborative environment, design/develop tools, test frameworks, and define processes to help the teams to own and be accountable for quality. The mission of the Quality Engineering org is to enable quality in all engineering teams at Reddit by providing robust test tools and frameworks that help establish quality standards across the development pipelines.
Responsibilities: 

Help in building an Engineering culture that enables quality in all software feature development teams across Reddit.
Develop and evolve test automation frameworks, tools, and services.
Analyze production issues, identify test gaps across the entire testing stack and make systemic improvements to automated testing
Maintain test infrastructure stability in non-production environments.
Participate in troubleshooting and triaging of issues with different teams to drive towards root cause identification and resolution.
Influence the entire engineering organization on unit/integration/end-to-end tests

Required Qualifications: 

8+ years of experience as an SDET, or as a Software Engineer for web platform
3+ years experience in modern web application development
Experience in designing and building scalable automated test frameworks, tools, and services for testing responsive web applications
Experience in writing, executing, and monitoring automated test suites using a variety of technologies such as Playwright, Cypress, Selenium and/or other modern frontend test automation technologies
Preferred experience in Typescript and/or Javascript
Experience in unit, snapshot, and end-to-end testing of responsive web applications
Experience in building test frameworks and automated tests for responsive web applications
Strong understanding of CI/CD process and quality checks in the workflow.
Strong understanding of QA methodologies for web applications releases.
Working proficiency and communication skills in verbal and written English

Benefits:

Comprehensive Healthcare Benefits and Income Replacement Programs
401k Match
Family Planning Support
Gender-Affirming Care
Mental Health &amp; Coaching Benefits
Flexible Vacation &amp; Reddit Global Days off
Generous paid Parental Leave  
Paid Volunteer time off
Pay Transparency:
This job posting may span more than one career level.
In addition to base salary, this job is eligible to receive equity in the form of restricted stock units, and depending on the position offered, it may also be eligible to receive a commission. Additionally, Reddit offers a wide range of benefits to U.S.-based employees, including medical, dental, and vision insurance, 401(k) program with employer match, generous time off for vacation, and parental leave. To learn more, please visit https://www.redditinc.com/careers/.
To provide greater transparency to candidates, we share base pay ranges for all US-based job postings regardless of state. We set standard base pay ranges for all roles based on function, level, and country location, benchmarked against similar stage growth companies. Final offer amounts are determined by multiple factors including, skills, depth of work experience and relevant licenses/credentials, and may vary from the amounts listed below.The base pay range for this position is:$217,000$303,900 USDReddit is proud to be an equal opportunity employer, and is committed to building a workforce representative of the diverse communities we serve.  Reddit is committed to providing reasonable accommodations for qualified individuals with disabilities and disabled veterans in our job application procedures. If, due to a disability, you need an accommodation during the interview process, please let your recruiter know."
3086607,"Strategic Community Specialist (contract)","https://job-boards.greenhouse.io/reddit/jobs/6967193","Reddit","Remote","Yes",5,"Contract","2025-06-19T02:05:20.290793Z","Reddit is a community of communities. Its built on shared interests, passion, and trust and is home to the most open and authentic conversations on the internet. Every day, Reddit users submit, vote, and comment on the topics they care most about. With 100,000+ active communities and approximately 101M+ daily active unique visitors, Reddit is one of the internets largest sources of information. For more information, visit redditinc.com.




The front page of the internet, Reddit brings over 430 million people together each month through their common interests, inviting them to share, vote, comment, and create across thousands of communities. Come for the cats, stay for the empathy.
We are searching for a strategic community management and operations expert to join the International Community team and help grow Reddit outside of the US. As an integral part of the International Community team, this role plays a key role in helping Reddit realize its mission: bringing community and belonging to everyone in the world. 
As the Community Manager, you will be at the forefront of jumpstarting and fostering local communities. You will be an expert of the German market, proficient in English, and focused on proactive initiatives to build bridges with local volunteer moderators and innovate, iterate, refine, and scale our international consumer playbook. The insights derived from your relationships and experiments will help accelerate our growth in the Germany.
This is a rare opportunity to join a new team at one of the most influential consumer products on the internet. If developing and proving out a community relations and growth playbook in close tandem with Product that unlocks the next hundreds of millions of global Redditors excites you, then youve found the right place!
Responsibilities:

Gain a deep understanding of the market to identify user and local moderator challenges, and market opportunities. Iterate, innovate, and scale the consumer growth playbook by recognizing new opportunities, suggesting bold ideas and programs, and persuading internal teams to align on new plans. Build strategic plans to cultivate, recruit, educate, and grow a local community of moderators (i.e., volunteers who develop, maintain, and shape the culture of local communities). Implement a conversion funnel designed to onboard power users and external creators, transforming them into active moderators. Communicate quantitative and qualitative insights to optimize and improve the international consumer growth playbook. Be obsessive about achieving aggressive goals and outcomes. Analyze quantitative and qualitative data, set KPls, and execute impactful community initiatives: leverage data to uncover community and moderator insights that will influence the direction of the local team in the market. Work cross-functionally with Product, Community, Engineering, Marketing, Safety, and BD

What We Can Expect From You:


5+ years of community development, project management, growth, operations, or product consulting experience with a track record of community-led projects that have driven business impact.
Deep knowledge and understanding of German culture, including current events, politics, customs, traditions, language, topics of interest, and taboos.
Nuanced comprehension of the digital landscape and the cultural intricacies inherent within it, including awareness of internet culture specific to Germany and other DACH countries and an appreciation for the diverse cultural facets shaping contemporary society.
Succinct and persuasive communicator: able to collaborate effectively across internal teams, local users, moderators, partners, content creators, influencers, etc.
Results-obsessed: demonstrates outstanding execution and high attention to detail.
Deep interest in developing and driving projects, framing issues and seeking solutions, testing hypotheses, and iterating on process improvements.
Proficiency in German &amp; English and based in the EU timezone 


Bonus Points:

Experience being a power user on Reddit
Experience working in the Swiss market
Proficiency in Swiss German and/or French
Reddit is proud to be an equal opportunity employer, and is committed to building a workforce representative of the diverse communities we serve.  Reddit is committed to providing reasonable accommodations for qualified individuals with disabilities and disabled veterans in our job application procedures. If, due to a disability, you need an accommodation during the interview process, please let your recruiter know."
3086606,"Principal Engineer - Ads Signals, Identity & Measurement","https://job-boards.greenhouse.io/reddit/jobs/6964782","Reddit","Remote","Yes",2,"Full time","2025-06-19T02:05:20.290818Z","Reddit is a community of communities. Its built on shared interests, passion, and trust and is home to the most open and authentic conversations on the internet. Every day, Reddit users submit, vote, and comment on the topics they care most about. With 100,000+ active communities and approximately 101M+ daily active unique visitors, Reddit is one of the internets largest sources of information. For more information, visit redditinc.com.




The Ads Measurement Org is dedicated to enhancing the efficiency and user-friendliness of our advertising platform. We specialize in off platform conversion signals ingestion, identity resolution, ads attribution, as well as powering Ads reporting and providing machine learning models with high quality data for training.
We are looking for a hands-on software engineering leader, familiar with the end to end Ads systems, experienced with Ads Measurement and the downstream adoption of Measurement data, capable of leading across different engineering and XFN organizations, as well as willing to get their hands dirty and solve problems when the team lacks the expertise. You will be responsible for improving our Ads performance via leading full end to end Measurement solutions from ingestion to ads delivery. As a diverse group of software engineers, product managers, data scientists, and ads experts, we are excited for you to join our team!
Responsibilities:

Understanding the current and future state of the business and converting business problems into engineering solutions.
Define the long term technical vision and strategy for Ads Measurement for the next 2+ years.
Lead large cross-functional projects end to end, from concept, design, implementation, to rollout, ensuring the highest quality and performance.
Identify top opportunities for Ads Measurement to improve Ads performance by diving deep into our platform and understanding the company priorities, the needs of our advertisers, as well as downstream consumers of Ads Measurement data.
Design and develop cutting-edge products and solutions for Ads Measurement that improves data quality and integrates with downstream consumers of measurement data (including modeling teams), from ideation to production deployment.
Collaborate with engineering and XFN leaders, data scientists, backend software engineers, fullstack engineers, as well as machine learning engineers.
Mentor staff engineers and leaders, share industry knowledge, and contribute to the technical growth of the team. 
Stay updated on state-of-the-art products and techniques, recognizing promising innovations, identifying gaps, and adapting them to Reddit's unique platform and community.

Minimum Qualifications:

A technical leader capable of creating and aligning on Measurement vision at the Ads Org level to solve challenges for at least the next 2+ years.
Advocates for Ads performance by leading Ads Measurement and working across job functions (product, engineering, privacy, legal, etc.) across the company.
Expert in Ads Measurement product and technologies such as Pixel, Conversions API, Event Deduplication, Events Manager, Signal Quality, Identity Resolution, Ads Attribution.
Candidates Ads experience spans across multiple Ads domains beyond Ads Measurement, such as Optimization, Delivery, Targeting, Ranking, Bidding, Reporting, etc. They are capable of building Measurement solutions that have end-to-end impact across the entire Ads system and are able to drive downstream adoption.
Familiar with Ads privacy challenges (GDPR, CCPA, ePD, ATT, etc.) and is experienced with delivering high Ads performance while meeting the privacy needs when developing solutions.
Demonstrates a strong understanding of industry trends and has a proven track record of driving high ad performance adapting to signal loss due to evolving privacy constraints.
Individual contributor capable of designing, implementing, testing, and launching complex product and infrastructure changes across the entire Ads stack.
Can deliver through others as well as doing hands-on work.

Benefits:

Comprehensive Healthcare Benefits and Income Replacement Programs
401k Match
Family Planning Support
Gender-Affirming Care
Mental Health &amp; Coaching Benefits
Flexible Vacation &amp; Reddit Global Days off
Generous paid Parental Leave  
Paid Volunteer time off

 
#LI-REMOTEPay Transparency:
This job posting may span more than one career level.
In addition to base salary, this job is eligible to receive equity in the form of restricted stock units, and depending on the position offered, it may also be eligible to receive a commission. Additionally, Reddit offers a wide range of benefits to U.S.-based employees, including medical, dental, and vision insurance, 401(k) program with employer match, generous time off for vacation, and parental leave. To learn more, please visit https://www.redditinc.com/careers/.
To provide greater transparency to candidates, we share base pay ranges for all US-based job postings regardless of state. We set standard base pay ranges for all roles based on function, level, and country location, benchmarked against similar stage growth companies. Final offer amounts are determined by multiple factors including, skills, depth of work experience and relevant licenses/credentials, and may vary from the amounts listed below.The base pay range for this position is:$260,800$365,100 USDReddit is proud to be an equal opportunity employer, and is committed to building a workforce representative of the diverse communities we serve.  Reddit is committed to providing reasonable accommodations for qualified individuals with disabilities and disabled veterans in our job application procedures. If, due to a disability, you need an accommodation during the interview process, please let your recruiter know."
3083773,"Strategic Community Specialist - Swedish speaker (contract)","https://job-boards.greenhouse.io/reddit/jobs/6961976","Reddit","Remote","Yes",5,"Contract","2025-06-19T02:05:20.290843Z","Reddit is a community of communities. Its built on shared interests, passion, and trust and is home to the most open and authentic conversations on the internet. Every day, Reddit users submit, vote, and comment on the topics they care most about. With 100,000+ active communities and approximately 101M+ daily active unique visitors, Reddit is one of the internets largest sources of information. For more information, visit redditinc.com.




We are searching for a strategic community management and operations expert to join the International Community team and help grow outside of the US. As an integral part of the Product organization, the International Community team plays a key role in helping team realize its mission: bringing community and belonging to everyone in the world.
As the Community Operations Specialist, you will be at the forefront of jumpstarting and fostering local communities. You will be an expert of the Swedish market, proficient in English, and focused on proactive initiatives to build bridges with local volunteer moderators and innovate, iterate, refine, and scale our international consumer playbook. The insights derived from your relationships and experiments will help accelerate our growth in Sweden.
This is a rare opportunity to join a new team at one of the most influential consumer products on the internet. If developing and proving out a community relations and growth playbook in close tandem with Product that unlocks the next hundreds of millions of global users excites you, then youve found the right place!
Responsibilities:

Gain a deep understanding of the market and specialized knowledge to identify user and moderator pain points, competitors, and market opportunities.
Cultivate, recruit, educate, and grow a local community of moderators (i.e., the volunteers who are developing, maintaining, and crafting the culture of local communities) and implement a conversion funnel to onboard external creators and local users to turn them into active moderators.
Be a public face with our local volunteer moderators to build trust and drive engagement in local communities, mediating conflicts and helping drive solutions.
Iterate, innovate, and scale the consumer growth playbook by recognizing new opportunities, suggesting bold ideas and programs, and persuading internal teams to align on new plans.
Communicate quantitative and qualitative insights to optimize and improve the international consumer growth playbook.
Be obsessive about achieving aggressive goals and outcomes.
Run reports, build dashboards, analyze data, set KPIs, and execute impactful community initiatives: leverage data to uncover community and moderator insights that will influence the direction of your market pod.
Work cross-functionally with Product, Community, Engineering, Marketing, Safety, and BD teams.

What We Can Expect From You:

5+ years of community development, project management, growth, operations, or product consulting experience with a track record of community-led projects that have driven business impact.
Deep knowledge and understanding of Swedish culture, including current events, politics, customs, traditions, language, topics of interest, taboos, etc.
Nuanced comprehension of the digital landscape and the cultural intricacies inherent within it. This includes awareness of internet culture specific to Sweden, as well as a deep appreciation for the diverse cultural facets shaping contemporary Swedish society.
Succinct and persuasive communicator: collaborate effectively across internal teams, local users, moderators, partners, content creators, influencers, etc.
Results-obsessed: outstanding execution and high attention to detail
Deep interest in developing and driving projects, framing issues and seeking solutions, testing hypotheses, and iterating on process improvements.
Proficiency in Swedish &amp; English and based in the EU timezone
Proficient in SQL

 Reddit is proud to be an equal opportunity employer, and is committed to building a workforce representative of the diverse communities we serve.  Reddit is committed to providing reasonable accommodations for qualified individuals with disabilities and disabled veterans in our job application procedures. If, due to a disability, you need an accommodation during the interview process, please let your recruiter know."
