"ID","Title","Link","Company","Location","Remote","Experience","EmploymentType","DatePosted","RoleDescription"
3120722,"Head of Community Partnerships","https://job-boards.greenhouse.io/reddit/jobs/6979033","Reddit","Remote","Yes",10,"Full time","2025-06-19T02:05:20.290027Z","Reddit is a community of communities. Its built on shared interests, passion, and trust and is home to the most open and authentic conversations on the internet. Every day, Reddit users submit, vote, and comment on the topics they care most about. With 100,000+ active communities and approximately 101M+ daily active unique visitors, Reddit is one of the internets largest sources of information. For more information, visit redditinc.com.




Reddit is a community of communities. Its built on shared interests, passion, and trust and is home to the most open and authentic conversations on the internet. Every day, Reddit users submit, vote, and comment on the topics they care most about. With 100,000+ active communities and 108M+ daily active unique visitors, Reddit is one of the internets largest sources of information. For more information, visit redditinc.com.
The Role:Were seeking a strategic, mission-driven Head of Community Partnerships to lead our efforts in supporting and enabling Reddits largest and most engaged subreddits  many of which are among the largest online communities in the world.
This senior leadership role is responsible for managing a team of community-facing account managers and community strategists focused on deep engagement, consultative partnerships, and driving sustainable success for Reddits most high-impact communities.
What Youll Do:

Build and lead a high-performing team focused on the development and strategic growth of Reddits portfolio of top communities.
Drive long-term engagement, partnership, and product adoption strategies for high-value communities within key strategic verticals.
Own CRM strategy, reporting, and performance measurement for Reddits top communities portfolio. 
Act as the voice of the customer for top communities within Reddit  advocating for their needs and opportunities in product, policy, and business decisions.
Partner with teams including Product, GTM, Support, and Data Science to facilitate feedback loops and bring relevant insights and opportunities to portfolio communities. 
Develop scalable frameworks, community success strategies, and support systems tailored to high-traffic, high-visibility communities.

What We're Looking For:

10+ years of experience in community, strategic partnerships, or customer success  with a minimum 7+ years in a leadership and management role. 
Experience managing managers and leading remote, geographically distributed teams.
Proven experience leading and scaling teams that work with influential or enterprise-level customers.
Strong understanding of online communities and community moderation, especially in a global context. 
Data-driven and outcomes-oriented, with a track record of hitting ambitious growth and retention targets.
High-level of comfort presenting to senior management and executive stakeholders.
Exceptional cross-functional collaboration skills, with the ability to identify and execute on strategic opportunities with partners ranging from Product to Policy to Marketing.
Skilled communicator with an ability to navigate nuanced and often sensitive conversations.
Comfortable working in a fast-paced, dynamic environment that blends tech, business, and community.

Bonus Points:

Experience working with UGC platforms, moderators, or volunteer-led communities.

If you're excited to shape the future of community, we want to hear from you.
Benefits:

Comprehensive Healthcare Benefits and Income Replacement Programs
401k Match
Family Planning Support
Gender-Affirming Care
Mental Health &amp; Coaching Benefits
Flexible Vacation &amp; Reddit Global Days off
Generous paid Parental Leave  
Paid Volunteer time off

 
 Pay Transparency:
This job posting may span more than one career level.
In addition to base salary, this job is eligible to receive equity in the form of restricted stock units, and depending on the position offered, it may also be eligible to receive a commission. Additionally, Reddit offers a wide range of benefits to U.S.-based employees, including medical, dental, and vision insurance, 401(k) program with employer match, generous time off for vacation, and parental leave. To learn more, please visit https://www.redditinc.com/careers/.
To provide greater transparency to candidates, we share base pay ranges for all US-based job postings regardless of state. We set standard base pay ranges for all roles based on function, level, and country location, benchmarked against similar stage growth companies. Final offer amounts are determined by multiple factors including, skills, depth of work experience and relevant licenses/credentials, and may vary from the amounts listed below.The base pay range for this position is:$219,200$306,900 USDReddit is proud to be an equal opportunity employer, and is committed to building a workforce representative of the diverse communities we serve.  Reddit is committed to providing reasonable accommodations for qualified individuals with disabilities and disabled veterans in our job application procedures. If, due to a disability, you need an accommodation during the interview process, please let your recruiter know."
3120720,"Client Account Manager, Large Customer Sales (Pharma)","https://job-boards.greenhouse.io/reddit/jobs/6979520","Reddit","New York","No",5,"Full time","2025-06-19T02:05:20.290105Z","Reddit is a community of communities. Its built on shared interests, passion, and trust and is home to the most open and authentic conversations on the internet. Every day, Reddit users submit, vote, and comment on the topics they care most about. With 100,000+ active communities and approximately 101M+ daily active unique visitors, Reddit is one of the internets largest sources of information. For more information, visit redditinc.com.




We are looking for a Client Account Manager for the Pharma vertical of our Large Customer Sales team. This person will closely collaborate with a Client Partner on campaign execution and optimizations to help agencies and advertisers achieve their marketing objectives on the fast-growing Reddit platform. 
This role is required to be based out of New York, NY.
Responsibilities:

Collaborate closely with Client Partners to meet and exceed your clients marketing goals
Proactively manage and deepen relationships with existing advertising partners, both with agencies and directly with clients to drive year-over-year Reddit revenue growth
Lead and execute campaign launches from start to finish, delivering insightful optimization recommendations to agency and client partners
Act as the primary point of contact for internal account operations, including managing revenue delivery, troubleshooting issues, and escalating when necessary
Educate brands and media agencies, effectively communicating Reddits value proposition and best practices for advertising on the platform
Consult clients on their awareness and direct response objectives, partnering closely with Client Partners to craft thoughtful and creative media plans
Collaborate with Ad Ops to ensure effective campaign delivery and resolve any technical hurdles
Dive deep into campaign performance data, audience and competitor insights, seasonality, and market and performance trends to develop KPI-driven campaign recommendations
Proactively seek and represent client needs and asks to cross-functional stakeholders
Shape Reddits native ads product roadmap by aggregating and sharing client feedback and campaign metrics with cross-functional stakeholders

Required Qualifications:

5+ years of experience in advertising sales and account management
Strong understanding of customer marketing funnel and traditional marketing ecosystem
Comfortable with problems of diverse scope where analysis of data requires evaluation of identifiable factors.
Understanding of Digital measurement, tracking fundamentals and mobile measurement partners
Tenacious and entrepreneurial approach to working through product, process, and client challenges
Experience cultivating strong relationships with external partners
Exceptional communication and interpersonal skills
Ability to work in a fast-paced and unstructured work environment
High attention to detail
Proficiency in Excel preferred
BA / BS degree or equivalent work experience

Benefits:

Comprehensive Healthcare Benefits
401k Matching
Workspace benefits for your home office
Personal &amp; Professional development funds
Family Planning Support
Flexible Vacation (please use them!) &amp; Reddit Global Wellness Days
4+ months paid Parental Leave
Paid Volunteer time off

#LI-JS1 #LI-onsitePay Transparency:
This job posting may span more than one career level.
In addition to base salary, this job is eligible to receive equity in the form of restricted stock units, and will also be eligible to receive a commission. Additionally, Reddit offers a wide range of benefits to U.S.-based employees, including medical, dental, and vision insurance, 401(k) program with employer match, generous time off for vacation, and parental leave. To learn more, please visit https://www.redditinc.com/careers/.
To provide greater transparency to candidates, we share base pay ranges for all US-based job postings regardless of state. We set standard base pay ranges for all roles based on function, level, and country location, benchmarked against similar stage growth companies. Final offer amounts are determined by multiple factors including, skills, depth of work experience and relevant licenses/credentials, and may vary from the amounts listed below.The base pay range for this position is:$105,000$147,000 USDReddit is proud to be an equal opportunity employer, and is committed to building a workforce representative of the diverse communities we serve.  Reddit is committed to providing reasonable accommodations for qualified individuals with disabilities and disabled veterans in our job application procedures. If, due to a disability, you need an accommodation during the interview process, please let your recruiter know."
3120718,"Agency Development Partnerships Manager, EMEA","https://job-boards.greenhouse.io/reddit/jobs/6648732","Reddit","London","No",4,"Full time","2025-06-19T02:05:20.290138Z","Reddit is a community of communities. Its built on shared interests, passion, and trust and is home to the most open and authentic conversations on the internet. Every day, Reddit users submit, vote, and comment on the topics they care most about. With 100,000+ active communities and approximately 101M+ daily active unique visitors, Reddit is one of the internets largest sources of information. For more information, visit redditinc.com.




As an Agency Development Partnerships Manager II at Reddit, you will play a key role on the Agency Development Team, working with the Agency Leads, the worlds largest Holding Companies and their clients.  You'll manage and support strategic relationships.  Youll be detail-oriented and output-focused, have strong communication and people skills, and you should have an innate ability to bring internal and external stakeholders together whilst managing partnerships and projects at the highest levels.
This role will report to the Agency Partner Manager Lead and will support the EMEA Hold Co. relationships with a focus on the UK.
Location: Must be based within the Greater London, UK area and capable of commuting into our London office a few times a month.
Responsibilities:

Act and serve as a liaison between the assigned Holding Company, Holding Company Lead, and Reddit to help execute, monitor, and optimize first-class partnership programs 
Support and assist in the build of Agency Developments annual and quarterly strategic plan for the assigned Holding Company through the use of data
Define alongside the Activations and Enablement Team on educational approaches, develop work plans, and create compelling educational programs 
Project, track, maintain progress, and report on delivery against Reddits annual endeavor goals, suggesting areas for optimization of the plan and/or programs
Work cross-functionally with sales, product, marketing, measurement, and insights teams to aggregate and  deliver best-in-class solutions for our agency clients
Be the thought leader in the industry; acting as an ambassador and spokesperson for Reddit acting as an advisor 
Work with agencies to uplevel their media and creative thinking and structure programs that deliver positive business impact for their clients

Qualifications:

4+ years of experience in partnership sales, agency digital media buying and/or client planning
Tenacious and entrepreneurial approach to working through product, process, and client challenges
Ability to manage across competing deadlines and priorities
Demonstrated ability to cultivate strong relationships with external partners
Exceptional communication and interpersonal skills
Familiarity with agency holding companies and the agency landscape
Is flexible and has the innate ability to work in a fast-paced and unstructured work and environment managing change effectively 
Exhibits a high level of competency in oral and written communication skill

Benefits:

Group Personal Pension Scheme with Employer match
Private Medical and Dental Scheme
Income Replacement Programs
Family Planning Support
Gender-Affirming Care
Mental Health &amp; Coaching Benefits
Bike to Work scheme
Flexible Vacation &amp; Reddit Global Days Off
Pay Transparency:
This job posting may span more than one career level.
In addition to base salary, this job is eligible to receive equity in the form of restricted stock units, and will also be eligible to receive a commission. Additionally, Reddit offers a wide range of benefits to U.S.-based employees, including medical, dental, and vision insurance, 401(k) program with employer match, generous time off for vacation, and parental leave. To learn more, please visit https://www.redditinc.com/careers/.
To provide greater transparency to candidates, we share base pay ranges for all US-based job postings regardless of state. We set standard base pay ranges for all roles based on function, level, and country location, benchmarked against similar stage growth companies. Final offer amounts are determined by multiple factors including, skills, depth of work experience and relevant licenses/credentials, and may vary from the amounts listed below.The base pay range for this position is:158,200221,500 GBPReddit is proud to be an equal opportunity employer, and is committed to building a workforce representative of the diverse communities we serve.  Reddit is committed to providing reasonable accommodations for qualified individuals with disabilities and disabled veterans in our job application procedures. If, due to a disability, you need an accommodation during the interview process, please let your recruiter know."
3116363,"Staff Software Engineer, ML Training Platform","https://job-boards.greenhouse.io/reddit/jobs/6706315","Reddit","Remote","Yes",8,"Full time","2025-06-19T02:05:20.290173Z","Reddit is a community of communities. Its built on shared interests, passion, and trust and is home to the most open and authentic conversations on the internet. Every day, Reddit users submit, vote, and comment on the topics they care most about. With 100,000+ active communities and approximately 101M+ daily active unique visitors, Reddit is one of the internets largest sources of information. For more information, visit redditinc.com.




Location:This role is completely remote-friendly. If you happen to live close to one of our physical office locations, our doors are open for you to come into the office as often as you'd like. 
Who We Are: The Machine Learning Platform team at Reddit is a high-impact team that owns the infrastructure that powers recommendations, content discovery, user and content quantification, while directly impacting other teams such as Growth, Ads, Feeds, and Core Machine Learning teams.
What Youll Do:As a Staff Software Engineer, ML Training Platform, this person will be instrumental in architecting, implementing, and maintaining foundational Machine Learning Training infrastructure that powers Feeds Ranking, Content Understanding, Recommendations and much more to fulfill Reddits mission of bringing community and belonging to everyone in the world. You will oversee GPU optimization in AI/ML batch workloads and debug performance bottlenecks in GPU workloads. You will build and own systems and tools that enable MLEs and data scientists, and continuously improve the ML software development lifecycle. 

Optimize model training on GPUs
Lead the building, testing, and maintenance of ML infrastructure at Reddit
Propose, design, and implement high-performance ML platform solutions that significantly advance the deployment of models that serve millions of redditors a seamless experience for MLEs
Play a pivotal role in designing, building, and optimizing the infrastructure and tooling required to support large-scale machine learning workflows
Analyze bottlenecks in distributed systems and optimize for performance and cost-efficiency
Work with management on team goal setting, planning, and de-risk project execution
Mentor other team members in adopting a rigorous DevOps approach to maintain and/or improve ML platform components and services health and quality

Who You Might Be:

8+ years of work experience in a production software development environment or building data systems
Experience with XLA for Tensorflow or torch.inductor for pytorch for kernel fusion during training
Experience with optimization of data workloads using collosal.AI or Deepspeed
Experience with distributed Training optimization using deepspeed, horovod or collosalAI
Experience with design and architecture of large scale ML Systems  
Experience with training workflows, hyperparameter tuning, and resource optimization on CPU and GPU
Experience with MLOps practices and tools such as Ray and MLFlow
Hands-on experience with Kubernetes, Docker, or other container orchestration systems

Benefits:

Comprehensive Healthcare Benefits and Income Replacement Programs
401k Match
Family Planning Support
Gender-Affirming Care
Mental Health &amp; Coaching Benefits
Flexible Vacation &amp; Reddit Global Days off
Generous paid Parental Leave  
Paid Volunteer time off

#LI-DB1 #LI-RemotePay Transparency:
This job posting may span more than one career level.
In addition to base salary, this job is eligible to receive equity in the form of restricted stock units, and depending on the position offered, it may also be eligible to receive a commission. Additionally, Reddit offers a wide range of benefits to U.S.-based employees, including medical, dental, and vision insurance, 401(k) program with employer match, generous time off for vacation, and parental leave. To learn more, please visit https://www.redditinc.com/careers/.
To provide greater transparency to candidates, we share base pay ranges for all US-based job postings regardless of state. We set standard base pay ranges for all roles based on function, level, and country location, benchmarked against similar stage growth companies. Final offer amounts are determined by multiple factors including, skills, depth of work experience and relevant licenses/credentials, and may vary from the amounts listed below.The base pay range for this position is:$230,000$322,000 USDReddit is proud to be an equal opportunity employer, and is committed to building a workforce representative of the diverse communities we serve.  Reddit is committed to providing reasonable accommodations for qualified individuals with disabilities and disabled veterans in our job application procedures. If, due to a disability, you need an accommodation during the interview process, please let your recruiter know."
3112779,"Senior Client Partner, Large Customer Sales (Telco)","https://job-boards.greenhouse.io/reddit/jobs/6979532","Reddit","New York","No",8,"Full time","2025-06-19T02:05:20.290215Z","Reddit is a community of communities. Its built on shared interests, passion, and trust and is home to the most open and authentic conversations on the internet. Every day, Reddit users submit, vote, and comment on the topics they care most about. With 100,000+ active communities and approximately 101M+ daily active unique visitors, Reddit is one of the internets largest sources of information. For more information, visit redditinc.com.




We're looking for an experienced seller to join the Telco vertical of our Large Customer Sales team. As a Senior Client Partner, you will be responsible for growing our relationships with some of our largest Telco clients and their agency partners, ensuring we meet their business objectives using Reddit's advertising suite.
This role is required to be based out of New York, NY.
Responsibilities:

Proactively manage and deepen your client partnerships, both with agency contacts and directly with clients to drive year-over-year revenue growth
Proactively construct upfront and joint business plans
Establish mutually beneficial relationships with new LOBs, educating them on Reddit and the Reddit ads platform
Leverage agency and client direct relationships to identify new buyers of Reddit advertising products
Leverage data from internal and external sources to inform client strategies and pitch proposals
Consistently meet deadlines for all projects, ensuring that clients receive the highest level of customer service
Act as an internal lead by actively volunteering in team meetings and Reddit special projects
Own client meetings from agenda to final presentation, instilling confidence and setting all interactions up for success by appropriately setting client expectations, identifying outcomes, and communicating clear next steps
Act as the primary point of contact for clients to communicate major platform updates, releases, changes, and/or opportunities that will deepen or expand the relationship
Provide strategic, proactive, and consultative advice to clients in order to uplevel and grow the relationship
Persistently explore and uncover the needs of your clients, leveraging deep product knowledge to align their goals with new and unique opportunities on the platform
Collaborate with Account Management and Ad Operations to meet and exceed clients marketing goals
Shape Reddits ads product roadmap by aggregating and sharing client feedback and campaign metrics with cross-functional stakeholders
Provide thought leadership and act as a Reddit evangelist with partners and at industry events
Share your industry, client, and product expertise by mentoring and training other team members
Collaborate closely with other Client Partners and Account Managers to craft a cohesive strategy across shared accounts
Build and leverage deep internal relationships, both within your direct team and cross-functionally, working together to deliver on client and business goals

Required Qualifications: 

8-12 years of experience in digital media with at least 4-7 years of experience in sales
Experience managing Telco partnerships, including having established relationships with key client and agency decision-makers
Experience owning partnerships with complex enterprise organizations
Proven experience managing relationships up through C-level executives
Deep industry expertise in specific verticals, product types, and/or measurement solutions
Subject matter expertise in the social media landscape and native advertising
Experience building and executing long-term account growth strategies
Demonstrated top-performer achievement against sales targets
Ability to lead special projects
BA / BS degree or equivalent work experience

Benefits:

Comprehensive Healthcare Benefits
401k Matching
Workspace benefits for your home office
Personal &amp; Professional development funds
Family Planning Support
Flexible Vacation (please use them!) &amp; Reddit Global Wellness Days
4+ months paid Parental Leave
Paid Volunteer time off

#LI-JS1 #LI-onsitePay Transparency:
This job posting may span more than one career level.
In addition to base salary, this job is eligible to receive equity in the form of restricted stock units, and will also be eligible to receive a commission. Additionally, Reddit offers a wide range of benefits to U.S.-based employees, including medical, dental, and vision insurance, 401(k) program with employer match, generous time off for vacation, and parental leave. To learn more, please visit https://www.redditinc.com/careers/.
To provide greater transparency to candidates, we share base pay ranges for all US-based job postings regardless of state. We set standard base pay ranges for all roles based on function, level, and country location, benchmarked against similar stage growth companies. Final offer amounts are determined by multiple factors including, skills, depth of work experience and relevant licenses/credentials, and may vary from the amounts listed below.The base pay range for this position is:$124,700$199,100 USDReddit is proud to be an equal opportunity employer, and is committed to building a workforce representative of the diverse communities we serve.  Reddit is committed to providing reasonable accommodations for qualified individuals with disabilities and disabled veterans in our job application procedures. If, due to a disability, you need an accommodation during the interview process, please let your recruiter know."
