"ID","Title","Link","Company","Location","Remote","Experience","EmploymentType","DatePosted","RoleDescription"
3112772,"Content Strategist, Spain (Contract)","https://job-boards.greenhouse.io/reddit/jobs/6982330","Reddit","Remote","Yes","Not specified","Contract","2025-06-19T02:05:20.290458Z","Reddit is a community of communities. Its built on shared interests, passion, and trust and is home to the most open and authentic conversations on the internet. Every day, Reddit users submit, vote, and comment on the topics they care most about. With 100,000+ active communities and approximately 101M+ daily active unique visitors, Reddit is one of the internets largest sources of information. For more information, visit redditinc.com.




This is a 6-month contract position
Reddit is expanding globally, and we are looking for a results-driven content strategist who will drive growth in the local content ecosystem in Spain 
As a Content Seeder, you will help expand our presence in Spain by growing diverse local communities and increasing the supply of high-quality content that ignites organic conversations. On top of curating relevant content, you will also support our growth initiatives such as securing collaborations with industry partners (media, celebrities, KOLs).
What You Will Do:

Develop and execute an actionable content strategy to drive organic engagements among Redditors and cultivate the success of our diverse local communities. 
Analyze the performance of content efforts. Provide data-driven insights and recommendations to optimize strategies for greater impact.
Track and analyze current internet trends, capitalizing on key local moments that are relevant to the local market.
Forge partnerships with key industry players such as media, celebrities, and KOLs to support our country growth initiatives such as, but not limited to, AMAs

What We Expect From You:

Reddit power user and active contributor.
Expertise crafting content that resonates with diverse Reddit communities across text, image and video.
Deep understanding of Reddit's platform, subreddit dynamics, and community engagement.
Deep understanding of local trends and culture in your market. 

Bonus Points:

Experience as a successful content creator/curator on Facebook/TikTok/YouTube/Instagram/X.
Experience as a moderator/community owner on Reddit.
Reddit is proud to be an equal opportunity employer, and is committed to building a workforce representative of the diverse communities we serve.  Reddit is committed to providing reasonable accommodations for qualified individuals with disabilities and disabled veterans in our job application procedures. If, due to a disability, you need an accommodation during the interview process, please let your recruiter know."
3112771,"Client Account Manager, AUS","https://job-boards.greenhouse.io/reddit/jobs/6979383","Reddit","Sydney","No",4,"Full time","2025-06-19T02:05:20.290483Z","Reddit is a community of communities. Its built on shared interests, passion, and trust and is home to the most open and authentic conversations on the internet. Every day, Reddit users submit, vote, and comment on the topics they care most about. With 100,000+ active communities and approximately 101M+ daily active unique visitors, Reddit is one of the internets largest sources of information. For more information, visit redditinc.com.




Were seeking a Client Account Manager for the Australia Enterprise team. This person will closely collaborate with Client Partners on campaign execution and optimizations to help agencies and advertisers achieve their marketing objectives on the fast-growing Reddit platform. 
Please note that this role is required to be based out of Sydney.
Responsibilities:

Collaborate closely with Client Partners to meet and exceed clients marketing goals.
Proactively manage and deepen relationships with existing advertising partners, both with agencies and directly with the largest and most complex clients of Reddit to drive year-on-year revenue growth.
Lead and execute campaign launches from start to finish and deliver insightful optimizations to agency and client partners
Identify, strategize, and win incremental revenue opportunities of existing advertiser base to grow in-quarter revenue growth.
Ongoing management of internal account operations (revenue delivery and troubleshooting issues)
Educate brands and media agencies, effectively communicate value proposition and best practices
Consult clients on their awareness and direct response objectives, and partner closely with Client Partners to craft thoughtful and creative media plans
Collaborate with Ad Ops to ensure effective campaign delivery and resolve any technical hurdles
Proactively seek and represent client needs and asks to cross-functional stakeholders
Shape Reddits native ads product roadmap, for mobile and in general, by aggregating and sharing client feedback and campaign metrics with cross-functional stakeholders
Proactively and continually identify areas of improvement
Mentor and train other team members.

Required Qualifications: 

4+ years of experience in advertising sales and account management, 
Strong understanding of customer marketing funnel and traditional marketing ecosystem
Understanding of Digital measurement, tracking fundamentals and mobile measurement partners
Tenacious and entrepreneurial approach to working through product, process, and client challenges
Experience cultivating strong relationships with external partners
Exceptional communication and interpersonal skills
Ability to work in a fast-paced and unstructured work environment
High attention to detail
Strong work ethic and growth mindset
Proficiency in Excel preferred
BA / BS degree or equivalent work experience

Benefits:

Private Medical Benefits
Superannuation
Family Planning Support
Gender-Affirming Care
Mental Health &amp; Coaching Benefits
Flexible Vacation &amp; Reddit Global Days Off
Pay Transparency:
This job posting may span more than one career level.
In addition to base salary, this job is eligible to receive equity in the form of restricted stock units, and will also be eligible to receive a commission. Additionally, Reddit offers a wide range of benefits to U.S.-based employees, including medical, dental, and vision insurance, 401(k) program with employer match, generous time off for vacation, and parental leave. To learn more, please visit https://www.redditinc.com/careers/.
To provide greater transparency to candidates, we share base pay ranges for all US-based job postings regardless of state. We set standard base pay ranges for all roles based on function, level, and country location, benchmarked against similar stage growth companies. Final offer amounts are determined by multiple factors including, skills, depth of work experience and relevant licenses/credentials, and may vary from the amounts listed below.The base pay range for this position is:$145,000$203,000 AUDReddit is proud to be an equal opportunity employer, and is committed to building a workforce representative of the diverse communities we serve.  Reddit is committed to providing reasonable accommodations for qualified individuals with disabilities and disabled veterans in our job application procedures. If, due to a disability, you need an accommodation during the interview process, please let your recruiter know."
3112770,"Client Account Executive, Mid-Market (Services)","https://job-boards.greenhouse.io/reddit/jobs/6892639","Reddit","New York","No",5,"Full time","2025-06-19T02:05:20.290513Z","Reddit is a community of communities. Its built on shared interests, passion, and trust and is home to the most open and authentic conversations on the internet. Every day, Reddit users submit, vote, and comment on the topics they care most about. With 100,000+ active communities and approximately 101M+ daily active unique visitors, Reddit is one of the internets largest sources of information. For more information, visit redditinc.com.




Were building Reddits Mid-Market team in North America to support a rapidly expanding book of advertisers who are looking to grow their businesses through Reddits unique, intent-rich communities. This is an opportunity to join a high-impact team that is reshaping how advertisers think about discovery, performance, and brand-building at scale.
As a Client Account Executive, you will have end-to-end ownership to, grow and retain your book of business across the Services segment. You will drive strategic conversations, guide campaign execution, and partner cross-functionally to help advertisers succeed on Reddit. You'll work closely with a team of Account Strategists to scale your impact across a dedicated book of business. The ideal candidate thrives in a fast-paced, consultative environment and enjoys taking ownership, building deep client relationships, and turning insights into action.
Please note that this role is required to work in person from our New York office 12 days per week.
Core Responsibilities

Own and grow a book of mid-market advertisers, acting as the main point of contact for both clients and agencies.
Drive advertiser activation, retention, and revenue growth through thoughtful client consultation, performance analysis, and solution-oriented storytelling.
Initiate and lead strategic sales conversations using market trends, performance data, and industry context to advise clients on how to scale on Reddit.
Work with Account Strategists to implement and optimize campaigns to achieve your clients advertising objectives across performance and brand campaigns.
Monitor and report on key campaign metrics, providing actionable recommendations for continuous improvement.
Identify and communicate product feedback and market insights to cross-functional teams to influence Reddits go-to-market strategy.
Develop and execute sales strategies to hit and exceed quarterly revenue targets.Cultivate strong client relationships with a customer-first mindset, balancing client priorities with Reddit best practices and long-term success planning.
Serve as a foundational hire shaping scaled sales methodologies and best practices for the Client Account Executive role.

Qualifications

5+ years of experience in digital media sales, account management, or paid social strategy.
Proven track record of meeting or exceeding revenue targets.
Strong understanding of the customer marketing funnel, auction dynamics, and digital advertising landscape.
Excellent communication skills - written, verbal, and visual - with a strong ability to craft and present narratives that drive action.
Highly analytical; comfortable translating data into client-facing insights.
Motivated self-starter who thrives in ambiguity and fast-paced environments.
Proficiency in Excel/Google Sheets and strong understanding of performance measurement and attribution.

Benefits:

Comprehensive Healthcare Benefits and Income Replacement Programs
401k Match
Family Planning Support
Gender-Affirming Care
Mental Health &amp; Coaching Benefits
Flexible Vacation &amp; Reddit Global Days off
Generous paid Parental Leave  
Paid Volunteer time off
Pay Transparency:
This job posting may span more than one career level.
In addition to base salary, this job is eligible to receive equity in the form of restricted stock units, and will also be eligible to receive a commission. Additionally, Reddit offers a wide range of benefits to U.S.-based employees, including medical, dental, and vision insurance, 401(k) program with employer match, generous time off for vacation, and parental leave. To learn more, please visit https://www.redditinc.com/careers/.
To provide greater transparency to candidates, we share base pay ranges for all US-based job postings regardless of state. We set standard base pay ranges for all roles based on function, level, and country location, benchmarked against similar stage growth companies. Final offer amounts are determined by multiple factors including, skills, depth of work experience and relevant licenses/credentials, and may vary from the amounts listed below.The base pay range for this position is:$114,660$160,510 USDReddit is proud to be an equal opportunity employer, and is committed to building a workforce representative of the diverse communities we serve.  Reddit is committed to providing reasonable accommodations for qualified individuals with disabilities and disabled veterans in our job application procedures. If, due to a disability, you need an accommodation during the interview process, please let your recruiter know."
3112769,"Client Account Executive, Mid-Market (Agency)","https://job-boards.greenhouse.io/reddit/jobs/6983177","Reddit","New York","No",5,"Full time","2025-06-19T02:05:20.290538Z","Reddit is a community of communities. Its built on shared interests, passion, and trust and is home to the most open and authentic conversations on the internet. Every day, Reddit users submit, vote, and comment on the topics they care most about. With 100,000+ active communities and approximately 101M+ daily active unique visitors, Reddit is one of the internets largest sources of information. For more information, visit redditinc.com.




Were building Reddits Mid-Market team in North America to support a rapidly expanding book of advertisers who are looking to grow their businesses through Reddits unique, intent-rich communities. This is an opportunity to join a high-impact team that is reshaping how advertisers think about discovery, performance, and brand-building at scale.
As a Client Account Executive, you will have end-to-end ownership to, grow and retain your book of business across the Mid-Market Agency segment. You will drive strategic conversations, guide campaign execution, and partner cross-functionally to help advertisers succeed on Reddit. You'll work closely with a team of Account Strategists to scale your impact across a dedicated book of business. The ideal candidate thrives in a fast-paced, consultative environment and enjoys taking ownership, building deep client relationships, and turning insights into action.
Please note that this role is required to work in person from our New York office 12 days per week.
Core Responsibilities

Own and grow a book of mid-market advertisers, acting as the main point of contact for both clients and agencies.
Drive advertiser activation, retention, and revenue growth through thoughtful client consultation, performance analysis, and solution-oriented storytelling.
Initiate and lead strategic sales conversations using market trends, performance data, and industry context to advise clients on how to scale on Reddit.
Work with Account Strategists to implement and optimize campaigns to achieve your clients advertising objectives across performance and brand campaigns.
Monitor and report on key campaign metrics, providing actionable recommendations for continuous improvement.
Identify and communicate product feedback and market insights to cross-functional teams to influence Reddits go-to-market strategy.
Develop and execute sales strategies to hit and exceed quarterly revenue targets.Cultivate strong client relationships with a customer-first mindset, balancing client priorities with Reddit best practices and long-term success planning.
Serve as a foundational hire shaping scaled sales methodologies and best practices for the Client Account Executive role.

Qualifications

5+ years of experience in digital media sales, account management, or paid social strategy.
Proven track record of meeting or exceeding revenue targets.
Strong understanding of the customer marketing funnel, auction dynamics, and digital advertising landscape.
Excellent communication skills - written, verbal, and visual - with a strong ability to craft and present narratives that drive action.
Highly analytical; comfortable translating data into client-facing insights.
Motivated self-starter who thrives in ambiguity and fast-paced environments.
Proficiency in Excel/Google Sheets and strong understanding of performance measurement and attribution.

Benefits:

Comprehensive Healthcare Benefits and Income Replacement Programs
401k Match
Family Planning Support
Gender-Affirming Care
Mental Health &amp; Coaching Benefits
Flexible Vacation &amp; Reddit Global Days off
Generous paid Parental Leave  
Paid Volunteer time off

#LI-ES1 #LI-onsitePay Transparency:
This job posting may span more than one career level.
In addition to base salary, this job is eligible to receive equity in the form of restricted stock units, and will also be eligible to receive a commission. Additionally, Reddit offers a wide range of benefits to U.S.-based employees, including medical, dental, and vision insurance, 401(k) program with employer match, generous time off for vacation, and parental leave. To learn more, please visit https://www.redditinc.com/careers/.
To provide greater transparency to candidates, we share base pay ranges for all US-based job postings regardless of state. We set standard base pay ranges for all roles based on function, level, and country location, benchmarked against similar stage growth companies. Final offer amounts are determined by multiple factors including, skills, depth of work experience and relevant licenses/credentials, and may vary from the amounts listed below.The base pay range for this position is:$114,660$160,510 USDReddit is proud to be an equal opportunity employer, and is committed to building a workforce representative of the diverse communities we serve.  Reddit is committed to providing reasonable accommodations for qualified individuals with disabilities and disabled veterans in our job application procedures. If, due to a disability, you need an accommodation during the interview process, please let your recruiter know."
3106368,"Web Engineer, Search Experiences","https://job-boards.greenhouse.io/reddit/jobs/6979395","Reddit","Remote","Yes",3,"Full time","2025-06-19T02:05:20.290578Z","Reddit is a community of communities. Its built on shared interests, passion, and trust and is home to the most open and authentic conversations on the internet. Every day, Reddit users submit, vote, and comment on the topics they care most about. With 100,000+ active communities and approximately 101M+ daily active unique visitors, Reddit is one of the internets largest sources of information. For more information, visit redditinc.com.




Location:This role is completely remote-friendly. If you happen to live close to one of our physical office locations, our doors are open for you to come into the office as often as you'd like. 
Who We Are: The mission of the Search Experiences team is to empower users to safely navigate, find, and engage with the breadth and depth of Reddit; a team that is used by 15 of all Redditors daily! This includes enabling product development teams across the company, and serving as the client access layer for all of Reddit's rich dataset while driving the next generation of user experiences. 
What Youll Do:Search is one our most viewed product surfaces, and a huge responsibility for the shepherds of these surfaces. This role will encompass ownership of the end to end UI/UX experiences that expose the latest advancements in Search technologies at Reddit. Furthermore, this is an opportunity to work closely with ML and Search practitioners to deliver a Search user experience that is safe, performant and engaging.
As a Web Engineer on the Search Experiences team, youll draw on your technical expertise (whether it's Lit-Element, SDUI, GraphQL, or React) to architect, implement, and maintain best in class UI/UX experiences that will advance Reddits efforts to bring community and belonging to everyone on the planet.
Responsibilities:

Expertise in Lit-Element, Web Components, React or equivalent web technologies, with experience developing Web applications
Design and implement the next generation of Reddit Feeds &amp; Search experiences
Work with product managers and designers to craft compelling user experiences
Champion and drive engineering processes and best practices
Write efficient, scalable and maintainable code that will help us iterate quickly and safely

Who You Might Be:

3+ years software engineering experience, and expect experience building user facing features from design to finish:

We are looking for someone with full stack web development experience, with a balance of experience across modern web technologies and backend service code
We are language-agnostic when hiring but use primarily typescript in the frontend, and GraphQL, golang, python in the backend stack.


A past track record of Quality, for example:

Familiarity with unit testing and other automated testing. 
Ability to code with resiliency and fault tolerance in mind
Has operational experience supporting live ops for websites


Collaboration skills: you work well with a team!

Benefits:

Comprehensive Healthcare Benefits and Income Replacement Programs
401k Match
Family Planning Support
Gender-Affirming Care
Mental Health &amp; Coaching Benefits
Flexible Vacation &amp; Reddit Global Days off
Generous paid Parental Leave  
Paid Volunteer time off

#LI-DB1 #LI-RemotePay Transparency:
This job posting may span more than one career level.
In addition to base salary, this job is eligible to receive equity in the form of restricted stock units, and depending on the position offered, it may also be eligible to receive a commission. Additionally, Reddit offers a wide range of benefits to U.S.-based employees, including medical, dental, and vision insurance, 401(k) program with employer match, generous time off for vacation, and parental leave. To learn more, please visit https://www.redditinc.com/careers/.
To provide greater transparency to candidates, we share base pay ranges for all US-based job postings regardless of state. We set standard base pay ranges for all roles based on function, level, and country location, benchmarked against similar stage growth companies. Final offer amounts are determined by multiple factors including, skills, depth of work experience and relevant licenses/credentials, and may vary from the amounts listed below.The base pay range for this position is:$164,200$229,900 USDReddit is proud to be an equal opportunity employer, and is committed to building a workforce representative of the diverse communities we serve.  Reddit is committed to providing reasonable accommodations for qualified individuals with disabilities and disabled veterans in our job application procedures. If, due to a disability, you need an accommodation during the interview process, please let your recruiter know."
