"ID","Title","Link","Company","Location","Remote","Experience","EmploymentType","DatePosted","RoleDescription"
3394791,"Forward Deployed Software Engineer  Applied AI FDE","https://jobs.smartrecruiters.com/ServiceNow/744000074864226-forward-deployed-software-engineer-applied-ai-fde","ServiceNow","New York","Yes",8,"Full time","2025-08-07T02:23:45.811438Z","Team Bio: ServiceNows Applied AI Forward Deployed Engineering (FDE) team is where bold ideas meet transformative action. We partner with our most strategic customers to shape the future of enterprise AI. Together, we identify high-value opportunities, accelerate business outcomes, and build reusable AI-native solutions that advance the Now AI Platform. Our mission: We partner deeply with our customers to build intelligent, scalable AI solutions that solve their most mission-critical challenges. By embedding in real-world complexity, we deliver fast, iterate with purpose, and transform every success into reusable patterns that accelerate transformation across the Now Platform and the broader enterprise. Why This Role Matters:Enterprises are raising the bar. AI initiatives must deliver business valuenot just promise potential. That means taking cutting-edge LLM capabilities and turning them into resilient, secure, and scalable software. As a Senior Forward Deployed Software Engineer (FDSE), you act as the CTO of the buildowning everything from backend services to LLM pipelines and front-end integrations. You partner with customers in the field to design, implement, and deliver solution-ready builds in agile sprints. Your software becomes the reference implementation for scalable GenAI in the enterprise. You codify patterns, shape internal tooling, and accelerate innovationdelivering systems that are battle-tested in production and scalable across industries. Who You Are:You are a systems-minded, AI-native engineer who ships real software. You own the full stackand are equally motivated by elegant APIs, intuitive UIs, and scalable orchestration pipelines. You think like a product-minded CTO, balancing creativity with pragmatism to deliver impact. You embed deeply with customer teams, diagnose root problems, and architect AI-powered workflows that run at scale. You dont just debug codeyou debug systems, context, and customer pain points. You will: Build solution-ready LLM-enabled applications that span backend logic, data orchestration, and front-end UI Operate in the field, working side-by-side with customers to adapt, deploy, and iterate in live environments Codify reusable assetslibraries, prompts, scaffoldsto accelerate future engagements Shape developer experience by sharing feedback with platform and product teams  What Youll Do: Deliver Production - ready solution in agile end-to-end sprintsEngineer with versatility: APIs, orchestration pipelines, vector DBs, LLM frameworks, UI components Operate with agility: integrate with legacy systems, navigate ambiguity, ship safely at speed Codify patterns: build scaffolds, SDKs, and documentation to scale success across customers Influence platform: inform product strategy through field-tested insights and extensible code What Success Looks Like:Production-grade delivery: Your solution builds consistently convert to scaled deployments in production environments Reusable impact: You author libraries, prompts, and scaffolds that power multiple deployments and projects Platform influence: Your work shapes internal tooling and is integrated into platform roadmap and primitives Velocity and precision: You move fast without breaking thingsshaping resilient, secure systems in high-stakes contexts Engineering leadership: You are trusted by architects, PMs, and customer teams to lead implementation from zero to one What You Bring:Experience: In leveraging or critically thinking about how to integrate AI into work processes, decision-making, or problem-solving. This may include using AI-powered tools, automating workflows, analyzing AI-driven insights, or exploring AIs potential impact on the function or industryRelevant Experience: 8+ years of software engineering, including 2+ years building systems in customer-facing or embedded roles System architecture: Proven ability to design and implement AI-native software in production environments Engineering depth: Strength in backend (Python, Node.js, Java), frontend (React, Angular), APIs (REST/GraphQL) LLM tooling: Familiarity with LangChain, Semantic Kernel, prompt chaining, vector search, and context management Performance &amp; observability: Skilled in debugging distributed systems, tuning for latency, and implementing monitoring Platform mindset: Can contribute to shared SDKs and tools, raising engineering velocity for the whole org Product sensibility: Prioritize for user value, MVP iteration, and long-term scale DevOps fluency: Experience deploying in AWS, Azure, or GCP with CI/CD, containers, and infra-as-code Field readiness: Able to travel up to 30% to embed onsite and deliver where it matters Preferred Qualifications:Experience integrating AI into SaaS platforms like ServiceNow or Salesforce Track record of production deployments in secure, regulated enterprise environments Contributions to dev experience tooling, frameworks, or reusable AI scaffolds Join us at the frontier of enterprise AIwhere your code powers AI transformation, your systems go live in the real world, and your ideas shape how the future scales.   For positions in this location, we offer a base pay of $173,100 - $303,000, plus equity (when applicable), variable/incentive compensation and benefits. Sales positions generally offer a competitive On Target Earnings (OTE) incentive compensation structure. Please note that the base pay shown is a guideline, and individual total compensation will vary based on factors such as qualifications, skill level, competencies, and work location. We also offer health plans, including flexible spending accounts, a 401(k) Plan with company match, ESPP, matching donations, a flexible time away plan and family leave programs. Compensation is based on the geographic location in which the role is located and is subject to change based on work location.Work PersonasWe approach our distributed world of work with flexibility and trust. Work personas (flexible, remote, or required in office) are categories that are assigned to ServiceNow employees depending on the nature of their work and their assigned work location. Learn more here. To determine eligibility for a work persona, ServiceNow may confirm the distance between your primary residence and the closest ServiceNow office using a third-party service.Equal Opportunity EmployerServiceNow is an equal opportunity employer. All qualified applicants will receive consideration for employment without regard to race, color, creed, religion, sex, sexual orientation, national origin or nationality, ancestry, age, disability, gender identity or expression, marital status, veteran status, or any other category protected by law. In addition, all qualified applicants with arrest or conviction records will be considered for employment in accordance with legal requirements. AccommodationsWe strive to create an accessible and inclusive experience for all candidates. If you require a reasonable accommodation to complete any part of the application process, or are unable to use this online application and need an alternative method to apply, please contact globaltalentss@servicenow.com for assistance. Export Control RegulationsFor positions requiring access to controlled technology subject to export control regulations, including the U.S. Export Administration Regulations (EAR), ServiceNow may be required to obtain export control approval from government authorities for certain individuals. All employment is contingent upon ServiceNow obtaining any export license or other approval that may be required by relevant export control authorities. From Fortune. 2025 Fortune Media IP Limited. All rights reserved. Used under license."
3389690,"Senior Manager Architecture ","https://jobs.smartrecruiters.com/ServiceNow/744000074674045-senior-manager-architecture-","ServiceNow","Bangalore","No","Not specified","Full time","2025-08-07T02:23:45.811472Z","This position reports to the Director, Architecture, Customer Excellence Group and leads a team of Architects based in India. The team supports a mix of global (cross-geo) strategic accounts outside APAC and local India customers, delivering architectural leadership across a diverse range of engagements. Our Architects focus on platform strategy, governance, and adoption enablement across multi-workflow environments. They partner with ServiceNows largest customers to maximise value through architecture-led delivery and long-term platform health.Preferred Location : Bangalore / HyderabadWhat You Get to Do in This RoleLead a team of 812 Architects, fostering growth, enablement, and professional development.Champion customer transformation, ensuring solutions align with business goals and drive measurable outcomes.Provide strategic and technical leadership to customers, partners, and internal teams.Drive a culture of collaboration, knowledge sharing, and continuous learning within the team.Coordinate work across regional and global teams to ensure alignment and effective delivery.Support business development efforts, including pre-sales, scoping, and proposal development.Partner with internal teamsProduct, Sales, Enablementto align architecture strategy with broader ServiceNow objectives.Develop and refine service offerings, best practices, and thought leadership.Key Performance MeasurementsTeam productivity and delivery readiness.Customer satisfaction scores and project impact.Talent development and team growth.Readiness and capability building within the team.Driving innovation and adoption in ServiceNow deployments.Cross-geo collaboration effectiveness.A transformation mindset, focused on delivering long-term business impact.Strong communication skills, with the ability to simplify complex concepts.Passion for driving innovation and continuous improvement.Ability to foster collaboration within a diverse, global team.Additional InformationTravel requirements will vary based on business needs.ServiceNow is an Equal Opportunity Employer, committed to building an inclusive and diverse workplace.We offer professional development, mentorship, and career growth opportunities.Benefits include health and wellness programs, remote work flexibility, and employee resource groups. Qualifications and Experience Leadership &amp; People DevelopmentProven leadership experience in a professional services environment.Ability to inspire, mentor, and develop diverse teams in technical and business domains.Experience managing teams or leading large-scale customer engagements.Strong relationship-building skills with internal teams, partners, and customers.Commitment to fostering an inclusive and equitable workplace, valuing diverse perspectives.Consulting &amp; Delivery Experience7+ years in a consulting or professional services role with a focus on enterprise solutions.Strong problem-solving mindset, focused on transformation and measurable business value.Experience with Now Create, Agile frameworks, or similar methodologies.Comfort engaging with senior stakeholders, including Enterprise Architects and C-level executives.Technical ExpertiseExperience in leveraging or critically thinking about how to integrate AI into work processes, decision-making, or problem-solving.This may include using AI-powered tools, automating workflows, analysing AI-driven insights, or exploring AIs potential impact on the function or industry. Experience in SaaS platforms, enterprise architecture, or digital transformation.Familiarity with ServiceNow or similar enterprise platforms is beneficial but not mandatory.Ability to design scalable, high-impact solutions across Technology, CRM, Industry, Core Business, or AI &amp; Data domains.Willingness to pursue relevant certifications and continuous learning in the ServiceNow ecosystem.Work PersonasWe approach our distributed world of work with flexibility and trust. Work personas (flexible, remote, or required in office) are categories that are assigned to ServiceNow employees depending on the nature of their work and their assigned work location. Learn more here. To determine eligibility for a work persona, ServiceNow may confirm the distance between your primary residence and the closest ServiceNow office using a third-party service.Equal Opportunity EmployerServiceNow is an equal opportunity employer. All qualified applicants will receive consideration for employment without regard to race, color, creed, religion, sex, sexual orientation, national origin or nationality, ancestry, age, disability, gender identity or expression, marital status, veteran status, or any other category protected by law. In addition, all qualified applicants with arrest or conviction records will be considered for employment in accordance with legal requirements. AccommodationsWe strive to create an accessible and inclusive experience for all candidates. If you require a reasonable accommodation to complete any part of the application process, or are unable to use this online application and need an alternative method to apply, please contact globaltalentss@servicenow.com for assistance. Export Control RegulationsFor positions requiring access to controlled technology subject to export control regulations, including the U.S. Export Administration Regulations (EAR), ServiceNow may be required to obtain export control approval from government authorities for certain individuals. All employment is contingent upon ServiceNow obtaining any export license or other approval that may be required by relevant export control authorities. From Fortune. 2025 Fortune Media IP Limited. All rights reserved. Used under license."
3389689,"Software Quality Engineer","https://jobs.smartrecruiters.com/ServiceNow/744000074676406-software-quality-engineer","ServiceNow","Hyderabad","No",2,"Full time","2025-08-07T02:23:45.811507Z","What you get to do in this role:   Maintain existing automation test frameworksCollect and report quality metrics from test executionWork with developers to design specific testing strategies for features being developed and automate themCreate comprehensive test plans; execute and automate themSupport engineering organizations in troubleshooting or addressing issues with applications and dev/test environmentsTo be successful in this role you have:Experience in leveraging or critically thinking about how to integrate AI into work processes, decision-making, or problem-solving. This may include using AI-powered tools, automating workflows, analyzing AI-driven insights, or exploring AI's potential impact on the function or industry.2+ years of experience with technologies relevant to SN and coding skills with high-quality results.Experience working within different automated testing frameworks, including Java, JUnit, Selenium, TestNG and other open-source projects.Experience with the agile methodology for software development teams.Ability to understand several testing techniques (e.g. performance, unit, integration, automated), their strengths and weakness, and ability to use them to best effect - including tracking and addressing of any discovered issues.Ability to use tools (such as IDE, debugger, build tools, source control, ServiceNow instances, profilers, system administration/Unix tools) to assist with daily tasks.  Work PersonasWe approach our distributed world of work with flexibility and trust. Work personas (flexible, remote, or required in office) are categories that are assigned to ServiceNow employees depending on the nature of their work and their assigned work location. Learn more here. To determine eligibility for a work persona, ServiceNow may confirm the distance between your primary residence and the closest ServiceNow office using a third-party service.Equal Opportunity EmployerServiceNow is an equal opportunity employer. All qualified applicants will receive consideration for employment without regard to race, color, creed, religion, sex, sexual orientation, national origin or nationality, ancestry, age, disability, gender identity or expression, marital status, veteran status, or any other category protected by law. In addition, all qualified applicants with arrest or conviction records will be considered for employment in accordance with legal requirements. AccommodationsWe strive to create an accessible and inclusive experience for all candidates. If you require a reasonable accommodation to complete any part of the application process, or are unable to use this online application and need an alternative method to apply, please contact globaltalentss@servicenow.com for assistance. Export Control RegulationsFor positions requiring access to controlled technology subject to export control regulations, including the U.S. Export Administration Regulations (EAR), ServiceNow may be required to obtain export control approval from government authorities for certain individuals. All employment is contingent upon ServiceNow obtaining any export license or other approval that may be required by relevant export control authorities. From Fortune. 2025 Fortune Media IP Limited. All rights reserved. Used under license."
3389688,"Staff Software Engineer, ServiceNow Platform","https://jobs.smartrecruiters.com/ServiceNow/744000074678205-staff-software-engineer-servicenow-platform","ServiceNow","Hyderabad","No",9,"Full time","2025-08-07T02:23:45.811542Z","Role In this role you will interact with business, system analysts and application developers to understand system requirements and put your automation and functional testing skills to ensure delivery of business critical cloud applications/solutions with highest quality and minimal downtime. You get to grow your career by acquiring skills on latest tools and technologies putting you in the league of the best in the industry.What you get to do in this role:Build high-quality, clean, scalable and reusable code by enforcing best practices around software engineering architecture and processes (Code Reviews, Unit testing, etc.)Work with the product owners to understand detailed requirements and own your code from design, implementation, test automation and delivery of high-quality product to our users.Design software that is simple to use to allow customers to extend and customize the functionality to meet their specific needsContribute to the design and implementation of new products and features while also enhancing the existing product suiteBe a mentor for colleagues and help promote knowledge-sharingTo be successful in this role you have:Experience in leveraging or critically thinking about how to integrate AI into work processes, decision-making, or problem-solving. This may include using AI-powered tools, automating workflows, analyzing AI-driven insights, or exploring AI's potential impact on the function or industry.BS in Computer Science/Engineering or equivalent domain with 9+ years of cloud applications experienceExperience in ServiceNow platform is mandatory.6 + years of experience with Javascript experience.Passion for JavaScript and the Web as a platform, reusability, and componentizationExperience with data structures, algorithms, object-oriented design, design patterns, and performance/scale considerationsExperience with any of the modern UI frameworks like Angular, React JSGood Analytical and design skillsGood understanding  in DevOPS Implementation.Good knowledge in Selenium, Open test frameworks.Ability to create unit tests using Junit, TestNG frameworksExperience working with SCM tools like Git/ SVN.Experience in Rest Api automation tools like  Rest Assured/ Http Client.Experience working in Agile Practices (SAFE, Scrum). FD21  Work PersonasWe approach our distributed world of work with flexibility and trust. Work personas (flexible, remote, or required in office) are categories that are assigned to ServiceNow employees depending on the nature of their work and their assigned work location. Learn more here. To determine eligibility for a work persona, ServiceNow may confirm the distance between your primary residence and the closest ServiceNow office using a third-party service.Equal Opportunity EmployerServiceNow is an equal opportunity employer. All qualified applicants will receive consideration for employment without regard to race, color, creed, religion, sex, sexual orientation, national origin or nationality, ancestry, age, disability, gender identity or expression, marital status, veteran status, or any other category protected by law. In addition, all qualified applicants with arrest or conviction records will be considered for employment in accordance with legal requirements. AccommodationsWe strive to create an accessible and inclusive experience for all candidates. If you require a reasonable accommodation to complete any part of the application process, or are unable to use this online application and need an alternative method to apply, please contact globaltalentss@servicenow.com for assistance. Export Control RegulationsFor positions requiring access to controlled technology subject to export control regulations, including the U.S. Export Administration Regulations (EAR), ServiceNow may be required to obtain export control approval from government authorities for certain individuals. All employment is contingent upon ServiceNow obtaining any export license or other approval that may be required by relevant export control authorities. From Fortune. 2025 Fortune Media IP Limited. All rights reserved. Used under license."
3389687,"Sr Software Quality Engineer","https://jobs.smartrecruiters.com/ServiceNow/744000074677820-sr-software-quality-engineer","ServiceNow","Hyderabad","No",5,"Full time","2025-08-07T02:23:45.811577Z","What you get to do in this role:   Maintain existing automation test frameworksCollect and report quality metrics from test executionWork with developers to design specific testing strategies for features being developed and automate themCreate comprehensive test plans; execute and automate themSupport engineering organizations in troubleshooting or addressing issues with applications and dev/test environmentsTo be successful in this role you have:Experience in leveraging or critically thinking about how to integrate AI into work processes, decision-making, or problem-solving. This may include using AI-powered tools, automating workflows, analyzing AI-driven insights, or exploring AI's potential impact on the function or industry.5+ years of experience with quality assurance and Java programming with Selenium, JUnit and TestNGFluency with scripting in JavaScript. Experience with Eclipse, Jenkin, Maven, and GitUnderstanding of testing techniques (e.g. performance, unit, integration, automated), their strengths and weakness, and ability to use them to best effectAbility to use tools (such as IDE, debugger, build tools, source control, ServiceNow instances, profilers, system administration/Unix tools) to assist with daily tasksExperience driving cross-team technical discussions with an understanding of SDLC concepts  Work PersonasWe approach our distributed world of work with flexibility and trust. Work personas (flexible, remote, or required in office) are categories that are assigned to ServiceNow employees depending on the nature of their work and their assigned work location. Learn more here. To determine eligibility for a work persona, ServiceNow may confirm the distance between your primary residence and the closest ServiceNow office using a third-party service.Equal Opportunity EmployerServiceNow is an equal opportunity employer. All qualified applicants will receive consideration for employment without regard to race, color, creed, religion, sex, sexual orientation, national origin or nationality, ancestry, age, disability, gender identity or expression, marital status, veteran status, or any other category protected by law. In addition, all qualified applicants with arrest or conviction records will be considered for employment in accordance with legal requirements. AccommodationsWe strive to create an accessible and inclusive experience for all candidates. If you require a reasonable accommodation to complete any part of the application process, or are unable to use this online application and need an alternative method to apply, please contact globaltalentss@servicenow.com for assistance. Export Control RegulationsFor positions requiring access to controlled technology subject to export control regulations, including the U.S. Export Administration Regulations (EAR), ServiceNow may be required to obtain export control approval from government authorities for certain individuals. All employment is contingent upon ServiceNow obtaining any export license or other approval that may be required by relevant export control authorities. From Fortune. 2025 Fortune Media IP Limited. All rights reserved. Used under license."
