"ID","Title","Link","Company","Location","Remote","Experience","EmploymentType","DatePosted","RoleDescription"
3394824,"Software Engineer (Java Full Stack)","https://jobs.smartrecruiters.com/ServiceNow/744000074741038-software-engineer-java-full-stack-","ServiceNow","Hyderabad","No",3,"Full time","2025-08-07T02:23:45.810291Z","What you get to do in this role:   Build high-quality, clean, scalable and reusable code by enforcing best practices around software engineering architecture and processes (Code Reviews, Unit testing, etc.)Work with the product owners to understand detailed requirements and own your code from design, implementation, test automation and delivery of high-quality product to our users.Design software that is simple to use to allow customers to extend and customize the functionality to meet their specific needsHelp design and implement new products and features while also enhancing the existing product suiteTo be successful in this role you have:Experience in leveraging or critically thinking about how to integrate AI into work processes, decision-making, or problem-solving. This may include using AI-powered tools, automating workflows, analyzing AI-driven insights, or exploring AI's potential impact on the function or industryExperience in using AI Productivity tools such as Cursor, Windsurf, etc. is a plus or nice to have3 to 4 years of experience with Java or a similar OO languagePassion for JavaScript and the Web as a platform, reusability, and componentizationExperience with data structures, algorithms, object-oriented design, design patterns, and performance/scale considerationsExperience with any of the modern UI frameworks like Angular, React or VueAnalytical and design skillsWorking knowledge and ability to use tools to assist with daily tasks (IDE, debugger, build tools, source control, ServiceNow instances, profilers, system administration/Unix tools) FD21  Work PersonasWe approach our distributed world of work with flexibility and trust. Work personas (flexible, remote, or required in office) are categories that are assigned to ServiceNow employees depending on the nature of their work and their assigned work location. Learn more here. To determine eligibility for a work persona, ServiceNow may confirm the distance between your primary residence and the closest ServiceNow office using a third-party service.Equal Opportunity EmployerServiceNow is an equal opportunity employer. All qualified applicants will receive consideration for employment without regard to race, color, creed, religion, sex, sexual orientation, national origin or nationality, ancestry, age, disability, gender identity or expression, marital status, veteran status, or any other category protected by law. In addition, all qualified applicants with arrest or conviction records will be considered for employment in accordance with legal requirements. AccommodationsWe strive to create an accessible and inclusive experience for all candidates. If you require a reasonable accommodation to complete any part of the application process, or are unable to use this online application and need an alternative method to apply, please contact globaltalentss@servicenow.com for assistance. Export Control RegulationsFor positions requiring access to controlled technology subject to export control regulations, including the U.S. Export Administration Regulations (EAR), ServiceNow may be required to obtain export control approval from government authorities for certain individuals. All employment is contingent upon ServiceNow obtaining any export license or other approval that may be required by relevant export control authorities. From Fortune. 2025 Fortune Media IP Limited. All rights reserved. Used under license."
3394823,"Manager, Technical Support Management","https://jobs.smartrecruiters.com/ServiceNow/744000074753356-manager-technical-support-management","ServiceNow","Hyderabad","No",10,"Full time","2025-08-07T02:23:45.810397Z","What you get to do in this role:Profound knowledge and experience in managing and exceeding Support KPIs and critical Technical Support Metrics - CSAT, Time to Resolution (TTR), Backlogs etc.Lead efforts to hire, develop, and build a technical team.Oversight and participation in Change Management as it relates to Customer Support.Leading by example to cultivate and maintain a culture built on teamwork and collaboration.Own and bring to conclusion customer escalations by working with cross-teams in Support, development and operations team.Drive daily incident management success from detection to resolution and dissatisfaction issues for customer accounts leading to ongoing enhanced customer experiences.Represent the Platform, Product and ServiceNow effectively with customers.Manage major operations outages and communications to the customers.Participate in weekend and holiday on-call rotation as required.Evaluation of current processes, technology, and organizational skills to identify areas of improvement and opportunities for advancement.Leading by example to cultivate and maintain a culture built on teamwork and collaboration.Manage to the company and departments vision, mission and values.To be successful in this role you have:Experience in leveraging or critically thinking about how to integrate AI into work processes, decision-making, or problem-solving. This may include using AI-powered tools, automating workflows, analyzing AI-driven insights, or exploring AI's potential impact on the function or industry.A minimum of 10 years technical support and service management experience with a minimum of 3-4 years in supervisory role is required.Experience managing Enterprise support in a large and complex environment in a web-based service and technology.Proven capability of having successfully delivered on support metrics and managed support team.Customer first Mind set and a Get it done attitude are critical success factors for this role.Demonstrated ability to provide exceptional internal and external customer care.Proven ability to create and implement programs to drive efficient, innovative operations and contain expenses.Ability to lead change by effectively building commitment and winning support for initiatives.A trustworthy leader with a reputation for fairness, dependability and adherence to high ethical standards.  Strong analytical and problem-solving skills.Excellent communication skills, both oral and written. JV20  Work PersonasWe approach our distributed world of work with flexibility and trust. Work personas (flexible, remote, or required in office) are categories that are assigned to ServiceNow employees depending on the nature of their work and their assigned work location. Learn more here. To determine eligibility for a work persona, ServiceNow may confirm the distance between your primary residence and the closest ServiceNow office using a third-party service.Equal Opportunity EmployerServiceNow is an equal opportunity employer. All qualified applicants will receive consideration for employment without regard to race, color, creed, religion, sex, sexual orientation, national origin or nationality, ancestry, age, disability, gender identity or expression, marital status, veteran status, or any other category protected by law. In addition, all qualified applicants with arrest or conviction records will be considered for employment in accordance with legal requirements. AccommodationsWe strive to create an accessible and inclusive experience for all candidates. If you require a reasonable accommodation to complete any part of the application process, or are unable to use this online application and need an alternative method to apply, please contact globaltalentss@servicenow.com for assistance. Export Control RegulationsFor positions requiring access to controlled technology subject to export control regulations, including the U.S. Export Administration Regulations (EAR), ServiceNow may be required to obtain export control approval from government authorities for certain individuals. All employment is contingent upon ServiceNow obtaining any export license or other approval that may be required by relevant export control authorities. From Fortune. 2025 Fortune Media IP Limited. All rights reserved. Used under license."
3394822,"Principle Product Manager, Field Services Management","https://jobs.smartrecruiters.com/ServiceNow/744000074757538-principle-product-manager-field-services-management","ServiceNow","Santa Clara","Yes",8,"Full time","2025-08-07T02:23:45.810437Z","This position reports to: GM, Field Service ManagementThe Team:The CRM and Industries Workflows products enable organizations to create seamless customer experiences and drive fierce customer loyalty. Our products, Customer Service Management, Sales and Order Management and Field Service Management, and Industry verticalized solutions, deliver omnichannel customer engagement and operations while uniting the front, middle, and back office teams to sell, fulfill and service through a single AI-powered platform.The Role:Outbound Product Managers are key to help us scale as we continue to be one of the fastest-growing business units at ServiceNow. Outbound Product Managers combine a deep understanding of product capabilities, and market and competitive dynamics, with a passion to inform roadmap and help our GTM, partner and customer ecosystem understand the value delivered. What you get to do in this role:  Create high-quality enablement content that describes the value of the product innovation with a focus on Field Service Management solution Develop a deep understanding of and document, customer use cases and success outcomes to influence the product roadmaps Develop best practices assets including early product demos to drive product adoption by customers and partners  Become a trusted resource to promote the FSM product vision with industry influencers, strategic partners and analyst firms.  Work in close coordination with Inbound Product Management, Product Marketing, Product Success and Technical Alliances to define product strategy, release themes, go-to-market and customer adoption plans.  Lead cross-functional teams to accomplish our goalsExperience in leveraging or critically thinking about how to integrate AI into work processes, decision-making, or problem-solving. This may include using AI-powered tools, automating workflows, analyzing AI-driven insights, or exploring AIs potential impact on the function or industry. 8+ years of Product Management or related experience in the Field Services Management domain is a mustExperience in Solution Consulting/Solution Architecture/Enterprise Architecture functions are a plusVery strong written and oral communication skills  Strong bias towards action, being hands-on with product, and a sense of urgency to win in the market   Excellent people and management skills to interact with customers, executive staff, colleagues and cross-functional teams, and third parties    For positions in this location, we offer a base pay of $163,600 - $286,300, plus equity (when applicable), variable/incentive compensation and benefits. Sales positions generally offer a competitive On Target Earnings (OTE) incentive compensation structure. Please note that the base pay shown is a guideline, and individual total compensation will vary based on factors such as qualifications, skill level, competencies, and work location. We also offer health plans, including flexible spending accounts, a 401(k) Plan with company match, ESPP, matching donations, a flexible time away plan and family leave programs. Compensation is based on the geographic location in which the role is located and is subject to change based on work location.Work PersonasWe approach our distributed world of work with flexibility and trust. Work personas (flexible, remote, or required in office) are categories that are assigned to ServiceNow employees depending on the nature of their work and their assigned work location. Learn more here. To determine eligibility for a work persona, ServiceNow may confirm the distance between your primary residence and the closest ServiceNow office using a third-party service.Equal Opportunity EmployerServiceNow is an equal opportunity employer. All qualified applicants will receive consideration for employment without regard to race, color, creed, religion, sex, sexual orientation, national origin or nationality, ancestry, age, disability, gender identity or expression, marital status, veteran status, or any other category protected by law. In addition, all qualified applicants with arrest or conviction records will be considered for employment in accordance with legal requirements. AccommodationsWe strive to create an accessible and inclusive experience for all candidates. If you require a reasonable accommodation to complete any part of the application process, or are unable to use this online application and need an alternative method to apply, please contact globaltalentss@servicenow.com for assistance. Export Control RegulationsFor positions requiring access to controlled technology subject to export control regulations, including the U.S. Export Administration Regulations (EAR), ServiceNow may be required to obtain export control approval from government authorities for certain individuals. All employment is contingent upon ServiceNow obtaining any export license or other approval that may be required by relevant export control authorities. From Fortune. 2025 Fortune Media IP Limited. All rights reserved. Used under license."
3394821,"Technical Support, Infrastructure Engineer","https://jobs.smartrecruiters.com/ServiceNow/744000074779201-technical-support-infrastructure-engineer","ServiceNow","Hyderabad","No",2,"Full time","2025-08-07T02:23:45.810485Z","What you get to do in this role:   In this role, the support engineer will resolve technical cases created by customers looking for help to understand or troubleshoot unexpected behaviors or to answer technical questions about the ServiceNow software and platform.A successful candidate will be committed to providing amazing customer support experiences, using skills that include building trust, showing empathy and excellent communication to answer customer questions and resolve issues through various technologies including web, chat, email, case updates, as well as direct telephone support.Understanding the ServiceNow platform and all core functionalities will be essential while employing various diagnostic tools to isolate the potential cause of the issue. The engineer is expected to diligently manage and resolve challenging issues assigned to them but may need to coordinate assistance from additional teams for more complex cases. As such, creative problem solving, a collaborative nature and flexibility will be key to your success.Lastly, support engineers also play a key role in providing input across business units regarding process and product improvements due to their unique perspective when working on technical issues for customers.Qualifications and technical skills that will lead to success: Experience in leveraging or critically thinking about how to integrate AI into work processes, decision-making, or problem-solving. This may include using AI-powered tools, automating workflows, analyzing AI-driven insights, or exploring AI's potential impact on the function or industry.Qualification &amp; ExperienceMust have bachelors degree in Computer Science or related field (or equivalent degree and experience)       2+ years providing customer facing technical support (Web based products or e-commerce preferred)       Candidates will lesser experience will be considered for appropriate roles.In order to be successful in this role, we need someone who has:       Ability to comprehend, modify server-side object-oriented JavaScript, Unix Shell scripting and Windows scripting and Powershell.       Ability in server administration across OS platforms (Windows/Unix). Including understanding of user permission levels, domain configuration, group policy objects and execution of SUDO Policies.       Remote administration via SSH, SNMP, WMI, PowerShell       Understanding of SNMP traps and MIBs/OIDs       Ability to understand and modify XML, JSON, Regular Expressions (RegEx)       Familiarity with AWS, Azure, VMWare, Amazon EC2 including appropriate template types (ARM templates, CFT)       Understanding of protocols such as HTTP, TCP, FTP/SFTP, SOAP and REST       Experience with troubleshooting tools such as Wireshark, Traceroute       Solid understanding of object-oriented programming skills (Java strongly preferred)       Good understanding of database concepts.       A fundamental understanding of ITOM, CMDB and ITIL business process       Strong troubleshooting/root cause isolation skills        Demonstrated creative problem-solving approach and strong analytical skills       Must be proficient with analyzing log files and standard debugging concept.       Experience providing web development support is highly desirable.       Familiarity with tools &amp; practices of the trade such as incident management, knowledgebase, defect &amp; escalation management.       Excellent communication skills (verbal and written).Preferred Skills (Great to have)       Previous experience working with the ServiceNow platform (Asset Management, Orchestration, Discovery, Mid Server, BSM Map &amp; Service Mapping)       Understanding of JavaScript.       Familiarity with Eclipse IDE.       Previous experience in software development(or) software consulting.       Experience supporting and troubleshooting e-commerce applications with catalog, shopping cart, merchandising and payment handling is highly desirable. Experience providing SaaS support is desirable.  Work PersonasWe approach our distributed world of work with flexibility and trust. Work personas (flexible, remote, or required in office) are categories that are assigned to ServiceNow employees depending on the nature of their work and their assigned work location. Learn more here. To determine eligibility for a work persona, ServiceNow may confirm the distance between your primary residence and the closest ServiceNow office using a third-party service.Equal Opportunity EmployerServiceNow is an equal opportunity employer. All qualified applicants will receive consideration for employment without regard to race, color, creed, religion, sex, sexual orientation, national origin or nationality, ancestry, age, disability, gender identity or expression, marital status, veteran status, or any other category protected by law. In addition, all qualified applicants with arrest or conviction records will be considered for employment in accordance with legal requirements. AccommodationsWe strive to create an accessible and inclusive experience for all candidates. If you require a reasonable accommodation to complete any part of the application process, or are unable to use this online application and need an alternative method to apply, please contact globaltalentss@servicenow.com for assistance. Export Control RegulationsFor positions requiring access to controlled technology subject to export control regulations, including the U.S. Export Administration Regulations (EAR), ServiceNow may be required to obtain export control approval from government authorities for certain individuals. All employment is contingent upon ServiceNow obtaining any export license or other approval that may be required by relevant export control authorities. From Fortune. 2025 Fortune Media IP Limited. All rights reserved. Used under license."
