"ID","Title","Link","Company","Location","Remote","Experience","EmploymentType","DatePosted","RoleDescription"
3394800,"Director, IT Program/Project Management","https://jobs.smartrecruiters.com/ServiceNow/744000074857435-director-it-program-project-management","ServiceNow","San Diego","Yes","Not specified","Full time","2025-08-07T02:23:45.811135Z","Company  Work matters. Its where we spend a third of our lives. And the workplace of the future is going to be a great place. Were dedicated to bringing that to life for people everywhere. Thats why we put people at the heart of everything we do. People matter. Our people have a passion for learning, building, and innovating. Whether youre an engineer, a sales professional, a finance professional, or anything in-between, our roles aim to provide each person with meaningful impact and plenty of space to grow.  People matter. Our people have a passion for learning, building, and innovating. Whether youre an engineer, a sales professional, a finance professional, or anything in-between, our roles aim to provide each person with meaningful impact and plenty of space to grow.Digital Technology:Were not yesterdays IT department, we're Digital Technology. The world around us keeps changing and so do we. Were redefining what it means to be IT with a mindset centered on transformation, experience, AI-driven automation, innovation, and growth. Were all about delivering delightful, secure customer and employee experiences that accelerate ServiceNows journey to become the defining enterprise software company of the 21st century. And we love co-creating, using, and highlighting our own products to do it.  Ultimately, we strive to make the world work better for our employees and customerswhen you work in ServiceNow Digital Technology, you work for them. Come join the Digital Technology IT PMO team and work with a talented group of Program Managers and Scrum Masters leading ServiceNow transformation programs. This team is responsible for driving, through best-in-class program management, enterprise initiatives that enable ServiceNow Sales, Marketing, Services and Channel businesses with advanced technology and analytics. As a member of the DT PMO team, you will be instrumental in delivering some of the most innovative and cutting-edge technologies, products to market. We are truly a team, supporting each other and celebrating our successes!  This position reports to the Senior Director PMO - Portfolio ManagementWhat you get to do in this role:  Drive Strategic Programs: Drive complex, mission-critical programs from concept through implementation, aligning with business objectives, OKRs, and value realization.Executive Collaboration &amp; Communication: Partner with cross-functional leaders across business, product, and technology. Deliver crisp, actionable updates and facilitate decision-making at the executive level.Agile &amp; Scaled Agile Execution: Apply SAFe/Agile standards across multiple teams including product, design, and engineering. Coach teams on Agile best practices and foster a culture of continuous improvement.Operational Excellence: Define and implement governance and operating models, manage risks and dependencies, ensure delivery quality, and promote best practices and documentation standards.Data-Dedicated Leadership: Create dashboards, analyze trends, and generate actionable insights. Leverage tools and AI to enhance reporting, planning, and workflow optimization.ServiceNow &amp; Digital Enablement: Collaborate with product leaders to convert vision into roadmaps powered by ServiceNow. Guide teams on backlog management, tooling, and digital experience improvement.
  To be successful in this role you have:Experience in leveraging or critically thinking about how to integrate AI into work processes, decision-making, or problem-solving. This may include using AI-powered tools, automating workflows, analyzing AI-driven insights, or exploring AI's potential impact on the function or industry.15+ years in Program/Portfolio Management within enterprise software, leading large-scale, high-impact initiatives.Extensive experience in digital customer experience, digital learning, and platform-based transformation programs.Proven success leading in complex, matrixed environments and influencing across all organizational levels.Deep expertise in Agile, Kanban, Scrum, SAFe, and hybrid methodologies, with ability to establish governance and execution frameworks.Skilled in strategic planning, OKRs, KPI tracking, value realization, and executive-level communications.High energy, adaptable, and self-motivated with a passion for driving innovation and continuous improvement.Hands-on experience with the ServiceNow platform highly preferred.Background in Engineering or Product Management is a strong plus.Strong business acumen with exceptional communication, leadership, and stakeholder engagement skills.For positions in this location, we offer a base pay of $189,200 - $331,100, plus equity (when applicable), variable/incentive compensation and benefits. Sales positions generally offer a competitive On Target Earnings (OTE) incentive compensation structure. Please note that the base pay shown is a guideline, and individual total compensation will vary based on factors such as qualifications, skill level, competencies, and work location. We also offer health plans, including flexible spending accounts, a 401(k) Plan with company match, ESPP, matching donations, a flexible time away plan and family leave programs. Compensation is based on the geographic location in which the role is located and is subject to change based on work location.Work PersonasWe approach our distributed world of work with flexibility and trust. Work personas (flexible, remote, or required in office) are categories that are assigned to ServiceNow employees depending on the nature of their work and their assigned work location. Learn more here. To determine eligibility for a work persona, ServiceNow may confirm the distance between your primary residence and the closest ServiceNow office using a third-party service.Equal Opportunity EmployerServiceNow is an equal opportunity employer. All qualified applicants will receive consideration for employment without regard to race, color, creed, religion, sex, sexual orientation, national origin or nationality, ancestry, age, disability, gender identity or expression, marital status, veteran status, or any other category protected by law. In addition, all qualified applicants with arrest or conviction records will be considered for employment in accordance with legal requirements. AccommodationsWe strive to create an accessible and inclusive experience for all candidates. If you require a reasonable accommodation to complete any part of the application process, or are unable to use this online application and need an alternative method to apply, please contact globaltalentss@servicenow.com for assistance. Export Control RegulationsFor positions requiring access to controlled technology subject to export control regulations, including the U.S. Export Administration Regulations (EAR), ServiceNow may be required to obtain export control approval from government authorities for certain individuals. All employment is contingent upon ServiceNow obtaining any export license or other approval that may be required by relevant export control authorities. From Fortune. 2025 Fortune Media IP Limited. All rights reserved. Used under license."
3394799,"Sr. Business Process Consultant, ServiceNow HR and Workplace Service Delivery Solutions","https://jobs.smartrecruiters.com/ServiceNow/744000074857945-sr-business-process-consultant-servicenow-hr-and-workplace-service-delivery-solutions","ServiceNow","Nashville","Yes",8,"Full time","2025-08-07T02:23:45.811172Z","The Role A Business Process Consultant (BPC) for ServiceNow is a functional and process expert in the ServiceNow Expert Services Team on customer engagement teams  consulting with customers and guiding them in the endeavor of transitioning business requirements to configuration requirements of the ServiceNow Core Business Services Products (which includes HR Service Delivery, Legal Service Delivery, Workplace/Facility Service Delivery, Employee Service Management Solutions and Finance &amp; Supply Chain Solutions  all with the goal of accelerating and driving customer business outcomes.What you get to do in this role: Be the process expert for HR, Legal, Workplace/Facility and/or Finance/Supply Chain departments using ServiceNow products and ServiceNow best practices focused on configuration vs. customization, to drive business outcomes Driving HR, Legal, Workplace/Facility and/or Finance/Supply Chain-specific process definition, re-engineering, improvement and gap analysis of current/future-state processes during workshops with key customer sponsors and stakeholders Lead customers in their efforts to take advantage of the ServiceNow Solutions standard capabilities in their efforts to improve their processes Lead customer design workshops focused on ServiceNow Platform and Solution functionality Own support of key customer process owners/Subject Matter Experts (SMEs) to obtain business requirements using ServiceNow standard materials and collateral Guide customers in completing required documentation such as business requirement workbooks for functional aspects of the solution Draft persona-based and functionality-focused user stories, their acceptance criteria, testing strategy and knowledge transfer while supporting customers in reviewing and approving them. The BPC owns the lifecycle of all user stories workflow in engagements - from draft to completion. Guide and advocate for the customers needs throughout the engagement Support internal unit testing of developed solution during the development stage of the engagement, in partnership with Technical Resources Drive customer unit and user-acceptance testing requirements throughout and at key stages of an engagement Be a lead member of an overall engagement project team focused on delivering successful and substantive customer outcomes Prepare all customer-facing deliverables focused on process Juggle multiple and complex projects/initiatives Promote continuous improvement practices for delivery/engagement materials Support specific sales activities when required Provide training and mentoring to other members of the ServiceNow delivery team and partner ecosystem upon request Up to 50% travel annually, driven by customer needs and internal meetings  At least 8+ years of consulting experience for complex, global organizations in the HR, Legal, and/or Workplace/Facility &amp; Finance/Supply Chain operations/technology departments (e.g., HRIS, Legal Operations, Space Management, Finance, Supply Chain, etc.)  Preferably ServiceNow certifications such as a current ServiceNow Certified System Administrator (CSA) certification, and relevant ServiceNow Solution-Specific CertifiedImplementation Specialist/Accreditation designations (i.e., HR Suite Certification, Legal Service Delivery Accreditation, Workplace Service Delivery Accreditation, Certified Application Developer, and/or completion of ServiceNow Supplier Lifecycle Operations (SLP)/Sourcing &amp; Procurement Operations (SPO)/Accounts Payable Operations (APO) Learning Paths) Demonstrated ability to influence and consult (providing options with pros, cons and risks) in HR, Legal, Workplace/Facility Service Delivery and/or Finance/Supply organizations, while providing thought leadership to HR, Legal, Workplace/Facility and/or Finance/Supply Chain sponsors/stakeholders in solving business process and/or technical problems Proven experience in defining and deploying future-state processes and in identifying solutions from a people, process and technology perspective with a focused prowess on implementation of technology Strong understanding with leading HR, Legal, Workplace/Facilities, and/or Finance/Supply Chain and related systems and tools such as Workday, Oracle / PeopleSoft, SAP / SuccessFactors, UltiPro, Infor, SAP ERP, etc. Solid experience in converting business requirements to configuration requirements by authoring user stories that support Agile Development Excellent communication skills (both written and verbal) with strong presentation and facilitation skills (proficiency in Visio, Word and PowerPoint) Experience in providing Knowledge-Centered Service / Support using technologies Experience in analyzing and recommending HR, Legal, Workplace/Facility and/or Finance/Supply Chain strategies based on business priorities Strong interpersonal skills, customer-centric attitude, ability to deal with cultural diversity  Work PersonasWe approach our distributed world of work with flexibility and trust. Work personas (flexible, remote, or required in office) are categories that are assigned to ServiceNow employees depending on the nature of their work and their assigned work location. Learn more here. To determine eligibility for a work persona, ServiceNow may confirm the distance between your primary residence and the closest ServiceNow office using a third-party service.Equal Opportunity EmployerServiceNow is an equal opportunity employer. All qualified applicants will receive consideration for employment without regard to race, color, creed, religion, sex, sexual orientation, national origin or nationality, ancestry, age, disability, gender identity or expression, marital status, veteran status, or any other category protected by law. In addition, all qualified applicants with arrest or conviction records will be considered for employment in accordance with legal requirements. AccommodationsWe strive to create an accessible and inclusive experience for all candidates. If you require a reasonable accommodation to complete any part of the application process, or are unable to use this online application and need an alternative method to apply, please contact globaltalentss@servicenow.com for assistance. Export Control RegulationsFor positions requiring access to controlled technology subject to export control regulations, including the U.S. Export Administration Regulations (EAR), ServiceNow may be required to obtain export control approval from government authorities for certain individuals. All employment is contingent upon ServiceNow obtaining any export license or other approval that may be required by relevant export control authorities. From Fortune. 2025 Fortune Media IP Limited. All rights reserved. Used under license."
3394798,"Sr. Business Process Consultant, ServiceNow HR and Workplace Service Delivery Solutions","https://jobs.smartrecruiters.com/ServiceNow/744000074859365-sr-business-process-consultant-servicenow-hr-and-workplace-service-delivery-solutions","ServiceNow","Atlanta","Yes",8,"Full time","2025-08-07T02:23:45.811207Z","The Role A Business Process Consultant (BPC) for ServiceNow is a functional and process expert in the ServiceNow Expert Services Team on customer engagement teams  consulting with customers and guiding them in the endeavor of transitioning business requirements to configuration requirements of the ServiceNow Core Business Services Products (which includes HR Service Delivery, Legal Service Delivery, Workplace/Facility Service Delivery, Employee Service Management Solutions and Finance &amp; Supply Chain Solutions  all with the goal of accelerating and driving customer business outcomes.What you get to do in this role: Be the process expert for HR, Legal, Workplace/Facility and/or Finance/Supply Chain departments using ServiceNow products and ServiceNow best practices focused on configuration vs. customization, to drive business outcomes Driving HR, Legal, Workplace/Facility and/or Finance/Supply Chain-specific process definition, re-engineering, improvement and gap analysis of current/future-state processes during workshops with key customer sponsors and stakeholders Lead customers in their efforts to take advantage of the ServiceNow Solutions standard capabilities in their efforts to improve their processes Lead customer design workshops focused on ServiceNow Platform and Solution functionality Own support of key customer process owners/Subject Matter Experts (SMEs) to obtain business requirements using ServiceNow standard materials and collateral Guide customers in completing required documentation such as business requirement workbooks for functional aspects of the solution Draft persona-based and functionality-focused user stories, their acceptance criteria, testing strategy and knowledge transfer while supporting customers in reviewing and approving them. The BPC owns the lifecycle of all user stories workflow in engagements - from draft to completion. Guide and advocate for the customers needs throughout the engagement Support internal unit testing of developed solution during the development stage of the engagement, in partnership with Technical Resources Drive customer unit and user-acceptance testing requirements throughout and at key stages of an engagement Be a lead member of an overall engagement project team focused on delivering successful and substantive customer outcomes Prepare all customer-facing deliverables focused on process Juggle multiple and complex projects/initiatives Promote continuous improvement practices for delivery/engagement materials Support specific sales activities when required Provide training and mentoring to other members of the ServiceNow delivery team and partner ecosystem upon request Up to 50% travel annually, driven by customer needs and internal meetings  At least 8+ years of consulting experience for complex, global organizations in the HR, Legal, and/or Workplace/Facility &amp; Finance/Supply Chain operations/technology departments (e.g., HRIS, Legal Operations, Space Management, Finance, Supply Chain, etc.)  Preferably ServiceNow certifications such as a current ServiceNow Certified System Administrator (CSA) certification, and relevant ServiceNow Solution-Specific CertifiedImplementation Specialist/Accreditation designations (i.e., HR Suite Certification, Legal Service Delivery Accreditation, Workplace Service Delivery Accreditation, Certified Application Developer, and/or completion of ServiceNow Supplier Lifecycle Operations (SLP)/Sourcing &amp; Procurement Operations (SPO)/Accounts Payable Operations (APO) Learning Paths) Demonstrated ability to influence and consult (providing options with pros, cons and risks) in HR, Legal, Workplace/Facility Service Delivery and/or Finance/Supply organizations, while providing thought leadership to HR, Legal, Workplace/Facility and/or Finance/Supply Chain sponsors/stakeholders in solving business process and/or technical problems Proven experience in defining and deploying future-state processes and in identifying solutions from a people, process and technology perspective with a focused prowess on implementation of technology Strong understanding with leading HR, Legal, Workplace/Facilities, and/or Finance/Supply Chain and related systems and tools such as Workday, Oracle / PeopleSoft, SAP / SuccessFactors, UltiPro, Infor, SAP ERP, etc. Solid experience in converting business requirements to configuration requirements by authoring user stories that support Agile Development Excellent communication skills (both written and verbal) with strong presentation and facilitation skills (proficiency in Visio, Word and PowerPoint) Experience in providing Knowledge-Centered Service / Support using technologies Experience in analyzing and recommending HR, Legal, Workplace/Facility and/or Finance/Supply Chain strategies based on business priorities Strong interpersonal skills, customer-centric attitude, ability to deal with cultural diversity  Work PersonasWe approach our distributed world of work with flexibility and trust. Work personas (flexible, remote, or required in office) are categories that are assigned to ServiceNow employees depending on the nature of their work and their assigned work location. Learn more here. To determine eligibility for a work persona, ServiceNow may confirm the distance between your primary residence and the closest ServiceNow office using a third-party service.Equal Opportunity EmployerServiceNow is an equal opportunity employer. All qualified applicants will receive consideration for employment without regard to race, color, creed, religion, sex, sexual orientation, national origin or nationality, ancestry, age, disability, gender identity or expression, marital status, veteran status, or any other category protected by law. In addition, all qualified applicants with arrest or conviction records will be considered for employment in accordance with legal requirements. AccommodationsWe strive to create an accessible and inclusive experience for all candidates. If you require a reasonable accommodation to complete any part of the application process, or are unable to use this online application and need an alternative method to apply, please contact globaltalentss@servicenow.com for assistance. Export Control RegulationsFor positions requiring access to controlled technology subject to export control regulations, including the U.S. Export Administration Regulations (EAR), ServiceNow may be required to obtain export control approval from government authorities for certain individuals. All employment is contingent upon ServiceNow obtaining any export license or other approval that may be required by relevant export control authorities. From Fortune. 2025 Fortune Media IP Limited. All rights reserved. Used under license."
