"ID","Title","Link","Company","Location","Remote","Experience","EmploymentType","DatePosted","RoleDescription"
3394812,"Dir, Software Engineering Management","https://jobs.smartrecruiters.com/ServiceNow/744000074832097-dir-software-engineering-management","ServiceNow","Santa Clara","No",15,"Full time","2025-08-07T02:23:45.810773Z","What you get to do in this role:Provide DevOps thought leadership and mentoring in both advisory and delivery contexts, focusing on the requirements of our business and how these are best served by continuous improvements to our delivery approachDefines a portfolio of change and roadmap. Engages and influences IT and business leaders to ensure the portfolio will deliver agreed business objectives.To be successful in this role you have:Experience in leveraging or critically thinking about how to integrate AI into work processes, decision-making, or problem-solving. This may include using AI-powered tools, automating workflows, analyzing AI-driven insights, or exploring AI's potential impact on the function or industry.Are a passionate, hands-on change agent that believes teamwork and communication are critical to high performing team function.Enjoy working with the latest open source and enterprise tools and building automated, integrated systems.Believe cultural and behavior changes and uplift are critical for improving teams of all sizes. Believe in continuous improvement through small, rapid, iterative change.Are in constant quest of learning and apply that to tools, technologies and processes.Are a smart, enthusiastic, creative leader who can look beyond today's problems to find tomorrow's solutions.Describe in detail, a recent DevOps transformation you have ledProvide detailed meaningful success metrics for a DevOps practice that you have leadDescribe your interaction and engagement with senior level executives in building and operationalizing a DevOps practiceAble to communicate a compelling vision and need for change that generates excitement, enthusiasm, and commitment to the processInteracts with others, internally and externally, in a way that gives them confidence in their intentions and those of the organizationUnderstands the business case for each deliverable undertaken and works with service owner and product owner to help ensure benefits are realizedIs proficient in planning, communication and presentation skills, and the capability to listen and influence.Excellent interpersonal skills, proven track record of building strong relationships and establishing credibility at all levels of the organizationCan do attitude and sense of ownership to thrive in a fast-paced environmentStrong knowledge of DevOps design patterns, processes and best practicesExperience in performing organizational DevSecOps enablement and transformation15+ years overall experience covering Application development, Architecture, Quality Assurance and Production support5+ years industry experience in DevOps architecture related to Continuous Integration/Continuous Delivery solutions &amp; Infrastructure Automation.Minimum of 5 years of technology consulting experience, Leading DevOps Architectural Designs5+ years of software delivery leadership in an Agile &amp; DevOps practice, with roles of increasing responsibility, and shown experience developing and leading enterprise initiatives.Good understanding of Microservices and Containerization, Docker Components and Orchestration using Swarm/Kubernetes.Minimum 5 yrs of experience handling Application Build, Configuration Management, Deployment &amp; Release Engineering.Architected solution and deep expertise on Cloud (Azure, AWS, GCP), setting up CI/CD for PaaS (Cloud Foundry, OpenShift) is a big plusExperience in leading the creation, oversight and ongoing operationalization of shared service environments. This includes extensive experience in advanced/sophisticated IT end to end life cycle management, leading application development and/or application management team(s).Deep knowledge of Infrastructure provisioning using Taraform, Ansible. Implementation experience in automation of environment provisioningA track record of increased responsibility (promotions) based on performance.Successfully led teams through major project engagements that involves Agile and DevOps transformationsProven leadership experience - leading, not just managing.Proven track history of taking complex delivery problems and creating leaner, more collaborative solutionsDemonstrates clarity of thought and expression to win confidence from clients and partners.Has the intellectual capacity to understand and explain complex technical concepts to both technical and non-technical audiences.Strong background in DevSecOps tools and pipelines for different technology eco systems such as Java, .NET, COTS productsExperienced level understanding of build and deployment systems, system configuration, job configuration and debugging.Experience setting up complete end-to-end fully integrated delivery systems (source control management, build tools, artifact repositories, deployment and monitoring systems).Experience with automation/configurationWorking understanding of code and script (PHP, Python, Groovy, Perl and/or Ruby) particularly used within build pipeline automation.Knowledge of standard methodologies and IT operations in an always-up, always-available service. Strong grasp of various automation tools.A strong focus on business outcomes. JV20   For positions in this location, we offer a base pay of $217,500 - $380,700, plus equity (when applicable), variable/incentive compensation and benefits. Sales positions generally offer a competitive On Target Earnings (OTE) incentive compensation structure. Please note that the base pay shown is a guideline, and individual total compensation will vary based on factors such as qualifications, skill level, competencies, and work location. We also offer health plans, including flexible spending accounts, a 401(k) Plan with company match, ESPP, matching donations, a flexible time away plan and family leave programs. Compensation is based on the geographic location in which the role is located and is subject to change based on work location.Work PersonasWe approach our distributed world of work with flexibility and trust. Work personas (flexible, remote, or required in office) are categories that are assigned to ServiceNow employees depending on the nature of their work and their assigned work location. Learn more here. To determine eligibility for a work persona, ServiceNow may confirm the distance between your primary residence and the closest ServiceNow office using a third-party service.Equal Opportunity EmployerServiceNow is an equal opportunity employer. All qualified applicants will receive consideration for employment without regard to race, color, creed, religion, sex, sexual orientation, national origin or nationality, ancestry, age, disability, gender identity or expression, marital status, veteran status, or any other category protected by law. In addition, all qualified applicants with arrest or conviction records will be considered for employment in accordance with legal requirements. AccommodationsWe strive to create an accessible and inclusive experience for all candidates. If you require a reasonable accommodation to complete any part of the application process, or are unable to use this online application and need an alternative method to apply, please contact globaltalentss@servicenow.com for assistance. Export Control RegulationsFor positions requiring access to controlled technology subject to export control regulations, including the U.S. Export Administration Regulations (EAR), ServiceNow may be required to obtain export control approval from government authorities for certain individuals. All employment is contingent upon ServiceNow obtaining any export license or other approval that may be required by relevant export control authorities. From Fortune. 2025 Fortune Media IP Limited. All rights reserved. Used under license."
3394811,"Manager, Software Engineering Management","https://jobs.smartrecruiters.com/ServiceNow/744000074833396-manager-software-engineering-management","ServiceNow","Pleasanton","No",6,"Full time","2025-08-07T02:23:45.810803Z","What you get to do in this role:   Manage product development activitiesWork with product management, design, support and other dev teams to create high-quality solutionsManage daily activities of the development teamSolve difficult and sometimes ambiguous problemsManage departmental resources, staffing, mentoring, and enhancing and maintaining a best-of-class engineering teamTo be successful in this role you have:Experience in leveraging or critically thinking about how to integrate AI into work processes, decision-making, or problem-solving. This may include using AI-powered tools, automating workflows, analyzing AI-driven insights, or exploring AI's potential impact on the function or industry.6+ years of experience with technologies relevant to SN and advanced coding skillsExperience with open source tools and agile development environmentsFluency in one or more relevant programming language (Java, C++, Ruby. Shell, JavaScript)An understanding of broad concepts and experience using those concepts to understand and develop solutions for problemsAbility to execute a project based on our priorities, context, risks and desired outcomesFD21  For positions in this location, we offer a base pay of $163,600 - $286,300, plus equity (when applicable), variable/incentive compensation and benefits. Sales positions generally offer a competitive On Target Earnings (OTE) incentive compensation structure. Please note that the base pay shown is a guideline, and individual total compensation will vary based on factors such as qualifications, skill level, competencies, and work location. We also offer health plans, including flexible spending accounts, a 401(k) Plan with company match, ESPP, matching donations, a flexible time away plan and family leave programs. Compensation is based on the geographic location in which the role is located and is subject to change based on work location.Work PersonasWe approach our distributed world of work with flexibility and trust. Work personas (flexible, remote, or required in office) are categories that are assigned to ServiceNow employees depending on the nature of their work and their assigned work location. Learn more here. To determine eligibility for a work persona, ServiceNow may confirm the distance between your primary residence and the closest ServiceNow office using a third-party service.Equal Opportunity EmployerServiceNow is an equal opportunity employer. All qualified applicants will receive consideration for employment without regard to race, color, creed, religion, sex, sexual orientation, national origin or nationality, ancestry, age, disability, gender identity or expression, marital status, veteran status, or any other category protected by law. In addition, all qualified applicants with arrest or conviction records will be considered for employment in accordance with legal requirements. AccommodationsWe strive to create an accessible and inclusive experience for all candidates. If you require a reasonable accommodation to complete any part of the application process, or are unable to use this online application and need an alternative method to apply, please contact globaltalentss@servicenow.com for assistance. Export Control RegulationsFor positions requiring access to controlled technology subject to export control regulations, including the U.S. Export Administration Regulations (EAR), ServiceNow may be required to obtain export control approval from government authorities for certain individuals. All employment is contingent upon ServiceNow obtaining any export license or other approval that may be required by relevant export control authorities. From Fortune. 2025 Fortune Media IP Limited. All rights reserved. Used under license."
3394810,"Customer Success Manager","https://jobs.smartrecruiters.com/ServiceNow/744000074836225-customer-success-manager","ServiceNow","Santa Clara","Yes",3,"Full time","2025-08-07T02:23:45.810834Z","What you get to do in this role:The role of the Customer Success Manager is to act as an advocate for our customers. You will oversee a portfolio of customers to help them achieve business outcomes and foster greater adoption and usage of the ServiceNow products they have purchased through prescriptive guidance. You will bring ServiceNow's best practices, innovations, and capabilities to help customers achieve their goals.Oversee the customer outcomes engagement for customers in your portfolio, understanding each customer's needs and challengesEnsure customers are technically healthy and on the most recent version of our productIdentify criteria for assisting your customers by using Success Plays in the Success PlatformPromote ServiceNow customer success stories and processesEnsure that customers obtain the maximum value from their ServiceNow investment and use their licensesWork with ServiceNow teams to improve product adoption and increased footprintEnsure any escalated client issues are resolved quickly, using resources from across the company ecosystemTo be successful in this role you have:Experience in leveraging or critically thinking about how to integrate AI into work processes, decision-making, or problem-solving. This may include using AI-powered tools, automating workflows, analyzing AI-driven insights, or exploring AI's potential impact on the function or industry.3+ years of experience providing customer professional services or related business supportStrategic tech industry experienceAbility to provide independent comprehensive servicesExperience resolving issues through analysisExperience in working collaborativelyServiceNow accreditations or certifications a plusFD21  For positions in this location, we offer a base pay of $88,000 - $125,000, plus equity (when applicable), variable/incentive compensation and benefits. Sales positions generally offer a competitive On Target Earnings (OTE) incentive compensation structure. Please note that the base pay shown is a guideline, and individual total compensation will vary based on factors such as qualifications, skill level, competencies, and work location. We also offer health plans, including flexible spending accounts, a 401(k) Plan with company match, ESPP, matching donations, a flexible time away plan and family leave programs. Compensation is based on the geographic location in which the role is located and is subject to change based on work location.Work PersonasWe approach our distributed world of work with flexibility and trust. Work personas (flexible, remote, or required in office) are categories that are assigned to ServiceNow employees depending on the nature of their work and their assigned work location. Learn more here. To determine eligibility for a work persona, ServiceNow may confirm the distance between your primary residence and the closest ServiceNow office using a third-party service.Equal Opportunity EmployerServiceNow is an equal opportunity employer. All qualified applicants will receive consideration for employment without regard to race, color, creed, religion, sex, sexual orientation, national origin or nationality, ancestry, age, disability, gender identity or expression, marital status, veteran status, or any other category protected by law. In addition, all qualified applicants with arrest or conviction records will be considered for employment in accordance with legal requirements. AccommodationsWe strive to create an accessible and inclusive experience for all candidates. If you require a reasonable accommodation to complete any part of the application process, or are unable to use this online application and need an alternative method to apply, please contact globaltalentss@servicenow.com for assistance. Export Control RegulationsFor positions requiring access to controlled technology subject to export control regulations, including the U.S. Export Administration Regulations (EAR), ServiceNow may be required to obtain export control approval from government authorities for certain individuals. All employment is contingent upon ServiceNow obtaining any export license or other approval that may be required by relevant export control authorities. From Fortune. 2025 Fortune Media IP Limited. All rights reserved. Used under license."
3394809,"Sr Customer Success Manager","https://jobs.smartrecruiters.com/ServiceNow/744000074841549-sr-customer-success-manager","ServiceNow","Santa Clara","Yes",5,"Full time","2025-08-07T02:23:45.810860Z","What you get to do in this role:The role of the Customer Success Manager is to act as an advocate for our customers. You will oversee a portfolio of customers to help them achieve business outcomes and foster greater adoption and usage of the ServiceNow products they have purchased through prescriptive guidance. You will bring ServiceNow's best practices, innovations, and capabilities to help customers achieve their goals. Oversee the customer outcomes engagement for customers in your portfolio, understanding each customer's needs and challenges Ensure customers are technically healthy and on the most recent version of our product Identify criteria for assisting your customers by using Success Plays in the Success Platform Promote ServiceNow customer success stories and processes Ensure that customers obtain the maximum value from their ServiceNow investment and use their licenses Work with ServiceNow teams to improve product adoption and increased footprint Ensure any escalated client issues are resolved quickly, using resources from across the company ecosystem Act as a customer advocate within the company, ensuring that customer perspectives and needs are represented in decision-making processes. Build and maintain strong relationships with customers, becoming a trusted advisor and advocate for their needsTo be successful in this role you have: Experience in leveraging or critically thinking about how to integrate AI into work processes, decision-making, or problem-solving. This may include using AI-powered tools, automating workflows, analyzing AI-driven insights, or exploring AI's potential impact on the function or industry. 5+ years of experience providing customer professional services or related business support Ability to provide independent comprehensive services Experience resolving issues through analysis ServiceNow accreditations or certifications a plus Strategic technology industry knowledge Familiarity with digital transformation, or project management, Comfortable with learning and explaining technical products or services. Ability to manage multiple customers and priorities simultaneously. Works well in a collaborative team environment, partnering with sales, product, and support teams. FD21  For positions in this location, we offer a base pay of $100,000-$130,000 plus equity (when applicable), variable/incentive compensation and benefits. Sales positions generally offer a competitive On Target Earnings (OTE) incentive compensation structure. Please note that the base pay shown is a guideline, and individual total compensation will vary based on factors such as qualifications, skill level, competencies, and work location. We also offer health plans, including flexible spending accounts, a 401(k) Plan with company match, ESPP, matching donations, a flexible time away plan and family leave programs.    Compensation is based on the geographic location in which the role is located and is subject to change based on work location. Work PersonasWe approach our distributed world of work with flexibility and trust. Work personas (flexible, remote, or required in office) are categories that are assigned to ServiceNow employees depending on the nature of their work and their assigned work location. Learn more here. To determine eligibility for a work persona, ServiceNow may confirm the distance between your primary residence and the closest ServiceNow office using a third-party service.Equal Opportunity EmployerServiceNow is an equal opportunity employer. All qualified applicants will receive consideration for employment without regard to race, color, creed, religion, sex, sexual orientation, national origin or nationality, ancestry, age, disability, gender identity or expression, marital status, veteran status, or any other category protected by law. In addition, all qualified applicants with arrest or conviction records will be considered for employment in accordance with legal requirements. AccommodationsWe strive to create an accessible and inclusive experience for all candidates. If you require a reasonable accommodation to complete any part of the application process, or are unable to use this online application and need an alternative method to apply, please contact globaltalentss@servicenow.com for assistance. Export Control RegulationsFor positions requiring access to controlled technology subject to export control regulations, including the U.S. Export Administration Regulations (EAR), ServiceNow may be required to obtain export control approval from government authorities for certain individuals. All employment is contingent upon ServiceNow obtaining any export license or other approval that may be required by relevant export control authorities. From Fortune. 2025 Fortune Media IP Limited. All rights reserved. Used under license."
