"ID","Title","Link","Company","Location","Remote","Experience","EmploymentType","DatePosted","RoleDescription"
3511884,"Senior Vehicle Systems Engineer","https://boards.greenhouse.io/relativity/jobs/8143040002?gh_jid=8143040002","Space","Long Beach","No",10,"Full time","2025-09-01T02:11:17.688458Z","At Relativity Space, were building rockets to serve todays needs and tomorrows breakthroughs. Our Terran R vehicle will deliver customer payloads to orbit, meeting the growing demand for launch capacity. But thats just the start. Achieving commercial success with Terran R will unlock new opportunities to advance science, exploration, and innovation, pioneering progress that reaches beyond the known.
Joining Relativity means becoming part of something where autonomy, ownership, and impact exist at every level. Here, you're not just executing tasks; you're solving problems that havent been solved before, helping develop a rocket, a factory, and a business from the ground up. Whether youre in propulsion, manufacturing, software, avionics, or a corporate function, youll collaborate across teams, shape decisions, and see your work come to life in record time. Relativity is a place where creativity and technical rigor go hand in hand, and your voice will help define the stories were writing together. Now is a unique moment in time where its early enough to leave your mark on the product, the process, and the culture, but far enough along that Terran R is tangible and picking up momentum. The most meaningful work of your career is waiting. Join us.About the Team:  
The Systems Engineering team ensures that Terran R comes together as a cohesive, high-performing, and scalable system. Within the department, one team focuses on building tools and processes to manage requirements, track decisions, and identify and mitigate risk - enabling faster, more informed development across the program. Engineers work across domains to understand complex problems, identify solutions, and implement them  all with deep technical knowledge, not just documentation. The other team focuses on the vehicle itself, working across teams to ensure all subsystems of Terran R function together as intended, burning down technical risk, and driving informed decisions at every stage of the vehicle lifecycle. Engineers are empowered to lead high-impact efforts, from major test campaigns to console operations during launch, and are trusted to drive improvements across fluids, structures, avionics, and more. Regardless of which team youre on, youll be part of a high-visibility, high-impact department at a pivotal moment in the program, where decisions made today on trades, architecture, and process will shape not just the first launch, but the long-term trajectory of Relativity.
About the Role: 
As a Senior Systems Engineer, you will collaborate with team members across the organization while contributing to the development of Relativitys engineering processes and tools to enable the design, development, certification, and flight of the Terran R launch system.
Projects and responsibilities include the following:

Develop the Systems Engineering tools and methodology roadmap, helping align the needs of various disciplines and the overall project from development to launch
Build, continuously improve, or eliminate engineering processes to support an efficient, product-focused culture
Prototype, implement, and rollout processes, tools, and automation that enable better design and test collaboration across the company
Manage the vehicle design and development processes from beginning to end, ranging from working with department leaders on setting expectations, making progress visible, and ensuring the processes are effective
Provide engineering expertise to solve technical problems at all levels.

As a Senior level Systems Engineer, you will work collaboratively within the Systems Engineering team to achieve the above responsibilities, while working autonomously on certain aspects of them.
To be successful in this role, you should be self-motivated, adaptable, and able to contribute significantly to a fast-paced integrated vehicle program. You should also be able to resolve ambiguity and drive projects to completion. Ideally, you have experience in: Systems Engineering, Verification and Validation (V&amp;V), and Requirement Management experience, Vehicle Configuration Management, Launch Vehicle certification as well as a proven track record completing projects successfully in a highly collaborative environment.
On a weekly basis, you will be developing processes and tools, supporting design teams, and working collaboratively with IT and DevOps. You will also use your strong organizational skills to properly manage the documentation and communication of your actions, recommendations, and decisions.
About You: 

Senior: An undergraduate degree in engineering or related field 
5+ years relevant experience
Experience performing cross-functional engineering and integration for complex systems
Experience solving difficult problems with multiple stakeholders in a fast-paced environment
Proven track record of contributing to project completion
Experience workflows and automation within Jira or equivalent 
Experience writing automation scripts in Python or other languages
Experience applying expertise in modern systems engineering practices and tools
Experience applying written and oral communication skills

Nice to haves, but not required: 

Graduate degree (MS/PhD) in engineering or related field and 10+ years of experience
Hands-on experience in the design, integration, test, and operation of complex systems
History of taking complex products from concept to production
Strong desire to learn new subjects to solve difficult and often ambiguous challenges
Experience with Model Based Systems Engineering (MB

 At Relativity Space, we are committed to transparency and fairness in our compensation practices. Actual compensation will be determined based on experience, qualifications, and other job-related factors.Compensation is only one part of our total rewards package. Relativity Space offers competitive salary and equity, a generous PTO and sick leave policy, parental leave, an annual learning and development stipend, and more! To see some of the benefits &amp; perks we offer, please visit here.Hiring Range:$142,000$181,500 USDWe are an equal opportunity employer and value diversity at our company. We do not discriminate on the basis of race, religion, color, national origin, gender, sexual orientation, age, marital status, veteran status, or disability status."
3511883,"Senior Stage Development Engineer","https://boards.greenhouse.io/relativity/jobs/8143706002?gh_jid=8143706002","Space","Long Beach","No",10,"Full time","2025-09-01T02:11:17.688489Z","At Relativity Space, were building rockets to serve todays needs and tomorrows breakthroughs. Our Terran R vehicle will deliver customer payloads to orbit, meeting the growing demand for launch capacity. But thats just the start. Achieving commercial success with Terran R will unlock new opportunities to advance science, exploration, and innovation, pioneering progress that reaches beyond the known.
Joining Relativity means becoming part of something where autonomy, ownership, and impact exist at every level. Here, you're not just executing tasks; you're solving problems that havent been solved before, helping develop a rocket, a factory, and a business from the ground up. Whether youre in propulsion, manufacturing, software, avionics, or a corporate function, youll collaborate across teams, shape decisions, and see your work come to life in record time. Relativity is a place where creativity and technical rigor go hand in hand, and your voice will help define the stories were writing together. Now is a unique moment in time where its early enough to leave your mark on the product, the process, and the culture, but far enough along that Terran R is tangible and picking up momentum. The most meaningful work of your career is waiting. Join us.About the Team:  
The Systems Engineering team ensures that Terran R comes together as a cohesive, high-performing, and scalable system. Within the department, one team focuses on building tools and processes to manage requirements, track decisions, and identify and mitigate risk - enabling faster, more informed development across the program. Engineers work across domains to understand complex problems, identify solutions, and implement them  all with deep technical knowledge, not just documentation. The other team focuses on the vehicle itself, working across teams to ensure all subsystems of Terran R function together as intended, burning down technical risk, and driving informed decisions at every stage of the vehicle lifecycle. Engineers are empowered to lead high-impact efforts, from major test campaigns to console operations during launch, and are trusted to drive improvements across fluids, structures, avionics, and more. Regardless of which team youre on, youll be part of a high-visibility, high-impact department at a pivotal moment in the program, where decisions made today on trades, architecture, and process will shape not just the first launch, but the long-term trajectory of Relativity.
About the Role: 
As a Senior Systems Engineer, you will collaborate with team members across the organization while contributing to the development of Relativitys engineering processes and tools to enable the design, development, certification, and flight of the Terran R launch system.
Projects and responsibilities include the following:

Develop the Systems Engineering tools and methodology roadmap, helping align the needs of various disciplines and the overall project from development to launch
Build, continuously improve, or eliminate engineering processes to support an efficient, product-focused culture
Prototype, implement, and rollout processes, tools, and automation that enable better design and test collaboration across the company
Manage the vehicle design and development processes from beginning to end, ranging from working with department leaders on setting expectations, making progress visible, and ensuring the processes are effective
Provide engineering expertise to solve technical problems at all levels.

As a Senior level Systems Engineer, you will work collaboratively within the Systems Engineering team to achieve the above responsibilities, while working autonomously on certain aspects of them.
To be successful in this role, you should be self-motivated, adaptable, and able to contribute significantly to a fast-paced integrated vehicle program. You should also be able to resolve ambiguity and drive projects to completion. Ideally, you have experience in: Systems Engineering, Verification and Validation (V&amp;V), and Requirement Management experience, Vehicle Configuration Management, Launch Vehicle certification as well as a proven track record completing projects successfully in a highly collaborative environment.
On a weekly basis, you will be developing processes and tools, supporting design teams, and working collaboratively with IT and DevOps. You will also use your strong organizational skills to properly manage the documentation and communication of your actions, recommendations, and decisions.
About You: 

Senior: An undergraduate degree in engineering or related field 
5+ years relevant experience
Experience performing cross-functional engineering and integration for complex systems
Experience solving difficult problems with multiple stakeholders in a fast-paced environment
Proven track record of contributing to project completion
Experience workflows and automation within Jira or equivalent 
Experience writing automation scripts in Python or other languages
Experience applying expertise in modern systems engineering practices and tools
Experience applying written and oral communication skills

Nice to haves, but not required: 

Graduate degree (MS/PhD) in engineering or related field and 10+ years of experience
Hands-on experience in the design, integration, test, and operation of complex systems
History of taking complex products from concept to production
Strong desire to learn new subjects to solve difficult and often ambiguous challenges
Experience with Model Based Systems Engineering (MB

 At Relativity Space, we are committed to transparency and fairness in our compensation practices. Actual compensation will be determined based on experience, qualifications, and other job-related factors.Compensation is only one part of our total rewards package. Relativity Space offers competitive salary and equity, a generous PTO and sick leave policy, parental leave, an annual learning and development stipend, and more! To see some of the benefits &amp; perks we offer, please visit here.Hiring Range:$142,000$181,500 USDWe are an equal opportunity employer and value diversity at our company. We do not discriminate on the basis of race, religion, color, national origin, gender, sexual orientation, age, marital status, veteran status, or disability status."
3511882,"Principal, People Business Partner, Federal","https://boards.greenhouse.io/relativity/jobs/8139373002?gh_jid=8139373002","Space","Long Beach","No",10,"Full time","2025-09-01T02:11:17.688506Z","At Relativity Space, were building rockets to serve todays needs and tomorrows breakthroughs. Our Terran R vehicle will deliver customer payloads to orbit, meeting the growing demand for launch capacity. But thats just the start. Achieving commercial success with Terran R will unlock new opportunities to advance science, exploration, and innovation, pioneering progress that reaches beyond the known.
Joining Relativity means becoming part of something where autonomy, ownership, and impact exist at every level. Here, you're not just executing tasks; you're solving problems that havent been solved before, helping develop a rocket, a factory, and a business from the ground up. Whether youre in propulsion, manufacturing, software, avionics, or a corporate function, youll collaborate across teams, shape decisions, and see your work come to life in record time. Relativity is a place where creativity and technical rigor go hand in hand, and your voice will help define the stories were writing together. Now is a unique moment in time where its early enough to leave your mark on the product, the process, and the culture, but far enough along that Terran R is tangible and picking up momentum. The most meaningful work of your career is waiting. Join us.About the Team: 
The People team is a core enabler of the business, with a true seat at the table and broad visibility across the company. From compensation and benefits to performance and onboarding, the team takes a comprehensive approach to supporting employees and leaders alike. We embed ourselves into departments, understanding needs and shaping the foundational strategies that will help individuals thrive as the company scales. Every challenge is an opportunity to solve for what really matters, with agility, empathy, and creativity.
About the Role:

Serve as the sole People partner to Relativity Federal, advising on org design, talent strategy, and team effectiveness. 
Drive key strategic initiatives including succession planning, performance management, and org health in a fast-scaling environment. 
Identify and proactively address challenges tied to hypergrowthretention, role clarity, leadership depth, and workforce stability. 
Partner on sensitive employee relations cases, including written warnings, PIPs, and leadership coaching. 
Collaborate cross-functionally with Legal, Total Rewards, and Employee Experience to ensure cohesive, compliant People support.

About You:

10+ years of progressive HR/People experience, including direct support to senior leaders and prior team management.
Proven experience in high-complexity environments (e.g., manufacturing, aerospace, supply chain, or engineering-heavy orgs).
Strong command of core People disciplines: employee relations, performance management, coaching, and organizational design.
Ability to operate strategically while supporting tactical execution when needed.
Exceptional judgment, discretion, and communication skillsespecially under pressure.
Familiarity with California labor law, shift-based scheduling, or hourly workforce dynamics.

Nice to haves but not required:  

Proficiency in Workday and Zensai.
Familiarity with Research &amp; Development endeavors. 
At Relativity Space, we are committed to transparency and fairness in our compensation practices. Actual compensation will be determined based on experience, qualifications, and other job-related factors.Compensation is only one part of our total rewards package. Relativity Space offers competitive salary and equity, a generous PTO and sick leave policy, parental leave, an annual learning and development stipend, and more! To see some of the benefits &amp; perks we offer, please visit here.Hiring Range:$187,000$247,000 USDWe are an equal opportunity employer and value diversity at our company. We do not discriminate on the basis of race, religion, color, national origin, gender, sexual orientation, age, marital status, veteran status, or disability status."
3511881,"PBF Technical Specialist I, Second Shift","https://boards.greenhouse.io/relativity/jobs/8141920002?gh_jid=8141920002","Space","Long Beach","No",3,"Full time","2025-09-01T02:11:17.688523Z","At Relativity Space, were building rockets to serve todays needs and tomorrows breakthroughs. Our Terran R vehicle will deliver customer payloads to orbit, meeting the growing demand for launch capacity. But thats just the start. Achieving commercial success with Terran R will unlock new opportunities to advance science, exploration, and innovation, pioneering progress that reaches beyond the known.
Joining Relativity means becoming part of something where autonomy, ownership, and impact exist at every level. Here, you're not just executing tasks; you're solving problems that havent been solved before, helping develop a rocket, a factory, and a business from the ground up. Whether youre in propulsion, manufacturing, software, avionics, or a corporate function, youll collaborate across teams, shape decisions, and see your work come to life in record time. Relativity is a place where creativity and technical rigor go hand in hand, and your voice will help define the stories were writing together. Now is a unique moment in time where its early enough to leave your mark on the product, the process, and the culture, but far enough along that Terran R is tangible and picking up momentum. The most meaningful work of your career is waiting. Join us.About the Team: 
The Powder Bed Fusion manufacturing team develops, creates, and operates the most advanced additive manufacturing technologies in the world. This best-in-class team makes sure that the infrastructure, materials, tools, and equipment are in place for us to rapidly iterate and print. The Powder-Based manufacturing team was crucial to manufacturing Aeon-1 for first launch and now are developing and demonstrating groundbreaking technologies, design, and approaches for Aeon-R!
About the Role:
This is a 2nd shift position with a standard schedule of 3:00 PM  1:30 AM PT, Monday through Friday. The role includes a 10% shift differential added to the base pay. Please note that this position is structured around a baseline expectation of a 50-hour workweek, which may include occasional overtime as needed to meet operational goals.

Perform routine periodic maintenance (PM) and troubleshooting of PBF Printers to ensure efficient operation and optimized output.
Perform laser optics inspection and calibrations to maintain optimal laser output.   
Maintain inventory of critical spares, consumables, and tools necessary to maintain printers and equipment. With the guidance of engineering and technical specialist team perform hardware repair and testing protocols to identify and resolve potential issues that may impact production. Such as testing and validating Sensors, Valves, Actuators, and Motors.
Assist engineers and technical specialist team in developing and documenting standard operating procedures (SOPs) related to printer maintenance and troubleshooting.
Provide onsite technical support and training to production team of changes to printer operations and daily maintenance 

About You:

3+ years of relevant experience working with PBF printers or similar additive manufacturing technologies.
1+ years of maintenance and troubleshooting experience with PBF Printers or similar advanced technologies.  
Relevant maintenance or machine operations certificates from OEMs or accredited institutions such as EOS Self-Care, EOS Advanced Troubleshooting, Certified Maintenance &amp; Reliability Technician, or equivalent. 
Proficient with Laser Optic testing and inspections methods such as Laser Power, Laser Focus, and Scanner Accuracy.
Strong mechanical aptitude, attention to detail, and communication skills.
Strong experience with hand tools, power tools, pneumatic tools, and a solid understanding of materials and processes as they relate to maintenance and repairs. 

Nice to haves but not required:  

Experience with other types of PBF printer OEMs such as Velo3D, Additive Industries, GE, Concept, or 3D Systems.
Familiarity with diagnostic software such as EOS Service
Familiarity with CAD or programming software.
Experience with Tooling Fabrication  

Highlighted Benefits:

100% health care coverage on your first day
Quarterly wellness stipend to use on health and wellness
Partnership with Modern Health with access to 8 therapy &amp; coaching sessions and mental health resources
Discounts on gym memberships, travel and entertainment through PerkSpot
Unlimited onsite snacks
Free lunch on Mondays and Fridays
Annual learning and development stipend
PPE Stipend
Pet Insurance through Fetch
Company Paid Life Insurance, Short Term Disability, and Long Term Disability
Up to 12 weeks salary continuation for paid pregnancy disability leave
8 Weeks company paid parental leave
Access to One Medical
At Relativity Space, we are committed to transparency and fairness in our compensation practices. Actual compensation will be determined based on experience, qualifications, and other job-related factors.Compensation is only one part of our total rewards package. Relativity Space offers competitive salary and equity, a generous PTO and sick leave policy, parental leave, an annual learning and development stipend, and more! To see some of the benefits &amp; perks we offer, please visit here.Hiring Range:$33.97$43.45 USDWe are an equal opportunity employer and value diversity at our company. We do not discriminate on the basis of race, religion, color, national origin, gender, sexual orientation, age, marital status, veteran status, or disability status."
