"ID","Title","Link","Company","Location","Remote","Experience","EmploymentType","DatePosted","RoleDescription"
1198400,"Welder (Starship)","https://boards.greenhouse.io/spacex/jobs/7521869002?gh_jid=7521869002","SpaceX","Starbase, TX","No",10,"Full time","2025-05-09T01:59:55.951042Z","SpaceX was founded under the belief that a future where humanity is out exploring the stars is fundamentally more exciting than one where we are not. Today SpaceX is actively developing the technologies to make this possible, with the ultimate goal of enabling human life on Mars.WELDER (STARSHIP)
Tank fabricators will work to build the primary airframe of the Starship and Super Heavy vehicles at the SpaceX South Texas build site. The tank fabricator will work with an elite team of other fabricators and technicians to rapidly build the tank (cylindrical structure), tank bulkheads, and other large associated structures for the flight article design of both vehicles.
RESPONSIBILITIES: 

GTAW class A welds; cut, trim, fit and fabricate metal components to dimensions for building and assembling
Collaborate with lead welder to ensure that the proper weld procedure, type of material and rod size are accurately assessed for each welding project
Analyze engineering drawings and specifications to plan welding operations where procedural information is unavailable
Make a continuous effort to improve operations, decrease turnaround times, streamline work processes, and work cooperatively and jointly
Perform other related duties, as assigned, for the purpose of ensuring an efficient and effective work environment
Weld assembly and fabrication of various small to large scale structures and assemblies
Effectively communicate with management/supervisors, engineering staff and planners to achieve build efficiency
Modify repair, assemble, and install launch vehicles
Check work after completion of each operation in job and/or completed job to ensure it is complete per drawing
Handle and dispose of hazardous materials in approved manner
Install and assemble custom and off-the-shelf tooling and machinery for building primary tank structure
Setup of safety equipment and work platforms at elevation
Operate general shop equipment and vehicles (forklifts, boom lifts, scissor lifts, etc.)

BASIC QUALIFICATIONS:

High school diploma or equivalency certificate
1+ years of experience with TIG welding in a manufacturing environment or certificate of completion for welding from an accredited program within the last 2 years

PREFERRED SKILLS AND EXPERIENCE:

10+ years of experience in TIG welding with one or more of the following materials: stainless steel, carbon steel, Inconel, aluminum and titanium
Highly proficient in tube cutting, grinding and fabrication
Highly experience in class A welds
Certifications with AWS D17.1 and D1.2
Knowledge in DC welding techniques, and engineering requirements
Knowledge in standard tools, materials, motions, and practices of the welding trade
Knowledge in occupational hazards and effective safety precautions of the trade
Knowledge in arc air procedures and equipment
Experience in overhead cranes and forklifts
Use of precision measuring instruments
Ability to rapidly change roles/responsibilities while working in a high-paced, challenging work environment

ADDITIONAL REQUIREMENTS:

Role requires passing a weld test per AWS D17.1
Ability to stand for extended periods  8 hours minimum
Ability to lift heavy objects (up to 25 lbs) unassisted
Ability to perform job duties that require standing, kneeling, crouching, twisting upper body, working in cramped positions in small openings and climbing hand over hand
Ability to work at elevated heights (up to 200 feet) and in confined spaces
Typically exposed to work in extreme outdoor environments  heat, cold, rain
Work performed in an environment requiring exposure to fumes, odors, and noise
ITAR REQUIREMENTS:

To conform to U.S. Government export regulations, applicant must be a (i) U.S. citizen or national, (ii) U.S. lawful, permanent resident (aka green card holder), (iii) Refugee under 8 U.S.C.  1157, or (iv) Asylee under 8 U.S.C.  1158, or be eligible to obtain the required authorizations from the U.S. Department of State. Learn more about the ITAR here.  

SpaceX is an Equal Opportunity Employer; employment with SpaceX is governed on the basis of merit, competence and qualifications and will not be influenced in any manner by race, color, religion, gender, national origin/ethnicity, veteran status, disability status, age, sexual orientation, gender identity, marital status, mental or physical disability or any other legally protected status.
Applicants wishing to view a copy of SpaceXs Affirmative Action Plan for veterans and individuals with disabilities, or applicants requiring reasonable accommodation to the application/interview process should reach out to EEOCompliance@spacex.com."
2919752,"Welding Engineer (Starship)","https://boards.greenhouse.io/spacex/jobs/7984360002?gh_jid=7984360002","SpaceX","Starbase, TX","No",1,"Full time","2025-05-09T01:59:55.951130Z","SpaceX was founded under the belief that a future where humanity is out exploring the stars is fundamentally more exciting than one where we are not. Today SpaceX is actively developing the technologies to make this possible, with the ultimate goal of enabling human life on Mars.WELDING ENGINEER (STARSHIP)
This position will support the development of SpaceXs Starship launch vehicles alongside a strong design-and-build engineering group. The welding engineer will help develop, qualify, and optimize welding designs and processes. The engineer will interface daily with design-and-build engineers to make welding improvements and enforce standardized practices and procedures on multiple welded assemblies.
RESPONSIBILITIES:

Develop, optimize, and qualify weld processes and parameters for multiple welding processes, including but not limited to electron beam welding, laser beam welding, gas tungsten arc welding, orbital tube welding, resistance welding, gas metal arc welding, friction stir welding, and plasma arc welding
Support production operations on full-scale welded assemblies, providing direction to manufacturing engineers and welders on correct techniques in a fast-paced manufacturing environment
Support design, manufacturing, and materials engineering with root cause analysis
Work closely with design, tooling, automation, and development engineers to improve welded designs for manufacturing
Set up welding qualification test campaigns and interpret mechanical testing and NDE results
Work closely with NDE personnel to interpret weld quality on development and flight hardware in addition to developing and implementing innovative state-of-the-art NDE techniques
Develop and implement improved process control where possible using test and NDE results as a feedback loop
Set up automated welding solutions in an effort to drive process consistency
Scope out new welding technologies that may be employed to improve rate/quality/efficiency

BASIC QUALIFICATIONS:

Bachelors degree in an engineering discipline
1+ years of experience with hands-on fabrication, manufacturing, or testing experience of welded assemblies

PREFERRED SKILLS AND EXPERIENCE:

Masters degree in welding engineering or related technical program
Hands-on welding experience in stainless steel, nickel-based, titanium, copper, and aluminum alloys
Experience with brazing, joining, and metallographic interpretation
Fundamental understanding of welding processes including, but not limited to, electron beam, laser beam, plasma arc, resistance, friction-stir, gas tungsten arc, and gas metal arc
Robot programming experience for automated welding solutions
Tooling design experience for welded assemblies to reduce part distortion and improve part consistency
Understanding of weld strength testing methodologies, standards, and data acquisition systems used to make informed welding decisions (ASTM E8, E399, E740, ISO 15653, AWS D17.X, AWS C7.X, thermos-couples, strain gages, etc.)
Experience with root cause analysis and corrective actions including, but not limited to, optical and SEM fractography/metallography, hardness, chemical analysis, and mechanical testing
Self-motivated engineer with keen attention to detail

ADDITIONAL REQUIREMENTS:

Position will be based in Starbase, Texas (Brownsville/South Padre Island area) and will require relocation if not already local.
Must be willing to work long hours and weekends as needed to support and maintain build schedules
Ability to perform job duties that require standing, kneeling, crouching, twisting upper body, working in cramped positions in small openings, and climbing hand over hand
Strong ability to multi-task and communicate status and results with a broad spectrum of internal and external departments 

 ITAR REQUIREMENTS:

To conform to U.S. Government export regulations, applicant must be a (i) U.S. citizen or national, (ii) U.S. lawful, permanent resident (aka green card holder), (iii) Refugee under 8 U.S.C.  1157, or (iv) Asylee under 8 U.S.C.  1158, or be eligible to obtain the required authorizations from the U.S. Department of State. Learn more about the ITAR here.  

SpaceX is an Equal Opportunity Employer; employment with SpaceX is governed on the basis of merit, competence and qualifications and will not be influenced in any manner by race, color, religion, gender, national origin/ethnicity, veteran status, disability status, age, sexual orientation, gender identity, marital status, mental or physical disability or any other legally protected status.
Applicants wishing to view a copy of SpaceXs Affirmative Action Plan for veterans and individuals with disabilities, or applicants requiring reasonable accommodation to the application/interview process should reach out to EEOCompliance@spacex.com."
2919751,"Sr. Modem / DSP Communication Systems Engineer (Silicon Engineering)","https://boards.greenhouse.io/spacex/jobs/7987771002?gh_jid=7987771002","SpaceX","Irvine","No",8,"Full time","2025-05-09T01:59:55.951174Z","SpaceX was founded under the belief that a future where humanity is out exploring the stars is fundamentally more exciting than one where we are not. Today SpaceX is actively developing the technologies to make this possible, with the ultimate goal of enabling human life on Mars.SR. MODEM / DSP COMMUNICATION SYSTEMS ENGINEER (SILICON ENGINEERING)
At SpaceX were leveraging our experience in building rockets and spacecraft to deploy Starlink, the worlds most advanced broadband internet system. Starlink is the worlds largest satellite constellation and is providing fast, reliable internet to millions of users worldwide. We design, build, test, and operate all parts of the system  thousands of satellites, consumer receivers that allow users to connect within minutes of unboxing, and the software that brings it all together. Weve only begun to scratch the surface of Starlinks potential global impact are looking for best-in-class engineers to help maximize Starlinks utility for communities and businesses around the globe. 
The Starlink modem team is seeking motivated, proactive, and intellectually curious engineers who can work with world-class cross-disciplinary teams (firmware, architecture, design, validation, product engineering, ASIC implementation). In this role, you will develop system algorithms and silicon solutions for cutting-edge communication systems for deployment in space and ground infrastructures. These systems are enabling connectivity in places it has previously not been available, affordable or reliable. Your efforts will help deliver cutting-edge solutions that will expand the performance and capabilities of the Starlink network.     
RESPONSIBILITIES:  

System-level and link-level design in support of a robust satellite broadband communication system 
Work in close collaboration with ASIC/FPGA, RF/antenna, and software engineers to design and validate silicon-based systems 
Develop floating-point and fixed-point models and run simulations to analyze and validate overall system performance, including modem performance 
Support IC designers with bit-accurate and cycle-accurate vector generation for silicon verification 
Generate spacecraft and consumer equipment system specifications, requirements, and test procedures 
Support silicon bring up and validation by developing and implementing system test plans 

BASIC QUALIFICATIONS:

Bachelors degree in computer science, physics, computer engineering or electrical engineering
5+ years of experience in system-level modeling and/or digital signal processing

PREFERRED SKILLS AND EXPERIENCE:

Advanced degree in electrical engineering with emphasis in communication systems and/or digital signal processing 8+ years of professional experience in system-level modeling
Professional experience in working on aspects of multiple access schemes such as TDMA, CDMA and OFDMA
Professional experience in design and verification of high data rate wireless modems
Expertise in MATLAB, C/C++, and/or Python
Expertise in wireless communication standards, such as 5GNR, LTE, WiFi, Bluetooth, etc
Expertise in designing and implementing system-level procedures and algorithms
Expertise in building and using system-level simulators and performance analysis
Expertise in various multiple access schemes including downlink and uplink scheduler designs and tradeoffs
Understanding of system link budgets and analysis related to communication systems
Understanding of modem designs, link-level algorithms and hardware architectures
Understanding of ASIC and FPGA development concepts, methodologies, and procedures
Experience working in the lab and using lab equipment
Strong interpersonal/written/verbal communication skills and experience with cross-functional collaboration
Strong teamwork skills combined with ability to work autonomously as an individual contributor
High level of self-motivation and desire to be challenged and learn new skills
Strong problem solving skills with high attention to detail
Ability to work in a dynamic, fast-paced environment with changing needs and requirements
Ability to meet tough goals under high pressure and manage time effectively

ADDITIONAL REQUIREMENTS:

Extended hours and weekend work may be required to support critical project and mission milestones

COMPENSATION &amp; BENEFITS:    Pay range:    DSP Systems Engineer/Senior: $160,000.00 - $220,000.00/per year    Your actual level and base salary will be determined on a case-by-case basis and may vary based on the following considerations: job-related knowledge and skills, education, and experience.
Base salary is just one part of your total rewards package at SpaceX. You may also be eligible for long-term incentives, in the form of company stock, stock options, or long-term cash awards, as well as potential discretionary bonuses and the ability to purchase additional stock at a discount through an Employee Stock Purchase Plan. You will also receive access to comprehensive medical, vision, and dental coverage, access to a 401(k) retirement plan, short &amp; long-term disability insurance, life insurance, paid parental leave, and various other discounts and perks. You may also accrue 3 weeks of paid vacation &amp; will be eligible for 10 or more paid holidays per year. Exempt employees are eligible for 5 days of sick leave per year.ITAR REQUIREMENTS:

To conform to U.S. Government export regulations, applicant must be a (i) U.S. citizen or national, (ii) U.S. lawful, permanent resident (aka green card holder), (iii) Refugee under 8 U.S.C.  1157, or (iv) Asylee under 8 U.S.C.  1158, or be eligible to obtain the required authorizations from the U.S. Department of State. Learn more about the ITAR here.  

SpaceX is an Equal Opportunity Employer; employment with SpaceX is governed on the basis of merit, competence and qualifications and will not be influenced in any manner by race, color, religion, gender, national origin/ethnicity, veteran status, disability status, age, sexual orientation, gender identity, marital status, mental or physical disability or any other legally protected status.
Applicants wishing to view a copy of SpaceXs Affirmative Action Plan for veterans and individuals with disabilities, or applicants requiring reasonable accommodation to the application/interview process should reach out to EEOCompliance@spacex.com."
2919750,"Sr. Modem / DSP Communication Systems Engineer (Silicon Engineering)","https://boards.greenhouse.io/spacex/jobs/7987778002?gh_jid=7987778002","SpaceX","Sunnyvale","No",8,"Full time","2025-05-09T01:59:55.951204Z","SpaceX was founded under the belief that a future where humanity is out exploring the stars is fundamentally more exciting than one where we are not. Today SpaceX is actively developing the technologies to make this possible, with the ultimate goal of enabling human life on Mars.SR. MODEM / DSP COMMUNICATION SYSTEMS ENGINEER (SILICON ENGINEERING)
At SpaceX were leveraging our experience in building rockets and spacecraft to deploy Starlink, the worlds most advanced broadband internet system. Starlink is the worlds largest satellite constellation and is providing fast, reliable internet to millions of users worldwide. We design, build, test, and operate all parts of the system  thousands of satellites, consumer receivers that allow users to connect within minutes of unboxing, and the software that brings it all together. Weve only begun to scratch the surface of Starlinks potential global impact are looking for best-in-class engineers to help maximize Starlinks utility for communities and businesses around the globe. 
The Starlink modem team is seeking motivated, proactive, and intellectually curious engineers who can work with world-class cross-disciplinary teams (firmware, architecture, design, validation, product engineering, ASIC implementation). In this role, you will develop system algorithms and silicon solutions for cutting-edge communication systems for deployment in space and ground infrastructures. These systems are enabling connectivity in places it has previously not been available, affordable or reliable. Your efforts will help deliver cutting-edge solutions that will expand the performance and capabilities of the Starlink network.     
RESPONSIBILITIES:  

System-level and link-level design in support of a robust satellite broadband communication system 
Work in close collaboration with ASIC/FPGA, RF/antenna, and software engineers to design and validate silicon-based systems 
Develop floating-point and fixed-point models and run simulations to analyze and validate overall system performance, including modem performance 
Support IC designers with bit-accurate and cycle-accurate vector generation for silicon verification 
Generate spacecraft and consumer equipment system specifications, requirements, and test procedures 
Support silicon bring up and validation by developing and implementing system test plans 

BASIC QUALIFICATIONS:

Bachelors degree in computer science, physics, computer engineering or electrical engineering
5+ years of experience in system-level modeling and/or digital signal processing

PREFERRED SKILLS AND EXPERIENCE:

Advanced degree in electrical engineering with emphasis in communication systems and/or digital signal processing 8+ years of professional experience in system-level modeling
Professional experience in working on aspects of multiple access schemes such as TDMA, CDMA and OFDMA
Professional experience in design and verification of high data rate wireless modems
Expertise in MATLAB, C/C++, and/or Python
Expertise in wireless communication standards, such as 5GNR, LTE, WiFi, Bluetooth, etc
Expertise in designing and implementing system-level procedures and algorithms
Expertise in building and using system-level simulators and performance analysis
Expertise in various multiple access schemes including downlink and uplink scheduler designs and tradeoffs
Understanding of system link budgets and analysis related to communication systems
Understanding of modem designs, link-level algorithms and hardware architectures
Understanding of ASIC and FPGA development concepts, methodologies, and procedures
Experience working in the lab and using lab equipment
Strong interpersonal/written/verbal communication skills and experience with cross-functional collaboration
Strong teamwork skills combined with ability to work autonomously as an individual contributor
High level of self-motivation and desire to be challenged and learn new skills
Strong problem solving skills with high attention to detail
Ability to work in a dynamic, fast-paced environment with changing needs and requirements
Ability to meet tough goals under high pressure and manage time effectively

ADDITIONAL REQUIREMENTS:

Extended hours and weekend work may be required to support critical project and mission milestones

COMPENSATION &amp; BENEFITS:    Pay range:    DSP Systems Engineer/Senior: $170,000.00 - $230,000.00/per year    Your actual level and base salary will be determined on a case-by-case basis and may vary based on the following considerations: job-related knowledge and skills, education, and experience.
Base salary is just one part of your total rewards package at SpaceX. You may also be eligible for long-term incentives, in the form of company stock, stock options, or long-term cash awards, as well as potential discretionary bonuses and the ability to purchase additional stock at a discount through an Employee Stock Purchase Plan. You will also receive access to comprehensive medical, vision, and dental coverage, access to a 401(k) retirement plan, short &amp; long-term disability insurance, life insurance, paid parental leave, and various other discounts and perks. You may also accrue 3 weeks of paid vacation &amp; will be eligible for 10 or more paid holidays per year. Exempt employees are eligible for 5 days of sick leave per year.ITAR REQUIREMENTS:

To conform to U.S. Government export regulations, applicant must be a (i) U.S. citizen or national, (ii) U.S. lawful, permanent resident (aka green card holder), (iii) Refugee under 8 U.S.C.  1157, or (iv) Asylee under 8 U.S.C.  1158, or be eligible to obtain the required authorizations from the U.S. Department of State. Learn more about the ITAR here.  

SpaceX is an Equal Opportunity Employer; employment with SpaceX is governed on the basis of merit, competence and qualifications and will not be influenced in any manner by race, color, religion, gender, national origin/ethnicity, veteran status, disability status, age, sexual orientation, gender identity, marital status, mental or physical disability or any other legally protected status.
Applicants wishing to view a copy of SpaceXs Affirmative Action Plan for veterans and individuals with disabilities, or applicants requiring reasonable accommodation to the application/interview process should reach out to EEOCompliance@spacex.com."
