"ID","Title","Link","Company","Location","Remote","Experience","EmploymentType","DatePosted","RoleDescription"
3521789,"Senior Manager, Internal Communications","https://boards.greenhouse.io/relativity/jobs/8146022002?gh_jid=8146022002","Space","Long Beach","No",6,"Full time","2025-09-01T02:11:17.688166Z","At Relativity Space, were building rockets to serve todays needs and tomorrows breakthroughs. Our Terran R vehicle will deliver customer payloads to orbit, meeting the growing demand for launch capacity. But thats just the start. Achieving commercial success with Terran R will unlock new opportunities to advance science, exploration, and innovation, pioneering progress that reaches beyond the known.
Joining Relativity means becoming part of something where autonomy, ownership, and impact exist at every level. Here, you're not just executing tasks; you're solving problems that havent been solved before, helping develop a rocket, a factory, and a business from the ground up. Whether youre in propulsion, manufacturing, software, avionics, or a corporate function, youll collaborate across teams, shape decisions, and see your work come to life in record time. Relativity is a place where creativity and technical rigor go hand in hand, and your voice will help define the stories were writing together. Now is a unique moment in time where its early enough to leave your mark on the product, the process, and the culture, but far enough along that Terran R is tangible and picking up momentum. The most meaningful work of your career is waiting. Join us.About the Team: 
The Brand &amp; Communications team drives all aspects of brand identity, media relations, digital media, and content strategy, focusing on both external impact and internal alignment. Our mission is to position the company as a trusted industry leader and household name, shaping the narrative around our bold vision and groundbreaking milestones. By crafting compelling stories and innovative campaigns, we energize and inspire stakeholders, fueling momentum that drives Relativitys mission forward.
About the Role:

Develop and execute internal communications strategies that align employees with the companys mission, vision, and goals. 
Translate complex technical and business updates into clear, engaging content for diverse audiences across engineering, manufacturing, and corporate functions. 
Draft and manage executive communications, including All Hands, leadership updates, organizational announcements, and sensitive change messaging. 
Own internal communication channels (Slack/Teams, intranet, newsletters, digital signage, video updates) and maintain an editorial calendar. 
Plan and deliver company-wide events and cultural campaigns that celebrate milestones, amplify values, and foster employee engagement. 
Partner with departments including HR, Operations, and EHS to communicate policies, programs, and compliance/safety requirements with clarity and impact. 
Establish feedback loops, measure effectiveness of communications, and surface employee insights to leadership. 
Support crisis and sensitive communications with transparency, consistency, and empathy.

About You:

Bachelors degree in communications, public relations, marketing, business, or a related field. 
Minimum 6 years of professional experience in internal communications, employee experience, or employer branding. 
Proven experience supporting C-Suite executives and senior leaders through messaging, presentations, or strategic communications. 
Direct experience planning and executing change management communications for organizational or cultural initiatives. 
Demonstrated ability to lead projects end-to-end, including scoping, planning, execution, and measurement of results. 
Track record of proactively identifying problems, proposing solutions, and successfully implementing improvements.  

Nice to haves but not required:  

Experience designing and building intranets or other knowledge management or employee engagement portals  
Experience working with design tools such as Canva or Illustrator  
Experience with multimedia content creation such as video and interactive newsletters  
At Relativity Space, we are committed to transparency and fairness in our compensation practices. Actual compensation will be determined based on experience, qualifications, and other job-related factors.Compensation is only one part of our total rewards package. Relativity Space offers competitive salary and equity, a generous PTO and sick leave policy, parental leave, an annual learning and development stipend, and more! To see some of the benefits &amp; perks we offer, please visit here.Hiring Range:$171,000$189,000 USDWe are an equal opportunity employer and value diversity at our company. We do not discriminate on the basis of race, religion, color, national origin, gender, sexual orientation, age, marital status, veteran status, or disability status."
3519042,"Technical Recruiter","https://boards.greenhouse.io/relativity/jobs/8145077002?gh_jid=8145077002","Space","Long Beach","No",2,"Full time","2025-09-01T02:11:17.688273Z","At Relativity Space, were building rockets to serve todays needs and tomorrows breakthroughs. Our Terran R vehicle will deliver customer payloads to orbit, meeting the growing demand for launch capacity. But thats just the start. Achieving commercial success with Terran R will unlock new opportunities to advance science, exploration, and innovation, pioneering progress that reaches beyond the known.
Joining Relativity means becoming part of something where autonomy, ownership, and impact exist at every level. Here, you're not just executing tasks; you're solving problems that havent been solved before, helping develop a rocket, a factory, and a business from the ground up. Whether youre in propulsion, manufacturing, software, avionics, or a corporate function, youll collaborate across teams, shape decisions, and see your work come to life in record time. Relativity is a place where creativity and technical rigor go hand in hand, and your voice will help define the stories were writing together. Now is a unique moment in time where its early enough to leave your mark on the product, the process, and the culture, but far enough along that Terran R is tangible and picking up momentum. The most meaningful work of your career is waiting. Join us.About the Team: 
The Talent Acquisition does more than just fill roles; we architect how Relativity grows. Youll partner closely with hiring managers, understand the gaps theyre facing, and design hiring strategies around those needs. Youre a trusted partner shaping not only who we hire, but how we hire. From building scalable interview frameworks to creating a candidate experience that reflects our values, the team lays the foundation for the long-term success of Relativity.
About the Role:
Our Talent Acquisition team is looking for a full lifecycle Technical Recruiter who will build collaborative relationships with hiring managers to understand hiring goals and develop recruiting strategies to effectively meet them. We have multiple openings that could be supporting any of the following Long Beach-based teams: Avionics, GNC, Propulsion, and Structural Engineering. You will partner closely with hiring managers, get to know their teams and their projects, and be expected to source, manage, and close high-performing candidates.  

You will become a subject matter expert on hardware technical recruiting and partner closely with senior leadership and hiring managers on defining and identifying what top talent looks like in this field
You will partner with sourcing team and develop creative strategies for engaging passive talent, and you will use your expertise in the industry and data to close
You will act as a trusted advisor to hiring managers and the interview team in the Hardware department
You will develop ideas and strategies to improve the funnel, improve and build equitable interview processes, research and implement new tools, and stay on top of the latest technology trends in the industry as well as competitive market data
You are an advocate for providing an excellent candidate experience as well as a champion for diversity, equity, and inclusion
Onsite requirements: This is an onsite role. You can expect work 5 days a week onsite at our Long Beach Headquarters to support all onsite interviews, occasional onsite team meetings, and hiring manager discussions

About You:

2+ years of full lifecycle technical recruiting experience at fast-scaling companies  
Extensive experience and track record of sourcing passive candidates and filling early to mid career level roles
Demonstrated experience partnering with hiring manager in developing and implementing hiring strategies  
Experience in negotiating offers and creative closing strategies  
Experience improving recruiting processes to drive efficiency and efficacy  

Nice to haves but not required:  

Experience recruiting for hardware and manufacturing teams that have scaled quickly  
Experience recruiting simultaneously for high volume non-exempt and niche exempt positions  
Ability to swiftly context switch between different engineering departments 
At Relativity Space, we are committed to transparency and fairness in our compensation practices. Actual compensation will be determined based on experience, qualifications, and other job-related factors.Compensation is only one part of our total rewards package. Relativity Space offers competitive salary and equity, a generous PTO and sick leave policy, parental leave, an annual learning and development stipend, and more! To see some of the benefits &amp; perks we offer, please visit here.Hiring Range:$111,000$142,000 USDWe are an equal opportunity employer and value diversity at our company. We do not discriminate on the basis of race, religion, color, national origin, gender, sexual orientation, age, marital status, veteran status, or disability status."
3519041,"Staff RF Development Engineer","https://boards.greenhouse.io/relativity/jobs/8116388002?gh_jid=8116388002","Space","Long Beach","No",8,"Full time","2025-09-01T02:11:17.688297Z","At Relativity Space, were building rockets to serve todays needs and tomorrows breakthroughs. Our Terran R vehicle will deliver customer payloads to orbit, meeting the growing demand for launch capacity. But thats just the start. Achieving commercial success with Terran R will unlock new opportunities to advance science, exploration, and innovation, pioneering progress that reaches beyond the known.
Joining Relativity means becoming part of something where autonomy, ownership, and impact exist at every level. Here, you're not just executing tasks; you're solving problems that havent been solved before, helping develop a rocket, a factory, and a business from the ground up. Whether youre in propulsion, manufacturing, software, avionics, or a corporate function, youll collaborate across teams, shape decisions, and see your work come to life in record time. Relativity is a place where creativity and technical rigor go hand in hand, and your voice will help define the stories were writing together. Now is a unique moment in time where its early enough to leave your mark on the product, the process, and the culture, but far enough along that Terran R is tangible and picking up momentum. The most meaningful work of your career is waiting. Join us.About the Team: 
The Avionics team is responsible for the full lifecycle of Terran Rs nervous system, designing, building, testing, installing, and operating the hardware that connects and controls every major electrical system on the vehicle and ground. The teams structure intentionally combines avionics design, manufacturing, and test to enable rapid iteration and feedback loops. Engineers are deeply embedded into other functions within Relativity, working closely with propulsion, GNC, fluids, and stage engineering teams to ensure seamless integration and operation. Now is a unique time to join: youll get to help shape Terran R's fundamental avionics architecture and be given a high degree of ownership on components that will fly.
About the Role: 

Drive the development of the flight and ground RF &amp; Telemetry system for our launch vehicles through all phases of the development process including design, integration, test, and launch
Create link budgets for various vehicle RF systems
Model antenna radiation patterns and simulate vehicle-level antenna performance
Develop the architecture for vehicle ground and vehicle RF systems, including S and L band systems
Select COTS parts or design custom components such as antennas, RF passives, PAs and LNAs, transmitters/receivers, and GSE
Support regulatory and licensing activities with government and regulatory bodies such as the FCC, ITU, and USSF

About You:  

Bachelors degree in Electrical Engineering, Computer Engineering, or a related field
8+ years of experience in RF and telemetry system engineering
Experience with 3 or more of the following:

Antenna design and modeling tools such as Ansys HFSS
Developing link budgets
Design and selection of RF passive components such as couplers and filters
Design and integration of RF systems consisting of radio transmitters and receivers, LNAs, PAs, couplers, filters, etc.
Working with RF test equipment such as spectrum analyzers, SDRs, and data recorders


Experience communicating deeply technical topics with individuals from different disciplines

Nice to haves, but not required:  

Familiarity with telemetry standards standards such as IRIG-106
Experience designing active RF electronics such as PAs, LNAs, and/or radio transceivers
Software engineering fluency and experience with C++, Python, and/or MATLAB
Experience establishing a ground station network for launch vehicles or satellite systems
At Relativity Space, we are committed to transparency and fairness in our compensation practices. Actual compensation will be determined based on experience, qualifications, and other job-related factors.Compensation is only one part of our total rewards package. Relativity Space offers competitive salary and equity, a generous PTO and sick leave policy, parental leave, an annual learning and development stipend, and more! To see some of the benefits &amp; perks we offer, please visit here.Hiring Range:$189,000$241,000 USDWe are an equal opportunity employer and value diversity at our company. We do not discriminate on the basis of race, religion, color, national origin, gender, sexual orientation, age, marital status, veteran status, or disability status."
3519040,"Staff Avionics Systems Integration & Test Engineer","https://boards.greenhouse.io/relativity/jobs/8133376002?gh_jid=8133376002","Space","Long Beach","No",10,"Full time","2025-09-01T02:11:17.688318Z","At Relativity Space, were building rockets to serve todays needs and tomorrows breakthroughs. Our Terran R vehicle will deliver customer payloads to orbit, meeting the growing demand for launch capacity. But thats just the start. Achieving commercial success with Terran R will unlock new opportunities to advance science, exploration, and innovation, pioneering progress that reaches beyond the known.
Joining Relativity means becoming part of something where autonomy, ownership, and impact exist at every level. Here, you're not just executing tasks; you're solving problems that havent been solved before, helping develop a rocket, a factory, and a business from the ground up. Whether youre in propulsion, manufacturing, software, avionics, or a corporate function, youll collaborate across teams, shape decisions, and see your work come to life in record time. Relativity is a place where creativity and technical rigor go hand in hand, and your voice will help define the stories were writing together. Now is a unique moment in time where its early enough to leave your mark on the product, the process, and the culture, but far enough along that Terran R is tangible and picking up momentum. The most meaningful work of your career is waiting. Join us.About the Team: 
The Avionics team is responsible for the full lifecycle of Terran Rs nervous system, designing, building, testing, installing, and operating the hardware that connects and controls every major electrical system on the vehicle and ground. The teams structure intentionally combines avionics design, manufacturing, and test to enable rapid iteration and feedback loops. Engineers are deeply embedded into other functions within Relativity, working closely with propulsion, GNC, fluids, and stage engineering teams to ensure seamless integration and operation. Now is a unique time to join: youll get to help shape Terran R's fundamental avionics architecture and be given a high degree of ownership on components that will fly.
About the Role:
As a Staff Avionics Integration &amp; Test Engineer, you will provide technical leadership across the Avionics and Software teams to drive a cohesive and effective test program for component, system, and vehicle level test:

Manage requirements and derive verification plans at the component and system-level to ensure the team delivers a functional avionics system
Drive the development of common hardware components (simulators, data acquisition systems, etc.) for use in component and system test
Drive the development of common software frameworks (test sequence automation, data review tools, configuration management software, etc.) for use in component, system, and vehicle test
Set technical strategy for development, ATP, and QTP functional, performance, and environmental testing
Help lead vehicle-level integration and test activities including on-console operations, data review, and troubleshooting 
Lead electrical and software system validation efforts leveraging hardware-in-the-loop (HITL) and similar test platforms

About You:

Undergraduate or graduate degree (BS/MS/PhD) in Electrical Engineering, Computer Engineering, Computer Science, Aerospace Engineering, or a related field
10+ years of experience in electrical or aerospace component and/or systems test
Experience applying expertise in environmental test standards such as SMC-S-016, RCC-319, RCC-324, DO-160, or MIL-STD-810
Experience applying expertise in environmental test equipment such as thermal chambers, shaker tables, vacuum chambers, etc.
Demonstrated experience leading system-level design verification of complex electrical systems (e.g. integrated power system testing, communication system testing, etc.) 
Experience with basic software development tools and frameworks such as Python, Git, etc.

Nice to haves but not required:  

Experience with production work order or MES systems
Familiarity with telemetry standards such as IRIG-106 or CCSDS standards
Experience leading vehicle-level test campaigns for rockets, spacecraft, or aircraft
At Relativity Space, we are committed to transparency and fairness in our compensation practices. Actual compensation will be determined based on experience, qualifications, and other job-related factors.Compensation is only one part of our total rewards package. Relativity Space offers competitive salary and equity, a generous PTO and sick leave policy, parental leave, an annual learning and development stipend, and more! To see some of the benefits &amp; perks we offer, please visit here.Hiring Range:$189,000$241,000 USDWe are an equal opportunity employer and value diversity at our company. We do not discriminate on the basis of race, religion, color, national origin, gender, sexual orientation, age, marital status, veteran status, or disability status."
3519039,"Power Systems Engineer I – Test & Launch","https://boards.greenhouse.io/relativity/jobs/8141065002?gh_jid=8141065002","Space","Stennis Space Center, Mississippi","No",1,"Internship","2025-09-01T02:11:17.688338Z","At Relativity Space, were building rockets to serve todays needs and tomorrows breakthroughs. Our Terran R vehicle will deliver customer payloads to orbit, meeting the growing demand for launch capacity. But thats just the start. Achieving commercial success with Terran R will unlock new opportunities to advance science, exploration, and innovation, pioneering progress that reaches beyond the known.
Joining Relativity means becoming part of something where autonomy, ownership, and impact exist at every level. Here, you're not just executing tasks; you're solving problems that havent been solved before, helping develop a rocket, a factory, and a business from the ground up. Whether youre in propulsion, manufacturing, software, avionics, or a corporate function, youll collaborate across teams, shape decisions, and see your work come to life in record time. Relativity is a place where creativity and technical rigor go hand in hand, and your voice will help define the stories were writing together. Now is a unique moment in time where its early enough to leave your mark on the product, the process, and the culture, but far enough along that Terran R is tangible and picking up momentum. The most meaningful work of your career is waiting. Join us.About the Team:
The Stennis Test team designs, builds, and operates Relativitys propulsion and stage test stands. Team members are hands-on with large-scale, complex systems including fully integrated engines and stage assemblies, pushing hardware to the limits and directly contributing to flight readiness. The work is fast-paced and highly operational, ideal for those with backgrounds in aviation, automotive, manufacturing, offshore operations, industrial systems, construction, or adjacent industries. Youll work in a close-knit, dynamic environment where collaboration between technicians, operators, and engineers is not only encouraged, but expected. As the company scales, the Stennis Test team becomes even more critical to unlocking our next phase of growth: proving out full-stage systems and paving the way for routine, reliable flights of Terran R.
 About the Role:

Serve as an Electrical Engineer connecting various internal technical teams to define electrical requirements and develop solutions on a wide variety of projects.
Act as the owners representative to external consultants, contractors, and government agencies.
Manage electrical utility construction activities for test stand facilities, including developing conceptual drawings/designs, requests for proposals, competitive bidding, bid evaluations, subcontractor selection, and subcontractor management for Stennis Space Center sites and other facilities across Relativitys real estate portfolio.
Maintain and troubleshoot the existing electrical distribution system, including developing maintenance and testing procedures for all AC power distribution equipment.
Lead the design of electrical distribution systems for the Terran R and A2 test complexes.
Manage day-to-day construction activities in coordination with the project manager for the Terran R test complex.
Oversee commissioning and maintenance of systems and equipment.
Support and troubleshoot AC power requests for Stennis Space Center facilities.

About You:

Bachelors degree in Electrical Engineering or a related engineering field.
Minimum of 1 year of experience working on electrical power systems.
Familiarity with NFPA 70 (NEC).
Experience in at least one of the following areas: analysis/design, hands-on field work, project management, or project execution.

  Nice to Haves (Not Required):

Experience with the design and operation of aerospace test infrastructure.
Ability to manage multiple projects simultaneously.
Background in construction, commissioning, operations, troubleshooting, or maintenance of low-voltage power systems.
Experience with electrical distribution design, hazard classification, single-line diagrams, breaker coordination, arc flash analysis, bid solicitation, contractor selection, construction management, permitting, and QA/QC.
Engineering Intern (EI) or Professional Engineer (PE) certification in Power.
Proficiency with AutoCAD or Bluebeam.
Experience with electrical power system analysis software (preferably EasyPower).
Familiarity with NFPA 70E or NESC.
Experience purchasing electrical hardware and materials.

 At Relativity Space, we are committed to transparency and fairness in our compensation practices. Actual compensation will be determined based on experience, qualifications, and other job-related factors.Compensation is only one part of our total rewards package. Relativity Space offers competitive salary and equity, a generous PTO and sick leave policy, parental leave, an annual learning and development stipend, and more! To see some of the benefits &amp; perks we offer, please visit here.Hiring Range:$102,000$130,900 USDWe are an equal opportunity employer and value diversity at our company. We do not discriminate on the basis of race, religion, color, national origin, gender, sexual orientation, age, marital status, veteran status, or disability status."
