"ID","Title","Link","Company","Location","Remote","Experience","EmploymentType","DatePosted","RoleDescription"
3482319,"Senior Fabrication and Manufacturing Technician ","https://boards.greenhouse.io/relativity/jobs/8133807002?gh_jid=8133807002","Space","Long Beach","No",5,"Full time","2025-09-01T02:11:17.688961Z","At Relativity Space, were building rockets to serve todays needs and tomorrows breakthroughs. Our Terran R vehicle will deliver customer payloads to orbit, meeting the growing demand for launch capacity. But thats just the start. Achieving commercial success with Terran R will unlock new opportunities to advance science, exploration, and innovation, pioneering progress that reaches beyond the known.
Joining Relativity means becoming part of something where autonomy, ownership, and impact exist at every level. Here, you're not just executing tasks; you're solving problems that havent been solved before, helping develop a rocket, a factory, and a business from the ground up. Whether youre in propulsion, manufacturing, software, avionics, or a corporate function, youll collaborate across teams, shape decisions, and see your work come to life in record time. Relativity is a place where creativity and technical rigor go hand in hand, and your voice will help define the stories were writing together. Now is a unique moment in time where its early enough to leave your mark on the product, the process, and the culture, but far enough along that Terran R is tangible and picking up momentum. The most meaningful work of your career is waiting. Join us.About the Team:  
The Stage Manufacturing team turns design into reality, owning the build of Terran Rs primary structures. This isnt about turning the same bolt every day; its about building the systems to build the rocket. Engineers and technicians work side by side, with deep collaboration and real-time feedback, to shape how we build better and faster. With a manifest and a launch date, its up to the team to deliver on Terran R: solving challenges in real time, optimizing for scale, and constantly improving processes. As the vehicle evolves, so will the factory, with opportunities to apply automation, machine learning, and advanced technologies. What we build here sets the blueprint for the future of scaled launch.
This is a 1st shift position with a standard schedule of 5:00 AM  3:30 PM PT, Monday through Friday. Please note that this position is structured around a baseline expectation of a 50-hour workweek, which may include occasional overtime as needed to meet operational goals.
About the Role:

Expert in conventional machining, independently operating and maintaining lathe and mill machinery to manufacture complex turned components.

Work with aluminum, stainless steel, and Inconel to tolerances of .002"" and surface finishes of 16 Ra or better.
Maintain dimensional accuracy on multi-angled ID and OD profile surfaces while meeting all inspection criteria.
Perform large lathe change-outs, including chuck installations (3-jaw, 4-jaw, custom), and execute offset turning.


Highly skilled in precision measurement, using a wide range of tools with excellent competency.

Calipers, micrometers, bore gauges, and height gauges.
Use multiple devices simultaneously for accurate dimensional verification.
Specialized tools: weld gauges, thickness &amp; radius gauges, surface roughness comparators, adjustable parallels, surface plates, and countersink gauges.


Proficient welder across multiple positions and configurations.

Capable in 1G, 2G, 5G, and 6G welding for tubes and pipes.


Brings a strong sense of ownership, craftsmanship, and pride to the department.

Maintains a clean, organized, and efficient workspace.
Supports a culture of quality, safety, and continuous improvement.


Demonstrated ability to work independently and collaboratively to complete one-off jobs and high-precision components.

Flexible and responsive to shifting priorities with quick turnaround times.


Serves as a Senior Fabrication &amp; Manufacturing Technician with deep technical proficiency in fabrication processes.

Leverages expertise in welding, machining, and precision measurement to drive complex manufacturing operations.



About You:

5+ years of hands-on experience in fabrication or machining environments, with knowledge in both manual (lathe and mill) and CNC operations.
Expertise in setting up and maintaining tooling and fixturing for various machining operations.
Strong understanding of metallurgy, particularly with aluminum, stainless steel, and Inconel.
Proficient in using basic hand and power tools, and capable of performing essential arithmetic.
Experienced in reading and interpreting complex technical drawings and blueprints, with solid troubleshooting, problem solving, and critical-thinking skills.
Knowledgeable in safety standards and procedures; team-oriented with strong communication skills.

Nice to haves but not required:  

NCCCO Certification (National Commission for the Certification of Crane Operators)
Familiarity with industry-standard CAD/CAM software for designing and programming machining operations.

Benefits:

100% health care coverage on your first day
Quarterly wellness stipend to use on health and wellness
Partnership with Modern Health with access to 8 therapy &amp; coaching sessions and mental health resources
Discounts on gym memberships, travel and entertainment through PerkSpot
Unlimited onsite snacks
Free lunch on Mondays and Fridays
Annual learning and development stipend
PPE Stipend
Pet Insurance through Fetch
Company Paid Life Insurance, Short Term Disability, and Long Term Disability
Up to 12 weeks salary continuation for paid pregnancy disability leave
8 Weeks company paid parental leave
Access to One Medical
At Relativity Space, we are committed to transparency and fairness in our compensation practices. Actual compensation will be determined based on experience, qualifications, and other job-related factors.Compensation is only one part of our total rewards package. Relativity Space offers competitive salary and equity, a generous PTO and sick leave policy, parental leave, an annual learning and development stipend, and more! To see some of the benefits &amp; perks we offer, please visit here.Hiring Range:$35.91$47.58 USDWe are an equal opportunity employer and value diversity at our company. We do not discriminate on the basis of race, religion, color, national origin, gender, sexual orientation, age, marital status, veteran status, or disability status."
3482318,"Principal Technical Program Manager, Engineering Programs","https://boards.greenhouse.io/relativity/jobs/8133881002?gh_jid=8133881002","Space","Long Beach","No",5,"Full time","2025-09-01T02:11:17.688979Z","At Relativity Space, were building rockets to serve todays needs and tomorrows breakthroughs. Our Terran R vehicle will deliver customer payloads to orbit, meeting the growing demand for launch capacity. But thats just the start. Achieving commercial success with Terran R will unlock new opportunities to advance science, exploration, and innovation, pioneering progress that reaches beyond the known.
Joining Relativity means becoming part of something where autonomy, ownership, and impact exist at every level. Here, you're not just executing tasks; you're solving problems that havent been solved before, helping develop a rocket, a factory, and a business from the ground up. Whether youre in propulsion, manufacturing, software, avionics, or a corporate function, youll collaborate across teams, shape decisions, and see your work come to life in record time. Relativity is a place where creativity and technical rigor go hand in hand, and your voice will help define the stories were writing together. Now is a unique moment in time where its early enough to leave your mark on the product, the process, and the culture, but far enough along that Terran R is tangible and picking up momentum. The most meaningful work of your career is waiting. Join us.About the Team: 
The Vehicle Engineering organization at Relativity Space encompasses design and hardware build, as well as the analysis, software, CONOPs development, risk management, and customer-facing and regulatory activities needed to be ready for test and launch operations. We are seeking a Principal Technical Program Manager - Engineering Programs to lead and scale our vehicle engineering program management organization. This role will be critical in driving operational excellence across all engineering disciplines, standardizing programmatic best practices, and acting as a senior interface to leadership across Relativity Space. Success in this role will mean delivering Terran R Vehicle Engineering outcomes on time, at the right risk posture. 
About the Role:

Execution Strategy &amp; Risk Management

Own schedule adherence, risk management, and reporting cadence across all Vehicle Engineering departments
Identify, assess, and mitigate risks associated with engineering program execution, ensuring proactive problem resolution to identify risks coming down the pipeline
Present program updates, risks, and strategic recommendations to the executive team


Cross-Functional and Strategic Leadership 

Establish and maintain a culture of excellence in program execution in Vehicle Engineering
Collaborate with PMOs and department leaders across the company to maintain a program level Integrated Master Schedule (IMS), understand true program critical path, escalate issues and decision points, and make recommendations on the best solutions to program issues


Goal Tracking &amp; Reporting

Establish goals and metrics to monitor operational performance and increase the predictability and efficiency of engineering work - building the scoreboard for accountability for the engineering team
Facilitate strong communication within departments and across the program to ensure transparent communication of program status to relevant stakeholders


Team Growth &amp; Development 

Build, lead, mentor, and coach a team of TPMs to drive engineering department success
Establish, standardize, and continuously improve program management methodologies, tools, templates, and best practices across all Vehicle Engineering programs



About You:

Bachelors degree in engineering, science, mathematics, or related fields; aerospace, electrical, or mechanical engineering degree preferred
5+ years technical leadership experience, proven track record of success and strategic thinking while balancing conflicting priorities and goals
5+ years in a Program Management role leading a large cross-functional program, including hardware, software, and operations
Demonstrated success leading large, cross-functional hardware teams from concept through delivery in fast-paced, high-ambiguity environments. Seamlessly able to switch between tactical execution and 30,000-ft perspective
Proven ability to communicate with highly technical teams and helping bridge communication between technical and non-technical teams
A systems mindset: identifying program dependencies, interfaces, risks and the impact of key technical and program decisions on other teams and at company level on hardware product development

Nice to haves but not required:  

Experience with launch vehicles, propulsion systems, or aerospace hardware
Experience building or scaling a PMO or program operations in a high-growth organization
PMP, MBA, Masters in engineering, science, mathematics or related fields, or equivalent experience preferred
Proven ability and high confidence in presenting effectively to C-level executives and board of directors with clarity and strategic insight
At Relativity Space, we are committed to transparency and fairness in our compensation practices. Actual compensation will be determined based on experience, qualifications, and other job-related factors.Compensation is only one part of our total rewards package. Relativity Space offers competitive salary and equity, a generous PTO and sick leave policy, parental leave, an annual learning and development stipend, and more! To see some of the benefits &amp; perks we offer, please visit here.Hiring Range:$196,000$253,000 USDWe are an equal opportunity employer and value diversity at our company. We do not discriminate on the basis of race, religion, color, national origin, gender, sexual orientation, age, marital status, veteran status, or disability status."
3482317,"Lead, Structures Technician","https://boards.greenhouse.io/relativity/jobs/8131622002?gh_jid=8131622002","Space","Long Beach","No","Not specified","Full time","2025-09-01T02:11:17.688996Z","At Relativity Space, were building rockets to serve todays needs and tomorrows breakthroughs. Our Terran R vehicle will deliver customer payloads to orbit, meeting the growing demand for launch capacity. But thats just the start. Achieving commercial success with Terran R will unlock new opportunities to advance science, exploration, and innovation, pioneering progress that reaches beyond the known.
Joining Relativity means becoming part of something where autonomy, ownership, and impact exist at every level. Here, you're not just executing tasks; you're solving problems that havent been solved before, helping develop a rocket, a factory, and a business from the ground up. Whether youre in propulsion, manufacturing, software, avionics, or a corporate function, youll collaborate across teams, shape decisions, and see your work come to life in record time. Relativity is a place where creativity and technical rigor go hand in hand, and your voice will help define the stories were writing together. Now is a unique moment in time where its early enough to leave your mark on the product, the process, and the culture, but far enough along that Terran R is tangible and picking up momentum. The most meaningful work of your career is waiting. Join us.About the Team: 
The Manufacturing team owns all process development, fabrication strategy, and production equipment for Terran R, our next generation, reusable rocket. This team has a wide variety of responsibilities  from factory floor layout, to developing complex tooling for novel processes, and interfacing with our vehicle engineering team to heavily influence design of the rocket. We leverage our deep expertise to translate engineering requirements into highly optimized production lines, working cross functionally to consistently enhance the vehicle program. 
About the Role:

Lead a team of technicians within a specific work center (barrels, domes, thrust structure) to ensure builds are completed on schedule while maintaining high quality standards and operations are completed safely  
Assist team with technical issues, train less experienced team members, and identify any technical gaps within the team  
Responsible for work center upkeep/6S and identifying tooling gaps that are needed 
Responsible for 1:1s and developing technicians thru our technician leveling framework 
50% hands on work 

About You:

1+ year working in a structures role or structures equivalent role 
Demonstrated proficiency in structures tasks such as hole drilling, PFD operation, assembly, and lift operations 
Effective communication and organizational skills, with the ability to coordinate tasks, mentor team members, and track production priorities 
Demonstrated ability to work collaboratively with partner organizations such as engineering, quality, and NDE 

Nice to haves but not required:  

Previous leadership experience 

Benefits:

100% health care coverage on your first day
Quarterly wellness stipend to use on health and wellness
Partnership with Modern Health with access to 8 therapy &amp; coaching sessions and mental health resources
Discounts on gym memberships, travel and entertainment through PerkSpot
Unlimited onsite snacks
Free lunch on Mondays and Fridays
Annual learning and development stipend
PPE Stipend
Pet Insurance through Fetch
Company Paid Life Insurance, Short Term Disability, and Long Term Disability
Up to 12 weeks salary continuation for paid pregnancy disability leave
8 Weeks company paid parental leave
Access to One Medical
At Relativity Space, we are committed to transparency and fairness in our compensation practices. Actual compensation will be determined based on experience, qualifications, and other job-related factors.Compensation is only one part of our total rewards package. Relativity Space offers competitive salary and equity, a generous PTO and sick leave policy, parental leave, an annual learning and development stipend, and more! To see some of the benefits &amp; perks we offer, please visit here.Hiring Range:$44.88$58.08 USDWe are an equal opportunity employer and value diversity at our company. We do not discriminate on the basis of race, religion, color, national origin, gender, sexual orientation, age, marital status, veteran status, or disability status."
3482316,"IT Associate II","https://boards.greenhouse.io/relativity/jobs/8130278002?gh_jid=8130278002","Space","Stennis Space Center, Mississippi","No",5,"Full time","2025-09-01T02:11:17.689014Z","At Relativity Space, were building rockets to serve todays needs and tomorrows breakthroughs. Our Terran R vehicle will deliver customer payloads to orbit, meeting the growing demand for launch capacity. But thats just the start. Achieving commercial success with Terran R will unlock new opportunities to advance science, exploration, and innovation, pioneering progress that reaches beyond the known.
Joining Relativity means becoming part of something where autonomy, ownership, and impact exist at every level. Here, you're not just executing tasks; you're solving problems that havent been solved before, helping develop a rocket, a factory, and a business from the ground up. Whether youre in propulsion, manufacturing, software, avionics, or a corporate function, youll collaborate across teams, shape decisions, and see your work come to life in record time. Relativity is a place where creativity and technical rigor go hand in hand, and your voice will help define the stories were writing together. Now is a unique moment in time where its early enough to leave your mark on the product, the process, and the culture, but far enough along that Terran R is tangible and picking up momentum. The most meaningful work of your career is waiting. Join us.About the Team: 
The IT Department at Relativity Space designs, builds, and maintains the technology ecosystem that powers our organizationon the ground, in manufacturing, and at the launch pad. We ensure seamless infrastructure operations, optimize applications and collaboration tools, and provide secure, high-performance computing environments that support both business and engineering needs. Our team safeguards critical systems and data through proactive security measures, risk management, and compliance enforcement, ensuring mission readiness at every stage. We deploy and support engineering software and automation solutions that enhance productivity, streamline workflows, and drive innovation across design, production, testing, and launch operations. Reliable, high-speed network connectivity is at the core of our operations, enabling efficient communication and data transfer across sites, test stands, and mission-critical environments. With a focus on performance, security, and continuous improvement, we provide the foundation for scalable growth and technical excellence in aerospace innovation.
About the Role:

Enhance Relativitys IT Operations team to support our growth at our headquarters in Long Beach by actively participating in the teams daily tasking and support requirements. 
Answer tickets addressing desktop, user experience, and system issues in a timely and professional manner. 
Install and maintain user endpoint devices, and infrastructure managed by other IT teams. 
Deliver and document solutions that reduce service desk requests and repetitive service workloads.
Leverage your desktop operating system wisdom to resolve issues and improve the end user experience, identifying and suggesting improvements to standard practices as you identify them

About You:

1.5+ years of hands-on IT support experience, in environments supporting Windows and macOS systems.
Familiarity with basic IT troubleshooting and support workflows, including hardware setup, software installation, peripheral support, and user account provisioning.
Functional understanding of core IT concepts, such as IP addressing, DNS/DHCP, file permissions, and system imaging.
Customer-first mindset with excellent communication skills and the ability to support users across technical skill levels.
Ability to follow documented procedures and escalate issues appropriately, showing good judgment in balancing independence with knowing when to ask for help.
Eagerness to learn in a fast-moving, iterative environment where priorities shift quickly and ambiguity is normal.

Nice to haves but not required:  

Linux, iOS, and Android support experience in an enterprise environment.
Knowledge of basic cloud SaaS/PaaS administration.
Familiarity with management tools such as ADUC, MDMs, MDT, Office 365 admin console, etc.
Experience with Atlassian products (Jira, Confluence), SharePoint, Smartsheet, and other business productivity applications. 
At Relativity Space, we are committed to transparency and fairness in our compensation practices. Actual compensation will be determined based on experience, qualifications, and other job-related factors.Compensation is only one part of our total rewards package. Relativity Space offers competitive salary and equity, a generous PTO and sick leave policy, parental leave, an annual learning and development stipend, and more! To see some of the benefits &amp; perks we offer, please visit here.Hiring Range:$33.53$42.89 USDWe are an equal opportunity employer and value diversity at our company. We do not discriminate on the basis of race, religion, color, national origin, gender, sexual orientation, age, marital status, veteran status, or disability status."
