"ID","Title","Link","Company","Location","Remote","Experience","EmploymentType","DatePosted","RoleDescription"
2919741,"Integration Technician, Ground Support Equipment (Falcon Operations) - Multiple Shifts","https://boards.greenhouse.io/spacex/jobs/7989064002?gh_jid=7989064002","SpaceX","Van","No",2,"Full time","2025-05-09T01:59:55.951434Z","SpaceX was founded under the belief that a future where humanity is out exploring the stars is fundamentally more exciting than one where we are not. Today SpaceX is actively developing the technologies to make this possible, with the ultimate goal of enabling human life on Mars.INTEGRATION TECHNICIAN, GROUND SUPPORT EQUIPMENT (FALCON OPERATIONS) - MULTIPLE SHIFTS
SpaceX is looking for motivated, energetic, and enthusiastic mechanical technicians to assist with launch site assembly and test of the Falcon 9 launch vehicle. Our team is tight-knit, and we regularly accomplish feats that were previously thought improbable. In addition to the required experience below, our ideal candidate needs to demonstrate exceptional personal initiative and the ability to maintain composure and a good attitude in demanding technical situations. Whether you are working with critical flight systems or a shovel, as a SpaceX employee youll be expected to be responsible, hardworking, and conscientious of the quality of work you are performing. We need people who are not afraid to use their technical ability to not only identify issues but propose solutions and implement improvements. You must be able to produce high-quality work in a timely manner while continually looking forward to drive process improvements that streamline work and save costs.
RESPONSIBILITIES:

Stage, set up, assemble, flight hardware and test equipment per technical work instructions and ensure the highest level of quality to support the successful launch of a world class launch vehicle
Hands-on operations with both large and small, fragile ESD sensitive assemblies
Proficiently use various mechanical tools and heavy machinery
Complete tasks related to site preventative maintenance in accordance with the asset management system
Maintain, troubleshoot, and install fluid and electromechanical components from a schematic or drawing
Work closely with engineers and leadership to develop and implement operational improvements focused on driving takt times down and ease of repeatability
Rapidly change roles/responsibilities while working in a high-paced, challenging work environment
Play a critical role in coordinated launch vehicle movements and integrated pressurized ground operations

BASIC QUALIFICATIONS:

High school diploma or equivalency certificate
2+ years of professional experience working hands-on as a technician in the aerospace, aviation, automotive, production, manufacturing, oil and gas industry OR a certificate from an accredited trade skills program

PREFERRED SKILLS AND EXPERIENCE:

Airframe &amp; Powerplant License
Associate degree in aerospace technology or equivalent area of study
Strong written and oral communication skills
Meticulous attention to detail
Ability to take project goals, inputs, and work toward the end-goal beyond individual task assignment
Experience populating and repairing connectors ranging from D-SUB, BNC, TNC, N-TYPE SMA 8P8C
Strong working knowledge of Microsoft Office (Excel, PowerPoint, Word, Outlook)
Experience working in a clean room and ESD sensitive environment
Able to obtain or currently hold top secret/ SCI security clearance
Knowledge of pressure, temperature, and flow measurement devices
Experience maintaining a propulsion test stand in the aerospace industry
Experience working at a rocket launch facility and supporting launch campaigns
Military aviation experience as a propulsion or airframe technician
Skill in operating and manipulating machinery and various hand and power tools requiring manual dexterity
Experience with forklifts, cranes, and heavy equipment
Familiarity with calibrated measurement devices including load cells, multi-meters, calipers, torque wrenches, depth gauges, and micrometers

ADDITIONAL REQUIREMENTS:

Ability to pass Air Force background check for Vandenberg 
Ability to work one of the following shifts, overtime, and weekends as needed:
Day Shift:

6:00 AM - 4:30 PM, Monday-Friday


Night Shift:

5:00 PM - 3:30 AM, Monday-Friday


Must be able to work while wearing air purifying and/or supplied air respirators
Work schedule varies depending on site operational needs, and flexibility is required
Must be able to lift up to 25 lbs. unassisted
Lifting, standing, climbing, bending, grasping, sitting, pulling, pushing, stooping, stretching, and carrying are generally required to perform the functions of this position
Must be able to work at elevated heights (up to 300 feet), including the use of ladders
Must be willing to operate heavy machinery
Must be able to work in confined spaces
Typically exposed to work in extreme outdoor environments  heat, cold, rain, ice
Work performed in an environment requiring exposure to fumes, odors, and noise
Willing to travel to other SpaceX sites as needed

COMPENSATION AND BENEFITS:
Pay range:Integration Technician/Level 1: $22.00 - $29.75/hourIntegration Technician/Level 2: $27.50 - $35.75/hourIntegration Technician/Level 3: $33.00 - $41.75/hour
Your actual level and base salary will be determined on a case-by-case basis and may vary based on the following considerations: job-related knowledge and skills, education, and experience.
Base salary is just one part of your total rewards package at SpaceX. You may also be eligible for long-term incentives, in the form of company stock, stock options, or long-term cash awards, as well as potential discretionary bonuses and the ability to purchase additional stock at a discount through an Employee Stock Purchase Plan. You will also receive access to comprehensive medical, vision, and dental coverage, access to a 401(k) retirement plan, short and long-term disability insurance, life insurance, paid parental leave, and various other discounts and perks. You may also accrue 3 weeks of paid vacation and will be eligible for 10 or more paid holidays per year.
 ITAR REQUIREMENTS:

To conform to U.S. Government export regulations, applicant must be a (i) U.S. citizen or national, (ii) U.S. lawful, permanent resident (aka green card holder), (iii) Refugee under 8 U.S.C.  1157, or (iv) Asylee under 8 U.S.C.  1158, or be eligible to obtain the required authorizations from the U.S. Department of State. Learn more about the ITAR here.  

SpaceX is an Equal Opportunity Employer; employment with SpaceX is governed on the basis of merit, competence and qualifications and will not be influenced in any manner by race, color, religion, gender, national origin/ethnicity, veteran status, disability status, age, sexual orientation, gender identity, marital status, mental or physical disability or any other legally protected status.
Applicants wishing to view a copy of SpaceXs Affirmative Action Plan for veterans and individuals with disabilities, or applicants requiring reasonable accommodation to the application/interview process should reach out to EEOCompliance@spacex.com."
2919740,"Facilities Technician (WW Hauler)","https://boards.greenhouse.io/spacex/jobs/7989168002?gh_jid=7989168002","SpaceX","Starbase, TX","No",5,"Full time","2025-05-09T01:59:55.951461Z","SpaceX was founded under the belief that a future where humanity is out exploring the stars is fundamentally more exciting than one where we are not. Today SpaceX is actively developing the technologies to make this possible, with the ultimate goal of enabling human life on Mars.FACILITIES TECHNICIAN (WW HAULER) - NIGHT SHIFT
RESPONSIBILITIES:

Execute all wastewater management operations at Starbase, including servicing of the onsite treatment plant and all distribution systems
Execute daily hauling operations onsite
Maintain all wastewater hauling equipment 
Responsible for the cleanliness of the vehicle and refueling when low 

BASIC QUALIFICATIONS:

High school diploma or equivalency certificate
2+ years of professional experience hauling water and wastewater
Class B CDL with Tank Endorsement  
Valid driver's license 

PREFERRED SKILLS AND EXPERIENCE: 

5+ years of professional driving experience
Professional experience hauling wastewater 
Excellent organizational and time management skills
WW / Hauling background
Experience servicing waste tanks and wastewater systems

ADDITIONAL REQUIREMENTS:

Ability to work all required hours, weekends and off-shifts with minimal notice
Ability to work in extreme outdoor environments  heat, cold, rain
Ability to lift 25 lbs.; lifting, standing, climbing, bending, grasping, pulling, pushing, stooping, stretching, are required to perform the functions of this position
ITAR REQUIREMENTS:

To conform to U.S. Government export regulations, applicant must be a (i) U.S. citizen or national, (ii) U.S. lawful, permanent resident (aka green card holder), (iii) Refugee under 8 U.S.C.  1157, or (iv) Asylee under 8 U.S.C.  1158, or be eligible to obtain the required authorizations from the U.S. Department of State. Learn more about the ITAR here.  

SpaceX is an Equal Opportunity Employer; employment with SpaceX is governed on the basis of merit, competence and qualifications and will not be influenced in any manner by race, color, religion, gender, national origin/ethnicity, veteran status, disability status, age, sexual orientation, gender identity, marital status, mental or physical disability or any other legally protected status.
Applicants wishing to view a copy of SpaceXs Affirmative Action Plan for veterans and individuals with disabilities, or applicants requiring reasonable accommodation to the application/interview process should reach out to EEOCompliance@spacex.com."
2919739,"Automation & Controls Engineer, Launch Pad (Starship)","https://boards.greenhouse.io/spacex/jobs/7990127002?gh_jid=7990127002","SpaceX","Starbase, TX","No",1,"Internship","2025-05-09T01:59:55.951488Z","SpaceX was founded under the belief that a future where humanity is out exploring the stars is fundamentally more exciting than one where we are not. Today SpaceX is actively developing the technologies to make this possible, with the ultimate goal of enabling human life on Mars.AUTOMATION &amp; CONTROLS ENGINEER, LAUNCH PAD (STARSHIP)
SpaceX's Starship spacecraft and Super Heavy rocket (collectively referred to as Starship) represent a fully reusable transportation system designed to carry both crew and cargo to Earth orbit, the Moon, Mars and beyond. Starship will be the world's most powerful launch vehicle ever developed, with the ability to carry in excess of 100 metric tons to Earth orbit.
We are looking for an automation &amp; controls engineer to help SpaceX develop and build launch systems for Starship. This role will be focused on electrical control systems for the launch mount and integration tower, including I/O systems, motion systems, and supporting infrastructure.
The successful applicant will be joining, and be supported, by a highly talented team of engineers with an amazing track record in developing any type of automated solution imaginable.
RESPONSIBILITIES:
Electrical systems:

Architect, design and integrate control systems for the Starship Launch pads
Design industrial electrical control panels which are NFPA79/NEC/UL508A compliant
Design control and data acquisition systems
Design and author electrical schematics
Design electrical conveyance and distribution systems (e.g. raceways, cables, wiring methods)
Work closely with other disciplines. Interface control systems with high power equipment and communication equipment.
Design electrical systems for hazardous environments

Control software:

Architect, write, and debug PLC code with an emphasis on generating code that is organized, structured, documented, maintainable and reusable for similar applications
Configure, commission and tune VFDs for open and closed loop control system applications
Generate aesthetically simple HMI screens for complex machinery while providing sufficient feedback for troubleshooting

Mechanical integration:

Add detail for electrical assemblies to CAD models to plan out install for cable tray, conduit, panel mounting, etc.

General responsibilities:

Participate in initial equipment conceptual development and carefully balance product specifications, process requirements, layout complexity, cost, and lead-time limits
Manage electrical cabinet builds, field wiring, and conveyance installs
Set, implement, and maintain schedules and budgets to ensure project completion

BASIC QUALIFICATIONS:

Bachelor's degree in an engineering discipline
1+ years of experience in the design and commissioning of control systems for industrial applications (internship experience qualifies)

PREFERRED SKILLS AND EXPERIENCE:

Experience with Industrial and process automation &amp; control systems.
Experience architecting, designing, and integrating various industrial control systems.
Electrical schematic CAD experience using EPlan
Mechanical design experience with CAD such as Siemens NX or SolidWorks
PLC programming experience
HMI and SCADA programming experience
Field bus networks, serial communication and Ethernet communication
Hands-on experience building and commissioning high quality electrical control panels and electro-mechanical systems
Knowledge of NEC, UL508A codes
Excellent communication skills both written and verbal
Experience in fast-paced iterative design and test environments
Experience solving complex problems with little to no supervision on schedule as an individual or as a member of an integrated team
Strong work ethic and drive to succeed as part of a high functioning team
Ability to rapidly change roles/responsibilities while working in a high-paced, challenging work environment
Ability to thrive in ambiguity, independently drive project progress, and manage multiple priorities
Demonstrated ability to design, implement and troubleshoot control systems
Fundamental understanding of engineering principles behind electronic equipment, instrumentation, and commonly used industrial equipment
Select and size electrical and electromechanical components such as servo motors, controllers, and VFDs.
Experience designing and installing instrumentation and control systems in hazardous areas (NFPA 70 Section 500 installations); Class 1, Division 1 and Division 2 environments or IEC equivalence
Experience tuning PID controllers
Experience with electrical power distribution, working knowledge of NFPA 70 and NFPA 70E
First-hand experience with programming and software development
Experience with industrial bus protocols such as Modbus, Profinet and EtherNet/IP

 ADDITIONAL REQUIREMENTS:

Must be willing to work extended hours and/or weekends as needed
Must be willing to travel for extended periods, up to 100% during system activation
Ability to pass Air Force background checks for Cape Canaveral and Vandenberg
ITAR REQUIREMENTS:

To conform to U.S. Government export regulations, applicant must be a (i) U.S. citizen or national, (ii) U.S. lawful, permanent resident (aka green card holder), (iii) Refugee under 8 U.S.C.  1157, or (iv) Asylee under 8 U.S.C.  1158, or be eligible to obtain the required authorizations from the U.S. Department of State. Learn more about the ITAR here.  

SpaceX is an Equal Opportunity Employer; employment with SpaceX is governed on the basis of merit, competence and qualifications and will not be influenced in any manner by race, color, religion, gender, national origin/ethnicity, veteran status, disability status, age, sexual orientation, gender identity, marital status, mental or physical disability or any other legally protected status.
Applicants wishing to view a copy of SpaceXs Affirmative Action Plan for veterans and individuals with disabilities, or applicants requiring reasonable accommodation to the application/interview process should reach out to EEOCompliance@spacex.com."
2912017,"Supplier Quality Specialist (Starship)","https://boards.greenhouse.io/spacex/jobs/7986911002?gh_jid=7986911002","SpaceX","Starbase, TX","No",2,"Full time","2025-05-09T01:59:55.951516Z","SpaceX was founded under the belief that a future where humanity is out exploring the stars is fundamentally more exciting than one where we are not. Today SpaceX is actively developing the technologies to make this possible, with the ultimate goal of enabling human life on Mars.SUPPLIER QUALITY SPECIALIST (SUPPLY CHAIN RELIABILITY)
SpaceX demands a new type of supply chain. We require our suppliers to provide premium quality with rapidly evolving designs at increasingly ambitious volumes. We are actively looking for candidates who possess comprehensive knowledge of manufacturing and quality tools and have unrelenting motivation to enable suppliers for success.
The Supply Chain Reliability team is chartered with global quality surveillance of the supply base, reducing supply chain risk through external evaluations and internal risk reviews, leading failure investigations and proactively driving source qualification activities. This position supports the Supply Chain Reliability team by managing tactical supplier quality activities with operational rigor, providing high service levels to all stakeholders, and allowing Engineering resources to focus on high-priority and proactive actions. This includes eliminating the impact of vendor-caused defects on SpaceX engineering and production through rapid defect containment, resolution, and corrective/ preventive action.
RESPONSIBILITIES: 

Improve the issue ticket landscape as it pertains to our specific products.
Dissect the issue ticket landscape and identify specific actions to improve vendor performance.
Own the non-conformances that are found at vendors (Supplier Deviation Requests) and non-conformances found in production.
Partner with the vendors to institute new processes or actions to reduce the amount of issues and reduce supply chain risk.
Improve our existing quality management processes while working with vendors to improve their performance.
Manage our containment, receiving, and precision inspection non-conformances, and find a path of resolution for the non-conformances that exist.
Identify ways to enhance and update the variables surrounding these processes, to reduce the total issue ticket landscape.
Create improvements within SpaceXs supply base to facilitate a more stable supply chain. 
Provide technical support onsite at suppliers as appropriate to ensure part reliability.
Work closely with Engineering, Procurement and Production teams to assure high quality parts and services that meet all requirements.
Analyze quality metrics to identify trends and pinpoint systemic root causes. 
Partner with Supply Chain Reliability Engineers to eliminate recurring non-conformances and ensure part reliability, including supplier improvement plans.
Review and assess supplier manufacturing processes and quality systems, including new supplier onboarding and audit evaluation.
Provide feedback as appropriate on manufacturing methods and technologies during supplier product lifecycle.
Execute supply chain non-conformance management processes, including Supplier Deviation Requests (SDR), Material Review Board (MRB), Return to Vendor (RTV), supplier Corrective and Preventive Action (CAPA), and production issue ticket review.
Support containment actions associated with non-conforming product, including identification of product location, coordination with Supply Chain Reliability Engineers to mitigate Flight risk and actions required to drive root cause analysis.
Cultivate network across SpaceX and build relationships with cross-functional groups to identify, reduce and ultimately eliminate impacts from vendor defects.
Assist the team in developing policies, standards, processes, and documentation as necessary to ensure continued success.

BASIC QUALIFICATIONS:

High school diploma or equivalency certificate.
2+ years of experience in an engineering, supply chain, manufacturing or quality-related field OR a bachelor's degree in engineering or supply chain in lieu of experience.

PREFERRED SKILLS AND EXPERIENCE:

Bachelors degree in engineering or supply chain.
Experience with sharing information and influencing others.
Strong written and verbal communication skills, able to liaise cross functionally, internally and externally, make presentations to team members and management.
Strong understanding of manufacturing processes and technical requirements. 
Deep technical domain experience in one or more commodity types, such as machined, avionics, or composite parts.
Experience reading engineering drawings, including Geometric Dimension and Tolerance (GD&amp;T).
Experience with AS9100 or similar quality management system standard.
Knowledge of supplier quality processes (Part or Supplier Approval Processes, First Article Inspection Reports, etc.).
Direct experience interfacing with suppliers, corrective/ preventive action systems, supplier portals.
Experience in a supplier development capacity.
Proficiency in MS Office applications.
Proficiency with lean concepts and statistical and data analytics.

ADDITIONAL REQUIREMENTS:

Position may involve extended hours and weekend work when needed to meet critical deadlines.
Must be able to travel - up to 25% work week travel.
This position is based in Brownsville, TX and requires being onsite - remote work not considered.
ITAR REQUIREMENTS:

To conform to U.S. Government export regulations, applicant must be a (i) U.S. citizen or national, (ii) U.S. lawful, permanent resident (aka green card holder), (iii) Refugee under 8 U.S.C.  1157, or (iv) Asylee under 8 U.S.C.  1158, or be eligible to obtain the required authorizations from the U.S. Department of State. Learn more about the ITAR here.  

SpaceX is an Equal Opportunity Employer; employment with SpaceX is governed on the basis of merit, competence and qualifications and will not be influenced in any manner by race, color, religion, gender, national origin/ethnicity, veteran status, disability status, age, sexual orientation, gender identity, marital status, mental or physical disability or any other legally protected status.
Applicants wishing to view a copy of SpaceXs Affirmative Action Plan for veterans and individuals with disabilities, or applicants requiring reasonable accommodation to the application/interview process should reach out to EEOCompliance@spacex.com."
