"ID","Title","Link","Company","Location","Remote","Experience","EmploymentType","DatePosted","RoleDescription"
3496708,"Senior Production Planner","https://boards.greenhouse.io/relativity/jobs/8138878002?gh_jid=8138878002","Space","Long Beach","No",3,"Full time","2025-09-01T02:11:17.688722Z","At Relativity Space, were building rockets to serve todays needs and tomorrows breakthroughs. Our Terran R vehicle will deliver customer payloads to orbit, meeting the growing demand for launch capacity. But thats just the start. Achieving commercial success with Terran R will unlock new opportunities to advance science, exploration, and innovation, pioneering progress that reaches beyond the known.
Joining Relativity means becoming part of something where autonomy, ownership, and impact exist at every level. Here, you're not just executing tasks; you're solving problems that havent been solved before, helping develop a rocket, a factory, and a business from the ground up. Whether youre in propulsion, manufacturing, software, avionics, or a corporate function, youll collaborate across teams, shape decisions, and see your work come to life in record time. Relativity is a place where creativity and technical rigor go hand in hand, and your voice will help define the stories were writing together. Now is a unique moment in time where its early enough to leave your mark on the product, the process, and the culture, but far enough along that Terran R is tangible and picking up momentum. The most meaningful work of your career is waiting. Join us.About the Team: 
At Relativity Space, our Production Control Team plays a mission-critical role in enabling our vision of revolutionizing aerospace manufacturing. This team is responsible for planning and scheduling the entire product lifecyclefrom initial components and engine builds to full-stage vehicle integration. What makes our team unique is the depth and extensiveness of our influence across the organization. We work closely with Production, Supply Chain, Program Management, Engineering, and Leadership to ensure that every part, assembly, and milestone is aligned with the bigger picture. Our planners sit at the intersection of strategic execution and tactical problem solving, helping to translate complex technical goals into clear, achievable plans. We thrive in an environment where no two days are the same, and where adaptability, ownership, and curiosity are essential. Whether its building capacity models from scratch, creating rate-based schedules for a new production line, or driving alignment across multiple hardware owners, this team is empowered to lead and deliver clarity where its needed most. If youre energized by the idea of scheduling the future of spaceflight, being a core driver of operational readiness, and collaborating with some of the most innovative teams in the industrythen this is the team for you.
About the Role:
In this role, we are seeking an experienced Senior Production Planner to join our growing team and play a key role in transforming our manufacturing operation into a high-output, rate-based system. This individual will own and drive planning deliverables tied to production execution, schedule transparency, and build readiness, while helping define scalable processes that support production rate acceleration.


Lead the development and execution of complex, integrated production plans across multiple programs, covering all phases from raw material through final vehicle integration.
Lead CTB reviews for assigned builds, ensuring shortages are tracked, mitigated, and escalated as needed. Maintain close alignment with propulsion integration teams through daily scrum updates and issue resolution.
Use CTB trends to inform risk management, resource allocation, and scheduling adjustments. Support scaling of CTB workflows into automated, system-driven readiness tools.
Drive long-range planning strategies by aligning capacity, material availability, and build requirements to program objectives and rate targets.
Own lead-time analysis to proactively identify systemic risks, implement recovery plans, and ensure on-time delivery of hardware across interdependent work centers.
Manage and continuously improve advanced Clear to Build processes, working across engineering, supply chain, and manufacturing to eliminate blockers and optimize readiness at every stage.
Support the deployment of scalable planning tools, automation, and analytics that enhance forecasting accuracy, enable scenario modeling, and increase operational agility.
Represent the production planning function in cross-functional reviews, program readiness gates, and executive-level updates, providing transparent communication of planning health, risks, and mitigation actions.
Mentor and guide planners across the organization, promoting planning excellence and driving consistency in standards, reporting, and best practices.


About You:

Bachelors degree or equivalent 3+ years of experience in production planning, scheduling, or manufacturing operations, preferably in aerospace, automotive, or other complex hardware environments.
Demonstrated expertise in capacity planning, MRP/ERP systems, and integrated scheduling techniques.
Experience working in a fast-paced, scaling production environment with evolving processes.
Strong analytical skills with the ability to simplify and communicate complex schedule data to various stakeholders.
Proven track record of cross-functional collaboration and effective problem-solving.
Excellent organizational and communication skillsboth written and verbal.
Skilled with resource loaded schedules using Smartsheet, MS Project, or comparable scheduling software. 

Nice to haves but not required:  

Aerospace, automotive, or high-rate manufacturing experience.
Experience with rate-based production transitions or new product introduction.
Exposure to digital planning tools and/or planning automation initiatives.
Familiarity with Clear to Build methodologies and shortage management.
Excellent analytical, communication, and problem-solving skills.
SQL query experience is a plus for supporting data-driven planning and reporting. 
At Relativity Space, we are committed to transparency and fairness in our compensation practices. Actual compensation will be determined based on experience, qualifications, and other job-related factors.Compensation is only one part of our total rewards package. Relativity Space offers competitive salary and equity, a generous PTO and sick leave policy, parental leave, an annual learning and development stipend, and more! To see some of the benefits &amp; perks we offer, please visit here.Hiring Range:$101,000$129,000 USDWe are an equal opportunity employer and value diversity at our company. We do not discriminate on the basis of race, religion, color, national origin, gender, sexual orientation, age, marital status, veteran status, or disability status."
3496707,"Quality Systems Engineer","https://boards.greenhouse.io/relativity/jobs/8118332002?gh_jid=8118332002","Space","Long Beach","No",3,"Full time","2025-09-01T02:11:17.688746Z","At Relativity Space, were building rockets to serve todays needs and tomorrows breakthroughs. Our Terran R vehicle will deliver customer payloads to orbit, meeting the growing demand for launch capacity. But thats just the start. Achieving commercial success with Terran R will unlock new opportunities to advance science, exploration, and innovation, pioneering progress that reaches beyond the known.
Joining Relativity means becoming part of something where autonomy, ownership, and impact exist at every level. Here, you're not just executing tasks; you're solving problems that havent been solved before, helping develop a rocket, a factory, and a business from the ground up. Whether youre in propulsion, manufacturing, software, avionics, or a corporate function, youll collaborate across teams, shape decisions, and see your work come to life in record time. Relativity is a place where creativity and technical rigor go hand in hand, and your voice will help define the stories were writing together. Now is a unique moment in time where its early enough to leave your mark on the product, the process, and the culture, but far enough along that Terran R is tangible and picking up momentum. The most meaningful work of your career is waiting. Join us. 
About the Team
 
The Quality team is focused on embedding quality into every part of the design and production process for Terran R. Not just inspecting at the end but influencing how things are built from the start. The team embeds themselves directly within design, manufacturing, test, and launch teams to stay close to the hardware, understand constraints, and proactively shape decisions. As we move beyond initial development into production and then scaled operations, now is the time to put the right processes, controls, and inspections in place without slowing down progress. The team plays a key role in balancing risk, driving a culture of ownership, and ensuring that speed doesnt come at the cost of reliability. Success here means building a quality system that scales with the Terran R program and Relativity as a whole.
 
About the Role
 

The Quality Systems Engineer in QMS team will be responsible for developing, implementing, maintaining, and continuously improving our Quality Management System in compliance with AS9100 and applicable aerospace regulations. You will:
 
 Partner with engineering, manufacturing, supply chain, and leadership teams to ensure our processes are robust, our documentation is clear, and our execution drives mission success. 
 Develop, implement, and maintain the quality management system (QMS) in alignment with AS9100, customer requirements, and regulatory expectations. 
 Lead QMS documentation control system that ensures effective document release, revision control, and accessibility, to support the scale of 
 Manage the internal audits, external audits, and certification activities; track and close out audit findings. 
 Support risk management activities and continuous improvement initiatives. 
 Provide QMS training and guidance to employees at all levels.

 
About You - Minimum Qualifications
 
 Bachelors degree in engineering, quality, or related STEM field, or equivalent experience. 
 3+ years of experience in quality systems or quality engineering, familiar with QMS platforms and digital applications, preferably in aerospace 
 In-depth working experience of AS9100 or ISO9001 requirements and principles. 
 Certified QMS lead auditor (AS9100 preferred). 
 Strong skills in document control, process mapping, and continuous improvement.At Relativity Space, we are committed to transparency and fairness in our compensation practices. Actual compensation will be determined based on experience, qualifications, and other job-related factors.Compensation is only one part of our total rewards package. Relativity Space offers competitive salary and equity, a generous PTO and sick leave policy, parental leave, an annual learning and development stipend, and more! To see some of the benefits &amp; perks we offer, please visit here.Hiring Range:$85,000$109,000 USDWe are an equal opportunity employer and value diversity at our company. We do not discriminate on the basis of race, religion, color, national origin, gender, sexual orientation, age, marital status, veteran status, or disability status."
3496706,"Propulsion Components Test Engineer II, Second Shift","https://boards.greenhouse.io/relativity/jobs/8137032002?gh_jid=8137032002","Space","Long Beach","No",2,"Full time","2025-09-01T02:11:17.688771Z","At Relativity Space, were building rockets to serve todays needs and tomorrows breakthroughs. Our Terran R vehicle will deliver customer payloads to orbit, meeting the growing demand for launch capacity. But thats just the start. Achieving commercial success with Terran R will unlock new opportunities to advance science, exploration, and innovation, pioneering progress that reaches beyond the known.
Joining Relativity means becoming part of something where autonomy, ownership, and impact exist at every level. Here, you're not just executing tasks; you're solving problems that havent been solved before, helping develop a rocket, a factory, and a business from the ground up. Whether youre in propulsion, manufacturing, software, avionics, or a corporate function, youll collaborate across teams, shape decisions, and see your work come to life in record time. Relativity is a place where creativity and technical rigor go hand in hand, and your voice will help define the stories were writing together. Now is a unique moment in time where its early enough to leave your mark on the product, the process, and the culture, but far enough along that Terran R is tangible and picking up momentum. The most meaningful work of your career is waiting. Join us.About the Team:
The Engine Manufacturing team is dedicated to delivering high-performance engines and advancing innovative manufacturing systems that continuously improve cost, quality, and lead time. Youre not just executing on designs; you actively provide input that shapes new hardware iterations and regularly interface with engineers to make critical decisions for the Aeon R program. Having successfully developed and refined processes for our initial development engines, the team is now focused on producing flight engines at rate for Terran Rs aggressive launch manifest.
About the Role:

Design and commission new test assets and systems - incorporating fluid, mechanical, and electrical components  to unlock new capabilities or enhance existing ones
Author and optimize test sequences, procedures, and operational processes to support first-article development and transition into high-volume production
Review and analyze test data to evaluate Terran-R &amp; Aeon-R component performance
Define and standardize operational requirements and processes to improve safety, data quality, and test repeatability
Plan and execute projects that improve test capabilities and operational efficiency in a manner that aligns with the Integrated Master Schedule (IMS)

About You:

Bachelors Degree or higher in Aerospace, Mechanical, or Electrical Engineering; or other related discipline. 
2+ years of relevant technical experience, including (but not limited to): 

Authoring &amp; Executing Test Procedures 
Designing &amp; Commissioning Complex Fluid-Mechanical Systems 
Leading Failure &amp; Anomaly Investigations 


Strong understanding of and ability to apply engineering fundamentals in fluid, thermal, mechanical, and electrical engineering. 
Demonstrated knowledge of safety standards, common test hazards, and appropriate mitigations. 
Ability to find simple, innovative solutions for difficult problems and make critical decisions under pressure. 
Willingness to work 2nd Shift, nominally 3pm to 11pm, to support Production Operations with a wide range of Component Acceptance Tests. 

Nice to haves, but not required:

Familiarity with Industry Test Standards: e.g., SMC-S-016, MIL-STD-1540D, &amp; MIL-STD-810G. 
In-depth knowledge and experience with test automation, data acquisition, and control systems. 
Knowledge of engine components such as pumps, valves, regulators, check valves, as well as electric, pneumatic, and hydraulic valves, actuators, and other fluid system components. 
Desire to work hands-on, as part of a team, in both the development and production phases of a product lifecycle. 
At Relativity Space, we are committed to transparency and fairness in our compensation practices. Actual compensation will be determined based on experience, qualifications, and other job-related factors.Compensation is only one part of our total rewards package. Relativity Space offers competitive salary and equity, a generous PTO and sick leave policy, parental leave, an annual learning and development stipend, and more! To see some of the benefits &amp; perks we offer, please visit here.Hiring Range:$112,000$143,000 USDWe are an equal opportunity employer and value diversity at our company. We do not discriminate on the basis of race, religion, color, national origin, gender, sexual orientation, age, marital status, veteran status, or disability status."
2587972,"Tooling Mechanical Engineer I","https://boards.greenhouse.io/relativity/jobs/7886689002?gh_jid=7886689002","Space","Long Beach","No",1,"Full time","2025-09-01T02:11:17.688789Z","At Relativity Space, were building rockets to serve todays needs and tomorrows breakthroughs. Our Terran R vehicle will deliver customer payloads to orbit, meeting the growing demand for launch capacity. But thats just the start. Achieving commercial success with Terran R will unlock new opportunities to advance science, exploration, and innovation, pioneering progress that reaches beyond the known.
Joining Relativity means becoming part of something where autonomy, ownership, and impact exist at every level. Here, you're not just executing tasks; you're solving problems that havent been solved before, helping develop a rocket, a factory, and a business from the ground up. Whether youre in propulsion, manufacturing, software, avionics, or a corporate function, youll collaborate across teams, shape decisions, and see your work come to life in record time. Relativity is a place where creativity and technical rigor go hand in hand, and your voice will help define the stories were writing together. Now is a unique moment in time where its early enough to leave your mark on the product, the process, and the culture, but far enough along that Terran R is tangible and picking up momentum. The most meaningful work of your career is waiting. Join us.About the Team: 
The Tooling and Factory Automation team sits at the intersection of design, manufacturing, and automation, making everything from large-scale structural fixtures to small tools that directly enable Terran Rs production. As a design group embedded within the manufacturing organization, we dig deep into the needs of our internal partners to understand root problems, propose solutions, and deliver hardware to help build faster, scale smarter, and work better. The team is also at the forefront of Relativitys growing factory automation efforts, an increasingly critical part of scaling production of Terran R at existing and future facilities. Youll have the autonomy to make decisions, field solutions, and see them in action on the factory floor. Ultimately, youre not just designing tools or automated processes; youre defining how rockets and factories get built.
About the Role: 

Develop high quality development and production tooling for the Terran vehicle and Aeon engine programs
Capable of integrating concepts and principles of mechanical design and analysis of several different projects in a fast-paced environment - projects will vary in size and scale
Ability to interpret and apply sound design and drafting standards (ASME Y14.5) in creating tooling drawing definitions
Handle a wide range of technical problems and familiar with all types of material handling, assembly fixtures, off-loaders, rotisseries, test fixtures, structural weldments, environmental chambers, and custom machines
Close collaboration with component designers, manufacturing engineers, and integration engineering to achieve the best possible cradle to grave metrics (safety, cost, quality, cycle time, delivery, reliability, life, and maintenance/refurbishment)
Manage projects including vendor selection, fabrication, inspection, equipment installation, and commissioning of tooling 

About You:  

Bachelor of Science degree in manufacturing engineering, mechanical engineering or equivalent
Experience using CAD and FEA-based analysis software (NX and ANSYS Workbench preferred) for structural applications

Nice to haves but not required:  

1+ years of work or project experience with design, build, and commissioning of tooling and fixtures for manufacturing, assembly and test
Experience with Siemens NX and Teamcenter PLM software
Experience with ANSYS Workbench, FEMAP Pre/Post processing, NASTRAN Solver, NX Advance Simulation, Mechanica, etc.
At Relativity Space, we are committed to transparency and fairness in our compensation practices. Actual compensation will be determined based on experience, qualifications, and other job-related factors.Compensation is only one part of our total rewards package. Relativity Space offers competitive salary and equity, a generous PTO and sick leave policy, parental leave, an annual learning and development stipend, and more! To see some of the benefits &amp; perks we offer, please visit here.Hiring Range:$97,000$124,300 USDWe are an equal opportunity employer and value diversity at our company. We do not discriminate on the basis of race, religion, color, national origin, gender, sexual orientation, age, marital status, veteran status, or disability status."
