"ID","Title","Link","Company","Location","Remote","Experience","EmploymentType","DatePosted","RoleDescription"
1971305,"Propulsion Technician (Fluid Systems)","https://boards.greenhouse.io/spacex/jobs/7748626002?gh_jid=7748626002","SpaceX","Hawthorne","No",5,"Full time","2025-05-09T01:59:55.952115Z","SpaceX was founded under the belief that a future where humanity is out exploring the stars is fundamentally more exciting than one where we are not. Today SpaceX is actively developing the technologies to make this possible, with the ultimate goal of enabling human life on Mars.PROPULSION TECHNICIAN (FLUID SYSTEMS) 
Candidates should possess a combination of solid mechanical knowledge, hands-on experience and the willingness and ability to learn. The propulsion technician is responsible for assembly and testing of rocket hardware, associated sub assemblies. This is a dynamic position that requires the flexibility to work on different systems, the ability to troubleshoot anomalies, and can work autonomously to defined schedules while keeping safety and quality at the forefront of everything that is done.
RESPONSIBILITIES:

Clean tools, valves, regulators and maintain a professional and neat work area
Stage, install, set-up, test and de-stage engines
Troubleshoot engines and cell systems
Operate test cell instrumentation and uses computer network systems, as well as test units as described in the test instruction
Accept or reject test units based on calculated test data and results
Perform work according to procedures, specifications and test instructions

BASIC QUALIFICATIONS:

High school diploma or equivalency certificate
1+ years of experience in a manufacturing, military, assembly, fabrication, aviation, or automotive environment OR certificate from an accredited trade skills program in A&amp;P, manufacturing, and/or electronics

PREFERRED SKILLS AND EXPERIENCE:

Experience staging, installing, removing and de-staging propulsion engines
A&amp;P license
2+ years of experience working on aircraft or rocket engines
5+ years of aerospace engines experience
Knowledge of pressure, temperature and flow measurement devices; mechanical and electrical systems; and/or propulsion engines
Strong mathematical, basic computer, problem solving and decision making skills, and strong written and verbal communication skills
Ability to work independently or as part of a team to meet aggressive schedules
Ability to operate and understand readouts on standard cell instrumentation: CRT screens, Daytronic vibration analyzer, and make full use of computer network systems

ADDITIONAL REQUIREMENTS:

Must be able to work all shifts, overtime, and/or weekends as needed
Expected shift times: 1st shift (~4 AM  2:30 PM) and 2nd shift (~2 PM  12:30 AM)
Able to lift 25 lbs. unassisted
Able to stand for extended periods  8 hours min
Able to stoop, bend, crawl, and being able to maneuver in tight spaces

COMPENSATION AND BENEFITS:   Pay range:    Propulsion Technician/Level 1: $22.00 - $27.00/hour    Propulsion Technician/Level 2: $25.00 - $32.50/hour    Propulsion Technician/Level 3: $30.00 - $38.00/hour   Your actual level and base salary will be determined on a case-by-case basis and may vary based on the following considerations: job-related knowledge and skills, education, and experience.
Base salary is just one part of your total rewards package at SpaceX. You may also be eligible for long-term incentives, in the form of company stock, stock options, or long-term cash awards, as well as potential discretionary bonuses and the ability to purchase additional stock at a discount through an Employee Stock Purchase Plan. You will also receive access to comprehensive medical, vision, and dental coverage, access to a 401(k) retirement plan, short and long-term disability insurance, life insurance, paid parental leave, and various other discounts and perks. You may also accrue 3 weeks of paid vacation and will be eligible for 10 or more paid holidays per year. 
 ITAR REQUIREMENTS:

To conform to U.S. Government export regulations, applicant must be a (i) U.S. citizen or national, (ii) U.S. lawful, permanent resident (aka green card holder), (iii) Refugee under 8 U.S.C.  1157, or (iv) Asylee under 8 U.S.C.  1158, or be eligible to obtain the required authorizations from the U.S. Department of State. Learn more about the ITAR here.  

SpaceX is an Equal Opportunity Employer; employment with SpaceX is governed on the basis of merit, competence and qualifications and will not be influenced in any manner by race, color, religion, gender, national origin/ethnicity, veteran status, disability status, age, sexual orientation, gender identity, marital status, mental or physical disability or any other legally protected status.
Applicants wishing to view a copy of SpaceXs Affirmative Action Plan for veterans and individuals with disabilities, or applicants requiring reasonable accommodation to the application/interview process should reach out to EEOCompliance@spacex.com."
2899869,"Supervisor, Spaceport Hospitality","https://boards.greenhouse.io/spacex/jobs/7985163002?gh_jid=7985163002","SpaceX","Starbase, TX","No",5,"Full time","2025-05-09T01:59:55.952143Z","SpaceX was founded under the belief that a future where humanity is out exploring the stars is fundamentally more exciting than one where we are not. Today SpaceX is actively developing the technologies to make this possible, with the ultimate goal of enabling human life on Mars.SUPERVISOR, SPACEPORT HOSPITALITY 
The Starbase Hospitality team serves all employees, customers, government partners, potential clients and/or visitors with everything from snacks to daily meals to full service events. The role of Supervisor, Spaceport Hospitality will be to support the direction and management of the organizations food/beverage operations and customer service activities. You will help develop and implement effective customer service strategies and training programs. The duties of Supervisor, Spaceport Hospitality will include but are not limited to; coordinating service operations, monitoring and motivating staff, ensuring excellent customer service, engaging with customers, hiring and developing talent, ensuring team is current with all mandatory company trainings, scheduling and payroll, interviewing, hiring and onboarding of new staff, setting and upholding customer service principles. Supervisor, Spaceport Hospitality will support the mission by providing a foundation of understanding for excellent customer service and quality food/beverage options that boost morale and productivity within SpaceX.
RESPONSIBILITIES:

Set and enforces standards for hospitality operations
Organize, coordinate and assist with catering/event requests
Manage and monitor product quality, consistency and service, and address issues accordingly
Maintain clean and safe work stations throughout operation
Oversee menu accuracy in multiple service formats and locations
Train staff on customer service, allergen and nutritional awareness
Enforce proper food safety practices with staff
Coordinate and enhance time management for team

BASIC QUALIFICATIONS:

High school diploma or equivalency certificate
5+ years of leadership experience within the food service industry

PREFERRED SKILLS AND EXPERIENCE:

2+ years of restaurant general manager experience
Experience opening new operations and/or creating operational procedures from the ground up
Experience in bartending
Experience in fine dining, casual and quick service restaurants
Advanced knowledge of customer service and safe kitchen operations
Advanced knowledge of beverage services including beer, wine, spirits
Experienced with Microsoft office and outlook
Excellent communication skills both written and verbal
Advanced knowledge of food profession principles and practices
Customer service or guest interaction experience
Excellent knowledge of food service systems, ordering and inventory
Experience in corporate environment
Proficient knowledge of human resources management
Ability to organize work for large groups in various service formats
Ability to work gracefully under pressure
Adaptability, problem-solving skills, and extreme attention to detail
Team player with the ability to collaborate effectively
Strong time management skills
Experience leading groups in large team settings of 10 or more staff members

ADDITIONAL REQUIREMENTS: 

Ability to carry large heavy items unassisted (up to 25lbs)
Able to perform frequent bending, stooping, and lifting of objects
Ability to stand for long periods of time  up to 10 hours a day
Must be able to work all shifts and available for extended hours, weekends and holiday as needed
Must participate in internal leadership and development training
Valid Texas Food Handler and TABC Certification or willingness to obtain them before employment
Must have or be able to obtain manager level food safety certification
ITAR REQUIREMENTS:

To conform to U.S. Government export regulations, applicant must be a (i) U.S. citizen or national, (ii) U.S. lawful, permanent resident (aka green card holder), (iii) Refugee under 8 U.S.C.  1157, or (iv) Asylee under 8 U.S.C.  1158, or be eligible to obtain the required authorizations from the U.S. Department of State. Learn more about the ITAR here.  

SpaceX is an Equal Opportunity Employer; employment with SpaceX is governed on the basis of merit, competence and qualifications and will not be influenced in any manner by race, color, religion, gender, national origin/ethnicity, veteran status, disability status, age, sexual orientation, gender identity, marital status, mental or physical disability or any other legally protected status.
Applicants wishing to view a copy of SpaceXs Affirmative Action Plan for veterans and individuals with disabilities, or applicants requiring reasonable accommodation to the application/interview process should reach out to EEOCompliance@spacex.com."
2899868,"Sr. NPI Engineer, PCBA Manufacturing (Starlink)","https://boards.greenhouse.io/spacex/jobs/7961531002?gh_jid=7961531002","SpaceX","Redmond","No",5,"Full time","2025-05-09T01:59:55.952169Z","SpaceX was founded under the belief that a future where humanity is out exploring the stars is fundamentally more exciting than one where we are not. Today SpaceX is actively developing the technologies to make this possible, with the ultimate goal of enabling human life on Mars.SR. NPI ENGINEER, PCBA MANUFACTURING (STARLINK)
At SpaceX were leveraging our experience in building rockets and spacecraft to deploy Starlink, the worlds most advanced broadband internet system. Starlink is the worlds largest satellite constellation and is providing fast, reliable internet to 5M+ users worldwide. We design, build, test, and operate all parts of the system  thousands of satellites, consumer receivers that allow users to connect within minutes of unboxing, and the software that brings it all together. Weve only begun to scratch the surface of Starlinks potential global impact and are looking for best-in-class engineers to help maximize Starlinks utility for communities and businesses around the globe.
As a Senior NPI engineer for PCBA Manufacturing you will be responsible for developing manufacturing processes for our next generation of satellite PCBAs. You will work closely with design and layout engineers to resolve manufacturing challenges and prepare the PCBA for volume manufacturing. This role will cover all PCBA process from the SMT line to secondary operations such as selective solder, X-ray, press fit, staking/underfill, and conformal coat.
RESPONSIBILITIES:

Manage new product introduction of PCBA assemblies, working closely with design engineers and process specialists. Developing and qualifying manufacturing processes.
Drive design feedback to improve manufacturability of PCBAs.
Manage work instructions, process documentation, and training
Identify trends and opportunities for optimizing product output, quality enhancements, and cost of manufacturability
Lead efforts to uncover root-cause and develop a permanent resolution on issues found during initial development builds
Support the transition of products from development to volume production and identify continuous improvement opportunities for yield, performance, and cost
Prepare and maintain documentation required to ensure efficient production. Participate in design reviews to conduct DFM and DFT recommendations with innovative and cost-effective solutions

BASIC QUALIFICATIONS:

Bachelor's degree in engineering discipline
5+ years of professional experience working in SMT or PCBA process engineering

PREFERRED SKILLS AND EXPERIENCE:

Hands on experience with optimizing SMT pick and place, reflow oven, conformal coating, or through hole soldering systems
High volume production experience (consumer goods, automotive, etc.)
Knowledge of statistical techniques and methods such as experiment design
Knowledge of IPC manufacturing standards
Experience with SQL, Python
Experience with Six Sigma
Experience with basic failure analysis tools and methods (X-ray, cross-section, polishing)
Excellent written and verbal communication skills
Demonstrated ability to gather, analyze, and use data to drive systemic improvements
Ability to work in a fast paced, autonomously driven, and demanding start-up atmosphere

ADDITIONAL REQUIREMENTS:

Ability to lift heavy objects, up to 25 Ibs unassisted
Extended hours and weekend work may be required to support critical project and mission milestones

COMPENSATION AND BENEFITS:
Pay range:          
NPI Engineer/Senior: $130,000.00 - $180,000.00/per year      
Your actual level and base salary will be determined on a case-by-case basis and may vary based on the following considerations: job-related knowledge and skills, education, and experience.
Base salary is just one part of your total rewards package at SpaceX. You may also be eligible for long-term incentives, in the form of company stock, stock options, or long-term cash awards, as well as potential discretionary bonuses and the ability to purchase additional stock at a discount through an Employee Stock Purchase Plan. You will also receive access to comprehensive medical, vision, and dental coverage, access to a 401(k) retirement plan, short and long-term disability insurance, life insurance, paid parental leave, and various other discounts and perks. You may also accrue 3 weeks of paid vacation and will be eligible for 10 or more paid holidays per year. Employees in Washington State accrue paid sick time in compliance with state and federal law. Company shuttles are offered to employees for roundtrip travel from select Seattle locations to the SpaceX Redmond office Monday to Friday.ITAR REQUIREMENTS:

To conform to U.S. Government export regulations, applicant must be a (i) U.S. citizen or national, (ii) U.S. lawful, permanent resident (aka green card holder), (iii) Refugee under 8 U.S.C.  1157, or (iv) Asylee under 8 U.S.C.  1158, or be eligible to obtain the required authorizations from the U.S. Department of State. Learn more about the ITAR here.  

SpaceX is an Equal Opportunity Employer; employment with SpaceX is governed on the basis of merit, competence and qualifications and will not be influenced in any manner by race, color, religion, gender, national origin/ethnicity, veteran status, disability status, age, sexual orientation, gender identity, marital status, mental or physical disability or any other legally protected status.
Applicants wishing to view a copy of SpaceXs Affirmative Action Plan for veterans and individuals with disabilities, or applicants requiring reasonable accommodation to the application/interview process should reach out to EEOCompliance@spacex.com."
2899867,"Production Coordinator - 1st Shift","https://boards.greenhouse.io/spacex/jobs/7982374002?gh_jid=7982374002","SpaceX","Van","No",1,"Full time","2025-05-09T01:59:55.952196Z","SpaceX was founded under the belief that a future where humanity is out exploring the stars is fundamentally more exciting than one where we are not. Today SpaceX is actively developing the technologies to make this possible, with the ultimate goal of enabling human life on Mars.PRODUCTION COORDINATOR - 1ST SHIFT
This role is responsible for serving as a liaison between all ancillary input and output organizations to ensure that components and assemblies flow smoothly through the production areas to meet stringent deadlines and quality standards.
RESPONSIBILITIES:

Create inventory requests based on production work orders and replacement parts
Maintain production schedules through the coordination of planning and shortage management in the production build
Ensure parts are handled and protected properly and within SpaceX specifications
Interface with engineers and technicians on the release of work orders for build
Reconciliation of work order bill of material quantities
Maintain a high integrity in regards to company computer systems per procedures
Assist with resolution of incorrect system data which is driving inappropriate demand, schedules, or could result in general failure
Verify all material received for conformity with accompanying paperwork, checking for damage, correct part numbers, quantity and revisions prior to release of work orders to production
Work with production customers for priority and schedule requirements
Assist materials management leadership and project teams with action item updates as required
Communicate part status and estimated completion dates to leadership upon request
Assist production teams in corrective actions
Support logistics process through innovative staging of workflow
Perform de-kitting operations and own the return to stock process
Support productivity improvement

BASIC QUALIFICATIONS:

High school diploma or equivalency certificate
1+ years of supply chain or manufacturing experience

PREFERRED SKILLS AND EXPERIENCE:

Strong computer skills, fluent with the suite of Microsoft office products
Bachelors degree
Organizational skills
Proficiency with MRP/ERP systems
Experience in aerospace or electronic manufacturing environments
APICS certification

ADDITIONAL REQUIREMENTS:

Ability to pass Air Force background check for Vandenberg Space Force Base
Ability to work the following shift and overtime as needed:

Weekday 1st shift: Monday - Friday from 6:00am - 4:30pm


Available for overtime as the schedule varies depending on site operational needs; flexibility required
Valid drivers license
The ability to lift heavy objects is required in this position (up to 50 lbs. unassisted)
Able to work at elevated heights
Able to work in extreme outdoor environments  heat, cold, rain, etc.
Able to work in an environment requiring exposure to fumes, odors, and noise
Able to and available for travel (up to 20% of time), including military and government installations

COMPENSATION &amp; BENEFITS:
Pay range:
Production Coordinator/Level 1: $22.00 - $25.25/hourProduction Coordinator/Level 2: $24.75 - $29.75/hourProduction Coordinator/Level 3: $27.50 - $33.00/hour
Your actual level and base salary will be determined on a case-by-case basis and may vary based on the following considerations: job-related knowledge and skills, education, and experience.
Base salary is just one part of your total rewards package at SpaceX. You may also be eligible for long-term incentives, in the form of company stock, stock options, or long-term cash awards, as well as potential discretionary bonuses and the ability to purchase additional stock at a discount through an Employee Stock Purchase Plan. You will also receive access to comprehensive medical, vision, and dental coverage, access to a 401(k) retirement plan, short &amp; long-term disability insurance, life insurance, paid parental leave, and various other discounts and perks. You may also accrue 3 weeks of paid vacation &amp; will be eligible for 10 or more paid holidays per year.ITAR REQUIREMENTS:

To conform to U.S. Government export regulations, applicant must be a (i) U.S. citizen or national, (ii) U.S. lawful, permanent resident (aka green card holder), (iii) Refugee under 8 U.S.C.  1157, or (iv) Asylee under 8 U.S.C.  1158, or be eligible to obtain the required authorizations from the U.S. Department of State. Learn more about the ITAR here.  

SpaceX is an Equal Opportunity Employer; employment with SpaceX is governed on the basis of merit, competence and qualifications and will not be influenced in any manner by race, color, religion, gender, national origin/ethnicity, veteran status, disability status, age, sexual orientation, gender identity, marital status, mental or physical disability or any other legally protected status.
Applicants wishing to view a copy of SpaceXs Affirmative Action Plan for veterans and individuals with disabilities, or applicants requiring reasonable accommodation to the application/interview process should reach out to EEOCompliance@spacex.com."
2899866,"Plasma Cutting System Operator/Programmer","https://boards.greenhouse.io/spacex/jobs/7985553002?gh_jid=7985553002","SpaceX","Starbase, TX","No",3,"Full time","2025-05-09T01:59:55.952223Z","SpaceX was founded under the belief that a future where humanity is out exploring the stars is fundamentally more exciting than one where we are not. Today SpaceX is actively developing the technologies to make this possible, with the ultimate goal of enabling human life on Mars.PLASMA CUTTING SYSTEM OPERATOR/PROGRAMMER
Work as part of a fabrication team of elite individuals building and improving the mechanical systems at our rocket launch facilities. Be there on the ground floor, getting your hands dirty and contributing directly to the success of future launches. The ideal candidate will operate, maintain, and repair computer numerical control (CNC) controlled plasma cutting systems.
RESPONSIBILITIES:

Program and operate a plasma cutter
Program and set up using proper gasses and cutting tips
Generate multiple part nestings and print layouts
Troubleshoot program, offset, and condition settings and adjust corrections
Work in accordance with established safety rules and good housekeeping practices
Work on additional equipment or tasks outside the job description as directed by the floor supervisor for production needs or continuous improvement
Perform weekly, monthly, and quarterly maintenance on equipment
Report inventory levels to the supervisor to keep an adequate stock of consumables and gasses
Accurately record time and production numbers daily and report scrap

BASIC QUALIFICATIONS:

High school diploma or equivalency certificate
3+ years of experience programming and operating a CNC-controlled plasma cutting system
Experience with overhead cranes, basic hand tools, tape measures, calipers, micrometers, or air grinders

PREFERRED SKILLS AND EXPERIENCE:

Experience using Hypertherm Automation EDGE CNC controller and the full Hypertherm suite: True Hole, True Bevel, Rapid Part, Nesting, Pro-Nest 2023 software and Collision Avoidance
Experience with NX/Teamcenter or MasterCam
Experience with flame cutting with a conventional oxyfuel torch
Able to navigate documentation from production records and databases
Able to identify material types and thickness as associated with work orders
Able to problem-solve cut quality issues
Experience programming 5-axis bevel heads
Able to read and interpret blueprints and understand part tolerances per print specification
Experience with .DXF, .DWG and various print file types

ADDITIONAL REQUIREMENTS:

Valid drivers license
Must be able to drive a forklift and safely handle materials
The ability to lift heavy objects is required in this position (up to 25lbs unassisted)
Must be able in extreme outdoor environments  heat, cold, rain, etc.
Must be able to work in an environment requiring exposure to fumes, odors, and noise
Must be available for overtime and weekends depending on site operational needs; flexibility is required
ITAR REQUIREMENTS:

To conform to U.S. Government export regulations, applicant must be a (i) U.S. citizen or national, (ii) U.S. lawful, permanent resident (aka green card holder), (iii) Refugee under 8 U.S.C.  1157, or (iv) Asylee under 8 U.S.C.  1158, or be eligible to obtain the required authorizations from the U.S. Department of State. Learn more about the ITAR here.  

SpaceX is an Equal Opportunity Employer; employment with SpaceX is governed on the basis of merit, competence and qualifications and will not be influenced in any manner by race, color, religion, gender, national origin/ethnicity, veteran status, disability status, age, sexual orientation, gender identity, marital status, mental or physical disability or any other legally protected status.
Applicants wishing to view a copy of SpaceXs Affirmative Action Plan for veterans and individuals with disabilities, or applicants requiring reasonable accommodation to the application/interview process should reach out to EEOCompliance@spacex.com."
