"ID","Title","Link","Company","Location","Remote","Experience","EmploymentType","DatePosted","RoleDescription"
2905195,"Transfer Pricing Manager","https://boards.greenhouse.io/spacex/jobs/7985853002?gh_jid=7985853002","SpaceX","Hawthorne","No",6,"Full time","2025-05-09T01:59:55.951761Z","SpaceX was founded under the belief that a future where humanity is out exploring the stars is fundamentally more exciting than one where we are not. Today SpaceX is actively developing the technologies to make this possible, with the ultimate goal of enabling human life on Mars.TRANSFER PRICING MANAGER
At SpaceX, we are leveraging our experience in building rockets and spacecraft to deploy Starlink, the worlds most advanced broadband internet system. Starlink is the worlds largest satellite constellation and is providing fast, reliable internet to 5M+ users worldwide. We design, build, test, and operate all parts of the system  thousands of satellites, consumer receivers that allow users to connect within minutes of unboxing, and the software that brings it all together. Weve only begun to scratch the surface of Starlinks potential global impact and are looking for a transfer pricing manager to join our tax team. The role will require providing transfer pricing support, including but not limited to compliance, audits, provision, and planning, etc.
RESPONSIBILITIES: 

Manage global transfer pricing compliance and documentation
Support the preparation and review of statutory financial statements, tax return filings, and external audits from a transfer pricing perspective    
Demonstrate and apply relevant technical knowledge of transfer pricing rules and regulations to intercompany transactions
Work closely and partner with other stakeholders in the tax department, finance, legal, business operations, and external advisors on various transfer pricing related matters
Contribute to operational aspects of transfer pricing, including planning, implementation, monitoring, maintenance, and process improvements
Proactively identify transfer pricing issues and regulatory changes that impact the company operations and financial positions

BASIC QUALIFICATIONS:

Bachelors degree in accounting, finance, business or STEM
6+ years of combined work experience in transfer pricing and tax with a Big 4 accounting firm or with a multinational company

PREFERRED SKILLS AND EXPERIENCE:

Solid understanding of the OECD transfer pricing guidelines and US specific rules and regulations
Ample experience with managing global transfer pricing projects across multiple countries and regions
Detail-oriented with solid organizational skills and analytical and problem-solving skills
Excellent communication skills (written, verbal, technical, and non-technical)
Proficient in use of Excel, Word, and PowerPoint
Self-starter with the ability to operate independently and manage multiple competing priorities and deadlines effectively

ADDITIONAL REQUIREMENTS: 

Willingness to work long hours and weekends when needed to meet critical deadlines
This position is based in Hawthorne, CA, and requires being onsite - remote/hybrid work will not be considered

COMPENSATION AND BENEFITS:             
Pay range:          Transfer Pricing Manager: $130,000.00 - $180,000.00/per year   
Your actual level and base salary will be determined on a case-by-case basis and may vary based on the following considerations: job-related knowledge and skills, education, and experience.
Base salary is just one part of your total rewards package at SpaceX. You may also be eligible for long-term incentives, in the form of company stock, stock options, or long-term cash awards, as well as potential discretionary bonuses and the ability to purchase additional stock at a discount through an Employee Stock Purchase Plan. You will also receive access to comprehensive medical, vision, and dental coverage, access to a 401(k) retirement plan, short and long-term disability insurance, life insurance, paid parental leave, and various other discounts and perks. You may also accrue 3 weeks of paid vacation and will be eligible for 10 or more paid holidays per year. Employees accrue paid sick leave pursuant to Company policy which satisfies or exceeds the accrual, carryover, and use requirements of the law.ITAR REQUIREMENTS:

To conform to U.S. Government export regulations, applicant must be a (i) U.S. citizen or national, (ii) U.S. lawful, permanent resident (aka green card holder), (iii) Refugee under 8 U.S.C.  1157, or (iv) Asylee under 8 U.S.C.  1158, or be eligible to obtain the required authorizations from the U.S. Department of State. Learn more about the ITAR here.  

SpaceX is an Equal Opportunity Employer; employment with SpaceX is governed on the basis of merit, competence and qualifications and will not be influenced in any manner by race, color, religion, gender, national origin/ethnicity, veteran status, disability status, age, sexual orientation, gender identity, marital status, mental or physical disability or any other legally protected status.
Applicants wishing to view a copy of SpaceXs Affirmative Action Plan for veterans and individuals with disabilities, or applicants requiring reasonable accommodation to the application/interview process should reach out to EEOCompliance@spacex.com."
2905194,"Sr. Sales Manager, LatAm (Starlink Enterprise Sales) ","https://boards.greenhouse.io/spacex/jobs/7985399002?gh_jid=7985399002","SpaceX","Remote - FL","Yes",7,"Full time","2025-05-09T01:59:55.951797Z","SpaceX was founded under the belief that a future where humanity is out exploring the stars is fundamentally more exciting than one where we are not. Today SpaceX is actively developing the technologies to make this possible, with the ultimate goal of enabling human life on Mars.SR. SALES MANAGER, LATIN AMERICA (STARLINK ENTERPRISE SALES)
The Starlink Enterprise Sales team is hiring a local, results driven Sr. Sales Manager to support Starlinks adoption across Latin America. Starlink brings an unprecedented opportunity to significantly impact communities, businesses, and governments worldwide. The role requires personal drive to identify opportunities in your region, develop the necessary relationships, and ultimately sign deals that will have immediate impact. 
RESPONSIBILITIES:

Meet your revenue targets  you should always be looking for opportunities for Starlink to make an impact and always be closing. 
Identify and secure new enterprise customers directly. This requires the establishment of relationships with the key decision makers and influencers in the various organizations, understanding their current and future needs, and working to find the right Starlink product for them. 
Identify opportunities for alternative go-to-market strategies and be able to defend them internally. 
Work in partnership with our market access, government affairs, finance and legal teams.
Gather customer requirements and work with the product engineering team to iterate on and improve Starlink product offerings.
Represent Starlink at regional conferences and events.

BASIC REQUIREMENTS:

Bachelors degree.
5+ years of professional experience in business development or sales.
Fluent in English with multi-lingual proficiency in Portuguese and/or Spanish.

PREFERRED SKILLS AND EXPERIENCE:

Strong sales track record with the ability to consistently meet or exceed revenue targets  preferably in the satellite/telecommunications sector for enterprise or government customers.
7+ years of professional experience in enterprise sales.
5+ years of enterprise technology direct sales experience.
Strong interpersonal, presentation, and negotiation skills.
Strong analytical skills in business and technical issues.
Highly detail oriented, diligent, and hard working with excellent customer interface skills.
Sufficient knowledge of Starlinks network infrastructure to communicate to customers.
Experience working with cross-functional teams and external customers.

ADDITIONAL REQUIREMENTS:

Must be available to work extended hours and weekends as needed.
Willingness to travel approximately 50% of the time including to customer locations and other SpaceX locations.
ITAR REQUIREMENTS:

To conform to U.S. Government export regulations, applicant must be a (i) U.S. citizen or national, (ii) U.S. lawful, permanent resident (aka green card holder), (iii) Refugee under 8 U.S.C.  1157, or (iv) Asylee under 8 U.S.C.  1158, or be eligible to obtain the required authorizations from the U.S. Department of State. Learn more about the ITAR here.  

SpaceX is an Equal Opportunity Employer; employment with SpaceX is governed on the basis of merit, competence and qualifications and will not be influenced in any manner by race, color, religion, gender, national origin/ethnicity, veteran status, disability status, age, sexual orientation, gender identity, marital status, mental or physical disability or any other legally protected status.
Applicants wishing to view a copy of SpaceXs Affirmative Action Plan for veterans and individuals with disabilities, or applicants requiring reasonable accommodation to the application/interview process should reach out to EEOCompliance@spacex.com."
2905192,"Sr. Intelligence Analyst","https://boards.greenhouse.io/spacex/jobs/7983905002?gh_jid=7983905002","SpaceX","Washington","No",6,"Full time","2025-05-09T01:59:55.951824Z","SpaceX was founded under the belief that a future where humanity is out exploring the stars is fundamentally more exciting than one where we are not. Today SpaceX is actively developing the technologies to make this possible, with the ultimate goal of enabling human life on Mars.SR. INTELLIGENCE ANALYST
SpaceX is seeking a dynamic and driven individual with a demonstrated ability to work independently and as a member of a team in a fast-paced, high tech environment. Our goal is to protect some of the worlds most advanced technologies including: rockets, Dragon capsules for human transport, inter-planetary transport vehicles, the world's largest satellite communications network, etc. As an industry leader, we are a target of adversaries, both foreign and domestic, focused on slowing us down and accessing our proprietary technology. The work we do will safeguard mankind becoming an interplanetary species.
You will be responsible for the research, analysis, production, and dissemination of information relevant to protecting the safety and security of personnel, brand, global assets, and operations at SpaceX. This role is also responsible for supporting certain investigations and research efforts, either stemming from intelligence conducted or through other escalation protocols, and actioning findings. You will use comprehensive understanding of various collection methods and platforms to explore new data sources, build effective queries, and combine information from disparate sources.
RESPONSIBILITIES:

Conduct in-depth research, evaluation, analysis, integration, and interpretation of information sourced from various open channels
Produce high-quality intelligence products on a daily, weekly, and monthly basis, including briefings and analytical papers
Produce in-depth corporate due diligence reports to identify compliance and regulatory risks of current and prospective suppliers
Identify emergent risks to the company, our technology, and people and quickly synthesize information to share with relevant stakeholders
Communicate findings effectively and accurately to team members, management, and relevant stakeholders
Prepare and deliver briefings and presentations on areas of focus and expertise
Navigate various social media platforms and OSINT tools proficiently and adapt quickly to new and emerging platforms and technologies
Maintain meticulous organization of ongoing and completed research, ensuring accessibility for self and others
Facilitate information sharing by fostering relationships and partnering with internal stakeholder groups as well as external local and federal law enforcement
Conduct intelligence analysis, threat assessment and analysis, and investigations on persons and groups of interest to determine whether they pose a threat, including interviews and data analysis
Manage and safeguard sensitive information, including case files and intelligence reports

BASIC QUALIFICATIONS:

Bachelor's degree and 4+ years of professional experience in intelligence, investigative, and/or forensic psychology; OR 6+ years professional experience in intelligence, investigative, and/or forensic psychology in lieu of a degree

PREFERRED SKILLS AND EXPERIENCE:

Strong analytical skills with the ability to interpret complex information and draw actionable insights
Experience conducting corporate due diligence and supporting a supply chain risk management (SCRM) program
Practical experience employing the Intelligence Cycle and Structured Analytical Techniques
Excellent written and oral communication skills, with the ability to produce clear and concise research reports
Ability to work independently as well as collaboratively within a team environment in a fast-paced, high-tech environment
Highly organized with a strong attention to detail
Ability to adapt to changing priorities and deadlines
Proficiency in Microsoft Office Suite and familiarity with social media monitoring tools, open source intelligence gathering, including web-based social medial platforms, online search tools, applications, and communications technology
Active TS/SCI clearance, or ability to obtain one
Highly collaborative with a great degree of emotional intelligence and maturity

ADDITIONAL REQUIREMENTS:

Must be willing to travel ad hoc, although only minimal travel is expected at this time
Candidates will be subject to pre-employment screening including background check and drug/alcohol test as well as random drug and alcohol testing during employment

COMPENSATION AND BENEFITS:        Pay range:    
Sr. Intelligence Analyst: $110,000.00 - $145,000.00/per year
Your actual level and base salary will be determined on a case-by-case basis and may vary based on the following considerations: job-related knowledge and skills, education, and experience. Those with an active clearance will receive a 10% differential, up to an additional $15,000 annually, once officially briefed into a classified program.
Base salary is just one part of your total rewards package at SpaceX. You may also be eligible for long-term incentives, in the form of company stock, stock options, or long-term cash awards, as well as potential discretionary bonuses and the ability to purchase additional stock at a discount through an Employee Stock Purchase Plan. You will also receive access to comprehensive medical, vision, and dental coverage, access to a 401(k) retirement plan, short and long-term disability insurance, life insurance, paid parental leave, and various other discounts and perks. You may also accrue 3 weeks of paid vacation and will be eligible for 10 or more paid holidays per year. Employees accrue paid sick leave pursuant to Company policy which satisfies or exceeds the accrual, carryover, and use requirements of the law.ITAR REQUIREMENTS:

To conform to U.S. Government export regulations, applicant must be a (i) U.S. citizen or national, (ii) U.S. lawful, permanent resident (aka green card holder), (iii) Refugee under 8 U.S.C.  1157, or (iv) Asylee under 8 U.S.C.  1158, or be eligible to obtain the required authorizations from the U.S. Department of State. Learn more about the ITAR here.  

SpaceX is an Equal Opportunity Employer; employment with SpaceX is governed on the basis of merit, competence and qualifications and will not be influenced in any manner by race, color, religion, gender, national origin/ethnicity, veteran status, disability status, age, sexual orientation, gender identity, marital status, mental or physical disability or any other legally protected status.
Applicants wishing to view a copy of SpaceXs Affirmative Action Plan for veterans and individuals with disabilities, or applicants requiring reasonable accommodation to the application/interview process should reach out to EEOCompliance@spacex.com."
2905189,"Sr. Intelligence Analyst","https://boards.greenhouse.io/spacex/jobs/7983519002?gh_jid=7983519002","SpaceX","Hawthorne","No",6,"Full time","2025-05-09T01:59:55.951851Z","SpaceX was founded under the belief that a future where humanity is out exploring the stars is fundamentally more exciting than one where we are not. Today SpaceX is actively developing the technologies to make this possible, with the ultimate goal of enabling human life on Mars.SR. INTELLIGENCE ANALYST
SpaceX is seeking a dynamic and driven individual with a demonstrated ability to work independently and as a member of a team in a fast-paced, high tech environment. Our goal is to protect some of the worlds most advanced technologies including: rockets, Dragon capsules for human transport, inter-planetary transport vehicles, the world's largest satellite communications network, etc. As an industry leader, we are a target of adversaries, both foreign and domestic, focused on slowing us down and accessing our proprietary technology. The work we do will safeguard mankind becoming an interplanetary species.
You will be responsible for the research, analysis, production, and dissemination of information relevant to protecting the safety and security of personnel, brand, global assets, and operations at SpaceX. This role is also responsible for supporting certain investigations and research efforts, either stemming from intelligence conducted or through other escalation protocols, and actioning findings. You will use comprehensive understanding of various collection methods and platforms to explore new data sources, build effective queries, and combine information from disparate sources.
RESPONSIBILITIES:

Conduct in-depth research, evaluation, analysis, integration, and interpretation of information sourced from various open channels
Produce high-quality intelligence products on a daily, weekly, and monthly basis, including briefings and analytical papers
Produce in-depth corporate due diligence reports to identify compliance and regulatory risks of current and prospective suppliers
Identify emergent risks to the company, our technology, and people and quickly synthesize information to share with relevant stakeholders
Communicate findings effectively and accurately to team members, management, and relevant stakeholders
Prepare and deliver briefings and presentations on areas of focus and expertise
Navigate various social media platforms and OSINT tools proficiently and adapt quickly to new and emerging platforms and technologies
Maintain meticulous organization of ongoing and completed research, ensuring accessibility for self and others
Facilitate information sharing by fostering relationships and partnering with internal stakeholder groups as well as external local and federal law enforcement
Conduct intelligence analysis, threat assessment and analysis, and investigations on persons and groups of interest to determine whether they pose a threat, including interviews and data analysis
Manage and safeguard sensitive information, including case files and intelligence reports

BASIC QUALIFICATIONS:

Bachelor's degree and 4+ years of professional experience in intelligence, investigative, and/or forensic psychology; OR 6+ years professional experience in intelligence, investigative, and/or forensic psychology in lieu of a degree

PREFERRED SKILLS AND EXPERIENCE:

Strong analytical skills with the ability to interpret complex information and draw actionable insights
Experience conducting corporate due diligence and supporting a supply chain risk management (SCRM) program
Practical experience employing the Intelligence Cycle and Structured Analytical Techniques
Excellent written and oral communication skills, with the ability to produce clear and concise research reports
Ability to work independently as well as collaboratively within a team environment in a fast-paced, high-tech environment
Highly organized with a strong attention to detail
Ability to adapt to changing priorities and deadlines
Proficiency in Microsoft Office Suite and familiarity with social media monitoring tools, open source intelligence gathering, including web-based social medial platforms, online search tools, applications, and communications technology
Active TS/SCI clearance, or ability to obtain one
Highly collaborative with a great degree of emotional intelligence and maturity

ADDITIONAL REQUIREMENTS:

Must be willing to travel ad hoc, although only minimal travel is expected at this time
Subject to pre-employment screening including background check and drug/alcohol test as well as random drug and alcohol testing during employment

COMPENSATION AND BENEFITS:        Pay range:    
Sr. Intelligence Analyst: $110,000.00 - $145,000.00/per year
Your actual level and base salary will be determined on a case-by-case basis and may vary based on the following considerations: job-related knowledge and skills, education, and experience. Those with an active clearance will receive a 10% differential, up to an additional $15,000 annually, once officially briefed into a classified program.
Base salary is just one part of your total rewards package at SpaceX. You may also be eligible for long-term incentives, in the form of company stock, stock options, or long-term cash awards, as well as potential discretionary bonuses and the ability to purchase additional stock at a discount through an Employee Stock Purchase Plan. You will also receive access to comprehensive medical, vision, and dental coverage, access to a 401(k) retirement plan, short and long-term disability insurance, life insurance, paid parental leave, and various other discounts and perks. You may also accrue 3 weeks of paid vacation and will be eligible for 10 or more paid holidays per year. Employees accrue paid sick leave pursuant to Company policy which satisfies or exceeds the accrual, carryover, and use requirements of the law.ITAR REQUIREMENTS:

To conform to U.S. Government export regulations, applicant must be a (i) U.S. citizen or national, (ii) U.S. lawful, permanent resident (aka green card holder), (iii) Refugee under 8 U.S.C.  1157, or (iv) Asylee under 8 U.S.C.  1158, or be eligible to obtain the required authorizations from the U.S. Department of State. Learn more about the ITAR here.  

SpaceX is an Equal Opportunity Employer; employment with SpaceX is governed on the basis of merit, competence and qualifications and will not be influenced in any manner by race, color, religion, gender, national origin/ethnicity, veteran status, disability status, age, sexual orientation, gender identity, marital status, mental or physical disability or any other legally protected status.
Applicants wishing to view a copy of SpaceXs Affirmative Action Plan for veterans and individuals with disabilities, or applicants requiring reasonable accommodation to the application/interview process should reach out to EEOCompliance@spacex.com."
