"ID","Title","Link","Company","Location","Remote","Experience","EmploymentType","DatePosted","RoleDescription"
3001268,"Medior Data Scientist / ML Engineer","https://jobs.smartrecruiters.com/SopraSteria1/744000061208611-medior-data-scientist-ml-engineer","Steria","Groningen","Yes","Not specified","Full time","2025-05-25T02:10:52.421495Z","Je kan waardevolle inzichten halen uit grote datasets. Als Data Scientist ontfutsel je deze door je vloeiend kennis van programmeertalen als Python en R en visualisatietools als Tableau en PowerBI. Je kan die inzichten communiceren naar stakeholders zodat ze de nodige stappen kunnen zetten. Onze data scientists zijn vaardig in Hadoop &amp; Spark en cloudplatformen als AWS en Azure. Deze tools  samen met je data expertise  zorgen ervoor dat het bouwen van voorspellende modellen, het uitvoeren van hypothesis tests en het uitvoeren van verkennende data-analyse je heel natuurlijk af gaan.Als Data Engineer zal je:ruwe data omzetten in bruikbare inzichten enschaalbare oplossingenje richten op het ontwerp en de optimalisatievan data-infrastructuurprocessen automatiserenzorgen voor een naadloze levering van datamicroservices ontwikkelen om data lakestoegankelijker en nuttiger te makenJe zoekt steeds naar innovatieve manieren om de schaalbaarheid en bruikbaarheid van data te verbeteren. Van de eerste conceptontwikkeling tot de uiteindelijke implementatiejij ontwikkelt en implementeert data oplossingen die sterke resultaten opleveren en de strategische doelen van onze klanten ondersteunen.We zijn op zoek naar gepassioneerde collegas die graag de grenzen willen verleggen op het gebied van digitale transformatie en technologie consulting. Bij Sopra Steria krijg je de kans om te werken aan impactvolle projecten en je vaardigheden te ontwikkelen in een constructieve teamomgeving. Jij wilt tot de besten behoren. Dat is waarom jij altijd naar manieren zoekt om jouw kennis uit te breiden en op de hoogte te blijven van de laatste trends en ontwikkelingen. Hou je van een uitdaging en vind je jezelf in (de meeste van) deze criteria? Dan kijken we nu al uit naar jouw sollicitatie.Type werk: HybridLocatie: Groningen, NLContracturen: 36-40Type contract: VastOpleiding: HBO, WO, PhDErvaring: 3-4 jaarTalen: NederlandsJe hebt kennis van of ervaring in:Need: Python, SQL, cloud platform (Azure, AWS, GCP), git, dockerNice to have: BI, R, Databricks, wiskundige optimalisatie, Specialisatie(e.g. Tabular ML, Computer vision, NLP, Deep Learning), MLOps/devOps, Verantwoorde AI kennis, big data/distributed computing, ETL/ELT, Presentatie vaardighedenJe zal deel uitmaken van een grote naam in de tech wereld die bekend is om consulting, digitale diensten en softwareontwikkeling. Je begeeft je tussen high-level professionals die durven in te zetten om hoge resultaten te behalen.Je zal deel uitmaken van een grote naam in de tech wereld die bekend is om consulting, digitale diensten en softwareontwikkeling. Je begeeft je tussen high-level professionals die durven in te zetten om hoge resultaten te behalen.Bij Sopra Steria zorgen we ervoor dat jij je werk met plezier n in balans kunt doen. Daarom bieden we een aantrekkelijk en flexibel pakket aan arbeidsvoorwaarden: Een vast contract. Vakantiegeld van 8%; Een royaal mobiliteitsbudget in de vorm van een leaseregeling met dekeuze uit een elektrische leaseauto met NS Business Card of leasefiets of een alternatief vervoersregeling  net wat het beste bij jouw manier van reizen past; Winstdeling van 8% on target (of OTB vast bedrag, afhankelijk van de functie); 27 betaalde vakantiedagen; Flex benefit van  1.800, - per jaar met daar bovenop een extra percentage van jouw salaris. Dit budget kan    worden gebruikt voor zaken als aankoop van extra vrije dagen of extra sparen in jouw pensioenregeling; Thuiskantoor met laptop, telefoon en een maandelijkse internetvergoeding; Hybride werken: thuis of op kantoor, afhankelijk van wat jij nodig hebt; Ontwikkelmogelijkheden via trainingen, kennisdelingssessies en inspirerende (netwerk)events; Sociale activiteiten met collegas  van gezellige borrels tot sportieve of inhoudelijke uitjes; Een flexibele pensioenregeling, waaraan jij op maat en passend bij jou, bijdragen kan toevoegen. Je kunt deelnemen aan de collectieve zorgverzekering. Lijkt deze job iets voor jou?Ben je klaar om met ons de wereld vorm te geven? Fantastisch! We kijken nu al uit naar jouw sollicitatie.______Sopra Steria is een werkgever die gelijke kansen biedt. Alle gekwalificeerde sollicitanten worden in aanmerking genomen voor een job zonder rekening te houden met leeftijd, afkomst, nationaliteit, huidskleur, verlof voor familie- of medische zorg, geslachtsidentiteit of -uitdrukking, genetische informatie, immigratiestatus, burgerlijke staat, medische toestand, nationale herkomst, fysieke of mentale handicap, politieke voorkeur, beschermde veteranen- of militaire status, ras, etniciteit, religie, geslacht (inclusief zwangerschap), seksuele geaardheid of enig ander kenmerk dat wordt beschermd door toepasselijke lokale wetten, voorschriften en verordeningen. We koesteren een werkomgeving die inclusief is en alle verschillen respecteert."
3001267,"Senior Data scientist / ML Engineer","https://jobs.smartrecruiters.com/SopraSteria1/744000061211360-senior-data-scientist-ml-engineer","Steria","Groningen","Yes","Not specified","Full time","2025-05-25T02:10:52.421573Z","Je kan waardevolle inzichten halen uit grote datasets. Als Data Scientist ontfutsel je deze door je vloeiend kennis van programmeertalen als Python en R en visualisatietools als Tableau en PowerBI. Je kan die inzichten communiceren naar stakeholders zodat ze de nodige stappen kunnen zetten. Onze data scientists zijn vaardig in Hadoop &amp; Spark en cloudplatformen als AWS en Azure. Deze tools  samen met je data expertise  zorgen ervoor dat het bouwen van voorspellende modellen, het uitvoeren van hypothesis tests en het uitvoeren van verkennende data-analyse je heel natuurlijk af gaan.Als Data Engineer zal je:ruwe data omzetten in bruikbare inzichten enschaalbare oplossingenje richten op het ontwerp en de optimalisatievan data-infrastructuurprocessen automatiserenzorgen voor een naadloze levering van datamicroservices ontwikkelen om data lakestoegankelijker en nuttiger te makenJe zoekt steeds naar innovatieve manieren om de schaalbaarheid en bruikbaarheid van data te verbeteren. Van de eerste conceptontwikkeling tot de uiteindelijke implementatiejij ontwikkelt en implementeert data oplossingen die sterke resultaten opleveren en de strategische doelen van onze klanten ondersteunen.We zijn op zoek naar gepassioneerde collegas die graag de grenzen willen verleggen op het gebied van digitale transformatie en technologie consulting. Bij Sopra Steria krijg je de kans om te werken aan impactvolle projecten en je vaardigheden te ontwikkelen in een constructieve teamomgeving. Jij wilt tot de besten behoren. Dat is waarom jij altijd naar manieren zoekt om jouw kennis uit te breiden en op de hoogte te blijven van de laatste trends en ontwikkelingen. Hou je van een uitdaging en vind je jezelf in (de meeste van) deze criteria? Dan kijken we nu al uit naar jouw sollicitatie.Type werk: HybridLocatie: Groningen, NLContracturen: 36-40Type contract: VastOpleiding: HBO, WO, PhDErvaring: 7+ jaarTalen: NederlandsJe hebt kennis en ervaring in:Need: Python, SQL, cloud platform (Azure, AWS, GCP), git, docker, Specialisatie(e.g. Tabular ML, Computer vision, NLP, Deep Learning), coaching, project management, Verantwoorde AI kennis, MLOps/DevOpsNice to have: BI, R, Databricks, wiskundige optimalisatie, big data/distributed computing, ETL/ELT, Presentatie vaardighedenJe zal deel uitmaken van een grote naam in de tech wereld die bekend is om consulting, digitale diensten en softwareontwikkeling. Je begeeft je tussen high-level professionals die durven in te zetten om hoge resultaten te behalen.Bij Sopra Steria zorgen we ervoor dat jij je werk met plezier n in balans kunt doen. Daarom bieden we een aantrekkelijk en flexibel pakket aan arbeidsvoorwaarden: Een vast contract. Vakantiegeld van 8%; Een royaal mobiliteitsbudget in de vorm van een leaseregeling met dekeuze uit een elektrische leaseauto met NS Business Card of leasefiets of een alternatief vervoersregeling  net wat het beste bij jouw manier van reizen past; Winstdeling van 8% on target (of OTB vast bedrag, afhankelijk van de functie); 27 betaalde vakantiedagen; Flex benefit van  1.800, - per jaar met daar bovenop een extra percentage van jouw salaris. Dit budget kan    worden gebruikt voor zaken als aankoop van extra vrije dagen of extra sparen in jouw pensioenregeling; Thuiskantoor met laptop, telefoon en een maandelijkse internetvergoeding; Hybride werken: thuis of op kantoor, afhankelijk van wat jij nodig hebt; Ontwikkelmogelijkheden via trainingen, kennisdelingssessies en inspirerende (netwerk)events; Sociale activiteiten met collegas  van gezellige borrels tot sportieve of inhoudelijke uitjes; Een flexibele pensioenregeling, waaraan jij op maat en passend bij jou, bijdragen kan toevoegen. Je kunt deelnemen aan de collectieve zorgverzekering. Lijkt deze job iets voor jou?Ben je klaar om met ons de wereld vorm te geven? Fantastisch! We kijken nu al uit naar jouw sollicitatie.______Sopra Steria is een werkgever die gelijke kansen biedt. Alle gekwalificeerde sollicitanten worden in aanmerking genomen voor een job zonder rekening te houden met leeftijd, afkomst, nationaliteit, huidskleur, verlof voor familie- of medische zorg, geslachtsidentiteit of -uitdrukking, genetische informatie, immigratiestatus, burgerlijke staat, medische toestand, nationale herkomst, fysieke of mentale handicap, politieke voorkeur, beschermde veteranen- of militaire status, ras, etniciteit, religie, geslacht (inclusief zwangerschap), seksuele geaardheid of enig ander kenmerk dat wordt beschermd door toepasselijke lokale wetten, voorschriften en verordeningen. We koesteren een werkomgeving die inclusief is en alle verschillen respecteert."
3001266,"Java Software Engineer","https://jobs.smartrecruiters.com/SopraSteria1/744000061215810-java-software-engineer","Steria","Sofia","No",3,"Full time","2025-05-25T02:10:52.421599Z","You develop clean code with Java (Spring, Spring Boot). SQL, PostgreSQL, OpenShiftYou support the introduction of CI / CD processes to increase the delivery speed of software solutionsYou analyze and solve problemsYou are a cornerstone for your team and are ready to share your knowledgeYou are a trusted partner to our customersYou have 3+ years experience with one of the following Java (Spring Boot, Spring), Microservice architectureYou are familiar with Unit testing, Clean code, Design patterns and SOLIDExperience with AWS is an advantageYou have participated in at least 1-2 commercial software projectsYou have a completed degree, or you are in the process of getting itYou have good communication skills and a Can-Do attitudeYou are fluent in English, knowing German language is a plusWhat we offer:Global project experience with significant impactContinuous professional and personal development opportunitiesSecure and supportive work environmentAn integral part of #OneTeam, fostering collective successBenefits:Competitive remuneration package26 days of annual paid leaveComprehensive health, life, and travel insuranceExtensive professional training programmesFlat organisational structureTeam events in Bulgaria and GermanyMultisport cards/vouchersModern office facilities are conveniently located at Metro Station G.M. Dimitrov Blvd.Application Process:We will conduct a thorough review of your application. We will contact you within the following week if we identify a mutual alignment of interests and a potential for collaboration. Please be advised that we dedicate considerable time to carefully assessing each application. We appreciate your patience and understanding during this process.At our organization, we are committed to fighting against all forms of discrimination. We foster a work environment that is inclusive and respectful of all differences.All of our positions are open to people with disabilities.At our organization, we are committed to fighting against all forms of discrimination. We foster a work environment that is inclusive and respectful of all differences.All of our positions are open to people with disabilities."
3001265,"Stage Data Management","https://jobs.smartrecruiters.com/SopraSteria1/744000061219125-stage-data-management","Steria","Collecchio","No","Not specified","Internship","2025-05-25T02:10:52.421618Z","Se anche tu vuoi dare forma al futuro con noi lavorando su importanti progetti per prestigiosi clienti e ti riconosci nel profilo, accetta la sfida e candidati! Stiamo cercando:Stage Data ManagementIL TUO RUOLO:Sarai inserito/a in un programma formativo, nel quale si alterneranno momenti di formazione in aula a momenti di formazione on the job.L'obiettivo del tirocinio  quello di acquisire nel tempo sempre pi autonomia, attraverso l'assegnazione di compiti e responsabilit crescenti, in affiancamento del tutor.Nellambito di questo percorso verrai inserito/a in un team di lavoro con cui affrontare progetti su cui potrai acquisire padronanza nelluso di DataBase, di software di analisi, elaborazione e presentazione dei dati, rudimenti Cloud.IL TUO PROFILO:Laurea in materie STEM (Ingegneria, Informatica, Matematica, Fisica, Statistica) o Diploma in materia InformaticaAttitudine ed interesse all'innovazione digitale in generaleOrientamento al risultato, pro-attivit, buone doti relazionali ed attitudine a lavorare in teamBuone capacit logiche, di analisi dei dati e attenzione per i dettagliEntusiasmo ed elevata motivazione alla crescita professionaleConoscenza della lingua IngleseLE TUE COMPETENZE:Costituisce titolo preferenziale l'aver gi utilizzato linguaggi di programmazione, la conoscenza del SQL e lutilizzo di DataBase relazionali.LA NOSTRA PROPOSTA:Ti offriamo lopportunit di lavorare in un ambiente dinamico, su progetti nazionali ed internazionali, che ti permetta di approfondire continuamente le tue conoscenze e di sviluppare le tue competenze.Se vuoi dare una spinta alla tua carriera ed entrare a far parte di una societ di servizi IT leader in Europa ed in continua crescita, inviaci il tuo curriculum!La sede di lavoro  Collecchio (PR)  con possibilit, compatibilmente con l'attivit svolta, di aderire allaccordo di smart working secondo quanto previsto dalla nostra policy aziendale. E comunque richiesta la disponibilit a compiere trasferte sul territorio nazionale e internazionale.Scopri Sopra Steria! Visita il nostro sito e rimani aggiornato attraverso il blog e le pagine social https://linktr.ee/SopraSteriaIl presente annuncio  rivolto ad entrambi i sessi, ai sensi delle leggi 903/77 e 125/91 e a persone di tutte le et e tutte le nazionalit, ai sensi dei decreti legislativi 215/03 e 216/03. Tutte le regole relative ai tuoi dati raccolti in questo modo sono dettagliate nell'Informativa sulla Protezione dei Dati dei Candidati (https://www.soprasteria.it/footer/protezione_dati_candidati).In conformit con la legislazione / i regolamenti vigenti in materia di tecnologia dell'informazione, documenti e libert civili, hai diritti di accesso, rettifica, cancellazione, portabilit, limitazione, opposizione e definizione di istruzioni riguardanti la sorte dei tuoi Dati personali dopo la tua morte. Questi diritti saranno esercitati inviando un'e-mail al responsabile della protezione dei dati (DPO) all'indirizzo DPO.Italia@soprasteria.com o per posta a questo indirizzo: Sopra Steria Group S.p.A. - Ufficio legale - Strada 4 Palazzo A7 - 20090 Assago (MI)Hai anche il diritto di presentare un reclamo Garante per la Protezione dei Dati Personali (Piazza di Monte Citorio n. 121 00186 Roma), se il titolare del trattamento non rispetta gli obblighi previsti dalla legislazione in vigoreIl presente annuncio  rivolto ad entrambi i sessi, ai sensi delle leggi 903/77 e 125/91 e a persone di tutte le et e tutte le nazionalit, ai sensi dei decreti legislativi 215/03 e 216/03.Tutte le regole relative ai tuoi dati raccolti in questo modo sono dettagliate nell'Informativa sulla Protezione dei Dati dei Candidati (https://www.soprasteria.it/footer/protezione_dati_candidati).
In conformit con la legislazione / i regolamenti vigenti in materia di tecnologia dell'informazione, documenti e libert civili, hai diritti di accesso, rettifica, cancellazione, portabilit, limitazione, opposizione e definizione di istruzioni riguardanti la sorte dei tuoi Dati personali dopo la tua morte. Questi diritti saranno esercitati inviando un'e-mail al responsabile della protezione dei dati (DPO) all'indirizzo DPO.Italia@soprasteria.com o per posta a questo indirizzo: Sopra Steria Group S.p.A. - Ufficio legale - Strada 4 Palazzo A7 - 20090 Assago (MI).
Hai anche il diritto di presentare un reclamo Garante per la Protezione dei Dati Personali (Piazza di Monte Citorio n. 121 00186 Roma), se il titolare del trattamento non rispetta gli obblighi previsti dalla legislazione in vigore."
3001264,"Systemutvecklare Dynamics 365 BC","https://jobs.smartrecruiters.com/SopraSteria1/744000061220326-systemutvecklare-dynamics-365-bc","Steria","Stockholm","No","Not specified","Full time","2025-05-25T02:10:52.421635Z","Vill du jobba p en av Sveriges Bsta Arbetsplatser, enligt Great Place to Work? Ett bolag rankat topp fem inom digital transformation av Gartner och utsedd till Karrirfretag flera r i rad? D r Sopra Steria platsen fr dig!Vi sker flera utvecklare inom Microsoft Dynamics 365 Business Central som brinner fr konsultrollen. Hr fr du jobba i implementationsprojekt med stor frihet, nra kunden och tillsammans med kompetenta kollegor.Dina arbetsuppgifterSystemutveckling i C/AL och ALAgilt arbete, enhetstester &amp; felskningVerksamhetsdialog &amp; kundkontaktDriva affrer &amp; kunskapsdelningVem r du?Erfaren utvecklare inom C/AL och/eller ALNyfiken och drivenVill jobba med Visual Studio Code, Microsoft Azure &amp; Dynamics 365Behrskar svenska &amp; engelska i tal och skriftLter det intressant? Ls mer om vra uppdrag hr: Sopra Steria KundreferenserAnsk nu! Det finns viss mjlighet till arbete p distans och beroende p var du bor s kommer du att tillhra ngot av vra kontor i  Stockholm eller Malm. Om du har frgor om tjnsten eller oss som bolag r du vlkommen att kontakta Christer Sderholm chroster.soderholm@soprasteria.com eller Kalle Forsell kalle.forsell@soprasteria.com Ansk och bli en del av ett fretag i digital framkant - som tror p sina medarbetare och dr vrdeorden driv, hjrta, nyfikenhet och kundfokus r p riktigt och genomsyrar vardagen. Sopra Steria r ett ledande internationellt konsultbolag inom digital transformation. Vi bygger samhllet genom designdriven innovation, teknisk utveckling med kunskap om marknadens ledande plattformar och driftlsningar (managed services). Med modern teknologi och en gedigen affrsfrstelse r vi en helhetspartner fr vra kunder och deras digitala transformationsresa. Enligt Great Place To Work r vi en av Sveriges bsta arbetsplatser, vi har tilldelats utmrkelsen Karrirfretag flera r i rad och Gartner har listat oss som ett topp 5 bolag inom digital transformation."
3001263,"Desarrollador/a Java","https://jobs.smartrecruiters.com/SopraSteria1/744000061229351-desarrollador-a-java","Steria","Valencia","Yes","Not specified","Full time","2025-05-25T02:10:52.421652Z","Buscamos un/a Desarrollador/a Java para colaborar en el marco de los proyectos del sector asegurador participando en su desarrollo, evolucin y migracin tecnolgica. Entre las funciones del da a da se encuentran...Desarrollo de soluciones.Anlisis de problemas detectados para plantear una solucin funcional y trasladar sta a un diseo detallado para que lo ejecute otra persona.Comunicacin con cliente de cara a entender las necesidades y traducirlas a un diseo detallado.Para ello, nos gustara que aportaras...Experiencia de al menos 5 aos en Java 8/17, Spring, Springboot, Hibernate.Experiencia en manejo de IDEs (Eclipse).Agilidad para localizar y/o depurar errores de cdigo.Asimismo, valoramos positivamente si la persona aporta conocimientos y/o experiencia en...Herramienta de calidad de cdigo Sonar.Herramienta MagicDraw.SQL para accesos a base de datos.Postman / SoapUI.Subversion. Qu tenemos para ti?Contrato indefinido y jornada completa23 das de vacacionesModelo hbrido de teletrabajo flexibleFormacin continua: competencias tcnicas, transversales y de idiomas. Contamos con acceso a certificaciones, formaciones de los principales Partners Tecnolgicos, plataformas online y mucho ms!Seguro de vida y de accidentesPosibilidad de acogerte a nuestra retribucin flexible (seguro mdico, cheques guarderas, transporte, comida y formacin)Acceso a Privilege Club, donde encontrars descuentos interesantes en las principales marcasOnboarding personalizado y detallado. Te acompaamos en todo momento para que te sientas #soprano desde el primer momento.Oficina con espacios reservados al ocio. Trabajo y diversin unido!Compaerismo y buen ambiente, el poder de la unin lo tenemos presente.Y lo ms importante...Tienes la posibilidad de desarrollar tu carrera profesional con nosotros: Crearemos juntos un plan de carrera personalizado. Te formars, marcaremos objetivos y llevaremos a cabo un seguimiento para asegurarnos de que lo conseguimos juntos. Escuchamos tus prioridades y luchamos por ellas.Aqu tu voz importa! nete a nosotros y s parte de algo ms! The world is how we shape itAdquirimos el compromiso de respetar la diversidad, creando un ambiente de trabajo inclusivo y aplicando polticas que favorezcan la inclusin y promuevan el respeto social y cultural en cuestiones de gnero, edad, funcional, orientacin sexual y religin con igualdad de oportunidades.Adquirimos el compromiso de respetar la diversidad, creando un ambiente de trabajo inclusivo y aplicando polticas que favorezcan la inclusin y promuevan el respeto social y cultural en cuestiones de gnero, edad, funcional, orientacin sexual y religin con igualdad de oportunidades."
