"ID","Title","Link","Company","Location","Remote","Experience","EmploymentType","DatePosted","RoleDescription"
2688927,"Proxy Product Owner Data – Transport - Nantes","https://jobs.smartrecruiters.com/SopraSteria1/744000050922513-proxy-product-owner-data-transport-nantes","Steria","Nantes","Yes","Not specified","Full time","2025-04-01T02:05:30.732478Z","Lagence  Data &amp; IA , consacre  nos clients du Transport et base  Nantes, vous propose dvoluer au sein de projets varis et  fort enjeu, pour des grands comptes leaders dans leur domaine (Ferroviaire, Logistique, Courrier...)Vous souhaitez intgrer une communaut d'experts, prendre part  l'accompagnement de vos collgues dans leur monte en comptences ou encore partager vos expertises pour enrichir nos savoir-faire ? Rencontrons-nous !Votre rle et vos missions :Sous la responsabilit dun Product Owner, vous organisez et animez des ateliers pour recueillir les besoins et les transmettre aux quipes de dveloppement ;Vous prenez en charge la reformulation des besoins en exigences, puis contribuez  leur validation et leur priorisation par les mtiers ;Vous cadrez une ou plusieurs solutions SI, en rponse aux exigences et au juste besoin, en tenant compte des contraintes techniques dfinies par la cellule Architecture et des contraintes durbanisation ;Vous sollicitez les experts SI pour raliser les tudes dimpacts et lvaluation des cots des solutions ;Vous prsentez vos propositions de solutions et les lments de dcisions aux instances mtiers et SI et favorisez une prise de dcision ;Vous rdigez les user stories, puis assistez les quipes de ralisation dans la comprhension des besoins mtiers et la mise en uvre de la solution retenue, en faisant preuve de proactivit pour viter les blocages et garantir la fluidit des dveloppements ;Vous remontez au Product Owner les questions dont la dcision relve de sa comptence exclusive ou ncessite son arbitrage, accompagnes de propositions de rponse ;Vous vous assurez de la qualit fonctionnelle des livrables produits par lquipe de ralisation et de leur cohrence avec la solution cadre ;Vous prenez en charge, le cas chant, les tests en phase de recette mtier de la solution.En parallle de votre mission, vous pouvez galement intervenir sur des sujets transverses, tels que devenir formateur(trice) sur les sujets qui vous anime ou encore participer  des challenges autour de l'innovation et du digital.Epaul(e) par votre manager de carrire (partenaire de votre employabilit), vous construisez votre carrire de manire active, grce  notre Acadmie, nos parcours de formation, nos certifications et des mises en situation sur le terrain.Votre immersion dans nos projets vous permettra d'acqurir une exprience significative aux environnements techniques et fonctionnels de nos clients et de leurs mtiers.Votre profil :De formation Bac+5 en cole d'Ingnieurs ou en Universit, vous avez une exprience accomplie dans la conception fonctionnelle dtaille de solution informatique. Et justifiez dune exprience minimum de 5 ans sur le poste. l'coute et rigoureux(se), vous avez dmontr votre aptitude  animer des ateliers,  vous approprier les enjeux mtiers et cadrer une solution informatique. Vous tes capables dinteragir efficacement avec les quipes techniques et dintgrer des principes darchitecture et durbanisation du SI dans vos travaux dtude.Vous avez des bases en SQL et vous matrisez la gestion des exigences. Vous avez particip  des projets en engagements de rsultats et/ou de moyens. Vous matrisez la communication crite, orale et pouvez galement travailler en langue anglaise.Votre sens du service, votre rigueur, vos qualits relationnelles et vos comptences mthodologiques, vous permettront  terme d'voluer au sein de l'agence  Data &amp; IA  Transport de Nantes, vers les diffrentes filires mtiers.Un accord tltravail pour tltravailler jusqu 2 jours par semaine selon vos missions. Un package avantages intressant : une mutuelle, un CSE, des titres restaurants, un accord dintressement, des primes vacances et cooptation.Des opportunits de carrires multiples : plus de 30 familles de mtiers, autant de passerelles  imaginer ensemble.Plusieurs centaines de formations accessibles en toute autonomie avec Sopra Steria Academy.La possibilit de s'engager auprs de notre fondation ou de notre partenaire  Vendredi .L'opportunit de rejoindre le collectif Tech'Me UP (formations, confrences, veille, et bien plus encore...).Employeur inclusif et engag, notre socit uvre chaque jour pour lutter contre toute forme de discrimination et favoriser un environnement de travail respectueux. Cest pourquoi, attachs  la mixit et  la diversit, nous encourageons toutes les candidatures et tous les profils.https://www.soprasteria.fr/nous-connaitre/nos-engagements"
2688926,"Développeur(se) expérimenté(e) - Full Stack - Energie & Telecom - Nantes","https://jobs.smartrecruiters.com/SopraSteria1/744000050925835-developpeur-se-experimente-e-full-stack-energie-telecom-nantes","Steria","Nantes","Yes","Not specified","Full time","2025-04-01T02:05:30.732509Z","Sopra Steria accompagne un acteur majeur du march lectrique dans la transition nergtique et l'innovation technologique. Le projet inclut :Installation de capteurs dans les logementsRcupration des donnes d'objets connectsTraitement et analyse sur une plateforme  big data Suivi et analyse de la consommationL'objectif est de dvelopper de nouvelles offres de services informatiques en lien avec le cur de mtier du client. Vous rejoindrez une quipe de plus de 20 collaborateurs et serez form(e) aux outils du Groupe, vous permettant de progresser et de vous certifier sur des technologies innovantes (Cloud AWS, Data, Angular, MicroServices).Votre rle et vos missions : Vous participez activement  un projet au cur de l'innovation, tant sur le plan mtier, que technologique (DevOps, Business Process Management Development, Web Services, Batchs spark, IHM).Intgr(e) en tant qu'acteur  part entire des tches de conception, dveloppement, tests, analyse, intgration, devops ; l'ensemble des phases de la vie du projet vous sera confi.Vous intervenez sur les diffrentes instances internes et clients, au cours desquelles vous communiquez sur l'avancement de vos travaux.Vous travaillerez dans un contexte de dveloppement AGILE (SAFe), avec un environnement technique innovant (Plateforme d'Intgration Continue, Openshift, AWS). Selon votre exprience et votre sensibilit RH, un rle de Manager Oprationnel pourrait vous tre confi.Environnement technique : Architecture MicroserviceLangages : Java/JEE, AngularBDD: MySql, Cassandra (NoSQL)Framework: Spring MVC, Spring Batch, SpringBoot, Junit, Spark, OpenShift, CamelOutils: Jenkins, Sonar, Maven, Docker, GITVotre profil :Vous tes diplm(e) d'une cole d'Ingnieurs ou quivalent Universitaire.Vous justifiez d'une premire exprience dans le dveloppement orient microservices et Cloud.Vous avez des affinits DevOPS ?Vous connaissez ou avez des apptences pour les mthodes de travail agiles.Vous avez un bon esprit de synthse et adhrez  l'ide que le dveloppement de la socit s'appuie sur la veille technologique et l'esprit d'innovation des collaborateurs ?Un accord tltravail pour tltravailler jusqu 2 jours par semaine selon vos missions. Un package avantages intressant : une mutuelle, un CSE, des titres restaurants, un accord dintressement, des primes vacances et cooptation.Des opportunits de carrires multiples : plus de 30 familles de mtiers, autant de passerelles  imaginer ensemble.Plusieurs centaines de formations accessibles en toute autonomie avec Sopra Steria Academy.La possibilit de s'engager auprs de notre fondation ou de notre partenaire  Vendredi .L'opportunit de rejoindre le collectif Tech'Me UP (formations, confrences, veille, et bien plus encore...).Employeur inclusif et engag, notre socit uvre chaque jour pour lutter contre toute forme de discrimination et favoriser un environnement de travail respectueux. Cest pourquoi, attachs  la mixit et  la diversit, nous encourageons toutes les candidatures et tous les profils.https://www.soprasteria.fr/nous-connaitre/nos-engagements"
2688925,"Data Modeling Engineer (junior)","https://jobs.smartrecruiters.com/SopraSteria1/744000050922730-data-modeling-engineer-junior-","Steria","Madrid","No","Not specified","Full time","2025-04-01T02:05:30.732538Z","Qu reto proponemos?
Buscamos un perfil junior de Data Modeling Engineer para importante proyecto aeronutico ubicado en Getafe.Qu buscamos?Conocimientos en lenguajes de modelado (SysML, UML) y lectura de cdigo (POO/Bases de datos).Fundamentos en Bases de datos, Modelado de datos y Ontologas.Pensamiento analtico y resolucin de problemas tcnicos.Flexibilidad y capacidad de adaptacin a herramientas IT.Proactividad y ganas de aprender y crecer profesionalmente.Ingles B2Qu tenemos para ti?Contrato indefinido y jornada completa23 das de vacacionesTickets restaurante Variables por performance y objetivos y aportacin al seguro mdicoFormacin continua: competencias tcnicas, transversales y de idiomas. Contamos con acceso a certificaciones, formaciones de los principales Partners Tecnolgicos, plataformas online y mucho ms!Seguro de vida y de accidentesPosibilidad de acogerte a nuestra retribucin flexible (seguro mdico, cheques guarderas, transporte, comida y formacin)Acceso a Privilege Club, donde encontrars descuentos interesantes en las principales marcasOnboarding personalizado y detallado. Te acompaamos en todo momento para que te sientas #soprano desde el primer momento.Oficina con espacios reservados al ocio. Trabajo y diversin unido!Compaerismo y buen ambiente, el poder de la unin lo tenemos presente.Y lo ms importante...Tienes la posibilidad de desarrollar tu carrera profesional con nosotros: Crearemos juntos un plan de carrera personalizado. Te formars, marcaremos objetivos y llevaremos a cabo un seguimiento para asegurarnos de que lo conseguimos juntos. Escuchamos tus prioridades y luchamos por ellas.

Aqu tu voz importa! nete a nosotros y s parte de algo ms! 

The world is how we shape itAdquirimos el compromiso de respetar la diversidad, creando un ambiente de trabajo inclusivo y aplicando polticas que favorezcan la inclusin y promuevan el respeto social y cultural en cuestiones de gnero, edad, funcional, orientacin sexual y religin con igualdad de oportunidades."
2688924,"Développeur/se Expert/e - Full stack - Services Publics - Nantes","https://jobs.smartrecruiters.com/SopraSteria1/744000050927305-developpeur-se-expert-e-full-stack-services-publics-nantes","Steria","Nantes","Yes","Not specified","Full time","2025-04-01T02:05:30.732569Z","Sopra Steria gre la Maitrise duvre dlgue du systme d'information du SIAO, essentiel pour accompagner les personnes en difficult (sans-abris, migrants) vers l'insertion et le logement, surtout en urgence. Ce projet, s'inscrit dans la stratgie ""logement dabord"" pour lutter contre le sans-abrisme.Plac sous l'autorit du premier ministre et fonctionnellement rattach au ministre de la cohsion des territoires, le projet est pilot par la Dlgation Interministrielle  l'Hbergement et  l'Accs au Logement (DIHAL) et accompagn de la Direction du Numrique (DNUM) du Ministre de la Transition Ecologique (MTE). Il entre actuellement dans une phase cruciale de refonte des processus mtiers et techniques pour optimiser la coordination des acteurs sociaux.Le projet est men en mthode Agile SCRUM (daily meeting, user stories ...) avec des sprints d'une dure de 3 semaines. Votre rle et vos missions :En tant que dveloppeur/euse sur le systme d'information SIAO, vous tes amen/e  raliser des dveloppements avec un niveau de complexit suprieur  la moyenne de l'quipe. Vous accompagnerez galement les jeunes diplms dans leurs dveloppements moins complexes pour garantir leur monte en comptence.Vous tes, en collaboration avec les autres dveloppeurs expriments du projet, partiellement responsable de la chane d'intgration continue du projet ainsi que des diffrents environnements internes (intgration, qualification) et de l'infrastructure qui les porte.Vous tes amen/e  rpondre aux interrogations de notre client sur le volet technique du projet.Vous tes en liens troits avec l'architecte du projet afin de dcliner l'architecture dfinie et mettre  l'preuve la conception. Vos missions ncessitent de :Comprendre les besoins et les enjeux du client ainsi que les cas dusage mtiers de la matrise d'ouvrageDvelopper des modules complexes combinant des problmatiques multiples (performance, scurit, accessibilit ...)valuer, arbitrer et adapter si ncessaire les choix techniques, en cohrence avec l'architecture du projetAnticiper et alerter sur les ventuels risques techniques, de qualit, de scurit ou de tenue des dlaisUtiliser et maintenir l'industrialisation du projet (compilation, tests automatiss ...)Orchestrer et coordonner les ralisations techniques de l'quipe projetL'environnement technique :OS : DebianFront : Angular / TypeScriptBack : Java / Spring BootBase de donnes : PostgreSQLIndexation : ElasticsearchAuthentification : KeycloakServeur frontal : nginxUn broker de message prvu (RabbitMQ ou Kafka)Docker, Ansible, Gitlab, IntelliJ UltimateNos postes de travail sont adapts aux besoins des profils tech (HP Elitebook 855 G8).Votre profil :Vous tes force de proposition et avez  cur de contribuer  lamlioration et  la vie des projets. Etes  l'aise dans votre communication avec un client et savez vulgariser des problmatiques techniques complexes auprs de populations aussi bien techniques que non-techniques.Vous tes pdagogue, vous savez vous montrer disponible et patient pour accompagner la monte en comptence de vos collgues. Vous apprciez galement rdiger et donner des formations technologiques.Vous oprez une veille technologique active sur les volutions de l'industrie et tes  l'affut des opportunits d'application de ces volutions sur vos contextes projet.Vous tes en mesure de rdiger des tudes techniques sur le primtre de votre projet en articulant des ides de manire claire, concise et engageante, ainsi que des prsentations client structures et ce en autonomie.Vous avez des connaissances sur les technologies Cloud (conteneurisation, orchestration de conteneurs, hyperscalers).Vous avez une solide exprience en tant que dveloppeur d'applications Java, de 4 ans minimum. Vous matrisez les bonnes pratiques inhrentes au dveloppement d'applications Java.#LI-HYBRID #NANTESUn accord tltravail pour tltravailler jusqu 2 jours par semaine selon vos missions. Un package avantages intressant : une mutuelle, un CSE, des titres restaurants, un accord dintressement, des primes vacances et cooptation.Des opportunits de carrires multiples : plus de 30 familles de mtiers, autant de passerelles  imaginer ensemble.Plusieurs centaines de formations accessibles en toute autonomie avec Sopra Steria Academy.La possibilit de s'engager auprs de notre fondation ou de notre partenaire  Vendredi .L'opportunit de rejoindre le collectif Tech'Me UP (formations, confrences, veille, et bien plus encore...).Employeur inclusif et engag, notre socit uvre chaque jour pour lutter contre toute forme de discrimination et favoriser un environnement de travail respectueux. Cest pourquoi, attachs  la mixit et  la diversit, nous encourageons toutes les candidatures et tous les profils.https://www.soprasteria.fr/nous-connaitre/nos-engagements"
2688923,"Business Analyst - Transport - Nantes","https://jobs.smartrecruiters.com/SopraSteria1/744000050928355-business-analyst-transport-nantes","Steria","Nantes","Yes","Not specified","Full time","2025-04-01T02:05:30.732598Z","Lagence Transport de Nantes vous propose dvoluer au sein de projets varis et  fort enjeu pour des grands comptes leaders dans leur domaine (Ferroviaire, Logistique, Courrier...)Vous souhaitez intgrer une communaut d'experts, prendre part  l'accompagnement de vos collgues dans leur monte en comptences ou encore partager vos expertises pour enrichir nos savoir-faire ? Rencontrons-nous !Votre rle et vos missions :Vous organisez et animez des ateliers mtiers (recueil de besoins fonctionnels et aide  la dcision),Vous veillez  analyser et  comprendre les besoins exprims par les utilisateurs et les quipes mtiers,Vous rdigez la documentation fonctionnelle : user stories, spcifications fonctionnelles, cahier des charges,Vous participez aux phases de recettes,Vous proposez des plans d'amlioration continue bass sur la comprhension des besoins mtiers du client : cartographie des flux mtiers, tudes comparatives de solutions,Vous travaillez en troite collaboration avec les dveloppeurs, tout en challengeant les solutions proposes pour crer le maximum de valeur,Vous grez un backlog projet,Vous participez et animez les instances de suivi de projet (Daily meeting, comit de suivi) ainsi que des sessions de Co-design.En parallle de votre mission, vous pouvez galement intervenir sur des sujets transverses, tels que devenir formateur(trice) sur les sujets qui vous anime ou encore participer  des challenges autour de l'innovation et du digital.Epaul(e) par votre manager, vous construisez votre carrire de manire active, grce  notre plateforme de formation , nos parcours de formations, nos certifications et des mises en situation sur le terrain.Votre immersion dans nos projets vous permettra d'acqurir une exprience significative aux environnements techniques et fonctionnels de nos clients et de leurs mtiers.Votre profil :Diplm(e) d'une Ecole d'Ingnieurs ou d'un Master 2, ou formation quivalente, vous bnficiez d'au moins 5 ans sur un poste similaire.Dans lidal, vous avez dbut votre carrire dans le dveloppement informatique, ce qui vous rend capable aujourd'hui d'interagir efficacement avec les quipes techniques.A l'coute et rigoureux(se), vous avez dmontr votre aptitude  comprendre,  vous approprier les enjeux mtiers et leur ralisation dans une solution informatique.Vous connaissez UML ou un autre outil de modlisation et la gestion des exigences. Vous avez particip  des projets en engagements de rsultats. Vous matrisez la communication crite, orale et pouvez galement travailler en langue anglaise.Votre sens du service, votre rigueur, vos qualits relationnelles et vos comptences mthodologiques, vous permettront  terme d'voluer au sein de l'agence Transport de Nantes vers les diffrentes filires mtiers.Un accord tltravail pour tltravailler jusqu 2 jours par semaine selon vos missions. Un package avantages intressant : une mutuelle, un CSE, des titres restaurants, un accord dintressement, des primes vacances et cooptation.Des opportunits de carrires multiples : plus de 30 familles de mtiers, autant de passerelles  imaginer ensemble.Plusieurs centaines de formations accessibles en toute autonomie avec Sopra Steria Academy.La possibilit de s'engager auprs de notre fondation ou de notre partenaire  Vendredi .L'opportunit de rejoindre le collectif Tech'Me UP (formations, confrences, veille, et bien plus encore...).Employeur inclusif et engag, notre socit uvre chaque jour pour lutter contre toute forme de discrimination et favoriser un environnement de travail respectueux. Cest pourquoi, attachs  la mixit et  la diversit, nous encourageons toutes les candidatures et tous les profils.https://www.soprasteria.fr/nous-connaitre/nos-engagements"
2688922,"Business Analyst - Services Publics - Nantes","https://jobs.smartrecruiters.com/SopraSteria1/744000050928985-business-analyst-services-publics-nantes","Steria","Nantes","Yes","Not specified","Full time","2025-04-01T02:05:30.732628Z","Les quipes de l'entit ""Services Publics"" de Sopra Steria modernisent les services publics pour les citoyens et les agents de l'tat, en travaillant avec des administrations et ministres. Elles innovent dans des domaines comme l'IA, la mobilit et le Big Data, tout en respectant les contraintes sociales et environnementales.Pour la Direction Gnrale des Douanes et Droits Indirects, nos quipes de Nantes et Barcelone mnent divers projets : BREXIT, E-commerce, lutte contre la fraude, surveillance aromaritime, contrle et taxation des marchandises, et projets europens.Elles conoivent quotidiennement des applications simples et intuitives rpondant aux besoins des agents publics et des citoyens, tout en respectant les exigences d'accessibilit et d'cologie.Votre rle et vos missions :Vous comprenez les besoins mtiers afin de permettre leur intgration dans le systme d'information de l'entreprise. En ce sens, vous tes l'interface entre les quipes mtier et les quipes de dveloppement.Aujourdhui, nous avons besoin de renforcer nos quipes qui participent  la mise en place dapplications mobiles. Ces dernires permettent de faciliter les actions de lutte contre la fraude (tabac, alcool, drogues, contrefaon, ...) menes par les agents sur le terrain.Dans ce cadre, nous vous proposons dintgrer un projet de dveloppement dune application mobile ayant pour vocation de faciliter la recherche de contaminants dans les produits vgtaux.En immersion totale au sein d'une quipe projet o la bonne humeur rime avec efficacit, vos missions sont : Participation  la dfinition d'un SI rpondant aux enjeux et contraintes ; Ralisation de travaux d'analyse d'usages et de donnes, de maquettage et prototypage ;Adoption dune dmarche dcoconception visant  rduire les impacts environnementaux des produits tout au long de leur cycle de vie ;Mise en place dune ergonomie optimisant la meilleure exprience utilisateur pour tous types dusagers (respect des contraintes daccessibilit) ;Animation datelier client, en proximit avec les utilisateurs finaux ; Participation  la ralisation des spcifications fonctionnelles et  la qualification ; Encadrement et formation de collaborateurs.  Bien sr, ces missions peuvent voluer afin d'tre aussi bien  l'coute de vos envies et dsirs d'apprentissage que des besoins du projet. En fonction de votre exprience, vous pouvez aussi participer au recrutement, au  coaching , aux formations (cration/dispense),  l'encadrement d'autres business analyst moins expriments, et intervenir galement en avant-vente.Votre profil :Au sein de lquipe vous insufflez un esprit de collaboration et dentraide de par votre position centrale au sein du projet et votre capacit de communication.Vous avez une bonne capacit dadaptation face  diffrents interlocuteurs et savez ragir rapidement aux changements.Titulaire dun Master 2, d'un diplme d'Ingnieurs ou formation quivalente et vous avez au moins 4 ans d'expriences, alors rejoignez nous! Vous avez une approche oriente utilisateurs, vous aimez changer au quotidien avec des clients et proposer des solutions en collaboration avec eux pour rpondre  lvolution de leurs mtiers, ce poste est le vtre ! #LI-HYBRID #NANTESUn accord tltravail pour tltravailler jusqu 2 jours par semaine selon vos missions. Un package avantages intressant : une mutuelle, un CSE, des titres restaurants, un accord dintressement, des primes vacances et cooptation.Des opportunits de carrires multiples : plus de 30 familles de mtiers, autant de passerelles  imaginer ensemble.Plusieurs centaines de formations accessibles en toute autonomie avec Sopra Steria Academy.La possibilit de s'engager auprs de notre fondation ou de notre partenaire  Vendredi .L'opportunit de rejoindre le collectif Tech'Me UP (formations, confrences, veille, et bien plus encore...).Employeur inclusif et engag, notre socit uvre chaque jour pour lutter contre toute forme de discrimination et favoriser un environnement de travail respectueux. Cest pourquoi, attachs  la mixit et  la diversit, nous encourageons toutes les candidatures et tous les profils.https://www.soprasteria.fr/nous-connaitre/nos-engagements"
