"ID","Title","Link","Company","Location","Remote","Experience","EmploymentType","DatePosted","RoleDescription"
2688921,"Project Manager - Transformation IT - Services Publics - Nantes","https://jobs.smartrecruiters.com/SopraSteria1/744000050928936-project-manager-transformation-it-services-publics-nantes","Steria","Nantes","Yes","Not specified","Full time","2025-04-01T02:05:30.732659Z","Avec l'accompagnement d'un directeur de projet ou d'un chef de projet expriment, vous tes charg(e) de piloter une quipe (5-10 personnes) de ralisation au forfait (dveloppement logiciel / intgration de systmes / maintenance applicative) au sein de nos projets de transformation des systmes d'information des clients que nous adressons dans la sphre services publics.
Votre rle et missions :

Votre fonction est globale et vous permet de monter en comptence dans le pilotage de projets complexes :Pilotage d'quipe (5  10 p. ; selon votre exprience)Tenue de nos engagements de services (delivery, cot, dlais, qualit)Animation de la relation avec vos interlocuteurs clientsSuivi des oprations et la qualit du deliveryOrganisation et gestion d'quipe en grande autonomieSuivi des carrires et de l'volution de vos quipes (participation aux comits RH visant  grer leur volution)Suivi de l'conomie des projetsReporting interne.En fonction de votre exprience, vous tes accompagn(e) en proximit par un chef de projets expriment pour mieux apprhender la fonction globale attendue chez Sopra Steria.

Le poste est volutif, la filire Chef de projet est dynamique et permet une volution rapide en termes de responsabilit et de salaire. Evolution possible vers des postes de directeur de projet ou de postes en structure pour pilotage plus globale d'entits.Votre profil :

Vous tes dj intervenu(e) dans le cadre forfaitaire, en ESN idalement (voir chez un diteur de logiciels). Vous apportez une solide culture en dveloppement logiciel.
La connaissance du secteur n'est pas essentielle : nous vous formerons  ce domaine via des formations menes par des oprationnels.Vous tes diplm(e) d'une formation Bac+5 (Ecole d'Ingnieurs ou de formation universitaire ou de formation quivalente), vous possdez une exprience oprationnelle d'au minima 4 ans, ainsi que d'une premire exprience en gestion de projet en matrise d'uvre (dveloppement logiciel / intgration de systmes / TMA).

Avant tout, vous tes  entrepreneur(e)  et passionn(e) par le pilotage, l'encadrement, le management d'quipe. Votre personnalit et votre potentiel nous importent avant tout : sens de l'humain et de l'engagement, leadership, rigueur, mthode, got du travail en quipe, sens de l'efficacit et du rsultat.Un accord tltravail pour tltravailler jusqu 2 jours par semaine selon vos missions. Un package avantages intressant : une mutuelle, un CSE, des titres restaurants, un accord dintressement, des primes vacances et cooptation.Des opportunits de carrires multiples : plus de 30 familles de mtiers, autant de passerelles  imaginer ensemble.Plusieurs centaines de formations accessibles en toute autonomie avec Sopra Steria Academy.La possibilit de s'engager auprs de notre fondation ou de notre partenaire  Vendredi .L'opportunit de rejoindre le collectif Tech'Me UP (formations, confrences, veille, et bien plus encore...).Employeur inclusif et engag, notre socit uvre chaque jour pour lutter contre toute forme de discrimination et favoriser un environnement de travail respectueux. Cest pourquoi, attachs  la mixit et  la diversit, nous encourageons toutes les candidatures et tous les profils.https://www.soprasteria.fr/nous-connaitre/nos-engagements"
2688920,"Développeur/se Expert/e – Java Fullstack - Services Financiers - Nantes","https://jobs.smartrecruiters.com/SopraSteria1/744000050929327-developpeur-se-expert-e-java-fullstack-services-financiers-nantes","Steria","Nantes","Yes","Not specified","Full time","2025-04-01T02:05:30.732688Z","La division  Services Financiers  sest dveloppe autour des mtiers de la banque de dtail, de la banque prive et des services financiers spcialiss. Nous participons  la rvolution digitale grce  notre expertise . Nous accompagnons la transformation de nos clients en y associant nos comptences.

Intgr(e) au sein dune quipe Sopra Steria pour un de nos Grands Comptes Bancaires, vous participez  un projet de transformation digitale de grande envergure. Votre rle et vos missions :Au sein d'une quipe projet de 5  15 personnes, vous avez pour missions :Vous intervenez en phase de conception et de dveloppement (backend et frontend) des User Stories dans le respect des normes et des standards de dveloppement et de scurit.Vous prenez en charge des conceptions, des chiffrages &amp; des dveloppements critiques ou complexes.Vous tes le support des dveloppeurs de lquipe et ralisez les revues de code (PR/MR).Vous tes le garant de la chane dintgration continue sur votre stack.Vous contribuez  la capitalisation technique et prsentez des sujets techniques au sein des quipes.Vous participez aux avant-ventes lorsque votre domaine dexpertise est concern.Afin de parfaire votre expertise technique, nous vous proposons de prendre part  linitiative Techme UP qui a pour but de valoriser les filires techniques chez Sopra Steria.Les axes principaux sont les suivants :Excellence Tech : dvelopper les comptences par du craftsmanship et de lalgorithmie, amliorer les environnements de dveloppement pour rpondre aux enjeux de time-to-market et de qualit ;Image Tech : prparation et rptition de talk en interne et en externe, confrences et rdaction de billets tech ;Dveloppement humain : permettre  chaque dveloppeur.euse et architecte de trouver sa voie dvolution jusquau plus haut niveau, mettre en lumire les comptences des expert.e.s !Votre environnement technique : Java 8/11/17, Oracle, PostgreSQL, JBoss EAP 7, Spring, Hibernate, Talend, Angular ou React.Votre profil : Vous disposez dau moins 4 ans dexprience en tant que dveloppeur, vous possdez de solides comptences techniques dans les stacks techniques back Java et front React.Vous avez dj effectu des missions de conception, exprimentation et mise en uvre de la structure de lapplication avec support aux quipes de dveloppement.Vous avez dj propos des prsentations/formations sur la bonne implmentation de la stack technique  une petite quipe de dveloppeurs juniors.Vous avez particip  la mise en uvre de lindustrialisation, de la CI/CD, recouvrant les aspects de qualimtrie et de scurit.Vous tes sensible au software craftmanship, et aux bonnes bonnes pratiques de dveloppement (SOLID, Clean Code).Pour finir, vous tes diplm(e) d'une cole d'Ingnieur ou d'une formation Universitaire ou quivalent.Vous aimez relever des challenges et participer  la modernisation technologique ainsi qu la transformation cloud des systmes dinformation IT ? Alors intgrez une entreprise o rgne un esprit entrepreneurial fort et une atmosphre propice  votre volution : participez sans plus attendre  une transformation durable grce  une vritable aventure humaine au sein d'un grand groupe international.Ce que nous vous proposons :Un accord tltravail pour tltravailler jusqu 2 jours par semaine selon vos missions. Un package avantages intressant : une mutuelle, un CSE, des titres restaurants, un accord dintressement, des primes vacances et cooptation.Des opportunits de carrires multiples : plus de 30 familles de mtiers, autant de passerelles  imaginer ensemble.Des centaines de formations pour dvelopper vos comptences et voluer au sein du GroupeDes plateformes de formations en autonomie pour prparer vos certifications et accompagner votre dveloppement personnelLa possibilit de s'engager auprs de notre fondation ou de notre partenaire  Vendredi .L'opportunit de rejoindre le collectif Tech'Me UP (formations, confrences, veille, et bien plus encore...)Tmoignages :Tmoignage de Sofiane, Lead developer chez Sopra Steria : Jai un profil de reconverti, initialement de formation en Biologie, jai rejoint Sopra Steria en tant que Dveloppeur en 2018. Je suis actuellement Lead developer au sein de plusieurs projets et jinterviens galement en qualit de manager oprationnel .Employeur inclusif et engag, notre socit uvre chaque jour pour lutter contre toute forme de discrimination et favoriser un environnement de travail respectueux. Cest pourquoi, attachs  la mixit et  la diversit, nous encourageons toutes les candidatures et tous les profils.https://www.soprasteria.fr/nous-connaitre/nos-engagements"
2688919,"Développeur(se) Expert(e) Data - Transport - Nantes","https://jobs.smartrecruiters.com/SopraSteria1/744000050930744-developpeur-se-expert-e-data-transport-nantes","Steria","Nantes","Yes","Not specified","Full time","2025-04-01T02:05:30.732719Z","En qualit dingnieur Dveloppeur(se) Senior, vous tes rattach(e)  lagence  Data &amp; IA , consacre  nos clients du Transport et base  Nantes. Lagence regroupe environ 80 collaborateurs et adresse plusieurs clients majeurs du transport (ferroviaire, routier et postal).Vous intgrez une entreprise dans laquelle rgnent un esprit entrepreneurial fort et une atmosphre propice  votre volution. Vous participez  une transformation numrique durable au cur d'une aventure humaine au sein d'un grand groupe international.Vous tes prt(e)  relever le dfi avec nous ? Un challenge s'offre  vous, futur(e) Data Ingnieur(e) !Votre rle et vos missions :Intgr(e) au sein d'une quipe de plusieurs collaborateurs (Data ingnieurs, Chef de projet, responsables produit), vous menez  bien vos activits o les matres mots sont : Agilit et Initiative !Vous apprhendez larchitecture du projet, labore par l'architecte, tout en apportant un regard critique. Vous travaillez en troite collaboration avec nos cellules dexpertises techniques transverses (DevOPS &amp; Industrialisation, Veille techno, Architecture), afin de dfinir conjointement les justes solutions techniques ;Vous dveloppez les fonctionnalits les plus complexes et mettez en place des socles permettant lindustrialisation ;Vous effectuez des revues de code et dispensez les bonnes pratiques de Software Craftsmanship ;Vous assurez l'encadrement technique de l'quipe de Data ingnieurs (donnez les directives ncessaires aux concepteurs / dveloppeurs afin de garantir un applicatif performant, rpondant aux besoins du client &amp; maintenable, apportez le support ncessaire, contrlez les ralisations) ;Vous tes acteur dans l'industrialisation ainsi que l'intgration continue des projets ;Vous participez activement  la capitalisation du projet et  la mise en place d'outillage permettant de scuriser et d'optimiser le delivery du projet ;Vous participez aux investigations d'anomalies &amp; identifier les pistes de rsolutions.  Chercher une aiguille dans une botte de foin  est votre expression prfre !Vous remontez les difficults techniques aux experts techniques transverses pour partage et rsolution.Vous voluez dans un contexte technique riche :Technologies : Spark, Scala, SQL, Python, Airflow, Nifi, Kafka, QlikReplicateCloud : Azure, AWSEnvironnements : Databricks, ClouderaGestionnaires de version : Gitlab, Azure DevOPSCI / CD : Jenkins, Ansible, TerraformData visualisation : Power BI, QlikSenseEn parallle de votre mission, vous pouvez galement intervenir sur des sujets transverses, tels que devenir formateur(trice), sur les sujets qui vous animent, ou encore participer  des challenges autour de l'innovation et du numrique.paul(e) par votre manager (partenaire de votre employabilit), vous construisez votre carrire de manire active, grce  notre Acadmie, nos parcours de formation, nos certifications et des mises en situation sur le terrain.Votre profil :Vous tes diplm(e) dune cole d'Ingnieurs ou quivalent Universit et justifiez dune exprience minimum de 5 ans en dveloppement et dune premire exprience en encadrement technique.Vous avez des comptences techniques prdominantes en Spark, en SQL et dans un langage de dveloppement (idalement Scala).Vous avez un bon esprit danalyse et de synthse, le sens du relationnel, vous tes polyvalent(e) et autonome.Vous aimez travailler sur des sujets qui allient dfi technique et innovation ? Alors venez profiter dune atmosphre propice  lentrepreneuriat et  votre volution.Vous vous reconnaissez ? Nous sommes impatients de vous rencontrer ! #LI-HYBRID #NANTESUn accord tltravail pour tltravailler jusqu 2 jours par semaine selon vos missions. Un package avantages intressant : une mutuelle, un CSE, des titres restaurants, un accord dintressement, des primes vacances et cooptation.Des opportunits de carrires multiples : plus de 30 familles de mtiers, autant de passerelles  imaginer ensemble.Plusieurs centaines de formations accessibles en toute autonomie avec Sopra Steria Academy.La possibilit de s'engager auprs de notre fondation ou de notre partenaire  Vendredi .L'opportunit de rejoindre le collectif Tech'Me UP (formations, confrences, veille, et bien plus encore...).Employeur inclusif et engag, notre socit uvre chaque jour pour lutter contre toute forme de discrimination et favoriser un environnement de travail respectueux. Cest pourquoi, attachs  la mixit et  la diversit, nous encourageons toutes les candidatures et tous les profils.https://www.soprasteria.fr/nous-connaitre/nos-engagements"
2688918,"Business Analyst - Energie & Telecom - Nantes","https://jobs.smartrecruiters.com/SopraSteria1/744000050930250-business-analyst-energie-telecom-nantes","Steria","Nantes","Yes","Not specified","Full time","2025-04-01T02:05:30.732749Z","La division  Energie &amp; Tlcom  accompagne les grands acteurs du secteur en France dans les domaines de la production et la distribution thermique, hydraulique et nuclaire. Dans un contexte agile, nos quipes dexperts participent  des projets autour de la transformation digitale pour conduire nos clients vers une transition cologique.Le dfi que nous vous proposons de relever ? Mettre lnergie au service des Smart Grid &amp; Cities ! Sopra Steria accompagne le gestionnaire du rseau de distribution d'lectricit sur le Systme de Gestion des Echanges, portail au cour de son SI. Le projet est organis suivant les principes de l'agilit  l'chelle Safe.Votre rle et vos missions :Au sein d'une quipe agile, vos missions sont les suivantes :Vous tes le relais privilgi du Product Owner pour le suivi des fonctionnalits mises en uvre et les affinages ;Vous apportez un support fonctionnel aux quipiers ;Vous mettez en uvre la mthodologie de tests Projet ;Vous dfinissez la stratgie de test sur les US et Features de l'quipe ;Vous vrifiez la bonne mise en uvre de la stratgie de test et la couverture des exigences dans les outils ;Vous participez activement aux diffrentes phases de validation ;Vous vous assurez du respect des DOD/DOR ;Vous vous assurez avec le Product Owner que les volutions de l'quipe n'augmentent pas le stock d'incidents utilisateur et ne dgradent pas la qualit des donnes ;Vous documentez fonctionnellement les travaux de l'quipe, et vous contribuez ainsi  la capitalisation des connaissances sur le projet ;Vous contribuez activement au maintien du stock d'incidents utilisateurs sous le seuil dfini par les indicateurs projet : analyse, suivi, ralisation, capitalisation.Environnement technique : J2EE, Microservices, Apache Camel, ORACLE, Jira, Xray, Confluence, Soap, SQL, UMLVotre profil :Vous tes motiv(e) pour rejoindre un projet riche fonctionnellement et techniquement par sa diversit des utilisateurs et partenaires SI, et souhaitez dvelopper vos comptences de tests et de conception dans un environnement challengeant.
Vous connaissez ou avez des apptences pour les mthodes de travail agiles.
Vous tes passionn(e) pour le secteur de l'nergie, ou tout simplement  l'coute des actualits sur ce domaine mtier.De formation Master 2 ou formation quivalente, vous justifiez de 4 ans d'exprience minimum en tant que concepteur/testeur fonctionnel ou appui au Product Owner.#LI-HYBRID #NANTESUn accord tltravail pour tltravailler jusqu 2 jours par semaine selon vos missions. Un package avantages intressant : une mutuelle, un CSE, des titres restaurants, un accord dintressement, des primes vacances et cooptation.Des opportunits de carrires multiples : plus de 30 familles de mtiers, autant de passerelles  imaginer ensemble.Plusieurs centaines de formations accessibles en toute autonomie avec Sopra Steria Academy.La possibilit de s'engager auprs de notre fondation ou de notre partenaire  Vendredi .L'opportunit de rejoindre le collectif Tech'Me UP (formations, confrences, veille, et bien plus encore...).Employeur inclusif et engag, notre socit uvre chaque jour pour lutter contre toute forme de discrimination et favoriser un environnement de travail respectueux. Cest pourquoi, attachs  la mixit et  la diversit, nous encourageons toutes les candidatures et tous les profils.https://www.soprasteria.fr/nous-connaitre/nos-engagements"
2688917,"Développeur/se Full Stack - Banque & Assurance - Brest","https://jobs.smartrecruiters.com/SopraSteria1/744000050932085-developpeur-se-full-stack-banque-assurance-brest","Steria","Guipavas","Yes","Not specified","Full time","2025-04-01T02:05:30.732779Z","La division Services Financiers est dveloppe autour des mtiers de la banque de dtail, de la banque prive et des services financiers spcialiss. Nous participons  la rvolution digitale grce  notre expertise en automatisation des processus, Big Data, IA, Cloud. Nous accompagnons la transformation de nos clients en y associant nos comptences dans les domaines fonctionnels des Crdits, des Risques/Conformit et des Moyens de Paiement.Description du posteLa division  Services Financiers  sest dveloppe autour des mtiers de la banque de dtail, de la banque prive et des services financiers spcialiss. Nous participons  la rvolution digitale grce  notre expertise. Nous accompagnons la transformation de nos clients en y associant nos comptences.Notre agence est implante sur le bassin Brestois depuis plusieurs annes. Elle a su dvelopper dans un environnement collaboratif et panouissant des projets multiples innovants et locaux. Notre quipe  taille humaine recherche des talents motivs et passionns pour la rejoindre.
Intgr(e) au sein dune quipe Sopra Steria pour un de nos Grands Comptes Bancaires, vous participez  un projet de transformation digitale de grande envergure. Votre rle et vos missions :Au sein d'une quipe projet de 5  15 personnes, vous avez pour missions :Vous intervenez en phase de conception et de dveloppement (backend et frontend) des User Stories dans le respect des normes et des standards de dveloppement et de scurit.Vous prenez en charge des conceptions, des chiffrages &amp; des dveloppements.Vous participez  toute la chane dintgration continue sur votre stack.Vous contribuez  la capitalisation technique et prsentez des sujets techniques au sein des quipes.Afin de parfaire votre expertise technique, nous vous proposons de prendre part  linitiative Techme UP qui a pour but de valoriser les filires techniques chez Sopra Steria.Les axes principaux sont les suivants :Excellence Tech : dvelopper les comptences par du craftsmanship et de lalgorithmie, amliorer les environnements de dveloppement pour rpondre aux enjeux de time-to-market et de qualit ;Image Tech : prparation et rptition de talk en interne et en externe, confrences et rdaction de billets tech ;Dveloppement humain : permettre  chaque dveloppeur.euse et architecte de trouver sa voie dvolution jusquau plus haut niveau, mettre en lumire les comptences des expert.e.s !Votre environnement technique : Java 8/11/17/21, Spring, Talend, Front JS, Microservices, Gitab, CI/CDVotre profil :Vous disposez dau moins 4 ans dexprience en tant que dveloppeur, vous possdez de solides comptences techniques dans les stacks techniques back Java et front.Vous avez dj effectu des missions de conception et de dveloppement. Vous avez dj apport votre support aux quipes de dveloppement.Vous avez particip  la mise en uvre de lindustrialisation, de la CI/CD, recouvrant les aspects de qualimtrie et de scurit.Vous tes sensible au software craftmanship, et aux bonnes bonnes pratiques de dveloppement (SOLID, Clean Code).Pour finir, vous tes diplm(e) d'une cole d'Ingnieur ou d'une formation Universitaire ou quivalent.Vous aimez relever des challenges et participer  la modernisation technologique ainsi qu la transformation cloud des systmes dinformation IT ? Alors intgrez une entreprise o rgne un esprit entrepreneurial fort et une atmosphre propice  votre volution : participez sans plus attendre  une transformation durable grce  une vritable aventure humaine au sein d'un grand groupe international.Un accord tltravail pour tltravailler jusqu 2 jours par semaine selon vos missions. Un package avantages intressant : une mutuelle, un CSE, des titres restaurants, un accord dintressement, des primes vacances et cooptation.Un accompagnement individualis avec un mentor.Des opportunits de carrires multiples : plus de 30 familles de mtiers, autant de passerelles  imaginer ensemble.Plusieurs centaines de formations accessibles en toute autonomie depuis lapp mobile avec Sopra Steria Academy.La possibilit de s'engager auprs de notre fondation ou de notre partenaire  Vendredi .L'opportunit de rejoindre le collectif Tech'Me UP (formations, confrences, veille, et bien plus encore...).Employeur inclusif et engag, notre socit uvre chaque jour pour lutter contre toute forme de discrimination et favoriser un environnement de travail respectueux. Cest pourquoi, attachs  la mixit et  la diversit, nous encourageons toutes les candidatures et tous les profils.https://www.soprasteria.fr/nous-connaitre/nos-engagements"
2688916,"Développeur(se) expérimenté(e) - Full Stack - Transport - Nantes","https://jobs.smartrecruiters.com/SopraSteria1/744000050932571-developpeur-se-experimente-e-full-stack-transport-nantes","Steria","Nantes","Yes","Not specified","Full time","2025-04-01T02:05:30.732809Z","Vous intgrez une entreprise dans laquelle rgnent un esprit entrepreneurial fort et une atmosphre propice  votre volution. Vous participez  une transformation numrique durable au cur d'une aventure humaine au sein d'un grand groupe international.Vous tes prt/e  relever le dfi avec nous ? Un challenge s'offre  vous, futur(e) Dveloppeur(se) Full Stack !Votre rle et vos missions :Intgr(e) au sein d'une quipe de 3  9 collaborateurs  lexprience varie et regroupant les comptences ncessaires aux projets, vous menez  bien vos activits o le maitre mot est : Agilit !Vous apprhendez les CT (Conceptions Techniques) labores par votre encadrement technique, afin de raliser les dveloppements et tests ncessaires. Lors de vos travaux, vous prenez du recul pour comprendre la logique et challenger les solutions. Vous travaillez en troite collaboration avec vos pairs et vos encadrants, afin de monter en comptence et devenir autonome ;Au fur et  mesure de votre progression, vous dveloppez des fonctionnalits de plus en plus complexes et participez  llaboration des solutions techniques ;Vous vous appuyez sur les revues de code et les bonnes pratiques de Software Craftsmanship pour progresser ;Vous participez activement  la capitalisation du projet ;Vous participez aux crmonies Agile et  la vie du projet. Vous faites vtre le processus de fonctionnement du projet et nhsitez pas  proposer des amliorations qui vous semblent pertinentes. Le travail en quipe est votre mode de fonctionnement prfr  ;Vous remontez les difficults techniques aux rfrents techniques transverses pour partage et rsolution.Vous partagez votre avancement  votre pilote et  votre quipe, lors des instances prvues  cette effet. Vous remontez une alerte, lorsque vous anticipez un dpassement du temps imparti sur une de vos tches.Vous voluez dans un contexte technique riche :Technologies : Java 11 (bientt 17), Spring Boot 2 (bientt 3), JavaScript (TypeScript), Angular, Docker, Camel, Hibernate, REST/JSON, Spring BatchDatabase : MongoDB, PostgreSQLBroker : Kafka, IBM MQ, Active MQCache : Redis, HazelcastCI / CD :Gitlab, Jenkins, Sonar, Artifactory, Harbor, AnsibleEn parallle de votre mission, vous pouvez galement intervenir sur des sujets transverses, tels que devenir formateur(trice) sur les sujets qui vous anime ou encore participer  des challenges autour de l'innovation et du digital.paul(e) par votre manager, vous construisez votre carrire de manire active, grce  notre Acadmie, nos parcours de formations, nos certifications et des mises en situation sur le terrain.Votre profil :Vous tes diplm(e) dune cole d'Ingnieurs ou Cycle Universitaire, ou formation quivalente, et vous disposez d'au moins 3 ans d'exprience sur les technologies Java/Spring et JavaScript/Angular.Vous avez un bon esprit dquipe, le sens du relationnel et du service client, une forte motivation  apprendre et matriser un savoir-faire.Vous aimez travailler sur des sujets qui allient dfi technique et innovation ? Alors venez profiter dune atmosphre propice  lentrepreneuriat et  votre volution.Vous vous reconnaissez ? Nous sommes impatients de vous rencontrer !Un accord tltravail pour tltravailler jusqu 2 jours par semaine selon vos missions. Un package avantages intressant : une mutuelle, un CSE, des titres restaurants, un accord dintressement, des primes vacances et cooptation.Des opportunits de carrires multiples : plus de 30 familles de mtiers, autant de passerelles  imaginer ensemble.Plusieurs centaines de formations accessibles en toute autonomie avec Sopra Steria Academy.La possibilit de s'engager auprs de notre fondation ou de notre partenaire  Vendredi .L'opportunit de rejoindre le collectif Tech'Me UP (formations, confrences, veille, et bien plus encore...).Employeur inclusif et engag, notre socit uvre chaque jour pour lutter contre toute forme de discrimination et favoriser un environnement de travail respectueux. Cest pourquoi, attachs  la mixit et  la diversit, nous encourageons toutes les candidatures et tous les profils.https://www.soprasteria.fr/nous-connaitre/nos-engagements"
