"ID","Title","Link","Company","Location","Remote","Experience","EmploymentType","DatePosted","RoleDescription"
2693150,"Talent Acquisition Specialist","https://jobs.smartrecruiters.com/SopraSteria1/744000050952956-talent-acquisition-specialist","Steria","Brussels","No",3,"Full time","2025-04-01T02:05:30.731524Z","As Talent Acquisition Specialist you have a key role in the growth of our company.With the right message and tone of voice you know how to get IT experts, consultants and digital talents enthusiast and how to bind them to our organization.You will be responsible for the creation and publication of vacancies, CV screening, 1st interview and feedback to candidates.You will also participate in job and school fairs, meet-ups, other events and you actively contribute to our employer branding by developing recruitment campaigns in collaboration with the Talent Acquisition Lead.You use the latest recruitment tools and are supported by the nicest colleagues.Switching between your immediate colleagues, and of course the business, is very important.You develop into the expert when it comes to our target groups and know how to provide the business with trends, market information and other data within the target groups to be recruited.A job in which you can use and expand your source experience: finding the best candidates and building a solid funnel is your responsibility.At least 3 year of demonstrable work experience in recruitment, preferably in IT recruitment.You speak English, Dutch or French.You enjoy the challenge of looking for the right IT profiles through various channels.You feel at home in an IT environment.You like networking and maintaining relationships.You are a team player, but you can also work independently.You are flexible and know how to come up with creative solutions to get your target group moving.You are results-oriented and can change gear quickly in a dynamic environment.You understand that thorough research within the labour market is necessary to arrive at the right approaches.Our employees are known for making bold choices and delivering results. Work among high-level professionals at the forefront of corporate software solutions and innovation at Europes Leading Digital Service Provider.We offer a generous employee benefits package that includes:A variety of perks, such as mobility options (including a company car), insurance coverage, meal vouchers, eco-cheques, and more.Continuous learning opportunities through the Sopra Steria Academy to support your career development.The opportunity to connect with fellow Sopra Steria colleagues at various team events.People are the cornerstone of our success. Thats why we aspire to be bolder together. Our goal is to build high-functioning teams and healthy team environments that inspire and help each other to deliver excellence for each of our customers.Excited about this job opportunity? Ready to shape the world with us? Great! We are looking forward to your application!Want to know what happens next?______Sopra Steria is an equal opportunity employer. All qualified applicants will be considered for employment without regard to age, ancestry, nationality, color, family or medical leave, gender identity or expression, genetic information, immigration status, marital status, medical condition, national origin, physical or mental disability, political affiliation, protected veteran or military status, race, ethnicity, religion, gender (including pregnancy), sexual orientation or any other characteristic protected by applicable local laws, regulations and ordinances. We foster a work environment that is inclusive and respectful of all differences."
2693149,"Développeur/se - Fullstack & Cloud - Energie & Télécom - Lyon","https://jobs.smartrecruiters.com/SopraSteria1/744000050954135-developpeur-se-fullstack-cloud-energie-telecom-lyon","Steria","Limonest","Yes","Not specified","Full time","2025-04-01T02:05:30.731662Z","Votre futur environnement de travail :Lagence Energie &amp; Telecom de Lyon intervient sur des projets majeurs et  forte technicit pour des clients du secteur de l'Energie (production, transport, distribution,etc).  
Notre objectif est d'imaginer, construire et dployer des solutions numriques innovantes au service de la transformation SI et de la transition nergtique. Votre rle et vos missions :Au sein d'une quipe projet,  vous remplissez les missions ci-aprs (non-exhaustif) : Conception de l'architecture de lapplication avec les Product Owner / Business Analyst ; Accompagnement des clients dans le cadrage technologique de leurs grands programmes de transformation numrique ; Ralisation des dveloppements en assurant la qualit du delivery ; Accompagnement et support technique aux Dveloppeurs ; Suivi des phases dintgration SI et/ou environnements cloud GCP/AWS dans une chane CI/CD ; Veille technologique pour partager avec vos quipes et proposer des solutions innovantes et durables.Technologies : Java, Spring Boot, Angular, Gitlab CI/CD, Google Cloud Plateform, Cloud AWS (Lambdas) et Python.Vos comptences techniques :Indispensable : vous avez  minima 3 ans d'exprience sur Java et / ou Angular.Indispensable galement : vous avez dj volu sur des environnements Cloud AWS ou GCP avec plus particulirement l'utilisation des services manags.Souhait : vous matrisez Python. Vos comptences comportementales :Vous savez rechercher des solutions et faire preuve d'initiative :Vous ne fermez pas les yeux sur les problmes que vous dtectez. Vous alertez et proposez des solutions. Voir mme, selon votre sniorit, vous corrigez directement les problmes.Vous fates preuve d'ouverture professionnelle :Vous tes toujours motiv(e) pour acqurir des nouvelles comptences. Vous n'tes pas dpass(e) par un nouveau sujet, mais vous prenez bien le temps de vous renseigner afin d'tre en matrise.Vous avez le sens du collectif :Vous partagez avec transparence, les difficults que vous rencontrez  vos collgues afin d'obtenir de l'aide. Vous restez attentif/ve aux besoins de vos collgues afin de les aider lorsque vous tes lgitime pour.Les avantages  nous rejoindre :Vous progressez  une vitesse remarquable, grce  nos programmes de formation et  la diversit de nos missions ;Vous trouvez toujours une personne pour vous aider, au sein de notre Communaut Techme UP par exemple ;Vous voluez au rythme de vos envies, grce  laccompagnement et aux conseils de nos managers ;Vous dveloppez votre rseau au sein de lentreprise et crez des relations fortes, en participant notamment aux diffrents vnements proposs. Tmoignages : Jai rejoint Sopra Steria en qualit de Dveloppeur en 2019. Jai rapidement volu sur un rle de Lead Developer puis de Directeur Technique. Aujourdhui, jaccompagne au quotidien une communaut denviron 50 Dveloppeurs .Thomas, Directeur technique chez Sopra Steria  Jai un profil de reconverti, initialement de formation en Biologie, jai rejoint Sopra Steria en tant que Dveloppeur en 2018. Je suis actuellement Lead Developer au sein de plusieurs projets et jinterviens galement en qualit de Manager Oprationnel .Sofiane, Lead developer chez Sopra Steria Processus de recrutement :Premier change tlphonique avec la Team Recrutement, afin de faire connaissance et de valider les pr-requis pour le poste ;Entretien RH avec la Team Recrutement, afin d'apprendre  encore mieux se connatre et d'changer autour de vos comptences comportementales ;Entretien Technique avec un Expert en dveloppement, dans le but de procder  l'valuation de vos comptences pour le poste. #Ingnieur #Lead #Developer #Tech #IT #Informatique#LI-HYBRID #ARAEmployeur inclusif et engag, notre socit uvre chaque jour pour lutter contre toute forme de discrimination et favoriser un environnement de travail respectueux. Cest pourquoi, attachs  la mixit et  la diversit, nous encourageons toutes les candidatures et tous les profils.https://www.soprasteria.fr/nous-connaitre/nos-engagements"
2693148,"Desarrollador/a Powerbuilder","https://jobs.smartrecruiters.com/SopraSteria1/744000050960310-desarrollador-a-powerbuilder","Steria","Madrid","No","Not specified","Full time","2025-04-01T02:05:30.731701Z","Qu reto proponemos?Buscamos ampliar el equipo para nuestra unidad de Aeroline. Podrs trabajar con uno de los clientes ms importantes del sector aeroespacial y formar parte de un equipo multidisciplinar, trabajando en Madrid y Sevilla.Se trata de una posicin 100% presencial.Qu buscamos?Se requiere experiencia de al menos 5 aos en desarrollos Powerbuilder, para el desarrollo de aplicaciones escritorio con reflejo en aplicaciones . Net. 
Experto en bbdd y con dotes de gestin tcnica de proyecto.Qu tenemos para ti?Contrato indefinido y jornada completa23 das de vacacionesFormacin continua: competencias tcnicas, transversales y de idiomas. Contamos con acceso a certificaciones, formaciones de los principales Partners Tecnolgicos, plataformas online y mucho ms!Seguro de vida y de accidentesPosibilidad de acogerte a nuestra retribucin flexible (seguro mdico, cheques guarderas, transporte, comida y formacin)Acceso a Privilege Club, donde encontrars descuentos interesantes en las principales marcasOnboarding personalizado y detallado. Te acompaamos en todo momento para que te sientas #soprano desde el primer momento.Oficina con espacios reservados al ocio. Trabajo y diversin unido!Compaerismo y buen ambiente, el poder de la unin lo tenemos presente.Y lo ms importante...Tienes la posibilidad de desarrollar tu carrera profesional con nosotros: Crearemos juntos un plan de carrera personalizado. Te formars, marcaremos objetivos y llevaremos a cabo un seguimiento para asegurarnos de que lo conseguimos juntos. Escuchamos tus prioridades y luchamos por ellas.Aqu tu voz importa! nete a nosotros y s parte de algo ms! The world is how we shape it Adquirimos el compromiso de respetar la diversidad, creando un ambiente de trabajo inclusivo y aplicando polticas que favorezcan la inclusin y promuevan el respeto social y cultural en cuestiones de gnero, edad, funcional, orientacin sexual y religin con igualdad de oportunidades."
2693147,"ingeniero/a Labview y Sistemas RF - Inglés alto","https://jobs.smartrecruiters.com/SopraSteria1/744000050960008-ingeniero-a-labview-y-sistemas-rf-ingles-alto","Steria","Madrid","No","Not specified","Full time","2025-04-01T02:05:30.731733Z","Qu reto proponemos?Para nuestra Unidad de Aeroline, buscamos incorporar a profesionales del sector Defensa para trabajar en actividades de Ingeniera de Sistemas (diseo y especificacin de sistemas para aplicaciones espaciales).Qu buscamos?Ingeniero/a de Sistemas con al menos 3 aos de experiencia en:Diseo y desarrollo de tests con instrumentacin electrnica con LabviewDiseo y desarrollo de sistemas RF (antenas phased array, mdulos de RF)Manejo de instrumentacin electrnicaBuen nivel de inglsQu tenemos para ti?Contrato indefinido y jornada completa23 das de vacacionesFormacin continua: competencias tcnicas, transversales y de idiomas. Contamos con acceso a certificaciones, formaciones de los principales Partners Tecnolgicos, plataformas online y mucho ms!Seguro de vida y de accidentesPosibilidad de acogerte a nuestra retribucin flexible (seguro mdico, cheques guarderas, transporte, comida y formacin)Acceso a Privilege Club, donde encontrars descuentos interesantes en las principales marcasOnboarding personalizado y detallado. Te acompaamos en todo momento para que te sientas #soprano desde el primer momento.Oficina con espacios reservados al ocio. Trabajo y diversin unido!Compaerismo y buen ambiente, el poder de la unin lo tenemos presente.Y lo ms importante...Tienes la posibilidad de desarrollar tu carrera profesional con nosotros: Crearemos juntos un plan de carrera personalizado. Te formars, marcaremos objetivos y llevaremos a cabo un seguimiento para asegurarnos de que lo conseguimos juntos. Escuchamos tus prioridades y luchamos por ellas.Aqu tu voz importa! nete a nosotros y s parte de algo ms! The world is how we shape it Adquirimos el compromiso de respetar la diversidad, creando un ambiente de trabajo inclusivo y aplicando polticas que favorezcan la inclusin y promuevan el respeto social y cultural en cuestiones de gnero, edad, funcional, orientacin sexual y religin con igualdad de oportunidades."
2693146,"Incident Manager / Change Manager (Català imprescindible)","https://jobs.smartrecruiters.com/SopraSteria1/744000050969942-incident-manager-change-manager-catala-imprescindible-","Steria","Barcelona","No","Not specified","Full time","2025-04-01T02:05:30.731763Z","Buscamos incorporar a nuestro equipo un perfil Incident /Change Manager,La persona seleccionada se integrar en nuestro proyecto insignia, en la Administracin Pblica Catalana, colaborando en el principal centro de control de infraestructuras.Tus funciones del da a da sern:'- Backup del responsable de servicio'- Liderazgo de CABs'- Liderazgo de situaciones de crisis para la gestin de incidencias/cambios.'- Coordinacin y actualizacin de calendarios de cambios mayores que se presentan a clientes y proveedores'- Seguimiento de indicadores de proceso'- Seguimiento de tareas del equipo y report a los responsables de cliente'- Definicin y seguimiento de la implantacin de tareas de procesos de gestin (incidencias/cambios/problemas) No buscamos la perfeccin, pero nos gustara que tuvieras...'- Conocimientos tcnicos generales de infraestructuras y aplicaciones, que le permitan entender y liderar CABs. Esto son reuniones donde se evalan los riesgos de los cambios en infraestructuras (como comunicaciones, infraestructuras, seguridad, etc) y despliegues de aplicaciones en los diferentes entornos.'- Liderazgo y proactividad, para poder seguir tareas de otras personas del equipo asegurando la calidad y tiempos de entrega de las mismas.'-Gestin y coordinacin de calendarios de cambios mayores.'- Cataln Nativo o un nivel muy fluido (idioma vehicular del proyecto)Qu tenemos para ti?Contrato indefinido y jornada completa23 das de vacacionesFormacin continua: competencias tcnicas, transversales y de idiomas. Contamos con acceso a certificaciones, formaciones de los principales Partners Tecnolgicos, plataformas online y mucho ms!Seguro de vida y de accidentesPosibilidad de acogerte a nuestra retribucin flexible (seguro mdico, cheques guarderas, transporte, comida y formacin)Acceso a Privilege Club, donde encontrars descuentos interesantes en las principales marcasOnboarding personalizado y detallado. Te acompaamos en todo momento para que te sientas #soprano desde el primer momento.Oficina con espacios reservados al ocio. Trabajo y diversin unido!Compaerismo y buen ambiente, el poder de la unin lo tenemos presente.Y lo ms importante...Tienes la posibilidad de desarrollar tu carrera profesional con nosotros: Crearemos juntos un plan de carrera personalizado. Te formars, marcaremos objetivos y llevaremos a cabo un seguimiento para asegurarnos de que lo conseguimos juntos. Escuchamos tus prioridades y luchamos por ellas.Aqu tu voz importa! nete a nosotros y s parte de algo ms! The world is how we shape it Adquirimos el compromiso de respetar la diversidad, creando un ambiente de trabajo inclusivo y aplicando polticas que favorezcan la inclusin y promuevan el respeto social y cultural en cuestiones de gnero, edad, funcional, orientacin sexual y religin con igualdad de oportunidades."
2693145,"Alternance - Ingénieur(e) Java / Angular - Energie & Utilities - Nantes","https://jobs.smartrecruiters.com/SopraSteria1/744000050980905-alternance-ingenieur-e-java-angular-energie-utilities-nantes","Steria","Nantes","Yes","Not specified","Full time","2025-04-01T02:05:30.731793Z","Rejoignez notre quipe projet et dveloppez vos comptences avec laccompagnement dexperts, en travaillant sur des technologies de pointe pour un acteur majeur de la distribution dlectricit en France !Intgr(e) au sein dune quipe projet de 5  10 personnes, vous tes form(e) aux outils mis en uvre par le Groupe, vous permettant de monter en comptences tant sur nos mthodologies que sur les technologies utilises pour ce projet. Accompagn(e) par un Chef de projet expriment, vous mettez en uvre vos connaissances techniques pour le compte dun acteur majeur de la distribution dlectricit en France.Vous assurez la responsabilit de votre sujet de bout en bout. Des points priodiques effectus avec le Chef de projet ainsi quavec votre tuteur permettront de vous apporter laide ncessaire, vous orienter, valider les tapes et trancher les choix proposs. Des experts vous apportent le soutien ncessaire pour assurer votre monte en comptence et votre progression au sein du projet.Votre rle et vos missions : Vous apprhendez les besoins fonctionnels  raliser, matrisez les outils spcifiques mis en uvre dans un contexte dvolution permanente, tout en maintenant une attention forte sur les aspects performance et optimisation en raison de la forte volumtrie des donnes manipuls.Vous participez  lensemble des phases de la vie du projet, intgr(e) en tant quacteur  part entire, des tches de conception, dveloppement, tests, analyse, intgration, maquettage dinterface homme machine vous seront confis.Vous participez aux diffrentes squences de pilotage du projet au cours desquelles vous communiquez sur lavancement de vos travaux.Les apports de l'alternance : Approfondir vos comptences techniques avec laccompagnement des rfrents techniques ;Apprhender le secteur de lnergie et de la gestion des interventions ;Mettre en application vos connaissances des diffrents rituels Agile (Scrum) ;Montrer votre capacit  proposer des solutions permettant damliorer la maintenabilit de lapplication et maitriser la dette technique ;tre intgr(e) au sein dun collectif (projet, Nantais, groupe).Environnement technique : Langages : PHP, JavaScript, HTML5, PL-SQL, Shell - Systme dexploitation : Linux, Red Hat - BDD : Oracle, MySQL - Frameworks : Zend, Smarty, Ajax, JQuery - Outils : PHP Storm, Jenkins, Sonar, X Ray, Docker, GitlabVotre profil :Etudiant(e) en dernire anne dEcole dIngnieurs ou Cycle Universitaire ou formation quivalente, vous recherchez une alternance de fin dtudes de 12 mois.Vous disposez de qualits rdactionnelles reconnues, d'un bon esprit d'analyse et d'un sens du service.Vous voulez dcouvrir les outils et la mthodologie de mise en uvre dun projet ? Postulez !Un accord tltravail pour tltravailler jusqu 2 jours par semaine selon vos missions. Un package avantages intressant : une mutuelle, un CSE, des titres restaurants, un accord dintressement, des primes vacances et cooptation.Des opportunits de carrires multiples : plus de 30 familles de mtiers, autant de passerelles  imaginer ensemble.Plusieurs centaines de formations accessibles en toute autonomie avec Sopra Steria Academy.La possibilit de s'engager auprs de notre fondation ou de notre partenaire  Vendredi .L'opportunit de rejoindre le collectif Tech'Me UP (formations, confrences, veille, et bien plus encore...).Employeur inclusif et engag, notre socit uvre chaque jour pour lutter contre toute forme de discrimination et favoriser un environnement de travail respectueux. Cest pourquoi, attachs  la mixit et  la diversit, nous encourageons toutes les candidatures et tous les profils.https://www.soprasteria.fr/nous-connaitre/nos-engagements"
2693144,"Traineeship Data Engineering","https://jobs.smartrecruiters.com/SopraSteria1/744000050984855-traineeship-data-engineering","Steria","Brussels","No","Not specified","Full time","2025-04-01T02:05:30.731825Z","Is graduation around the corner, or do you already have some work experience? 
Then our traineeship, starting in September 2025, might be the perfect place for you to start a challenging and exciting career in data! Where youre going to get started From September 2025, you will go through an intensive 10-week training program at our headquarters in Diegem. With guidance of your personal coach, you will put your newly acquired skills into practice and prepare for your first assignment at the customer. The program will cover basic and advanced sessions to enable working in most data platform environments, and help you obtain your first certificates.  What can you expect?You will become Cloud Certified (Azure (Fabric), AWS, Databricks, Google,...) You will become proficient in querying databases through SQL. You will start building, implementing and maintaining scalable data pipelines.  You will learn how to program in Python, aligned with best practices. Data modelling will have no more secrets for you anymore. You will learn software development and participate in an Agile environment, using the Scrum principles. You will be learning how to gather requirements from various stakeholders. In time, you will become an experienced designer of data solutions. You will follow a dedicated training program designed and given by our own colleagues. Throughout and after the program, you can rely on the support of our senior colleagues. Were seeking passionate colleagues who are eager to push the boundaries in digital transformation and technology consulting. At Sopra Steria, youll have the opportunity to grow your skills in a constructive and collaborative team environment, working on impactful projects that drive change for our clients. If you thrive on challenge and meet (most of) the qualifications below, we look forward to your application! You like to solve complex (data) problems and theorems and are solution and result oriented. 
Fascinated by new trends and best practices, you make a point of working carefully and independently.  
Your backgroundYou have recently graduated or are about to graduate with a bachelor's or master's degree in a data-related field. You are eager to learn and excited to expand your knowledge across various data domains. You have strong communication skills and enjoy working in a consultancy environment. You are analytical, critical, and enjoy collaborating with others to find solutions. You have an interest in data cloud platforms. You are enthusiastic about technologies like Azure, SQL, Python, and AWS. You are fluent in Dutch and English; knowledge of French is a plus. We welcome 11.000 new colleagues every year worldwide, and its essential to us that everyone feels supported and valued. At Sopra Steria, youll work on projects that make a change for our clients. And youll get the opportunity to grow your own skills in the process, too. Your path to excellence starts at The Sopra Steria Academy, where youll get exclusive development opportunities with experts and strategic partners to fast-track you to your full potential. Youll have access to more than 250 trainings to get you there.  Youll become a part of a major Tech player in Europe recognised for its consulting, digital services, and software development.  Do you picture yourself in a fast-growing, vibrant team at the cutting edge of software implementation? Does working with international clients across multiple industries sound exciting? Then youre in the right place. We offer a generous employee benefits package that includes:  Access to our Sopra Steria training and personal development academy  A company car lease or mobility budget  A company laptop and smartphone  Monthly office drinks   Insurance coverage Meal vouchers A competitive salary with an indefinite contract People are the cornerstone of our success. Thats why we aspire to be bolder together. Our goal is to build high-functioning teams and healthy team environments that inspire and help each other to deliver excellence for each of our customers.  Excited about this job opportunity? Ready to shape the world with us? Great! We are looking forward to your application!  ______Sopra Steria is an equal opportunity employer. All qualified applicants will be considered for employment without regard to age, ancestry, nationality, color, family or medical leave, gender identity or expression, genetic information, immigration status, marital status, medical condition, national origin, physical or mental disability, political affiliation, protected veteran or military status, race, ethnicity, religion, gender (including pregnancy), sexual orientation or any other characteristic protected by applicable local laws, regulations and ordinances. We foster a work environment that is inclusive and respectful of all differences."
