"ID","Title","Link","Company","Location","Remote","Experience","EmploymentType","DatePosted","RoleDescription"
2999970,"Tech Lead - Full Stack - Défense & Sécurité - Ile de France","https://jobs.smartrecruiters.com/SopraSteria1/744000061168371-tech-lead-full-stack-defense-securite-ile-de-france","Steria","Courbevoie","Yes","Not specified","Full time","2025-05-25T02:10:52.421795Z","Le secteur Dfense et Scurit doit relever de nombreux dfis : assurer l'efficacit oprationnelle de nos clients, Concevoir et mettre  disposition des forces des solutions scurises et souveraines dans un contexte o lexcellence et linnovation font le succs de nos projets anne aprs anne.Notre quipe, dynamique et soude uvre dans un but commun : accompagner le ministre des Armes, le ministre de la Justice ou le ministre de lIntrieur pour rpondre  ses enjeux capacitaires et stratgiques (Identit numrique, scurit routire, soutien logistique et numrique des diffrentes armes, contrle aux frontires, forces de lordre, civil, pnal, pnitentiaire, cyberscurit...) avec des outils  la pointe de la technologie. Votre rle et vos missionsEn tant que responsable technique, vous serez en responsabilit de lensemble du cycle de dveloppement des applications, de leur conception en passant par leur dveloppement et la gestion de leur pipeline et jusqu leur mise en production. 1. Conception et analyse darchitecture :Participer  lanalyse des besoins techniques et fonctionnels.Concevoir des architectures volutives, performante et scurises.Proposer des solutions adaptes aux contraintes mtier et techniques. 2. Dveloppement fullstack :Chiffrer et valuer la complexit des solutionsEffectuer des dveloppements frontend complexesEffectuer des dveloppement backend complexesMener des revues de codes avec lensemble de lquipe pour partager les principes de  clean code  et de  Craftmanship  3. Production et gestion de la chane de dploiement continue :Produire des pipelines CI/CD rpondant aux normes dindustrialisation du groupe et du client (build, tests, scurit, package, dploiement...)Maintenir la plateforme CI/CD 4. Collaboration et veille technologique :Assurez le rle de responsable technique, durant le droulement projet, pour les quipes de dveloppeurs et travaillez dans ce cadre en troite collaboration avec le pilotage, la direction projet dans l'objectif de garantir une qualit du produit livr le dveloppement et la livraison de valeur mtierVeiller  la documentation technique des projetsRester  jour sur les dernires tendances et technologies du dveloppement en participant  des formations, des talks et en passant des certificationsEnvironnement technique :Langages : Java, Typescript, SQLFrameworks : Spring (boot, framework, data, security), Hibernate, Angular, ReactBase de donnes : PostgreSQL, OracleDevOps : GitLab, GitLab CI/CD, Ansible, TerraformEnvironnement Cloud : KubernetesMthodologies : Agile, Craftsmanship, TDDSopra Steria porte une attention toute particulire au bien-tre et  l'panouissement professionnel des dveloppeurs avec la Communaut Techme Up proposant entre autres : des journes de confrences, des pc boosts pour les dveloppements et des parcours de formation ddi  nos experts techniques.Vous serez accompagn par un manager, en proximit, qui vous accompagnera dans vos choix dorientation et de carrire ainsi que par la mise  disposition dun catalogue de formations certifiantes.Au-del des projets, vous aurez l'opportunit de vous impliquer dans les communauts locales, nationales ou internationales. Les thmatiques couvrent un large spectre d'innovations, de technologies ou encore de vie au travail et en dehors (Rserve militaire). De quoi dvelopper de nouvelles comptences et satisfaire votre envie de contribuer autrement.Nous recherchons un(e) Tech Lead disposant dune bonne exprience technique et managriale pour accompagner nos quipes. L'organisation, le sens du rsultat et la pdagogie sont des atouts que nous apprcions particulirement. Vous tes reconnu(e) pour votre coute, vos qualits relationnelles, votre rigueur et votre leadership.Diplm(e) d'un BAC +5 (Ecole d'ingnieurs ou quivalent), vous disposez d'une exprience d'au moins 6 ans.Ce que nous vous proposons :Un accord tltravail pour tltravailler jusqu 2 jours par semaine selon vos missions. Un package avantages intressant : une mutuelle, un CSE, des titres restaurants, un accord dintressement, des primes vacances et cooptation.Des opportunits de carrires multiples : plus de 30 familles de mtiers, autant de passerelles  imaginer ensemble.La possibilit de s'engager auprs de notre fondation ou de notre partenaire  Vendredi .L'opportunit de rejoindre le collectif Tech'Me UP (formations, confrences, veille, et bien plus encore...).#IDFEmployeur inclusif et engag, notre socit uvre chaque jour pour lutter contre toute forme de discrimination et favoriser un environnement de travail respectueux. Cest pourquoi, attachs  la mixit et  la diversit, nous encourageons toutes les candidatures et tous les profils.https://www.soprasteria.fr/nous-connaitre/nos-engagements"
2999969,"Business Analyst - Area Mutui e finanziamenti","https://jobs.smartrecruiters.com/SopraSteria1/744000061170691-business-analyst-area-mutui-e-finanziamenti","Steria","Roma","No","Not specified","Full time","2025-05-25T02:10:52.421811Z","IL TUO RUOLO:Interfaccia diretta con IT Manager Cliente  Analisi funzionale delle implementazioni richiesteStima e pianificazione attivitPredisposizione documenti di analisiPredisposizione casi di testCollaudo funzionale e applicativoSupporto funzionale e operativo.IL TUO PROFILO:Formazione: Laurea Magistrale in ambito5+ anni di esperienza lavorativa di cui almeno 3 in ambito Financial ServicesPadronanza ed esperienze maturate con il ruolo di Project managerConoscenza dei processi bancari, con focus su ambito Mutui e finanziamentiLE TUE COMPETENZE:Processi a compendio di Area Mutui e finanziamenti, in particolar modo:Conoscenze del processo del credito in ambito bancarioConoscenza degli impatti dei finanziamenti nel sistema bancario (Fidi, Segnalazioni, Contabilit, ecc..)Conoscenza dei processi di cartolarizzazione dei creditiConoscenza in ambito DWH del creditoSono gradite competenze tecniche in area mainframe e/o dipartimentaleLA NOSTRA PROPOSTA:Ti offriamo lopportunit di lavorare in una azienda dinamica orientata allinnovazione e allevoluzione tecnologicaPotrai essere parte dello sviluppo delle linee di offerta consulenziali ed apportare un tuo personale contributo a questo importante progettoPotrai cimentarti su progetti nazionali ma anche in prospettiva internazionali, che ti permetta di approfondire continuamente le tue conoscenze e di sviluppare le tue competenzeSe vuoi dare una spinta alla tua carriera ed entrare a far parte di una societ di servizi IT leader in Europa ed in continua crescita, inviaci il tuo curriculum!Sede di Lavoro: ROMA (RM) con possibilit di aderire allaccordo di smart working secondo quanto previsto dalla nostra policy aziendale. Viene comunque richiesta la disponibilit a compiere trasferte sul territorio nazionale e internazionale.
Scopri Sopra Steria! Visita il nostro sito e rimani aggiornato attraverso il blog e le pagine social https://linktr.ee/SopraSteria.

Il presente annuncio  rivolto ad entrambi i sessi, ai sensi delle leggi 903/77 e 125/91 e a persone di tutte le et e tutte le nazionalit, ai sensi dei decreti legislativi 215/03 e 216/03.
I Dati personali raccolti in relazione alla gestione delle domande di assunzione (CV, rapporti di interviste, ecc.) sono trattati da Sopra Steria Group S.p.A. in qualit di titolare del trattamento sulla base dell'interesse legittimo della societ a valutare la capacit del candidato di ottenere le posizioni lavorative che potrebbero essere proposte durante la conservazione dei tuoi dati, nonch la necessit di svolgere ogni attivit preliminare alla conclusione di un contratto di lavoro.
Le varie categorie di Dati personali raccolti sono:dati identificativi dei candidati (compresi nome, cognome, fotografia, data di nascita, indirizzo postale, numero di telefono, indirizzo e-mail);esperienza professionale, formazione, lingue.Questi Dati Personali possono essere elaborati da personale autorizzato (servizi HR) di Sopra Steria Group S.p.A. e delle imprese del Gruppo Sopra Steria. Se questi destinatari sono tenuti a trattare i tuoi Dati Personali al di fuori dell'Unione Europea, i trasferimenti di dati saranno effettuati in conformit con la legislazione in vigore.
Questi dati personali vengono conservati durante un periodo di 5 anni dopo l'ultimo contatto del richiedente da parte di Sopra Steria Group S.p.A.

Tutte le regole relative ai tuoi dati raccolti in questo modo sono dettagliate nella Carta di protezione dei dati personali (https://www.soprasteria.it/footer/informativa-sulla-privacy).

In conformit con la legislazione / i regolamenti vigenti in materia di tecnologia dell'informazione, documenti e libert civili, hai diritti di accesso, rettifica, cancellazione, portabilit, limitazione, opposizione e definizione di istruzioni riguardanti la sorte dei tuoi Dati personali dopo la tua morte. Questi diritti saranno esercitati inviando un'e-mail al responsabile della protezione dei dati (DPO) all'indirizzo DPO.Italia@soprasteria.com o per posta a questo indirizzo: Sopra Steria Group S.p.A. - Ufficio legale - Strada 4 Palazzo A7 - 20090 Assago (MI)
Hai anche il diritto di presentare un reclamo Garante per la Protezione dei Dati Personali (Piazza di Monte Citorio n. 121 00186 Roma), se il titolare del trattamento non rispetta gli obblighi previsti dalla legislazione in vigoreIl presente annuncio  rivolto ad entrambi i sessi, ai sensi delle leggi 903/77 e 125/91 e a persone di tutte le et e tutte le nazionalit, ai sensi dei decreti legislativi 215/03 e 216/03.Tutte le regole relative ai tuoi dati raccolti in questo modo sono dettagliate nell'Informativa sulla Protezione dei Dati dei Candidati (https://www.soprasteria.it/footer/protezione_dati_candidati).
In conformit con la legislazione / i regolamenti vigenti in materia di tecnologia dell'informazione, documenti e libert civili, hai diritti di accesso, rettifica, cancellazione, portabilit, limitazione, opposizione e definizione di istruzioni riguardanti la sorte dei tuoi Dati personali dopo la tua morte. Questi diritti saranno esercitati inviando un'e-mail al responsabile della protezione dei dati (DPO) all'indirizzo DPO.Italia@soprasteria.com o per posta a questo indirizzo: Sopra Steria Group S.p.A. - Ufficio legale - Strada 4 Palazzo A7 - 20090 Assago (MI).
Hai anche il diritto di presentare un reclamo Garante per la Protezione dei Dati Personali (Piazza di Monte Citorio n. 121 00186 Roma), se il titolare del trattamento non rispetta gli obblighi previsti dalla legislazione in vigore."
2999967,"Business Analyst - IT - Défense & Sécurité - Ile-de-France","https://jobs.smartrecruiters.com/SopraSteria1/744000061176065-business-analyst-it-defense-securite-ile-de-france","Steria","Courbevoie","Yes","Not specified","Full time","2025-05-25T02:10:52.421830Z","Le secteur Dfense et Scurit doit relever de nombreux dfis : assurer l'efficacit oprationnelle de nos clients, concevoir et mettre  disposition des forces des solutions scurises et souveraines dans un contexte o lexcellence et linnovation font le succs de nos projets anne aprs anne. Notre quipe, dynamique et soude uvre dans un but commun : accompagner le ministre des Armes, le ministre de la Justice ou le ministre de lIntrieur pour rpondre  ses enjeux capacitaires et stratgiques (Identit numrique, scurit routire, soutien logistique et numrique des diffrentes armes, contrle aux frontires, forces de lordre, civil, pnal, pnitentiaire, cyberscurit...) avec des outils  la pointe de la technologie. Votre rle et vos missions :Sous la responsabilit dun/e chef/fe de projet, vous intervenez sur toute la chane de valeur du cycle de projet au sein dune quipe pluridisplinaire, dynamique et soude.En tant que Business Analyst,Vous participez  la traduction du besoin mtier en proximit du client. Vous aidez  l'expression du besoin mtier, rdigez le cahier des charges ou les  Users Stories. Vous tablissez les spcifications fonctionnelles gnrales ou dtailles sur la base d'expression de besoins.Vous dfinissez la stratgie de test, les plans de test puis coordonnez les tests et la recette.Vous intervenez en support des quipes projet lors de la phase de ralisation pour expliquer le besoin mtier, guider les dveloppeurs et prciser les solutions.Post livraison vous participez au maintien en condition oprationnelle et accompagnez le mtier dans la conduite du changement via la rdaction des documentations utiles au support futur. Vous formez et maintenez  niveau les  Key-users  (relais mtiers).Vous tes garant de la solution et de l'engagement client. Vous participez activement  l'tablissement du backlog de la solution et suivez sa ralisation tout au long du projet.  Vous pratiquez sur nos projets la mthode agile : Scrum/Kanban/SAFe.Vous serez accompagn par un manager, en proximit, qui vous accompagnera dans vos choix dorientation et de carrire. Un catalogue de formations certifiantes vous permet d'acqurir ou de perfectionner vos comptences.Au-del des projets, vous aurez l'opportunit de vous impliquer dans les communauts locales, nationales ou internationales. Les thmatiques couvrent un large spectre d'innovations, de technologies ou encore de vie au travail et en dehors (Rserve militaire). De quoi dvelopper de nouvelles aptitudes et satisfaire votre envie de contribuer autrement. Votre profil :Diplm(e) d'une cole d'Ingnieurs ou quivalent universitaire, vous avez une exprience significative de 3 ans minimum en tant que Business Analyst.Vous possdez un bon relationnel, le sens du service et vous aimez travailler en quipe.Vous avez l'me d'un entrepreneur et tes passionn(e) par le pilotage, l'encadrement et le management d'quipe. Vous avez le sens de l'humain et de l'engagement, vous tes rigoureux(se) et avez le got du travail en quipe.Les avantages  nous rejoindre :Un accord tltravail pour tltravailler jusqu 2 jours par semaine selon vos missions. Un package avantages intressant : une mutuelle, un CSE, des titres restaurants, un accord dintressement, des primes vacances et cooptation.Un accompagnement individualis avec un mentor.Des opportunits de carrires multiples : plus de 30 familles de mtiers, autant de passerelles  imaginer ensemble.Plusieurs centaines de formations accessibles en toute autonomie depuis lapp mobile avec Sopra Steria Academy.La possibilit de s'engager auprs de notre fondation ou de notre partenaire  Vendredi .L'opportunit de rejoindre le collectif Tech'Me UP (formations, confrences, veille, et bien plus encore...).Employeur inclusif et engag, notre socit uvre chaque jour pour lutter contre toute forme de discrimination et favoriser un environnement de travail respectueux. Cest pourquoi, attachs  la mixit et  la diversit, nous encourageons toutes les candidatures et tous les profils.https://www.soprasteria.fr/nous-connaitre/nos-engagements"
2999966,"Senior Java Developer","https://jobs.smartrecruiters.com/SopraSteria1/744000061177616-senior-java-developer","Steria","Nieuwegein","No","Not specified","Full time","2025-05-25T02:10:52.421846Z","Wie zijn wij?Wij zijn de practice JTech van Sopra Steria en wij bieden grotere organisaties en (semi-)overheden op maat gemaakte, end-to-end technologie- en softwareoplossingen om klanten te helpen om keuzes te maken en resultaten te behalen. Hierin boeken we al jaren succes na succes!Onze klantengroepen behoren tot de sectoren overheid, financile dienstverlening of industrie en hebben een grote maatschappelijke of economische betekenis voor Nederland.Een voorbeeld van een opdracht kan het volgende inhouden: Een verouderde java applicatie met java versie 8 moet vernieuwd worden naar de laatste lts-versie;De gehele OTAP draait op een of meer RHEL-servers in de kelder van het hoofdgebouw van de klant en moet naar Azure (AKS) worden gebracht;Men twijfelt nog over de inzet van Openshift en heeft een kenner nodig om ze op weg te helpen?;De CI/CD is een Jenkins pipeline en die moet naar Azure pipelines worden omgezet;Stappen definiren om de applicatie in een Kubernetes cluster te laten draaien (Bijv. met Helm, Dockerfile, Podman, Maven dependencies);Een nieuw framework worden geselecteerd zoals bijvoorbeeld Spring of Quarkus;De bestaande unit en integration tests zinvol maken;Adviseren van de business over de beveiliging en stabiliteit van het applicatielandschap;Krijg je ideen hoe je dit verder kunt oppakken of jeuken je handen om hieraan te werken? Lees dan vooral verder!Als senior developer verwachten we dat je:Minimaal 5 jaar werkervaring hebt;Minimaal 2 frameworks of meer machtig bent zoals Spring of Quarkus;Ervaring met testmethodieken (unit, integratie, acceptatietests) en kan deze toepassenInhoudelijke kennis en kunnen toepassen van cloud technologien zoals AWS, Azure met bijvoorbeeld OpenShift;Ervaring met werken in een agile scrum omgeving;Ervaring met het werken in overeenstemming met DevOps principe;Bijdragen op het gebied van software-architectuur en technisch ontwerp;Graag werkzaam in teamverband;  Je brengt een positieve mindset en oplossingsgerichte houding;In staat om kennis en ervaring met plezier over te dragen;Bachelor in Informatica of een relevante gelijkwaardige opleiding;Ten minste Nederlands op B-1/B-2 niveauKlinkt dit nog steeds bekend? Dan ben jij de developer die we zoeken, aarzel niet en solliciteer!Dit krijg je van onsKlaar voor de volgende stap in je carrire? Dan wijzen we je graag in de juiste richting.Met kantoren in bijna 30 landen die je leiden naar plaatsen waar je nog nooit bent geweest. Wil je lieverintern groeien? Ook dat is mogelijk. We dagen je uit om jezelf te blijven uitdagen en zo telkens de besteversie van jezelf te zijn.Bij Sopra Steria zorgen we ervoor dat jij je werk met plezier n in balans kunt doen. Daarom biedenwe een aantrekkelijk en flexibel pakket aan arbeidsvoorwaarden: Een vast contract en een salaris tussen de 3.000,- en 6.500,- bruto per maand (op basis van 40 uur per week). De exacte inschaling hangt af van jouw ervaring en de rol; Vakantiegeld van 8%; Een royaal mobiliteitsbudget in de vorm van een leaseregeling van 1.022- 1.209 met de keuze uit een elektrische leaseauto met NS Business Card of leasefiets of een alternatief vervoersregeling van 930 - 1.113,- net wat het beste bij jouw manier van reizen past; Winstdeling van 8% on target (of OTB vast bedrag, afhankelijk van de functie); 27 betaalde vakantiedagen; Flex Benefits budget van  1.800, - per jaar.Dit budget kan worden gebruikt voor zaken als aankoop van extra vrije dagen of extra sparen in jouw pensioenregeling; Thuiskantoor met laptop, telefoon en een maandelijkse internetvergoeding; Hybride werken: thuis of op kantoor, afhankelijk van wat jij nodig hebt; Ontwikkelmogelijkheden via trainingen, kennisdelingssessies en inspirerende (netwerk)events; Sociale activiteiten met collegas  van gezellige borrels tot sportieve of inhoudelijke uitjes; Een flexibele pensioenregeling, waaraan jij op maat en passend bij jou, bijdragen kan toevoegen. Je kunt deelnemen aan de collectieve zorgverzekering.Lijkt deze job iets voor jou?Ben je klaar om met ons de wereld vorm te geven? Fantastisch! We kijken nu al uit naar jouw sollicitatie______Sopra Steria is een werkgever die gelijke kansen biedt. Alle gekwalificeerde sollicitanten worden in aanmerking genomen voor een job zonder rekening te houden met leeftijd, afkomst, nationaliteit, huidskleur, verlof voor familie- of medische zorg, geslachtsidentiteit of -uitdrukking, genetische informatie, immigratiestatus, burgerlijke staat, medische toestand, nationale herkomst, fysieke of mentale handicap, politieke voorkeur, beschermde veteranen- of militaire status, ras, etniciteit, religie, geslacht (inclusief zwangerschap), seksuele geaardheid of enig ander kenmerk dat wordt beschermd door toepasselijke lokale wetten, voorschriften en verordeningen. We koesteren een werkomgeving die inclusief is en alle verschillen respecteert."
2999965,"Data Architect (Data Products)","https://jobs.smartrecruiters.com/SopraSteria1/744000061179606-data-architect-data-products-","Steria","Bristol","No","Not specified","Full time","2025-05-25T02:10:52.421861Z"," Location: Yate, Bristol Salary: 60,000-70,000 Contract type: Full-time &amp; permanent  Hybrid, office 2 days per weekAs a Data Architect, Data Products at SBS, you will be responsible for designing and maintaining our overall data architecture, with a strong focus on delivering and operating data products. This includes developing foundational elements that enable scalable, reliable, and well-governed data products. You will ensure data ownership and accountability across domains and collaborate closely with cross-functional teams to translate business needs into robust data-driven solutions. You will ensure that our data is well-organised, secure, and easily accessible while overseeing the implementation of data mesh principles. Your role will involve managing data consistency across various domains and integrating data from multiple domains. You will optimise data performance and stay abreast of emerging technologies to provide strategic recommendations. What will the role involve?Design and Maintain Data Architecture: Develop and oversee the overall data architecture to support business objectives and ensure data consistency across domains. Collaborate with teams to design and operate high-quality data products that meet specific business needs, integrating key enablers such as semantic modelling, metadata, and cataloguing. Implement Data Mesh Principles: Lead the implementation of data mesh principles to manage data as a product, ensuring high-quality, reliable, and discoverable data across various domains. Data Security and Accessibility: Ensure data security, governance, and accessibility, maintaining compliance with regulatory requirements and best practices. Data Integration: Oversee data integration processes, ensuring seamless data flow across multiple sources, including databases, files, and event streams. Collaboration: Work closely with data engineers, data scientists, and other stakeholders to ensure alignment of data architecture with business needs. Technology Leadership: Stay updated with emerging data technologies and provide strategic recommendations for adopting new tools and methodologies. Performance Optimisation: Monitor and optimise data systems for performance, scalability, and reliability. What are we looking for?Data Modelling and Lakehouse Design: Strong data modelling, design, and integration expertise. Data Mesh Architectures: In-depth understanding of data mesh architectures. Technical Proficiency: Proficient in dbt, SQL, Python/Java, Apache Spark, Trino, Apache Airflow, and Astro. Cloud Technologies: Awareness and experience with cloud technologies, particularly AWS. Analytical Skills: Excellent problem-solving and analytical skills with attention to detail. Communication Skills: Strong verbal and written communication skills to effectively collaborate with cross-functional teams. Leadership: Demonstrated leadership skills with the ability to mentor and guide team members. Experience: Proven experience designing and maintaining data architectures in a complex, multi-source data ecosystem. At SBS, were committed to supporting our employees in every aspect of their lives, from health and wellbeing to financial security and lifestyle perks. Heres a snapshot of the benefits you'll enjoy as part of our team:Competitive salary: 65,000-75,000Health &amp; Wellbeing: Private Medical Insurance, Health Cash Plan, Dental Insurance, Eye Care Vouchers, Flu VaccinationsFinance &amp; Protection: Life Assurance, Critical Illness Cover, Pension Plan, Long Service Awards, Payroll Giving, Fleet car providerLeisure &amp; Lifestyle: Cycle to Work Scheme, Holiday Trading, Travel InsuranceWe are committed to fighting against all forms of discrimination and fostering a work environment that is inclusive and respectful of all differences.At our organization, we are committed to fighting against all forms of discrimination. We foster a work environment that is inclusive and respectful of all differences.All of our positions are open to people with disabilities."
