"ID","Title","Link","Company","Location","Remote","Experience","EmploymentType","DatePosted","RoleDescription"
2999955,"Chef(fe) de projet technique - Infrastructure - Rennes","https://jobs.smartrecruiters.com/SopraSteria1/744000061188485-chef-fe-de-projet-technique-infrastructure-rennes","Steria","Cesson-Sévigné","Yes","Not specified","Full time","2025-05-25T02:10:52.421972Z","Au sein de la filiale Infrastructure &amp; Cloud Services et d'une agence compose d'une centaine de collaborateurs et collaboratrices, vous intgrez une quipe chez un client grand compte dans un environnement stimulant. Vous tes accompagn(e) par une quipe dynamique qui vous fera prendre activement part au projet dans son ensemble.Votre rle et vos missions :

En tant que Chef(fe) de projet, vous intervenez pour des clients majeurs et pour ce faire, vous: Analysez et dfinissez les besoins techniques Coordonnez les dploiements d'infrastructureGrez des planningsCoordonnez les prestatairesPilotez la gestion budgtaireGarantissez le respect des engagements qualit / cot / dlais.Ce que nous vous proposons :Un accord tltravail pour tltravailler jusqu 2 jours par semaine selon vos missions.Un package avantages intressant : une mutuelle, un CSE, des titres restaurants, un accord dintressement, des primes vacances et cooptation.Un accompagnement individualis avec un manager uniqueDes opportunits de carrires multiples : plus de 30 familles de mtiers, autant de passerelles  imaginer ensemble.Plusieurs centaines de formations accessibles en toute autonomie depuis lapp mobile avec Sopra Steria Academy.La possibilit de s'engager auprs de notre fondation ou de notre partenaire  Vendredi .L'opportunit de rejoindre le collectif Tech'Me UP (formations, confrences, veille, et bien plus encore...).Diplm(e) dune cole d'Ingnieurs ou quivalent Universitaire, vous avez dj une exprience significative sur une fonction similaire.

Vous communiquez facilement en anglais et vous tes reconnu(e) pour votre coute, vos qualits relationnelles, votre rigueur et votre leadership.

Vous avez l'exprience de missions gres en mode agile ou ITIL.

Vous possdez les comptences et connaissances suivantes :Systme d'exploitation (Linux/Windows)Stockage (SAN/NAS)Service WebComptences gnraliste en InfrastructureVous avez envie d'tre au coeur d'un secteur en pleine expansion et souhaitez voluer au sein d'un grand groupe ambitieux, leader dans les technologies innovantes.

Votre sens du service client, votre esprit d'analyse et votre sens du rsultat sont apprcis et vous permettent de collaborer avec vos clients et les prestataires que vous pilotez.Le challenge vous motive? Vous vous reconnaissez ? Nous sommes impatients de vous rencontrer !Employeur inclusif et engag, notre socit uvre chaque jour pour lutter contre toute forme de discrimination et favoriser un environnement de travail respectueux. Cest pourquoi, attachs  la mixit et  la diversit, nous encourageons toutes les candidatures et tous les profils.https://www.soprasteria.fr/nous-connaitre/nos-engagements"
2999954,"Ingénieur(e) Cloud - Infrastructure - Nantes","https://jobs.smartrecruiters.com/SopraSteria1/744000061188785-ingenieur-e-cloud-infrastructure-nantes","Steria","Saint-Herblain","Yes","Not specified","Full time","2025-05-25T02:10:52.421987Z","Vous intgrez une agence dynamique qui compte 65 collaborateurs.Suivant les missions qui vous sont confies, vous tes amen(e)  voluer au sein d'quipes internes Sopra Steria dans des prestations de type Infogrance ou vous tes directement intgr(e)  des quipes client.

Nous vous proposons des missions varies aux dfis ambitieux dans des secteurs d'activit stimulants et multiculturels.

Vos missions :
Dans des environnements  haute valeur technologique et  haute disponibilit, vos missions principales sont les suivantes :Vous auditez et analysez les infrastructures clients dployes dans le Cloud public (AWS, Azure, GCP, OVH) ou dans un Cloud priv (OpenStack...);Vous construisez, dployez et veillez au bon fonctionnement des infrastructures ainsi que des solutions applicatives dans des environnements de type Cloud;Vous dveloppez, via l'Infrastructure as Code, des fondamentaux rseaux et systmes ainsi que des services Cloud Public;Vous automatisez le provisioning des environnements via des outils de dploiement continu;Vous participez aux projets de Move2Cloud de nos clients;Vous mettez en place des outils de monitoring adapts  l'environnement;Vous rdigez et valuez les procdures d'exploitation.Selon vos envies et dsirs d'apprentissage, selon les besoins de nos clients, ces missions sont volutives.


Environnement technique :Cloud : GCP, AWS, Azure;OpenSource, intgration continue GitLab, Nexus, Jenkins, Puppet;Automatisation : Ansible, Ansible Tower, Terraform;Conteneurisation : Kubernetes, OpenShift, Docker.
Ce que nous vous proposons :Un accord tltravail pour tltravailler jusqu 2 jours par semaine selon vos missions.Un package avantages intressants : une mutuelle, un CSE, des titres restaurants, un accord dintressement, des primes vacances et cooptation.Des opportunits de carrires multiples : plus de 30 familles de mtiers, autant de passerelles  imaginer ensemble. Des centaines de formations pour dvelopper vos comptences et voluer au sein du GroupeDes plateformes de formations en autonomie pour prparer vos certifications et accompagner votre dveloppement personnel La possibilit de s'engager auprs de notre fondation ou de notre partenaire  Vendredi .L'opportunit de rejoindre le collectif Tech'Me UP (formations, confrences, veille, et bien plus encore...)Votre profil :

De formation suprieure, vous justifiez d'une exprience d'au moins 3 ans dans un poste similaire.
Des certifications Microsoft et une connaissance Microsoft Azure seraient un plus !

Vos qualits d'organisation, de suivi et de rigueur, votre sens du service client, votre ractivit, votre dynamisme, votre capacit d'adaptation et de travail en quipe sont autant d'atouts pour russir dans cette mission.
Vous tes galement force de proposition dans la mise en place de nouveaux projets informatique.

 Employeur inclusif et engag, notre socit uvre chaque jour pour lutter contre toute forme de discrimination et favoriser un environnement de travail respectueux. Cest pourquoi, attachs  la mixit et  la diversit, nous encourageons toutes les candidatures et tous les profils.https://www.soprasteria.fr/nous-connaitre/nos-engagements"
2999953,"Ingénieur(e) sécurité réseau - Infrastructure - Nantes","https://jobs.smartrecruiters.com/SopraSteria1/744000061189677-ingenieur-e-securite-reseau-infrastructure-nantes","Steria","Saint-Herblain","Yes","Not specified","Full time","2025-05-25T02:10:52.422002Z","Au sein de la filiale Digitale Platform Services et d'une agence compose d'une soixantaine de collaborateurs et collaboratrices, vous intgrez une quipe chez un client grand compte dans un environnement stimulant. Vous tes accompagn(e) par une quipe dynamique qui vous fera prendre activement part au projet dans son ensemble.Prt(e)  relever le dfi avec nous ?Afin de renforcer nos quipes, nous recherchons un (e) ingnieur (e) Rseaux et Scurit. Votre rle et vos missions : Vous maintenez en conditions oprationnelles des composants de scurit et rseaux,Vous traitez des alertes de supervision, suivez la capacit et la bande passanteVous grez le patch management, traitez les vulnrabilits du primtre, analysez les flux (Sonde H5 Audit),Vous assurez le traitement des demandes JIRA sur le primtre (Ouverture de flux/cration de VIP F5/gestion de VPN avec les partenaires/gestion proxy),Vous grez des incidents d'exploitation en rapport avec ces technologies, et vous mettez en place les documentations diverses,Vous assurez le support technique N2 et N3 sur les technologies rseaux et scurit (cisco Nexus et Load Balancer F5 ; checkpoint, fortinet),Vous contribuez aux projets d'volution et des architectures de l'infra rseau &amp; scurit (Dploiement d'une solution NAC, NIST V3 ...),Vous grez les dossiers d'architecture.Les expertises attendues pour raliser cette prestation sont listes ci-aprs :Monitoring / reporting (Shinken &amp; ehealth, Tufin)F5 appliancesFirewall &amp; VPN CheckpointFirewall FortinetProxy (proxy cloud, Bluecoat, MacAfee)Ce que nous vous proposons :Un accord tltravail pour tltravailler jusqu' 2 jours par semaine selon vos missions.Un package avantages intressants : une mutuelle, un CSE, des titres restaurants, un accord d'intressement, des primes vacances et cooptation.Un accompagnement individualis avec un manager unique Des opportunits de carrires multiples : plus de 50 mtiers, autant de passerelles  imaginer ensemble.Plusieurs centaines de formations accessibles en toute autonomie depuis l'app mobile avec Sopra Steria Academy.La possibilit de s'engager auprs de notre fondation ou de notre partenaire Vendredi L'opportunit de rejoindre le collectif Tech'Me UP (formations, confrences, veille, et bien plus encore...).De formation Master 1 ou 2 cole dIngnieur ou formation quivalente, vous avez plusieurs annes d'expriences sur un poste d'Ingnieur scurit rseau.
Curieux(se), rigoureux(se) et force de proposition, vous tes reconnu(e) pour votre coute et vos capacits d'analyse et d'innovation. Vos qualits telles que la diplomatie, l'esprit d'quipe ou encore le sens du service client seront galement des atouts essentiels  votre russite dans les missions confies.
Vous tes motiv(e) pour intgrer un secteur dynamique en pleine expansion, au sein d'un grand groupe ambitieux leader dans les technologies innovantes ? Rejoignez-nous !Vous vous reconnaissez ? Nous sommes impatients de vous rencontrer !Employeur inclusif et engag, notre socit uvre chaque jour pour lutter contre toute forme de discrimination et favoriser un environnement de travail respectueux. Cest pourquoi, attachs  la mixit et  la diversit, nous encourageons toutes les candidatures et tous les profils.https://www.soprasteria.fr/nous-connaitre/nos-engagements"
2999952,"Chef/fe de Projet Technique - Infrastructure - Nantes","https://jobs.smartrecruiters.com/SopraSteria1/744000061191715-chef-fe-de-projet-technique-infrastructure-nantes","Steria","Saint-Herblain","Yes","Not specified","Full time","2025-05-25T02:10:52.422018Z","Vous intgrez lagence Infrastructure &amp; Cloud Services, qui compte 75 collaborateurs sur Nantes. Suivant les missions qui vous sont confies, vous tes amen(e)  voluer au sein d'quipes internes Sopra Steria dans des prestations de type Infogrance ou vous tes directement intgr(e)  des quipes client.Nous vous proposons des missions varies aux dfis ambitieux dans des secteurs dactivit stimulants et multiculturels.Votre rle et vos missions :Vous dfinissez les outils et procdures ncessaires au bon droulement du projetVous laborez un planning prvisionnel, rpartissez les activits et assurez le pilotage du projetVous assurez linterface vis--vis du client sur le projetVous identifiez et valuez les risques de manire prventiveVous accompagnez ou encadrez les intervenants de lquipe projetVous animez les comits techniques ou de pilotageVous accompagnez les quipes projets dans la conception et lintgration des briques techniques dinfrastructuresVous assurez une veille technologique continue sur les briques techniques et tes force de proposition et dinnovationSelon vos envies et dsirs dapprentissage, selon les besoins de nos clients, ces missions sont volutives.Environnement technique :Infrastructures techniques,Systmes dexploitation Linux/WindowsServeurs dapplicationsEnvironnements CloudConteneurisationCe que nous vous proposons :Un accord tltravail jusqu' 2 jours par semaine selon vos missionsUn package avantages intressants : une mutuelle, un CSE, des titres restaurants, un accord d'intressement, des primes vacances et cooptationUn accompagnement individualis avec un manager uniqueDes opportunits de carrires multiples : plus de 50 mtiers, autant de passerelles  imaginer ensemblePlusieurs centaines de formations accessibles en toute autonomie depuis l'app mobile avec Sopra Steria AcademyLa possibilit de s'engager auprs de notre fondation ou de notre partenaire  vendredi L'opportunit de rejoindre le collectif Guilde Cloud (Prsentations techniques, formations, confrences, veille, et bien plus encore...)Profil :Dplom(e) dun Bac+5 et issu(e) dune cole dIngnieurs ou dune formation quivalente, vous justifiez d'une exprience d'au moins 2 ans dans un poste similaire.

Vos qualits d'organisation, de suivi et de rigueur, votre sens du service client, votre ractivit, votre dynamisme, votre capacit d'adaptation et de travail en quipe sont autant d'atouts pour russir dans cette mission.Vous tes galement force de proposition dans la mise en place de nouveaux projets informatique.Employeur inclusif et engag, notre socit uvre chaque jour pour lutter contre toute forme de discrimination et favoriser un environnement de travail respectueux. Cest pourquoi, attachs  la mixit et  la diversit, nous encourageons toutes les candidatures et tous les profils.https://www.soprasteria.fr/nous-connaitre/nos-engagements"
2999951,"Ingénieur(e) Cloud - Infrastructure - Rennes","https://jobs.smartrecruiters.com/SopraSteria1/744000061187716-ingenieur-e-cloud-infrastructure-rennes","Steria","Cesson-Sévigné","Yes","Not specified","Full time","2025-05-25T02:10:52.422038Z","Vous rejoignez une agence compose d'une centaine de collaborateurs. Au sein d'une quipe dynamique, agile et  taille humaine, vous voluez dans un environnement technique riche et stimulant.Nous vous proposons des missions varies aux dfis ambitieux dans des secteurs d'activit stimulants et multiculturels : tlcom, dfense, transport, banque, services publics nationaux.Prt(e)  relever le dfi avec nous ?Vos missions au quotidien :Dans des environnements  haute valeur technologique et  haute disponibilit, vos missions principales sont les suivantes :Vous auditez et analysez les infrastructures clients dployes dans le Cloud public (AWS, Azure, GCP, OVH...) ou dans un Cloud priv (OpenStack...)Vous construisez, dployez et veillez au bon fonctionnement des infrastructures ainsi que des solutions applicatives dans des environnements de type CloudVous dveloppez, via lInfrastructure as Code, des fondamentaux rseaux et systmes ainsi que des services Cloud PublicVous automatisez le provisioning des environnements via des outils de dploiement continuVous participez aux projets de Move2Cloud de nos clientsVous mettez en place des outils de monitoring adapts  lenvironnementVous rdigez et valuez les procdures dexploitationSelon vos envies et dsirs dapprentissage, selon les besoins de nos clients, ces missions sont volutives.Suivant les missions qui vous sont confies, vous tes amen(e)  voluer au sein d'quipes internes Sopra Steria dans des prestations de type Infogrance ou vous tes directement intgr(e)  des quipes client.Environnement technique :Cloud : GCP, AWS, AzureOpenSource, intgration continue GitLab, Nexus, Jenkins, PuppetAutomatisation : Ansible, Ansible Tower, TerraformConteneurisation : Kubernetes, OpenShift, DockerCe que nous vous proposons :Un accord tltravail pour tltravailler jusqu' 2 jours par semaine selon vos missionsUn package avantages intressants : une mutuelle, un CSE, des titres restaurants, un accord d'intressement, des primes vacances et cooptationUn accompagnement individualis avec un manager uniqueDes opportunits de carrires multiples : plus de 50 mtiers, autant de passerelles  imaginer ensemblePlusieurs centaines de formations accessibles en toute autonomie depuis l'app mobile avec Sopra Steria AcademyLa possibilit de s'engager auprs de notre fondation ou de notre partenaire  vendredi L'opportunit de rejoindre le collectif Guilde Cloud (Prsentations techniques, formations, confrences, veille, et bien plus encore...)Vous justifiez d'une exprience de 5 ans minimum sur une fonction similaire.Vous tes reconnu(e) pour votre adaptabilit, votre esprit dinnovation, votre capacit  convaincre et votre esprit de synthse.Vous avez le got du challenge et vous apprciez le travail en quipe, tout en faisant preuve dautonomie.Vous recherchez des projets qui allient challenge technique, nouvelles technologies et innovation.Vous vous reconnaissez ? Nous sommes impatients de vous rencontrer !Employeur inclusif et engag, notre socit uvre chaque jour pour lutter contre toute forme de discrimination et favoriser un environnement de travail respectueux. Cest pourquoi, attachs  la mixit et  la diversit, nous encourageons toutes les candidatures et tous les profils.https://www.soprasteria.fr/nous-connaitre/nos-engagements"
2999950,"Ingénieur(e) DevOps - Infrastructure - Rennes","https://jobs.smartrecruiters.com/SopraSteria1/744000061189930-ingenieur-e-devops-infrastructure-rennes","Steria","Cesson-Sévigné","Yes","Not specified","Full time","2025-05-25T02:10:52.422053Z","Au sein de la filiale Digital Platform Services et d'une agence compose d'une centaine de collaborateurs et collaboratrices, vous intgrez une quipe chez un client grand compte dans un environnement stimulant. Vous tes accompagn(e) par une quipe dynamique qui vous fera prendre activement part au projet dans son ensemble.

Votre rle et vos missions :Vous faites partie d'une quipe de spcialistes multidisciplinaires (system team) avec une connaissance approfondie des technologies Cloud, de l'infrastructure et des contraintes applicatives :Vous dployez et assurer la maintenance :Vous tes responsable du dploiement agile de l'infrastructure demande par les quipes de dveloppementVous tes en charge de la maintenance oprationnelle et scuritaire, avec surveillance et optimisation des performances des infrastructuresVous participez aux projets et au pilotage :Vous participez activement aux phases d'analyse et de design des projets, incluant le PI planning et les SprintsVous dfinissez des outils, des procdures et des rgles permettant la russite des dploiements dinfrastructure en production pour les nouvelles fonctionnalits applicativesVous identifiez et valuez de faon prventive des risques sur les infrastructuresVous automatisez et grez les incidents :Vous accompagnez les quipes projets dans la conception et l'intgration des briques techniques dinfrastructuresVous tes en charge du support et maintien des infrastructures et des briques techniques, gestion des incidents complexes et critiquesVous grez des escalades vers les quipes de dveloppement, vous tes linterface locale de l'quipe clientVous tes force de propositions et mise en uvre des axes d'automatisation et de CICD via des outils comme Terraform, Ansible et CloudFormationVous animez et accompagnez linnovation :Vous participez aux comits techniques et  la veille technologique en continuVous accompagnez des quipes projets dans la conception et l'intgration des nouvelles solutions techniques dinfrastructures.Vous avez un rle de rfrent(e), vous tes force de propositions et dinnovation au sein des quipesSelon vos envies et dsirs dapprentissage, selon les besoins de nos clients, ces missions sont volutives.Votre environnement technique peut tre compos de :Intgration Continue : GitLab, Nexus, JenkinsAutomatisation : Ansible, Ansible Tower, TerraformConteneurisation : Docker, Kubernetes, OpenShiftEnvironnement DevOps : CI/CD avec Ansible, Terraform, Docker, Cloud (AWS, Azure, Google, OVHcloud, Outscale)Environnement Technologique : Microsoft, Linux, VmWare, Hyper-VVous ne matrisez pas toutes les technologies mentionnes ? Pas de panique grce  la Sopra Steria Academy et ses nombreuses formations et certifications nous vous accompagnons dans le dveloppement de vos comptences.
Ce que nous vous proposons :Un accord tltravail pour tltravailler jusqu' 2 jours par semaine selon vos missionsUn package avantages intressants : une mutuelle, un CSE, des titres restaurants, un accord d'intressement, des primes vacances et cooptationUn accompagnement individualis avec un manager uniqueDes opportunits de carrires multiples : plus de 50 mtiers, autant de passerelles  imaginer ensemblePlusieurs centaines de formations accessibles en toute autonomie depuis l'app mobile avec Sopra Steria AcademyLa possibilit de s'engager auprs de notre fondation ou de notre partenaire  vendredi L'opportunit de rejoindre le collectif Guilde Cloud (Prsentations techniques, formations, confrences, veille, et bien plus encore...)Votre profil :

Diplm(e) d'une cole d'Ingnieur ou quivalent, vous avez dj une exprience significative sur une fonction similaire.
Vous tes reconnu(e) pour votre adaptabilit, votre esprit d'innovation, votre capacit  convaincre et votre esprit de synthse.
Vous avez le got du challenge et vous apprciez le travail en quipe, tout en faisant preuve d'autonomie.
Vous recherchez des projets qui allient challenge technique, nouvelles technologies et innovation.

Vous vous reconnaissez ? Nous sommes impatients de vous rencontrer !Employeur inclusif et engag, notre socit uvre chaque jour pour lutter contre toute forme de discrimination et favoriser un environnement de travail respectueux. Cest pourquoi, attachs  la mixit et  la diversit, nous encourageons toutes les candidatures et tous les profils.https://www.soprasteria.fr/nous-connaitre/nos-engagements"
2999948,"Programador/a .NET/Angular","https://jobs.smartrecruiters.com/SopraSteria1/744000061195476-programador-a-net-angular","Steria","Sevilla","No","Not specified","Full time","2025-05-25T02:10:52.422069Z","Qu reto proponemos?Dentro del plan de expansin y crecimiento de nuestro Centro de Servicios buscamos incorporar a un/a Programador/a .NET/Angular con conocimientos de francs para trabajar en proyectos internacionales.Estamos buscando un desarrollador con experiencia en proyectos de .NET para incorporarse en un atractivo proyecto que desarrollamos para Francia desde nuestro Centro de Servicios de Sevilla.Si te apasiona trabajar con clientes internacionales y quieres seguir creciendo en el rea tcnica, te esperamos!Qu buscamos? Francs autnomo (mnimo B2). Experiencia de mnimo 2 aos trabajando en proyectos con tecnologas .NET. Experiencia con Angular. Capacidad analtica. Persona curiosa con capacidad resolutiva.Qu tenemos para ti?Contrato indefinido y jornada completa23 das de vacacionesFormacin continua: competencias tcnicas, transversales y de idiomas. Contamos con acceso a certificaciones, formaciones de los principales Partners Tecnolgicos, plataformas online y mucho ms!Seguro de vida y de accidentesPosibilidad de acogerte a nuestra retribucin flexible (seguro mdico, cheques guarderas, transporte, comida y formacin)Acceso a Privilege Club, donde encontrars descuentos interesantes en las principales marcasOnboarding personalizado y detallado. Te acompaamos en todo momento para que te sientas #soprano desde el primer momento.Oficina con espacios reservados al ocio. Trabajo y diversin unido!Compaerismo y buen ambiente, el poder de la unin lo tenemos presente.Y lo ms importante...Tienes la posibilidad de desarrollar tu carrera profesional con nosotros: Crearemos juntos un plan de carrera personalizado. Te formars, marcaremos objetivos y llevaremos a cabo un seguimiento para asegurarnos de que lo conseguimos juntos. Escuchamos tus prioridades y luchamos por ellas.Aqu tu voz importa! nete a nosotros y s parte de algo ms! The world is how we shape it Adquirimos el compromiso de respetar la diversidad, creando un ambiente de trabajo inclusivo y aplicando polticas que favorezcan la inclusin y promuevan el respeto social y cultural en cuestiones de gnero, edad, funcional, orientacin sexual y religin con igualdad de oportunidades."
