"ID","Title","Link","Company","Location","Remote","Experience","EmploymentType","DatePosted","RoleDescription"
2693137,"Alternance - Ingénieur(e) études et développement Big Data – Transport - Nantes","https://jobs.smartrecruiters.com/SopraSteria1/744000050987536-alternance-ingenieur-e-etudes-et-developpement-big-data-transport-nantes","Steria","Nantes","Yes","Not specified","Full time","2025-04-01T02:05:30.732064Z","Plongez au cur du Big Data et devenez un acteur cl de la transformation numrique dun leader du transport logistique avec des solutions innovantes et  forte valeur ajoute !Dans le cadre de la transformation du SI Post-Oprationnel vers loffre Big Data, vous intervenez sur les phases de ralisation des solutions dlivres et sur les phases amont dtudes :Etudes fonctionnelles et techniques ;Ingestion des flux de donnes ;Modlisation et traitements des donnes ;Restitution et valorisation des donnes au sein de solution de data visualisation.Votre rle et vos missions :Vous intgrez donc le Centre de comptences BI &amp; Big Data qui accompagne notre client sur les technologies de traitement et de valorisation des donnes.Nos quipes  taille humaine y mnent des projets Agiles, entoures de leaders techniques apportant leur expertise, au quotidien et lors de formations ddies. Ils vous encadrent sur vos missions, avec votre Project manager et votre tuteur.Environnement technologique :Spark, Scala, Kafka, Nifi, Cloud, K8s, Airflow, Power BI, Git/JenkinsLes apports de l'alternance :Dcouvrir le framework Scrum ;Approfondir votre connaissance des environnements Big Data ;Concevoir des solutions industrielles  forte plus-value mtier ;Imaginer des usages de la donne et dvelopper sa force de proposition ;Disposer dun environnement de travail prsentant une solide expertise technologique ;Interagir au sein dquipes multidisciplinaires.Votre profil :Vous tes curieux (se), vous avez le sens du service, un bon relationnel et vous aimez travailler en quipe. Vous avez de bonnes capacits d'adaptation et vous tes force de proposition.Actuellement en dernire anne dEcole d'Ingnieurs, en Master 2 informatique ou formation quivalente, vous avez des aptitudes  rsoudre des problmes complexes et vous tes prt(e)  relever le challenge ? Un accord tltravail pour tltravailler jusqu 2 jours par semaine selon vos missions. Un package avantages intressant : une mutuelle, un CSE, des titres restaurants, un accord dintressement, des primes vacances et cooptation.Des opportunits de carrires multiples : plus de 30 familles de mtiers, autant de passerelles  imaginer ensemble.Plusieurs centaines de formations accessibles en toute autonomie avec Sopra Steria Academy.La possibilit de s'engager auprs de notre fondation ou de notre partenaire  Vendredi .L'opportunit de rejoindre le collectif Tech'Me UP (formations, confrences, veille, et bien plus encore...).Employeur inclusif et engag, notre socit uvre chaque jour pour lutter contre toute forme de discrimination et favoriser un environnement de travail respectueux. Cest pourquoi, attachs  la mixit et  la diversit, nous encourageons toutes les candidatures et tous les profils.https://www.soprasteria.fr/nous-connaitre/nos-engagements"
2693136,"Sopra Sterias Accelerateprogram 2025","https://jobs.smartrecruiters.com/SopraSteria1/744000050990944-sopra-sterias-accelerateprogram-2025","Steria","Stockholm","No","Not specified","Full time","2025-04-01T02:05:30.732091Z","Sopra Sterias Accelerateprogram 2025Genom vrt traineeprogram Accelerate, som blivit utsett till Sveriges bsta inom IT av Karrirfretagen, rivstartar du din karrir som konsult inom digital transformation.Sopra Steria Accelerate ger dig med hga ambitioner en strukturerad utvecklingsplan fr dina frsta tre r i konsultyrket. Vi vet att den strsta utvecklingen som konsult sker genom att jobba i riktiga kunduppdrag och att f lra sig i skarpt lge. Drfr r du konsult frn start och kommer till strsta delen att bygga din kompetens genom att jobba i uppdrag hos ngon av vra kunder.Parallellt med ditt uppdrag erbjuder vi dig utbildning som strker din kompetens och ger dig relevanta verktyg inom flera olika verksamhetsomrden. Alla utbildningar r skrddarsydda fr att du ska utvecklas i konsultrollen och trna tillsammans med kollegor i en trygg milj. Exempel p utbildningar inom programmet r Explore Team Delivery och Develop your Innovation Skills. Inom programmet ges du mjlighet att bygga ett brett ntverk bde genom arbete i projekt och uppdrag med kollegor inom Sopra Steria.Hos oss blir du anstlld frn dag ett och fr en marknadsmssig ln. Vi erbjuder helt enkelt ett inspirerande och utvecklande program fr dig som r nyutexaminerad och vill ha en framgngsrik karrir som konsult. Vrt ml r att du ska lyckas och utveckla dig till att bli en av marknadens vassaste konsulter.Vi erbjuder fljande inriktningar 2025: Advisory (Stockholm, Gteborg)Data &amp; Analytics (Tillsatt alla platser)Digital Platform Services (Stockholm)Microsoft Business Applications CRM (Gteborg)Systemutveckling (Gteborg)Tech Management (Tillsatt alla platser)Hr kan du lsa mer om programmet och se mer information kring inriktningarna: Inriktningar traineeprogram Accelerate (soprasteria.se)Vi sker dig som:r p vg att avsluta dina studier eller r nyutexaminerad p kandidat- eller masterniv frn universitet eller hgskola (examen 2024 eller 2025).Har lst en ingenjrsutbildning eller annan relevant teknisk utbildning inom data/systemvetenskap, IT eller liknande. Har goda kunskaper i tal och skrift p svenska och engelska.r bde en bra lyssnare och en god kommunikatr vilket gr att du kan se nya mjligheter i ditt uppdrag. En av de saker som symboliserar en framgngsrik konsult r hgt affrsmannaskap. Ute i ditt uppdrag r du en relationsbyggare fr Sopra Steria och kunden.r ambitis och mlinriktad och kan visa att du klarar att frverkliga det du har bestmt dig fr att gra, bde genom studier och p fritiden. Vi ser grna att du har visat driv och nyfikenhet genom att engagera dig i olika aktiviteter vid sidan om dina studier.Framfr allt, brinner du fr att jobba med digitalisering!Anskan:Vi arbetar med lpande urval i denna process, s ansk redan idag genom att ladda upp ditt CV samt betyg eller examensbevis frn din utbildning. Betyg eller examensbevis ska bifogas under vriga bilagor i anskan. Skicka inte med ett personligt brev. Om du r intresserad av Accelerateprogrammet men osker p vilken inriktning du ska vlja, hjlper vi dig att hitta rtt under rekryteringsprocessen. Vi frvntar oss dock att du har lst p om de olika inriktningarna som r ppna i r innan intervjun och har en uppfattning om vilka omrden som intresserar dig mest. Om du gr vidare i rekryteringsprocessen kommer du att f ett utskick med logik- och personlighetstest, vilka r obligatoriska i vr rekryteringsprocess.Sista anskningsdag: 2025-04-07Sopra Steria har kunder och projekt som kan krva skerhetsgodknnande p olika niver.Sopra Steria r ett ledande internationellt konsultbolag inom digital transformation. Vi bygger samhllet genom designdriven innovation, teknisk utveckling med kunskap om marknadens ledande plattformar och driftlsningar (managed services). Med modern teknologi och en gedigen affrsfrstelse r vi en helhetspartner fr vra kunder och deras digitala transformationsresa. Enligt Great Place To Work r vi en av Sveriges bsta arbetsplatser, vi har tilldelats utmrkelsen Karrirfretag flera r i rad och Gartner har listat oss som ett topp 5 bolag inom digital transformation."
2693135,"Information Security Officer","https://jobs.smartrecruiters.com/SopraSteria1/744000050993545-information-security-officer","Steria","Bristol","No",3,"Full time","2025-04-01T02:05:30.732119Z"," Location: Bristol or Sheffield Salary: 55,000-70,000 DOE Contract type: Full-time &amp; permanent  Hybrid, office 2 days per weekWe are on the lookout for an experienced Cloud Information Security Officer to help drive forward our commitment to providing a world-class information security management system for our products and services that protects both Sopra Banking Software and our customers' interests. This role will report to the Security, Risk and Compliance Lead.Proactively monitor for, identify, respond to, and resolve security incidentsAlign information security strategy with business goals and objectives.Ensure compliance with relevant local and international laws, as well as internal policies.Foster a culture of information security awareness and continuous improvement.Drive the adoption of best practices in data protection and cybersecurity.Maintain a strong relationship with internal teams and our customers by demonstrating an understanding of, and by executing best practices within information security.Update and maintain Information Security Policies, procedures and supporting operational collateral.Manage internal and external audit events (e.g., SOC1, ISO 27001) and information security requests from customers to demonstrate compliance with industry best practices and customer contractual obligations.Remain up to date with the latest threats and vulnerabilities to ensure operational tools and processes are in place and up to date.Participate in the identification, assessment, registration, and treatment of information security risks.Minimum of 3 years of experience working in an information security role, or an information security-related qualification.Experience working in and securing cloud environments (AWS preferred)Excellent working knowledge of common security tools and platforms.Familiarity with GDPR, ISO 27001 and other relevant information security laws and standards.Excellent written and verbal communication skills, with the ability to convey complex information.A very strong understanding of information security concepts and best practices.Capable of managing emerging information security risks and how these can be mitigated. Were committed to supporting our employees in every aspect of their lives, from health and wellbeing to financial security and lifestyle perks. Heres a snapshot of the benefits you'll enjoy as part of our team:Competitive salary: 55,000-70,000 DOEHealth &amp; Wellbeing: Private Medical Insurance, Health Cash Plan, Dental Insurance, Eye Care Vouchers, Flu VaccinationsFinance &amp; Protection: Life Assurance, Critical Illness Cover, Pension Plan, Long Service Awards, Payroll Giving, Fleet car providerLeisure &amp; Lifestyle: Cycle to Work Scheme, Holiday Trading, Travel InsuranceAt our organization, we are committed to fighting against all forms of discrimination. We foster a work environment that is inclusive and respectful of all differences.All of our positions are open to people with disabilities."
2693134,"Cloud Cyber Security Manager","https://jobs.smartrecruiters.com/SopraSteria1/744000050996655-cloud-cyber-security-manager","Steria","Yate","No","Not specified","Full time","2025-04-01T02:05:30.732148Z"," Location: Yate, Bristol Permanent, fulltime60,000-80,000 per annum (dependant of experience)  Hybrid: Minimum of 2 days in the office per weekAre you passionate about information &amp; cyber security and looking for your next challenge in a dynamic, fast-growing environment? Our Managed Services function is expanding, and were searching for a Cloud Cyber Security Manager to join our team and make a real impact.In this hands-on role, you'll work across teams, ensuring security is embedded into everything we do. Youll be at the heart of monitoring, protecting, and enhancing our security posture while collaborating with key stakeholders across the business. This is an opportunity to be part of a forward-thinking, security-first culture where your expertise will help drive continuous improvement in a rapidly evolving landscape.What will the role involve?Proactively monitor, detect, and respond to security threats  be the first line of defence in keeping our systems safe.Conduct internal security and compliance audits to ensure processes are followed, and security controls are effective.Collaborate with stakeholders to advocate for and implement best-in-class security practices.Support projects and business initiatives, ensuring security is at the forefront.Mentor and guide junior analysts, sharing your expertise to strengthen our security capabilities.Key Responsibilities:Investigate and respond to security alerts, document findings and collaborate with relevant teams.Lead internal audits to ensure compliance with ISO 27001 and our security policies.Identify vulnerabilities across networks, operating systems, applications, and databases, ensuring risks are addressed effectively.Stay ahead of emerging cyber threats, driving improvements in our security strategy and processes.Provide operational security support to Managed Services teams.Engage with customers and external auditors to demonstrate the strength of our security controls.Ensure changes introduced through CAB do not introduce security risks.Generate and deliver security reports for customers and maintain security packs for project teams.This is your chance to make a real impact in a company that values innovation, collaboration, and security excellence. If youre ready to take your career to the next level, apply today! What are we looking for?Experience securing cloud environments (AWS preferred).A background as a Cyber Security Officer or similar role within a large organisation.Strong knowledge of vulnerability assessment tools &amp; techniques.A solid understanding of networking technologies, security best practices, and OS hardening.Awareness of cyber threats and adversarial techniques used to compromise systems.It would be a bonus if you also had:Security certifications  CompTIA Security+, CISSP, AWS/Cloud certifications are a plus!Experience with Rapid7 InsightVM &amp; InsightIDR or securing enterprise databases.Familiarity with UK financial sector regulations and banking IT operations.What are we offering?At SBS, were committed to supporting our employees in every aspect of their lives, from health and wellbeing to financial security and lifestyle perks. Heres a snapshot of the benefits you'll enjoy as part of our team:Competitive salary: 60,000-80,000 per annumHealth &amp; Wellbeing: Private Medical Insurance, access to Peppy (Menopause, Fertility, Baby, Mens health, Womens health Support), Health Cash Plan, Dental Insurance, Eye Care Vouchers, Flu VaccinationsFinance &amp; Protection: Life Assurance, Critical Illness Cover, Pension Plan, Long Service Awards, Payroll Giving, Fleet car providerLeisure &amp; Lifestyle: 25 days annual leave, Cycle to Work Scheme, Holiday Trading, Travel InsuranceAs part of our hiring process, new employees will be required to pass a confidential consumer credit check and DBS check. This is a straightforward credit check for CCJs, bankruptcy and a criminal record check, however if you wish to know more about what is or is not acceptable please ask our recruitment team.At our organization, we are committed to fighting against all forms of discrimination. We foster a work environment that is inclusive and respectful of all differences.All of our positions are open to people with disabilities."
2693133,"Product Consultant","https://jobs.smartrecruiters.com/SopraSteria1/744000051013815-product-consultant","Steria","Sheffield","No","Not specified","Full time","2025-04-01T02:05:30.732176Z"," Location: Sheffield Salary: 50,000k-60,000 Contract type: Full-time &amp; permanent  Hybrid, office 2 days per weekWe are looking for a Product Consultant to implement and support our mortgage and savings solutions from pre-sales through to go live, and beyond to ensure our clients are making the best use of the functionality available to maximise efficiencies. Time will be a hybrid of remote and office-based working, and client sites (based throughout the UK).A key responsibility of the Product Consultant is to understand the clients current and target business processes, then help to refine their requirements and deliver the solution proposition. This will cover a wide range of assignments, including:Subject Matter Expert in SBS products, recommending product or business solutions within your disciplineUnderstand the needs of the client and proactively offer assistance within the scope of the project, defining and documenting configuration requirements and associated technical solutionsImplement software configuration in line with client requirements, working with senior colleagues, product managers and development teams to deliver solutions and highlight functionality gapsConsult on the underlying data model, with the ability to carry out field mapping activities relating to external integrations and APIsFollow defined consultancy methodology ensuring consistency and traceability of approachKnowledge transfer to both customers and colleagues in order to share product information and best practiceWhat are we looking for?Experience working within a software solutions provider or, in software implementation/upgrade projects, ideally within the Financial Services sectorExperience of working on large scale data and systems migration projectsConfidence in a client facing role, including workshop facilitation and undertaking customer demonstrationsGood working knowledge of relational databases, including SQL (Oracle an advantage)An understanding of APIs, Web services and Cloud technologiesIt would be advantageous to have:Good working knowledge of mortgage and savings operations within the UK (origination and servicing), including regulation and best industry business practiceIf you do not have all of the above experience or skills we would still like to hear from you.Were committed to supporting our employees in every aspect of their lives, from health and wellbeing to financial security and lifestyle perks. Heres a snapshot of the benefits you'll enjoy as part of our team:Competitive salary: 50,000-60,000 DOEHealth &amp; Wellbeing: Private Medical Insurance, Health Cash Plan, Dental Insurance, Eye Care Vouchers, Flu VaccinationsFinance &amp; Protection: Life Assurance, Critical Illness Cover, Pension Plan, Long Service Awards, Payroll Giving, Fleet car providerLeisure &amp; Lifestyle: Cycle to Work Scheme, Holiday Trading, Travel InsuranceAs part of our hiring process, new employees will be required to pass a confidential consumer credit check and DBS check. This is a straightforward credit check for CCJs, bankruptcy and a criminal record check; however, if you wish to know more about what is or is not acceptable,please ask our recruitment team.At our organization, we are committed to fighting against all forms of discrimination. We foster a work environment that is inclusive and respectful of all differences.All of our positions are open to people with disabilities."
2693132,"Tech lead - PHP/Symfony - Services Publics - Montpellier","https://jobs.smartrecruiters.com/SopraSteria1/744000051034652-tech-lead-php-symfony-services-publics-montpellier","Steria","Montpellier","Yes","Not specified","Full time","2025-04-01T02:05:30.732206Z","Fort de ses succs et en pleine dynamique de croissance, le vertical Services Publics qui regroupe sur le Sud-Est 250 collaborateurs recherche son(sa) futur(e) talent. Vous intgrez une quipe de 4  10 personnes et vous intervenez sur des projets de complexit grandissante.

Vous souhaitez vous investir sur des projets  forts enjeux socitaux impactant le quotidien des citoyens, alliant challenges et innovation ? Intgrer une entreprise o rgnent un esprit entrepreneurial fort et une atmosphre propice  votre volution ?

Alors rejoignez-nous et intervenez sur des projets auprs d'acteurs du secteur public et de la sant pour structurer, en tant Leader Technique, un Centre de Services mutli-client en structuration autour des technologies PHP/Symfony. Vos missions :
- Vous assurez le rle de responsable de dveloppement, durant le droulement de projets, pour les quipes de dveloppeurs et travaillez dans ce cadre en troite collaboration avec le pilotage, la direction de projet, dans l'objectif d'assurer le dveloppement et la livraison de valeur mtier auprs de votre client
- Vous tes garant de la qualit des dveloppements, en ce sens vous appliquez et partagez les bonnes pratiques de dveloppement : revues de code des dveloppeurs de l'quipe, gestion de la qualimtrie, prise dinitiative sur de linnovation
- Vous adopter une posture de coaching pour partager vos connaissances et savez transfrer votre savoir-faire  votre quipe ainsi qu' vos pairs, vous tes attendu comme un lment fdrateur qui uvre pour le collectif
- Vous implmentez la dmarche d'industrialisation et de qualit propose par Sopra Steria
- Vous animez le travail d'une ou plusieurs quipes et participez aux phases de conception et de dveloppement des user stories et vous prenez un rle de support technique au sein de l'quipe
- Vous ralisez le dveloppement de sujets techniques complexes en prenant en compte l'ensemble des aspects de scurit, de performance, d'accessibilit, dimpact numrique

Vous travaillez dans un environnement technique riche et innovant :
- Langages : PHP 8+, Symfony 6.4
- Base de Donnes : PostegreSQL 16
- Infrastructure : Docker (avec connaissance dorchestration), OpenShift, Azure Stack
- DevOps : GitLab, Jenkins, Sonarqube, Checkmarx, Promyze, GatlingDot(e) d'un bon relationnel, l'esprit d'quipe et la transmission de votre savoir-faire n'a pas de secret pour vous. Vritable rfrent(e) technique, vous proposez des solutions innovantes en adquation avec les enjeux projets et besoins clients.De formation cole d'Ingnieurs ou diplm(e) d'un Master 2 Informatique, vous possdez au minimum 8 ans d'exprience post diplme. Vous matrisez la conception, le dveloppement, les tests et l'industrialisation dans des environnements technologiques diffrents.
 Un accord tltravail pour tltravailler jusqu 2 jours par semaine selon vos missions. Un package avantages intressant : une mutuelle, un CSE, des titres restaurants, un accord dintressement, des primes vacances et cooptation.Un accompagnement individualis avec un mentor.Des opportunits de carrires multiples : plus de 30 familles de mtiers, autant de passerelles  imaginer ensemble.Plusieurs centaines de formations accessibles en toute autonomie depuis lapp mobile avec Sopra Steria Academy.La possibilit de s'engager auprs de notre fondation ou de notre partenaire  Vendredi .L'opportunit de rejoindre le collectif Tech'Me UP (formations, confrences, veille, et bien plus encore...).Employeur inclusif et engag, notre socit uvre chaque jour pour lutter contre toute forme de discrimination et favoriser un environnement de travail respectueux. Cest pourquoi, attachs  la mixit et  la diversit, nous encourageons toutes les candidatures et tous les profils.https://www.soprasteria.fr/nous-connaitre/nos-engagements"
2688936,"Systemutvecklare .NET","https://jobs.smartrecruiters.com/SopraSteria1/744000050889375-systemutvecklare-net","Steria","Göteborg","Yes","Not specified","Full time","2025-04-01T02:05:30.732236Z","Vi sker .NET-utvecklare till Stockholm, Malm och Gteborg! 
Vill du vara en del av ett av Sveriges bsta arbetsgivare och hjlpa vra kunder att ta nsta steg i sin digitala resa? Sopra Steria sker fler .NET-utvecklare till vra agila team  hr mts trygghet, flexibilitet och en kultur prglad av kunskapsdelning. Vi kallar det Power of Sharing!Om rollen
Som .NET-utvecklare hos oss kommer du att bli en viktig del av vra kunders digitala transformation. Du arbetar nra bde kunder och kollegor fr att utveckla innovativa och affrskritiska lsningar. Vra projekt strcker sig ver flera branscher, bland annat telekom och offentlig sektor, dr vi har stora behov av agila teamleveranser.Du fr chansen att arbeta med modern teknik tillsammans med erfarna utvecklare och vara med och forma lsningar som gr skillnad i samhllet. P Sopra Steria mts du av en stark teamknsla och en kultur dr kunskapsspridning och samarbete r centrala  ngot vi tror r nyckeln till bde personlig och gemensam framgng. Ls grna mer om oss och hur vi tnker hr: klick!. Vi sker dig som:Har minst 5 rs erfarenhet av .NET-utveckling.Har du dessutom erfarenhet av JavaScript, Azure eller mikrotjnster, vore det toppen!Trivs med att arbeta som konsult och gillar att dela kunskap med kollegor.Behrskar svenska och engelska i tal och skrift.Varfr Sopra Steria?
Hos oss fr du arbeta med teknik i framkant tillsammans med engagerade kollegor. Vi erbjuder spnnande och varierande uppdrag dr du kan pverka projekt som gr skillnad i samhllet. Med kollektivavtal, marknadsmssiga lner, flexibilitet och en kultur prglad av delning och samarbete vill vi ge dig den bsta arbetsmiljn fr att lyckas.Anskan
Vill du bli en del av vrt .NET-team? Ansk enkelt genom att ladda upp ditt CV p vr hemsida. Har du frgor om tjnsten? Kontakta vr rekryterare Hanna Korell p hanna.korell@soprasteria.com.Urval och intervjuer sker lpande  skicka drfr in din anskan s snart som mjligt. Vi ser fram emot att hra frn dig!Sopra Steria har kunder och projekt som kan krva skerhetsgodknnande p olika niver.Sopra Steria r ett ledande internationellt konsultbolag inom digital transformation. Vi bygger samhllet genom designdriven innovation, teknisk utveckling med kunskap om marknadens ledande plattformar och driftlsningar (managed services). Med modern teknologi och en gedigen affrsfrstelse r vi en helhetspartner fr vra kunder och deras digitala transformationsresa. Enligt Great Place To Work r vi en av Sveriges bsta arbetsplatser, vi har tilldelats utmrkelsen Karrirfretag flera r i rad och Gartner har listat oss som ett topp 5 bolag inom digital transformation."
