"ID","Title","Link","Company","Location","Remote","Experience","EmploymentType","DatePosted","RoleDescription"
2993250,"Er du nyutdannet i 2025 og ønsker å jobbe med skytjenester?","https://jobs.smartrecruiters.com/SopraSteria1/744000060992554-er-du-nyutdannet-i-2025-og-nsker-a-jobbe-med-skytjenester-","Steria","Trondheim","No","Not specified","Full time","2025-05-25T02:10:52.422223Z","Som nyutdannet i Sopra Steria fr du en rakettstart p arbeidslivet hos n av Norges beste arbeidsplasser! Vi er fortsatt p utkikk etter nyutdannede innen teknologi til kontoret vre i Trondheim.I Sopra Steria er vi opptatt av  bruke kunnskap og teknologi for  levere gode lsninger sammen med kundene vre, til det beste for samfunnet vrt. Ikke minst s er vi opptatt av  vre en skikkelig god arbeidsplass for alle som jobber her. Power of Sharing er et begrep som sitter i ryggmargen hos de som jobber hos oss, s her er det alltid noen som vil dele av sin kunnskap og erfaring! Hva kan du jobbe med innen teknologi?
Vi er Norges ledende fagmilj innen moderne digitale plattformer  med breddekompetanse som strekker seg fra sky og infrastruktur til utvikling og integrasjon. Hos oss fr du jobbe med noen av landets mest komplekse og spennende prosjekter, hvor vi blant annet bistr store virksomheter med:Optimalisering av applikasjonsportefljerInfrastruktur som kode (IaC)Integrasjoner og modernisering i forbindelse med oppkjp og fusjoner Sopra Steria er en strategisk partner p skyreisen til Norges strste virksomheter!Vi ser etter deg som brenner for teknologi  enten du er interessert i skytjenester, data og integrasjon, programmering eller pen kildekode (Open Source). Hos oss kan du blant annet:Designe og utvikle lsninger basert p teknologi fra ledende skyleverandrer som Microsoft Azure, Google Cloud og Amazon Web Services  samt pen kildekode fra blant annet Cloud Native Computing Foundation (CNCF)Levere verdi kontinuerlig gjennom smidige metoder og DevOps-prinsipper  enten i produktteam eller platform engineering-teamEtablere og forvalte utviklings-, data- og integrasjonsplattformer som akselererer produktutvikling og gir fart til forretningen Hvem ser vi etter?Vi ser etter deg som er nyutdannet vren 2025 og nsker  vre med p  utvikle samfunnet sammen med vre kunder. I tillegg hper vi du kjenner deg igjen i flgende:Du har en teknisk utdannelse p masternivDu har en interesse for digitalisering og teknologiDu er nysgjerrig p  jobbe som konsulent, og  jobbe med kunder i ulike bransjerDu har ikke mer enn ett rs relevant arbeidserfaring etter endt utdanningDu kommuniserer godt p norsk, muntlig og skriftligDu har karakterer som gjr deg og de rundt deg stolteVi tror at du vil oppleve mestring, utvikle deg og ha det gy som konsulent hos oss dersom du anser deg selv som strukturert og mlbevisst, kundeorientert, samt god til  samarbeide og bygge relasjoner. Muligheter for utvikling og nettverksbyggingNyutdannede i Sopra Steria har mulighet til  delta i kompetanseprogrammet Accelerate. Programmet tilbyr samlinger som gir innsikt i Sopra Sterias virksomhet og arbeidsmetoder, samt mulighet til  bygge nettverk og fokusere p personlig utvikling. Det er frivillig  delta p samlinger knyttet til dette kompetanseprogrammet. Som nyutdannet hos oss vil du ogs f mulighet til  vre med p mye sosialt og moro ved siden av hverdagen som konsulent. Gode grunner til  velge oss:Vi nsker at du har det bra bde p og utenfor jobb. Derfor tilbyr vi:En rekke kurs, fagsamlinger og mulighet for  ta sertifiseringer tilpasset din rolleEt godt og trygt arbeidsmilj (snikskryt: vi har blitt kret til Norges beste arbeidsplass flere r p rad)En ekstra lnnet ferieuke i ret (seks uker til sammen)Over 60 ulike aktivitetsgrupper innen alt fra idrett og friluftsliv, til gaming og karaokeGode forsikringsordninger som bl.a. dekker flere behandlinger hos fysioterapeut, kiropraktor og andre helsetjenesterBedriftshytter p Hemsedal, Hafjell, Trysil, Norefjell og BeitostlenFor at vi skal lykkes med vrt arbeid i Sopra Steria, m vi vre en arbeidsplass hvor alle fler tilhrighet, trygghet og anerkjennelse. Derfor verdsetter vi forskjeller hos vre medarbeidere, og anvender den kompetansen som ulikhetene frer med seg, til det beste for vre kunder og ansatte.Oppstartsdato: 04. august 2025Sknadsfrist: SnarestFor at vi skal kunne vurdere din sknad, m flgende dokumenter lastes opp: sknadsbrev, CV og forelpig karakterutskrift/vitneml. Sknader vurderes fortlpende.Sopra Steria har kunder og prosjekter som kan kreve sikkerhetsklarering p ulike niver.Vi er Norges ledende konsulentselskap innen digitalisering, innovasjon og brekraft, og gjennom en rrekke har vi vrt rangert som en av Norges beste arbeidsplasser. Som et av Europas strste konsulentselskaper, bistr vi store private selskaper og offentlige virksomheter med sin omstilling.Vi er opptatt av  skape verdi for vre kunder og samfunnet, og har som ml  skape en bedre og mer brekraftig fremtid.I Norge srger vre 3300 medarbeidere for en rlig omsetning p over 5,9 milliarder kroner i 2024. Vi har kontorer i Oslo, Stavanger, Trondheim, Bergen, Drammen, Hamar, Fredrikstad, Kristiansand og Troms. Totalt i selskapet er vi 51 000 medarbeidere fordelt p 30 land, og hadde en omsetning p  5,8 milliarder i 2024.Vi ble kret til rets konsulentselskap i 2023 og 2024"
2993248,"Medior/Sr. Business Analyst  – FEC Screening Systems (Sanction Detection)","https://jobs.smartrecruiters.com/SopraSteria1/744000060993052-medior-sr-business-analyst-fec-screening-systems-sanction-detection-","Steria","Nieuwegein","No","Not specified","Contract","2025-05-25T02:10:52.422239Z","Stap in de cruciale wereld van Know Your Customer (KYC) en het bestrijden van financile criminaliteit (FEC) bij banken en financile instellingen. Sopra Steria staat aan de frontlinie van het beschermen van het financile systeem met geavanceerde, data-gedreven Sanction Screening-technologien. Dit proces detecteert transacties waarbij personen of organisaties betrokken zijn die mogelijk risicos vormen op het gebied van sancties, terrorismefinanciering of witwassen.Wat ga je doen?Als Business Analyst speel je een sleutelrol in het vormgeven, testen en afstemmen van onze sanctie screening systemen en -modellen op het beleid, de risicostandaarden en compliance procedures van de klant. Je bent verantwoordelijk voor de volledige levenscyclus van jouw features  van het definiren van de requirements en begeleiden van de implementatie tot het monitoren van de prestaties en rapporteren van de resultaten. Je bent zowel een strategische denker als een hands-on analist, in staat om complexe zakelijke behoeften te vertalen naar duidelijke en uitvoerbare taken voor jouw squad.Jouw verantwoordelijkheden/taken zijn: Specificeren van zakelijke en technische vereisten via interviews, workshops, demos en samenwerkingDefiniren van duidelijke en testbare acceptatiecriteria voor features en epicsPrioriteren en onderscheid maken tussen wereldwijde must-haves en nice-to-haves om de integriteit van wereldwijde standaarden te waarborgenAnalyseren en beoordelen van sanctie screening algoritmen, regels en drempels, en verbeteringen aanbevelenNauw samenwerken met Product Owners om backlog refinement en squadprioriteiten af te stemmenTechnische concepten en oplossingen helder communiceren naar internationale stakeholdersZorgen dat alle oplossingen voldoen aan interne beleidslijnen, standaarden en regelgevingUitvoeren van data-analyse en mapping; oplossingen voorstellen voor datakwaliteitsproblemenStimuleren van een feedbackcultuur en een proactieve, oplossingsgerichte houding onderhouden Wij zijn op zoek naar gepassioneerde collegas die graag de grenzen verleggen op het gebied van digitale transformatie en technologieconsultancy. Bij Sopra Steria krijg je de kans om je vaardigheden verder te ontwikkelen in een constructieve, samenwerkende teamomgeving, waarbij je werkt aan impactvolle projecten die verandering teweegbrengen voor onze klanten. Als je gedijt op uitdagingen en (de meeste van) de onderstaande kwalificaties bezit, kijken we uit naar je sollicitatie!Type dienstverband: Hybride
Locatie: Nieuwegein
Aantal uren: 32-40 uur werkweek
Contractduur: En jaar, met uitzicht op een vast dienstverband
Opleiding: Je hebt een HBO- of WO-opleiding afgerond
Talen: Nederlands (vereist)We zoeken iemand met de volgende vaardigheden:Minimaal 2,5 jaar relevante werkervaring als business analyst, bij voorkeur in de financile sectorErvaring met Sanction Screening of bredere FEC-domeinen is zeer gewenst (maar geen must)Bekendheid met risico- en compliance-architectuur, inclusief tools zoals Inform RiskShield, Python, DatabricksAffiniteit met data: in staat om data lineage analyses, kwaliteitsbeoordelingen en privacy reviews uit te voerenErvaring met modeltesten, risicostandaarden en rapportages aan toezichthoudersVaardigheid om samen te werken met diverse stakeholders zoals Compliance, IT en Business OperationsSterk functioneel inzicht in enterprise IT-landschappenErvaring met Agile, Scrum, DevOps, Lean of SAFe methodologienDaarnaast breng je de volgende persoonlijke vaardigheden mee:Sterk analytisch denkvermogen en probleemoplossend vermogenIn staat om zowel strategisch als gedetailleerd te werkenUitstekende communicatieve vaardigheden, met het vermogen om technische en niet-technische stakeholders te betrekkenHoog niveau van documentatie- en rapportagevaardigheden  nauwkeurig, onderbouwd en audit-readyZelfstandig en georganiseerd, met het vermogen om meerdere initiatieven tegelijk te managen Je zal deel uitmaken van een grote naam in de tech wereld die bekend is om consulting, digitale diensten en softwareontwikkeling. Je begeeft je tussen high-level professionals die durven in te zetten om hoge resultaten te behalen. Daarnaast maak je ook deel uit van onze Data area.Bij Sopra Steria  Financial Economic Crime (FEC) voorzien we banken en financile instellingen van digitale tools om risicos te beheren, klanten te beschermen en de impact van financile economische criminaliteit te beperken. Als poortwachters van het financile systeem spelen banken een cruciale rol in de bescherming van onze economie tegen criminele inmenging. Daardoor worden financile instellingen onderworpen aan steeds strengere regelgeving en toezicht. Tegelijkertijd maken wereldwijde economische instabiliteit en steeds geavanceerdere, technologiegedreven financile criminaliteit het werk van banken steeds moeilijker.Enkele cijfers: Naar schatting wordt jaarlijks 16 miljard euro aan crimineel geld witgewassen in Nederland. Minder dan 1% van de criminele geldstromen die via het mondiale banksysteem gaan, wordt daadwerkelijk gestopt. Daarom moeten banken hun aanpak radicaal veranderen in de strijd tegen FEC. Gelukkig zijn er tactische veranderingen die banken snel kunnen doorvoeren om het effect van financile economische criminaliteit te verminderen.Klaar voor de volgende stap in je carrire? Dan wijzen we je graag in de juiste richting. Met kantoren in bijna 30 landen die je leiden naar plaatsen waar je nog nooit bent geweest. Wil je liever intern groeien? Ook dat is mogelijk. We dagen je uit om jezelf te blijven uitdagen en zo telkens de beste versie van jezelf te zijn.Bij Sopra Steria zorgen we ervoor dat jij je werk met plezier n in balans kunt doen. Daarom bieden we een aantrekkelijk en flexibel pakket aan arbeidsvoorwaarden: Een vast contract en een salaris tussen de  3.000 en  6.000 bruto per maand (op basis van 40 uur per week). De exacte inschaling hangt af van jouw ervaring en de rol; Vakantiegeld van 8%; Een royaal mobiliteitsbudget in de vorm van een leaseregeling  met de keuze uit een elektrische leaseauto met NS Business Card of leasefiets of een alternatief vervoersregeling net wat het beste bij jouw manier van reizen past; Winstdeling van 8% on target (of OTB vast bedrag, afhankelijk van de functie); 27 betaalde vakantiedagen; Flex benefit budget van  1.800, - per jaar met daar bovenop een extra percentage van jouw salaris. Dit budget kan worden gebruikt voor zaken als aankoop van extra vrije dagen of extra sparen in jouw pensioenregeling; Thuiskantoor met laptop, telefoon en een maandelijkse internetvergoeding; Hybride werken: thuis of op kantoor, afhankelijk van wat jij nodig hebt; Ontwikkelmogelijkheden via trainingen, kennisdelingssessies en inspirerende (netwerk)events; Sociale activiteiten met collegas  van gezellige borrels tot sportieve of inhoudelijke uitjes; Een flexibele pensioenregeling, waaraan jij op maat en passend bij jou, bijdragen kan toevoegen. Je kunt deelnemen aan de collectieve zorgverzekering.Lijkt deze job iets voor jou? Ben je klaar om met ons de wereld vorm te geven? Fantastisch! We kijken nu al uit naar jouw sollicitatie.______Sopra Steria is een werkgever die gelijke kansen biedt. Alle gekwalificeerde sollicitanten worden in aanmerking genomen voor een job zonder rekening te houden met leeftijd, afkomst, nationaliteit, huidskleur, verlof voor familie- of medische zorg, geslachtsidentiteit of -uitdrukking, genetische informatie, immigratiestatus, burgerlijke staat, medische toestand, nationale herkomst, fysieke of mentale handicap, politieke voorkeur, beschermde veteranen- of militaire status, ras, etniciteit, religie, geslacht (inclusief zwangerschap), seksuele geaardheid of enig ander kenmerk dat wordt beschermd door toepasselijke lokale wetten, voorschriften en verordeningen. We koesteren een werkomgeving die inclusief is en alle verschillen respecteert."
2993247,"Drupal & PHP Developer","https://jobs.smartrecruiters.com/SopraSteria1/744000061000855-drupal-php-developer","Steria","Barcelona","No","Not specified","Full time","2025-05-25T02:10:52.422255Z","Como TDeveloper  principales responsabilidades sernDesarrollo de proyectos de desarrollo Drupal - PHP v8 en adelanteAplicacin transversal de estndares y mejoras prcticas en los proyectos de desarrollo.Reuniones con negocio y tecnologa para alinear los objetivos de los proyectos.Experiencia de al menos 3 aos como Desarrollador Drupal / PHP en las ltimas versiones. Qu tenemos para ti?Contrato indefinido y jornada completa23 das de vacacionesFormacin continua: competencias tcnicas, transversales y de idiomas. Contamos con acceso a certificaciones, formaciones de los principales Partners Tecnolgicos, plataformas online y mucho ms!Seguro de vida y de accidentesPosibilidad de acogerte a nuestra retribucin flexible (seguro mdico, cheques guarderas, transporte, comida y formacin)Acceso a Privilege Club, donde encontrars descuentos interesantes en las principales marcasOnboarding personalizado y detallado. Te acompaamos en todo momento para que te sientas #soprano desde el primer momento.Oficina con espacios reservados al ocio. Trabajo y diversin unido!Compaerismo y buen ambiente, el poder de la unin lo tenemos presente.Y lo ms importante...Tienes la posibilidad de desarrollar tu carrera profesional con nosotros: Crearemos juntos un plan de carrera personalizado. Te formars, marcaremos objetivos y llevaremos a cabo un seguimiento para asegurarnos de que lo conseguimos juntos. Escuchamos tus prioridades y luchamos por ellas.Aqu tu voz importa! nete a nosotros y s parte de algo ms! The world is how we shape it Adquirimos el compromiso de respetar la diversidad, creando un ambiente de trabajo inclusivo y aplicando polticas que favorezcan la inclusin y promuevan el respeto social y cultural en cuestiones de gnero, edad, funcional, orientacin sexual y religin con igualdad de oportunidades."
2993246,"Técnico/a Administración Personal/Contratación - Temporal","https://jobs.smartrecruiters.com/SopraSteria1/744000061002921-tecnico-a-administracion-personal-contratacion-temporal","Steria","Madrid","No","Not specified","Full time","2025-05-25T02:10:52.422272Z","Formars parte de un equipo nacional de Administracin de Personal de RRHH en el que dars soporte transversal en temas relacionados con la contratacin, aspectos laborales y del mbito de la PRL.Si te mueves como pez en el agua en temas administrativos, te gusta trabajar con personas, tienes conocimientos de asesora laboral y cuentas con experiencia previa al respecto, esta puede ser tu oportunidad.Al menos 1 aos de experiencia en un departamento de administracin laboral de empresa o en asesora de empresas.Experiencia en la elaboracin de contratos de trabajo, certificados de empresa, control de vencimientos de contratos temporales, cambios de jornada, control periodos de prueba...Conocimientos y experiencia contrastada con Excel (formulacin bsica).Contrato de duracin determinada hasta septiembre de ao 2025 con posibilidad de transformacin a indefinidoFormacin continua: competencias, habilidades y de idiomas. Contamos con acceso a certificaciones, formaciones de los principales Partners Tecnolgicos, plataformas online y mucho ms!Seguro de vida y de accidentesPosibilidad de acogerte a nuestra retribucin flexible (seguro mdico, cheques guarderas, transporte, comida y formacin)Acceso a Privilege Club, donde encontrars descuentos interesantes en las principales marcasOnboarding personalizado y detallado. Te acompaamos en todo momento para que te sientas #soprano desde el primer momento.Oficina con espacios reservados al ocio. Trabajo y diversin unido!Compaerismo y buen ambiente, el poder de la unin lo tenemos presente.The world is how we shape it Adquirimos el compromiso de respetar la diversidad, creando un ambiente de trabajo inclusivo y aplicando polticas que favorezcan la inclusin y promuevan el respeto social y cultural en cuestiones de gnero, edad, funcional, orientacin sexual y religin con igualdad de oportunidades."
2993245,"Tech lead - Java - Transport - Sophia Antipolis","https://jobs.smartrecruiters.com/SopraSteria1/744000061013227-tech-lead-java-transport-sophia-antipolis","Steria","Biot","Yes","Not specified","Full time","2025-05-25T02:10:52.422288Z","Sopra Steria Group  Sophia-Antipolis, est compos de 400 collaborateurs. Nous intervenons  la fois sur des projets  taille humaine que des projets internationaux autour de technologies varies pour le compte de grands donneurs d'ordre locaux dans les secteurs du transport, de l'industrie, des tlcommunications, du service public...Votre rle et missionsAu sein d'une de nos quipes, pour l'un de nos clients arien, vous tes en charge de diverses tches :Vous mettez en place des lments de l'architecture applicative ;Vous veillez  la bonne mise en uvre de l'industrialisation du projet ;  Vous assurez la conformit technique, dfinissez et vrifiez les standards de qualit ;Vous faites monter en comptences et encadrez les juniors ;Vous animez la communaut interne ""Tech Me Up"" via des prsentations ou tutoriaux, et autres vnements.Nos projets utilisent les stack techniques suivantes : Java / SpringBoot / Angular / Cloud Azure / Amazon WebServices / KubernetesChez SOPRA STERIA, comme il existe plusieurs faons dtre Tech lead, nous avons dfinis diffrents parcours techniques pour avancer ensemble !Vous tre passionn(e) par l'un de ces environnements et souhaitez voluer vers un plus large bagage technique ou plus de responsabilit dencadrement technique ? Rejoignez-nous !Nous vous offrons une relle opportunit de vous accomplir tant sur le plan professionnel que du savoir-tre, en dveloppant vos talents dans un environnement volutif, accompagn(e) par un management de proximit et une politique de formation adapte. Vous rejoignez la communaut Tech2Tech Transport pour partager avec vos pairs et galement apprendre techniquement des autres quipes.Votre Manager Oprationnel, vous accompagne tout au long de votre parcours pour dfinir avec vous la meilleure orientation pour atteindre vos objectifs (Architecture - Rfrent technique - Responsable dquipe de dveloppeurs/ses).Vous tes reconnu(e) pour votre rigueur, votre pdagogie et votre capacit  tre force de proposition et transmettre vos connaissances et votre savoir-faire aux autres.Diplm(e) dune cole dIngnieur ou quivalent, vous avez dj une premire exprience significative dans le dveloppement en accompagnement dquipe ou expert technique.Alors sans plus attendre, intgrez une entreprise o rgne un esprit entrepreneurial fort et une atmosphre propice  votre volution : participez  une transformation durable et nergtique grce  une vritable aventure humaine au sein dun grand groupe international.Un accord tltravail pour tltravailler jusqu 2 jours par semaine selon vos missions. Un package avantages intressant : une mutuelle, un CSE, des titres restaurants, un accord dintressement, des primes vacances et cooptation.Un accompagnement individualis avec un manager oprationnel.Un collectif technique : Tech'Me UP (formations, confrences, veille, et bien plus encore...).Des opportunits de carrires multiples : plus de 30 familles de mtiers, autant de passerelles  imaginer ensemble.Plusieurs centaines de formations accessibles en toute autonomie depuis lapp mobile avec Sopra Steria Academy.La possibilit de s'engager auprs de notre fondation ou de notre partenaire  Vendredi .Employeur inclusif et engag, notre socit uvre chaque jour pour lutter contre toute forme de discrimination et favoriser un environnement de travail respectueux. Cest pourquoi, attachs  la mixit et  la diversit, nous encourageons toutes les candidatures et tous les profils.https://www.soprasteria.fr/nous-connaitre/nos-engagements"
2993244,"Chef /fe de projet Lutte anti-drones - Défense & Sécurité - Le Plessis Robinson","https://jobs.smartrecruiters.com/SopraSteria1/744000061019145-chef-fe-de-projet-lutte-anti-drones-defense-securite-le-plessis-robinson","Steria","Le Plessis-Robinson","No","Not specified","Full time","2025-05-25T02:10:52.422305Z","Chef/ fe de projet Lutte anti-dronesNous recrutons un Chef/ fe de projet Lutte anti-drones pour rejoindre notre BU Dfense &amp; Scurit au sein de l'agence Lutte Anti-Drone, qui fournit des solutions intgres autour de son C2 BOREADES et comprenant des fonctions de dtection, didentification et de neutralisation de drones illicites pour les clients tatiques en France et  lExport. Ces systmes sont modulaires, interoprables, s'appuient sur des technologies d'intelligence artificielle afin de fournir  l'oprateur un trs haut niveau de performance et de simplicit d'utilisation.Vos missions :-Encadrement dun projet majeur de lutte anti drone, dure March &gt; 5 ans,- Gestion de lquipe, du planning, des cots, des risques,- Gestion de Contrat,- Optimisation des process internes,-Industrialisation et passage  l'chelle.Environnement technique :-Cycle en V,-Informatique industrielle,-Intgration,-Capteurs (radars, goniomtres, RF, ...),-Optronique.De formation BAC+5 coles dingnieur ou quivalent, vous avez une exprience minimum de 10 ans en Ingnierie/architecture systme, gestion de projet ou coordination technique de prfrence dans un domaine industriel (dfense, aronautique, spatial, tlcommunications, IT...).Trs bon niveau rdactionnel exig.Vous tes autonome et vous savez une bonne qualit d'analyse et de synthse ? Vous tes force de proposition et savez animer une quipe ?Alors postulez pour nous rejoindre!Intgrer l'agence Lutte Anti-Drone (LAD) c'est aussi :Des formations ds votre arrive &amp; tout au long de votre carrire : la CS Academy et la Sopra Steria Academy vous propose des parcours de formations spcifiques aux mtiers et  votre environnement (4400 jours de formation en 2023, 5700 jours de formation prvus sur 2024)Une mutuelle prenant en charge votre famille Un comit dentreprise offrant des avantages culturels, sportifs et des prix sur vos hbergements et transports lors de vos vacancesUne prime vacances et de cooptationLA SUITE DES EVENEMENTS Si votre profil correspond, vous aurez un entretien technique avec un de nos Responsables oprationnels. Puis, vous rencontrerez Ly lors dun entretien RH. Et nous nous engageons  vous faire un retour par tlphone :)#CSGROUP #anidrones #LAD#droneshttps://boreades.eu/fr/Employeur inclusif et engag, notre socit uvre chaque jour pour lutter contre toute forme de discrimination et favoriser un environnement de travail respectueux. Cest pourquoi, attachs  la mixit et  la diversit, nous encourageons toutes les candidatures et tous les profils.https://www.soprasteria.fr/nous-connaitre/nos-engagements"
