"ID","Title","Link","Company","Location","Remote","Experience","EmploymentType","DatePosted","RoleDescription"
2789660,"Campaign Manager, Portworx","https://job-boards.greenhouse.io/purestorage/jobs/6807510","storage","Santa Clara","No",5,"Full time","2025-07-15T02:21:31.707198Z","Were in an unbelievably exciting area of tech and are fundamentally reshaping the data storage industry. Here, you lead with innovative thinking, grow along with us, and join the smartest team in the industry.
This type of workwork that changes the worldis what the tech industry was founded on. So, if you're ready to seize the endless opportunities and leave your mark, come join us.At Pure Storage, youll have the opportunity to shape demand generation strategies, collaborate with cross-functional teams, and contribute to our customer acquisition and brand-building efforts. If you thrive in a fast-paced environment and are passionate about data-driven marketing, wed love to have you on board.
SHOULD YOU ACCEPT THIS CHALLENGE...

Develop and manage integrated multi-channel marketing programs to drive lead generation and sales pipeline growth.
Execute marketing programs, including webinars, emails, and customer outreach. 
Own and optimize the email marketing conversion funnel through Marketo.
Track, measure, and analyze marketing programs performance, applying insights to continuously optimize program effectiveness.
Manage and grow the community by fostering engagement, creating compelling content, and facilitating discussions that strengthen relationships with partners, customers, and key stakeholders.

WHAT YOULL NEED TO BRING TO THIS ROLE...

5+ years of experience in campaign marketing or demand generation.
Strong understanding of lead nurturing and multi-touch marketing strategies to drive conversion.
Expertise in email marketing strategy, including A/B testing, audience segmentation, and automation.
Ability to use data and analytics to track performance and refine strategies.
Solid experience working with Salesforce.com and Marketo to execute integrated demand generation campaigns including measurement of campaign effectiveness. 
Proven experience partnering with sales and marketing teams to create and execute integrated marketing programs. 
Track record of marketing results with a strong creative and analytical mindset.
Bachelor's degree in Business, Marketing, Technology, or a related field preferred.

We are primarily an in-office environment and therefore, you will be expected to work from the Santa Clara, CA office in compliance with Pures policies, unless you are on PTO, or work travel, or other approved leave.
#LI-ONSITE #LI-KQ1 
Salary ranges are determined based on role, level and location. For positions open to candidates in multiple geographical locations, the base salary range is reflective of the labor market across the applicable locations. 
This role may be eligible for incentive pay and/or equity. 
There is no application deadline and we accept applications on an ongoing basis until the job is filled.The annual base salary range is: $149,000$224,000 USDWHAT YOU CAN EXPECT FROM US:

Pure Innovation: We celebrate those who think critically, like a challenge and aspire to be trailblazers.
Pure Growth: We give you the space and support to grow along with us and to contribute to something meaningful. We have been Named Fortune's Best Large Workplaces in the Bay AreaTM, Fortune's Best Workplaces for MillennialsTM and certified as a Great Place to Work!
Pure Team: We build each other up and set aside ego for the greater good.

And because we understand the value of bringing your full and best self to work, we offer a variety of perks to manage a healthy balance, including flexible time off, wellness resources and company-sponsored team events. Check out purebenefits.com for more information.
ACCOMMODATIONS AND ACCESSIBILITY:
Candidates with disabilities may request accommodations for all aspects of our hiring process. For more on this, contact us at TA-Ops@purestorage.com if youre invited to an interview.
WHERE DIFFERENCES FUEL INNOVATION:
Were forging a future where everyone finds their rightful place and where every voice matters. Where uniqueness isnt just accepted but embraced. Thats why we are committed to fostering the growth and development of every person, cultivating a sense of community through our Employee Resource Groups and advocating for inclusive leadership. At Pure Storage, diversity, equity, inclusion and sustainability are part of our DNA because we believe our people will shape the next chapter of our success story. 
Pure Storage is proud to be an equal opportunity employer. We strongly encourage applications from Indigenous Peoples, racialized people, people with disabilities, people from gender and sexually diverse communities, and people with intersectional identities. We also encourage you to apply even if you feel you dont match all of the role criteria. If you think you can do the job and feel youre a good match, please apply."
3250290,"Senior Technical Product Manager, Digital Experience","https://job-boards.greenhouse.io/purestorage/jobs/7059540","storage","Santa Clara","No",8,"Full time","2025-07-15T02:21:31.707223Z","Were in an unbelievably exciting area of tech and are fundamentally reshaping the data storage industry. Here, you lead with innovative thinking, grow along with us, and join the smartest team in the industry.
This type of workwork that changes the worldis what the tech industry was founded on. So, if you're ready to seize the endless opportunities and leave your mark, come join us.SHOULD YOU ACCEPT THIS CHALLENGE...
We are seeking an experienced Senior Technical Product Manager to lead technical and outbound product management for our application and data recovery solutions, focusing on disaster recovery, cyber recovery, and business continuity use cases.
WHAT YOULL NEED TO BRING TO THIS ROLE...

Engage directly with enterprise IT, application owners, and infrastructure teams, as well as architects and leadership stakeholders at customer organizations.
Regularly interface with customers looking to solve for ransomware attacks, data corruption, and unplanned outages to understand pain points and recovery needs.
Gather and convert customer feedback, support escalations, and enhancement requests into actionable product requirements and roadmap priorities.
Brings ethos of making the customer an evangelist for the product through active listening and support.
Develop high-quality technical collateral, including recovery playbooks, best practices, and architectural patterns for disaster recovery and cyber resilience.
Act as a technical expert and advocate for our data protection solutions at industry conferences, webinars, customer events, and public forums.
Deliver compelling presentations and live product demonstrations to internal teams, customers, and partners.
Deep understanding of disaster recovery architectures, cyber recovery workflows, and application recovery processes across on-premises, hybrid cloud, and public cloud environments.
Strong systems-thinking ability to analyze root causes of application downtime and data loss across storage, compute, virtualization, and network layers.
Hands-on experience with backup and recovery software, snapshot and replication technologies, and orchestration frameworks.
Familiarity with recovery for mission-critical workloads such as databases (e.g., Oracle, SQL Server), virtualized environments (VMware vSphere), and containerized applications (Kubernetes).
Working knowledge of ransomware attack vectors and recovery techniques (immutable snapshots, air-gapped backups, rapid restore).
Define and validate product performance and scalability with respect to recovery time objectives (RTO) and recovery point objectives (RPO) across different recovery scenarios.
Work with partners and engineering teams to integrate and test recovery workflows with cloud providers, SaaS platforms, and security ecosystems.
Translate customer use cases into detailed technical requirements and collaborate closely with inbound Product Managers and Engineers on feature design and prioritization.
Navigate customer-critical incidents with limited information to quickly triage issues and drive resolution paths.
Balance strategic vision with tactical execution in evolving threat and disaster landscapes.
Mentor junior team members and foster a culture of technical excellence and customer empathy within the product organization.
Self motivated and asks questions to anyone/everyone to absorb the technologies quickly.
Out of the box thinking for problem solving and product simplification.

What Youll Need to Bring to This Role:

Technically strong product leader with a passion for helping customers recover from crises and ensuring business continuity, we invite you to join our team and make an impact on the future of resilient data infrastructure.
8+ years of relevant experience in product management, solutions architecture, engineering, or technical pre-sales within data protection, disaster recovery, or IT resilience domains.
Demonstrated success working directly with customers in recovery scenarios, incident response, or post-mortem analysis.
Experience with cloud and hybrid recovery solutions, including AWS, Azure, GCE and VMware-based DR platforms like SRM and Zerto.
Outstanding written and verbal communication skills, able to clearly articulate complex recovery workflows and product value to technical and business audiences.
Effective at presenting to both technical teams and executive stakeholders.
Proven leadership driving cross-functional initiatives and influencing engineering, support, and field teams without direct authority.
Bachelors or Masters degree in Computer Science, Information Systems, or a related technical field, or equivalent hands-on industry experience.

We are primarily an in-office environment and therefore, you will be expected to work from the Santa Clara office in compliance with Pures policies, unless you are on PTO, or work travel, or other approved leave.
INCLUDE FOR POSTING LOCATION IDENTIFICATION
#LI-REMOTE, #LI-ONSITE 
Salary ranges are determined based on role, level and location. For positions open to candidates in multiple geographical locations, the base salary range is reflective of the labor market across the applicable locations. 
This role may be eligible for incentive pay and/or equity. 
There is no application deadline and we accept applications on an ongoing basis until the job is filled.The annual base salary range is: $181,000$272,000 USDWHAT YOU CAN EXPECT FROM US:

Pure Innovation: We celebrate those who think critically, like a challenge and aspire to be trailblazers.
Pure Growth: We give you the space and support to grow along with us and to contribute to something meaningful. We have been Named Fortune's Best Large Workplaces in the Bay AreaTM, Fortune's Best Workplaces for MillennialsTM and certified as a Great Place to Work!
Pure Team: We build each other up and set aside ego for the greater good.

And because we understand the value of bringing your full and best self to work, we offer a variety of perks to manage a healthy balance, including flexible time off, wellness resources and company-sponsored team events. Check out purebenefits.com for more information.
ACCOMMODATIONS AND ACCESSIBILITY:
Candidates with disabilities may request accommodations for all aspects of our hiring process. For more on this, contact us at TA-Ops@purestorage.com if youre invited to an interview.
WHERE DIFFERENCES FUEL INNOVATION:
Were forging a future where everyone finds their rightful place and where every voice matters. Where uniqueness isnt just accepted but embraced. Thats why we are committed to fostering the growth and development of every person, cultivating a sense of community through our Employee Resource Groups and advocating for inclusive leadership. At Pure Storage, diversity, equity, inclusion and sustainability are part of our DNA because we believe our people will shape the next chapter of our success story. 
Pure Storage is proud to be an equal opportunity employer. We strongly encourage applications from Indigenous Peoples, racialized people, people with disabilities, people from gender and sexually diverse communities, and people with intersectional identities. We also encourage you to apply even if you feel you dont match all of the role criteria. If you think you can do the job and feel youre a good match, please apply."
3250289,"Senior Manager, Demand Generation","https://job-boards.greenhouse.io/purestorage/jobs/7059612","storage","Santa Clara","No",8,"Full time","2025-07-15T02:21:31.707245Z","Were in an unbelievably exciting area of tech and are fundamentally reshaping the data storage industry. Here, you lead with innovative thinking, grow along with us, and join the smartest team in the industry.
This type of workwork that changes the worldis what the tech industry was founded on. So, if you're ready to seize the endless opportunities and leave your mark, come join us.SHOULD YOU ACCEPT THIS CHALLENGE...
The Portworx marketing team is seeking a strategic and results-driven Sr. Demand Generation Manager. In this role, you will be responsible for creating and executing integrated demand generation campaigns that drive pipeline and revenue growth. You will work closely with marketing, sales, operations, and creative teams to design and launch multi-channel campaigns including email, digital, direct mail, and content syndication. This role is ideal for someone with deep B2B marketing experience and a passion for building scalable programs that convert.

Develop, maintain and execute demand generation campaigns aligned with business goals.
Work closely with marketing ops and sales teams to ensure leads are being properly tracked and followed up
Map personas to buyers journey and build targeted campaigns
Work with external agencies and internal creative teams to create campaign design and execution
Establish goals and KPIs on demand programs and regularly report on their performance 
Update sales on a regular basis on plans, progress of campaigns and upcoming activities
Collaborate with sales and marketing to build programs that support sales enablement
Recommend new tools to drive and scale campaigns with an emphasis on integrated marketing
Establish goals and KPIs and report back on results to key stakeholders in sales, product groups and marketing

WHAT YOULL NEED TO BRING TO THIS ROLE...

8+ years of experience leading and running demand generation campaigns for large b2b organizations
Proficient in email marketing strategy and execution
Proven experience building B2B marketing acquisition channels with small businesses &amp; large enterprises
Solid experience working with Salesforce.com and Marketo to execute integrated demand generation campaigns including measurement of campaign effectiveness
Proven experience partnering with sales and marketing teams to create and execute integrated marketing programs
Track record of marketing results with strong creative and analytical mindset

We are primarily an in-office environment and therefore, you will be expected to work from the Santa Clara, CA office in compliance with Pures policies, unless you are on PTO, or work travel, or other approved leave.
#LI-ONSITE 
Salary ranges are determined based on role, level and location. For positions open to candidates in multiple geographical locations, the base salary range is reflective of the labor market across the applicable locations. 
This role may be eligible for incentive pay and/or equity. 
There is no application deadline and we accept applications on an ongoing basis until the job is filled.The annual base salary range is: $176,000$265,000 USDWHAT YOU CAN EXPECT FROM US:

Pure Innovation: We celebrate those who think critically, like a challenge and aspire to be trailblazers.
Pure Growth: We give you the space and support to grow along with us and to contribute to something meaningful. We have been Named Fortune's Best Large Workplaces in the Bay AreaTM, Fortune's Best Workplaces for MillennialsTM and certified as a Great Place to Work!
Pure Team: We build each other up and set aside ego for the greater good.

And because we understand the value of bringing your full and best self to work, we offer a variety of perks to manage a healthy balance, including flexible time off, wellness resources and company-sponsored team events. Check out purebenefits.com for more information.
ACCOMMODATIONS AND ACCESSIBILITY:
Candidates with disabilities may request accommodations for all aspects of our hiring process. For more on this, contact us at TA-Ops@purestorage.com if youre invited to an interview.
WHERE DIFFERENCES FUEL INNOVATION:
Were forging a future where everyone finds their rightful place and where every voice matters. Where uniqueness isnt just accepted but embraced. Thats why we are committed to fostering the growth and development of every person, cultivating a sense of community through our Employee Resource Groups and advocating for inclusive leadership. At Pure Storage, diversity, equity, inclusion and sustainability are part of our DNA because we believe our people will shape the next chapter of our success story. 
Pure Storage is proud to be an equal opportunity employer. We strongly encourage applications from Indigenous Peoples, racialized people, people with disabilities, people from gender and sexually diverse communities, and people with intersectional identities. We also encourage you to apply even if you feel you dont match all of the role criteria. If you think you can do the job and feel youre a good match, please apply."
3250288,"Product Marketing Manager, AI Solutions","https://job-boards.greenhouse.io/purestorage/jobs/7057550","storage","Santa Clara","No",7,"Full time","2025-07-15T02:21:31.707264Z","Were in an unbelievably exciting area of tech and are fundamentally reshaping the data storage industry. Here, you lead with innovative thinking, grow along with us, and join the smartest team in the industry.
This type of workwork that changes the worldis what the tech industry was founded on. So, if you're ready to seize the endless opportunities and leave your mark, come join us.Pure Storage is seeking a highly motivated and experienced B2B Product Marketing Manager to drive our AI Solution into the marketplace. In this high-visibility position, you will play a key role in bringing our AI solutions to market, including developing marketing campaign strategies and plans, creating engaging campaign content for IT leaders and AI practitioners, and working with our AI ecosystem partner teams including NVIDIA, Cisco, and Intel on joint marketing content.
Your responsibilities include collaborating closely with our integrated marketing teams to create global AI marketing campaigns, develop AI campaign content including whitepapers, webinars, blog posts, and event sessions, and execute AI solution launch campaigns and activities.
As an experienced marketer or practitioner in AI, you possess a deep understanding of the AI market dynamics, competitive landscapes, and customer insights. You will drive AI marketing campaign strategies and accelerate demand for our rapidly growing set of AI solutions. 
SHOULD YOU ACCEPT THIS CHALLENGE...

Develop the AI solution marketing campaign requirements that drive the campaign planning process.
Build the compelling content that drives campaign engagement including solution briefs, whitepapers, blog posts, webinars and social media posts.
Collaborate with integrated marketing and field marketing teams across the marketing organization to drive campaign success.
Team with AI ecosystem partners to build compelling joint marketing campaigns for online and in-person events.
Align with marketing leadership to prioritize investment of campaigns towards these solutions, and drive the team to deliver messaging and content that brings these campaigns to life.
Amplify the power of our culture, connect the hearts and minds of your team members' vision and potential for Pure, ensuring that people enjoy, grow, develop, thrive and feel recognized in this period of tremendous growth.

WHAT YOULL NEED TO BRING TO THIS ROLE...

7+ years of experience in product or solution marketing at a fast growing company or prior experience in AI consulting or data science practitioner roles.
Product and Solution Marketing Powerhouse: Extensive B2B technology marketing experience, skilled in positioning products for both business decision makers and technical audiences, preferably in the data center or applications space.
Domain Experience: Demonstrated experience and success in messaging, positioning, and content development in support of AI solutions.
Messaging, Storytelling, and Content Creation with Domain Expertise: Deep understanding of data analytics, data science and AI market, preferably experience marketing with NVIDIA, Cisco, or Intel.
Influencing Skills: Exceptional executive presence and credibility with the ability to influence and build strong relationships with various internal partners, including product marketing, field marketing, and sales, while actively contributing to the overall go-to-market strategy.
Exceptional written and verbal communication skills. This role demands someone who is gifted in their ability to use the spoken and written word to communicate effectively with all stakeholders
We are primarily an in-office environment and therefore, you will be expected to work from the Santa Clara office in compliance with Pures policies, unless you are on PTO, or work travel, or other approved leave.

#LI-ONSITE
#LI-KT1 
Salary ranges are determined based on role, level and location. For positions open to candidates in multiple geographical locations, the base salary range is reflective of the labor market across the applicable locations. 
This role may be eligible for incentive pay and/or equity. 
There is no application deadline and we accept applications on an ongoing basis until the job is filled.The annual base salary range is: $149,000$224,000 USDWHAT YOU CAN EXPECT FROM US:

Pure Innovation: We celebrate those who think critically, like a challenge and aspire to be trailblazers.
Pure Growth: We give you the space and support to grow along with us and to contribute to something meaningful. We have been Named Fortune's Best Large Workplaces in the Bay AreaTM, Fortune's Best Workplaces for MillennialsTM and certified as a Great Place to Work!
Pure Team: We build each other up and set aside ego for the greater good.

And because we understand the value of bringing your full and best self to work, we offer a variety of perks to manage a healthy balance, including flexible time off, wellness resources and company-sponsored team events. Check out purebenefits.com for more information.
ACCOMMODATIONS AND ACCESSIBILITY:
Candidates with disabilities may request accommodations for all aspects of our hiring process. For more on this, contact us at TA-Ops@purestorage.com if youre invited to an interview.
WHERE DIFFERENCES FUEL INNOVATION:
Were forging a future where everyone finds their rightful place and where every voice matters. Where uniqueness isnt just accepted but embraced. Thats why we are committed to fostering the growth and development of every person, cultivating a sense of community through our Employee Resource Groups and advocating for inclusive leadership. At Pure Storage, diversity, equity, inclusion and sustainability are part of our DNA because we believe our people will shape the next chapter of our success story. 
Pure Storage is proud to be an equal opportunity employer. We strongly encourage applications from Indigenous Peoples, racialized people, people with disabilities, people from gender and sexually diverse communities, and people with intersectional identities. We also encourage you to apply even if you feel you dont match all of the role criteria. If you think you can do the job and feel youre a good match, please apply."
