"ID","Title","Link","Company","Location","Remote","Experience","EmploymentType","DatePosted","RoleDescription"
3241789,"District Manager, Enterprise  - New York","https://job-boards.greenhouse.io/purestorage/jobs/7056389","storage","New York","No",5,"Full time","2025-07-15T02:21:31.707525Z","Were in an unbelievably exciting area of tech and are fundamentally reshaping the data storage industry. Here, you lead with innovative thinking, grow along with us, and join the smartest team in the industry.
This type of workwork that changes the worldis what the tech industry was founded on. So, if you're ready to seize the endless opportunities and leave your mark, come join us.SHOULD YOU ACCEPT THIS CHALLENGE...
Pure Storage is looking for an operationally strong, mature and highly motivated District Manager who can build and lead a team of focused account executives in New York Metro. Responsibilities include recruiting direct (Account Executive) and aligned (PreSales Engineer) reporting roles, accurate forecasting, Account Executive development, territory planning, and extensive channel partner relationship development. The successful candidate will have the ability to establish strong business relationships at the executive level, support key sales presentations, and provide strategic direction to the sales team in coordinating multiple resources within an account and successfully closing business for Pure Storage.
What You Will Be Doing

Lead and inspire a team of Enterprise Account Executives, and ensure that the Pure Culture and Values are embedded into your team.
Hire additional Account Executives as the business demands.
Provide leadership to the extended Pure Storage team aligned to your district (SEs, Channel Managers, Inside Sales reps, etc.).
Closely manage and enable the teams performance related to KPIs including pipeline growth, partner team alignment, forecast accuracy, POC management. At all times maintain a 4X pipeline to goal.
Recruit, develop and maintain strong relationships with channel partner principals, AEs and leadership teams.
Drive sales call activity and lead by example. Ensure that each member of the team attains or over-achieves quota.
Significant field travel expected.
Deliver business results which include annual bookings goal, new logo production and AE participation at or above goal.
Weekly review of activities, pipeline and if pipeline insufficient to deliver plan.
Strong analytical and problem solving skills required.
Performance management of the team.

WHAT YOULL NEED TO BRING TO THIS ROLE...

5+ years successful field sales management experience in storage or core Information Technology infrastructure in a highly competitive environment.
Experience selling to IT departments and IT management is required.
Passionate and persuasive. Excellent verbal communication skills.
Proven track record of recruitment and associate development.
Must have strong written and verbal communication skills and be able to clearly and effectively articulate Pure Storages value.
Must be organized, detail and process oriented.
Ability to manage multiple tasks and use good judgment in identifying root causality and problem solving.
Ability to coordinate Pure Storage resources to execute a complex sales strategy.
Ability to use CRM and other online tools effectively.
 
Salary ranges are determined based on role, level and location. For positions open to candidates in multiple geographical locations, the base salary range is reflective of the labor market across the applicable locations. 
This role may be eligible for incentive pay and/or equity. 
There is no application deadline and we accept applications on an ongoing basis until the job is filled.The annual base salary range is: $168,000$269,000 USDWHAT YOU CAN EXPECT FROM US:

Pure Innovation: We celebrate those who think critically, like a challenge and aspire to be trailblazers.
Pure Growth: We give you the space and support to grow along with us and to contribute to something meaningful. We have been Named Fortune's Best Large Workplaces in the Bay AreaTM, Fortune's Best Workplaces for MillennialsTM and certified as a Great Place to Work!
Pure Team: We build each other up and set aside ego for the greater good.

And because we understand the value of bringing your full and best self to work, we offer a variety of perks to manage a healthy balance, including flexible time off, wellness resources and company-sponsored team events. Check out purebenefits.com for more information.
ACCOMMODATIONS AND ACCESSIBILITY:
Candidates with disabilities may request accommodations for all aspects of our hiring process. For more on this, contact us at TA-Ops@purestorage.com if youre invited to an interview.
WHERE DIFFERENCES FUEL INNOVATION:
Were forging a future where everyone finds their rightful place and where every voice matters. Where uniqueness isnt just accepted but embraced. Thats why we are committed to fostering the growth and development of every person, cultivating a sense of community through our Employee Resource Groups and advocating for inclusive leadership. At Pure Storage, diversity, equity, inclusion and sustainability are part of our DNA because we believe our people will shape the next chapter of our success story. 
Pure Storage is proud to be an equal opportunity employer. We strongly encourage applications from Indigenous Peoples, racialized people, people with disabilities, people from gender and sexually diverse communities, and people with intersectional identities. We also encourage you to apply even if you feel you dont match all of the role criteria. If you think you can do the job and feel youre a good match, please apply."
3120337,"Technical Program Manager, FlashArray","https://job-boards.greenhouse.io/purestorage/jobs/6895302","storage","Santa Clara","No",7,"Full time","2025-07-15T02:21:31.707550Z","Were in an unbelievably exciting area of tech and are fundamentally reshaping the data storage industry. Here, you lead with innovative thinking, grow along with us, and join the smartest team in the industry.
This type of workwork that changes the worldis what the tech industry was founded on. So, if you're ready to seize the endless opportunities and leave your mark, come join us.SHOULD YOU ACCEPT THIS CHALLENGE...
As Technical Program Manager for the FlashArray team you will:

Work with engineering teams working on building/deploying services as well as cross functional non-engineering teams for solution readiness and deliver program objectives.
Big picture owner providing clarity on what we are trying to accomplish, understanding of the business objectives and driving the outcome for the program
Be the change agent with capabilities to identify and deliver on process changes that would enable faster time to market while driving organization consistency and efficiency
Drive content, schedule and overall delivery of the program and set it up for success in the field/customer base
Plan, coordinate, and execute software releases for our products. Develop release plans, schedules, processes, procedures, and documentation in collaboration with cross-functional teams
Dive deep into technical systems to triage SW Release risks and issues found, take necessary actions to mitigate them and stay connected to the details to help make the right release tradeoffs
Continuously improve the release management process and tools to increase efficiency and quality
Understands dependencies across functions to optimize the overall system and deliver the highest quality offerings
Make trade-offs and timely decision, drive accountability for delivery and ensure that the objectives of the program are met
Set goals for the program, track and periodically communicate to stakeholders as well as ensure corrective actions/mitigations as needed
Be the single point person for delivery decisions, exec and cross team communication and working with various functional groups to deliver the program
Optimize team processes to improve quality, productivity, and responsiveness to feedback and changing priorities and set up the program for success in the field
Overcome obstacles by resolving issues, regardless of team boundaries, and identify and resolve teamwork issues

WHAT YOULL NEED TO BRING TO THIS ROLE...

7+ years of experience as a Technical Program Manager; MS in computer science, MBA or engineering management equivalent preferred.
Experience managing SW releases with predictable and frequent cadence 
Proven expertise in managing projects throughout the entire SDLC, including investigation, design, execution and delivering products to market on schedule, and addressing customer feedback in development.
Solid project and technical judgment; ability to influence a growing organization.
Take ownership of the product experience, quality, and metrics
Solid knowledge of end-to-end best practices.
Demonstrated strong analytical and problem solving skills.
Outstanding verbal and written communication skills with the ability to interact with technical and non-technical, cross-functional groups
We are primarily an in-office environment and therefore, you will be expected to work from the Santa Clara, CA office in compliance with Pures policies, unless you are on PTO, or work travel, or other approved leave.

#LI-ONSITE 
Salary ranges are determined based on role, level and location. For positions open to candidates in multiple geographical locations, the base salary range is reflective of the labor market across the applicable locations. 
This role may be eligible for incentive pay and/or equity. 
There is no application deadline and we accept applications on an ongoing basis until the job is filled.The annual base salary range is: $199,000$299,000 USDWHAT YOU CAN EXPECT FROM US:

Pure Innovation: We celebrate those who think critically, like a challenge and aspire to be trailblazers.
Pure Growth: We give you the space and support to grow along with us and to contribute to something meaningful. We have been Named Fortune's Best Large Workplaces in the Bay AreaTM, Fortune's Best Workplaces for MillennialsTM and certified as a Great Place to Work!
Pure Team: We build each other up and set aside ego for the greater good.

And because we understand the value of bringing your full and best self to work, we offer a variety of perks to manage a healthy balance, including flexible time off, wellness resources and company-sponsored team events. Check out purebenefits.com for more information.
ACCOMMODATIONS AND ACCESSIBILITY:
Candidates with disabilities may request accommodations for all aspects of our hiring process. For more on this, contact us at TA-Ops@purestorage.com if youre invited to an interview.
WHERE DIFFERENCES FUEL INNOVATION:
Were forging a future where everyone finds their rightful place and where every voice matters. Where uniqueness isnt just accepted but embraced. Thats why we are committed to fostering the growth and development of every person, cultivating a sense of community through our Employee Resource Groups and advocating for inclusive leadership. At Pure Storage, diversity, equity, inclusion and sustainability are part of our DNA because we believe our people will shape the next chapter of our success story. 
Pure Storage is proud to be an equal opportunity employer. We strongly encourage applications from Indigenous Peoples, racialized people, people with disabilities, people from gender and sexually diverse communities, and people with intersectional identities. We also encourage you to apply even if you feel you dont match all of the role criteria. If you think you can do the job and feel youre a good match, please apply."
2860872,"Account Executive, Enterprise (Delhi)","https://job-boards.greenhouse.io/purestorage/jobs/6823474","storage","Remote","Yes",8,"Full time","2025-07-15T02:21:31.707570Z","Were in an unbelievably exciting area of tech and are fundamentally reshaping the data storage industry. Here, you lead with innovative thinking, grow along with us, and join the smartest team in the industry.
This type of workwork that changes the worldis what the tech industry was founded on. So, if you're ready to seize the endless opportunities and leave your mark, come join us.ABOUT THE ROLE...
Pure Storage India is seeking a dynamic and driven Sales Hunter to join our Enterprise team in Delhi. In this role, youll be at the forefront of developing new business, working with our channel resellers and key customer accounts. Collaborate with Sales, Pre-sales, Partner sales, and Field Marketing teams to drive success in the Enterprise / Government sector.
YOUR CHALLENGE...
As an Account Executive, you will:

Promote Innovative Solutions: Advocate for our all-flash enterprise storage technology.
Build Relationships: Foster strong connections with Enterprise / Government customers, ensuring high satisfaction.
Lead and Strategize: Direct pursuit teams and develop account plans to secure new customers.
Manage Sales Pipeline: Drive activities to meet and exceed sales quotas.
Collaborate with Partners: Work with Channel, GSI, and Ecosystem Partners to position Pure Storage.
Execute Account Strategies: Develop and implement strategies to close deals consistently.
Deliver Results: Surpass quotas, maintain a strong pipeline, and drive referenceable business.
Communicate Effectively: Present proposals highlighting Pure Storages benefits.

WHAT YOULL BRING...
To excel in this role, you should have:

Sales Passion: A strong drive for sales and relationship building.
Enterprise Experience: Experience with direct/indirect sales on Enterprise / Government accounts.
Partner Collaboration: Experience working with Channel, GSI, and Ecosystem Partners.
Prospecting Skills: Advanced skills in engaging new customers required.
Ambition and Drive: A goal-oriented attitude and desire to drive change.
Proven Success: A track record of exceeding quotas and maintaining a robust pipeline.
Adaptability: Ability to thrive in a fast-paced environment.
Industry Knowledge: Understanding of cloud computing and Data Centre Architecture.
Communication Skills: Excellent time management and communication abilities.
Experience: 8+ years of field sales experience.

Join Pure Storage India and be part of a team that's redefining data storage. Apply now and unleash your potential!WHAT YOU CAN EXPECT FROM US:

Pure Innovation: We celebrate those who think critically, like a challenge and aspire to be trailblazers.
Pure Growth: We give you the space and support to grow along with us and to contribute to something meaningful. We have been Named Fortune's Best Large Workplaces in the Bay AreaTM, Fortune's Best Workplaces for MillennialsTM and certified as a Great Place to Work!
Pure Team: We build each other up and set aside ego for the greater good.

And because we understand the value of bringing your full and best self to work, we offer a variety of perks to manage a healthy balance, including flexible time off, wellness resources and company-sponsored team events. Check out purebenefits.com for more information.
ACCOMMODATIONS AND ACCESSIBILITY:
Candidates with disabilities may request accommodations for all aspects of our hiring process. For more on this, contact us at TA-Ops@purestorage.com if youre invited to an interview.
WHERE DIFFERENCES FUEL INNOVATION:
Were forging a future where everyone finds their rightful place and where every voice matters. Where uniqueness isnt just accepted but embraced. Thats why we are committed to fostering the growth and development of every person, cultivating a sense of community through our Employee Resource Groups and advocating for inclusive leadership. At Pure Storage, diversity, equity, inclusion and sustainability are part of our DNA because we believe our people will shape the next chapter of our success story. 
Pure Storage is proud to be an equal opportunity employer. We strongly encourage applications from Indigenous Peoples, racialized people, people with disabilities, people from gender and sexually diverse communities, and people with intersectional identities. We also encourage you to apply even if you feel you dont match all of the role criteria. If you think you can do the job and feel youre a good match, please apply."
3237461,"Developer, Portworx - Go, K8s","https://job-boards.greenhouse.io/purestorage/jobs/7058327","storage","Bangalore","No",4,"Full time","2025-07-15T02:21:31.707590Z","Were in an unbelievably exciting area of tech and are fundamentally reshaping the data storage industry. Here, you lead with innovative thinking, grow along with us, and join the smartest team in the industry.
This type of workwork that changes the worldis what the tech industry was founded on. So, if you're ready to seize the endless opportunities and leave your mark, come join us.SHOULD YOU ACCEPT THIS CHALLENGE...
You will join the Portworx team, which is responsible for delivering the highest quality Portworx suite of products. You will be contributing to cleanest code, being customer oriented and putting quality first. You will be involved in developing a new SaaS platform to help provide a secured, consistent best-in-class experience for our customers purchasing and using various Portworx offerings_- As a developer in the Portworx team, you will be responsible for design and implementing various features and products on the Portworx portfolio. 
Key Responsibilities:

Designing and developing SaaS microservices and integrating new features to Portworx products
Bringing a focus on design, development, unit/functional testing, design reviews, code reviews, documentation, continuous integration and continuous deployment
Collaborating with peers and stake-holders to take solutions from initial design to production
Take full ownership of design and development activity by adapting to customer feedback and handling issues found in unit testing, system testing and customer deployments
Experimenting with new technologies in order to push the state-of-the-art and innovate new solutions

Requirements:

BS in Computer Science or related technical field.
4+ years of experience in designing, developing and testing various product components using one or more of the following languages (C++, Java, Go preferred).
Good understanding of Microservices Architecture, and SaaS based scalable platforms
Experience designing and implementing high quality, testable, maintainable, optimal, production grade microservices and more often promote it to production environment hosted in cloud by applying knowledge and experience around cloud infrastructure, deployments and continuous integration
Designing and owning microservices to operate and scale in a distributed system architecture
Experience working with multiple stakeholders (internal and external) from product management to customer beta partners in designing highly scalable and production quality software
Proven design sensibility and the willingness to work in a collaborative, team oriented environment
Must be willing and able to work in an open office environment.
Solid CS background in data structures, algorithms and software design.

 
What Can Give You a Head Start:

Knowledge and working experience in Kubernetes and Containers 
Experience building and integrating Authentication (SSO, LDAP) and Authorization (RBAC, OAuth) frameworks.
Experience working in E-commerce marketplace integration projects .
Prior experience in Kubernetes Control Plane development 
Experience working in automating SaaS billing and usage reporting to customers 
Experience working in building systems to obtain Telemetry reports from business services running in production.
Experience building public facing SDKs._

 WHAT YOU CAN EXPECT FROM US:

Pure Innovation: We celebrate those who think critically, like a challenge and aspire to be trailblazers.
Pure Growth: We give you the space and support to grow along with us and to contribute to something meaningful. We have been Named Fortune's Best Large Workplaces in the Bay AreaTM, Fortune's Best Workplaces for MillennialsTM and certified as a Great Place to Work!
Pure Team: We build each other up and set aside ego for the greater good.

And because we understand the value of bringing your full and best self to work, we offer a variety of perks to manage a healthy balance, including flexible time off, wellness resources and company-sponsored team events. Check out purebenefits.com for more information.
ACCOMMODATIONS AND ACCESSIBILITY:
Candidates with disabilities may request accommodations for all aspects of our hiring process. For more on this, contact us at TA-Ops@purestorage.com if youre invited to an interview.
WHERE DIFFERENCES FUEL INNOVATION:
Were forging a future where everyone finds their rightful place and where every voice matters. Where uniqueness isnt just accepted but embraced. Thats why we are committed to fostering the growth and development of every person, cultivating a sense of community through our Employee Resource Groups and advocating for inclusive leadership. At Pure Storage, diversity, equity, inclusion and sustainability are part of our DNA because we believe our people will shape the next chapter of our success story. 
Pure Storage is proud to be an equal opportunity employer. We strongly encourage applications from Indigenous Peoples, racialized people, people with disabilities, people from gender and sexually diverse communities, and people with intersectional identities. We also encourage you to apply even if you feel you dont match all of the role criteria. If you think you can do the job and feel youre a good match, please apply."
