"ID","Title","Link","Company","Location","Remote","Experience","EmploymentType","DatePosted","RoleDescription"
3225982,"Technical Evangelist","https://job-boards.greenhouse.io/purestorage/jobs/6979263","storage","Santa Clara","No",5,"Full time","2025-07-15T02:21:31.707869Z","Were in an unbelievably exciting area of tech and are fundamentally reshaping the data storage industry. Here, you lead with innovative thinking, grow along with us, and join the smartest team in the industry.
This type of workwork that changes the worldis what the tech industry was founded on. So, if you're ready to seize the endless opportunities and leave your mark, come join us.As a Technical Evangelist, youll drive the creation and execution of our value narrative, blog strategy, digital experiences, and technical content to engage and inspire technical buyers. In close partnership with Product Management and Product Marketing, you'll bring new features to life through compelling stories that showcase product capabilities and differentiators. Youll develop and manage a robust technical marketing bill of materialsranging from sales presentations and social media content to demo videos, enablement resources, and technical articlesthat span multiple channels. Collaboration is key: youll work cross-functionally with field sales, partners, and internal teams to ensure alignment and education. A core focus will be on highlighting FlashBlades unique value for key workloads, while also building meaningful engagement with our technical community.
SHOULD YOU ACCEPT THIS CHALLENGE...

Owning the technical marketing execution of our core FlashBlade (FB) solutions. Working directly with Product Marketing Managers, Product Managers and Field Sales Engineering to bring marketing moments to fruition through presentations, blogs, webcasts, videos, demos, and more
Driving digital strategy of the purestorage.com/demos Pure360 demonstrations and experiences like TestDrive.
Development and ownership of the FB product blog strategy supporting core features and product announcements
Primary owner of the FB technical marketing BOM strategy, inc development orchestration across teams (and self as required)
Be a thought leader creating content that highlights the new features and integrations for FlashArray.
Understand high-level technical architecture and be able to facilitate communication, feedback, and drive decisions on appropriate collateral.

WHAT YOULL NEED TO BRING TO THIS ROLE...

Bachelor's degree or equivalent work experience
5+ years of experience in a product marketing, solution marketing, or technical marketing role.
Knowledge of NAS storage arrays for File and Object protocols
Product management candidates should also apply.
Demonstrated success in positioning and launching differentiated products
Recognized as a professional communicator/speaker and enjoy writing 
Strong aptitude for translating technical differentiators into simple stories
The desire to redefine the benchmark for excellence, be part of something big and learn as much as you can in the process
Strong technical product marketing or product management experience within cloud or storage platform
Knowledge of key target audience: DevOps, cloud architects, Storage Admins, IT infrastructure managers, Director of IT, and VP of IT
We are primarily an in-office environment and therefore, you will be expected to work from the Santa Clara office in compliance with Pures policies, unless you are on PTO, or work travel, or other approved leave.

#LI-ONSITE
#LI-KT1 
Salary ranges are determined based on role, level and location. For positions open to candidates in multiple geographical locations, the base salary range is reflective of the labor market across the applicable locations. 
This role may be eligible for incentive pay and/or equity. 
There is no application deadline and we accept applications on an ongoing basis until the job is filled.The annual base salary range is: $149,000$224,000 USDWHAT YOU CAN EXPECT FROM US:

Pure Innovation: We celebrate those who think critically, like a challenge and aspire to be trailblazers.
Pure Growth: We give you the space and support to grow along with us and to contribute to something meaningful. We have been Named Fortune's Best Large Workplaces in the Bay AreaTM, Fortune's Best Workplaces for MillennialsTM and certified as a Great Place to Work!
Pure Team: We build each other up and set aside ego for the greater good.

And because we understand the value of bringing your full and best self to work, we offer a variety of perks to manage a healthy balance, including flexible time off, wellness resources and company-sponsored team events. Check out purebenefits.com for more information.
ACCOMMODATIONS AND ACCESSIBILITY:
Candidates with disabilities may request accommodations for all aspects of our hiring process. For more on this, contact us at TA-Ops@purestorage.com if youre invited to an interview.
WHERE DIFFERENCES FUEL INNOVATION:
Were forging a future where everyone finds their rightful place and where every voice matters. Where uniqueness isnt just accepted but embraced. Thats why we are committed to fostering the growth and development of every person, cultivating a sense of community through our Employee Resource Groups and advocating for inclusive leadership. At Pure Storage, diversity, equity, inclusion and sustainability are part of our DNA because we believe our people will shape the next chapter of our success story. 
Pure Storage is proud to be an equal opportunity employer. We strongly encourage applications from Indigenous Peoples, racialized people, people with disabilities, people from gender and sexually diverse communities, and people with intersectional identities. We also encourage you to apply even if you feel you dont match all of the role criteria. If you think you can do the job and feel youre a good match, please apply."
3225981,"Senior Pre-Sales Systems Engineer, Enterprise - Detroit","https://job-boards.greenhouse.io/purestorage/jobs/7051282","storage","Detroit","Yes",5,"Full time","2025-07-15T02:21:31.707891Z","Were in an unbelievably exciting area of tech and are fundamentally reshaping the data storage industry. Here, you lead with innovative thinking, grow along with us, and join the smartest team in the industry.
This type of workwork that changes the worldis what the tech industry was founded on. So, if you're ready to seize the endless opportunities and leave your mark, come join us.Are you passionate about driving innovation in the data storage industry? Are you skilled in crafting technical solutions that exceed customer expectations? If so, we have an exciting opportunity for you! Pure Storage, a leader in the data storage and flash technology space, is seeking a talented and motivated Pre-Sales Systems Engineer to join our dynamic team. 
As a Senior Pre-Sales Systems Engineer, you will play a crucial role in understanding our customers' unique challenges and tailoring Pure Storage solutions to meet their specific needs. Collaborating closely with the sales team, you will act as a technical expert during the sales process, helping to showcase the value of our products and services.
SHOULD YOU ACCEPT THIS CHALLENGE YOU WILL:

Develop an exhaustive understanding of what drives a customers business and what motivates their decision making
Connect the dots from technology solutions, inclusive of the Pure Storage portfolio and others from the ecosystem, to measurable customer business outcomes
Partner closely with account managers, specialists and channel partners to create a seamless and holistic customer experience and strategy to drive revenue growth and net new business
Passionately bring to light the advantages of a Pure Storage solution
Delight customers and teammates with your technical leadership and domain expertise on storage products, distributed storage architectures, file systems, and competitive storage offerings in the DAS, NAS and SAN product spaces
Take control of evaluations,  benchmarks and system configurations
Build and deliver technical product and architecture presentations with vigor to customers and lock in the technical win with clients and prospective accounts
Capture requirements and translate Customers business needs into innovative solutions to accelerate their growth and capacity
Contribute significant portions and/or lead responses to RFPs, RFQs and RFIs
Seek out and spur new opportunities for interoperability, functional, and performance testing/validation
Promote mutual roadmap and planning exchanges
Liaise with product and technical marketing to produce materials (i.e. whitepaper, web presentations) that support overall alliance plans and objectives
Stay current with the competition and ensure that materials accurately reflect the latest, differentiated solution positioning
Move with market trends and competitive landscape to promote thought leadership within our organization
Lead by example living the Pure Values:  Persistence, Creativity, Teamwork, Ownership and Customer-first  

WHAT YOULL NEED TO BRING TO THIS ROLE...

BS in CS, EE or other technical degree and/or equivalent experience
Pre-sales experience is required
5 or more years of relevant experience, mixed among technology, design, and communications required. Experience supporting the sales of enterprise storage, networking, systems, cloud, or software to enterprise accounts preferred
Deep understanding of the architecture, design and implementation of multi-tiered client/server and web-based computing solutions
Must have a familiarity with modern web architecture a plus (LAMP stack, scale-out vs scale-up architectures, AWS well-architected framework, microservices architecture)
Prior experience in targeting new prospects and converting them into clients
Contribute significant portions and/or lead responses to RFPs, RFQs and RFIs
Superior knowledge of current and emerging storage architectures (FC, iSCSI, NAS, OSD, SAN)
Previous experience with Linux, NFS file systems and Linux distributed network environment
Installation/configuration of distributed computing, multiprocessing, virtual memory subsystem, storage subsystems architecture, shared memory architectures, cache architectures, windowing systems
Strong knowledge of digital transformation to a Cloud Native architecture, On-Prem, Public Cloud, Provisioning Automation, and Containers
Knowledge of VMware, Local Area Networking, Ethernet, TCP/IP and general networking
Familiarity with AWS, Azure, GCP a plus
Familiarity with containers, k8s and microservices architectures a plus
Curiosity and passion around technology and explaining and showing new technology platforms and concepts to customers
Familiarity with storage-intensive applications and their requirements such as structured databases (SQL, Oracle) is highly desirable
Excellent verbal and written interpersonal skills

#LI-REMOTE
#LI-JL4 
Salary ranges are determined based on role, level and location. For positions open to candidates in multiple geographical locations, the base salary range is reflective of the labor market across the applicable locations. 
This role may be eligible for incentive pay and/or equity. 
There is no application deadline and we accept applications on an ongoing basis until the job is filled.The annual base salary range is: $137,200$206,500 USDWHAT YOU CAN EXPECT FROM US:

Pure Innovation: We celebrate those who think critically, like a challenge and aspire to be trailblazers.
Pure Growth: We give you the space and support to grow along with us and to contribute to something meaningful. We have been Named Fortune's Best Large Workplaces in the Bay AreaTM, Fortune's Best Workplaces for MillennialsTM and certified as a Great Place to Work!
Pure Team: We build each other up and set aside ego for the greater good.

And because we understand the value of bringing your full and best self to work, we offer a variety of perks to manage a healthy balance, including flexible time off, wellness resources and company-sponsored team events. Check out purebenefits.com for more information.
ACCOMMODATIONS AND ACCESSIBILITY:
Candidates with disabilities may request accommodations for all aspects of our hiring process. For more on this, contact us at TA-Ops@purestorage.com if youre invited to an interview.
WHERE DIFFERENCES FUEL INNOVATION:
Were forging a future where everyone finds their rightful place and where every voice matters. Where uniqueness isnt just accepted but embraced. Thats why we are committed to fostering the growth and development of every person, cultivating a sense of community through our Employee Resource Groups and advocating for inclusive leadership. At Pure Storage, diversity, equity, inclusion and sustainability are part of our DNA because we believe our people will shape the next chapter of our success story. 
Pure Storage is proud to be an equal opportunity employer. We strongly encourage applications from Indigenous Peoples, racialized people, people with disabilities, people from gender and sexually diverse communities, and people with intersectional identities. We also encourage you to apply even if you feel you dont match all of the role criteria. If you think you can do the job and feel youre a good match, please apply."
3225980,"Security Operations and SaaS Security Analyst","https://job-boards.greenhouse.io/purestorage/jobs/7032267","storage","Lehi, Utah; Santa Clara, California","No",7,"Full time","2025-07-15T02:21:31.707912Z","Were in an unbelievably exciting area of tech and are fundamentally reshaping the data storage industry. Here, you lead with innovative thinking, grow along with us, and join the smartest team in the industry.
This type of workwork that changes the worldis what the tech industry was founded on. So, if you're ready to seize the endless opportunities and leave your mark, come join us.SHOULD YOU ACCEPT THIS CHALLENGE...
Operating in a hybrid Security Operations and SaaS Security environment, you are a technical and analytical engineer who thrives on implementing secure solutions, automating the boring stuff, and evolving operations in step with todays threat landscape.
You bring structure and reliability to security operations by managing a modern stack of tools, ensuring SLA-driven service support, and proactively enhancing enterprise SaaS security posture. Your hands-on experience in cloud security, scripting, and compliance frameworks enables you to drive strategic improvements across infrastructure, tooling, and business-facing platforms.
You enjoy engaging with multiple teamsfrom architects and developers to security operations and IT stakeholders to SaaS application owners to build and maintain secure-by-design environments. Youre comfortable translating business needs into security outcomes, and you take pride in helping your organization stay ahead of emerging risks.
ABOUT THE ROLE
You are a Security Operations Engineer / SaaS Security Analyst responsible for implementing, maintaining, and optimizing secure technology solutions that align with organizational goals and compliance requirements.
In this role, you support a diverse security toolset (e.g., EDR, web content filtering, certificate issuer, domain registrar, SaaS security posture management, etc. ), support incident response, and monitor SaaS environments. Your responsibilities include operating security systems, assessing third-party risks, collaborating on compliance initiatives. Youll support day-to-day operations, support security events, and contribute to improvements that make our workflows more effective.
Youll collaborate with teams across the organizationfrom IT to application ownersto support security best practices and help resolve issues as they arise. Youll also have opportunities to grow your technical skills, work with modern security technologies, and contribute to projects that improve our security posture over time.
This is a hands-on role where curiosity, teamwork, and attention to detail are just as important as technical knowledge. If you're interested in a role that blends security engineering and SaaS analysis, this is a great opportunity to build experience and make an impact.
RESPONSIBILITIES
SaaS Security Analyst Responsibilities

Posture Monitoring Across SaaS Applications: Work closely with SaaS application owners and stakeholders and help drive down SaaS security risk findings especially in IAM &amp; access control hygiene such as least privilege enforcement, manage access lifecycle, and implement MFA and role-based access.
SaaS Tooling Integration: Integrate posture management tools with existing infrastructure for real-time visibility.
Misconfiguration Detection &amp; Remediation: Identify risks in SaaS environments and lead remediation with SaaS owners.
Data Flow &amp; Third-party App Oversight: Monitor app integrations and third-party data sharing to minimize exposure.
Security Awareness &amp; Enablement: Act as a knowledge resource to help teams adopt secure usage practices for cloud applications.
Support Risk Reviews &amp; Compliance Audits: Assist with vendor security reviews, policy enforcement, and audit readiness for SaaS platforms.

Security Operations Engineer Responsibilities

Manage &amp; Monitor Security Tools: Operate and maintain platforms like EDR, web content filtering, certificate issuer, domain registrar, SaaS security posture management, DMARC, DKIM, etc.System Administration &amp; Runbooks &amp; Enhancements:Execute repeatable tasks on security systems and services (e.g., log ingestion, user provisioning, policy enforcement, proficient with all security toolings) using documented runbooks. Suggest and implement improvements to reduce manual effort and errors.
Security Ticket Queue Ownership: Prioritize and resolve service and escalation tickets with SLA accountability.
Tool Integration &amp; Automation: Script automations and integrate tools to streamline workflows using Python, PowerShell, etc.
Security Strategy Collaboration: Partner with architects, developers, and the SOC to align on infrastructure security, emerging risks, and tool performance.
Drive Performance Testing: Conduct stress tests of tooling to ensure robustness without impeding innovation or daily operations.

WHAT YOULL NEED TO BRING TO THIS ROLE...

57+ years of experience in cybersecurity, security operations, or infrastructure security roles.
Strong background in IT systems (Windows, Linux, Unix) and cloud platforms (AWS, Azure, Google Cloud).Proven experience operating security operations technology stack toolings.
Proficient understanding of compliance obligations and ability to align technical controls with CIS, MITRE, and NIST standards.
Proficiency in scripting (Python, PowerShell, Shell) to support automation and integration.
DevOps and CI/CD awareness is a plus.
CISSP (preferred), CISM, or SANS (GCIH, GCIA) certifications.
Security+, AWS/Azure cloud certifications, or vendor-specific security credentials are a bonus.
Excellent communicator capable of translating technical issues into business risks and actions.
Highly collaborative, with a track record of leading initiatives across multiple teams.
Adaptive, trustworthy, and proactive in problem-solving.
Bachelors degree in Computer Science, Information Assurance, MIS, or a related fieldor equivalent experience.

We are primarily an in-office environment and therefore, you will be expected to work from the Santa Clara, CA or Lehi, Utah office in compliance with Pures policies, unless you are on PTO, or work travel, or other approved leave.
#LI-TH3,  #LI-ONSITE
  
Salary ranges are determined based on role, level and location. For positions open to candidates in multiple geographical locations, the base salary range is reflective of the labor market across the applicable locations. 
This role may be eligible for incentive pay and/or equity. 
There is no application deadline and we accept applications on an ongoing basis until the job is filled.The annual base salary range is: $114,000$248,000 USDWHAT YOU CAN EXPECT FROM US:

Pure Innovation: We celebrate those who think critically, like a challenge and aspire to be trailblazers.
Pure Growth: We give you the space and support to grow along with us and to contribute to something meaningful. We have been Named Fortune's Best Large Workplaces in the Bay AreaTM, Fortune's Best Workplaces for MillennialsTM and certified as a Great Place to Work!
Pure Team: We build each other up and set aside ego for the greater good.

And because we understand the value of bringing your full and best self to work, we offer a variety of perks to manage a healthy balance, including flexible time off, wellness resources and company-sponsored team events. Check out purebenefits.com for more information.
ACCOMMODATIONS AND ACCESSIBILITY:
Candidates with disabilities may request accommodations for all aspects of our hiring process. For more on this, contact us at TA-Ops@purestorage.com if youre invited to an interview.
WHERE DIFFERENCES FUEL INNOVATION:
Were forging a future where everyone finds their rightful place and where every voice matters. Where uniqueness isnt just accepted but embraced. Thats why we are committed to fostering the growth and development of every person, cultivating a sense of community through our Employee Resource Groups and advocating for inclusive leadership. At Pure Storage, diversity, equity, inclusion and sustainability are part of our DNA because we believe our people will shape the next chapter of our success story. 
Pure Storage is proud to be an equal opportunity employer. We strongly encourage applications from Indigenous Peoples, racialized people, people with disabilities, people from gender and sexually diverse communities, and people with intersectional identities. We also encourage you to apply even if you feel you dont match all of the role criteria. If you think you can do the job and feel youre a good match, please apply."
