"ID","Title","Link","Company","Location","Remote","Experience","EmploymentType","DatePosted","RoleDescription"
2798208,"Senior Manager, Technical Services","https://job-boards.greenhouse.io/purestorage/jobs/6798311","storage","Lehi, Utah; Remote, North Carolina","Yes",7,"Full time","2025-07-15T02:21:31.706865Z","Were in an unbelievably exciting area of tech and are fundamentally reshaping the data storage industry. Here, you lead with innovative thinking, grow along with us, and join the smartest team in the industry.
This type of workwork that changes the worldis what the tech industry was founded on. So, if you're ready to seize the endless opportunities and leave your mark, come join us. 
SHOULD YOU ACCEPT THIS CHALLENGE...
Pure Storage is seeking an experienced Senior Manager for our Technical Services team in Lehi, Utah or Raleigh, North Carolina. Senior Managers in Technical Services are uniquely responsible for maintaining the culture of service and collaboration that differentiates Pure from other storage vendors, and from other employers. Through their mentorship and guidance of first-time Managers, Team Leads, and Coaches. Senior Managers set the tone for the organization that is directly reflected in the quality of engineer interactions with customers, and in the desirability of Pure Technical Services as a place to work. As leaders of those that supervise the people doing the technical services work of the business, Senior Managers must exemplify and continuously model behavior, conduct, and judgment congruent with Pures core values. 
Key Responsibilities:

Supervision of 1-5 managers/team leads and a direct team of individual contributors
Provide guidance, mentorship, and development to Managers, Team Leads, Coaches, peers and other direct reports
Ensure priorities and goals for their functional area or areas are clear and in obvious alignment with Pures corporate goals, and with the more general goals and priorities of Pure Technical Services.
Work with Managers to ensure goals cascade to all individual contributors in a way that facilitates organizational clarity
Develop strategies and execution plans for support delivery, and future service differentiation with management peers
Collaborate across functions with peers in other organizations to accomplish shared goals as one Pure team
Partner with peers and management on talent, diversity &amp;  inclusion and development guidelines
Ability to fully understand and be able to effectively communicate the state of the business 
Participate in or contribute to projects as assigned
Cultivates career development of staff members through coaching, training, performance evaluations and appropriate job assignments; maintains technical competence and leadership and establishes management succession.
Identify, lead and execute on projects
Champions initiatives to resolve critical processes and technological-related issues.
Working cross-functionally across Pure Storage to drive/develop initiatives
Partner with recruiting to set priorities for hiring
Responsible for helping resolve internal conflicts 
Schedule regular team meetings, guide direct reports in determining team goals, assist in creating a path for growth and success.   
Mentor managers on how to be effective in team management and effectively provide feedback
Build strong relations with key technical influencers and decision makers within the organization.

 
WHAT YOULL NEED TO BRING TO THIS ROLE...

A minimum of 7-10 years of experience in customer-facing, technical support role
At least 5 years of management experience
Must be willing to work the following shift: Monday - Friday from 7am - 4pm MST.
Excellent communications and organizational skills
Experience recruiting technical talent and developing a strong team and leadership bench
Track record of managing high performing and engaged teams
Proven ability to resolve customer and employee problems, complaints and issues utilizing appropriate internal and external resources
Prior support experience in technical industry
Experience working across multiple teams in developing procedures, policies, improving operational efficiencies, etc...
Successfully established and deliver operational directives for two or more teams/departments
Change management experience is required
Knowledge of ITIL concepts is preferred (ITIL Certification is a bonus!)
Bachelor's Degree or equivalent years of experience 

We are primarily an in-office environment and therefore, you will be expected to work from the Lehi, Utah office in compliance with Pures policies, unless you are on PTO, or work travel, or other approved leave.
#LI-ONSITE
  
Salary ranges are determined based on role, level and location. For positions open to candidates in multiple geographical locations, the base salary range is reflective of the labor market across the applicable locations. 
This role may be eligible for incentive pay and/or equity. 
There is no application deadline and we accept applications on an ongoing basis until the job is filled.The annual base salary range is: $123,000$212,000 USDWHAT YOU CAN EXPECT FROM US:

Pure Innovation: We celebrate those who think critically, like a challenge and aspire to be trailblazers.
Pure Growth: We give you the space and support to grow along with us and to contribute to something meaningful. We have been Named Fortune's Best Large Workplaces in the Bay AreaTM, Fortune's Best Workplaces for MillennialsTM and certified as a Great Place to Work!
Pure Team: We build each other up and set aside ego for the greater good.

And because we understand the value of bringing your full and best self to work, we offer a variety of perks to manage a healthy balance, including flexible time off, wellness resources and company-sponsored team events. Check out purebenefits.com for more information.
ACCOMMODATIONS AND ACCESSIBILITY:
Candidates with disabilities may request accommodations for all aspects of our hiring process. For more on this, contact us at TA-Ops@purestorage.com if youre invited to an interview.
WHERE DIFFERENCES FUEL INNOVATION:
Were forging a future where everyone finds their rightful place and where every voice matters. Where uniqueness isnt just accepted but embraced. Thats why we are committed to fostering the growth and development of every person, cultivating a sense of community through our Employee Resource Groups and advocating for inclusive leadership. At Pure Storage, diversity, equity, inclusion and sustainability are part of our DNA because we believe our people will shape the next chapter of our success story. 
Pure Storage is proud to be an equal opportunity employer. We strongly encourage applications from Indigenous Peoples, racialized people, people with disabilities, people from gender and sexually diverse communities, and people with intersectional identities. We also encourage you to apply even if you feel you dont match all of the role criteria. If you think you can do the job and feel youre a good match, please apply."
3176208,"Compensation Business Partner, G&A","https://job-boards.greenhouse.io/purestorage/jobs/7011855","storage","Lehi, Utah","No",6,"Full time","2025-07-15T02:21:31.706941Z","Were in an unbelievably exciting area of tech and are fundamentally reshaping the data storage industry. Here, you lead with innovative thinking, grow along with us, and join the smartest team in the industry.
This type of workwork that changes the worldis what the tech industry was founded on. So, if you're ready to seize the endless opportunities and leave your mark, come join us.SHOULD YOU ACCEPT THIS CHALLENGE...
The Compensation Partner, G&amp;A is a vital member of Pures HR Compensation Team, shaping and executing our compensation strategies for our G&amp;A organizations. This individual contributor role offers wide scope, high impact, and autonomy in supporting senior HR and business leaders across multiple business functions.
In this role youll lead through influence and subject matter expertise - managing relationships across all levels and driving outcomes. You'll partner closely with stakeholders across HR, Legal, Finance and business leaders to develop compensation strategies that support organization growth and an exceptional employee experience.
Strategic Partnership &amp; Advisory

Act as a trusted compensation advisor to HRBPs and business leaders, delivering insights that align pay strategies with organizational goals by enabling long-term talent success through strategic acquisition, engagement and retention
Lead HRBPs and business leaders through Annual Compensation Cycle to ensure fairness and consistency across rewards and alignment with Pures pay for performance philosophy
Serve as liaison between compensation and talent teams to ensure alignment across HR and enablement of partners, managers and employees around job and pay programs

Operational Expertise

Implement competitive compensation structures across G&amp;A functions including base pay and incentives
Design supplemental compensation programs and processes
Collaborate cross-functionally to manage projects effectively including change communications and policy documentation related to compensation design
Execute programs with excellence using proven program management experience to ensure stakeholder alignment, visibility and on time delivery

Insights &amp; Continuous Improvement

Leverage best practices to evolve Pures compensation effectiveness and build knowledge base compensation practices and processes to drive efficiency and scale

WHAT YOULL NEED TO BRING TO THIS ROLE...

Bachelors degree or equivalent work experience in a relevant field. A Masters degree or professional certification (e.g., Certified Compensation Professional) is preferred
6+ years of experience in compensation management
Ability to navigate complex challenges with strong analytical, critical thinking, and data-driven decision-making skills
Experience applying user-centered design thinking to shape impactful HR processes and experiences
Ability to translate ambiguity into clarity through confident, clear communication  whether presenting to groups, leading workshops, or aligning stakeholders
Influence without authority, by fostering cross-functional collaboration in both in-person and virtual environments
Strong ownership mindset with a proactive, high-quality approach to work
Trusted to handle sensitive information with maturity, discretion, and sound judgment
Highly organized while managing competing priorities with resilience and focus
Committed to continuous learning, improvement, and bringing a positive, can-do attitude to every challenge
Proficiency in compensation management systems and tools

We are primarily an in-office environment and therefore, you will be expected to work from the Lehi, Utah office in compliance with Pures policies, unless you are on PTO, or work travel, or other approved leave.
#LI-TH3, #LI-ONSITE 
Salary ranges are determined based on role, level and location. For positions open to candidates in multiple geographical locations, the base salary range is reflective of the labor market across the applicable locations. 
This role may be eligible for incentive pay and/or equity. 
There is no application deadline and we accept applications on an ongoing basis until the job is filled.The annual base salary range is: $149,000$224,000 USDWHAT YOU CAN EXPECT FROM US:

Pure Innovation: We celebrate those who think critically, like a challenge and aspire to be trailblazers.
Pure Growth: We give you the space and support to grow along with us and to contribute to something meaningful. We have been Named Fortune's Best Large Workplaces in the Bay AreaTM, Fortune's Best Workplaces for MillennialsTM and certified as a Great Place to Work!
Pure Team: We build each other up and set aside ego for the greater good.

And because we understand the value of bringing your full and best self to work, we offer a variety of perks to manage a healthy balance, including flexible time off, wellness resources and company-sponsored team events. Check out purebenefits.com for more information.
ACCOMMODATIONS AND ACCESSIBILITY:
Candidates with disabilities may request accommodations for all aspects of our hiring process. For more on this, contact us at TA-Ops@purestorage.com if youre invited to an interview.
WHERE DIFFERENCES FUEL INNOVATION:
Were forging a future where everyone finds their rightful place and where every voice matters. Where uniqueness isnt just accepted but embraced. Thats why we are committed to fostering the growth and development of every person, cultivating a sense of community through our Employee Resource Groups and advocating for inclusive leadership. At Pure Storage, diversity, equity, inclusion and sustainability are part of our DNA because we believe our people will shape the next chapter of our success story. 
Pure Storage is proud to be an equal opportunity employer. We strongly encourage applications from Indigenous Peoples, racialized people, people with disabilities, people from gender and sexually diverse communities, and people with intersectional identities. We also encourage you to apply even if you feel you dont match all of the role criteria. If you think you can do the job and feel youre a good match, please apply."
3265309,"Senior Data Engineer","https://job-boards.greenhouse.io/purestorage/jobs/7054233","storage","Bangalore","No",6,"Full time","2025-07-15T02:21:31.706965Z","Were in an unbelievably exciting area of tech and are fundamentally reshaping the data storage industry. Here, you lead with innovative thinking, grow along with us, and join the smartest team in the industry.
This type of workwork that changes the worldis what the tech industry was founded on. So, if you're ready to seize the endless opportunities and leave your mark, come join us.Pure Storage, Inc. is seeking a highly skilled and experienced BI Engineer - Snowflake developer , skilled in multiple BI tools, concepts, and processes to manage the life cycle of our analytics dashboards and standard reporting, including business requirement gathering, functional specification write-ups, prototyping, development, quality testing, user acceptance testing, roll-out and post-launch enhancements implementation.  In this role, you will design, develop and implement BI solutions using Snowflake as the data warehouse platform and be able to create engaging and interactive business insights dashboards in Tableau, using best practices related to data visualization techniques, focusing on enhancing the user experience for your stakeholders.  You will be expected to seamlessly communicate with multiple stakeholders to produce and maintain comprehensive and scalable datasets, processes, and documentation, as well as mentor junior teammates.
Technical Qualifications:

6+ years' experience in Data Engineering of highly scalable data platforms/ecosystems with hands-on experience in complex sql.
3+ years experience in Snowflake with knowledge in distributed computing preferred.
Working Knowledge of data visualization tools such as Tableau, and/or Power BI.
Be able to operate as a Fullstack BI engineer when need be.
Familiarity with working with GTM data and exposure to Salesforce.
Hands-on experience on Python , Pyspark.
Experience with Salesforce Einstein Analytics &amp; SOQL is value add.
Having done Quality Assurance in prior roles as additional responsibilities.
Proficiency in SQL and database table design  able to write structured and efficient queries on large data sets.
Demonstrated innate passion for Data Engineering and data architecture pertaining to Analytics.
Knowledge of Cloud data solutions, data engineering, data platforms and analytics and modern ways of automating data ingesting using cloud-based and on-premise technologies.
Experience in a role performing data warehouse and analytics solution design and development using a variety of techniques.
Understanding of data architecture design, data modeling, and physical database design and tuning.
Work with data warehouse architects, data scientists, and data collection application engineers. 
Propose data schema and data flow optimization for reporting performance and enhancement as needed.
Understanding data and query optimization, query profiling, and query performance monitoring tools and techniques.
Creating and maintaining business requirements and other technical documentation.
Collaborate with business stakeholders and data analysts to understand business requirements and translate them into actionable insights and reporting solutions.
Solid understanding of data modeling, database design, and SQL.
Experience with data integration, ETL, and data warehousing concepts.
Excellent communication and interpersonal skills, with the ability to collaborate effectively with cross-functional teams Strong communication skills.
An ability to talk both to the technical teams responsible for the data and comfortable explaining data and conclusions to non-technical teams.
Snowflake Certified preferred not mandatory.
Experience with Cloud Database systems like Snowflake or AWS Redshift will be a plus.
Bachelor's degree in Computer Science, Information Systems, Math, Statistics, or a related field.

Soft Skills:

Be a self-starter who takes autonomy and pride in your work.
Have the ability to think independently while also working in a collaborative environment.
Not be afraid to ask for help, voice your opinion, or make suggestions for improvements.
Be a fast learner and have a passion and drive for continuous learning and challenging yourself.
Be able to have fun in the midst of stress while maintaining great attention to detail.
Adapt quickly to new situations and be forward-thinking.
Have a clear and transparent communication style.
Be creative and want to use your creativity to move the business forward.
Have a willingness and openness to learning new practices, platforms, and technologies.

This is a full time position and the candidate is expected to report into Pure Storages Bangalore Office. WHAT YOU CAN EXPECT FROM US:

Pure Innovation: We celebrate those who think critically, like a challenge and aspire to be trailblazers.
Pure Growth: We give you the space and support to grow along with us and to contribute to something meaningful. We have been Named Fortune's Best Large Workplaces in the Bay AreaTM, Fortune's Best Workplaces for MillennialsTM and certified as a Great Place to Work!
Pure Team: We build each other up and set aside ego for the greater good.

And because we understand the value of bringing your full and best self to work, we offer a variety of perks to manage a healthy balance, including flexible time off, wellness resources and company-sponsored team events. Check out purebenefits.com for more information.
ACCOMMODATIONS AND ACCESSIBILITY:
Candidates with disabilities may request accommodations for all aspects of our hiring process. For more on this, contact us at TA-Ops@purestorage.com if youre invited to an interview.
WHERE DIFFERENCES FUEL INNOVATION:
Were forging a future where everyone finds their rightful place and where every voice matters. Where uniqueness isnt just accepted but embraced. Thats why we are committed to fostering the growth and development of every person, cultivating a sense of community through our Employee Resource Groups and advocating for inclusive leadership. At Pure Storage, diversity, equity, inclusion and sustainability are part of our DNA because we believe our people will shape the next chapter of our success story. 
Pure Storage is proud to be an equal opportunity employer. We strongly encourage applications from Indigenous Peoples, racialized people, people with disabilities, people from gender and sexually diverse communities, and people with intersectional identities. We also encourage you to apply even if you feel you dont match all of the role criteria. If you think you can do the job and feel youre a good match, please apply."
3265308,"Account Executive, Commercial (Seattle)","https://job-boards.greenhouse.io/purestorage/jobs/7037699","storage","Remote, Washington","Yes","Not specified","Full time","2025-07-15T02:21:31.707014Z","Were in an unbelievably exciting area of tech and are fundamentally reshaping the data storage industry. Here, you lead with innovative thinking, grow along with us, and join the smartest team in the industry.
This type of workwork that changes the worldis what the tech industry was founded on. So, if you're ready to seize the endless opportunities and leave your mark, come join us.Pure Storage is seeking an Account Executive with experience selling into customers in Greater Seattle Area.  This Account Executive will coordinate the overall strategy and relationship between the assigned accounts and Pure Storage. They will be responsible for team-selling efforts with other teammates and strategic partners around the globe to close business on a quarterly and annual basis. The ideal candidate will currently be selling and living in Seattle, WA.
SHOULD YOU ACCEPT THIS CHALLENGE...
In this role, you'll:

Evangelize our radically simple, all-flash enterprise storage technology and data solutions, ensuring customers fully grasp Pures total value proposition
Build and invest in relationships with customers to establish Pures value, continually driving the highest customer satisfaction ratings in the industry
Lead pursuit teams and develop account plans to make sure all internal resources are engaged to execute and win new Pure Customers 
Drive and manage a healthy and robust pipeline of sales activity to assure quarterly and annual quotas are met or exceeded

WHAT YOULL NEED TO BRING TO THIS ROLE...

Authenticity and a genuine desire to engage customers and understand their business challenges 
Thought leadership, creativity and a Challenger Mindset; the ability to apply your customer insights and expertise in technology solutions to position Pures portfolio to solve persistent problems
Avid hunter with proven prospecting skills, consistently opening doors to new customers and navigating seamlessly between the boardroom and the data center while passionately positioning the advantages of a Pure Storage solution
Excellent interpersonal skills including written and oral communication, able to build relationships easily and deepen them over time
Ability to assess, plan, and actively manage a territory to achieve maximum revenue and efficiency
Expertise leading a complex sales process with multiple stakeholders, while fostering teamwork and shared ownership internally and with Partners
Consistent track record of exceeding quota and driving referenceable business.
Passionate about post-sales customer success
8 + years of outside sales with a focus on new logo acquisition or business development; consistently delivering $5-$10M per year in revenues
 
Salary ranges are determined based on role, level and location. For positions open to candidates in multiple geographical locations, the base salary range is reflective of the labor market across the applicable locations. 
This role may be eligible for incentive pay and/or equity. 
There is no application deadline and we accept applications on an ongoing basis until the job is filled.The annual base salary range is: $139,000$222,500 USDWHAT YOU CAN EXPECT FROM US:

Pure Innovation: We celebrate those who think critically, like a challenge and aspire to be trailblazers.
Pure Growth: We give you the space and support to grow along with us and to contribute to something meaningful. We have been Named Fortune's Best Large Workplaces in the Bay AreaTM, Fortune's Best Workplaces for MillennialsTM and certified as a Great Place to Work!
Pure Team: We build each other up and set aside ego for the greater good.

And because we understand the value of bringing your full and best self to work, we offer a variety of perks to manage a healthy balance, including flexible time off, wellness resources and company-sponsored team events. Check out purebenefits.com for more information.
ACCOMMODATIONS AND ACCESSIBILITY:
Candidates with disabilities may request accommodations for all aspects of our hiring process. For more on this, contact us at TA-Ops@purestorage.com if youre invited to an interview.
WHERE DIFFERENCES FUEL INNOVATION:
Were forging a future where everyone finds their rightful place and where every voice matters. Where uniqueness isnt just accepted but embraced. Thats why we are committed to fostering the growth and development of every person, cultivating a sense of community through our Employee Resource Groups and advocating for inclusive leadership. At Pure Storage, diversity, equity, inclusion and sustainability are part of our DNA because we believe our people will shape the next chapter of our success story. 
Pure Storage is proud to be an equal opportunity employer. We strongly encourage applications from Indigenous Peoples, racialized people, people with disabilities, people from gender and sexually diverse communities, and people with intersectional identities. We also encourage you to apply even if you feel you dont match all of the role criteria. If you think you can do the job and feel youre a good match, please apply."
