"ID","Title","Link","Company","Location","Remote","Experience","EmploymentType","DatePosted","RoleDescription"
3467060,"Eng Photographer","https://jobs.smartrecruiters.com/NBCUniversal3/744000077298275-eng-photographer","universal","Houston","Yes",5,"Full time","2025-08-21T01:57:37.572006Z","Versant Media Field Operations is seeking a highly skilled and experienced Full-Time ENG (Electronic News Gathering) Photographer to join our broadcast news gathering team.  This role will report to the Manager Field Operations. The ideal candidate will have a strong background in news photography, technical expertise with professional camera and lighting equipment, and the ability to thrive in high-pressure, fast-paced environments. This role requires flexibility, creativity, and a passion for visual storytelling.What Youll Do: Maintain a professional demeanor and attention to detail under pressure.Capture high-quality video and audio content for daily news coverage, live broadcasts, and special reports, in live and prerecorded environments that enhance storytelling.Operate a wide range of professional broadcast camera systems, lighting equipment, audio gear, and bonded cellular or satellite transmission systems.Collaborate closely with reporters, producers, and assignment editors to ensure visually compelling and editorially sound storytelling.Ensure all shots meet network standards for quality and editorial integrity.Safely transport, set up, and break down equipment on location.Quickly adapt to breaking news scenarios, adjusting coverage plans and equipment setups as needed.Maintain all assigned equipment in good working order; report and coordinate repairs and replacements as necessary.Apply creative techniques in lighting, composition, and camera movement to enhance storytelling.Assist with live shot setups, including lighting, framing, and IFB/mic coordination for on-air talent.Monitor and troubleshoot live transmission feeds from the field as required.Adhere to all safety protocols and company policies during field assignments.Work flexible hours, including early mornings, late nights, weekends, holidays, and on-call assignments.Prioritize and manage multiple production assignments simultaneously.What You Must Have:Associates or Bachelors degree in Broadcast Television Production or equivalent experience.5+ years of professional experience as an ENG photographer or camera operator in a broadcast news environment.Strong technical expertise with professional video cameras, lenses, lighting kits, audio equipment, and live transmission technologiesProficient in operating Panasonic P2, Sony FX Cinema Series, and Canon 5D cameras.Knowledge of LiveU and other streaming/mobile technologies, including 5G.Skilled in adjusting lighting for optimal exposure in various conditions.Proven ability to shoot under tight deadlines and adjust quickly to changing editorial direction.Strong news judgment and understanding of journalistic standards.Excellent interpersonal skills; ability to work collaboratively with reporters, producers, and other crew members in the field.Ability to lift and carry equipment weighing 50+ lbs and work outdoors in varying weather conditions.Valid passport and drivers license with a clean driving record; ability to drive company vehicles to assignments.Commitment to maintaining the highest levels of quality, professionalism, and ethical standards in all work.What Would Make You a Stand-out:FAA Part 107 drone certification is a strong plusExperience with various LED lighting instruments, as well as DMX lighting systems.Experience in EFP (Electronic Field Production) and multi-camera environments.Knowledge of digital-first production methods and content optimization for social/video platforms.Familiarity with Movi/Gimble-Ronin camera stabilization systems. Comfortable applying basic makeup to guests and talent.Additional Information Salary range: $50-$70/hourThis position is required to be performed full-time from an NBCUniversal-designated worksite.As part of our selection process, external candidates may be required to attend an in-person interview with an NBCUniversal employee at one of our locations prior to a hiring decision. NBCUniversal's policy is to provide equal employment opportunities to all applicants and employees without regard to race, color, religion, creed, gender, gender identity or expression, age, national origin or ancestry, citizenship, disability, sexual orientation, marital status, pregnancy, veteran status, membership in the uniformed services, genetic information, or any other basis protected by applicable law.If you are a qualified individual with a disability or a disabled veteran and require support throughout the application and/or recruitment process as a result of your disability, you have the right to request a reasonable accommodation. You can submit your request to AccessibilitySupport@nbcuni.com.Although you'll be hired as an NBCU employee, your employment and the responsibilities associated with this job likely will transition to Versant in the future. By joining at this pivotal time, you'll be a part of this exciting company as it takes shape."
3467058,"Director, Incident Response & Detection","https://jobs.smartrecruiters.com/NBCUniversal3/744000077298305-director-incident-response-detection","universal","Englewood Cliffs","Yes",5,"Full time","2025-08-21T01:57:37.572019Z","The Director, Incident Response and Detection will be a critical team member within the new Versant Cyber organization. This individual is responsible for all incident response operations, the 24/7 security operations center (SOC), and all detection engineering and threat hunting activities. Reporting directly to the VP, Cyber Defense Operations, the successful candidate will be expected to develop new strategies, processes, best-practices, and tools that contribute to our cyber security posture. Responsibilities:Key areas of focus for the Director, Incident Response and Detection include managing workflows, escalations, and advance technical processes to build program maturity and growth of the threat operations and response function.  The successful candidate will be responsible for the following activities:Lead the overall strategy, execution, and continuous improvement of Security Operations, Incident Response, and Security Automation, Detection Engineering, and Threat Hunting programs.Manage and mentor SOC managers, incident responders, and threat hunters across global time zones, ensuring 24/7 operational resilience and high performance.Build and evolve IR policies, procedures, and playbooks that align with industry best practices (NIST, MITRE ATT&amp;CK, etc.).Ensure continuous readiness for cyber incidents and lead tabletop exercises and red/blue team collaboration.Serve as the senior escalation point for critical security incidents, overseeing coordinated responses, executive communications, and post-incident reviews.Promote, foster, and advocate for an environment of collaboration, diversity, and inclusion. Lead proactive threat hunting efforts, leveraging advanced analytics, threat intel, and behavioral analysis to uncover sophisticated adversary tactics.Interface with executive leadership, Legal, Risk, and IT to provide visibility and alignment on key cyber risks and response readiness.Deliver clear, actionable reporting on threat landscape trends, incident response outcomes, and SOC performance.Act as a spokesperson and subject matter expert during high-severity events, regulatory reviews, and board-level discussions.#LI-remoteBasic Requirements:5+ years working in Cyber Defense with experience in Incident Response, Security Operations Center (SOC), detection engineering, or similar functions.Deep technical knowledge of cyber threats, detection technologies, forensic tools, EDR/SIEM platforms, and attack methodologies.Strong command of security frameworks such as MITRE ATT&amp;CK, NIST CSF, CIS Controls, and experience with compliance regimes (e.g., SOX, GDPR, ISO).Experience with host-based and network-based logging and analysis.Must be self-motivated and able to work both independently and as part of a team.Strong communication (both verbal and written) and client intimacy skills with experience briefing corporate executives and professionals.Ability to be on call and provide support during nontraditional working hours.Bachelors Degree in an IT related field and/or equivalent work experience.Desired Characteristics:Previous experience working in multiple large complex environments and specifically within the Cyber Defense components of those organizations.Previous experience working in cyber defense and/or information security functions in the media and advanced technology industries.Previous experience working with network tools and technologies such as firewall (FW), proxies, IPS/IDS devices, full packet capture (FPC), and email platforms.Previous experience conducting static, dynamic, or reverse engineering malware analysis.Experience in applying security concepts to Cloud computing (AWS, Azure, GCP).Relevant certifications (GCIA, GCIH, GCFA, GNFA, etc.).Masters Degree in an IT related field.Additional Requirements:Fully Remote: This position has been designated as fully remote, meaning that the position is expected to contribute from a non-NBCUniversal worksite, most commonly an employees residence.This position is eligible for company sponsored benefits, including medical, dental and vision insurance, 401(k), paid leave, tuition reimbursement, and a variety of other discounts and perks. Learn more about the benefits offered by NBCUniversal by visiting the Benefits page of the Careers website. Salary range: $160,000 - $200,000 (bonus and long-term incentive eligible)We are accepting applications for this position on an ongoing basis.As part of our selection process, external candidates may be required to attend an in-person interview with an NBCUniversal employee at one of our locations prior to a hiring decision. NBCUniversal's policy is to provide equal employment opportunities to all applicants and employees without regard to race, color, religion, creed, gender, gender identity or expression, age, national origin or ancestry, citizenship, disability, sexual orientation, marital status, pregnancy, veteran status, membership in the uniformed services, genetic information, or any other basis protected by applicable law.  If you are a qualified individual with a disability or a disabled veteran, you have the right to request a reasonable accommodation if you are unable or limited in your ability to use or access nbcunicareers.com as a result of your disability. You can request reasonable accommodations by emailing AccessibilitySupport@nbcuni.com.Although you'll be hired as an NBCU employee, your employment and the responsibilities associated with this job likely will transition to Versant in the future. By joining at this pivotal time, you'll be a part of this exciting company as it takes shape.For LA County and City Residents Only:  NBCUniversal will consider for employment  qualified applicants with criminal histories, or arrest or conviction records, in a manner  consistent with relevant legal requirements, including the City of Los Angeles' Fair Chance Initiative For Hiring Ordinance, the Los Angeles County Fair Chance Ordinance for Employers, and the California Fair Chance Act, where applicable."
3467056,"Investigations Lead","https://jobs.smartrecruiters.com/NBCUniversal3/744000077298315-investigations-lead","universal","Englewood Cliffs","Yes",5,"Full time","2025-08-21T01:57:37.572032Z","The Investigations Lead will be a critical team member within the new Versant Cyber organization. This individual is responsible for collaborating with HR and Legal to oversee and execute complex investigations into cybersecurity incidents, insider threats, and violations of security policy across the organization involving employee misconduct, data loss, IP theft, and other internal threats. As part of the investigations and insider threat team, the successful candidate will role play a critical part in safeguarding the companys people, data, and infrastructure by uncovering and responding to malicious or negligent activities.Responsibilities:Key areas of focus for the Investigations Lead include investigations leadership, technical analysis and forensics, insider threat detection, and program governance.  The successful candidate will be responsible for the following activities:Coordinate investigative efforts across cybersecurity, physical security, HR, legal, and compliance teams.Serve as the primary escalation point for critical or high-risk investigative cases.Promote, foster, and advocate for an environment of collaboration, diversity, and inclusion. Conduct detailed forensic analysis of logs, endpoints, network activity, and digital evidence to uncover root causes and attribution.Deliver thorough investigative reports with clear findings, timelines, supporting evidence, and recommendations for remediation or disciplinary actions.Brief executive leadership on high-impact cases, investigation trends, and systemic vulnerabilities.Maintain awareness of emerging threats and apply investigative techniques accordingly.Work closely with the Security Operations Center (SOC) and threat intelligence teams to validate suspicious behavior and correlate indicators.Help establish and maintain investigative standards, workflows, and documentation practices.Ensure investigative activities comply with legal, regulatory, and ethical requirements related to privacy, labor law, and corporate governance.#LI-remoteBasic Requirements:5+ years working in Cyber Defense with experience in cybersecurity investigations, digital forensics, corporate security, detection engineering, or similar functions.Previous experience supporting or leading incident response or detection engineering functions.Proven ability to lead complex investigations from inception to closure with minimal oversight.Strong technical expertise in log analysis, endpoint forensics, SIEM/EDR platforms, and evidence preservation techniques.Deep understanding of insider threat indicators, data exfiltration patterns, and cybercrime tactics.Ability to manage sensitive cases with discretion and communicate clearly to both technical and non-technical stakeholders.Ability to be on call and provide support during nontraditional working hours.Bachelors Degree in an IT related field and/or equivalent work experience.Desired Characteristics:Previous experience working in multiple large complex environments and specifically within the Cyber Defense components of those organizations.Previous experience working in cyber defense and/or information security functions in the media and advanced technology industries.Previous experience working with network tools and technologies such as firewall (FW), proxies, IPS/IDS devices, full packet capture (FPC), and email platforms.Previous experience conducting static, dynamic, or reverse engineering malware analysis.Experience in applying security concepts to Cloud computing (AWS, Azure, GCP).Relevant certifications (GCIA, GCIH, GCFA, GNFA, etc.).Masters Degree in an IT related field.Additional Requirements:Fully Remote: This position has been designated as fully remote, meaning that the position is expected to contribute from a non-NBCUniversal worksite, most commonly an employees residence.This position is eligible for company sponsored benefits, including medical, dental and vision insurance, 401(k), paid leave, tuition reimbursement, and a variety of other discounts and perks. Learn more about the benefits offered by NBCUniversal by visiting the Benefits page of the Careers website. Salary range: $120,000 - $150,000 (bonus eligible)We are accepting applications for this position on an ongoing basis.As part of our selection process, external candidates may be required to attend an in-person interview with an NBCUniversal employee at one of our locations prior to a hiring decision. NBCUniversal's policy is to provide equal employment opportunities to all applicants and employees without regard to race, color, religion, creed, gender, gender identity or expression, age, national origin or ancestry, citizenship, disability, sexual orientation, marital status, pregnancy, veteran status, membership in the uniformed services, genetic information, or any other basis protected by applicable law.  If you are a qualified individual with a disability or a disabled veteran, you have the right to request a reasonable accommodation if you are unable or limited in your ability to use or access nbcunicareers.com as a result of your disability. You can request reasonable accommodations by emailing AccessibilitySupport@nbcuni.com.Although you'll be hired as an NBCU employee, your employment and the responsibilities associated with this job likely will transition to Versant in the future. By joining at this pivotal time, you'll be a part of this exciting company as it takes shape.For LA County and City Residents Only:  NBCUniversal will consider for employment  qualified applicants with criminal histories, or arrest or conviction records, in a manner  consistent with relevant legal requirements, including the City of Los Angeles' Fair Chance Initiative For Hiring Ordinance, the Los Angeles County Fair Chance Ordinance for Employers, and the California Fair Chance Act, where applicable."
3467054,"Senior Financial Analyst, International TVD","https://jobs.smartrecruiters.com/NBCUniversal3/744000077298835-senior-financial-analyst-international-tvd","universal","Universal City","No",2,"Full time","2025-08-21T01:57:37.572045Z","About Us: NBCUniversal Global TV Distribution is responsible for the licensing and distribution of NBCUniversal product to all forms of television and streaming platforms in the U.S., Canada and in over 200 territories internationally. NBCUniversals content portfolio includes a vast and diverse library of more than 6,500 feature films and 170,000 television episodes, including current and classic titles, non-scripted programming, kids, sports, news, long-form and short-form programming from Universal Pictures, Focus Features, Universal Television, UCP, Universal International Studios, Sky Studios, Universal Television Alternative Studio, NBC Late Night properties, DreamWorks Animation, Telemundo, Universal Pictures Content Group, as well as locally produced content from around the world, and more. Global TV Distribution is a division of Comcast NBCUniversal.Overview: The Senior Financial Analyst of Global TVD Finance is responsible for Financial Planning and Analysis of NBCUniversals Filmed Entertainment product distributed in the Linear Free and Basic, Premium Pay, Subscription-VOD markets and Ad based-VOD markets. The SFA will support the development and analysis of revenue budgets and forecasts. This position will report to the Finance Manager and will be responsible for working collaboratively with the Sales, Sales Strategy, Sales Administration, Controllership and Information Technology groups.ResponsibilitiesResponsible for preparing all aspects of financial planning (Annual Revenue Budget and Forecasts, Monthly Pacing) across multiple platforms and territoriesCreate and maintain deal analysis and financial models for international dealsAnalyze financial results against prior plan/forecasts, including identifying major financial drivers and providing variance analysisUnderstand licensing and distribution agreements, assessing financial impact of dealsParticipate in quarter close process, including tracking and review of revenue recognitionPerform ad-hoc financial analyses to support senior management decisions and initiativesThe responsibilities associated with this position are not limited to the above descriptions and may be modified at any time by the Department or NBCUniversalBasic Requirements: Bachelor's degree in Business Administration, Accounting or Finance2+ years of experience in performing quantitative analysis, forecasting, and/or financial modelingProficient in Microsoft Excel, including advanced formulas and pivot tablesDesired Characteristics: Solid analytical skills and attention to detail with ability to manipulate high volumes of dataCritical thinker who actively challenges assumptions and seeks to understand underlying business driversDemonstrates a strong sense of curiosity alongside excellent judgment and problem-solving skills to quickly resolve unique and challenging obstaclesExceptional organizational and time management skills with ability to multitask in a fast-paced environment and meet deadlinesTeam player with interpersonal ability to work with others and collaborate to achieve goalsPossesses high level of personal and professional integrityClear and concise verbal and written communication skillsEntertainment industry knowledge preferredAdditional Requirements:Hybrid: This position has been designated as hybrid, generally contributing from the office a minimum of three days per week.This position is eligible for company-sponsored benefits, including medical, dental, and vision insurance, 401(k), paid leave, tuition reimbursement, and a variety of other discounts and perks. Learn more about the benefits offered by NBCUniversal by visiting the Benefits page of the Careers website. As part of our selection process, external candidates may be required to attend an in-person interview with an NBCUniversal employee at one of our locations prior to a hiring decision. NBCUniversal's policy is to provide equal employment opportunities to all applicants and employees without regard to race, color, religion, creed, gender, gender identity or expression, age, national origin or ancestry, citizenship, disability, sexual orientation, marital status, pregnancy, veteran status, membership in the uniformed services, genetic information, or any other basis protected by applicable law.NBCUniversal will consider for employment qualified applicants with criminal histories, or arrest or conviction records, in a manner consistent with relevant legal requirements, including the City of Los Angeles' Fair Chance Initiative For Hiring Ordinance, the Los Angeles County Fair Chance Ordinance for Employers, and the California Fair Chance Act, where applicable.If you are a qualified individual with a disability or a disabled veteran and require support throughout the application and/or recruitment process as a result of your disability, you have the right to request a reasonable accommodation. You can submit your request to AccessibilitySupport@nbcuni.com."
