"ID","Title","Link","Company","Location","Remote","Experience","EmploymentType","DatePosted","RoleDescription"
3467078,"Account Executive, Telemundo Houston","https://jobs.smartrecruiters.com/NBCUniversal3/744000077233375-account-executive-telemundo-houston","universal","Houston","No",5,"Full time","2025-08-21T01:57:37.571729Z","This position will be responsible for growing revenue across NBCUniversal Local OTT and digital platforms, including NBC Spot On, Peacock, NBC / Telemundo Full Episode Player, and Linear TV including Telemundo. The AE will develop an understanding of our ad products, leverage tentpole events like the Olympics, Super Bowl, and World Cup, and have solid consultative selling skills to be able to best develop solutions to meet client needs. New business, revenue closure, account relationship building, customer satisfaction, and product implementation success are key responsibilities. This sales role is focused on delivering quarterly results and meeting individual budget requirements for linear and non-linear platforms, with a focus on Houston, TX and Louisiana.Job Duties / ResponsibilitiesDevelop both general and Hispanic market sales revenue from new advertisers as well as maximize revenue from an assigned list (active &amp; non-active accounts), while meeting target revenue goals defined by management for Houston and Louisiana.Own, manage, and develop agency &amp; advertiser relationships through day-to-day contact; being closely involved in the entire sales cycle, from conception and development of proposal to invoicing and post-analysis.Build and present consultative sales presentations, promoting NBCUs portfolio, combining industry knowledge and market trends, reflecting an understanding of clients business needs, and delivering solutions to them, while providing superior customer service.Work closely with Creative Solutions, Marketing, and Research to ensure consistent and strong execution of all solutions; work with digital teams to ensure client needs are met and ensure full and effective campaign delivery.Develop and maintain deep expertise of the NBCU portfolio including Telemundo and digital properties such as Peacock.Connect with key stakeholders within the linear and digital/programmatic buying ecosystems, to promote our product portfolio and secure sales.Use all available platforms, such as industry events, professional networks, and others to prospect new business opportunities regularly.Stay informed of industry changes and share market intelligence internally; maintain a working knowledge of research product updatesActively participate in team and station projects and special sales events.Accurately communicate quarterly revenue pacing reportsCommunicate quarterly client progress to the Local Sales ManagerAttend weekly sales meetings as directed by station management.Complete tasks such as posting, weekly forecasting, reporting, and tracking of new business prospects with the manager.Aggressively develop strong business relationships with all buyers, media planners, and brand managers in your assigned territory. Bachelors degree in a relevant field, or relevant work experience, with a minimum 5 years experience in advertising sales or media (linear and digital), either for a media company or with an agency.Knowledge of the linear and digital media market.Proficiency with Microsoft Office.Strong communication skills both verbal and written.Excellent driving record and active drivers licenseInterested candidates must submit a resume/CV through www.nbcunicareers.com to be considered.Must be able to work in Houston, TXMust have unrestricted work authorization to work in the United States.Desired CharacteristicsPrior experience selling advertising/sponsorships to ad agencies and client-direct.Proven track record of developing new business.Strong experience with Excel, PowerPoint, and Salesforce.comSelf-starter that can thrive in both a corporate and start-up environment.Excellent knowledge of industry trends, technologies, and pricing models.Excellent knowledge of ad campaign metrics and analysisStrong ability to collaborate with a team.Professional maturity, integrity, discipline, and a positive attitudeExceptional communication skillsExceptional presentation skills - creation and deliveryAbility to accurately identify and assess opportunities and apply resources and strategies appropriately.Ability to effectively manage the successful execution of a sales strategy.Excellent negotiation skills As part of our selection process, external candidates may be required to attend an in-person interview with an NBCUniversal employee at one of our locations prior to a hiring decision. NBCUniversal's policy is to provide equal employment opportunities to all applicants and employees without regard to race, color, religion, creed, gender, gender identity or expression, age, national origin or ancestry, citizenship, disability, sexual orientation, marital status, pregnancy, veteran status, membership in the uniformed services, genetic information, or any other basis protected by applicable law.If you are a qualified individual with a disability or a disabled veteran and require support throughout the application and/or recruitment process as a result of your disability, you have the right to request a reasonable accommodation. You can submit your request to AccessibilitySupport@nbcuni.com."
3467077,"Sr. Manager, Video Ops Syndication","https://jobs.smartrecruiters.com/NBCUniversal3/744000077256426-sr-manager-video-ops-syndication","universal","Stamford","Yes",7,"Full time","2025-08-21T01:57:37.571799Z","Our Media Group portfolio is a powerhouse collection of consumer-first brands, supported by media industry leaders, Comcast, NBCUniversal and Sky. When you join our team, youll work across our dynamic portfolio including Peacock, NOW, Fandango, SkyShowtime, Showmax, and TV Everywhere, powering streaming across more than 70 countries globally. And the evolution doesnt stop there. With unequalled scale, our teams make the most out of every opportunity to collaborate and learn from one another. Were always looking for ways to innovate faster, accelerate our growth and consistently offer the very best in consumer experience. But most of all, were backed by a culture of respect. We embrace authenticity and inspire people to thrive.The Sr. Manager, Video Operations Syndication is responsible for defining, implementing, and overseeing the DNOC strategy specific to International syndication partners. This leader ensures operational readiness through effective planning, tooling and engineering support, high-quality content monitoring, and securing and developing the operational staff needed to deliver best-in-class live, linear, and VOD services.Key Responsibilities:Strategy &amp; Planning:Develop and lead the staffing and tooling plan for each syndication partner, including securing necessary budgets and resources.Partner closely with DNOC leaders and team members to gain alignment and buy-in on partner roadmaps and strategic priorities.Own and manage the DNOC readiness tracker for each partner to ensure all operational requirements are fully met before launch.Establish and maintain clear communication of partner content changes (SLEs, Linear, VOD) to DNOC teams and key stakeholders.Foster regular collaboration and information sharing across DNOC Operations and Engineering teams to ensure seamless execution and alignment.Engage with partner leadership to gather strategic feedback, identify growth opportunities, and inform operational improvements.Proactively communicate risks, progress updates, and strategic roadmaps to senior internal stakeholders and executive leadership.Drive continuous improvement in operational processes, tooling, and monitoring to support efficiency, scale, and high partner satisfaction.7+ years of experience in operations, program management, or technical readinessideally within video streaming or live broadcast environments.Proven experience in video operations, content monitoring, or network operations leadership, ideally within streaming videoDemonstrated success developing and executing strategy, budgets, and staffing plans in a complex, multi-partner environment.Strong understanding of engineering for live events, content QC processes, and operational tooling best practices.Excellent cross-functional leadership skills, with the ability to communicate effectively with technical teams, stakeholders, and executive leadership.Highly organized, with strong problem-solving abilities and a track record of delivering results under tight timelines.Experience fostering a culture of operational excellence, continuous improvement, and collaboration across geographically distributed teams. This position is eligible for company sponsored benefits, including medical, dental, and vision insurance, 401(k), paid leave, tuition reimbursement, and a variety of other discounts and perks. Learn more about the benefits offered by NBCUniversal by visiting the Benefits page of the Careers website. Salary range: $140,000 - $155,000, Bonus &amp; LTI eligible.As part of our selection process, external candidates may be required to attend an in-person interview with an NBCUniversal employee at one of our locations prior to a hiring decision. NBCUniversal's policy is to provide equal employment opportunities to all applicants and employees without regard to race, color, religion, creed, gender, gender identity or expression, age, national origin or ancestry, citizenship, disability, sexual orientation, marital status, pregnancy, veteran status, membership in the uniformed services, genetic information, or any other basis protected by applicable law. If you are a qualified individual with a disability or a disabled veteran, you have the right to request a reasonable accommodation if you are unable or limited in your ability to use or access nbcunicareers.com as a result of your disability. You can request reasonable accommodations by emailing AccessibilitySupport@nbcuni.com.For LA County and City Residents Only:  NBCUniversal will consider for employment  qualified applicants with criminal histories, or arrest or conviction records, in a manner  consistent with relevant legal requirements, including the City of Los Angeles' Fair Chance Initiative For Hiring Ordinance, the Los Angeles County Fair Chance Ordinance for Employers, and the California Fair Chance Act, where applicable."
3467076,"Receptionist","https://jobs.smartrecruiters.com/NBCUniversal3/744000077265336-receptionist","universal","New York","No","Not specified","Full time","2025-08-21T01:57:37.571817Z","Responsibilities of the receptionist will be to handle all administrative duties for the program, including, but not limited to:Answer phones and take messages.Sort and deliver mail and packages.Greet guests and visitors. Escort/register as necessary.Restock office supplies.Maintain Staff Data and contacts.Works with the staff on additional project-based duties.Stay current on pop culture and entertainment news stories.Willing to float to alternative desks as needed.Complete expense reports in a timely manner.Basic Requirements:     Proficiency in MS Office and the internet.Bachelors degree required.Must be willing to work in New York, NY.Must be 21 years or older.Must be willing to work overtime, nights, and Saturdays of scheduled show weeks.Must have unrestricted work authorization to work in the United States.Interested candidates must submit a resume for this job online to be considered.Desired Characteristics:Prior media experience.Professional phone manner.Strong interpersonal skills.Detail oriented.Ability to multi-task and prioritize assignments under high pressure in a fast-paced environment.Ability to work within a team environment.Ambitious applicants seeking a career in television production.Additional Requirements:Required On-Site: This position is required to be performed full-time from an NBCUniversal-designated worksite.This position is eligible for company sponsored benefits, including medical, dental and vision insurance, 401(k), paid leave, tuition reimbursement, and a variety of other discounts and perks. Learn more about the benefits offered by NBCUniversal by visiting the Benefits page of the Careers website.Hourly salary range: $17.50 - $20.00The candidate who fills this position will be paid at least 60 hours per week regardless of whether they work less than 60 hours. Hours over 37.5 hrs/wk will be paid at the appropriate overtime rate.As part of our selection process, external candidates may be required to attend an in-person interview with an NBCUniversal employee at one of our locations prior to a hiring decision. NBCUniversal's policy is to provide equal employment opportunities to all applicants and employees without regard to race, color, religion, creed, gender, gender identity or expression, age, national origin or ancestry, citizenship, disability, sexual orientation, marital status, pregnancy, veteran status, membership in the uniformed services, genetic information, or any other basis protected by applicable law.If you are a qualified individual with a disability or a disabled veteran and require support throughout the application and/or recruitment process as a result of your disability, you have the right to request a reasonable accommodation. You can submit your request to AccessibilitySupport@nbcuni.com."
3467074,"Technical Product Manager","https://jobs.smartrecruiters.com/NBCUniversal3/744000077272162-technical-product-manager","universal","Stamford","No",5,"Full time","2025-08-21T01:57:37.571832Z","Role OverviewThe Technical Product Manager will lead the strategy, development, and optimization of internal tools used to manage live event operations across NBCUniversals streaming platforms. This includes metadata systems, live event management, and other proprietary solutions. The role will serve as a key liaison between operations, engineering, and governance teams to ensure tools are scalable, reliable, and aligned with business needs.Key ResponsibilitiesOwn the product lifecycle for metadata and live event management tools, including live event management and custom-built platforms.Collaborate with stakeholders across operations, engineering, and governance to define product requirements and prioritize enhancements.Drive roadmap planning, sprint execution, and release management for internal tooling.Ensure tools meet operational SLAs and support 24/7 live event workflows with minimal disruption.Conduct regular performance analysis and user feedback sessions to identify areas for improvement.Partner with engineering to implement automation and integrations that enhance operational efficiency.Maintain documentation, training materials, and support resources for tool users.Lead vendor and partner relationships related to tooling infrastructure and support.Monitor tool usage, adoption, and ROI to inform future investment and development decisions.Manage a team of product owners that are focused on improving live event operations.Use data and determine ROIs to improve operations and the value to the business.Basic Qualifications5+ years of experience in digital operations, product management, or technical program management.3+ years managing internal tools or platforms in a media or streaming environment.Strong understanding of metadata systems, Airtable, and workflow automation.Experience working with engineering teams in Agile environments.Familiarity with live event operations, video streaming infrastructure, and digital distribution workflows.Preferred QualificationsBA/BS in Computer Science, Engineering, or related field.Experience with Airtable scripting, APIs, and integrations.Strong analytical skills and experience with data-driven decision-making.Excellent communication and stakeholder management abilities.Passion for improving operational tools and employee This position is eligible for company sponsored benefits, including medical, dental, and vision insurance, 401(k), paid leave, tuition reimbursement, and a variety of other discounts and perks. Learn more about the benefits offered by NBCUniversal by visiting the Benefits page of the Careers website. Salary range: $95,000 - $120,000. Bonus &amp; LTI eligible.As part of our selection process, external candidates may be required to attend an in-person interview with an NBCUniversal employee at one of our locations prior to a hiring decision. NBCUniversal's policy is to provide equal employment opportunities to all applicants and employees without regard to race, color, religion, creed, gender, gender identity or expression, age, national origin or ancestry, citizenship, disability, sexual orientation, marital status, pregnancy, veteran status, membership in the uniformed services, genetic information, or any other basis protected by applicable law.If you are a qualified individual with a disability or a disabled veteran and require support throughout the application and/or recruitment process as a result of your disability, you have the right to request a reasonable accommodation. You can submit your request to AccessibilitySupport@nbcuni.com."
3467072,"Associate Technical Product Owner","https://jobs.smartrecruiters.com/NBCUniversal3/744000077272696-associate-technical-product-owner","universal","Stamford","No","Not specified","Full time","2025-08-21T01:57:37.571850Z","Role Summary and PurposeAs an Associate Technical Product Owner at NBCUniversal, you will support the development, maintenance, and optimization of live video management systems, encoding platforms, and metadata workflows. This entry-level role is ideal for someone passionate about digital media technology and eager to grow within a fast-paced, innovative environment. You will work closely with cross-functional teams to ensure seamless delivery of live content and accurate metadata across NBCUniversals streaming platforms.This is a foundational opportunity to gain hands-on experience in technical product ownership while contributing to the success of high-visibility live events and digital video operations.Key ResponsibilitiesAssist in managing the product lifecycle for live video and encoding platforms, including requirements gathering, testing, and documentation.Support the configuration and monitoring of live video workflows and metadata pipelines.Collaborate with engineering, operations, and content teams to ensure accurate and timely metadata delivery.Help track and prioritize feature requests, bug reports, and system enhancements.Participate in daily stand-ups, sprint planning, and retrospectives as part of an Agile development team.Maintain product documentation and user guides for internal stakeholders.Monitor system performance and escalate issues as needed to ensure uninterrupted live streaming experiences.Contribute to the development of product roadmaps and release plans under the guidance of the Technical Product Owner.Apply analytical thinking and problem-solving skills to troubleshoot issues and identify opportunities for workflow improvements.Bachelors degree in Media Technology, Computer Science, Information Systems, or a related field (or equivalent experience).Strong interest in digital video technologies, live streaming, and metadata systems.Basic understanding of video encoding, streaming protocols, and content management systems is a plus.Excellent organizational and communication skills.Ability to work collaboratively in a team environment and adapt to changing priorities.Familiarity with Agile methodologies and tools like Jira or Confluence is a plus.Preferred TraitsEagerness to learn and grow in a technical product management role.Detail-oriented with a proactive approach to problem-solving and continuous improvement.Comfortable working in a fast-paced, deadline-driven environment.Passion for media, entertainment, and emerging technologies.Passion for improving operational tools and employee This position is eligible for company sponsored benefits, including medical, dental, and vision insurance, 401(k), paid leave, tuition reimbursement, and a variety of other discounts and perks. Learn more about the benefits offered by NBCUniversal by visiting the Benefits page of the Careers website. Salary range: $65,000 - $75,000.As part of our selection process, external candidates may be required to attend an in-person interview with an NBCUniversal employee at one of our locations prior to a hiring decision. NBCUniversal's policy is to provide equal employment opportunities to all applicants and employees without regard to race, color, religion, creed, gender, gender identity or expression, age, national origin or ancestry, citizenship, disability, sexual orientation, marital status, pregnancy, veteran status, membership in the uniformed services, genetic information, or any other basis protected by applicable law.If you are a qualified individual with a disability or a disabled veteran and require support throughout the application and/or recruitment process as a result of your disability, you have the right to request a reasonable accommodation. You can submit your request to AccessibilitySupport@nbcuni.com."
3467071,"Sr. Software Engineer","https://jobs.smartrecruiters.com/NBCUniversal3/744000077275295-sr-software-engineer","universal","New York","No",4,"Full time","2025-08-21T01:57:37.571869Z","Our Media Group portfolio is a powerhouse collection of consumer-first brands, supported by media industry leaders, Comcast, NBCUniversal and Sky. When you join our team, youll work across our dynamic portfolio including Peacock, NOW, Fandango, SkyShowtime, Showmax, and TV Everywhere, powering streaming across more than 70 countries globally. And the evolution doesnt stop there. With unequalled scale, our teams make the most out of every opportunity to collaborate and learn from one another. Were always looking for ways to innovate faster, accelerate our growth and consistently offer the very best in consumer experience. But most of all, were backed by a culture of respect. We embrace authenticity and inspire people to thrive.Our streaming video SDK is at the forefront of technology, leveraging modern video codecs, adaptive bitrate streaming, low-latency streaming, and support for live streaming. We ensure seamless playback across various platforms, including web browsers, smart TVs, gaming consoles, and streaming media devices. This compatibility allows us to reach a wide audience and provide exceptional streaming experiences regardless of the device or operating system.Join us as a Roku Brightscript Software Engineer as we redefine the future of streaming video technology. We work on Roku devices and together we will shape our culture, solve technical problems, and create extraordinary streaming experiences that captivate audiences worldwide.Key ResponsibilitiesDevelop and design features that are of high quality and maintainable using good coding practices.Help management in providing reliable estimates for pieces of work and assist the team in achieving it while providing updates.Ensure and contribute to high performance of execution and provide a good user experience.Contribute to integrations against the Roku suite of devices.Help ensure we provide a good playback experience across the different devices we support and help improve performance.Mentor junior team members and provide constructive feedback such as in code reviews to maintain high code quality best practices.Contribute ideas on how to improve and maintain best practices, coding standards and documentation among the team.Stay up to date with the latest industry standards and emerging technologies and be able to provide solutions to improve our products.4+ years of experience developing products in Brightscript in either front-end and/or backend.Experienced working with Roku development tools and video playback components, such as roVideoPlayer or SceneGraph video nodes.High proficiency in Brightscript is recommended.Experience working on video playback technologies (such as HLS, DASH, and streaming video monitoring tools such as Conviva)Solid understanding of the underlying execution and be able to identify issues and improve overall performance and memory consumption.Good soft skills involving communication and ability to collaborate with multiple teams in a global setting.Excellent problem-solving skills, adaptability on changing requirements and a mindset for analyzing and troubleshooting problems. This position is eligible for company sponsored benefits, including medical, dental, and vision insurance, 401(k), paid leave, tuition reimbursement, and a variety of other discounts and perks. Learn more about the benefits offered by NBCUniversal by visiting the Benefits page of the Careers website. Salary range: $110,000 - $160,000. As part of our selection process, external candidates may be required to attend an in-person interview with an NBCUniversal employee at one of our locations prior to a hiring decision. NBCUniversal's policy is to provide equal employment opportunities to all applicants and employees without regard to race, color, religion, creed, gender, gender identity or expression, age, national origin or ancestry, citizenship, disability, sexual orientation, marital status, pregnancy, veteran status, membership in the uniformed services, genetic information, or any other basis protected by applicable law.If you are a qualified individual with a disability or a disabled veteran and require support throughout the application and/or recruitment process as a result of your disability, you have the right to request a reasonable accommodation. You can submit your request to AccessibilitySupport@nbcuni.com."
