"ID","Title","Link","Company","Location","Remote","Experience","EmploymentType","DatePosted","RoleDescription"
3460241,"Assistant Controller, Universal Pictures","https://jobs.smartrecruiters.com/NBCUniversal3/744000077024257-assistant-controller-universal-pictures","universal","Amsterdam","No","Not specified","Full time","2025-08-21T01:57:37.572226Z","The Assistant Controller is responsible for the completeness and accuracy of the general ledger, balance sheet, and corporate reporting for UPI Netherlands, including managing key financial cycles, ensuring compliance with accounting and NBCU policies, and local regulations.This role has a direct reporting line to the Finance Director of UPI in the Netherlands. This position will oversee and manage all finance tasks outsourced to Accenture, an external finance partner.The Assistant Controller will be the go to finance person for stakeholders of multiple disciplines (Auditors, internal and external, Treasury, Fin Ops, Tax, legal, payroll, marketing, sales team, etc.) for day-to-day issues and query resolution.   
 KEY RESPONSIBILITIESMonth-end / Quarter-end Financial reportingResponsible for overseeing the completeness and accuracy of the day-to-day operations for the general ledger, including sub-system reconciliations, intercompany, Accounts Receivable, Accounts payable, cashpool, and other various activitiesResponsible for all elements of the close process; sign off on key journal entries and all balance sheet reconciliationsResponsible for Cash forecastingReview monthly and quarterly balance sheets and P&amp;L to ensure compliance with Group policies and alignment with business understanding.Prepare &amp; review quarterly supplemental data request submissions and ensure all corporate reporting obligations are met.Provide ad-hoc reporting and analysis (including for non-finance departments).GovernanceSupport NBCUs FinOps end-to-end RTR, P2P, and OTC process improvement projects with operational input.Work closely with Fin Ops and Accenture Team lead to ensure all outsourced accounting activities are performed as agreed; support performance metrics on outsourced work, and identify areas for improvement or expansion of the scope of work. Partner Accounting and ReportingFacilitate reporting to distribution partners according to contractual requirements, with timely cash settlement of royalties, including any internal stakeholder management.Statutory and Tax reportingIdentify, document, and drive compliance with local Statutory requirements for NBCU. Assisting in the External and Internal audits and working with the statutory controller and outsourced finance partner to collect audit evidence and support for the Financial Statements and required disclosuresSupport to the NBCU Tax team to ensure compliance with local tax regulations and reporting requirements in the area of corporate income tax and VAT. Controllership and special projectsResponsible for maintaining a strong internal control environment, ensuring compliance with group policies and procedures, laws and regulations, and the integrity of financial and operational information, with the ability to identify and communicate risks, together with suggestions on how to mitigate the riskDeveloping and leveraging key relationships with Controllership Teams across UPI and NBCU, demonstrating a high level of cultural consciousness, collaboration, and flexibility, is a critical part of the roleSupport special finance initiatives as assigned, acting as a business partner and consultant when performing these duties. Projects relate to, but are not limited to, improving the monthly close process, IT enhancement projects, and operational systems used, implementation of new reporting tools, simplification and integration projects, etc.OtherSupport FD in areas where required, including budgeting, forecasting, and data analytics.Work closely with the Finance Analyst on day-to-day finance operations and various internal projectsBecome a super-user of SAP and Data Warehouse solutions, continuously work on system improvements, optimize automated reporting tools, and close procedures.Relevant degree or an accredited professional finance qualificationStrong financial reporting experience (SAP)Very Strong Microsoft office (Word/Excel/PowerPoint) skillsFluent in English and Dutch (verbal and written)ABOUT YOUAdvanced degree in finance or accounting (preferred ACA, ACCA, CIMA, US CPA, Dutch RA/RC)Experience in Audit and preferably in similar position in an international business environmentStrong Technical Accounting KnowledgeDeveloped analytical and problem-solving skillsExperience with working with outsourced finance partners or managing remote teams is a plusOrganised and thorough, with the ability to prioritise tasksDemonstrates ability to build relationships and engage and influence people to work effectively with internal and external stakeholdersKeen eye for emerging (AI) and tech trends to support the Finance DirectorAbility to cope in a fast, dynamic organisation and manage competing priorities and deadlinesWillingness to work flexible hours during closeAs part of our selection process, external candidates may be required to attend an in-person interview with an NBCUniversal employee at one of our locations prior to a hiring decision. NBCUniversal's policy is to provide equal employment opportunities to all applicants and employees without regard to race, color, religion, creed, gender, gender identity or expression, age, national origin or ancestry, citizenship, disability, sexual orientation, marital status, pregnancy, veteran status, membership in the uniformed services, genetic information, or any other basis protected by applicable law.If you are a qualified individual with a disability or a disabled veteran and require support throughout the application and/or recruitment process as a result of your disability, you have the right to request a reasonable accommodation. You can submit your request to AccessibilitySupport@nbcuni.com."
3460240,"Editorial Director, CNBC Select","https://jobs.smartrecruiters.com/NBCUniversal3/744000077031445-editorial-director-cnbc-select","universal","Englewood Cliffs","No",8,"Full time","2025-08-21T01:57:37.572247Z","CNBC's commerce team is looking to hire a strategic and experienced editorial director to further develop its financial coverage for a broad consumer audience under the CNBC Select brand. CNBC Select is a consumer-friendly vertical of CNBC devoted to providing rigorous reviews and advice on personal finance products so our readers can make informed decisions.The Editorial Director will be responsible for executing strategy and overseeing the day-to-day content production and optimization. This leader will guide the editorial team in creating clear, engaging, and impactful content while maintaining CNBC Selects voice, standards, and mission across all platforms.This role will manage the editorial calendar and a growing team of personal finance journalists, and collaborate cross-functionally with compliance, partnerships analytics, product and CNBC editorial teams to drive audience growth and revenue. The ideal candidate is a strong leader and journalist with deep experience in personal finance, commerce content, and service journalism.Key ResponsibilitiesDevelop and implement a content strategy aligned with broader organizational goals.Oversee the editorial calendar, daily operations, publishing goals, and evergreen content updates.Approve all site content and ensure it meets CNBC Selects editorial standards.Guide editors and reporters in translating data, research, and expert insights into clear, engaging, and actionable content.Work with SEO, social and analytics teams to build and execute strategies that improve site metrics and revenue.Work with the partnerships team to ideate and execute new revenue opportunities, including branded content and affiliate commerce.Manage editorial elements of new insertion orders and paid content opportunities.Partner with Product to optimize the content experience across platforms.Lead editorial meetings and contribute to analytics and strategy discussions.Oversee newsletters, social media, broadcast placements, and other off-site platforms.Ensure compliance with legal and standards teams as needed.What well offer:Sweat it out -- Free onsite fitness center with state-of-the-art equipment  and group classesEat up -- Gourmet cafeteria with daily specials, plus soup and salad barsExtras -- Dry cleaningDont have a car? No problem! We offer free shuttle transportation to and from multiple locations in Manhattan, Brooklyn, Hoboken and Jersey City. Were a global company that values our employees individual experiences and wellbeing.We know that were smarter, more dynamic and better together. Thats why we offer benefits and perks to meet your unique needs. Read more about them on our careers site here. We invite you to seek the excitement, challenges and opportunities that make working at CNBC so rewarding.This position is eligible for company sponsored benefits, including medical, dental, and vision insurance, 401(k), paid leave, tuition reimbursement, and a variety of other discounts and perks. Learn more about the benefits offered by NBCUniversal by visiting the Benefits page of the Careers website. Salary range:  $135,000-$180,000Minimum 8 years of editorial experience, including 5+ years in personal finance or commerce content.At least 3 years managing an editorial team.Proven journalism skills and editorial judgment.Strong understanding of SEO, analytics, and affiliate marketing platforms (e.g., Skimlinks, Amazon, Rakuten).Experience with data-driven content strategy and optimization.Familiarity with tools like Parse.ly, Google Analytics, Google Trends, and Domo.Excellent communication, organizational, and leadership skills.Experience working with a growing brand and/or major news organization is a plus.Media training and experience as an expert on live television is a plus.Firm grasp of AP Style guidelines and editorial best practices.Desired CharacteristicsStrategic thinker with a passion for service journalism.Ability to make quick decisions and manage multiple tasks simultaneously.Detail-oriented and proactive.Strong collaborator across editorial, product, and business teams.Deep knowledge of personal finance products and consumer needs.Creative and entrepreneurial within an established media company.Additional Requirements:Interested candidates must submit a resume/CV through nbcunicareers.com to be considered Must have unrestricted work authorization to work in the United States Hybrid: This position has been designated as hybrid, generally contributing from the Englewood Cliffs  office a minimum of three days per week.As part of our selection process, external candidates may be required to attend an in-person interview with an NBCUniversal employee at one of our locations prior to a hiring decision. NBCUniversal's policy is to provide equal employment opportunities to all applicants and employees without regard to race, color, religion, creed, gender, gender identity or expression, age, national origin or ancestry, citizenship, disability, sexual orientation, marital status, pregnancy, veteran status, membership in the uniformed services, genetic information, or any other basis protected by applicable law.If you are a qualified individual with a disability or a disabled veteran and require support throughout the application and/or recruitment process as a result of your disability, you have the right to request a reasonable accommodation. You can submit your request to AccessibilitySupport@nbcuni.com.Although you'll be hired as an NBCU employee, your employment and the responsibilities associated with this job likely will transition to Versant in the future. By joining at this pivotal time, you'll be a part of this exciting company as it takes shape."
3460239,"Transcriber","https://jobs.smartrecruiters.com/NBCUniversal3/744000077038785-transcriber","universal","Miami","No",2,"Full time","2025-08-21T01:57:37.572262Z","The Transcriber is responsible for transcribing and captioning news, specials, scripted programs, sports, and a variety of other shows for Telemundo and the NBC organization using all types of text-to-speech programs and AI platforms.Job Duties:Responsible for writing, timestamping, and performing quality control on all of Telemundos closed captioning and subtitle files for broadcast, Peacock, and Netflix among othersResponsible for transcribing shows, promos, movies, and short videos in Spanish with 100% accuracy (proper punctuation, accentuation, tenses and free of misspellings errors)Translates television programs, promotional material, films, and short videos without being literal and finding the most native interpretation in the language being translated intoManages multiple concurrent projects with varying deadlines and priority levelsEscalates potential delays or technical issues that could impact delivery timelinesPerforms quality control on text-only and text files with video, both in English and Spanish, whether they are transcriptions or translations, to deliver a final text 100% free of grammatical or contextual errors such as wrong tenses, missing punctuation, improper spelling, or wrong pronounsMaintains detailed logs of project progress and completion statusViews videos on the platforms to perform quality control of the final productPrepares quality reports on both external providers and internal productUtilizes software like Dragon Naturally Speaking, Stanza, or any other AI text generators to transcribe or translate audio with the goal of accelerating processesDelivers the final product using the established workflowsUtilizes subtitles created by internal or external transcribers or translatorsConducts proactive research on any unknown terms for both transcription and translation when delivering a final productWorks under the direct supervision of Sr Manager, Edit &amp; Language Operations and is responsible for completing any other tasks as assigned by Manager or Supervisor as neededBasic Requirements:Minimum 2 years of prior/relevant experience in transcribing and/or captioningNative or near-native English proficiency (written and verbal) is required, with working knowledge of Spanish sufficient for translation support.Exhibits strong command of English standards following The Chicago Manual of Style.Exhibits knowledge of subtitle standards and closed captioning regulations by the FCC.Prior experience using technology, such as speech-to-text converters, to speed up translations and transcriptionsPrior experience using AI programs such as AWS to accelerate translation and transcription processesPrior experience with cloud-based collaboration platforms (Google Workspace, Microsoft 365)Proven ability to work with multiple monitors and multitask between translation and transcription toolsDesired Characteristics:Previous experience in dubbing, voice-over, or audio post-production is a plusPrior experience with software like Stanza or others to add timestamps preferredExceptional communication, time management, analytical and organizational skillsSelf-starter who exhibits ownership on assigned tasks and who will push for solutions that solve immediate problems while building towards long-term goalsAbility to multitask and work in a fast paced, dead-line driven environmentAccustomed to working in a team and collaborating with all levels within the organizationAbility to build rapport with clients and manage expectationsAbility to effectively be flexible in approach, and respond well to pressureAbility to lead and direct others, promote a positive work environment and problem solvesProcess oriented, good at identifying and implementing best practicesChange agent and continuous learner; creative and adaptable when facing challengesDemonstration of best-in-class customer service skills and strategic thinking Additional Requirements:Interested candidate must submit a resume/CV through www.nbcunicareers.com to be considered (note job #:      )Must be willing to work in Miami, FloridaWillingness to travel and work overtime, and on weekends with short noticeMust have a valid drivers licenseMust be on call 24 hours a day / 7 days a weekThis position is required to be performed on a hybrid basis from an NBCUniversal-designated worksite.As part of our selection process, external candidates may be required to attend an in-person interview with an NBCUniversal employee at one of our locations prior to a hiring decision. NBCUniversal's policy is to provide equal employment opportunities to all applicants and employees without regard to race, color, religion, creed, gender, gender identity or expression, age, national origin or ancestry, citizenship, disability, sexual orientation, marital status, pregnancy, veteran status, membership in the uniformed services, genetic information, or any other basis protected by applicable law.If you are a qualified individual with a disability or a disabled veteran and require support throughout the application and/or recruitment process as a result of your disability, you have the right to request a reasonable accommodation. You can submit your request to AccessibilitySupport@nbcuni.com."
3460238,"Stage - Assistant Programmation - Octobre 2025","https://jobs.smartrecruiters.com/NBCUniversal3/744000077044185-stage-assistant-programmation-octobre-2025","universal","Paris","No","Not specified","Internship","2025-08-21T01:57:37.572282Z","START DATE: October / November 2025 for a 6-month internship onlyWithin the Programming Department of the Paris office, your role will be to assist the team in charge of the 13me RUE and SYFY channels, by participating in the following missions:Editorial research, Catalog expertise, drafting of viewing notes, and purchase recommendations.National and international competitive analysisSupport in the administrative follow-up of acquisitionsOccasional support in the 13me RUE French original series production process (reading sheets, etc)Assistance in the linear and non-linear programming of the channels (stocks, programming schedules, etc)Liaison with the marketing department for promotional assetsPlease include a detailed cover letter outlining why you would like to work for NBCUniversal and what you feel you would bring to this role. Without a cover letter, your application will not be considered.An internship agreement provided by your school is mandatory. Basic Requirements: Fluent in French and EnglishMaster degree student currently enrolled in Business School, IEP, Marketing or Media Management trackKnowledge of audiovisual programs (series) and affinity with film newsMicrosoft Office savy ( Word, Powerpoint and Excel)As part of our selection process, external candidates may be required to attend an in-person interview with an NBCUniversal employee at one of our locations prior to a hiring decision. NBCUniversal's policy is to provide equal employment opportunities to all applicants and employees without regard to race, color, religion, creed, gender, gender identity or expression, age, national origin or ancestry, citizenship, disability, sexual orientation, marital status, pregnancy, veteran status, membership in the uniformed services, genetic information, or any other basis protected by applicable law.If you are a qualified individual with a disability or a disabled veteran and require support throughout the application and/or recruitment process as a result of your disability, you have the right to request a reasonable accommodation. You can submit your request to AccessibilitySupport@nbcuni.com."
3460237,"Data Engineer II","https://jobs.smartrecruiters.com/NBCUniversal3/744000077052395-data-engineer-ii","universal","Orlando","Yes",5,"Full time","2025-08-21T01:57:37.572303Z","As a Data Engineer II, you will be working on our data systems and services with other data engineers to deliver projects and systems critical to Fandango's business. We expect our data engineers to be versatile, display leadership qualities and be enthusiastic about taking on new problems across our businesses as we continue to build great things for fellow movie fans.

Responsibilities:Contribute to and help team in design, build, testing, scaling, and maintaining data pipelines from a variety of source systems and streams (Internal, third party, cloud based, etc.), according to business and technical requirements.Continually work on improving the codebase and have active participation and oversight in all aspects of the team, including agile ceremonies.Collaborate with engineers and product managers to understand data needs.Participate in Agile ceremonies (standups, retros, sprint planning, etc.)Troubleshoot and fix production issues as they occur.Bachelor's degree in Computer Science, Computer Engineering, or related technical field, or equivalent practical experience.5+ years of applied experience in Data Engineering, including but not limited to: building Data Pipelines, Orchestration, Data Modeling &amp; Data Lake.Programming skills in one or more of the following: Python, Java, Scala, plus SQL and experience in writing reusable/efficient code to automate analysis and data processes.Experience in Data Warehousing (Relational and dimensional data modeling).Strong working experience with a variety of data sources such as APIs, real-time feeds, structured and semi-structured file formats.Experience with processing large datasets and building code using Glue, Apache Airflow / Amazon MWAA, SQL, Python, and pySpark.Experience of near Real Time &amp; Batch Data Pipeline development.Experience with AWS data management (S3, Redshift, DynamoDB) and related tools (Athena, EMR, Glue, Lambda).Experience working in an agile/scrum environment.Desired Characteristics:Familiar with software build, release, deployment and monitoring tools and practices.Experience with Talend, Informatica, or other off-the-shelf ETL tools.Experience working with Terraform.Strong Test-Driven Development background, with understanding of levels of testing required to continuously deliver value to production.Team-oriented and collaborative approach with a demonstrated aptitude, enthusiasm, and willingness to learn new methods, tools, practices, and skills.Ability to work effectively across functions, disciplines, and levelsFully Remote: This position has been designated as fully remote, meaning that the position is expected to contribute from a non-NBCUniversal worksite, most commonly an employees residence.#LI-remoteAs part of our selection process, external candidates may be required to attend an in-person interview with an NBCUniversal employee at one of our locations prior to a hiring decision. NBCUniversal's policy is to provide equal employment opportunities to all applicants and employees without regard to race, color, religion, creed, gender, gender identity or expression, age, national origin or ancestry, citizenship, disability, sexual orientation, marital status, pregnancy, veteran status, membership in the uniformed services, genetic information, or any other basis protected by applicable law.If you are a qualified individual with a disability or a disabled veteran and require support throughout the application and/or recruitment process as a result of your disability, you have the right to request a reasonable accommodation. You can submit your request to AccessibilitySupport@nbcuni.com.Although you'll be hired as an NBCU employee, your employment and the responsibilities associated with this job likely will transition to Versant in the future. By joining at this pivotal time, you'll be a part of this exciting company as it takes shape."
