"ID","Title","Link","Company","Location","Remote","Experience","EmploymentType","DatePosted","RoleDescription"
3376578,"Volume Recruiter, Contract","https://www.wayfair.com/careers/jobs/8105692002?gh_jid=8105692002","Wayfair","McDonough, GA","No",1,"Contract","2025-08-31T02:00:52.937723Z","The base pay for this position is $29 - $33 per hour. The base pay offered may vary depending on location, job-related knowledge, skills, and experience.
This position is a hybrid in-office role that works out of our McDonough, GA, fulfillment center. This position is required to be in office a minimum of 2 days a week with flexibility to attend community events on top of 2 days in office.
This contract role is based on an entry level recruiter and is for 4-6m.
Who We Are
Wayfair Recruiters are true business partners who are charged with finding, attracting, and hiring top talent into all parts of the company against a high bar for performance, potential, and culture. As a high volume recruiter, you are responsible for full lifecycle recruiting to support our NA Supply Chain around the country. This opportunity is based out of our McDonough, GA, fulfillment center and will primarily support hiring for this site but will flex into other locations virtually as needed. If you're interested in learning more about us and want to gain insight into our dynamic, team oriented environment that encourages learning and growth, apply today! 
What You'll Do

Full life cycle, high volume recruitment for Wayfairs NA Supply Chain. 
Act as partner, consultant, and adviser to stakeholders and cross functional partners by developing and executing strategies to recruit top talent in a highly competitive market.
Source candidates from online sources, social networking, employee referrals, and networking events.
Guide candidates and hiring managers through the recruiting process, including pre-qualifying &amp; interviewing candidates and driving the offer.
Ensure an impressive candidate experience through thorough communication and timely feedback, as well as interviewer preparedness and effective interview format
Operate cross functionally and collaboratively in a culture of continuous improvement   

What You'll Need

1+ years of full cycle recruitment experience with high volume recruitment experience preferred.
Experience in high volume recruiting for frontline employees is a plus (General Warehouse Associates and Warehouse associates with experience/skillset to operate PIV equipment, specifically cherry picker/order pickers).
A sense of urgency to drive recruiting results and deliver for the business, while also effectively working together as part of a team
Strong relationship management skills with an ability to build trust and credibility with candidates, hiring managers and cross functional partners.
Proven organizational skills with attention to detail and the ability to prioritize and work well in an environment with competing demands.
Familiarity and comfort with a data driven environment. Ability to use metrics to guide decision-making.
About Wayfair Inc.
Wayfair is one of the worlds largest online destinations for the home. Whether you work in our global headquarters in Boston, or in our warehouses or offices throughout the world, were reinventing the way people shop for their homes. Through our commitment to industry-leading technology and creative problem-solving, we are confident that Wayfair will be home to the most rewarding work of your career. If youre looking for rapid growth, constant learning, and dynamic challenges, then youll find that amazing career opportunities are knocking.
No matter who you are, Wayfair is a place you can call home. Were a community of innovators, risk-takers, and trailblazers who celebrate our differences, and know that our unique perspectives make us stronger, smarter, and well-positioned for success. We value and rely on the collective voices of our employees, customers, community, and suppliers to help guide us as we build a better Wayfair  and world  for all. Every voice, every perspective matters. Thats why were proud to be an equal opportunity employer. We do not discriminate on the basis of race, color, ethnicity, ancestry, religion, sex, national origin, sexual orientation, age, citizenship status, marital status, disability, gender identity, gender expression, veteran status, genetic information, or any other legally protected characteristic.
Your personal data is processed in accordance with our Candidate Privacy Notice (https://www.wayfair.com/careers/privacy). If you have any questions or wish to exercise your rights under applicable privacy and data protection laws, please contact us at dataprotectionofficer@wayfair.com."
1600436,"Operations Business Associate - Early Careers (Summer 2025 Start)","https://www.wayfair.com/careers/jobs/7629286002?gh_jid=7629286002","Wayfair","Boston","No",1,"Internship","2025-08-31T02:00:52.937855Z","Summer 2025 Start
Location: Boston, MA
Additional Details:

This is a Boston based opportunity with a 4 day in office expectation (Monday - Thursday) with 1 day remote (Friday).
At this time, Wayfair will not sponsor applicants for employment authorization for this position for the following work visas: STEM OPT EAD, H-1B, H-1B1, E-3, O-1, J-1, or TN
The salary range for this position is $64,000 - $68,000 per year. The base salary offered may vary depending on location, job-related knowledge, skills, and experience.

Wayfair is continuing to expand our commitment to hiring and supporting talent early in their careers, focusing on filling opportunities with experienced graduates who have 1-3 years of experience.
Service Enablement Associate

As a Service Enablement Associate, you'll be at the heart of our Global Services team, turning raw data into clear, actionable insights that directly influence how we operate and grow. This is a hands-on role perfect for a data-driven problem-solver who wants to make a measurable impact.
What You'll Do


Drive Strategic Decisions: Build and maintain key performance dashboards that provide a clear picture of our operational health to leaders across the company.


Support New Initiatives: Define the metrics and build the reporting needed to measure the success of new projects, ensuring they are on track to meet their goals.


Own Our Data: Act as the central point for collecting and consolidating data from various teams, becoming the go-to expert for ensuring data integrity and accuracy.


Streamline Workflows: Analyze our operational processes to identify opportunities for improvement and help us work more efficiently.


What You'll Need 

Team-first attitude with enthusiasm for cross-functional collaboration
High attention to detail and proven ability to manage multiple, competing priorities simultaneously
Ability to drive results in the details while simultaneously considering the big picture. 
An entrepreneurial spirit and mindset; you must be adaptable and comfortable with change

 

Bachelors degree in a business, supply chain, quantitative or science discipline (engineering preferred)
1-3 years of transferable experience in a corporate environment, including internship and co-op experience preferably in the supply chain, product management, or automation/robotics field
You must be authorized to work in the United States without visa sponsorship by Wayfair now or in the future

 
Preferred Qualifications:

Experience in product management, operations management, logistics, supply chain, or B2B customer service.
Excellent written and verbal communication skills, along with the ability to influence others.
Analytical mindset able to process large volumes of data using a variety of reporting tools (Excel, Google Sheets, SQL, Jira, etc.).
Ability to distill complex information in a simplistic way via emails, charts, graphs, and other forms of presentations.
Passionate about execution with strong interest to drive customer engagement.
Desire to own projects from beginning to end, and  thrive as part of a team as well as individually.
Comfortability navigating a fast-paced, dynamic environment with little structure.
Experience working with, analyzing, synthesizing, and presenting data with clarity and recommended actions.
Strong project management and prioritization skills.

 
Why Youll Love Wayfair:

Time Off:

Paid Holidays
Paid Time Off (PTO)

Health &amp; Wellness:

Full Health Benefits (Medical, Dental, Vision, HSA/FSA)
Life Insurance
Disability Protection (Short Term &amp; Long Term Disability) 
Global Wellbeing: Gym/Fitness discounts (including US Peloton, Global ClassPass, and various regional gym memberships)
Mental Health Support (Global Mental Health, Global Wayhealthy Recordings)
Caregiver Services

Financial Growth &amp; Security:

401K Matching (Employee Matching Program)
Tuition Reimbursement 
Financial Health Education (Knowledge of Financial Education - KOFE)
Tax Advantaged Accounts

Family Support:

Family Planning Support
Parental Leave
Global Surrogacy &amp; Adoption Policy

Professional Development &amp; Recognition:

Rewards &amp; Recognition 
Global Employee Anniversary Awards 
Paid Volunteer Work 

Unique Perks:

Employee Discount 
U.S. Bluebikes Membership
Global Pod Outings

Work/Life Balance:

Emphasizing a supportive &amp; flexible work environment that encourages a balance between personal and professional commitments 


 
Purpose &amp; Inclusion at Wayfair:At Wayfair, we pride ourselves on fostering an environment where every individual experiences a fair and equitable employee journey. We are committed to developing targeted resources that raise awareness around inclusion and eliminate barriers, ensuring Wayfair provides a fair and inclusive workplace experience for everyone.
Social Impact &amp; Responsibility:At Wayfair, we focus on helping people on their journey to home - specifically those who have lost their way from home. We do this by leveraging our best assets, such as collaborating with leading nonprofit organizations, coordinating in-kind product donations, empowering our employees to get involved through paid volunteer time off programs, and encouraging our customers to donate. This multi-faceted approach allows us to support communities in need in authentic ways that align with Wayfair's broader mission of helping everyone, anywhere create their sense of home.
Wayfair's In-Office Policy:
All Boston-based corporate employees will be in office in a hybrid capacity. Employees will work in the office on designated days, Monday, Tuesday, Wednesday, and Thursday, and work remotely the other 1 day of the week.
Massachusetts Applicants: I understand that it is unlawful in Massachusetts to require or administer a lie detector test as a condition of employment or continued employment. An employer who violates this law shall be subject to criminal penalties and civil liability.
Assistance for Individuals with Disabilities
Wayfair is fully committed to providing equal opportunities for all individuals, including individuals with disabilities. As part of this commitment, Wayfair will make reasonable accommodations to the known physical or mental limitations of qualified individuals with disabilities, unless doing so would impose an undue hardship on business operations. If you require a reasonable accommodation to participate in the job application or interview process, please let us know by completing our Accommodations for Applicants form.
Need Assistance?
For more information about applying for a career at Wayfair, visit our FAQ page here.
At this time, Wayfair does not provide sponsorship for employment authorization for this position.About Wayfair Inc.
Wayfair is one of the worlds largest online destinations for the home. Whether you work in our global headquarters in Boston, or in our warehouses or offices throughout the world, were reinventing the way people shop for their homes. Through our commitment to industry-leading technology and creative problem-solving, we are confident that Wayfair will be home to the most rewarding work of your career. If youre looking for rapid growth, constant learning, and dynamic challenges, then youll find that amazing career opportunities are knocking.
No matter who you are, Wayfair is a place you can call home. Were a community of innovators, risk-takers, and trailblazers who celebrate our differences, and know that our unique perspectives make us stronger, smarter, and well-positioned for success. We value and rely on the collective voices of our employees, customers, community, and suppliers to help guide us as we build a better Wayfair  and world  for all. Every voice, every perspective matters. Thats why were proud to be an equal opportunity employer. We do not discriminate on the basis of race, color, ethnicity, ancestry, religion, sex, national origin, sexual orientation, age, citizenship status, marital status, disability, gender identity, gender expression, veteran status, genetic information, or any other legally protected characteristic.
Your personal data is processed in accordance with our Candidate Privacy Notice (https://www.wayfair.com/careers/privacy). If you have any questions or wish to exercise your rights under applicable privacy and data protection laws, please contact us at dataprotectionofficer@wayfair.com."
3516939,"Volume Recruiter, Contract","https://www.wayfair.com/careers/jobs/8145693002?gh_jid=8145693002","Wayfair","Lancaster, TX","No",1,"Contract","2025-08-31T02:00:52.937899Z","The base pay for this position is $29 - $33 per hour. The base pay offered may vary depending on location, job-related knowledge, skills, and experience.
This position is a hybrid in-office role that works out of our Lancaster, TX, fulfillment center. This position is required to be in office a minimum of 2 days a week with flexibility to attend community events on top of 2 days in office
This contract role is based on an entry level recruiter and is for a 6 month contract position with potential to convert to a permanent position based on business needs..
Who We Are
Wayfair Recruiters are true business partners who are charged with finding, attracting, and hiring top talent into all parts of the company against a high bar for performance, potential, and culture. As a high volume recruiter, you are responsible for full lifecycle recruiting to support our NA Supply Chain around the country. This opportunity is based out of our Lancaster, TX, fulfillment center and will primarily support hiring for this site but will flex into other locations virtually as needed. If you're interested in learning more about us and want to gain insight into our dynamic, team oriented environment that encourages learning and growth, apply today! 
What You'll Do

Full life cycle, high volume recruitment for Wayfairs NA Supply Chain. 
Act as partner, consultant, and adviser to stakeholders and cross functional partners by developing and executing strategies to recruit top talent in a highly competitive market.
Source candidates from online sources, social networking, employee referrals, and networking events.
Guide candidates and hiring managers through the recruiting process, including pre-qualifying &amp; interviewing candidates and driving the offer.
Ensure an impressive candidate experience through thorough communication and timely feedback, as well as interviewer preparedness and effective interview format
Operate cross functionally and collaboratively in a culture of continuous improvement   

What You'll Need

1+ years of full cycle recruitment experience with high volume recruitment experience preferred.
Experience in high volume recruiting for frontline employees is a plus (General Warehouse Associates and Warehouse associates with experience/skillset to operate PIV equipment, specifically cherry picker/order pickers).
A sense of urgency to drive recruiting results and deliver for the business, while also effectively working together as part of a team
Strong relationship management skills with an ability to build trust and credibility with candidates, hiring managers and cross functional partners.
Proven organizational skills with attention to detail and the ability to prioritize and work well in an environment with competing demands.
Familiarity and comfort with a data driven environment. Ability to use metrics to guide decision-making.
About Wayfair Inc.
Wayfair is one of the worlds largest online destinations for the home. Whether you work in our global headquarters in Boston, or in our warehouses or offices throughout the world, were reinventing the way people shop for their homes. Through our commitment to industry-leading technology and creative problem-solving, we are confident that Wayfair will be home to the most rewarding work of your career. If youre looking for rapid growth, constant learning, and dynamic challenges, then youll find that amazing career opportunities are knocking.
No matter who you are, Wayfair is a place you can call home. Were a community of innovators, risk-takers, and trailblazers who celebrate our differences, and know that our unique perspectives make us stronger, smarter, and well-positioned for success. We value and rely on the collective voices of our employees, customers, community, and suppliers to help guide us as we build a better Wayfair  and world  for all. Every voice, every perspective matters. Thats why were proud to be an equal opportunity employer. We do not discriminate on the basis of race, color, ethnicity, ancestry, religion, sex, national origin, sexual orientation, age, citizenship status, marital status, disability, gender identity, gender expression, veteran status, genetic information, or any other legally protected characteristic.
Your personal data is processed in accordance with our Candidate Privacy Notice (https://www.wayfair.com/careers/privacy). If you have any questions or wish to exercise your rights under applicable privacy and data protection laws, please contact us at dataprotectionofficer@wayfair.com."
3516938,"Full Time Associate, Retail Sales","https://www.wayfair.com/careers/jobs/8145860002?gh_jid=8145860002","Wayfair","Wilmette, IL","No",1,"Full time","2025-08-31T02:00:52.937930Z","Full Time Associate, SalesLocation: 3232 Lake Ave Suite 1, Wilmette, IL 60091The entry pay rate for this role is $18/hr.
Overview:
As a Retail Sales Associate, you'll play a vital role in creating an inviting and inspiring experience for every Wayfair customer. Youll actively support customers throughout their shopping journey, from answering questions and placing orders to handling returns and solving issues with empathy and precision. Youll thrive in a proactive sales environment, building personalized connections, boosting store performance, and turning first-time shoppers into loyal customers. If you're passionate about delivering top-tier service and love fast-paced, collaborative work, this role offers a great opportunity to grow with a brand redefining the future of home retail.
 
What Does a Retail Sales Associate Do?

 Engage and Connect with Customers: Build meaningful relationships by asking thoughtful questions to understand each customer's needs and style preferences.
 Demonstrate Reliability: Show up ready to work, on time, every shift. Communicate proactively about any unexpected absences or challenges.
 Always Be Selling (ABS): Approach every customer as a new sales opportunity. Educate them on purchase options through POS systems, the Wayfair app, quotes, or online tools.
 Provide Product Expertise: Share tailored recommendations using your knowledge of Wayfairs in-store and endless aisle offerings.
 Support Operational Excellence: Help with carry-outs, curbside pickups, cancellations, cart retrieval, and product returns while keeping the store clean and organized.
 Adapt to a Fast-Paced Environment: Stay agile and energized amid frequent product, promotion, and operational changes.
 Collaborate Effectively: Contribute to store success through replenishment, backfills, floor sets, and sharing fresh ideas.
 Deliver Exceptional Service: Provide personalized support and proactive solutions that make Wayfair a go-to shopping destination.

 
Youll Thrive in This Role if You Have:

 Selling &amp; Service Experience: 1+ year of experience in retail sales or customer-facing roles. Experience in interior design or specialty sales is a plus.
 Open Availability: Willingness to work nights, weekends, and holidays based on business needs.
 Technical Proficiency: Comfortable using mobile devices, store apps, inventory tools, and POS systems.
 Core Competencies: Strong sales instincts combined with great communication, organization, and relationship-building skills.
 Time Management &amp; Multitasking: Ability to juggle multiple customers or tasks at once while staying focused and accurate.

 
Additional Physical and Environmental Requirements:

 Physical Activity:Frequent standing, walking, and reaching with hands and arms; occasional sitting, climbing, balancing, and crawling.
 Mobility &amp; Movement: Frequent stooping, kneeling, and crouching throughout the day.
 Lifting Ability: Must be able to lift and/or move up to 50 lbs regularly.
 Vision Requirements: Includes close, distance, color, and peripheral vision; depth perception and the ability to adjust focus.
 Temperature Flexibility: Comfortable in environments with varying temperature conditions.
 Noise Tolerance: Occasional exposure to moderate noise levels and physical activity.
 Safety Awareness: Minimal exposure to workplace or environmental hazardsmust adhere to all safety protocols.

What are the Benefits*?

 Competitive Pay: Earn competitive compensation with regular opportunities for performance-based increases.
 Career Growth: Access professional development and advancement opportunities to help you grow with us.
 Health Benefits from Day One: Medical, dental, and vision insurance coverage starts on your first day.
 Time to Recharge: Start accruing paid time off immediatelybecause work-life balance matters.
 401(k) with Company Match: Well match up to 4% to help you plan for your future.
 Tuition Reimbursement: Eligible after 6 months of employmentlearn, grow, and get support along the way.
 Wayfair Employee Discount: Save big on the pieces you loveplus get 10% off at our in-store restaurant .
 Parental Leave Options: Choose from paid and unpaid leave plans to support your growing family.

 And So Much More: Weve got more good stuff where that came from! NOTE: our full-time roles receive the full benefits package above, while part-time or seasonal team members may have modified offerings. Your recruiter or in-store team can help with any questions!About Wayfair Inc.
Wayfair is one of the worlds largest online destinations for the home. Whether you work in our global headquarters in Boston, or in our warehouses or offices throughout the world, were reinventing the way people shop for their homes. Through our commitment to industry-leading technology and creative problem-solving, we are confident that Wayfair will be home to the most rewarding work of your career. If youre looking for rapid growth, constant learning, and dynamic challenges, then youll find that amazing career opportunities are knocking.
No matter who you are, Wayfair is a place you can call home. Were a community of innovators, risk-takers, and trailblazers who celebrate our differences, and know that our unique perspectives make us stronger, smarter, and well-positioned for success. We value and rely on the collective voices of our employees, customers, community, and suppliers to help guide us as we build a better Wayfair  and world  for all. Every voice, every perspective matters. Thats why were proud to be an equal opportunity employer. We do not discriminate on the basis of race, color, ethnicity, ancestry, religion, sex, national origin, sexual orientation, age, citizenship status, marital status, disability, gender identity, gender expression, veteran status, genetic information, or any other legally protected characteristic.
Your personal data is processed in accordance with our Candidate Privacy Notice (https://www.wayfair.com/careers/privacy). If you have any questions or wish to exercise your rights under applicable privacy and data protection laws, please contact us at dataprotectionofficer@wayfair.com."
