"ID","Title","Link","Company","Location","Remote","Experience","EmploymentType","DatePosted","RoleDescription"
3494515,"Head of Revenue Performance and Narrative (Senior Manager, L4)","https://www.wayfair.com/careers/jobs/8136013002?gh_jid=8136013002","Wayfair","Boston","No","Not specified","Full time","2025-08-31T02:00:52.938646Z","The salary range for this position is $161,000 - $172,500 per year. The base salary offered may vary depending on location, job-related knowledge, skills, and experience. Restricted stock units will be provided as part of the compensation package.
This is a hybrid position located in our Boston HQ. M-Th are in office and Friday's are remote.
At this time, Wayfair will not sponsor applicants for this position for the following work visas: F1-OPT, STEM OPT EAD, H-1B, H-1B1, E-3, O-1, J-1, or TN.
Who We Are
To win in the home goods space, Wayfair has to regularly make tactical decisions to influence revenue trends and improve the customer experience, and also needs to keep a tight pulse on progress along strategic goals. To inform these, we require a deep understanding of trends in internal performance indicators, customer health and competitive developments. Wayfairs Business Trends team is the C-suites right hand in steering revenue growth, monitoring performance drivers, and surfacing tactical and strategic opportunities in real time.
We are looking for a Senior Manager who will own the revenue performance narrative for Wayfairs North American business with a focus on wayfair.com, combining sharp analysis of input metrics with executive storytelling that shapes weekly leadership decisions. In this role, you will tightly partner with Commercial, Operations, and Technology leaders in understanding the impact of recipe input metrics (e.g. ship speed, availability or price levels) on revenue performance, surface and prioritize revenue improvement opportunities across both immediate and long-term horizons, and align on narratives which are shared in our weekly status report to the C-suite. You will also closely collaborate with the Head of CompIntel in understanding competitive trends driving revenue, the Head of Business Trends Advanced Insights in expanding the Business Trends toolkit and advancing use cases for GenAI / agentic AI, and with our Data Engineering team in improving our foundational data platform. This role reports to the Director of Business Trends &amp; Competitive Intelligence.  
This role offers an opportunity to shape the revenue agenda of a Fortune 500 e-commerce leader, with visibility and impact at the highest levels of the company. The ideal candidate combines strong analytical acumen, an ability to tie different data inputs to a consistent narrative and strong cross-team collaboration to influence both short and long term revenue tactics. 
 
What You'll Do

Partner with the Director of Business Trends to craft a weekly C-suite update that drives decisions on short- and mid-term revenue priorities with a focus on wayfair.com. 
Collaborate with key leaders across Commercial (e.g. Pricing, Category Management, Marketing, Promotions), Operations (e.g. Logistics, Service) and Technology (e.g. in relation to site load speed or tech-driven site issues) in improving input metrics and forming a narrative on trends which flow into the weekly C-suite update.
Identify and analyze connections between wayfair.com, wayfair.ca, our SRBs (e.g. Birch Lane) and our luxury brand (Perigold), highlighting key similarities and differences in e.g. customer mix and seasonal approach.
Support the GM of wayfair.ca in understanding revenue drivers and making the connections to the US business. Ensure ongoing reporting cadence for the SRBs (e.g. Birch Lane) whilst staying fluent on key revenue trends across these stores. 
Build a 6-18 months roadmap outlining our plan to improve the positioning of Business Trends as the connective tissue across Commercial, Operations and Technology. This includes continuously improving our modeling of input metrics and macro factors to predict revenue performance. 
Collaborate with the Head of Business Trends Advanced Insights and the Head of CompIntel in advancing joint OKRs.  
Develop and maintain tracking of macroeconomic trends (e.g., housing market), ensuring external drivers are systematically factored into revenue performance analysis.
Oversee and refine dashboards and guide enhancements to predictive models that inform decision-making, ensuring analytical rigor while leveraging a global analyst team for execution.
Present findings confidently to senior stakeholders across the US and global business.
Act as the go-to expert for performance insights across the North American business with a focus on wayfair.com. 
Provide dotted-line leadership to a global analyst team, ensuring quality, consistency, and scalability of dashboards and data foundations.

 
What You'll Need

5+ years experience in investment banking, M&amp;A, corporate finance or private equity preferred.  
Bachelors degree with a focus on economics, math, statistics, engineering, business or related field is a plus
Exceptional communication skills, with proven experience presenting to senior executives or clients and shaping decisions through clear, data-driven narratives.
Ability to connect macroeconomic and competitive factors with internal performance drivers to anticipate revenue shifts.
Proven ability to lead and mentor junior talent, ensuring analytical excellence and narrative consistency.
Proven track record in driving results along a set of key output metrics and OKRs.
Strong analytical skills  ability to develop analytical hypotheses and assumptions, use data software to conduct analyses, and synthesize findings.
Strong business acumen  ability to understand how various parts of the business interact, and how Business Trends fits in.
Thrives in high-stakes, fast-paced environments; resilient, adaptable, and comfortable driving clarity from ambiguity.
Advanced Excel / Google Sheets skills; Experience with SQL or Google Big Query is a plus but not required.
About Wayfair Inc.
Wayfair is one of the worlds largest online destinations for the home. Whether you work in our global headquarters in Boston, or in our warehouses or offices throughout the world, were reinventing the way people shop for their homes. Through our commitment to industry-leading technology and creative problem-solving, we are confident that Wayfair will be home to the most rewarding work of your career. If youre looking for rapid growth, constant learning, and dynamic challenges, then youll find that amazing career opportunities are knocking.
No matter who you are, Wayfair is a place you can call home. Were a community of innovators, risk-takers, and trailblazers who celebrate our differences, and know that our unique perspectives make us stronger, smarter, and well-positioned for success. We value and rely on the collective voices of our employees, customers, community, and suppliers to help guide us as we build a better Wayfair  and world  for all. Every voice, every perspective matters. Thats why were proud to be an equal opportunity employer. We do not discriminate on the basis of race, color, ethnicity, ancestry, religion, sex, national origin, sexual orientation, age, citizenship status, marital status, disability, gender identity, gender expression, veteran status, genetic information, or any other legally protected characteristic.
Your personal data is processed in accordance with our Candidate Privacy Notice (https://www.wayfair.com/careers/privacy). If you have any questions or wish to exercise your rights under applicable privacy and data protection laws, please contact us at dataprotectionofficer@wayfair.com."
3494513,"Senior Associate, Global Sales Revenue Operations (Category Sales)","https://www.wayfair.com/careers/jobs/8138946002?gh_jid=8138946002","Wayfair","Boston","No",3,"Full time","2025-08-31T02:00:52.938663Z","The base salary for this position is $83,500- $92,500 per year. The base salary offered may vary depending on location, job-related knowledge, skills, and experience.
At this time, Wayfair does not provide sponsorship for employment authorization for this position.
Wayfairs Revenue Operations team is seeking a data-driven and collaborative Senior Associate to drive our global B2B and B2C sales strategy. You will own high-impact projects, lead executive business reviews, and optimize sales workflows to help teams exceed their targets. This role partners closely with Sales, Analytics, and Category Management leaders and includes managing and mentoring a Category Sales Associate.
What Youll Do

Drive Data Insights &amp; Strategy: Drive weekly sales business reviews by analyzing performance data and KPIs to uncover actionable insights, identify growth opportunities, and inform category strategy.
Manage Strategic Projects: Own the end-to-end lifecycle of medium and long-term projects, including scoping deliverables, coordinating cross-functional teams, and communicating progress to senior leadership to improve sales effectiveness.
Drive Operational Excellence: Develop and execute data-driven action plans to address performance gaps or accelerate positive trends, ensuring clear goals and alignment with partner teams.
Cross-Functional Partnership: xxxx

What Youll Need

3+ years of experience in sales/revenue operations, project management, strategy, or consulting.
Proven ability to analyze complex data and translate it into actionable business insights and strategic recommendations.
Strong project management skills with experience leading cross-functional initiatives from concept to completion.
Excellent communication and stakeholder management skills, with a demonstrated ability to influence partners at all levels.
Experience or a strong aptitude for coaching and developing team members.
A collaborative mindset with a passion for breaking down complex problems and driving operational improvements.

An Important Note about Wayfair's In-Office Policy:
All Boston-based interns, Co-ops, and corporate employees will be in office in a hybrid capacity. Employees will work in the office on designated days, Monday - Thursday, and work remotely Friday.
Massachusetts Applicants: 
I understand that it is unlawful in Massachusetts to require or administer a lie detector test as a condition of employment or continued employment. An employer who violates this law shall be subject to criminal penalties and civil liability.About Wayfair Inc.
Wayfair is one of the worlds largest online destinations for the home. Whether you work in our global headquarters in Boston, or in our warehouses or offices throughout the world, were reinventing the way people shop for their homes. Through our commitment to industry-leading technology and creative problem-solving, we are confident that Wayfair will be home to the most rewarding work of your career. If youre looking for rapid growth, constant learning, and dynamic challenges, then youll find that amazing career opportunities are knocking.
No matter who you are, Wayfair is a place you can call home. Were a community of innovators, risk-takers, and trailblazers who celebrate our differences, and know that our unique perspectives make us stronger, smarter, and well-positioned for success. We value and rely on the collective voices of our employees, customers, community, and suppliers to help guide us as we build a better Wayfair  and world  for all. Every voice, every perspective matters. Thats why were proud to be an equal opportunity employer. We do not discriminate on the basis of race, color, ethnicity, ancestry, religion, sex, national origin, sexual orientation, age, citizenship status, marital status, disability, gender identity, gender expression, veteran status, genetic information, or any other legally protected characteristic.
Your personal data is processed in accordance with our Candidate Privacy Notice (https://www.wayfair.com/careers/privacy). If you have any questions or wish to exercise your rights under applicable privacy and data protection laws, please contact us at dataprotectionofficer@wayfair.com."
3494512,"Inventory Operations Specialist - Perigold Luxury","https://www.wayfair.com/careers/jobs/8130669002?gh_jid=8130669002","Wayfair","West Palm Beach","No",1,"Full time","2025-08-31T02:00:52.938689Z","Logistics Specialist
Location: West Palm Beach, Florida

The base pay for this position is $24.00 per hour.
Benefits start day one

Brief Overview of Position
Perigold, the destination for luxury home, is opening its first physical retail stores, first-of-their-kind retail destinations of 20-30K square feet, with the best products in all styles and from across our catalog including furniture, decor, housewares, and home improvement categories.  Come be a part of it!  We are looking for a Logistics Lead to oversee all back of house store operations, and report directly into the Store Manager.  If you are driven, collaborative, and determined with strong attention to detail and communication skills and thrive on constant learning and dynamic challenges, this may be the perfect fit.
 
What youll do 

Maintain luxury experience standards by supporting an authentic, inviting guest experience that exemplifies our commitment to customer satisfaction and passion for luxury design.
Oversee full store inventory accuracy, all inbound and outbound flows, all store replenishment, and fulfillment.
Support the Store Manager and team with receiving and stockroom organization and supply levels to maximize inventory accuracy, inventory reconciliation and restocking efficiency, safety and productivity to support sales floor replenishment, returns and other related processes.  
Maintain and communicate comprehensive operations reporting for the store vs goals established for the business and by the store manager. 
Report on inventory position to store manager and leads on a regular basis. 
Collaborate closely with corporate PIM/SIM team to reconcile inventory and planning accuracy, and troubleshoot issues. 
Partner with Guest Experience and Sales leads to ensure alignment with greater business requirements and expectations (including soliciting feedback on back of house processes and policies, and working to improve as needed). 
Perform key holder and Manager On Duty duties.  

 
What youll need
Experience &amp; Qualifications

1-3 years of experience in a supply chain related role; retail back of house and/or fulfillment experience a plus.  
Customer centric mindset.  
Demonstrated ability to thrive in a fast-paced, startup environment, including willingness to explore and test innovative ideas and pursue continuous improvement.  
Strong business acumen, and exceptional analytical, problem-solving, and decision-making skills.
Strong organization, self-motivation, communication and relationship management skills.


Flexibility availability (including mornings, nights, weekends, some holidays).
Candidates must be open to learning how to safely operate a pallet jack (also known as a pallet truck or pump truck) as part of their job responsibilities. Training will be provided to ensure proper handling and safety protocols are followed. Typically, this requires you to be able to lift at least 50lbs or more.

 
Physical Demands

While performing the duties of this job, the employee is frequently required to stand, walk, talk and hear. The employee frequently is required to handle, or feel and reach with hands and arms. The employee is occasionally required to sit; regularly climb or balance; and frequently stoop, kneel, crouch, or crawl. The employee must regularly, frequently or occasionally lift and/or move up to 50 lbs.
Specific vision abilities required by this job include close vision, distance vision, color vision, peripheral vision, depth perception, and ability to adjust focus.
Candidates must be open to learning how to safely operate a pallet jack (also known as a pallet truck or pump truck) as part of their job responsibilities. Training will be provided to ensure proper handling and safety protocols are followed. Typically, this requires you to be able to lift at least 50lbs or more.

 
 
Compensation &amp; Benefits:

The base pay for this position is $24.00 per hour.
Medical benefits, financial benefits, and a generous employee discount - starting on day one.

 
About Perigold
Perigold is the destination for luxury home. Established in 2017, Perigold offers an unmatched selection of the worlds best design brands, with unique pieces for every style and space. The brand offers the highest quality pieces for home, backed by a quality guarantee and expert concierge support. They also offer free white-glove delivery and 30-day returns on most items. Headquartered in Boston, Massachusetts, Perigold is part of the Wayfair Inc. (NYSE:W) brand portfolio. 
 
Your personal data is processed in accordance with our Candidate Privacy Notice (https://www.wayfair.com/careers/privacy). If you have any questions or wish to exercise your rights under applicable privacy and data protection laws, please contact us at dataprotectionofficer@wayfair.com.
 
Assistance for Individuals with Disabilities
Wayfair is fully committed to providing equal opportunities for all individuals, including individuals with disabilities. As part of this commitment, Wayfair will make reasonable accommodations to the known physical or mental limitations of qualified individuals with disabilities, unless doing so would impose an undue hardship on business operations. If you require a reasonable accommodation to participate in the job application or interview process, please let us know by completing our Accommodations for Applicants form.
 
Need Assistance?
For more information about applying for a career at Wayfair, visit our FAQ page here. About Wayfair Inc.
Wayfair is one of the worlds largest online destinations for the home. Whether you work in our global headquarters in Boston, or in our warehouses or offices throughout the world, were reinventing the way people shop for their homes. Through our commitment to industry-leading technology and creative problem-solving, we are confident that Wayfair will be home to the most rewarding work of your career. If youre looking for rapid growth, constant learning, and dynamic challenges, then youll find that amazing career opportunities are knocking.
No matter who you are, Wayfair is a place you can call home. Were a community of innovators, risk-takers, and trailblazers who celebrate our differences, and know that our unique perspectives make us stronger, smarter, and well-positioned for success. We value and rely on the collective voices of our employees, customers, community, and suppliers to help guide us as we build a better Wayfair  and world  for all. Every voice, every perspective matters. Thats why were proud to be an equal opportunity employer. We do not discriminate on the basis of race, color, ethnicity, ancestry, religion, sex, national origin, sexual orientation, age, citizenship status, marital status, disability, gender identity, gender expression, veteran status, genetic information, or any other legally protected characteristic.
Your personal data is processed in accordance with our Candidate Privacy Notice (https://www.wayfair.com/careers/privacy). If you have any questions or wish to exercise your rights under applicable privacy and data protection laws, please contact us at dataprotectionofficer@wayfair.com."
2580833,"Platform Engineer III, Observability","https://www.wayfair.com/careers/jobs/7907709002?gh_jid=7907709002","Wayfair","Bangalore","No",6,"Full time","2025-08-31T02:00:52.938716Z","Who We Are:
Wayfair leads e-commerce for all things home, driven by modern tech. We seek sharp thinkers who design scalable systems while keeping a startup mindset. Our culture values fast, data-driven innovation.
The Observability team needs experienced engineers skilled in cloud-native design, legacy maintenance, and SRE best practicesplus ideas for improvement! We collaborate across Tech to ensure platforms and services are production-ready, contributing to both platform and software codebases.
What Youll Do:

As a DevOps Engineer, you will join our team to help grow our systems into best-in-class for efficiency, stability, observability, velocity, and scale in the e-commerce space, engage with the product and engineering team from Day 1 to design, build and maintain the system / software proactively
Influence the design and architecture of Wayfair system as part of Cloud Enablement journey whilst maintaining our critical pieces of Legacy Tools; collaborate with development teams to design scalable and reliable systems, considering aspects such as fault tolerance, availability and performance
Work with both software engineers and platform Engineers to optimize and develop repeatable systems for the two sides to leverage each other. Theres a wide range of opportunities to both guide the broad conversation and dive into the nuance of our code &amp; architecture
Help service owners build realistic SLOs, set SLAs and error budgets, and ensure production services have reliability built into their designEven after self-healing and automation done by you provide production support and creatively solve challenging engineering problems across our stack
Participate in a shared on-call schedule managed across Engineering
Automate repetitive tasks to increase efficiency and reduce human error
Mentor new hires and other engineers by example, tech talks, paired programming, and other avenues to increase technical efficiency across the organization.

What Youll Need:

6+ years experience working in DevOps or SRE role, or software development with an understanding of Cloud Infrastructure
Experience with cloud platforms GCP, AWS, Azure, and containerization technologies (e.g. Docker, Kubernetes)
Experience with server-side software engineering (Python, Go, Java, BASH etc)
Design experience with distributed systems, microservices architecture, and related technologies
Strong understanding of monitoring and alerting, with a focus on performance monitoring and tracing instrumentation &amp; SLI/SLO/SLAs
Experience decoupling monolith services a plus
Knowledge of CI/CD pipelines and version control systems (e.g., Git).
Excellent communication skills across engineers, product managers, and business stakeholders alike
Knowledge of configuration management tools (e.g. Puppet, Ansible, Chef, Terraform)

Nice To Have:

Passion for leading a large, cross-cutting technical initiative to delivery, cross-functional consensus building and influencing design decisions
Ample experience gathering and balancing requirements from technical and business stakeholders, and reaching consensus on prioritization
Experience mentoring engineers and leading code reviews
About Wayfair Inc.
Wayfair is one of the worlds largest online destinations for the home. Whether you work in our global headquarters in Boston, or in our warehouses or offices throughout the world, were reinventing the way people shop for their homes. Through our commitment to industry-leading technology and creative problem-solving, we are confident that Wayfair will be home to the most rewarding work of your career. If youre looking for rapid growth, constant learning, and dynamic challenges, then youll find that amazing career opportunities are knocking.
No matter who you are, Wayfair is a place you can call home. Were a community of innovators, risk-takers, and trailblazers who celebrate our differences, and know that our unique perspectives make us stronger, smarter, and well-positioned for success. We value and rely on the collective voices of our employees, customers, community, and suppliers to help guide us as we build a better Wayfair  and world  for all. Every voice, every perspective matters. Thats why were proud to be an equal opportunity employer. We do not discriminate on the basis of race, color, ethnicity, ancestry, religion, sex, national origin, sexual orientation, age, citizenship status, marital status, disability, gender identity, gender expression, veteran status, genetic information, or any other legally protected characteristic.
Your personal data is processed in accordance with our Candidate Privacy Notice (https://www.wayfair.com/careers/privacy). If you have any questions or wish to exercise your rights under applicable privacy and data protection laws, please contact us at dataprotectionofficer@wayfair.com."
