"ID","Title","Link","Company","Location","Remote","Experience","EmploymentType","DatePosted","RoleDescription"
3508740,"Night Operations Manager","https://www.wayfair.com/careers/jobs/8143516002?gh_jid=8143516002","Wayfair","Greensboro","No",5,"Full time","2025-08-31T02:00:52.938127Z","The salary range for this position is $80,500 - $88,780 per year. The base salary offered may vary depending on location, job-related knowledge, skills, and experience. Restricted stock units will be provided as part of the compensation package.
Shift: The team is currently finalizing the schedule but this will be an overnight shift position. 
We are looking for a talented and driven Home Delivery Operations Terminal Manager to join us and lead our Greensboro Delivery Operations. You will lead a team of Supervisors, Associates/Specialists, and Driver Partners serving our customers in your delivery area.  
Weve been busy building a best-in-class logistics network that allows us to delight customers by speeding up deliveries, adding specialized services, and reducing damage. 
Home Delivery Operations Manager is a fantastic spot to start your Wayfair journey. We have ambitious plans for over the next 5 years, so opportunities for growth will be plentiful for those who want them!
What Youll Do

Assume full responsibility for the safety, customer experience, employee experience, quality, and cost of your Home Delivery Operation Terminal - this is your site - get excited to Be an Owner
Provide inspirational leadership and guidance to your team of Wayfair Warehouse and Wayfair Transportation employees, inclusive of leaders and frontline staff
Build a partnership with our Delivery Partners ensuring your operation has the needed outbound capacity and provides an exceptional home delivery customer experience
Drive results for your building across a comprehensive and balanced set of performance metrics (e.g., Safety, Customer, Employee, Quality, Cost)
Develop your people by relentlessly focusing on skill development and career pathing
Collaborate with several core stakeholders and ensure your building has what it needs to be successful (e.g., Safety, Talent Mgt, Talent Acquisition, Transportation, Training, Workforce Planning, Technology, to name a few...)
Champion change for your team - we are always improving and we move fast

What You'll Need

Ownership mentality and motivation to build the best team
Strong leadership skills and ability to collaborate effectively with cross functional teams
Ability to proactively identify opportunities and implement solutions; lean/six sigma a plus
Comfort with delivery routing technologies/strategies and warehouse management systems
Comfort with raw data sets as well as creating simple but useful templates in google sheets
BA/BS in management, administration, supply chain, or customer service.
5+ years working experience in fulfillment, distribution, home delivery or transportation
Bilingual is a plus






Find your place in the Wayborhood! Click here to stay informed on upcoming warehouse leadership opportunities.





 About Wayfair Inc.
Wayfair is one of the worlds largest online destinations for the home. Whether you work in our global headquarters in Boston, or in our warehouses or offices throughout the world, were reinventing the way people shop for their homes. Through our commitment to industry-leading technology and creative problem-solving, we are confident that Wayfair will be home to the most rewarding work of your career. If youre looking for rapid growth, constant learning, and dynamic challenges, then youll find that amazing career opportunities are knocking.
No matter who you are, Wayfair is a place you can call home. Were a community of innovators, risk-takers, and trailblazers who celebrate our differences, and know that our unique perspectives make us stronger, smarter, and well-positioned for success. We value and rely on the collective voices of our employees, customers, community, and suppliers to help guide us as we build a better Wayfair  and world  for all. Every voice, every perspective matters. Thats why were proud to be an equal opportunity employer. We do not discriminate on the basis of race, color, ethnicity, ancestry, religion, sex, national origin, sexual orientation, age, citizenship status, marital status, disability, gender identity, gender expression, veteran status, genetic information, or any other legally protected characteristic.
Your personal data is processed in accordance with our Candidate Privacy Notice (https://www.wayfair.com/careers/privacy). If you have any questions or wish to exercise your rights under applicable privacy and data protection laws, please contact us at dataprotectionofficer@wayfair.com."
3508739,"Guest Experience Host, Part-Time, Wayfair Stores","https://www.wayfair.com/careers/jobs/8142657002?gh_jid=8142657002","Wayfair","Wilmette, IL","No",1,"Full time","2025-08-31T02:00:52.938145Z","Guest Experience Host, Part Time, Wayfair Stores
Location: 3232 Lake Ave Suite 1, Wilmette, IL 60091The entry pay rate for this position is $18.00/hr.
Overview:
At Wayfair, we believe great experiences start the moment someone walks through our doors. As a Guest Experience Host, youll be the first and last impression for every guest and team member who enters our store. From offering a warm welcome to helping monitor safety and store standards, youll play a key role in creating a seamless, secure, and friendly in-store experience. If you thrive on human connection, are naturally observant, and love delivering standout service, youll feel right at home here.
What Does a Guest Experience Host Do?

 Deliver Hospitality-Level Service: Go beyond expectations to ensure every guest feels valued, respected, and supported. Whether youre greeting at the entrance, resolving concerns, or helping someone find their way, youll treat every interaction as a chance to leave a lasting positive impression.
 Create a Welcoming Vibe: You will ensure every visit starts and ends on a high note. Offer assistance, answer questions, and set a friendly, professional tone for the entire team.
 Support Customer &amp; Team Needs: Assist guests with wayfinding, field inquiries, and surface feedback or concerns to store leadership. Be a go-to source for in-the-moment supportwhether for customers or your teammates.
 Tackle Admin Tasks with Care: Answer store phones, check voicemails, help with device check-ins, and support internal communication needs. Document and escalate security or safety incidents with accuracy, professionalism, and confidentiality.
 Enhance Asset Protection Awareness: Keep a watchful eye on store activity and flag behaviors that may indicate policy violations, theft, or safety risks. Work closely with the Asset Protection (AP) team to maintain a secure environment.
 Uphold Safety Standards: Conduct routine safety walks and monitor for potential hazards in both front-of-house and back-of-house areas. Respond promptly and appropriately to safety incidents and escalate issues when needed.
 Oversee Security &amp; Access: Manage check-in procedures for associates and visitors, monitor security desk operations, and use store cameras to oversee key entry and exit points.

You'll Thrive in This Role if You Have:

 People-First Energy: 1+ years of experience in retail, hospitality, or customer-facing roleswhere you made others feel seen, supported, and welcome.
 Strong Communication Skills: You can clearly and professionally communicate in person and in writing, adjusting your tone as needed for guests, associates, and leaders.
 Situational Awareness: Youre observant, tactful, and know when to escalate concerns. You recognize when something is off and respond with care and confidence.
 Tech-Savviness: Youre comfortable using Google Suite tools like Gmail, Sheets, and Formsand ready to learn new systems if needed.
 Dependable Flexibility: Available for a retail schedule including mornings, evenings, weekends, and holidays. You show up on time and bring your A-game to every shift.
 Hospitality Mindset: Background in hospitality or high-end service environments is a big plus. You bring warmth, attentiveness, and a solutions-focused attitude to every interaction ensuring guests feel truly cared for from start to finish.

Additional Physical and Environmental Requirements:

 Physical Activity: Frequent standing, walking, and reaching with hands and arms; occasional sitting, climbing, balancing, and crawling.
 Mobility &amp; Movement: Frequent stooping, kneeling, and crouching throughout the day.
 Lifting Ability: Must be able to lift and/or move up to 50 lbs regularly.
 Vision Requirements: Includes close, distance, color, and peripheral vision; depth perception and the ability to adjust focus.
 Temperature Flexibility: Comfortable in environments with varying temperature conditions.
 Noise Tolerance: Occasional exposure to moderate noise levels and physical activity.
 Safety Awareness: Minimal exposure to workplace or environmental hazardsmust adhere to all safety protocols.

What are the Benefits*?

 Competitive Pay: Earn competitive compensation with regular opportunities for performance-based increases.
 Career Growth: Access professional development and advancement opportunities to help you grow with us.
 Health Benefits from Day One: Medical, dental, and vision insurance coverage starts on your first day.
 Time to Recharge: Start accruing paid time off immediatelybecause work-life balance matters.
 401(k) with Company Match: Well match up to 4% to help you plan for your future.
 Tuition Reimbursement: Eligible after 6 months of employmentlearn, grow, and get support along the way.
 Wayfair Employee Discount: Save big on the pieces you loveplus get 10% off at our in-store restaurant .
 Parental Leave Options: Choose from paid and unpaid leave plans to support your growing family.
 And So Much More*: Weve got more good stuff where that came from! Our full-time roles receive the full benefits package, while part-time or seasonal team members may have modified offerings. Your recruiter or in-store team can help with any questions!

 About Wayfair Inc.
Wayfair is one of the worlds largest online destinations for the home. Whether you work in our global headquarters in Boston, or in our warehouses or offices throughout the world, were reinventing the way people shop for their homes. Through our commitment to industry-leading technology and creative problem-solving, we are confident that Wayfair will be home to the most rewarding work of your career. If youre looking for rapid growth, constant learning, and dynamic challenges, then youll find that amazing career opportunities are knocking.
No matter who you are, Wayfair is a place you can call home. Were a community of innovators, risk-takers, and trailblazers who celebrate our differences, and know that our unique perspectives make us stronger, smarter, and well-positioned for success. We value and rely on the collective voices of our employees, customers, community, and suppliers to help guide us as we build a better Wayfair  and world  for all. Every voice, every perspective matters. Thats why were proud to be an equal opportunity employer. We do not discriminate on the basis of race, color, ethnicity, ancestry, religion, sex, national origin, sexual orientation, age, citizenship status, marital status, disability, gender identity, gender expression, veteran status, genetic information, or any other legally protected characteristic.
Your personal data is processed in accordance with our Candidate Privacy Notice (https://www.wayfair.com/careers/privacy). If you have any questions or wish to exercise your rights under applicable privacy and data protection laws, please contact us at dataprotectionofficer@wayfair.com."
3508738,"Guest Experience Host, Full-Time, Wayfair Stores","https://www.wayfair.com/careers/jobs/8142588002?gh_jid=8142588002","Wayfair","Wilmette, IL","No",1,"Full time","2025-08-31T02:00:52.938173Z","Guest Experience Host
Location: 3232 Lake Ave Suite 1, Wilmette, IL 60091The entry pay rate for this position is $18.00/hr.
Overview:
At Wayfair, we believe great experiences start the moment someone walks through our doors. As a Guest Experience Host, youll be the first and last impression for every guest and team member who enters our store. From offering a warm welcome to helping monitor safety and store standards, youll play a key role in creating a seamless, secure, and friendly in-store experience. If you thrive on human connection, are naturally observant, and love delivering standout service, youll feel right at home here.
What Does a Guest Experience Host Do?

 Deliver Hospitality-Level Service: Go beyond expectations to ensure every guest feels valued, respected, and supported. Whether youre greeting at the entrance, resolving concerns, or helping someone find their way, youll treat every interaction as a chance to leave a lasting positive impression.
 Create a Welcoming Vibe: You will ensure every visit starts and ends on a high note. Offer assistance, answer questions, and set a friendly, professional tone for the entire team.
 Support Customer &amp; Team Needs: Assist guests with wayfinding, field inquiries, and surface feedback or concerns to store leadership. Be a go-to source for in-the-moment supportwhether for customers or your teammates.
 Tackle Admin Tasks with Care: Answer store phones, check voicemails, help with device check-ins, and support internal communication needs. Document and escalate security or safety incidents with accuracy, professionalism, and confidentiality.
 Enhance Asset Protection Awareness: Keep a watchful eye on store activity and flag behaviors that may indicate policy violations, theft, or safety risks. Work closely with the Asset Protection (AP) team to maintain a secure environment.
 Uphold Safety Standards: Conduct routine safety walks and monitor for potential hazards in both front-of-house and back-of-house areas. Respond promptly and appropriately to safety incidents and escalate issues when needed.
 Oversee Security &amp; Access: Manage check-in procedures for associates and visitors, monitor security desk operations, and use store cameras to oversee key entry and exit points.

You'll Thrive in This Role if You Have:

 People-First Energy: 1+ years of experience in retail, hospitality, or customer-facing roleswhere you made others feel seen, supported, and welcome.
 Strong Communication Skills: You can clearly and professionally communicate in person and in writing, adjusting your tone as needed for guests, associates, and leaders.
 Situational Awareness: Youre observant, tactful, and know when to escalate concerns. You recognize when something is off and respond with care and confidence.
 Tech-Savviness: Youre comfortable using Google Suite tools like Gmail, Sheets, and Formsand ready to learn new systems if needed.
 Dependable Flexibility: Available for a retail schedule including mornings, evenings, weekends, and holidays. You show up on time and bring your A-game to every shift.
 Hospitality Mindset: Background in hospitality or high-end service environments is a big plus. You bring warmth, attentiveness, and a solutions-focused attitude to every interaction ensuring guests feel truly cared for from start to finish.

Additional Physical and Environmental Requirements:

 Physical Activity: Frequent standing, walking, and reaching with hands and arms; occasional sitting, climbing, balancing, and crawling.
 Mobility &amp; Movement: Frequent stooping, kneeling, and crouching throughout the day.
 Lifting Ability: Must be able to lift and/or move up to 50 lbs regularly.
 Vision Requirements: Includes close, distance, color, and peripheral vision; depth perception and the ability to adjust focus.
 Temperature Flexibility: Comfortable in environments with varying temperature conditions.
 Noise Tolerance: Occasional exposure to moderate noise levels and physical activity.
 Safety Awareness: Minimal exposure to workplace or environmental hazardsmust adhere to all safety protocols.

What are the Benefits*?

 Competitive Pay: Earn competitive compensation with regular opportunities for performance-based increases.
 Career Growth: Access professional development and advancement opportunities to help you grow with us.
 Health Benefits from Day One: Medical, dental, and vision insurance coverage starts on your first day.
 Time to Recharge: Start accruing paid time off immediatelybecause work-life balance matters.
 401(k) with Company Match: Well match up to 4% to help you plan for your future.
 Tuition Reimbursement: Eligible after 6 months of employmentlearn, grow, and get support along the way.
 Wayfair Employee Discount: Save big on the pieces you loveplus get 10% off at our in-store restaurant .
 Parental Leave Options: Choose from paid and unpaid leave plans to support your growing family.
 And So Much More*: Weve got more good stuff where that came from! Our full-time roles receive the full benefits package, while part-time or seasonal team members may have modified offerings. Your recruiter or in-store team can help with any questions!
About Wayfair Inc.
Wayfair is one of the worlds largest online destinations for the home. Whether you work in our global headquarters in Boston, or in our warehouses or offices throughout the world, were reinventing the way people shop for their homes. Through our commitment to industry-leading technology and creative problem-solving, we are confident that Wayfair will be home to the most rewarding work of your career. If youre looking for rapid growth, constant learning, and dynamic challenges, then youll find that amazing career opportunities are knocking.
No matter who you are, Wayfair is a place you can call home. Were a community of innovators, risk-takers, and trailblazers who celebrate our differences, and know that our unique perspectives make us stronger, smarter, and well-positioned for success. We value and rely on the collective voices of our employees, customers, community, and suppliers to help guide us as we build a better Wayfair  and world  for all. Every voice, every perspective matters. Thats why were proud to be an equal opportunity employer. We do not discriminate on the basis of race, color, ethnicity, ancestry, religion, sex, national origin, sexual orientation, age, citizenship status, marital status, disability, gender identity, gender expression, veteran status, genetic information, or any other legally protected characteristic.
Your personal data is processed in accordance with our Candidate Privacy Notice (https://www.wayfair.com/careers/privacy). If you have any questions or wish to exercise your rights under applicable privacy and data protection laws, please contact us at dataprotectionofficer@wayfair.com."
3454781,"Platform Engineer II, Platform Foundation","https://www.wayfair.com/careers/jobs/7986097002?gh_jid=7986097002","Wayfair","Bangalore","No",3,"Full time","2025-08-31T02:00:52.938192Z","Candidates for this position are preferred to be based in Bangalore, India and will be expected to comply with their team's hybrid work schedule requirements.
Who We Are:
Wayfair leads e-commerce for all things home, driven by modern tech. We seek sharp thinkers who design scalable systems while keeping a startup mindset. Our culture values fast, data-driven innovation.
The Wayfair Operations Center team needs experienced engineers skilled in cloud-native design, legacy maintenance, and SRE best practicesplus ideas for improvement! We collaborate across Tech to ensure platforms and services are production-ready, contributing to both platform and software codebases.
What Youll Do:

As a DevOps Engineer, you will join our team to help grow our systems into best-in-class for efficiency, stability, observability, velocity, and scale in the e-commerce space, engage with the product and engineering team from Day 1 to design, build and maintain the system / software proactively
Influence the design and architecture of Wayfair system as part of Cloud Enablement journey whilst maintaining our critical pieces of Legacy Tools; collaborate with development teams to design scalable and reliable systems, considering aspects such as fault tolerance, availability and performance
Work with both software engineers and platform Engineers to optimize and develop repeatable systems for the two sides to leverage each other. Theres a wide range of opportunities to both guide the broad conversation and dive into the nuance of our code &amp; architecture
Help service owners build realistic SLOs, set SLAs and error budgets, and ensure production services have reliability built into their designEven after self-healing and automation done by you provide production support and creatively solve challenging engineering problems across our stack
Participate in a shared on-call schedule managed across Engineering
Automate repetitive tasks to increase efficiency and reduce human error
Mentor new hires and other engineers by example, tech talks, paired programming, and other avenues to increase technical efficiency across the organization.

What Youll Need:

3+ years experience working in DevOps or SRE role, or software development with an understanding of Cloud Infrastructure
Experience with cloud platforms GCP, AWS, Azure, and containerization technologies (e.g. Docker, Kubernetes)
Experience with server-side software engineering (Python, Go, Java, BASH etc)
Design experience with distributed systems, microservices architecture, and related technologies
Strong understanding of monitoring and alerting, with a focus on performance monitoring and tracing instrumentation &amp; SLI/SLO/SLAs
Experience decoupling monolith services a plus
Knowledge of CI/CD pipelines and version control systems (e.g., Git).
Excellent communication skills across engineers, product managers, and business stakeholders alike
Knowledge of configuration management tools (e.g. Puppet, Ansible, Chef, Terraform)

Nice To Have:



Passion for leading a large, cross-cutting technical initiative to delivery, cross-functional consensus building and influencing design decisions
Ample experience gathering and balancing requirements from technical and business stakeholders, and reaching consensus on prioritization
Experience mentoring engineers and leading code reviews


About Wayfair Inc.
Wayfair is one of the worlds largest online destinations for the home. Whether you work in our global headquarters in Boston, or in our warehouses or offices throughout the world, were reinventing the way people shop for their homes. Through our commitment to industry-leading technology and creative problem-solving, we are confident that Wayfair will be home to the most rewarding work of your career. If youre looking for rapid growth, constant learning, and dynamic challenges, then youll find that amazing career opportunities are knocking.
No matter who you are, Wayfair is a place you can call home. Were a community of innovators, risk-takers, and trailblazers who celebrate our differences, and know that our unique perspectives make us stronger, smarter, and well-positioned for success. We value and rely on the collective voices of our employees, customers, community, and suppliers to help guide us as we build a better Wayfair  and world  for all. Every voice, every perspective matters. Thats why were proud to be an equal opportunity employer. We do not discriminate on the basis of race, color, ethnicity, ancestry, religion, sex, national origin, sexual orientation, age, citizenship status, marital status, disability, gender identity, gender expression, veteran status, genetic information, or any other legally protected characteristic.
Your personal data is processed in accordance with our Candidate Privacy Notice (https://www.wayfair.com/careers/privacy). If you have any questions or wish to exercise your rights under applicable privacy and data protection laws, please contact us at dataprotectionofficer@wayfair.com."
