"ID","Title","Link","Company","Location","Remote","Experience","EmploymentType","DatePosted","RoleDescription"
3479810,"Software Engineer III, Service Lifecycle ","https://www.wayfair.com/careers/jobs/8134316002?gh_jid=8134316002","Wayfair","Toronto, ON","No",4,"Full time","2025-08-31T02:00:52.938418Z","An Important Note about Wayfair's In-Office Policy and Salary: 
Candidates for this position must be based in Toronto, Canada and will require you to work in the office on Tuesdays, Wednesdays, and Thursday
 
The salary range for this position is $192,047 - $211,914 CAD per year. The base salary offered may vary depending on location, job-related knowledge, skills, and experience. Restricted stock units will also be provided as part of the compensation package.

 
Who We Are:
Wayfair runs the largest custom e-commerce large parcel network in the United States, approximately 1.6 million square meters of logistics space. The nature of the network is inherently a highly variable ecosystem that requires flexible, reliable, and resilient systems to operate efficiently. 
 
We are looking for a passionate Platform Engineer to join the Service Lifecycle team at Wayfair. This team is responsible for everything that is necessary to successfully run a service or application in production at Wayfair. On the service lifecycle team, we are responsible for the compute infrastructure on which all of Wayfair runs, service to service communication using our service mesh and Wayfairs network edge which includes our CDN. As part of our team, you will be solving complex problems that have a direct impact on production infrastructure that powers all of Wayfairs business.
 
Interested in learning more about Wayfairs Engineering community? 

Check out our Wayfair Tech Blog: https://www.aboutwayfair.com/careers/tech-blog. 

 
What Youll Do:

Work on a team of extremely talented platform engineers to help maintain and scale the current and future state services platform at Wayfair
Help architect and develop the future state compute platform by leveraging industry best practices as well as embracing new technologies to support the future growth of Wayfair as a business
Help influence the product roadmaps of GCP (our primary cloud provider) to better suit Wayfairs future state architecture
Work collaboratively with business and technical stakeholders to develop and architect enhancements to the compute platform capabilities that enable them to develop and iterate applications to power the Wayfair business
Identify opportunities to introduce automation, improvements to avoid repetitive operational tasks (DRY)
Participate in the on-call rotation to ensure operational excellence and overall platform health

 
We Are a Match Because You Have:

4+ years of experience in platform engineering/sre roles using an object oriented language (Python, Golang, etc)
Bachelors degree in Computer Science, Computer Engineering or equivalent combination of education and experience
Extensive experience working with Kubernetes in a public cloud (GKE, EKS, AKS, etc)
Experience working with Istio/Service Mesh
Experience working with IaC (Terraform, Pulumi, etc)
Experience working within a Public Cloud environment (GCP, AWS, Azure, etc)
Experience working with CI/CD tools such as Argo, Buildkite, TravisCI, Jenkins, Spinnaker, etc
Experience working with platform observability tools (Prometheus, Thanos, Grafana, Fluentbit, Cloud Monitoring, Google Cloud Logging, Datadog, Pagerduty, Cloudwatch, Kibana, Elastic Search, Splunk,  VictorOps, etc)
Experience with Networking
Experience and desire to work in an agile environment
Analytical mindset and passion for solving business problems with technology

 
Nice To Haves:

Experience working with Dev Testing tools and patterns such as Garden, Flagger, Canary Deployments, Blue/Green Testing, A/B Testing
Experience setting up and working with Kubernetes Admission Control (Kyverno, OPA, etc)
Experience working with workload scaling (HPA, VPA, Capacity Planning/Reservations, etc)

 
Why Youll Love Wayfair:

Time Off:

Paid Holidays
Paid Time Off (PTO)

Health &amp; Wellness:

Full Health Benefits (Medical, Dental, Vision, HSA/FSA)
Life Insurance
DIsability Protection (Short Term &amp; Long Term DIsability) 
Global Wellbeing: Gym/Fitness discounts (including US Peloton, Global ClassPass, and various regional gym memberships)
Mental Health Support (Global Mental Health, Global Wayhealthy Recordings)
Caregiver Services

Financial Growth &amp; Security:

401K Matching (Employee Matching Program)
Tuition Reimbursement 
Financial Health Education (Knowledge of Financial Education - KOFE)
Tax Advantaged Accounts

Family Support:

Family Planning Support
Parental Leave
Global Surrogacy &amp; Adoption Policy

Professional Development &amp; Recognition:

Rewards &amp; Recognition 
Global Employee Anniversary Awards 
Paid Volunteer Work 

Unique Perks:

Employee Discount 
U.S. Bluebikes Membership
Global Pod Outings

Work/Life Balance:

Emphasizing a supportive &amp; flexible work environment that encourages a balance between personal and professional commitments 


We are looking forward to your application!
 
Assistance for Individuals with Disabilities
 
Wayfair is fully committed to providing equal opportunities for all individuals, including individuals with disabilities. As part of this commitment, Wayfair will make reasonable accommodations to the known physical or mental limitations of qualified individuals with disabilities, unless doing so would impose an undue hardship on business operations. If you require a reasonable accommodation to participate in the job application or interview process, please let us know by completing our Accommodations for Applicants form.
 
Need Assistance?
 
For more information about applying for a career at Wayfair, visit our FAQ page here. 
 
About Wayfair Inc.
Wayfair is one of the worlds largest online destinations for the home. Through our commitment to industry-leading technology and creative problem-solving, we are confident that Wayfair will be home to the most rewarding work of your career. If youre looking for rapid growth, constant learning, and dynamic challenges, then youll find that amazing career opportunities are knocking.About Wayfair Inc.
Wayfair is one of the worlds largest online destinations for the home. Whether you work in our global headquarters in Boston, or in our warehouses or offices throughout the world, were reinventing the way people shop for their homes. Through our commitment to industry-leading technology and creative problem-solving, we are confident that Wayfair will be home to the most rewarding work of your career. If youre looking for rapid growth, constant learning, and dynamic challenges, then youll find that amazing career opportunities are knocking.
No matter who you are, Wayfair is a place you can call home. Were a community of innovators, risk-takers, and trailblazers who celebrate our differences, and know that our unique perspectives make us stronger, smarter, and well-positioned for success. We value and rely on the collective voices of our employees, customers, community, and suppliers to help guide us as we build a better Wayfair  and world  for all. Every voice, every perspective matters. Thats why were proud to be an equal opportunity employer. We do not discriminate on the basis of race, color, ethnicity, ancestry, religion, sex, national origin, sexual orientation, age, citizenship status, marital status, disability, gender identity, gender expression, veteran status, genetic information, or any other legally protected characteristic.
Your personal data is processed in accordance with our Candidate Privacy Notice (https://www.wayfair.com/careers/privacy). If you have any questions or wish to exercise your rights under applicable privacy and data protection laws, please contact us at dataprotectionofficer@wayfair.com."
3442352,"Accounts Receivable Associate  ","https://www.wayfair.com/careers/jobs/8121573002?gh_jid=8121573002","Wayfair","Galway, IRE","No",1,"Full time","2025-08-31T02:00:52.938435Z","Financial Operations Associate
 
Galway, UK | Office-Based (MonThurs, Fri-WFH)Full-Time
Benefits: Vhi Health &amp; Dental Insurance, Wellbeing Scheme, LearnLux Financial Care, Employee Discounts, Pension, Tuition Reimbursement, Bright Horizons (Child Back-up care), ClassPass access, Sport/Gym Membership Contribution, Commuter Benefits, Holiday including tenure entitlement + Bank Holidays, and more. 
Salary: The salary range for this position is 30,400 - 38,000 per year, however the base salary offered may vary depending on location, job-related knowledge, skills, and experience.
 
Benefits: Vhi Health &amp; Dental Insurance, Wellbeing Scheme, LearnLux Financial Care, Employee Discounts, Pension, Tuition Reimbursement, Bright Horizons (Child Back-up care), ClassPass access, Sport/Gym Membership Contribution, Commuter Benefits, Holiday including tenure entitlement + Bank Holidays, and more.
Wayfairs Global Financial Operations team is seeking an Order to Cash Associate based in our Financial Shared Services team in Galway.  We are looking for the right individual to support the Global Order to Cash  team. The ideal candidate will bring strong organizational and planning skills, highly motivated, detail oriented, collaborative, self-motivated, customer oriented mindset,  a high sense of urgency and problem-
What You'll Do:

Responsible for supporting various billing processes, including fulfillment, forwarding, rebates, promotional billing, carrier invoicing, liquidations and marketing campaign billing.
Assisting with internal and external audits to improve accuracy and maintain a high standard of billing operations
Conducting invoicing audits to determine the validity and accuracy of charges
Investigate and resolve inquiries related to invoicing disputes or finance related topics to meet agreed-upon service level agreements (SLAs).
Partner &amp; collaborate with key stakeholders. 
Perform month end tasks in line with the month end deadlines
Support continuous improvement initiatives by reviewing processes regularly
Ensure all processes are documented and assist in the development of the function
Work with internal teams to devise appropriate metrics which show the health and performance of the function and the team where relevant 
Ad hoc responsibilities: 

Involvement in any project related to finance initiatives as required. 
Support any Ad-Hoc Billing Initiatives. 

Adherence to company policies and procedures. Understand internal accounting processes, practices, SOX and internal controls necessary to safeguard company assets and minimize exposure.

What You'll Need:

Bachelors Degree/Finance qualification desirable
A minimum of 1-3 years of experience working with invoicing or accounts Receivable environment. 
High proficiency in Excel and google sheets is required
Previous SQL or GBQ experience is preferred
Strong organization and planning skills
Problem identification and resolutions skills
Meticulous attention to detail and strong planning and forward-thinking capabilities
Demonstrated ability to anticipate needs and situations before they are fully developed.
Advanced proficiency in Google Enterprise Suite tools (calendar, mail drive, docs, sheets, slides, meet)
Excellent written, verbal, and presentation skills
Flexible and able to handle ad hoc issues that may arise.
Extremely high level of discretion pertaining to confidential information
Motivation to develop and maintain internal and external relationships
Setting and facilitating the achievement of department objectives.

#LI-HybridAbout Wayfair Inc.
Wayfair is one of the worlds largest online destinations for the home. Whether you work in our global headquarters in Boston, or in our warehouses or offices throughout the world, were reinventing the way people shop for their homes. Through our commitment to industry-leading technology and creative problem-solving, we are confident that Wayfair will be home to the most rewarding work of your career. If youre looking for rapid growth, constant learning, and dynamic challenges, then youll find that amazing career opportunities are knocking.
No matter who you are, Wayfair is a place you can call home. Were a community of innovators, risk-takers, and trailblazers who celebrate our differences, and know that our unique perspectives make us stronger, smarter, and well-positioned for success. We value and rely on the collective voices of our employees, customers, community, and suppliers to help guide us as we build a better Wayfair  and world  for all. Every voice, every perspective matters. Thats why were proud to be an equal opportunity employer. We do not discriminate on the basis of race, color, ethnicity, ancestry, religion, sex, national origin, sexual orientation, age, citizenship status, marital status, disability, gender identity, gender expression, veteran status, genetic information, or any other legally protected characteristic.
Your personal data is processed in accordance with our Candidate Privacy Notice (https://www.wayfair.com/careers/privacy). If you have any questions or wish to exercise your rights under applicable privacy and data protection laws, please contact us at dataprotectionofficer@wayfair.com."
3442354," Financial Operations Associate","https://www.wayfair.com/careers/jobs/8121539002?gh_jid=8121539002","Wayfair","Galway, IRE","No",1,"Full time","2025-08-31T02:00:52.938452Z","Financial Operations Associate
 
Galway, UK | Office-Based (MonThurs, Fri-WFH)Full-Time
Benefits: Vhi Health &amp; Dental Insurance, Wellbeing Scheme, LearnLux Financial Care, Employee Discounts, Pension, Tuition Reimbursement, Bright Horizons (Child Back-up care), ClassPass access, Sport/Gym Membership Contribution, Commuter Benefits, Holiday including tenure entitlement + Bank Holidays, and more. 
Salary: The salary range for this position is 30,400 - 38,000 per year, however the base salary offered may vary depending on location, job-related knowledge, skills, and experience.
 
Benefits: Vhi Health &amp; Dental Insurance, Wellbeing Scheme, LearnLux Financial Care, Employee Discounts, Pension, Tuition Reimbursement, Bright Horizons (Child Back-up care), ClassPass access, Sport/Gym Membership Contribution, Commuter Benefits, Holiday including tenure entitlement + Bank Holidays, and more.
Wayfairs Global Financial Operations team is seeking an Order to Cash Associate based in our Financial Shared Services team in Galway.  We are looking for the right individual to support the Global Order to Cash  team. The ideal candidate will bring strong organizational and planning skills, highly motivated, detail oriented, collaborative, self-motivated, customer oriented mindset,  a high sense of urgency and problem-
What You'll Do:

Responsible for supporting various billing processes, including fulfillment, forwarding, rebates, promotional billing, carrier invoicing, liquidations and marketing campaign billing.
Assisting with internal and external audits to improve accuracy and maintain a high standard of billing operations
Conducting invoicing audits to determine the validity and accuracy of charges
Investigate and resolve inquiries related to invoicing disputes or finance related topics to meet agreed-upon service level agreements (SLAs).
Partner &amp; collaborate with key stakeholders. 
Perform month end tasks in line with the month end deadlines
Support continuous improvement initiatives by reviewing processes regularly
Ensure all processes are documented and assist in the development of the function
Work with internal teams to devise appropriate metrics which show the health and performance of the function and the team where relevant 
Ad hoc responsibilities: 

Involvement in any project related to finance initiatives as required. 
Support any Ad-Hoc Billing Initiatives. 

Adherence to company policies and procedures. Understand internal accounting processes, practices, SOX and internal controls necessary to safeguard company assets and minimize exposure.

What You'll Need:

Bachelors Degree/Finance qualification desirable
A minimum of 1-3 years of experience working with invoicing or accounts Receivable environment. 
High proficiency in Excel and google sheets is required
Previous SQL or GBQ experience is preferred
Strong organization and planning skills
Problem identification and resolutions skills
Meticulous attention to detail and strong planning and forward-thinking capabilities
Demonstrated ability to anticipate needs and situations before they are fully developed.
Advanced proficiency in Google Enterprise Suite tools (calendar, mail drive, docs, sheets, slides, meet)
Excellent written, verbal, and presentation skills
Flexible and able to handle ad hoc issues that may arise.
Extremely high level of discretion pertaining to confidential information
Motivation to develop and maintain internal and external relationships
Setting and facilitating the achievement of department objectives.

#LI-HybridAbout Wayfair Inc.
Wayfair is one of the worlds largest online destinations for the home. Whether you work in our global headquarters in Boston, or in our warehouses or offices throughout the world, were reinventing the way people shop for their homes. Through our commitment to industry-leading technology and creative problem-solving, we are confident that Wayfair will be home to the most rewarding work of your career. If youre looking for rapid growth, constant learning, and dynamic challenges, then youll find that amazing career opportunities are knocking.
No matter who you are, Wayfair is a place you can call home. Were a community of innovators, risk-takers, and trailblazers who celebrate our differences, and know that our unique perspectives make us stronger, smarter, and well-positioned for success. We value and rely on the collective voices of our employees, customers, community, and suppliers to help guide us as we build a better Wayfair  and world  for all. Every voice, every perspective matters. Thats why were proud to be an equal opportunity employer. We do not discriminate on the basis of race, color, ethnicity, ancestry, religion, sex, national origin, sexual orientation, age, citizenship status, marital status, disability, gender identity, gender expression, veteran status, genetic information, or any other legally protected characteristic.
Your personal data is processed in accordance with our Candidate Privacy Notice (https://www.wayfair.com/careers/privacy). If you have any questions or wish to exercise your rights under applicable privacy and data protection laws, please contact us at dataprotectionofficer@wayfair.com."
3457667,"Tech Recruiter, Early Careers, Contract","https://www.wayfair.com/careers/jobs/8103697002?gh_jid=8103697002","Wayfair","Boston","No",1,"Contract","2025-08-31T02:00:52.938471Z","The base pay for this position is $31- $35 per hour. The base pay offered may vary depending on location, job-related knowledge, skills, and experience.
This position is full time and is a hybrid in-office role that works out of our Headquarters in Boston, MA. This role is not a virtual / remote position - 4 days in office/ 1 day WFH
This is an entry level recruiter role and is a contract position with potential to convert to a permanent position based on business needs.
The Wayfair Campus and Early Careers team is strategic to the company's overall success and continued growth. Our recruiters are true business partners and charged with finding, attracting, and hiring top talent into entry level roles across all parts of the company against a high bar for performance, potential, and culture.
This is your opportunity to join the new Early Careers Recruiting team under the broader Wayfair Campus &amp; Early Careers department! This role is perfect for the recruiter who is energized by the ever-changing landscape of attracting early career talent and hyper-focused with providing an impeccable candidate-experience. 
This role will focus on acquiring top talent in the early stages of their career (upcoming and recent graduates with up to 3 years of experience) and placing them into high priority roles within the organization. You will play a major role in growing Wayfairs brand and making this the place to be to kickstart careers. This role will partner closely with recruiters across our Talent organization to meet the fluctuating entry level needs of our hiring managers based on business priorities, attrition, and campus recruiting seasonality. This person will need to have working knowledge of Gen Z and candidate trends, and be able to translate these into strong recruitment strategies.
You may be a great match for this opportunity if you have an exceptional communication style coupled with an operational mindset that enables you to excel in the high-volume recruiting arena and the want to constantly be looking to learn, grow, and develop in your career. You should be comfortable with remaining agile and thrive in an ever-changing role and environment. 
What You'll Do

Full-cycle recruitment from attraction to onboarding, including: job posting, event planning and management, sourcing, interviewing, and closing candidates.
Proactively build a consistent pipeline of applicants for a variety of roles to meet the real-time hiring needs of the business.
Ensure an impressive, high-touch candidate experience from initial contact to offer decisions and sell strategy, including providing feedback to candidates throughout the interview process.
Partner with senior level stakeholders to deliver a best-in-class recruitment, interviewing, and hiring experience. 
Work to improve existing processes and develop innovative approaches for securing future talent.
Uphold an inclusive recruitment process in alignment with Wayfairs People Principles and commitment to DEI.
Manage and facilitate recruiting activities with external partners, including networking events and presentations to attract a high caliber and quantity of applicants.
Flex to support Wayfairs Summer Internship Program planning, in addition to various campus events and programs throughout the year, as needed #OneTeam.

What You'll Need

1+ years of experience in full cycle recruiting in a high-growth and fast-paced environment within campus, university, higher education, career services, or related high volume recruiting spaces.
Experience in recruiting for Tech positions (SWE, Machine Learning, Data Science), Commercial, Operations, or Finance positions is a plus.
Ability to manage strategic relationships with senior level stakeholder and excellent verbal and written communication skills.
In-depth direct sourcing expertise utilizing a range of methods and sources and experience promoting a compelling employment brand internally and externally.
A strong interest in emerging technology and the ability to integrate generative AI tools (e.g. Gemini) into daily recruiting tasks to drive efficiencies.
Proven organizational skills with attention to detail and the ability to prioritize and work well in an environment with competing demands.
Experience establishing relationships with external partners such as campus career centers &amp; promoting a compelling employment brand.
Proven record of finding efficiencies in your work without compromising the business relationship or candidate experience, with a comfortability to flex outside of your job duties to support the broader talent acquisition team.

About Wayfair Inc.
Wayfair is one of the worlds largest online destinations for the home. Whether you work in our global headquarters in Boston, or in our warehouses or offices throughout the world, were reinventing the way people shop for their homes. Through our commitment to industry-leading technology and creative problem-solving, we are confident that Wayfair will be home to the most rewarding work of your career. If youre looking for rapid growth, constant learning, and dynamic challenges, then youll find that amazing career opportunities are knocking.
No matter who you are, Wayfair is a place you can call home. Were a community of innovators, risk-takers, and trailblazers who celebrate our differences, and know that our unique perspectives make us stronger, smarter, and well-positioned for success. We value and rely on the collective voices of our employees, customers, community, and suppliers to help guide us as we build a better Wayfair  and world  for all. Every voice, every perspective matters. Thats why were proud to be an equal opportunity employer. We do not discriminate on the basis of race, color, ethnicity, ancestry, religion, sex, national origin, sexual orientation, age, citizenship status, marital status, disability, gender identity, gender expression, veteran status, genetic information, or any other legally protected characteristic.
Your personal data is processed in accordance with our Candidate Privacy Notice (https://www.wayfair.com/careers/privacy). If you have any questions or wish to exercise your rights under applicable privacy and data protection laws, please contact us at dataprotectionofficer@wayfair.com."
