"ID","Title","Link","Company","Location","Remote","Experience","EmploymentType","DatePosted","RoleDescription"
2763729,"Associate Commissioner for the Division of Preservation and Portfolio Management","https://jobs.smartrecruiters.com/CityOfNewYork/3743990007418686-associate-commissioner-for-the-division-of-preservation-and-portfolio-management","York","New York","No",4,"Full time","2025-04-11T01:54:58.291638Z","About the Agency:The New York City Department of Housing Preservation Development (HPD) promotes quality and affordability in the city's housing, and diversity and strength in the citys neighborhoods because every New Yorker deserves a safe, affordable place to live in a neighborhood they love.   -	We maintain building and resident safety and health -	We create opportunities for New Yorkers through housing affordability -	We engage New Yorkers to build and sustain neighborhood strength and diversity.  HPD is entrusted with fulfilling these objectives through the goals and strategies of Housing Our Neighbors: A Blueprint for Housing and Homelessness, Mayor Adams comprehensive housing framework. To support this important work, the administration has committed $5 billion in new capital funding, bringing the 10-year planned investment in housing to more than $22 billion the largest in the citys history. This investment, coupled with a commitment to reduce administrative and regulatory barriers, is a multi-pronged strategy to tackle New York Citys complex housing crisis, by addressing homelessness and housing instability, promoting economic stability and mobility, increasing homeownership opportunities, improving health and safety, and increasing opportunities for equitable growth. ________________________________________Your Team:The Office of Development (OOD) leads the agencys effort to create and preserve affordable housing as a critical part of Housing Our Neighbors: A Blueprint for Housing and Homelessness in collaboration with other HPD offices as well as other city, state and federal agencies. The OOD is comprised of eight divisions that administer a range of programs. These divisions include New Construction Finance, Special Needs Housing, Building and Land Development Services (BLDS), Homeownership Opportunities and Preservation, Preservation Finance, Portfolio Management &amp; Conversions, Compliance and Enforcement, and Housing Incentives.The Associate Commissioner for Preservation and Portfolio Management   will oversee the Division of Preservation Finance and the Division of Portfolio Management &amp; Conversions. The Division of Preservation Finance administers multiple financing programs including the Multifamily Housing Rehabilitation Loan Program (HRP), Green Housing Preservation Program (GHPP), Participation Loan Program (PLP), Housing Preservation Opportunities Program (HPO),  Neighborhood Pillars Program, the Third Party Transfer Program (TPT), Multi-Family Preservation Loan Program (MPLP), Community Partnerships for Affordable Renovation Program,  the Lead Hazard Reduction and Healthy Homes Program, HUD Multifamily Program (HUD MF), and LIHTC Preservation (Year 15) Program. The Division also oversees programs to provide technical assistance to multifamily owners. These programs facilitate the financial and physical viability, as well as affordability of privately-owned multi-family and single-family buildings throughout New York City. The Division of Portfolio Management &amp; Conversions (PMC) comprises of four teams, including Conversions, Requisitions, and Construction Monitoring. PMC is responsible for overseeing a large pipeline of HPD projects financed across the Divisions of New Construction, Special Needs Housing, Homeownership Opportunities and Preservation, and Preservation Finance. The division is responsible for proactively managing projects from closing through construction to permanent loan conversion and transition to other teams within HPD. Your Impact:As the Associate Commissioner of Preservation and Portfolio Management, you will play a key role in delivering on the Citys housing goals. The Associate Commissioner will oversee two Divisions comprising of ~120 people that are dedicated to preserving and producing affordable housing across the five boroughs. Using a host of financial and operational tools, the Associate Commissioner will optimize the departments ability to deliver high-quality affordable housing to those in New York that need it most. Your Role:Under the supervisions of the Deputy Commissioner, the Associate Commissioner for Preservation and Portfolio Management will oversee HPDs financing of the preservation of multifamily, single-family, and mixed-use affordable housing on both public and private sites. Additionally, the Associate Commissioner would oversee a pipeline of projects from financial closing through completion to ensure successful completion and conversion. This will be done by overseeing two divisions: Preservation Finance (PF) and Portfolio Management &amp; Conversions (PMC). The Associate Commissioner will work directly with the Assistant Commissioners of Preservation Finance and Portfolio Management &amp; Conversions, in close coordination with other divisions within the Office of Development and across HPD, and in partnership with the New York City Housing Development Corporation (HDC) and other City, state, and federal agencies. The Associate Commissioner will have the primary responsibility for directly managing and overseeing staff that directly engage with and negotiate with property owners, developers, lenders, and other development partners from the private and non-profit sectors. They will contribute to and at times lead development of agency strategy and public policy on a broad range of related topics, including developing new tools and resources to achieve housing preservation and stabilization goals, broadening and deepening affordability, providing permanent housing for homeless households, and expanding opportunities for affordable homeownership.Your Responsibilities:As the Associate Commissioner you will perform duties including, but not limited to the following:-	Overseeing the development and implementation of preservation programs to meet the goals of Housing New York and other initiatives. -	Establishing practices to proactively manage projects upon closing through successful transition to Asset Management and other teams. -	Strengthening the preservation and conversions project pipeline of buildings and portfolios, including through creating new programs and tools to expand the Agencys reach.-	Leading and provide guidance to staff implementing the PF and PMC financing programs and operations.-	Overseeing coordination withing HPD as well as numerous outside agency, lending and program partners. -	Establishing and successfully achieving housing production, completion, and conversion targets and associated budgets to meet the agency goals of the Housing Our Neighbors Blueprint.  -	Managing inquiries, both internal and external, about HPDs preservation and conversions activities. -	Ensuring the City is efficiently and effectively using City resources to achieve housing goals.-	Fostering innovation and solutions-driven programs, processes, and resources to advance the goals of Housing New York and other policy priorities.-	Contributing to the development, implementation, and tracking of strategic plans and housing policy for the Office of Development and the Agency.-	Streamlining and improving processes for HPD financed projects throughout the construction, completion, and conversion cycle. -	Other responsibilities and initiatives as may be required to ensure the success of PF and PMC, the Office of Development, and the Agency.Preferred skills:-	Extensive knowledge of financial tools and theory as well as facility in the use and analysis of financial models-	Extensive knowledge of affordable housing policy and programs at city, state and federal levels-	Extensive experience managing real estate transactions, particularly affordable housing transactions-	Excellent ability to build and maintain relationships with within and outside the agency, including working with developers/owners/borrowers, financial institutions, governmental agencies.  -	Demonstrated ability to manage large volume of work and meet deadlines in fast-paced environment. -	Demonstrated sound judgment and ability to make decisions-	Demonstrated supervisory skills and ability to lead large and diverse teams-	Excellent verbal and written communication skills-	Excellent analytical, organizational, and quantitative abilitiesASSISTANT COMMISSIONER (NEIGHB - 95558Qualification Requirements1.	Graduation form an accredited college with a baccalaureate degree and four (4) years of progressively responsible supervisory, administrative, or consultative experience in city planning, urban renewal, real estate or mortgage financing, including one (1) year of executive- level experience directing broad and technically complex housing rehabilitation loan programs using government or private sector funding. Graduate work in an appropriate field may be substituted for up to (2) years of the general experience required; or 2.	Education and/or experience equivalent to 1 above.The City of New York is an inclusive equal opportunity employer committed to recruiting and retaining a diverse workforce and providing a work environment that is free from discrimination and harassment based upon any legally protected status or protected characteristic, including but not limited to an individual's sex, race, color, ethnicity, national origin, age, religion, disability, sexual orientation, veteran status, gender identity, or pregnancy."
2760273,"HIGH PRESSURE PLANT TENDER","https://jobs.smartrecruiters.com/CityOfNewYork/3743990007401486-high-pressure-plant-tender","York","New York","No",10,"Full time","2025-04-11T01:54:58.291670Z","DCAS's mission is to make city government work for all New Yorkers. From managing New York Citys most iconic courthouses and municipal buildings, to purchasing over $1 billion annually in goods and services for more than 80 City agencies   what we do ensures that all agencies can deliver on their mission. Our reach touches every facet of city government and is instrumental to the successful day-to-day operations of the City of New York.Our commitment to equity, effectiveness and sustainability guides our work providing City agencies with the critical resources and support needed to succeed, including:- Recruiting, hiring, and training City employees.- Managing 55 public buildings.- Acquiring, selling, and leasing City property.- Purchasing over $1 billion in goods and services for City agencies.- Overseeing the greenest municipal vehicle fleet in the country.- Leading the City's efforts to reduce carbon emissions from government operations.When you work at DCAS, you're not just working for one agency, but in service of them all. It's an opportunity to provide impactful support, quality customer service, and help protect the future of New York City for generations to come. Visit our website at nyc.gov/dcas to learn more about the work we do.Background:The Mechanical Maintenance and Operations group is responsible for the preventative maintenance, repairs and operations of various mechanical systems within 55 DCAS-managed court and non-court buildings. They are also responsible for maintaining all heating, ventilation, and air conditioning equipment for safe, reliable, and efficient operation, including seasonal tune-ups; filter, belt, steam trap replacement, lubrication and perform emergency repairs on a 24-hour basis.Responsibilities:High Pressure Plant Tenders, under direct supervision, tend oil, gas or coal fired high-pressure boilers, incinerator furnaces and related equipment, and assist in the maintenance and repair of this equipment. May be assigned to inspect, maintain and repair heating, ventilation, refrigeration, air conditioning and related auxiliary systems and equipment. They hand fire high-pressure boilers using solid fuels, and stoker equipment and incinerator furnaces using burnable refuse; clean fires; tend and operate stoker equipment, oil-, gas-, or coal-fired high-pressure boilers and incinerator furnaces, and related equipment; maintain, clean, repair and assist in the inspection and testing of high-pressure boilers, incinerators, auxiliaries and related equipment; maintain, clean, repair and/or tend to, and assist in the inspection and testing of equipment and systems used in heating, ventilation, refrigeration, air conditioning and related auxiliary equipment, such as cooling towers, air handlers, chilled water pumps, air cleaners and filters, fans, heat exchangers, tubes, air treatment assemblies, humidifiers/dehumidifiers, and controls; may dismantle and/or assemble equipment associated with heating, ventilation, refrigeration, air conditioning and mechanical systems to make it operational; requisition parts as required; and may operate a motor vehicle. All High Pressure Plant Tenders perform related work.To Apply: Only individuals who are currently serving permanently in the High Pressure Plant Tender title or reachable on the High Pressure Plant Tender civil service list may apply.	Please go to www.nyc.gov/jobs or www.nyc.gov/ess for current NYC employees and search for Job ID# :625161 NO PHONE CALLS, FAXES OR PERSONAL INQUIRIES PERMITTED. NOTE: ONLY THOSE CANDIDATES UNDER CONSIDERATION WILL BE CONTACTEDHIGH PRESSURE PLANT TENDER - 916501. Two years of full-time satisfactory experience within the last ten years operating and maintaining high pressure boilers or the equivalent marine experience; or 2. Not less than one year of experience as described in ""1"" above plus sufficient training of a relevant nature acquired in an approved trade or vocational high school to make up the equivalent of the remaining required experience. Six months of acceptable experience will be credited for each year of approved trade or vocational high school.The City of New York is an inclusive equal opportunity employer committed to recruiting and retaining a diverse workforce and providing a work environment that is free from discrimination and harassment based upon any legally protected status or protected characteristic, including but not limited to an individual's sex, race, color, ethnicity, national origin, age, religion, disability, sexual orientation, veteran status, gender identity, or pregnancy."
2760272,"Stationary Engineer","https://jobs.smartrecruiters.com/CityOfNewYork/3743990007401496-stationary-engineer","York","New York","No","Not specified","Full time","2025-04-11T01:54:58.291703Z","DCAS's mission is to make city government work for all New Yorkers. From managing New York Citys most iconic courthouses and municipal buildings, to purchasing over $1 billion annually in goods and services for more than 80 City agencies   what we do ensures that all agencies can deliver on their mission. Our reach touches every facet of city government and is instrumental to the successful day-to-day operations of the City of New York.Our commitment to equity, effectiveness, and sustainability guides our work providing City agencies with the critical resources and support needed to succeed, including:- Recruiting, hiring, and training City employees.- Managing 55 public buildings.- Acquiring, selling, and leasing City property.- Purchasing over $1 billion in goods and services for City agencies.- Overseeing the greenest municipal vehicle fleet in the country.- Leading the City's efforts to reduce carbon emissions from government operations.When you work at DCAS, you're not just working for one agency, but in service of them all. It's an opportunity to provide impactful support, quality customer service, and help protect the future of New York City for generations to come. Visit our website at nyc.gov/dcas to learn more about the work we do.Facility Management actively manages and operates approximately 55 City-owned court and office buildings totaling 15 million square feet. These buildings are located throughout the City and include City Hall, the Manhattan and Brooklyn Municipal Buildings, and each of the five Borough Halls. This line of service provides all necessary building services to keep these buildings fully functional and operational. Mechanical Maintenance and Operations - responsible for the preventive maintenance, repair, and operation of the installed mechanical systems in the DCAS portfolio. This includes heating, ventilation and air conditioning equipment, plus backup electrical generators, fire suppression, and domestic water supply.Responsibilities:- Operates, maintains and adjusts boilers, furnaces, engines, pumps, heat exchangers, generators, motors, equipment for heating, ventilation, air conditioning, lighting and associated equipment   in public buildings, municipal pumping stations and incinerators;- Takes responsible charge of a watch and directs subordinate personnel;- May operate control consoles in control rooms;- Makes periodic inspections of equipment and minor repairs to such equipment;- Performs preventive maintenance;- Prepares requisitions for materials and spare parts;- Reads and logs meters, gauges and other recording devices;- Instructs and trains subordinates and other personnel;- As directed, inspects low pressure boilers in accordance with a unified inspection procedure instituted by the New York City Department of Buildings. To Apply:Please go to www.nyc.gov/jobs or www.nyc.gov/ess for current NYC employees and search for Job ID#: 625174NO PHONE CALLS, FAXES OR PERSONAL INQUIRIES PERMITTED. NOTE: ONLY THOSE CANDIDATES UNDER CONSIDERATION WILL BE CONTACTEDSTATIONARY ENGINEER - 91644A valid license for High Pressure Boiler Operating Engineer issued by the New York City Department of Buildings. This license must be maintained for the duration of employment.The City of New York is an inclusive equal opportunity employer committed to recruiting and retaining a diverse workforce and providing a work environment that is free from discrimination and harassment based upon any legally protected status or protected characteristic, including but not limited to an individual's sex, race, color, ethnicity, national origin, age, religion, disability, sexual orientation, veteran status, gender identity, or pregnancy."
2760271,"HIGH PRESSURE PLANT TENDER","https://jobs.smartrecruiters.com/CityOfNewYork/3743990007401506-high-pressure-plant-tender","York","New York","No",10,"Full time","2025-04-11T01:54:58.291733Z","DCAS's mission is to make city government work for all New Yorkers. From managing New York Citys most iconic courthouses and municipal buildings, to purchasing over $1 billion annually in goods and services for more than 80 City agencies   what we do ensures that all agencies can deliver on their mission. Our reach touches every facet of city government and is instrumental to the successful day-to-day operations of the City of New York.Our commitment to equity, effectiveness and sustainability guides our work providing City agencies with the critical resources and support needed to succeed, including:- Recruiting, hiring, and training City employees.- Managing 55 public buildings.- Acquiring, selling, and leasing City property.- Purchasing over $1 billion in goods and services for City agencies.- Overseeing the greenest municipal vehicle fleet in the country.- Leading the City's efforts to reduce carbon emissions from government operations.When you work at DCAS, you're not just working for one agency, but in service of them all. It's an opportunity to provide impactful support, quality customer service, and help protect the future of New York City for generations to come. Visit our website at nyc.gov/dcas to learn more about the work we do.Background:The Mechanical Maintenance and Operations group is responsible for the preventative maintenance, repairs and operations of various mechanical systems within 55 DCAS-managed court and non-court buildings. They are also responsible for maintaining all heating, ventilation, and air conditioning equipment for safe, reliable, and efficient operation, including seasonal tune-ups; filter, belt, steam trap replacement, lubrication and perform emergency repairs on a 24-hour basis.Responsibilities:High Pressure Plant Tenders, under direct supervision, tend oil, gas or coal fired high-pressure boilers, incinerator furnaces and related equipment, and assist in the maintenance and repair of this equipment. May be assigned to inspect, maintain and repair heating, ventilation, refrigeration, air conditioning and related auxiliary systems and equipment. They hand fire high-pressure boilers using solid fuels, and stoker equipment and incinerator furnaces using burnable refuse; clean fires; tend and operate stoker equipment, oil-, gas-, or coal-fired high-pressure boilers and incinerator furnaces, and related equipment; maintain, clean, repair and assist in the inspection and testing of high-pressure boilers, incinerators, auxiliaries and related equipment; maintain, clean, repair and/or tend to, and assist in the inspection and testing of equipment and systems used in heating, ventilation, refrigeration, air conditioning and related auxiliary equipment, such as cooling towers, air handlers, chilled water pumps, air cleaners and filters, fans, heat exchangers, tubes, air treatment assemblies, humidifiers/dehumidifiers, and controls; may dismantle and/or assemble equipment associated with heating, ventilation, refrigeration, air conditioning and mechanical systems to make it operational; requisition parts as required; and may operate a motor vehicle. All High Pressure Plant Tenders perform related work.To Apply:Only individuals who are currently serving permanently in the High Pressure Plant Tender title or reachable on the High Pressure Plant Tender civil service list may apply. Please go to www.nyc.gov/jobs or www.nyc.gov/ess for current NYC employees and search for Job ID#: 628721 NO PHONE CALLS, FAXES OR PERSONAL INQUIRIES PERMITTED.NOTE: ONLY THOSE CANDIDATES UNDER CONSIDERATION WILL BE CONTACTEDHIGH PRESSURE PLANT TENDER - 916501. Two years of full-time satisfactory experience within the last ten years operating and maintaining high pressure boilers or the equivalent marine experience; or 2. Not less than one year of experience as described in ""1"" above plus sufficient training of a relevant nature acquired in an approved trade or vocational high school to make up the equivalent of the remaining required experience. Six months of acceptable experience will be credited for each year of approved trade or vocational high school.The City of New York is an inclusive equal opportunity employer committed to recruiting and retaining a diverse workforce and providing a work environment that is free from discrimination and harassment based upon any legally protected status or protected characteristic, including but not limited to an individual's sex, race, color, ethnicity, national origin, age, religion, disability, sexual orientation, veteran status, gender identity, or pregnancy."
