"ID","Title","Link","Company","Location","Remote","Experience","EmploymentType","DatePosted","RoleDescription"
2763743,"HOUSING MANAGER (HA)","https://jobs.smartrecruiters.com/CityOfNewYork/3743990007418546-housing-manager-ha-","York","New York","No",6,"Full time","2025-04-11T01:54:58.291195Z","Under the direction of the Neighborhood Administrator, the Property Manager will perform work of a difficult and responsible nature, with oversight of Management and Maintenance Operations at a housing development. In addition, the Property Manager is directly responsible for all aspects of the development to ensure that residents are provided with quality housing, a safe environment, and availability to community-based services. Specific duties and responsibilities include but are not limited to: General Property Administration - Maintain a professional setting with regularly scheduled office hours in the property business office; promote availability either personally, or through other site personnel for emergencies. Rent Collection/Legal Action - Ensure timely collection of rent payments and ensure processing of documents for timely legal action for rent delinquents and holdover cases, and the data entries of related computer records; authorize requests for rent adjustments; obtain verifications and maintain computer files in accordance with NYCHA procedures. Annual Income Reviews - Ensure the completion of annual reviews including the submission of non- verifiable cases via Seibel to Office of Tenancy Administration. Uncollected Accounts - Ensure uncollected accounts are processed in the required timeframe as per NYCHA policy. Visual Assessments - Ensure visual lead assessments are completed by trained staff and the appropriate repairs and follow up is conducted for all work orders in Maximo. Occupancy and Vacancy - Ensure vacant apartments are prepared in accordance to policy and procedures and are available for occupancy; utilize professional marketing techniques when offering units; maintain high occupancy levels by leasing timely; maintain records of assigned units status in Tenant Turnover Log (TTL). Procurement - Maintain sufficient materials, services and staffing to complete apartment, corrective maintenance, preventive maintenance repairs timely and consistently; ensure all steps to procure goods and services are followed in accordance to NYCHA procedures. Safety &amp; Security - Observe safety guidelines to ensure safety and security of residents and staff. Repair/Work Orders - Ensure resident repair requests are responded to within prescribed guidelines; coordinate the completion of repairs, and close work orders in accordance with established procedures. Property Maintenance - Conduct property inspections, which include move-ins, housekeeping, and grounds to assure adherence to established satisfactory standards. PHAS - In conjunction with the Property Maintenance Supervisor, formulate and implement a plan for successful PHAS inspection(s) and corrective action plans within the required timeframe in accordance with NYCHA policies and procedures. Resident Relations - Manage resident engagement to ensure compliance with HUD regulations. Staff Supervision/Training - Ensure staffing levels are met, develop and secure training, supervise and discipline staff as appropriate; participate in pre-employment interviews and hiring processes. Reporting- Ensure the timely and accurate submission of various management reports as needed. Additional Information1.	For NYCHA employees: This position is open as a promotional opportunity only. It is not open on a direct transfer (lateral) basis.  2.	NYCHA employees applying for promotional, title or level change opportunities must have served a period of one year at current location and in current title and level (if applicable). 3.	NYCHA provides benefits that include a choice of medical coverage plans, deferred compensation plans and a defined pension benefit plan as a member of the New York City Employees 4.	NYCHA residents are encouraged to apply.NOTE: IF THIS APPOINTMENT IS MADE ON A PROVISIONAL BASIS PURSUANT TO  65 OF THE NYS CIVIL SERVICE LAW, NO TENURE OR PERMANENCE ACCRUES TO AN INCUMBENT IN THIS POSITION BY VIRTUE OF SUCH APPOINTMENT. NOTE: This position is open to qualified persons with a disability who are eligible for the 55-a Program. Please indicate in your cover letter that you would like to be considered for the position under the 55-a Program. For detailed information regarding the 55-a Program, click on the link below:https://bit.ly/55aProgramPlease read this posting carefully to make certain you meet the minimum qualification requirements before applying to this position.HOUSING MANAGER (HA) - 802101. A baccalaureate degree from an accredited college, and three years of full-time satisfactory supervisory and/or administrative experience in housing management at a development or developments containing at least 150 apartments, including overseeing the performance of duties such as: interviewing applicants, determining eligibility; gathering and evaluating information to resolve complaints; collecting rents; and/or resolving tenant related problems; or  2. A four-year high school diploma or its educational equivalent, and six years of the full-time satisfactory experience as described in ""1"" above; or  3. A satisfactory equivalent combination of education and experience as described in ""1"" or ""2"" above. Undergraduate college credits may be substituted for experience on the basis of 30 semester credits from an accredited college for one year of full-time satisfactory experience. However, all candidates must have a four-year high school diploma or its educational equivalent.The City of New York is an inclusive equal opportunity employer committed to recruiting and retaining a diverse workforce and providing a work environment that is free from discrimination and harassment based upon any legally protected status or protected characteristic, including but not limited to an individual's sex, race, color, ethnicity, national origin, age, religion, disability, sexual orientation, veteran status, gender identity, or pregnancy."
2763742,"Systems Engineer","https://jobs.smartrecruiters.com/CityOfNewYork/3743990007418556-systems-engineer","York","New York","No",6,"Full time","2025-04-11T01:54:58.291217Z","Note: Only those serving in the permanent civil service title of Certified IT Admin. (Lan/Wan) will be considered. The Fire Department of the City of New York (FDNY) is the largest Fire Department in the United States and universally is recognized as the world's busiest and most highly skilled emergency response agency. The Department's main goal is to provide fire protection, emergency medical care, and other critical public safety services to residents and visitors in the five boroughs.  FDNY members are sworn to serve and protect life and property and the Department works to continually educate the public in fire, life safety and disaster preparedness, along with enforcing public safety codes. Since its inception in 1865, FDNY has helped lead efforts to make New York the safest big city in the nation. This accomplishment requires a steadfast and daily commitment to maintaining the Department's core values. The Fire Department, City of New York (FDNY), seeks a full-time Systems Engineer in the Bureau of Technology Development and Systems. Reporting directly to the Manager, Servers and Systems, the successful candidate will:Manage Virtualization infrastructure including computer hardware, storage and network integration- Manage VDI infrastructure- Serve as a subject matter expert in the management of Windows Operating Systems and virtual appliances- Architect new IT solutions in response to business needs- Automate common tasks using Powershell- Troubleshoot production issues including reviewing logs, performing and analyzing network packet captures and correlating events across disparate systems- Manage shared infrastructure services including Active Directory, DNS, Backup software, monitoring and security tools- Assist with projects involving the implementation, migration and upgrade of it systems- Maintain a consistent focus on the security of the IT ecosystem including password security, patching and hardening of attack exposure.Special Working Conditions: May be required to work shifts including nights, Saturdays, Sundays, and holidays.CERTIFIED IT ADMINISTRATOR (LA - 13652Professional/vendor certification(s) in local area network administration that is required for the position to be filled. In addition, all candidates must have the following:1. A baccalaureate degree from an accredited college, and two years of satisfactory full-time (not classroom based) experience in local area network and/or wide area network planning, design, configuration, installation, implementation, troubleshooting, integration, performance monitoring, maintenance, enhancement, and security management; or2. A four-year high school diploma or its educational equivalent and six years of satisfactory full-time (not classroom based) information technology experience of which at least 2 years must have been as described in ""1"" or  3. A satisfactory equivalent of education and/or experience equivalent to ""1"" or ""2"" above. Education may be substituted for experience on the basis that 30 undergraduate semester credits from an accredited college is equivalent to 6 months of experience. A masters degree in computer science or a related field from an accredited college may be substitute for one year of experience. However, all candidates must have at least one year of satisfactory (not classroom based) full-time information technology experience as described in ""1"" above.  Note:  In addition to meeting the minimum Qualification Requirements: Incumbents may be required to update existing and/or obtain additional professional industry-standard certification(s) for current and future technical environments(s) in which they may be assigned to work, as determined by the employing agency.The City of New York is an inclusive equal opportunity employer committed to recruiting and retaining a diverse workforce and providing a work environment that is free from discrimination and harassment based upon any legally protected status or protected characteristic, including but not limited to an individual's sex, race, color, ethnicity, national origin, age, religion, disability, sexual orientation, veteran status, gender identity, or pregnancy."
2763741,"Project Executive","https://jobs.smartrecruiters.com/CityOfNewYork/3743990007418566-project-executive","York","New York","No",6,"Full time","2025-04-11T01:54:58.291250Z","Hours: Full-Time Positions  35 Hours Work Location: 777 3rd Avenue, Manhattan, NY 10017The NYC Department of Design and Construction, Borough Based Jails (BBJ) Program, seeks a Project Executive (Design). The selected candidate will oversee design management for a multi-billion-dollar Design-Build program, including planning, scheduling, cost, design, and construction administration. The Project Executive will be responsible for management of all aspects of design and construction administration related to the City's BBJ program, including oversight of the Program Management Consultant. In addition, the candidate will be responsible for overseeing the development and execution of strategies to facilitate implementation and efficiently expedite this high-profile program through the various regulatory agencies, in close collaboration with several Sponsor Agencies and project stakeholders; reviewing and implementing research and development initiatives, including development of design/construction documentation/specification, vendor and Design-Builder payment processing; developing strategies for stakeholder communication which include social media, on-site mock-ups, media updates, work structure and community planning. The candidate will update the BBJ team on all project-related updates and issues; and liaise with sponsor agencies and all project stakeholders to review design, contract procurement, community concerns, and construction-related issues; manage a team consisting of engineers, architects, design-builders, project management consulting and administrative personnel; and participate in various agency task forces relating to relevant initiatives.Authorization to work in the United States is required for this position. NYC Department of Design and Construction does not provide sponsorship for international employees for visa applications, extensions, or status changes, including STEM/OPT visas. Applicants are responsible for ensuring that they meet all qualifying requirements for this position, at the time of application.All applicants, including City Employees: Please go to NYC Government Jobs | Explore Careers | City of New York, go to Search for Open Jobs, and type in the Job ID # listed above. Submit job application as prompted. Do not apply via Employee Self-Service (ESS), e-mail, mail, or fax your resume to DDC directly.ADMIN ARCHITECT (NON MGRL) M-1 - 1000AA  valid New York State Registration as an Architect is required. In addition, candidates must have six ( 6 ) years of full-time paid experience in architectural work, at least two (2) years of which shall have been as an administrative architect.The City of New York is an inclusive equal opportunity employer committed to recruiting and retaining a diverse workforce and providing a work environment that is free from discrimination and harassment based upon any legally protected status or protected characteristic, including but not limited to an individual's sex, race, color, ethnicity, national origin, age, religion, disability, sexual orientation, veteran status, gender identity, or pregnancy."
2763740,"Senior Rackets Investigator - CIB","https://jobs.smartrecruiters.com/CityOfNewYork/3743990007418576-senior-rackets-investigator-cib","York","New York","No",3,"Full time","2025-04-11T01:54:58.291279Z","The Office of the District Attorney, Bronx County (BXDA) is charged with the twin goals of ensuring public safety and striving for equal justice for the over 1.4 million members of the Bronx County community. By Pursuing Justice with Integrity, the BXDA places a focus on assistance for crime victims while simultaneously ensuring fairness to defendants. Moreover, the BXDA aims to balance the need to seek appropriate punishment for certain crimes while recognizing when punitive measures do not adequately advance justice. By recognizing these significant distinctions and acting accordingly, BXDA has established a standard of excellence in the representation of the Bronx community at large, which continues to grow stronger every day. In furtherance of this mission, the BXDA seeks experienced and enthusiastic, well-qualified investigator to collaborate with experienced attorneys in the Conviction Integrity Bureau, which reinvestigates claims of actual innocence and wrongful conviction. These investigations comprise the Offices most serious cases, the majority of which are homicides where new, credible, viable, evidence-based leads of wrongful conviction exist. The Special Criminal Investigator will work in collaboration with the attorneys of the Conviction Integrity Bureau to determine which cases are appropriate for reinvestigation. Where indicated, the Special Criminal Investigator will develop investigation strategies and lead the execution of reinvestigations, including but not limited to locating and interviewing witnesses and locating evidence for forensic testing.JOB RESPONSIBILITIES:-Review case files and in conjunction with ADAs in the Bureau create an investigation plan-Identify and locate high value target witnesses-Interview witnesses in the field both locally, nationally, and internationally-Locate evidence and deliver it for forensic testing-Communicate and coordinate with local and federal law enforcement agenciesCANDIDATE MUST POSSESS A VALID NYS DRIVERS LICENCE.The City of New York offers a comprehensive benefits package including health insurance for the employee and his/her spouse or domestic partner and unemancipated children under age 26, union benefits such as dental and vision coverage, paid annual leave and sick leave, paid holidays, a pension, and optional savings and pre-tax programs such as Deferred Compensation, IRA, and a flexible spending account.SENIOR RACKETS INVESTIGATOR - 308311. Graduation from high school or its equivalent and three years of full-time, paid experience in police enforcement or investigative work, one year of which must have been in rackets or police investigative work.  2. Education and/or experience which is equivalent to ""1"". However, all candidates are required to have one year of full-time, paid experience in rackets or police investigative work.The City of New York is an inclusive equal opportunity employer committed to recruiting and retaining a diverse workforce and providing a work environment that is free from discrimination and harassment based upon any legally protected status or protected characteristic, including but not limited to an individual's sex, race, color, ethnicity, national origin, age, religion, disability, sexual orientation, veteran status, gender identity, or pregnancy."
2763739,"CODE-Clerical Support","https://jobs.smartrecruiters.com/CityOfNewYork/3743990007418586-code-clerical-support","York","New York","No",3,"Full time","2025-04-11T01:54:58.291312Z","About the Agency:The NYC Department Housing Preservation &amp; Development (HPD) promotes quality and affordability in the city's housing, and diversity and strength in the citys neighborhoods because every New Yorker deserves a safe, affordable place to live in a neighborhood they love. -	We maintain building and resident safety and health-	We create opportunities for New Yorkers through housing affordability-	We engage New Yorkers to build and sustain neighborhood strength and diversity. HPD is entrusted with fulfilling these objectives through the goals and strategies of Housing Our Neighbors: A Blueprint for Housing and Homelessness, Mayor Adams comprehensive housing framework. To support this important work, the administration has committed $5 billion in new capital funding, bringing the 10-year planned investment in housing to $22 billion the largest in the citys history. This investment, coupled with a commitment to reduce administrative and regulatory barriers, is a multi-pronged strategy to tackle New York Citys complex housing crisis, by addressing homelessness and housing instability, promoting economic stability and mobility, increasing homeownership opportunities, improving health and safety, and increasing opportunities for equitable growth.Your Team:The Office of Enforcement and Neighborhood Services (OENS) leads the agencys effort to work closely with other HPD divisions and outside community partners to identify buildings in distress, assess and develop appropriate strategies to address those properties and work closely with responsible owners to develop a plan to improve conditions and return buildings to firm financial footing and physical health. OENS uses enforcement tools within its Division of Code Enforcement, Housing Litigation Division, Emergency Operations and Enhanced Enforcement, and the Division of Neighborhood Preservation to ensure compliance with legal and regulatory obligations.The Office of Enforcement and Neighborhood Services is composed of seven divisions: Data Management &amp; Technology (DMT), Division of Neighborhood Preservation (DNP), Administration &amp; Internal Compliance (AIC), Housing Litigation Division (HLD), Division of Code Enforcement (DCE), and Emergency Operations and Enhanced Enforcement Division (EOD) and Division of Emergency Housing Services (EHS).  Your Impact:As the Code Associate for the Division of Code Enforcement, you will assist the division in assuring owner compliance with the New York city Housing Maintenance Code (HMC) and the New York State Multiple Dwelling Law (MDL) in privately-owned, multiple-unit dwellings and tenant-occupied apartments in one- and two-family houses throughout the City to promote quality housing for New Yorkers. Your Role:Under the direction within the Division of Code Enforcement, the selected candidate responsibilities will include, but not be limited to the following;Your Responsibilities:-	Conducting research and responding to inquiries from tenants and landlords-	Updating tracking reports and inventory logs-	Performing tenant callbacks to verify if conditions have been corrected-	Scheduling inspection appointments-	Performing data entry and processing dismissal request, notice of violations, and mold documents-	Facilitating customer service, such as: handling telephone inquiries from tenants regarding complaints and inspection results-	Special projectsPreferred Skills: -	Must possess excellent written and verbal communications skills.-	Must be proficient with PC software applications, such as Excel and Microsoft Word.-	Candidates with bi-lingual skillsNote: Candidates may be assigned to any office within the 5 boroughs and may be assigned to work evenings and weekends.COMMUNITY ASSOCIATE - 56057Qualification Requirements 1. High school graduation or equivalent and three years of experience in community work or community centered activities in an area related to duties described above; or 2. Education and/or experience which is equivalent to ""1"" above.The City of New York is an inclusive equal opportunity employer committed to recruiting and retaining a diverse workforce and providing a work environment that is free from discrimination and harassment based upon any legally protected status or protected characteristic, including but not limited to an individual's sex, race, color, ethnicity, national origin, age, religion, disability, sexual orientation, veteran status, gender identity, or pregnancy."
