"ID","Title","Link","Company","Location","Remote","Experience","EmploymentType","DatePosted","RoleDescription"
2763764,"Child Care Investigator, Bureau of Childcare","https://jobs.smartrecruiters.com/CityOfNewYork/3743990007418356-child-care-investigator-bureau-of-childcare","York","New York","No",5,"Full time","2025-04-11T01:54:58.290501Z","Established in 1805, the New York City Department of Health and Mental Hygiene (the NYC Health Department) is the oldest and largest health department in the country. Our mission is to protect and improve the health of all New Yorkers, in service of a vision of a city in which all New Yorkers can realize their full health potential, regardless of who they are, how old they are, where they are from, or where they live. As a world-renowned public health agency with a history of building transformative public health programming and infrastructure, innovating in science and scholarship to advance public health knowledge, and responding to urgent public health crises   from New York Citys yellow fever outbreak in 1822, to the COVID-19 pandemic   we are a hub for public health innovation, expertise, and programs, and services. We serve as the population health strategist, and policy, and planning authority for the City of New York, while also having a vast impact on national and international public policy, including programs and services focused on food and nutrition, anti-tobacco support, chronic disease prevention, HIV/AIDS treatment, family and child health, environmental health, mental health, and racial and social justice work, among others. Our Agencys five strategic priorities, building off a recently-completed strategic planning process emerging from the COVID-19 emergency, are: 1) To re-envision how the Health Department prepares for and responds to health emergencies, with a focus on building a response-ready organization, with faster decision-making, transparent public communications, and stronger surveillance and bridges to healthcare systems 2) Address and prevent chronic and diet-related disease, including addressing rising rates of childhood obesity and the impact of diabetes, and transforming our food systems to improve nutrition and enhance access to healthy foods 3) Address the second pandemic of mental illness including: reducing overdose deaths, strengthening our youth mental health systems, and supporting people with serious mental illness 4) Reduce black maternal mortality and make New York a model city for womens health 5) Mobilize against and combat the health impacts of climate change Our 7,000-plus team members bring extraordinary diversity to the work of public health. True to our value of equity as a foundational element of all of our work, and a critical foundation to achieving population health impact in New York City, the NYC Health Department has been a leader in recognizing and dismantling racisms impacts on the health of New Yorkers and beyond. In 2021, the NYC Board of Health declared racism as a public health crisis. With commitment to advance anti-racist public health practices that dismantle systems that perpetuate inequitable power, opportunity and access, the NYC Health Department continues to work in and with communities and community organizations to increase their access to health services and decrease avoidable health outcomes.The New York City Department of Health and Mental Hygiene's Division of Environmental Health works to prevent and control illness and injury related to environmental and occupational health risks through outreach, education, surveillance and enforcement.  With staff of 1,000, the Division covers a broad range of subject matter, including oversight of environmental investigations, lead poisoning, injury prevention, occupational health, food safety, child care, radiation control, recreational and drinking water quality, air quality, climate health, vector control, veterinary public health and pest control. The Bureau of Child Care ensures that child care services in New York City operate in compliance with the New York City Health Code and New York State Social Service regulations and are licensed or permitted as required by law. The Bureau routinely monitors child care programs to protect the health and safety of children while in the child care environment, and actively works to improve and expand access to high quality programs which early childhood development and learning. The Bureau seeks to hire an Associate Investigator to respond to allegations of provider activity associated with child care programs that are unsafe, unhealthy or unregulated. The Child Care Investigator will also search for child care providers who are operating illegally, unregulated, and thus more likely to create an environment with health and safety risks to children. DUTIES WILL INCLUDE BUT NOT BE LIMITED TO: Investigate allegations of illegal child care operations throughout the five boroughs of New York City. Conduct intense surveillance in and around commercial and residential buildings of suspected illegal operations. Interview childcare operators, staff, witnesses, families and children involved in complaints involving allegations of illegal operations. Collaborate with other investigative agencies such as ACS, DOI, NYPD, FDNY. Examine and analyze records and files of the child care program to ensure compliance with regulations. Maintain confidential records and files for all investigations performed; Must be prepared to produce all required records and evidence to substantiate related legal processes. Conduct public education and outreach efforts conveying the importance of choosing licensed providers and reporting to the NYC Health Department programs that may be unsafe, unhealthy or operating illegally. Travel throughout New York City using mass transit or a personal car and carry approximately 15 pounds of inspection equipment. **IMPORTANT NOTES TO ALL CANDIDATES:Please note: If you are called for an interview you will be required to bring to your interview copies of original documentation, such as:- A document that establishes identity for employment eligibility, such as: A Valid U.S. Passport, Permanent Resident Card/Green Card, or Drivers license. - Proof of Education according to the education requirements of the civil service title. - Current Resume - Proof of Address/NYC Residency dated within the last 60 days, such as: Recent Utility Bill (i.e. Telephone, Cable, Mobile Phone) Additional documentation may be required to evaluate your qualification as outlined in this postings Minimum Qualification Requirements section. Examples of additional documentation may be, but not limited to: college transcript, experience verification or professional trade licenses.If after your interview you are the selected candidate you will be contacted to schedule an on-boarding appointment. By the time of this appointment you will be asked to produce the originals of the above documents along with your original Social Security card. **LOAN FORGIVENESSAs a prospective employee of the City of New York, you may be eligible for federal loan forgiveness programs and state repayment assistance programs. For more information, please visit the U.S. Department of Educations website at StudentAid.gov/PSLF.""FINAL APPOINTMENTS ARE SUBJECT TO OFFICE OF MANAGEMENT &amp; BUDGET APPROVAL.This position MAY be eligible for remote work up to two days per week, pursuant to the Remote Work Pilot Program.ASSOCIATE INVESTIGATOR (NOT PR - 311211. A four-year high school diploma or its educational equivalent and five years of satisfactory, full-time experience as an investigator evaluating credit worthiness, searching for assets, verifying information concerning education, experience, and other personal qualifications bearing upon character and fitness for employment, or performing investigations involving the research, compilation and/or location of evidence or information in order to build a case or uncover activities of a criminal, corrupt, unlawful or unethical nature; or 2. An associate degree or 60 semester credits from an accredited college and four years of satisfactory, full-time experience as described in ""1"" above; or 3. A baccalaureate degree from an accredited college and two years of satisfactory, full-time experience as described in ""1"" above; or 4. Education and/or experience equivalent to ""1"", ""2"", or ""3"" above.The City of New York is an inclusive equal opportunity employer committed to recruiting and retaining a diverse workforce and providing a work environment that is free from discrimination and harassment based upon any legally protected status or protected characteristic, including but not limited to an individual's sex, race, color, ethnicity, national origin, age, religion, disability, sexual orientation, veteran status, gender identity, or pregnancy."
2763763,"Building Evaluator- Division of Neighborhood Preservation (DNP) - Site Office","https://jobs.smartrecruiters.com/CityOfNewYork/3743990007418366-building-evaluator-division-of-neighborhood-preservation-dnp-site-office","York","New York","No",6,"Full time","2025-04-11T01:54:58.290616Z","About the Agency:The New York City Department of Housing Preservation and Development (HPD) promotes quality and affordability in the city's housing, and diversity and strength in the citys neighborhoods because every New Yorker deserves a safe, affordable place to live in a neighborhood they love.   -	We maintain building and resident safety and health -	We create opportunities for New Yorkers through housing affordability -	We engage New Yorkers to build and sustain neighborhood strength and diversity.  HPD is entrusted with fulfilling these objectives through the goals and strategies of Housing Our Neighbors: A Blueprint for Housing and Homelessness, Mayor Adams comprehensive housing framework. To support this important work, the administration has committed $5 billion in new capital funding, bringing the 10-year planned investment in housing to $22 billion the largest in the citys history. This investment, coupled with a commitment to reduce administrative and regulatory barriers, is a multi-pronged strategy to tackle New York Citys complex housing crisis, by addressing homelessness and housing instability, promoting economic stability and mobility, increasing homeownership opportunities, improving health and safety, and increasing opportunities for equitable growth. Your Team:The Office of Enforcement and Neighborhood Services (OENS) leads the agencys effort to work closely with other HPD divisions and outside community partners to identify buildings in distress, assess and develop appropriate strategies to address those properties and work closely with responsible owners to develop a plan to improve conditions and return buildings to firm financial footing and physical health. OENS uses enforcement tools within its Division of Code Enforcement, Housing Litigation Division, Emergency Operations and Enhanced Enforcement, and the Division of Neighborhood Preservation to ensure compliance with legal and regulatory obligations.The Office of Enforcement and Neighborhood Services is composed of six divisions: Data Management &amp; Technology (DMT), Division of Neighborhood Preservation (DNP), Administration &amp; Internal Compliance (AIC), Housing Litigation Division (HLD), Division of Code Enforcement (DCE), and Emergency Operations and Enhanced Enforcement Division (EOD).  Your Impact:As the Building Evaluator  Community Coordinator for the Division of Neighborhood Preservation-Site Office, performing building surveys at properties identified as potentially distress building, entering complaints on the building, conducting outreach to owners, developing a building treatment plan in an effort to improve conditions, and return buildings to firm financial footing and physical health.  Your Role:Your role will be a Building Evaluator  Community Coordinator in the Division of Neighborhood Preservation. Under the direct supervision of the Director of the Manhattan, Bronx DNP office, your responsibilities will include but not be limited to the following: Your Responsibilities:-	Conducting and completing building assessments (surveys) of buildings located in the Bronx and Manhattan; however, may be assigned field work in any of the five boroughs, and be scheduled to work evenings and weekends;-	Identifying conditions at the buildings that are not in compliance with the NYC Housing Maintenance Code and/or the NYS Multiple Dwelling Law, and noting other conditions and issues found at the buildings being assessed; -	Make appointments with owners, managing agents, and tenants to provide access to conduct surveys;   -	Communicating to owners and managing agents about their building status and outstanding violations while in the field conducting building surveys and visits, as well as follow-up calls from the office to ensure conditions are being addressed in a timely manner; -	Preparing field reports and entering assessment results on the Physical Building Inspection Survey and/or HPDInfo; -	Occasionally attend tenant meetings requested by non-profit organizations and tenant associations;-	Researching building information utilizing database systems such as DOB and HPD Info and attach any relevant documents to the survey;-	Escalating any problems and/or emergency conditions found in the field;-	Work on special projects as required by the Department HeadLicense Requirements:  Must possess a Motor Vehicle Driver License valid in the State of New York with no restrictions which preclude the performance of Community Coordinator work.  This license must be maintained for the duration of employment.COMMUNITY COORDINATOR - 560581. A baccalaureate degree from an accredited college and two years of experience in community work or community centered activities in an area related to the duties described above; or 2. High school graduation or equivalent and six years of experience in community work or community centered activities in an area related to the duties as described above; or 3. Education and/or experience which is equivalent to ""1"" or ""2"" above. However, all candidates must have at least one year of experience as described in ""1"" above.The City of New York is an inclusive equal opportunity employer committed to recruiting and retaining a diverse workforce and providing a work environment that is free from discrimination and harassment based upon any legally protected status or protected characteristic, including but not limited to an individual's sex, race, color, ethnicity, national origin, age, religion, disability, sexual orientation, veteran status, gender identity, or pregnancy."
2763762,"IT Product Owner","https://jobs.smartrecruiters.com/CityOfNewYork/3743990007418376-it-product-owner","York","New York","No",3,"Full time","2025-04-11T01:54:58.290655Z","The New York City Taxi and Limousine Commission (TLC) is the nations largest for-hire transportation agency, licensing and regulating the Citys yellow and green taxicabs, for-hire vehicles, commuter vans, and luxury limousines. TLC develops and enforces rules to promote safety, transparency, as well as consumer and driver protection for a vital mode of transport in New York City. The vehicles, businesses, and drivers licensed and regulated by the agency move over one million people a day. With the introduction of new apps and technologies, TLC is on the front lines of a changing mobility landscape in New York City. TLC collaborates with renowned universities on data analysis, builds partnerships with leaders around the globe on the future of transportation, and works to streamline agency operations to meet the demands of a changing industry. TLC is a committed partner of the Mayors Vision Zero initiative to promote safe driving and a leader in citywide initiatives, including open data and the growth of the Citys wheelchair accessible taxi and for-hire vehicle fleets.The TLC Information Technology (IT) department is seeking a Product Owner who, under the supervision of the Chief Product Officer, will play a key role in the IT department by collaborating closely with various internal stakeholders, vendors, and external agencies to gather business requirements, analyze data, and document user stories. Furthermore, the Product Owner will manage a portfolio of stakeholder requests by working in partnership with TLC divisions to gather requirements for IT data projects, help prioritize the request backlog, and clearly communicate with IT teams, business stakeholders, executive management, and external stakeholders throughout implementation.The successful candidate is an analytical leader who thrives in a highly collaborative fast-paced environment and actively engages with teams throughout the software development lifecycle. S/he will be smart, self-motivated, detailed, and comfortable working in a fast-paced and continuously changing environment. This role requires a strong background in business analysis, data analysis, and product ownership.Responsibilities:-  Evaluate requests from stakeholders for enhancements and projects, perform research and analysis to understand the request and potential impacts-  Meet with business stakeholders as needed to understand and document requirements for IT enhancements and projects, including but not limited to data projects and enhancements.-  Assist stakeholders in managing and prioritizing their product backlogs. Provide expertise on advantages and disadvantages of prioritizing one request over another and help build consensus among various stakeholder groups.-  Collaborate with IT teams to develop innovative technology solutions that address wide-ranging business needs-  Communicate clearly and frequently with IT teams, business stakeholders, project sponsors, clients, external vendors, external agencies, and executives on the status of IT requests-  Actively participate in IT projects and sprints to articulate business requirements and clarify business needs. Solicit feedback from stakeholders as needed to facilitate project or enhancement implementation.-  Coordinate with stakeholders to ensure user acceptance testing (UAT) is performed.To Apply:Please go to cityjobs.nyc.gov and search for Job ID# 684798 or click the ""Apply"" button below.SUBMISSION OF A RESUME IS NOT A GUARANTEE THAT YOU WILL RECEIVE AN INTERVIEW.APPOINTMENTS ARE SUBJECT TO OVERSIGHT APPROVAL.CYBER SECURITY ANALYST - 136331. A baccalaureate degree, from an accredited college including or supplemented by twenty-four (24) semester credits in cyber security, network security, computer science, computer programming, computer engineering, information technology, information science, information systems management, network administration, or a pertinent scientific, technical or related area; or2. A four-year high school diploma or its equivalent approved by a States department of education or a recognized accrediting organization and three years of satisfactory experience in any of the areas described in 1 above; or3. Education and/or experience equivalent to 1 or 2, above. College education may be substituted for up to two years of the required experience in 2 above on the basis that sixty (60) semester credits from an accredited college is equated to one year of experience. In addition, twenty-four (24) credits from an accredited college or graduate school in cyber security, network security, computer science, computer programming, computer engineering, information technology, information science, information systems management, network administration, or a pertinent scientific, technical or related area; or a certificate of at least 625 hours in computer programming from an accredited technical school (post high school), may be substituted for one year of experience.The City of New York is an inclusive equal opportunity employer committed to recruiting and retaining a diverse workforce and providing a work environment that is free from discrimination and harassment based upon any legally protected status or protected characteristic, including but not limited to an individual's sex, race, color, ethnicity, national origin, age, religion, disability, sexual orientation, veteran status, gender identity, or pregnancy."
2763761,"Intelligence Analyst","https://jobs.smartrecruiters.com/CityOfNewYork/3743990007418386-intelligence-analyst","York","New York","No",3,"Full time","2025-04-11T01:54:58.290689Z","The New York City Business Integrity Commission (BIC) is a regulatory and law enforcement agency with jurisdiction over the trade waste industry and the public wholesale markets. Businesses seeking to operate in these industries must apply and be approved for a License or Registration by BIC. Under direct supervision, the candidate will be responsible for conducting confidential background investigations of applicants. Duties include, but are not limited to, reviewing and verifying documentation, conducting database and online searches, compiling and analyzing research, preparing intelligence reports and charts, presenting case findings, updating case files and agency databases, and liaising with other regulatory and law enforcement partners. Intel Analysts may also conduct research and analyze records to aid in criminal and civil investigations and compliance matters. The ideal candidate is a critical thinker with a high regard for accuracy, has strong analytical and writing skills, and is interested in investigating organized crime and other areas of corruption. Prior proven work experience having utilized proprietary databases such as Lexis Accurint and Clear as well as City databases (e.g. ACRIS, PASSPort) and preparing comprehensive narrative reports is a plus.COMMUNITY ASSOCIATE - 56057Qualification Requirements 1. High school graduation or equivalent and three years of experience in community work or community centered activities in an area related to duties described above; or 2. Education and/or experience which is equivalent to ""1"" above.The City of New York is an inclusive equal opportunity employer committed to recruiting and retaining a diverse workforce and providing a work environment that is free from discrimination and harassment based upon any legally protected status or protected characteristic, including but not limited to an individual's sex, race, color, ethnicity, national origin, age, religion, disability, sexual orientation, veteran status, gender identity, or pregnancy."
