"ID","Title","Link","Company","Location","Remote","Experience","EmploymentType","DatePosted","RoleDescription"
2763754,"Audit & Compliance Coordinator","https://jobs.smartrecruiters.com/CityOfNewYork/3743990007418456-audit-compliance-coordinator","York","New York","No","Not specified","Part time","2025-04-11T01:54:58.290935Z","DCAS's mission is to make City government work for all New Yorkers. From managing New York Citys most iconic courthouses and municipal buildings, to purchasing over $1 billion annually in goods and services for more than 80 City agencies   what we do ensures that all agencies can deliver on their mission. Our reach touches every facet of City government and is instrumental in the successful day-to-day operations of the City of New York.  Our commitment to equity, effectiveness, and sustainability guides our work providing City agencies with the critical resources and support needed to succeed, including:  -	Recruiting, hiring, and training City employees.  -	Managing 55 public buildings.  -	Acquiring, selling, and leasing City property.  -	Purchasing more than $1 billion in goods and services for City agencies.  -	Overseeing the greenest municipal vehicle fleet in the country.  -	Leading the City's efforts to reduce carbon emissions from government operations.   When you work at DCAS, you're not just working for one agency, but in service to all of them. It's an opportunity to provide critical support, quality customer service, and help protect the future of New York City for generations to come. Visit our website at nyc.gov/dcas to learn more about the work we do.The Audit &amp; Compliance Unit within the Customer Experience Center is responsible for ensuring agencies comply with Civil Service rules and properly use Civil Service lists.  The unit is responsible for auditing and closing dispositions for the agencies Citywide. Overall, the Customer Experience Center is responsible for business functions including customer service, correspondence, list maintenance, and monitoring compliance in the use of Civil Service eligible lists, as outlined by the New York State Civil Service Commission. The Customer Experience Center seeks to hire one (1) Audit and Compliance Coordinator to support the Customer Experience Supervisor. With latitude to exercise independent judgment and decision-making, the selected candidates responsibilities will include, but not be limited to, the following:-	Assist candidates on the Interactive Voice Response (IVR) System with list-related inquiries.-	Review and prepare responses to correspondence.-	Process Civil Service list related updates into the mainframe system; Including but not limited to Restorations, Insertions, List Number Changes, Correspondence, Selective Certification Requests, DP-434 Requests, and Additional Credits.-	Other administrative duties as assigned by the Customer Service Supervisor.SPECIAL EXAMINER (DCAS) - 066681. Education and/or experience appropriate to qualify for the specific assignment.The City of New York is an inclusive equal opportunity employer committed to recruiting and retaining a diverse workforce and providing a work environment that is free from discrimination and harassment based upon any legally protected status or protected characteristic, including but not limited to an individual's sex, race, color, ethnicity, national origin, age, religion, disability, sexual orientation, veteran status, gender identity, or pregnancy."
2763753,"Vendor Contract Auditor","https://jobs.smartrecruiters.com/CityOfNewYork/3743990007418466-vendor-contract-auditor","York","New York","No",6,"Full time","2025-04-11T01:54:58.290964Z","Only those on the Staff Analyst list or permanent incumbents are eligible to apply.DCAS's mission is to make city government work for all New Yorkers. From managing New York Citys most iconic courthouses and municipal buildings, to purchasing over $1 billion annually in goods and services for more than 80 City agencies   what we do ensures that all agencies can deliver on their mission. Our reach touches every facet of city government and is instrumental to the successful day-to-day operations of the City of New York.  Our commitment to equity, effectiveness, and sustainability guides our work providing City agencies with the critical resources and support needed to succeed, including:  -  Recruiting, hiring, and training City employees.  -  Managing 55 public buildings.  -  Acquiring, selling, and leasing City property.  -  Purchasing over $1 billion in goods and services for City agencies.  -  Overseeing the greenest municipal vehicle fleet in the country.  -  Leading the City's efforts to reduce carbon emissions from government operations.  When you work at DCAS, you're not just working for one agency, but in service of them all. It's an opportunity to provide impactful support, quality customer service, and help protect the future of New York City for generations to come. Visit our website at nyc.gov/dcas to learn more about the work we do.DCASs Audit &amp; Compliance Services (ACS) consists of the following units: -  Engineering Audit.-  Vendor Contract Audit.-  Internal Audit.-  Non-Public Schools Audit Program; and-  External Audit Coordination.The Internal Audit team and function is an integral part of DCAS by advising management in satisfying the agencys overall responsibility for successfully achieving its assigned mission and assuring full accountability for resources. Internal audits are conducted in accordance with the Professional Standards established by the International Association of Internal Auditors (IIA) and with the Generally Accepted Government Auditing Standards (GAGAS) as mandated in the NYC Comptrollers directives. The Internal Audit team assist the agency by identifying ways to safeguard assets, avoid waste and inefficiency, and promote sound business practices consistent with adopted policies and procedures. In addition, DCAS has undergone several external audits related to Procurement of goods and services contracts and monitor, which are potentially are high risk in nature to the agency, as well as on a citywide level. The number of these external audits have increased significantly and without an internal audit function, the agency would not be able to mitigate risk associated with costs to address fiscal discrepancies and revenue generating opportunities, which places DCAS at a high risk. For an agency of this proportion, not being able to adequately replace or staff ACS Internal Audit &amp; Risk Management Unit will greatly impact our ability to effectively conduct and perform the required ongoing audits to effectively and efficiently identify and address agencywide risk through DCAS thirteen (13) lines of service operations, invoice payments and approval process.The Internal Audit team consisted of an Audit Supervisor and 2 Staff Auditors; currently the unit has been depleted due to staff attrition, and this is the minimum staff needed to conduct this work. The Internal Audit team adds value to DCAS and its operations by:-   Controlling risk management.-   Improving quality of performance, efficiency, and cost recovery.-   Decrementing errors and costs.-   Developing policy and procedures.-   Increasing regulatory compliance.-   Bettering management communications and clarity in the form of guidance.Audit and Compliance Services (ACS), within DCAS, assists management with identifying and prioritizing areas or processes of DCAS Lines of Service (LOS) that require attention or have concerning risk factors. DCAS ACS provides audit/review and consulting services by gaining an understanding of the processes and procedures as they currently exist; performing tests of controls to verify whether internal controls are adequate and working as designed; and providing recommendations to improve processes and controls. The Internal Audit team adds value to DCAS and its operations by, controlling risk management, improving quality of performance, efficiency, and cost recovery; decrementing errors and costs, developing policy and procedures, increasing regulatory compliance, bettering management communications and clarity in the form of guidance. In addition, ACS is tasked with the following:-  Coordination of all external audit activities, providing DCAS responses to those audits, and developing and assisting in managing corrective action plans.-  Coordination of the City's Financial and Single Audits.-  Preparation and review of NYC Comptrollers Directive 1, MoRMC Risk Assessment, the DOI Anti-Corruption Report, and the Agencys Internal Control Statement.-  Preparation and reporting on quarterly metrics identified by DOI.-  Auditing the reimbursable expenses of the Non-Public Schools (NPS) security guard services program under Local Law 2 mandate.-  Conduct audits of DCAS fourteen (14) lines of services processes, invoice and approval process.With regards to citywide procurement DCAS processed orders for goods and services worth over $1.5 billion for over 100 NYC agencies, departments, boards and authorities. DCAS has the overall responsibility to ensure that the contracted vendors are in compliance with the contract stipulations, terms, conditions, agreed upon prices, and specifications. As such, ACS overall consulting services and audit work adds value to DCASs operations and its thirteen (13) lines of services by controlling risk management, improving quality of performance, efficiency, and cost recovery; decrementing errors and costs, developing policy and procedures, increasing regulatory compliance, bettering management communications and clarity in the form of guidance.-  Conduct and perform reviews/audits and analyze reimbursement claims, conduct field/site visits to ensure compliance with Local laws/regulations, Comptrollers Directives and any other City mandate.-  Under supervisory direction, conduct detailed fiscal/operational and financial audit reviews to evaluate systems of internal control effectiveness. This includes reviews of invoices, Certified Payroll reports, Timesheets, Insurance documents, and MOUs etc.-  Prepare audit findings detailing the tests performed and supported by audit work papers.-  Prepare preliminary draft audit report capturing the audit objectives, scope, methodology and all findings for supervisory review and approval.-  Performing tests of controls to verify whether controls are working as designed in compliance with Governmental Auditing Standards (GAGAS) and IIA Standards.-  Providing findings and recommendations to improve processes and controls. Conducting follow-ups to ensure that corrective action plan initiatives related to internal and external audits are implemented.-  Managing the Agencywide compliance through ACS annual risk assessment process, which includes identifying and prioritizing areas or processes that require attention.-  Participate and hold meetings to conduct surveys, present audit findings and write up meeting minutes. To Apply: Please go to www.nyc.gov/careers and search for Job ID #. 706393For current City employees please go to www.nyc.gov/ess and log into Employee Self Service. NO PHONE CALLS, FAXES OR PERSONAL INQUIRIES PERMITTED. NOTE: ONLY THOSE CANDIDATES UNDER CONSIDERATION WILL BE CONTACTED.STAFF ANALYST - 12626A master's degree from an accredited college in economics, finance, accounting, business or public administration, human resources management, management science, operations research, organizational behavior, industrial psychology, statistics, personnel administration, labor relations, psychology, sociology, human resources development, political science, urban studies or a Juris Doctor degree from an accredited law school; orA baccalaureate degree from an accredited college and two years of satisfactory full- time professional experience working in one or a combination of the following areas: working with the budget of a large public or private concern in budget administration, accounting, economic or financial administration, or fiscal or economic research; in management or methods analysis, operations research, organizational research or program evaluation; in personnel or public administration, recruitment, position classification, personnel relations, labor relations, employee benefits, staff development, employment program planning/administration, labor market research, economic planning, social services program planning/evaluation, or fiscal management; or in a related area.An associate degree or completion of 60 semester credits from an accredited college and four years of satisfactory full-time professional experience as described in ""2"" above.A four-year high school diploma or its educational equivalent approved by a State's department of education or a recognized accrediting organization and six years of satisfactory full-time professional experience as described in ""2"" above.A combination of education and/or experience equivalent to 1, 2, 3, or 4 above. College education may be substituted for professional experience at the rate of 30 semester credits from an accredited college for one year of experience. However, all candidates must have a high school diploma.The City of New York is an inclusive equal opportunity employer committed to recruiting and retaining a diverse workforce and providing a work environment that is free from discrimination and harassment based upon any legally protected status or protected characteristic, including but not limited to an individual's sex, race, color, ethnicity, national origin, age, religion, disability, sexual orientation, veteran status, gender identity, or pregnancy."
2763752,"Housing Assistant","https://jobs.smartrecruiters.com/CityOfNewYork/3743990007418476-housing-assistant","York","Bronx","No",3,"Full time","2025-04-11T01:54:58.290988Z","The Leased Housing Department Inspections Unit is seeking Housing Assistant to conduct Housing Quality Standards (HQS) and National Standards for the Physical Inspection of Real Estate (NSPIRE) inspections. The Unit is responsible for inspecting all subsidized units in the Section 8 program to ensure they are maintained in accordance with HUDs inspection standards.Reporting directly to the Leased Housing Department's Inspections Unit Manager, the successful candidate will be responsible for, but not limited to the following: -	Conduct annual and biannual inspections at privately owned Housing Choice Voucher program participant properties using various test equipment and handheld computer devices. -	Conduct Rental, transfer and special inspections at privately owned Housing Choice Voucher program participant properties. -	Conduct project-based inspections at Housing Choice Voucher program participant properties.-	Interact with program participants, landlords, and advocates.-	Perform other tasks as needed to support Inspection units.NOTE: IF THIS APPOINTMENT IS MADE ON A PROVISIONAL/TEMPORARY BASIS PURSUANT TO  65 OF THE NYS CIVIL SERVICE LAW, NO TENURE OR PERMANENCE ACCRUES TO AN INCUMBENT IN THIS POSITION BY VIRTUE OF SUCH APPOINTMENT. NOTE: This position is open to qualified persons with a disability who are eligible for the 55-a Program. Please indicate in your cover letter that you would like to be considered for the position under the 55-a Program. For detailed information regarding the 55-a Program, click on the link below: https://bit.ly/55aProgram Additional Information1.	For NYCHA employees: This position is open on a direct transfer (lateral) basis and as a promotional opportunity. 2.	For NYCHA employees: This vacancy is for a title which is normally filled through the Automated Transfer List System (ATLS). However, employees applying to this location via the Automated Transfer List System (ATLS) must reapply to this vacancy posting to be considered for this position. 3.	Employees applying for transfer, promotional, title or level change opportunities must have served a period of one year at current location and in current title and level (if applicable). opportunity must have served a period of one year at current location and in current title and level (if applicable).Please read this posting carefully to make certain you meet the minimum qualification requirements before applying to this position.HOUSING ASSISTANT (HA) - 80201A baccalaureate degree from an accredited college; or An associate degree or sixty semester credits from an accredited college and one year of satisfactory full-time experience in housing management at a development or developments containing at least 150 apartments, performing any one or a combination of the following duties: interviewing applicants; determining eligibility; gathering and evaluating information to resolve complaints; collecting rents; and/or resolving tenant-related problems; orA four-year high school diploma or its educational equivalent, and three years of satisfactory full-time experience as described in 1 above; orA satisfactory equivalent combination of education and experience as described in ""1"" or ""2"" above. Undergraduate college credit may be substituted for experience on the basis of 30 semester credits from an accredited college for one year of satisfactory full-time experience. However, all candidates must have a four-year high school diploma, or its educational equivalent.The City of New York is an inclusive equal opportunity employer committed to recruiting and retaining a diverse workforce and providing a work environment that is free from discrimination and harassment based upon any legally protected status or protected characteristic, including but not limited to an individual's sex, race, color, ethnicity, national origin, age, religion, disability, sexual orientation, veteran status, gender identity, or pregnancy."
2763751,"Summer College Intern - HR","https://jobs.smartrecruiters.com/CityOfNewYork/3743990007418411-summer-college-intern-hr","York","New York","No","Not specified","Internship","2025-04-11T01:54:58.291012Z","AGENCY DESCRIPTION : The New York City Board of Correction (BOC or the Board) is a nine-person, non-judicial oversight board that regulates, monitors, and inspects NYCs correctional facilities. The Board conducts independent oversight and enacts regulations to support safer, fairer, smaller, and more humane NYC jails. The City Charter mandates the Board's five functions:Establish and ensure compliance with minimum standards ""for the care, custody, correction, treatment, supervision, and discipline of all persons held or confined under the jurisdiction of the Department of Correction""Investigate any matter within the jurisdiction of the DepartmentReview grievances from person in custody and staffEvaluate the performance of the NYC Department of Correction (DOC)Make recommendations on areas of key correctional planning.UNIT DESCRIPTION:The Boards Administration team handles all human resources, budgeting, IT, and administrative personnel matters for the agency.INTERNSHIP RESPONSIBILITIES:Under the direction of the Administration Unit's Deputy Executive Director, the Summer College Intern - HR will be trained in and will perform the following tasks:*Plan and execute bi-weekly employee development and support information sessions, including the preparation of materials and scheduling of session speakers. *Research training and professional development grants and funding opportunities.*Assist in the collection and analysis of data relating to personnel management, including updates to tools like the staffing plan, organizational chart, and headcount tracker. *Assist in the preparation of unit process documentation, policies, reports, presentations, and recruitment materials.  *The internship will be 10 weeks in duration, beginning on June 2, 2025 and ending on August 9, 2025. The intern will work a minimum of 28 hours per week and a maximum of 34 hours per week. QUALIFICATION, SPECIAL SKILLS:The ideal candidate is an undergraduate student or recent college graduate able to demonstrate the following:- Strong writing, research and project management skills,- Ability to complete work with attention to detail and handle sensitive information in a professional manner, and- Proficient with Microsoft Word, Excel, and PowerPoint. TO APPLY:To apply, visit Job ID # 707082 at https://cityjobs.nyc.gov/. Please submit a resume and cover letter as part of your application. No phone calls please. The City of New York is an inclusive equal opportunity employer committed to recruiting and retaining a diverse workforce and providing a work environment that is free from discrimination and harassment based upon any legally protected status or protected characteristic, including but not limited to an individual's sex, race, color, ethnicity, national origin, age, religion, disability, sexual orientation, veteran status, gender identity, or pregnancy.SUMMER COLLEGE INTERN - 10234As of June of the Program year the prospective interne must be a student matriculated in a college or be a recent college graduate (winter/spring term of the Program year). NOTE: Appointment to this title is only valid for the duration of the Program, June - August each year.The City of New York is an inclusive equal opportunity employer committed to recruiting and retaining a diverse workforce and providing a work environment that is free from discrimination and harassment based upon any legally protected status or protected characteristic, including but not limited to an individual's sex, race, color, ethnicity, national origin, age, religion, disability, sexual orientation, veteran status, gender identity, or pregnancy."
